Sheet: KZT
A1: RAMSTORE KAZAKISTAN
B3: MAGAZA TOPLAM | J3: 117 - MEGA2 MACROCENTER | R3: 114 - SHALYAPINA | Z3: 116 - ISSYK | AH3: 115 - MEGA PARK | AP3: 104 - MEGA ALMATY | AX3: 201 - MEGA ASTANA | BF3: 105 - ATRIUM | BN3: 300 - KARAGANDA | BV3: 100 - SAMAL | CD3: 101 - TASTAK | CL3: 103 - ATAKENT | CT3: 200 - ASTANA | DB3: 100TS - SAMAL TOPTAN SATIS | DJ3: 200TS - ASTANA TOPTAN SATIS | DR3: 400 - MEGA CIMKENT | DZ3: 107 - MANGO | EH3: 108 - GLOBUS | EP3: 202 - AJAR ASTANA | EX3: 112 - SHEMYAKINA | FF3: 501 - ARDAGER AKTAU | FN3: 520 - URALSK | FV3: 540 - ATYRAU | GD3: 118 - SANAL MARKET | GL3: 106 - APORT | GT3: 521 - ATRIUM URALSK | HB3: 109 - ALMAGUL | HJ3: 110 - ALTYN TARAZ | HR3: 203 - TULPAR ASTANA | HZ3: 113 - KOKTEM | IH3: 205 - ASORTI ASTANA
A4: TARIH | B4: NET SATIŞ GEÇEN YIL | C4: NET SATIŞ BÜTÇE | D4: NET SATIS FİİLİ | E4: Prog.Göre Artış | F4: G.Yıla Göre Artış | G4: MUSTERI SAYISI | H4: MUSTERI SAYISI GEÇEN YIL | I4: G.Yıla Göre Artış | J4: NET SATIŞ GEÇEN YIL | K4: NET SATIŞ BÜTÇE | L4: NET SATIS FİİLİ | M4: Prog.Göre Artış | N4: G.Yıla Göre Artış | O4: MUSTERI SAYISI | P4: MUSTERI SAYISI GEÇEN YIL | Q4: G.Yıla Göre Artış | R4: NET SATIŞ GEÇEN YIL | S4: NET SATIŞ BÜTÇE | T4: NET SATIS FİİLİ | U4: Prog.Göre Artış | V4: G.Yıla Göre Artış | W4: MUSTERI SAYISI | X4: MUSTERI SAYISI GEÇEN YIL | Y4: G.Yıla Göre Artış | Z4: NET SATIŞ GEÇEN YIL | AA4: NET SATIŞ BÜTÇE | AB4: NET SATIS FİİLİ | AC4: Prog.Göre Artış | AD4: G.Yıla Göre Artış | AE4: MUSTERI SAYISI | AF4: MUSTERI SAYISI GEÇEN YIL | AG4: G.Yıla Göre Artış | AH4: NET SATIŞ GEÇEN YIL | AI4: NET SATIŞ BÜTÇE | AJ4: NET SATIS FİİLİ | AK4: Prog.Göre Artış | AL4: G.Yıla Göre Artış | AM4: MUSTERI SAYISI | AN4: MUSTERI SAYISI GEÇEN YIL | AO4: G.Yıla Göre Artış | AP4: NET SATIŞ GEÇEN YIL | AQ4: NET SATIŞ BÜTÇE | AR4: NET SATIS FİİLİ | AS4: Prog.Göre Artış | AT4: G.Yıla Göre Artış | AU4: MUSTERI SAYISI | AV4: MUSTERI SAYISI GEÇEN YIL | AW4: G.Yıla Göre Artış | AX4: NET SATIŞ GEÇEN YIL | AY4: NET SATIŞ BÜTÇE | AZ4: NET SATIS FİİLİ | BA4: Prog.Göre Artış | BB4: G.Yıla Göre Artış | BC4: MUSTERI SAYISI | BD4: MUSTERI SAYISI GEÇEN YIL | BE4: G.Yıla Göre Artış | BF4: NET SATIŞ GEÇEN YIL | BG4: NET SATIŞ BÜTÇE | BH4: NET SATIS FİİLİ | BI4: Prog.Göre Artış | BJ4: G.Yıla Göre Artış | BK4: MUSTERI SAYISI | BL4: MUSTERI SAYISI GEÇEN YIL | BM4: G.Yıla Göre Artış | BN4: NET SATIŞ GEÇEN YIL | BO4: NET SATIŞ BÜTÇE | BP4: NET SATIS FİİLİ | BQ4: Prog.Göre Artış | BR4: G.Yıla Göre Artış | BS4: MUSTERI SAYISI | BT4: MUSTERI SAYISI GEÇEN YIL | BU4: G.Yıla Göre Artış | BV4: NET SATIŞ GEÇEN YIL | BW4: NET SATIŞ BÜTÇE | BX4: NET SATIS FİİLİ | BY4: Prog.Göre Artış | BZ4: G.Yıla Göre Artış | CA4: MUSTERI SAYISI | CB4: MUSTERI SAYISI GEÇEN YIL | CC4: G.Yıla Göre Artış | CD4: NET SATIŞ GEÇEN YIL | CE4: NET SATIŞ BÜTÇE | CF4: NET SATIS FİİLİ | CG4: Prog.Göre Artış | CH4: G.Yıla Göre Artış | CI4: MUSTERI SAYISI | CJ4: MUSTERI SAYISI GEÇEN YIL | CK4: G.Yıla Göre Artış | CL4: NET SATIŞ GEÇEN YIL | CM4: NET SATIŞ BÜTÇE | CN4: NET SATIS FİİLİ | CO4: Prog.Göre Artış | CP4: G.Yıla Göre Artış | CQ4: MUSTERI SAYISI | CR4: MUSTERI SAYISI GEÇEN YIL | CS4: G.Yıla Göre Artış | CT4: NET SATIŞ GEÇEN YIL | CU4: NET SATIŞ BÜTÇE | CV4: NET SATIS FİİLİ | CW4: Prog.Göre Artış | CX4: G.Yıla Göre Artış | CY4: MUSTERI SAYISI | CZ4: MUSTERI SAYISI GEÇEN YIL | DA4: G.Yıla Göre Artış | DB4: NET SATIŞ GEÇEN YIL | DC4: NET SATIŞ BÜTÇE | DD4: NET SATIS FİİLİ | DE4: Prog.Göre Artış | DF4: G.Yıla Göre Artış | DG4: MUSTERI SAYISI | DH4: MUSTERI SAYISI GEÇEN YIL | DI4: G.Yıla Göre Artış | DJ4: NET SATIŞ GEÇEN YIL | DK4: NET SATIŞ BÜTÇE | DL4: NET SATIS FİİLİ | DM4: Prog.Göre Artış | DN4: G.Yıla Göre Artış | DO4: MUSTERI SAYISI | DP4: MUSTERI SAYISI GEÇEN YIL | DQ4: G.Yıla Göre Artış | DR4: NET SATIŞ GEÇEN YIL | DS4: NET SATIŞ BÜTÇE | DT4: NET SATIS FİİLİ | DU4: Prog.Göre Artış | DV4: G.Yıla Göre Artış | DW4: MUSTERI SAYISI | DX4: MUSTERI SAYISI GEÇEN YIL | DY4: G.Yıla Göre Artış | DZ4: NET SATIŞ GEÇEN YIL | EA4: NET SATIŞ BÜTÇE | EB4: NET SATIS FİİLİ | EC4: Prog.Göre Artış | ED4: G.Yıla Göre Artış | EE4: MUSTERI SAYISI | EF4: MUSTERI SAYISI GEÇEN YIL | EG4: G.Yıla Göre Artış | EH4: NET SATIŞ GEÇEN YIL | EI4: NET SATIŞ BÜTÇE | EJ4: NET SATIS FİİLİ | EK4: Prog.Göre Artış | EL4: G.Yıla Göre Artış | EM4: MUSTERI SAYISI | EN4: MUSTERI SAYISI GEÇEN YIL | EO4: G.Yıla Göre Artış | EP4: NET SATIŞ GEÇEN YIL | EQ4: NET SATIŞ BÜTÇE | ER4: NET SATIS FİİLİ | ES4: Prog.Göre Artış | ET4: G.Yıla Göre Artış | EU4: MUSTERI SAYISI | EV4: MUSTERI SAYISI GEÇEN YIL | EW4: G.Yıla Göre Artış | EX4: NET SATIŞ GEÇEN YIL | EY4: NET SATIŞ BÜTÇE | EZ4: NET SATIS FİİLİ | FA4: Prog.Göre Artış | FB4: G.Yıla Göre Artış | FC4: MUSTERI SAYISI | FD4: MUSTERI SAYISI GEÇEN YIL | FE4: G.Yıla Göre Artış | FF4: NET SATIŞ GEÇEN YIL | FG4: NET SATIŞ BÜTÇE | FH4: NET SATIS FİİLİ | FI4: Prog.Göre Artış | FJ4: G.Yıla Göre Artış | FK4: MUSTERI SAYISI | FL4: MUSTERI SAYISI GEÇEN YIL | FM4: G.Yıla Göre Artış | FN4: NET SATIŞ GEÇEN YIL | FO4: NET SATIŞ BÜTÇE | FP4: NET SATIS FİİLİ | FQ4: Prog.Göre Artış | FR4: G.Yıla Göre Artış | FS4: MUSTERI SAYISI | FT4: MUSTERI SAYISI GEÇEN YIL | FU4: G.Yıla Göre Artış | FV4: NET SATIŞ GEÇEN YIL | FW4: NET SATIŞ BÜTÇE | FX4: NET SATIS FİİLİ | FY4: Prog.Göre Artış | FZ4: G.Yıla Göre Artış | GA4: MUSTERI SAYISI | GB4: MUSTERI SAYISI GEÇEN YIL | GC4: G.Yıla Göre Artış | GD4: NET SATIŞ GEÇEN YIL | GE4: NET SATIŞ BÜTÇE | GF4: NET SATIS FİİLİ | GG4: Prog.Göre Artış | GH4: G.Yıla Göre Artış | GI4: MUSTERI SAYISI | GJ4: MUSTERI SAYISI GEÇEN YIL | GK4: G.Yıla Göre Artış | GL4: NET SATIŞ GEÇEN YIL | GM4: NET SATIŞ BÜTÇE | GN4: NET SATIS FİİLİ | GO4: Prog.Göre Artış | GP4: G.Yıla Göre Artış | GQ4: MUSTERI SAYISI | GR4: MUSTERI SAYISI GEÇEN YIL | GS4: G.Yıla Göre Artış | GT4: NET SATIŞ GEÇEN YIL | GU4: NET SATIŞ BÜTÇE | GV4: NET SATIS FİİLİ | GW4: Prog.Göre Artış | GX4: G.Yıla Göre Artış | GY4: MUSTERI SAYISI | GZ4: MUSTERI SAYISI GEÇEN YIL | HA4: G.Yıla Göre Artış | HB4: NET SATIŞ GEÇEN YIL | HC4: NET SATIŞ BÜTÇE | HD4: NET SATIS FİİLİ | HE4: Prog.Göre Artış | HF4: G.Yıla Göre Artış | HG4: MUSTERI SAYISI | HH4: MUSTERI SAYISI GEÇEN YIL | HI4: G.Yıla Göre Artış | HJ4: NET SATIŞ GEÇEN YIL | HK4: NET SATIŞ BÜTÇE | HL4: NET SATIS FİİLİ | HM4: Prog.Göre Artış | HN4: G.Yıla Göre Artış | HO4: MUSTERI SAYISI | HP4: MUSTERI SAYISI GEÇEN YIL | HQ4: G.Yıla Göre Artış | HR4: NET SATIŞ GEÇEN YIL | HS4: NET SATIŞ BÜTÇE | HT4: NET SATIS FİİLİ | HU4: Prog.Göre Artış | HV4: G.Yıla Göre Artış | HW4: MUSTERI SAYISI | HX4: MUSTERI SAYISI GEÇEN YIL | HY4: G.Yıla Göre Artış | HZ4: NET SATIŞ GEÇEN YIL | IA4: NET SATIŞ BÜTÇE | IB4: NET SATIS FİİLİ | IC4: Prog.Göre Artış | ID4: G.Yıla Göre Artış | IE4: MUSTERI SAYISI | IF4: MUSTERI SAYISI GEÇEN YIL | IG4: G.Yıla Göre Artış | IH4: NET SATIŞ GEÇEN YIL | II4: NET SATIŞ BÜTÇE | IJ4: NET SATIS FİİLİ | IK4: Prog.Göre Artış | IL4: G.Yıla Göre Artış | IM4: MUSTERI SAYISI | IN4: MUSTERI SAYISI GEÇEN YIL | IO4: G.Yıla Göre Artış
A5: 01.01.2016 | B5: 57176022 | C5: 58920468 | D5: 58069821 | E5: =+RC[-1]/RC[-2]-1 -> -1.4437207117906747E-2 | F5: =+RC[-2]/RC[-4]-1 -> 1.5632409683905557E-2 | G5: 29821 | H5: 30660 | I5: =+RC[-1]/RC[-2]-1 -> 2.8134536065189009E-2 | J5: 0 | K5: 566654 | L5: 802447 | M5: =+RC[-1]/RC[-2]-1 -> 0.41611459550272301 | N5: =+RC[-2]/RC[-4]-1 -> #DIV/0! | O5: 679 | P5: 0 | Q5: =+RC[-1]/RC[-2]-1 -> -1 | R5: 398031 | S5: 522913 | T5: 399617 | U5: =+RC[-1]/RC[-2]-1 -> -0.23578683260886613 | V5: =+RC[-2]/RC[-4]-1 -> 3.9846142637132154E-3 | W5: 357 | X5: 346 | Y5: =+RC[-1]/RC[-2]-1 -> -3.081232492997199E-2 | Z5: 0 | AA5: 600000 | AB5: 694713 | AC5: =+RC[-1]/RC[-2]-1 -> 0.15785500000000008 | AD5: =+RC[-2]/RC[-4]-1 -> #DIV/0! | AE5: 329 | AF5: 0 | AG5: =+RC[-1]/RC[-2]-1 -> -1 | AH5: 1835522 | AI5: 2604228 | AJ5: 2589600 | AK5: =+RC[-1]/RC[-2]-1 -> -5.6170197079518092E-3 | AL5: =+RC[-2]/RC[-4]-1 -> 0.41082482258452901 | AM5: 2163 | AN5: 1431 | AO5: =+RC[-1]/RC[-2]-1 -> -0.33841886269070731 | AP5: 7989792 | AQ5: 5710256 | AR5: 7208365 | AS5: =+RC[-1]/RC[-2]-1 -> 0.26235408710222452 | AT5: =+RC[-2]/RC[-4]-1 -> -9.7803171847277159E-2 | AU5: 3784 | AV5: 4407 | AW5: =+RC[-1]/RC[-2]-1 -> 0.16464059196617331 | AX5: 4404496 | AY5: 5232554 | AZ5: 4940254 | BA5: =+RC[-1]/RC[-2]-1 -> -5.5861821970685788E-2 | BB5: =+RC[-2]/RC[-4]-1 -> 0.12163888898979591 | BC5: 2465 | BD5: 2399 | BE5: =+RC[-1]/RC[-2]-1 -> -2.6774847870182583E-2 | BF5: 949026 | BG5: 1244651 | BH5: 763943 | BI5: =+RC[-1]/RC[-2]-1 -> -0.38621910881042154 | BJ5: =+RC[-2]/RC[-4]-1 -> -0.19502416161411806 | BK5: 464 | BL5: 547 | BM5: =+RC[-1]/RC[-2]-1 -> 0.17887931034482762 | BN5: 1590913 | BO5: 1300000 | BP5: 1657392 | BQ5: =+RC[-1]/RC[-2]-1 -> 0.27491692307692306 | BR5: =+RC[-2]/RC[-4]-1 -> 4.1786697324115218E-2 | BS5: 1187 | BT5: 1329 | BU5: =+RC[-1]/RC[-2]-1 -> 0.11962931760741369 | BV5: 5759158 | BW5: 6561336 | BX5: 6496298 | BY5: =+RC[-1]/RC[-2]-1 -> -9.9123105416335511E-3 | BZ5: =+RC[-2]/RC[-4]-1 -> 0.1279944047376369 | CA5: 1710 | CB5: 1646 | CC5: =+RC[-1]/RC[-2]-1 -> -3.7426900584795364E-2 | CD5: 2615896 | CE5: 2635176 | CF5: 2276648 | CG5: =+RC[-1]/RC[-2]-1 -> -0.13605466959322643 | CH5: =+RC[-2]/RC[-4]-1 -> -0.12968711294332802 | CI5: 1180 | CJ5: 1243 | CK5: =+RC[-1]/RC[-2]-1 -> 5.3389830508474567E-2 | CL5: 977249 | CM5: 780000 | CN5: 896618 | CO5: =+RC[-1]/RC[-2]-1 -> 0.14951025641025639 | CP5: =+RC[-2]/RC[-4]-1 -> -8.2508142755838065E-2 | CQ5: 452 | CR5: 486 | CS5: =+RC[-1]/RC[-2]-1 -> 7.5221238938053103E-2 | CT5: 2408262 | CU5: 1613057 | CV5: 2268562 | CW5: =+RC[-1]/RC[-2]-1 -> 0.4063743562688733 | CX5: =+RC[-2]/RC[-4]-1 -> -5.8008638594970185E-2 | CY5: 649 | CZ5: 774 | DA5: =+RC[-1]/RC[-2]-1 -> 0.19260400616332829 | DB5: 0 | DC5: 0 | DD5: 0 | DE5: =+RC[-1]/RC[-2]-1 -> #DIV/0! | DF5: =+RC[-2]/RC[-4]-1 -> #DIV/0! | DG5: 0 | DH5: 0 | DI5: =+RC[-1]/RC[-2]-1 -> #DIV/0! | DJ5: 0 | DK5: 0 | DL5: 0 | DM5: =+RC[-1]/RC[-2]-1 -> #DIV/0! | DN5: =+RC[-2]/RC[-4]-1 -> #DIV/0! | DO5: 0 | DP5: 0 | DQ5: =+RC[-1]/RC[-2]-1 -> #DIV/0! | DR5: 2698906 | DS5: 2500000 | DT5: 2086525 | DU5: =+RC[-1]/RC[-2]-1 -> -0.16539000000000004 | DV5: =+RC[-2]/RC[-4]-1 -> -0.22689971418048649 | DW5: 2048 | DX5: 2435 | DY5: =+RC[-1]/RC[-2]-1 -> 0.18896484375 | DZ5: 1291294 | EA5: 1220000 | EB5: 1158419 | EC5: =+RC[-1]/RC[-2]-1 -> -5.0476229508196746E-2 | ED5: =+RC[-2]/RC[-4]-1 -> -0.10290065624094902 | EE5: 615 | EF5: 850 | EG5: =+RC[-1]/RC[-2]-1 -> 0.38211382113821135 | EH5: 2025070 | EI5: 2411430 | EJ5: 1837361 | EK5: =+RC[-1]/RC[-2]-1 -> -0.23806164806774399 | EL5: =+RC[-2]/RC[-4]-1 -> -9.2692598280553318E-2 | EM5: 1158 | EN5: 1288 | EO5: =+RC[-1]/RC[-2]-1 -> 0.11226252158894656 | EP5: 2316701 | EQ5: 2489003 | ER5: 3135451 | ES5: =+RC[-1]/RC[-2]-1 -> 0.25972166365408156 | ET5: =+RC[-2]/RC[-4]-1 -> 0.35341202856993625 | EU5: 1289 | EV5: 1011 | EW5: =+RC[-1]/RC[-2]-1 -> -0.2156710628394104 | EX5: 429953 | EY5: 367834 | EZ5: 230705 | FA5: =+RC[-1]/RC[-2]-1 -> -0.3728013179858306 | FB5: =+RC[-2]/RC[-4]-1 -> -0.46341809453591443 | FC5: 215 | FD5: 387 | FE5: =+RC[-1]/RC[-2]-1 -> 0.8 | FF5: 2521759 | FG5: 2952657 | FH5: 2409367 | FI5: =+RC[-1]/RC[-2]-1 -> -0.18400037660994828 | FJ5: =+RC[-2]/RC[-4]-1 -> -4.456889020719268E-2 | FK5: 1133 | FL5: 1157 | FM5: =+RC[-1]/RC[-2]-1 -> 2.118270079435125E-2 | FN5: 909313 | FO5: 600000 | FP5: 376552 | FQ5: =+RC[-1]/RC[-2]-1 -> -0.37241333333333337 | FR5: =+RC[-2]/RC[-4]-1 -> -0.58589396610408073 | FS5: 377 | FT5: 779 | FU5: =+RC[-1]/RC[-2]-1 -> 1.0663129973474801 | FV5: 3666397 | FW5: 4750000 | FX5: 4977734 | FY5: =+RC[-1]/RC[-2]-1 -> 4.7943999999999987E-2 | FZ5: =+RC[-2]/RC[-4]-1 -> 0.35766366817341377 | GA5: 1511 | GB5: 1510 | GC5: =+RC[-1]/RC[-2]-1 -> -6.6181336863002649E-4 | GD5: 0 | GE5: 0 | GF5: 0 | GG5: =+RC[-1]/RC[-2]-1 -> #DIV/0! | GH5: =+RC[-2]/RC[-4]-1 -> #DIV/0! | GI5: 0 | GJ5: 0 | GK5: =+RC[-1]/RC[-2]-1 -> #DIV/0! | GL5: 5079515 | GM5: 4500000 | GN5: 4332217 | GO5: =+RC[-1]/RC[-2]-1 -> -3.7285111111111102E-2 | GP5: =+RC[-2]/RC[-4]-1 -> -0.14711995141268408 | GQ5: 2692 | GR5: 2997 | GS5: =+RC[-1]/RC[-2]-1 -> 0.11329866270430911 | GT5: 978538 | GU5: 1200000 | GV5: 755715 | GW5: =+RC[-1]/RC[-2]-1 -> -0.3702375 | GX5: =+RC[-2]/RC[-4]-1 -> -0.22771011447690326 | GY5: 473 | GZ5: 570 | HA5: =+RC[-1]/RC[-2]-1 -> 0.20507399577167029 | HB5: 2020602 | HC5: 1793040 | HD5: 1767333 | HE5: =+RC[-1]/RC[-2]-1 -> -1.4337103466737999E-2 | HF5: =+RC[-2]/RC[-4]-1 -> -0.12534333827245547 | HG5: 707 | HH5: 886 | HI5: =+RC[-1]/RC[-2]-1 -> 0.25318246110325315 | HJ5: 1108637 | HK5: 1219821 | HL5: 1133596 | HM5: =+RC[-1]/RC[-2]-1 -> -7.0686600738960825E-2 | HN5: =+RC[-2]/RC[-4]-1 -> 2.2513230209707968E-2 | HO5: 678 | HP5: 573 | HQ5: =+RC[-1]/RC[-2]-1 -> -0.15486725663716816 | HR5: 988090 | HS5: 1049990 | HT5: 846234 | HU5: =+RC[-1]/RC[-2]-1 -> -0.19405518147791889 | HV5: =+RC[-2]/RC[-4]-1 -> -0.14356586950581429 | HW5: 491 | HX5: 546 | HY5: =+RC[-1]/RC[-2]-1 -> 0.11201629327902229 | HZ5: 1459555 | IA5: 1755000 | IB5: 1508092 | IC5: =+RC[-1]/RC[-2]-1 -> -0.14068831908831914 | ID5: =+RC[-2]/RC[-4]-1 -> 3.325465638499403E-2 | IE5: 696 | IF5: 686 | IG5: =+RC[-1]/RC[-2]-1 -> -1.4367816091954033E-2 | IH5: 753347 | II5: 740868 | IJ5: 520063 | IK5: =+RC[-1]/RC[-2]-1 -> -0.2980355474929407 | IL5: =+RC[-2]/RC[-4]-1 -> -0.30966340876116849 | IM5: 319 | IN5: 377 | IO5: =+RC[-1]/RC[-2]-1 -> 0.18181818181818188
A6: 02.01.2016 | B6: 77920659 | C6: 76158321 | D6: 77272049 | E6: =+RC[-1]/RC[-2]-1 -> 1.4623851804716148E-2 | F6: =+RC[-2]/RC[-4]-1 -> -8.3239799088454802E-3 | G6: 43529 | H6: 44035 | I6: =+RC[-1]/RC[-2]-1 -> 1.1624434285189222E-2 | J6: 0 | K6: 752168 | L6: 1015303 | M6: =+RC[-1]/RC[-2]-1 -> 0.34983540911073052 | N6: =+RC[-2]/RC[-4]-1 -> #DIV/0! | O6: 1015 | P6: 0 | Q6: =+RC[-1]/RC[-2]-1 -> -1 | R6: 506562 | S6: 741289 | T6: 611778 | U6: =+RC[-1]/RC[-2]-1 -> -0.17471053799530278 | V6: =+RC[-2]/RC[-4]-1 -> 0.2077060655951295 | W6: 560 | X6: 500 | Y6: =+RC[-1]/RC[-2]-1 -> -0.1071428571428571 | Z6: 0 | AA6: 800000 | AB6: 1047704 | AC6: =+RC[-1]/RC[-2]-1 -> 0.30963000000000007 | AD6: =+RC[-2]/RC[-4]-1 -> #DIV/0! | AE6: 470 | AF6: 0 | AG6: =+RC[-1]/RC[-2]-1 -> -1 | AH6: 3045570 | AI6: 3348293 | AJ6: 3875844 | AK6: =+RC[-1]/RC[-2]-1 -> 0.15755819457855091 | AL6: =+RC[-2]/RC[-4]-1 -> 0.27261694855150265 | AM6: 3597 | AN6: 2371 | AO6: =+RC[-1]/RC[-2]-1 -> -0.3408395885460106 | AP6: 11417071 | AQ6: 7613675 | AR6: 10327731 | AS6: =+RC[-1]/RC[-2]-1 -> 0.35647121790725245 | AT6: =+RC[-2]/RC[-4]-1 -> -9.5413263174066287E-2 | AU6: 5410 | AV6: 6255 | AW6: =+RC[-1]/RC[-2]-1 -> 0.15619223659889103 | AX6: 5503411 | AY6: 6279065 | AZ6: 6344296 | BA6: =+RC[-1]/RC[-2]-1 -> 1.0388648628418373E-2 | BB6: =+RC[-2]/RC[-4]-1 -> 0.15279342211584779 | BC6: 3240 | BD6: 3119 | BE6: =+RC[-1]/RC[-2]-1 -> -3.7345679012345645E-2 | BF6: 1584305 | BG6: 1503953 | BH6: 1310382 | BI6: =+RC[-1]/RC[-2]-1 -> -0.12870814446994017 | BJ6: =+RC[-2]/RC[-4]-1 -> -0.17289789529162625 | BK6: 816 | BL6: 953 | BM6: =+RC[-1]/RC[-2]-1 -> 0.16789215686274517 | BN6: 2503907 | BO6: 1700000 | BP6: 2060039 | BQ6: =+RC[-1]/RC[-2]-1 -> 0.21178764705882358 | BR6: =+RC[-2]/RC[-4]-1 -> -0.1772701621905286 | BS6: 1984 | BT6: 2077 | BU6: =+RC[-1]/RC[-2]-1 -> 4.6875E-2 | BV6: 8224688 | BW6: 9739484 | BX6: 9157637 | BY6: =+RC[-1]/RC[-2]-1 -> -5.9741049936526402E-2 | BZ6: =+RC[-2]/RC[-4]-1 -> 0.11343275270745834 | CA6: 2246 | CB6: 2245 | CC6: =+RC[-1]/RC[-2]-1 -> -4.4523597506673784E-4 | CD6: 3038940 | CE6: 3199857 | CF6: 2876855 | CG6: =+RC[-1]/RC[-2]-1 -> -0.10094263587404062 | CH6: =+RC[-2]/RC[-4]-1 -> -5.3336031642612247E-2 | CI6: 1586 | CJ6: 1657 | CK6: =+RC[-1]/RC[-2]-1 -> 4.4766708701134972E-2 | CL6: 1344102 | CM6: 1213333 | CN6: 1524495 | CO6: =+RC[-1]/RC[-2]-1 -> 0.25645226825611767 | CP6: =+RC[-2]/RC[-4]-1 -> 0.13421079650205114 | CQ6: 800 | CR6: 873 | CS6: =+RC[-1]/RC[-2]-1 -> 9.1250000000000053E-2 | CT6: 3007325 | CU6: 2621217 | CV6: 2906708 | CW6: =+RC[-1]/RC[-2]-1 -> 0.10891543889727551 | CX6: =+RC[-2]/RC[-4]-1 -> -3.345730840531036E-2 | CY6: 979 | CZ6: 1008 | DA6: =+RC[-1]/RC[-2]-1 -> 2.962206332992845E-2 | DB6: 0 | DC6: 0 | DD6: 0 | DE6: =+RC[-1]/RC[-2]-1 -> #DIV/0! | DF6: =+RC[-2]/RC[-4]-1 -> #DIV/0! | DG6: 0 | DH6: 0 | DI6: =+RC[-1]/RC[-2]-1 -> #DIV/0! | DJ6: 0 | DK6: 0 | DL6: 0 | DM6: =+RC[-1]/RC[-2]-1 -> #DIV/0! | DN6: =+RC[-2]/RC[-4]-1 -> #DIV/0! | DO6: 0 | DP6: 0 | DQ6: =+RC[-1]/RC[-2]-1 -> #DIV/0! | DR6: 3283813 | DS6: 2700000 | DT6: 2096107 | DU6: =+RC[-1]/RC[-2]-1 -> -0.22366407407407407 | DV6: =+RC[-2]/RC[-4]-1 -> -0.36168502895871357 | DW6: 2418 | DX6: 2729 | DY6: =+RC[-1]/RC[-2]-1 -> 0.1286186931348221 | DZ6: 2055305 | EA6: 1650000 | EB6: 1369161 | EC6: =+RC[-1]/RC[-2]-1 -> -0.17020545454545455 | ED6: =+RC[-2]/RC[-4]-1 -> -0.33384047623102164 | EE6: 1060 | EF6: 1331 | EG6: =+RC[-1]/RC[-2]-1 -> 0.25566037735849068 | EH6: 2450290 | EI6: 2725964 | EJ6: 2444048 | EK6: =+RC[-1]/RC[-2]-1 -> -0.10341882724790208 | EL6: =+RC[-2]/RC[-4]-1 -> -2.5474535667207032E-3 | EM6: 1678 | EN6: 1816 | EO6: =+RC[-1]/RC[-2]-1 -> 8.2240762812872514E-2 | EP6: 2894328 | EQ6: 2765559 | ER6: 4307734 | ES6: =+RC[-1]/RC[-2]-1 -> 0.55763590652016459 | ET6: =+RC[-2]/RC[-4]-1 -> 0.48833649814395597 | EU6: 1892 | EV6: 1487 | EW6: =+RC[-1]/RC[-2]-1 -> -0.21405919661733619 | EX6: 538221 | EY6: 379700 | EZ6: 245282 | FA6: =+RC[-1]/RC[-2]-1 -> -0.35401106136423488 | FB6: =+RC[-2]/RC[-4]-1 -> -0.54427270582158638 | FC6: 279 | FD6: 507 | FE6: =+RC[-1]/RC[-2]-1 -> 0.81720430107526876 | FF6: 2985987 | FG6: 3200000 | FH6: 2692792 | FI6: =+RC[-1]/RC[-2]-1 -> -0.15850249999999999 | FJ6: =+RC[-2]/RC[-4]-1 -> -9.8190313621593139E-2 | FK6: 1387 | FL6: 1567 | FM6: =+RC[-1]/RC[-2]-1 -> 0.12977649603460706 | FN6: 1222044 | FO6: 600000 | FP6: 387184 | FQ6: =+RC[-1]/RC[-2]-1 -> -0.3546933333333333 | FR6: =+RC[-2]/RC[-4]-1 -> -0.68316689088117943 | FS6: 476 | FT6: 1094 | FU6: =+RC[-1]/RC[-2]-1 -> 1.2983193277310923 | FV6: 4752963 | FW6: 5000000 | FX6: 4674377 | FY6: =+RC[-1]/RC[-2]-1 -> -6.5124599999999977E-2 | FZ6: =+RC[-2]/RC[-4]-1 -> -1.6534107250571917E-2 | GA6: 1749 | GB6: 2092 | GC6: =+RC[-1]/RC[-2]-1 -> 0.19611206403659232 | GD6: 0 | GE6: 160000 | GF6: 0 | GG6: =+RC[-1]/RC[-2]-1 -> -1 | GH6: =+RC[-2]/RC[-4]-1 -> #DIV/0! | GI6: 0 | GJ6: 0 | GK6: =+RC[-1]/RC[-2]-1 -> #DIV/0! | GL6: 7257042 | GM6: 6700000 | GN6: 6808626 | GO6: =+RC[-1]/RC[-2]-1 -> 1.6212835820895499E-2 | GP6: =+RC[-2]/RC[-4]-1 -> -6.1790465040714948E-2 | GQ6: 4433 | GR6: 4355 | GS6: =+RC[-1]/RC[-2]-1 -> -1.7595307917888547E-2 | GT6: 1301395 | GU6: 1200000 | GV6: 894865 | GW6: =+RC[-1]/RC[-2]-1 -> -0.25427916666666661 | GX6: =+RC[-2]/RC[-4]-1 -> -0.31238017665658779 | GY6: 701 | GZ6: 967 | HA6: =+RC[-1]/RC[-2]-1 -> 0.37945791726105571 | HB6: 2655632 | HC6: 2146214 | HD6: 2004798 | HE6: =+RC[-1]/RC[-2]-1 -> -6.5890913021721009E-2 | HF6: =+RC[-2]/RC[-4]-1 -> -0.24507687812166745 | HG6: 1038 | HH6: 1181 | HI6: =+RC[-1]/RC[-2]-1 -> 0.13776493256262046 | HJ6: 2011066 | HK6: 2106964 | HL6: 1789361 | HM6: =+RC[-1]/RC[-2]-1 -> -0.15073964244287041 | HN6: =+RC[-2]/RC[-4]-1 -> -0.11024252809206658 | HO6: 1160 | HP6: 1305 | HQ6: =+RC[-1]/RC[-2]-1 -> 0.125 | HR6: 1863444 | HS6: 1999980 | HT6: 1656012 | HU6: =+RC[-1]/RC[-2]-1 -> -0.17198571985719857 | HV6: =+RC[-2]/RC[-4]-1 -> -0.11131646564103881 | HW6: 1031 | HX6: 1110 | HY6: =+RC[-1]/RC[-2]-1 -> 7.6624636275460789E-2 | HZ6: 1748919 | IA6: 2225000 | IB6: 1985592 | IC6: =+RC[-1]/RC[-2]-1 -> -0.1075991011235955 | ID6: =+RC[-2]/RC[-4]-1 -> 0.13532530666085729 | IE6: 1009 | IF6: 940 | IG6: =+RC[-1]/RC[-2]-1 -> -6.8384539147670953E-2 | IH6: 724329 | II6: 1086606 | IJ6: 857338 | IK6: =+RC[-1]/RC[-2]-1 -> -0.21099460153910432 | IL6: =+RC[-2]/RC[-4]-1 -> 0.18363064298129728 | IM6: 515 | IN6: 496 | IO6: =+RC[-1]/RC[-2]-1 -> -3.6893203883495151E-2
A7: 03.01.2016 | B7: 71639723 | C7: 72088131 | D7: 74415075 | E7: =+RC[-1]/RC[-2]-1 -> 3.2279155635204448E-2 | F7: =+RC[-2]/RC[-4]-1 -> 3.8740406631667224E-2 | G7: 43336 | H7: 43056 | I7: =+RC[-1]/RC[-2]-1 -> -6.4611408528706393E-3 | J7: 0 | K7: 859621 | L7: 1136462 | M7: =+RC[-1]/RC[-2]-1 -> 0.32205006625012644 | N7: =+RC[-2]/RC[-4]-1 -> #DIV/0! | O7: 1071 | P7: 0 | Q7: =+RC[-1]/RC[-2]-1 -> -1 | R7: 493162 | S7: 657894 | T7: 533280 | U7: =+RC[-1]/RC[-2]-1 -> -0.18941349214311121 | V7: =+RC[-2]/RC[-4]-1 -> 8.1348522392236333E-2 | W7: 580 | X7: 493 | Y7: =+RC[-1]/RC[-2]-1 -> -0.15000000000000002 | Z7: 0 | AA7: 800000 | AB7: 790606 | AC7: =+RC[-1]/RC[-2]-1 -> -1.1742499999999989E-2 | AD7: =+RC[-2]/RC[-4]-1 -> #DIV/0! | AE7: 379 | AF7: 0 | AG7: =+RC[-1]/RC[-2]-1 -> -1 | AH7: 2322271 | AI7: 3069268 | AJ7: 3990708 | AK7: =+RC[-1]/RC[-2]-1 -> 0.30021490466130696 | AL7: =+RC[-2]/RC[-4]-1 -> 0.7184506028796811 | AM7: 3488 | AN7: 2114 | AO7: =+RC[-1]/RC[-2]-1 -> -0.39392201834862384 | AP7: 10077503 | AQ7: 6661966 | AR7: 9667097 | AS7: =+RC[-1]/RC[-2]-1 -> 0.45108771194569286 | AT7: =+RC[-2]/RC[-4]-1 -> -4.0724969270661604E-2 | AU7: 5241 | AV7: 6026 | AW7: =+RC[-1]/RC[-2]-1 -> 0.14978057622591101 | AX7: 4747515 | AY7: 5755810 | AZ7: 5313807 | BA7: =+RC[-1]/RC[-2]-1 -> -7.6792493150399377E-2 | BB7: =+RC[-2]/RC[-4]-1 -> 0.11928177162157461 | BC7: 3082 | BD7: 2919 | BE7: =+RC[-1]/RC[-2]-1 -> -5.288773523685919E-2 | BF7: 1426762 | BG7: 1503953 | BH7: 1052286 | BI7: =+RC[-1]/RC[-2]-1 -> -0.30031989031572126 | BJ7: =+RC[-2]/RC[-4]-1 -> -0.26246563897832997 | BK7: 796 | BL7: 1074 | BM7: =+RC[-1]/RC[-2]-1 -> 0.34924623115577891 | BN7: 1812468 | BO7: 1400000 | BP7: 1540889 | BQ7: =+RC[-1]/RC[-2]-1 -> 0.10063500000000003 | BR7: =+RC[-2]/RC[-4]-1 -> -0.1498393350944679 | BS7: 1773 | BT7: 1948 | BU7: =+RC[-1]/RC[-2]-1 -> 9.8702763677382954E-2 | BV7: 9207635 | BW7: 9534442 | BX7: 10135424 | BY7: =+RC[-1]/RC[-2]-1 -> 6.3032739619161671E-2 | BZ7: =+RC[-2]/RC[-4]-1 -> 0.10076300809056837 | CA7: 2320 | CB7: 2327 | CC7: =+RC[-1]/RC[-2]-1 -> 3.0172413793103647E-3 | CD7: 2870189 | CE7: 3011630 | CF7: 2791574 | CG7: =+RC[-1]/RC[-2]-1 -> -7.3068736863426076E-2 | CH7: =+RC[-2]/RC[-4]-1 -> -2.7390182319004031E-2 | CI7: 1690 | CJ7: 1581 | CK7: =+RC[-1]/RC[-2]-1 -> -6.4497041420118362E-2 | CL7: 1589270 | CM7: 1126667 | CN7: 1443926 | CO7: =+RC[-1]/RC[-2]-1 -> 0.28159074509149562 | CP7: =+RC[-2]/RC[-4]-1 -> -9.1453308751816897E-2 | CQ7: 987 | CR7: 954 | CS7: =+RC[-1]/RC[-2]-1 -> -3.3434650455927084E-2 | CT7: 2763337 | CU7: 2621217 | CV7: 2940607 | CW7: =+RC[-1]/RC[-2]-1 -> 0.12184798130028907 | CX7: =+RC[-2]/RC[-4]-1 -> 6.4150698955646845E-2 | CY7: 955 | CZ7: 1031 | DA7: =+RC[-1]/RC[-2]-1 -> 7.9581151832460728E-2 | DB7: 0 | DC7: 0 | DD7: 0 | DE7: =+RC[-1]/RC[-2]-1 -> #DIV/0! | DF7: =+RC[-2]/RC[-4]-1 -> #DIV/0! | DG7: 0 | DH7: 0 | DI7: =+RC[-1]/RC[-2]-1 -> #DIV/0! | DJ7: 0 | DK7: 0 | DL7: 0 | DM7: =+RC[-1]/RC[-2]-1 -> #DIV/0! | DN7: =+RC[-2]/RC[-4]-1 -> #DIV/0! | DO7: 0 | DP7: 0 | DQ7: =+RC[-1]/RC[-2]-1 -> #DIV/0! | DR7: 2647128 | DS7: 2500000 | DT7: 2024299 | DU7: =+RC[-1]/RC[-2]-1 -> -0.19028040000000002 | DV7: =+RC[-2]/RC[-4]-1 -> -0.23528480677927177 | DW7: 1877 | DX7: 2537 | DY7: =+RC[-1]/RC[-2]-1 -> 0.35162493340436862 | DZ7: 1889284 | EA7: 1630000 | EB7: 1509229 | EC7: =+RC[-1]/RC[-2]-1 -> -7.4092638036809766E-2 | ED7: =+RC[-2]/RC[-4]-1 -> -0.20116350956235274 | EE7: 1106 | EF7: 1277 | EG7: =+RC[-1]/RC[-2]-1 -> 0.15461121157323698 | EH7: 2830369 | EI7: 2725964 | EJ7: 2592735 | EK7: =+RC[-1]/RC[-2]-1 -> -4.8874086378250081E-2 | EL7: =+RC[-2]/RC[-4]-1 -> -8.395866404698471E-2 | EM7: 1824 | EN7: 2006 | EO7: =+RC[-1]/RC[-2]-1 -> 9.9780701754385914E-2 | EP7: 2630675 | EQ7: 2765559 | ER7: 4014617 | ES7: =+RC[-1]/RC[-2]-1 -> 0.45164756926176586 | ET7: =+RC[-2]/RC[-4]-1 -> 0.52607866802246561 | EU7: 1966 | EV7: 1440 | EW7: =+RC[-1]/RC[-2]-1 -> -0.26754832146490337 | EX7: 516161 | EY7: 379700 | EZ7: 176963 | FA7: =+RC[-1]/RC[-2]-1 -> -0.53393995259415328 | FB7: =+RC[-2]/RC[-4]-1 -> -0.65715542243602287 | FC7: 270 | FD7: 464 | FE7: =+RC[-1]/RC[-2]-1 -> 0.71851851851851856 | FF7: 2656676 | FG7: 3200000 | FH7: 2402055 | FI7: =+RC[-1]/RC[-2]-1 -> -0.2493578125 | FJ7: =+RC[-2]/RC[-4]-1 -> -9.5841946853888138E-2 | FK7: 1503 | FL7: 1748 | FM7: =+RC[-1]/RC[-2]-1 -> 0.16300731869594154 | FN7: 1053790 | FO7: 600000 | FP7: 349653 | FQ7: =+RC[-1]/RC[-2]-1 -> -0.41724499999999998 | FR7: =+RC[-2]/RC[-4]-1 -> -0.66819480162081635 | FS7: 441 | FT7: 1009 | FU7: =+RC[-1]/RC[-2]-1 -> 1.2879818594104306 | FV7: 4451848 | FW7: 4500000 | FX7: 4909635 | FY7: =+RC[-1]/RC[-2]-1 -> 9.1029999999999944E-2 | FZ7: =+RC[-2]/RC[-4]-1 -> 0.10283077948752961 | GA7: 1819 | GB7: 1970 | GC7: =+RC[-1]/RC[-2]-1 -> 8.3012644310060502E-2 | GD7: 0 | GE7: 180000 | GF7: 0 | GG7: =+RC[-1]/RC[-2]-1 -> -1 | GH7: =+RC[-2]/RC[-4]-1 -> #DIV/0! | GI7: 0 | GJ7: 0 | GK7: =+RC[-1]/RC[-2]-1 -> #DIV/0! | GL7: 6249727 | GM7: 5700000 | GN7: 6027329 | GO7: =+RC[-1]/RC[-2]-1 -> 5.742614035087712E-2 | GP7: =+RC[-2]/RC[-4]-1 -> -3.5585234363036955E-2 | GQ7: 4207 | GR7: 3802 | GS7: =+RC[-1]/RC[-2]-1 -> -9.6268124554314216E-2 | GT7: 932584 | GU7: 1100000 | GV7: 760611 | GW7: =+RC[-1]/RC[-2]-1 -> -0.3085354545454545 | GX7: =+RC[-2]/RC[-4]-1 -> -0.18440483645441053 | GY7: 656 | GZ7: 870 | HA7: =+RC[-1]/RC[-2]-1 -> 0.32621951219512191 | HB7: 2467018 | HC7: 2146214 | HD7: 1945376 | HE7: =+RC[-1]/RC[-2]-1 -> -9.3577807245689426E-2 | HF7: =+RC[-2]/RC[-4]-1 -> -0.21144636966572594 | HG7: 979 | HH7: 1222 | HI7: =+RC[-1]/RC[-2]-1 -> 0.24821246169560784 | HJ7: 1839227 | HK7: 2217857 | HL7: 1806098 | HM7: =+RC[-1]/RC[-2]-1 -> -0.18565624384259216 | HN7: =+RC[-2]/RC[-4]-1 -> -1.8012458494791606E-2 | HO7: 1214 | HP7: 1140 | HQ7: =+RC[-1]/RC[-2]-1 -> -6.0955518945634224E-2 | HR7: 1764905 | HS7: 1999980 | HT7: 1826623 | HU7: =+RC[-1]/RC[-2]-1 -> -8.6679366793667945E-2 | HV7: =+RC[-2]/RC[-4]-1 -> 3.4969587598199237E-2 | HW7: 1500 | HX7: 1624 | HY7: =+RC[-1]/RC[-2]-1 -> 8.2666666666666666E-2 | HZ7: 1635490 | IA7: 2255000 | IB7: 1943859 | IC7: =+RC[-1]/RC[-2]-1 -> -0.1379782705099778 | ID7: =+RC[-2]/RC[-4]-1 -> 0.18854838611058455 | IE7: 1099 | IF7: 971 | IG7: =+RC[-1]/RC[-2]-1 -> -0.11646951774340308 | IH7: 764729 | II7: 1185389 | IJ7: 789327 | IK7: =+RC[-1]/RC[-2]-1 -> -0.33411985432630131 | IL7: =+RC[-2]/RC[-4]-1 -> 3.2165642992484811E-2 | IM7: 513 | IN7: 509 | IO7: =+RC[-1]/RC[-2]-1 -> -7.7972709551656916E-3
A8: 04.01.2016 | B8: 69637487 | C8: 66991244 | D8: 74254958 | E8: =+RC[-1]/RC[-2]-1 -> 0.10842781184956052 | F8: =+RC[-2]/RC[-4]-1 -> 6.6307260628172937E-2 | G8: 44679 | H8: 42691 | I8: =+RC[-1]/RC[-2]-1 -> -4.4495176704939632E-2 | J8: 0 | K8: 752168 | L8: 916646 | M8: =+RC[-1]/RC[-2]-1 -> 0.2186718924495592 | N8: =+RC[-2]/RC[-4]-1 -> #DIV/0! | O8: 1022 | P8: 0 | Q8: =+RC[-1]/RC[-2]-1 -> -1 | R8: 415742 | S8: 648628 | T8: 530419 | U8: =+RC[-1]/RC[-2]-1 -> -0.18224467645553388 | V8: =+RC[-2]/RC[-4]-1 -> 0.27583693733132564 | W8: 619 | X8: 470 | Y8: =+RC[-1]/RC[-2]-1 -> -0.24071082390953147 | Z8: 0 | AA8: 700000 | AB8: 663104 | AC8: =+RC[-1]/RC[-2]-1 -> -5.2708571428571438E-2 | AD8: =+RC[-2]/RC[-4]-1 -> #DIV/0! | AE8: 471 | AF8: 0 | AG8: =+RC[-1]/RC[-2]-1 -> -1 | AH8: 2186405 | AI8: 2325203 | AJ8: 3524434 | AK8: =+RC[-1]/RC[-2]-1 -> 0.51575324821101631 | AL8: =+RC[-2]/RC[-4]-1 -> 0.61197673807002828 | AM8: 3293 | AN8: 2076 | AO8: =+RC[-1]/RC[-2]-1 -> -0.36957181901002123 | AP8: 10661886 | AQ8: 6661966 | AR8: 10157735 | AS8: =+RC[-1]/RC[-2]-1 -> 0.52473534088886065 | AT8: =+RC[-2]/RC[-4]-1 -> -4.7285348952333606E-2 | AU8: 5273 | AV8: 6093 | AW8: =+RC[-1]/RC[-2]-1 -> 0.15550919780011374 | AX8: 4543318 | AY8: 4709299 | AZ8: 5335770 | BA8: =+RC[-1]/RC[-2]-1 -> 0.13302850381765952 | BB8: =+RC[-2]/RC[-4]-1 -> 0.17442142504662894 | BC8: 3095 | BD8: 2888 | BE8: =+RC[-1]/RC[-2]-1 -> -6.6882067851373184E-2 | BF8: 1396458 | BG8: 1452093 | BH8: 1335535 | BI8: =+RC[-1]/RC[-2]-1 -> -8.0268963489253053E-2 | BJ8: =+RC[-2]/RC[-4]-1 -> -4.3626804386526441E-2 | BK8: 1076 | BL8: 984 | BM8: =+RC[-1]/RC[-2]-1 -> -8.5501858736059533E-2 | BN8: 1484083 | BO8: 1100000 | BP8: 1318720 | BQ8: =+RC[-1]/RC[-2]-1 -> 0.1988363636363637 | BR8: =+RC[-2]/RC[-4]-1 -> -0.11142436103641107 | BS8: 1577 | BT8: 1886 | BU8: =+RC[-1]/RC[-2]-1 -> 0.19594166138237168 | BV8: 8812604 | BW8: 9534442 | BX8: 10617888 | BY8: =+RC[-1]/RC[-2]-1 -> 0.11363496678672957 | BZ8: =+RC[-2]/RC[-4]-1 -> 0.20485250443569236 | CA8: 2640 | CB8: 2422 | CC8: =+RC[-1]/RC[-2]-1 -> -8.2575757575757525E-2 | CD8: 2892540 | CE8: 3011630 | CF8: 2996453 | CG8: =+RC[-1]/RC[-2]-1 -> -5.0394636791372127E-3 | CH8: =+RC[-2]/RC[-4]-1 -> 3.5924481597488622E-2 | CI8: 1828 | CJ8: 1658 | CK8: =+RC[-1]/RC[-2]-1 -> -9.2997811816192599E-2 | CL8: 1359388 | CM8: 1126667 | CN8: 1530208 | CO8: =+RC[-1]/RC[-2]-1 -> 0.35817237923894107 | CP8: =+RC[-2]/RC[-4]-1 -> 0.1256594879460462 | CQ8: 1049 | CR8: 998 | CS8: =+RC[-1]/RC[-2]-1 -> -4.8617731172545309E-2 | CT8: 2917472 | CU8: 2621217 | CV8: 3226257 | CW8: =+RC[-1]/RC[-2]-1 -> 0.23082407904419977 | CX8: =+RC[-2]/RC[-4]-1 -> 0.10583991894352374 | CY8: 1132 | CZ8: 1080 | DA8: =+RC[-1]/RC[-2]-1 -> -4.5936395759717308E-2 | DB8: 0 | DC8: 0 | DD8: 0 | DE8: =+RC[-1]/RC[-2]-1 -> #DIV/0! | DF8: =+RC[-2]/RC[-4]-1 -> #DIV/0! | DG8: 0 | DH8: 0 | DI8: =+RC[-1]/RC[-2]-1 -> #DIV/0! | DJ8: 0 | DK8: 0 | DL8: 0 | DM8: =+RC[-1]/RC[-2]-1 -> #DIV/0! | DN8: =+RC[-2]/RC[-4]-1 -> #DIV/0! | DO8: 0 | DP8: 0 | DQ8: =+RC[-1]/RC[-2]-1 -> #DIV/0! | DR8: 2660614 | DS8: 2500000 | DT8: 2110836 | DU8: =+RC[-1]/RC[-2]-1 -> -0.15566559999999996 | DV8: =+RC[-2]/RC[-4]-1 -> -0.20663576151970942 | DW8: 1983 | DX8: 2527 | DY8: =+RC[-1]/RC[-2]-1 -> 0.27433182047402926 | DZ8: 1839825 | EA8: 1600000 | EB8: 1419815 | EC8: =+RC[-1]/RC[-2]-1 -> -0.112615625 | ED8: =+RC[-2]/RC[-4]-1 -> -0.22828801652331066 | EE8: 1118 | EF8: 1295 | EG8: =+RC[-1]/RC[-2]-1 -> 0.15831842576028632 | EH8: 2590820 | EI8: 2725964 | EJ8: 2630076 | EK8: =+RC[-1]/RC[-2]-1 -> -3.5175813033481051E-2 | EL8: =+RC[-2]/RC[-4]-1 -> 1.5151959611242827E-2 | EM8: 2017 | EN8: 2001 | EO8: =+RC[-1]/RC[-2]-1 -> -7.9325731284085599E-3 | EP8: 2832624 | EQ8: 2489003 | ER8: 3944429 | ES8: =+RC[-1]/RC[-2]-1 -> 0.58474256559755045 | ET8: =+RC[-2]/RC[-4]-1 -> 0.39250002824236474 | EU8: 1976 | EV8: 1574 | EW8: =+RC[-1]/RC[-2]-1 -> -0.20344129554655865 | EX8: 424671 | EY8: 379700 | EZ8: 179415 | FA8: =+RC[-1]/RC[-2]-1 -> -0.52748222280747958 | FB8: =+RC[-2]/RC[-4]-1 -> -0.57752000960743732 | FC8: 267 | FD8: 438 | FE8: =+RC[-1]/RC[-2]-1 -> 0.6404494382022472 | FF8: 2128103 | FG8: 2800000 | FH8: 2383394 | FI8: =+RC[-1]/RC[-2]-1 -> -0.14878785714285714 | FJ8: =+RC[-2]/RC[-4]-1 -> 0.1199617687677712 | FK8: 1591 | FL8: 1404 | FM8: =+RC[-1]/RC[-2]-1 -> -0.11753614079195474 | FN8: 880069 | FO8: 600000 | FP8: 279285 | FQ8: =+RC[-1]/RC[-2]-1 -> -0.53452499999999992 | FR8: =+RC[-2]/RC[-4]-1 -> -0.68265556450687392 | FS8: 441 | FT8: 961 | FU8: =+RC[-1]/RC[-2]-1 -> 1.179138321995465 | FV8: 4331167 | FW8: 3900000 | FX8: 4304156 | FY8: =+RC[-1]/RC[-2]-1 -> 0.10362974358974353 | FZ8: =+RC[-2]/RC[-4]-1 -> -6.2364254252953444E-3 | GA8: 1765 | GB8: 1861 | GC8: =+RC[-1]/RC[-2]-1 -> 5.4390934844192662E-2 | GD8: 0 | GE8: 90000 | GF8: 0 | GG8: =+RC[-1]/RC[-2]-1 -> -1 | GH8: =+RC[-2]/RC[-4]-1 -> #DIV/0! | GI8: 0 | GJ8: 0 | GK8: =+RC[-1]/RC[-2]-1 -> #DIV/0! | GL8: 5295270 | GM8: 4800000 | GN8: 5566516 | GO8: =+RC[-1]/RC[-2]-1 -> 0.15969083333333334 | GP8: =+RC[-2]/RC[-4]-1 -> 5.1224205753436447E-2 | GQ8: 3843 | GR8: 3414 | GS8: =+RC[-1]/RC[-2]-1 -> -0.11163153786104607 | GT8: 987325 | GU8: 1100000 | GV8: 722841 | GW8: =+RC[-1]/RC[-2]-1 -> -0.34287181818181822 | GX8: =+RC[-2]/RC[-4]-1 -> -0.26787937102777704 | GY8: 715 | GZ8: 861 | HA8: =+RC[-1]/RC[-2]-1 -> 0.2041958041958043 | HB8: 2480122 | HC8: 2064712 | HD8: 1956578 | HE8: =+RC[-1]/RC[-2]-1 -> -5.2372437415000306E-2 | HF8: =+RC[-2]/RC[-4]-1 -> -0.21109606704831452 | HG8: 1061 | HH8: 1253 | HI8: =+RC[-1]/RC[-2]-1 -> 0.18096135721017914 | HJ8: 2118304 | HK8: 2106964 | HL8: 1972072 | HM8: =+RC[-1]/RC[-2]-1 -> -6.4021976645068479E-2 | HN8: =+RC[-2]/RC[-4]-1 -> -6.9032584558212595E-2 | HO8: 1385 | HP8: 1435 | HQ8: =+RC[-1]/RC[-2]-1 -> 3.6101083032491044E-2 | HR8: 1609072 | HS8: 1799982 | HT8: 1805065 | HU8: =+RC[-1]/RC[-2]-1 -> 2.8239171280601827E-3 | HV8: =+RC[-2]/RC[-4]-1 -> 0.12180499070271567 | HW8: 1586 | HX8: 1478 | HY8: =+RC[-1]/RC[-2]-1 -> -6.8095838587641899E-2 | HZ8: 1937552 | IA8: 2305000 | IB8: 1940083 | IC8: =+RC[-1]/RC[-2]-1 -> -0.15831540130151844 | ID8: =+RC[-2]/RC[-4]-1 -> 1.3062875215736902E-3 | IE8: 1175 | IF8: 1073 | IG8: =+RC[-1]/RC[-2]-1 -> -8.6808510638297864E-2 | IH8: 852053 | II8: 1086606 | IJ8: 887228 | IK8: =+RC[-1]/RC[-2]-1 -> -0.18348693086546553 | IL8: =+RC[-2]/RC[-4]-1 -> 4.1282643215856396E-2 | IM8: 681 | IN8: 561 | IO8: =+RC[-1]/RC[-2]-1 -> -0.17621145374449343
A9: 05.01.2016 | B9: 68130590 | C9: 65822645 | D9: 67684692 | E9: =+RC[-1]/RC[-2]-1 -> 2.8288851048146046E-2 | F9: =+RC[-2]/RC[-4]-1 -> -6.5447547129711126E-3 | G9: 43668 | H9: 43459 | I9: =+RC[-1]/RC[-2]-1 -> -4.7861134011175643E-3 | J9: 0 | K9: 752168 | L9: 771439 | M9: =+RC[-1]/RC[-2]-1 -> 2.562060603482208E-2 | N9: =+RC[-2]/RC[-4]-1 -> #DIV/0! | O9: 799 | P9: 0 | Q9: =+RC[-1]/RC[-2]-1 -> -1 | R9: 443543 | S9: 648628 | T9: 561663 | U9: =+RC[-1]/RC[-2]-1 -> -0.13407530973069315 | V9: =+RC[-2]/RC[-4]-1 -> 0.26631014354865257 | W9: 668 | X9: 524 | Y9: =+RC[-1]/RC[-2]-1 -> -0.21556886227544914 | Z9: 0 | AA9: 700000 | AB9: 535326 | AC9: =+RC[-1]/RC[-2]-1 -> -0.23524857142857147 | AD9: =+RC[-2]/RC[-4]-1 -> #DIV/0! | AE9: 420 | AF9: 0 | AG9: =+RC[-1]/RC[-2]-1 -> -1 | AH9: 1570231 | AI9: 2325203 | AJ9: 2868578 | AK9: =+RC[-1]/RC[-2]-1 -> 0.23368927358170444 | AL9: =+RC[-2]/RC[-4]-1 -> 0.82685095377686468 | AM9: 2815 | AN9: 1661 | AO9: =+RC[-1]/RC[-2]-1 -> -0.40994671403197158 | AP9: 9622249 | AQ9: 7042650 | AR9: 8908213 | AS9: =+RC[-1]/RC[-2]-1 -> 0.26489503240967527 | AT9: =+RC[-2]/RC[-4]-1 -> -7.4206768085091079E-2 | AU9: 4491 | AV9: 5209 | AW9: =+RC[-1]/RC[-2]-1 -> 0.15987530616789125 | AX9: 3905282 | AY9: 4499997 | AZ9: 5087417 | BA9: =+RC[-1]/RC[-2]-1 -> 0.13053786480302088 | BB9: =+RC[-2]/RC[-4]-1 -> 0.30270157187112234 | BC9: 3136 | BD9: 2584 | BE9: =+RC[-1]/RC[-2]-1 -> -0.17602040816326525 | BF9: 1641072 | BG9: 1503953 | BH9: 1333171 | BI9: =+RC[-1]/RC[-2]-1 -> -0.11355541030869976 | BJ9: =+RC[-2]/RC[-4]-1 -> -0.18762187155712851 | BK9: 1064 | BL9: 1296 | BM9: =+RC[-1]/RC[-2]-1 -> 0.21804511278195493 | BN9: 1249308 | BO9: 1100000 | BP9: 1122915 | BQ9: =+RC[-1]/RC[-2]-1 -> 2.0831818181818118E-2 | BR9: =+RC[-2]/RC[-4]-1 -> -0.10117040793783438 | BS9: 1656 | BT9: 1623 | BU9: =+RC[-1]/RC[-2]-1 -> -1.9927536231884035E-2 | BV9: 10100528 | BW9: 9739484 | BX9: 9919526 | BY9: =+RC[-1]/RC[-2]-1 -> 1.8485784257153748E-2 | BZ9: =+RC[-2]/RC[-4]-1 -> -1.7920053288303373E-2 | CA9: 2786 | CB9: 3027 | CC9: =+RC[-1]/RC[-2]-1 -> 8.6503948312993462E-2 | CD9: 2350029 | CE9: 2635176 | CF9: 2431951 | CG9: =+RC[-1]/RC[-2]-1 -> -7.7120086096716167E-2 | CH9: =+RC[-2]/RC[-4]-1 -> 3.4859995344738381E-2 | CI9: 1639 | CJ9: 1496 | CK9: =+RC[-1]/RC[-2]-1 -> -8.7248322147650992E-2 | CL9: 1575872 | CM9: 1213333 | CN9: 1389752 | CO9: =+RC[-1]/RC[-2]-1 -> 0.14540031467041614 | CP9: =+RC[-2]/RC[-4]-1 -> -0.11810603906916295 | CQ9: 995 | CR9: 1084 | CS9: =+RC[-1]/RC[-2]-1 -> 8.9447236180904444E-2 | CT9: 2794436 | CU9: 2722033 | CV9: 2498714 | CW9: =+RC[-1]/RC[-2]-1 -> -8.2041253724697727E-2 | CX9: =+RC[-2]/RC[-4]-1 -> -0.10582528996906715 | CY9: 1234 | CZ9: 1272 | DA9: =+RC[-1]/RC[-2]-1 -> 3.0794165316045286E-2 | DB9: 0 | DC9: 0 | DD9: 0 | DE9: =+RC[-1]/RC[-2]-1 -> #DIV/0! | DF9: =+RC[-2]/RC[-4]-1 -> #DIV/0! | DG9: 0 | DH9: 0 | DI9: =+RC[-1]/RC[-2]-1 -> #DIV/0! | DJ9: 0 | DK9: 0 | DL9: 0 | DM9: =+RC[-1]/RC[-2]-1 -> #DIV/0! | DN9: =+RC[-2]/RC[-4]-1 -> #DIV/0! | DO9: 0 | DP9: 0 | DQ9: =+RC[-1]/RC[-2]-1 -> #DIV/0! | DR9: 2191274 | DS9: 2000000 | DT9: 1824195 | DU9: =+RC[-1]/RC[-2]-1 -> -8.7902499999999995E-2 | DV9: =+RC[-2]/RC[-4]-1 -> -0.16751853031615394 | DW9: 2265 | DX9: 2432 | DY9: =+RC[-1]/RC[-2]-1 -> 7.3730684326710927E-2 | DZ9: 1744569 | EA9: 1600000 | EB9: 1554200 | EC9: =+RC[-1]/RC[-2]-1 -> -2.8625000000000012E-2 | ED9: =+RC[-2]/RC[-4]-1 -> -0.10912093474090168 | EE9: 1082 | EF9: 1294 | EG9: =+RC[-1]/RC[-2]-1 -> 0.1959334565619224 | EH9: 3530269 | EI9: 3774412 | EJ9: 3672056 | EK9: =+RC[-1]/RC[-2]-1 -> -2.7118396189923066E-2 | EL9: =+RC[-2]/RC[-4]-1 -> 4.0163228354553215E-2 | EM9: 3041 | EN9: 3055 | EO9: =+RC[-1]/RC[-2]-1 -> 4.6037487668530996E-3 | EP9: 2396946 | EQ9: 2489003 | ER9: 3352084 | ES9: =+RC[-1]/RC[-2]-1 -> 0.34675771784927534 | ET9: =+RC[-2]/RC[-4]-1 -> 0.39848123403697877 | EU9: 1796 | EV9: 1594 | EW9: =+RC[-1]/RC[-2]-1 -> -0.11247216035634744 | EX9: 389829 | EY9: 308506 | EZ9: 141199 | FA9: =+RC[-1]/RC[-2]-1 -> -0.54231360168035625 | FB9: =+RC[-2]/RC[-4]-1 -> -0.63779246797955003 | FC9: 264 | FD9: 454 | FE9: =+RC[-1]/RC[-2]-1 -> 0.71969696969696972 | FF9: 2995214 | FG9: 2700000 | FH9: 2401499 | FI9: =+RC[-1]/RC[-2]-1 -> -0.11055592592592589 | FJ9: =+RC[-2]/RC[-4]-1 -> -0.19822122893389249 | FK9: 1716 | FL9: 2016 | FM9: =+RC[-1]/RC[-2]-1 -> 0.17482517482517479 | FN9: 726050 | FO9: 550000 | FP9: 278248 | FQ9: =+RC[-1]/RC[-2]-1 -> -0.49409454545454545 | FR9: =+RC[-2]/RC[-4]-1 -> -0.61676468562771158 | FS9: 453 | FT9: 885 | FU9: =+RC[-1]/RC[-2]-1 -> 0.95364238410596025 | FV9: 4303015 | FW9: 3800000 | FX9: 4093310 | FY9: =+RC[-1]/RC[-2]-1 -> 7.7186842105263054E-2 | FZ9: =+RC[-2]/RC[-4]-1 -> -4.8734433879500716E-2 | GA9: 1752 | GB9: 1976 | GC9: =+RC[-1]/RC[-2]-1 -> 0.12785388127853881 | GD9: 0 | GE9: 0 | GF9: 0 | GG9: =+RC[-1]/RC[-2]-1 -> #DIV/0! | GH9: =+RC[-2]/RC[-4]-1 -> #DIV/0! | GI9: 0 | GJ9: 0 | GK9: =+RC[-1]/RC[-2]-1 -> #DIV/0! | GL9: 4019432 | GM9: 3800000 | GN9: 3706016 | GO9: =+RC[-1]/RC[-2]-1 -> -2.4732631578947339E-2 | GP9: =+RC[-2]/RC[-4]-1 -> -7.797519649542517E-2 | GQ9: 2813 | GR9: 2734 | GS9: =+RC[-1]/RC[-2]-1 -> -2.808389619623175E-2 | GT9: 1100755 | GU9: 950000 | GV9: 847575 | GW9: =+RC[-1]/RC[-2]-1 -> -0.1078157894736842 | GX9: =+RC[-2]/RC[-4]-1 -> -0.23000576876780032 | GY9: 859 | GZ9: 996 | HA9: =+RC[-1]/RC[-2]-1 -> 0.15948777648428414 | HB9: 2490810 | HC9: 2309218 | HD9: 1976623 | HE9: =+RC[-1]/RC[-2]-1 -> -0.14402927744370608 | HF9: =+RC[-2]/RC[-4]-1 -> -0.20643365009775938 | HG9: 1025 | HH9: 1311 | HI9: =+RC[-1]/RC[-2]-1 -> 0.27902439024390246 | HJ9: 2587331 | HK9: 1996071 | HL9: 1915814 | HM9: =+RC[-1]/RC[-2]-1 -> -4.0207487609408732E-2 | HN9: =+RC[-2]/RC[-4]-1 -> -0.25954042988701487 | HO9: 1425 | HP9: 1452 | HQ9: =+RC[-1]/RC[-2]-1 -> 1.8947368421052602E-2 | HR9: 1327573 | HS9: 1449986 | HT9: 1449344 | HU9: =+RC[-1]/RC[-2]-1 -> -4.4276289564171289E-4 | HV9: =+RC[-2]/RC[-4]-1 -> 9.1724522869928826E-2 | HW9: 1387 | HX9: 1403 | HY9: =+RC[-1]/RC[-2]-1 -> 1.1535688536409516E-2 | HZ9: 2006612 | IA9: 2225000 | IB9: 2171798 | IC9: =+RC[-1]/RC[-2]-1 -> -2.3911011235955071E-2 | ID9: =+RC[-2]/RC[-4]-1 -> 8.2320847278895881E-2 | IE9: 1405 | IF9: 1300 | IG9: =+RC[-1]/RC[-2]-1 -> -7.4733096085409234E-2 | IH9: 1068361 | II9: 987824 | IJ9: 872066 | IK9: =+RC[-1]/RC[-2]-1 -> -0.11718484264403373 | IL9: =+RC[-2]/RC[-4]-1 -> -0.18373471139436948 | IM9: 682 | IN9: 781 | IO9: =+RC[-1]/RC[-2]-1 -> 0.14516129032258074
A10: 06.01.2016 | B10: 70652405 | C10: 69430699 | D10: 74152036 | E10: =+RC[-1]/RC[-2]-1 -> 6.8000712480224434E-2 | F10: =+RC[-2]/RC[-4]-1 -> 4.9533076757967365E-2 | G10: 44361 | H10: 43601 | I10: =+RC[-1]/RC[-2]-1 -> -1.713216564099096E-2 | J10: 0 | K10: 752168 | L10: 816757 | M10: =+RC[-1]/RC[-2]-1 -> 8.5870443837015031E-2 | N10: =+RC[-2]/RC[-4]-1 -> #DIV/0! | O10: 827 | P10: 0 | Q10: =+RC[-1]/RC[-2]-1 -> -1 | R10: 461793 | S10: 741289 | T10: 708948 | U10: =+RC[-1]/RC[-2]-1 -> -4.3628058692358862E-2 | V10: =+RC[-2]/RC[-4]-1 -> 0.53520733315576452 | W10: 704 | X10: 556 | Y10: =+RC[-1]/RC[-2]-1 -> -0.21022727272727271 | Z10: 0 | AA10: 850000 | AB10: 694569 | AC10: =+RC[-1]/RC[-2]-1 -> -0.18286000000000002 | AD10: =+RC[-2]/RC[-4]-1 -> #DIV/0! | AE10: 410 | AF10: 0 | AG10: =+RC[-1]/RC[-2]-1 -> -1 | AH10: 1710217 | AI10: 2790244 | AJ10: 3116292 | AK10: =+RC[-1]/RC[-2]-1 -> 0.11685286304710263 | AL10: =+RC[-2]/RC[-4]-1 -> 0.8221617490645925 | AM10: 2897 | AN10: 1667 | AO10: =+RC[-1]/RC[-2]-1 -> -0.4245771487745944 | AP10: 9421434 | AQ10: 7613675 | AR10: 9231436 | AS10: =+RC[-1]/RC[-2]-1 -> 0.2124809635294389 | AT10: =+RC[-2]/RC[-4]-1 -> -2.0166569123129197E-2 | AU10: 4609 | AV10: 5016 | AW10: =+RC[-1]/RC[-2]-1 -> 8.8305489260143144E-2 | AX10: 4164511 | AY10: 4709299 | AZ10: 5208957 | BA10: =+RC[-1]/RC[-2]-1 -> 0.10610029220909523 | BB10: =+RC[-2]/RC[-4]-1 -> 0.25079679222842732 | BC10: 2863 | BD10: 2673 | BE10: =+RC[-1]/RC[-2]-1 -> -6.6363953894516214E-2 | BF10: 1919569 | BG10: 1503953 | BH10: 1518483 | BI10: =+RC[-1]/RC[-2]-1 -> 9.6612061680119155E-3 | BJ10: =+RC[-2]/RC[-4]-1 -> -0.20894586232638679 | BK10: 1188 | BL10: 1276 | BM10: =+RC[-1]/RC[-2]-1 -> 7.4074074074074181E-2 | BN10: 1226693 | BO10: 1200000 | BP10: 1091554 | BQ10: =+RC[-1]/RC[-2]-1 -> -9.0371666666666628E-2 | BR10: =+RC[-2]/RC[-4]-1 -> -0.11016529808191622 | BS10: 1498 | BT10: 1662 | BU10: =+RC[-1]/RC[-2]-1 -> 0.10947930574098796 | BV10: 10009505 | BW10: 10764692 | BX10: 10413837 | BY10: =+RC[-1]/RC[-2]-1 -> -3.2593129464363657E-2 | BZ10: =+RC[-2]/RC[-4]-1 -> 4.0394804738096424E-2 | CA10: 2857 | CB10: 3050 | CC10: =+RC[-1]/RC[-2]-1 -> 6.7553377668883474E-2 | CD10: 2258740 | CE10: 2541063 | CF10: 2529012 | CG10: =+RC[-1]/RC[-2]-1 -> -4.7425034326185056E-3 | CH10: =+RC[-2]/RC[-4]-1 -> 0.11965609144921507 | CI10: 1660 | CJ10: 1447 | CK10: =+RC[-1]/RC[-2]-1 -> -0.12831325301204821 | CL10: 1505864 | CM10: 1126667 | CN10: 1579436 | CO10: =+RC[-1]/RC[-2]-1 -> 0.4018658574361369 | CP10: =+RC[-2]/RC[-4]-1 -> 4.885700169470808E-2 | CQ10: 1092 | CR10: 1115 | CS10: =+RC[-1]/RC[-2]-1 -> 2.1062271062270987E-2 | CT10: 3054398 | CU10: 2722033 | CV10: 3282272 | CW10: =+RC[-1]/RC[-2]-1 -> 0.20581638797178425 | CX10: =+RC[-2]/RC[-4]-1 -> 7.4605208620487584E-2 | CY10: 1279 | CZ10: 1300 | DA10: =+RC[-1]/RC[-2]-1 -> 1.6419077404222104E-2 | DB10: 0 | DC10: 0 | DD10: 0 | DE10: =+RC[-1]/RC[-2]-1 -> #DIV/0! | DF10: =+RC[-2]/RC[-4]-1 -> #DIV/0! | DG10: 0 | DH10: 0 | DI10: =+RC[-1]/RC[-2]-1 -> #DIV/0! | DJ10: 0 | DK10: 0 | DL10: 0 | DM10: =+RC[-1]/RC[-2]-1 -> #DIV/0! | DN10: =+RC[-2]/RC[-4]-1 -> #DIV/0! | DO10: 0 | DP10: 0 | DQ10: =+RC[-1]/RC[-2]-1 -> #DIV/0! | DR10: 2445868 | DS10: 2100000 | DT10: 1810137 | DU10: =+RC[-1]/RC[-2]-1 -> -0.13802999999999999 | DV10: =+RC[-2]/RC[-4]-1 -> -0.25992040453532239 | DW10: 2019 | DX10: 2446 | DY10: =+RC[-1]/RC[-2]-1 -> 0.2114908370480435 | DZ10: 1899497 | EA10: 1700000 | EB10: 1624767 | EC10: =+RC[-1]/RC[-2]-1 -> -4.4254705882352918E-2 | ED10: =+RC[-2]/RC[-4]-1 -> -0.14463302653281374 | EE10: 1186 | EF10: 1258 | EG10: =+RC[-1]/RC[-2]-1 -> 6.0708263069140012E-2 | EH10: 4141241 | EI10: 4193791 | EJ10: 3894539 | EK10: =+RC[-1]/RC[-2]-1 -> -7.1355964090723645E-2 | EL10: =+RC[-2]/RC[-4]-1 -> -5.9571997862476467E-2 | EM10: 2928 | EN10: 3167 | EO10: =+RC[-1]/RC[-2]-1 -> 8.16256830601092E-2 | EP10: 2583270 | EQ10: 2765559 | ER10: 3841896 | ES10: =+RC[-1]/RC[-2]-1 -> 0.38919328786693752 | ET10: =+RC[-2]/RC[-4]-1 -> 0.48722200931377668 | EU10: 1962 | EV10: 1575 | EW10: =+RC[-1]/RC[-2]-1 -> -0.19724770642201839 | EX10: 513659 | EY10: 314439 | EZ10: 170207 | FA10: =+RC[-1]/RC[-2]-1 -> -0.45869628131370477 | FB10: =+RC[-2]/RC[-4]-1 -> -0.66863814320395432 | FC10: 259 | FD10: 441 | FE10: =+RC[-1]/RC[-2]-1 -> 0.70270270270270263 | FF10: 3315043 | FG10: 2750000 | FH10: 3676696 | FI10: =+RC[-1]/RC[-2]-1 -> 0.33698036363636374 | FJ10: =+RC[-2]/RC[-4]-1 -> 0.10909451249953617 | FK10: 1925 | FL10: 2038 | FM10: =+RC[-1]/RC[-2]-1 -> 5.8701298701298699E-2 | FN10: 910341 | FO10: 500000 | FP10: 285988 | FQ10: =+RC[-1]/RC[-2]-1 -> -0.42802399999999996 | FR10: =+RC[-2]/RC[-4]-1 -> -0.68584519427335477 | FS10: 439 | FT10: 868 | FU10: =+RC[-1]/RC[-2]-1 -> 0.97722095671981779 | FV10: 4600816 | FW10: 3800000 | FX10: 4590028 | FY10: =+RC[-1]/RC[-2]-1 -> 0.207902105263158 | FZ10: =+RC[-2]/RC[-4]-1 -> -2.3448014439177989E-3 | GA10: 1923 | GB10: 1889 | GC10: =+RC[-1]/RC[-2]-1 -> -1.7680707228289183E-2 | GD10: 0 | GE10: 200000 | GF10: 0 | GG10: =+RC[-1]/RC[-2]-1 -> -1 | GH10: =+RC[-2]/RC[-4]-1 -> #DIV/0! | GI10: 0 | GJ10: 0 | GK10: =+RC[-1]/RC[-2]-1 -> #DIV/0! | GL10: 4352208 | GM10: 4000000 | GN10: 3959167 | GO10: =+RC[-1]/RC[-2]-1 -> -1.020825000000003E-2 | GP10: =+RC[-2]/RC[-4]-1 -> -9.0308413568469192E-2 | GQ10: 2791 | GR10: 2780 | GS10: =+RC[-1]/RC[-2]-1 -> -3.9412396990325949E-3 | GT10: 1228484 | GU10: 950000 | GV10: 1235161 | GW10: =+RC[-1]/RC[-2]-1 -> 0.30016947368421043 | GX10: =+RC[-2]/RC[-4]-1 -> 5.4351542226027671E-3 | GY10: 864 | GZ10: 1036 | HA10: =+RC[-1]/RC[-2]-1 -> 0.19907407407407418 | HB10: 2752149 | HC10: 2445054 | HD10: 2077255 | HE10: =+RC[-1]/RC[-2]-1 -> -0.15042571656904102 | HF10: =+RC[-2]/RC[-4]-1 -> -0.24522436830273364 | HG10: 1103 | HH10: 1422 | HI10: =+RC[-1]/RC[-2]-1 -> 0.28921124206708981 | HJ10: 2133699 | HK10: 1885179 | HL10: 2013091 | HM10: =+RC[-1]/RC[-2]-1 -> 6.7851381752077611E-2 | HN10: =+RC[-2]/RC[-4]-1 -> -5.6525311208375673E-2 | HO10: 1438 | HP10: 1525 | HQ10: =+RC[-1]/RC[-2]-1 -> 6.0500695410292016E-2 | HR10: 1160569 | HS10: 1199988 | HT10: 1453996 | HU10: =+RC[-1]/RC[-2]-1 -> 0.21167545008783417 | HV10: =+RC[-2]/RC[-4]-1 -> 0.252830292727102 | HW10: 1368 | HX10: 1352 | HY10: =+RC[-1]/RC[-2]-1 -> -1.1695906432748537E-2 | HZ10: 2041010 | IA10: 2225000 | IB10: 2356492 | IC10: =+RC[-1]/RC[-2]-1 -> 5.9097528089887552E-2 | ID10: =+RC[-2]/RC[-4]-1 -> 0.15457151116359058 | IE10: 1502 | IF10: 1293 | IG10: =+RC[-1]/RC[-2]-1 -> -0.13914780292942741 | IH10: 841827 | II10: 1086606 | IJ10: 971063 | IK10: =+RC[-1]/RC[-2]-1 -> -0.10633385054012223 | IL10: =+RC[-2]/RC[-4]-1 -> 0.15351847826216081 | IM10: 770 | IN10: 749 | IO10: =+RC[-1]/RC[-2]-1 -> -2.7272727272727226E-2
A11: 07.01.2016 | B11: 72462922 | C11: 75718660 | D11: 73727879 | E11: =+RC[-1]/RC[-2]-1 -> -2.6291814989858553E-2 | F11: =+RC[-2]/RC[-4]-1 -> 1.7456610430365949E-2 | G11: 43536 | H11: 43839 | I11: =+RC[-1]/RC[-2]-1 -> 6.959757442116965E-3 | J11: 0 | K11: 752168 | L11: 784069 | M11: =+RC[-1]/RC[-2]-1 -> 4.2412067516831353E-2 | N11: =+RC[-2]/RC[-4]-1 -> #DIV/0! | O11: 900 | P11: 0 | Q11: =+RC[-1]/RC[-2]-1 -> -1 | R11: 481377 | S11: 741289 | T11: 615377 | U11: =+RC[-1]/RC[-2]-1 -> -0.16985548146539342 | V11: =+RC[-2]/RC[-4]-1 -> 0.27836809818499852 | W11: 613 | X11: 514 | Y11: =+RC[-1]/RC[-2]-1 -> -0.16150081566068519 | Z11: 0 | AA11: 1000000 | AB11: 636013 | AC11: =+RC[-1]/RC[-2]-1 -> -0.36398699999999995 | AD11: =+RC[-2]/RC[-4]-1 -> #DIV/0! | AE11: 354 | AF11: 0 | AG11: =+RC[-1]/RC[-2]-1 -> -1 | AH11: 2072903 | AI11: 3255285 | AJ11: 3850969 | AK11: =+RC[-1]/RC[-2]-1 -> 0.18298981502387646 | AL11: =+RC[-2]/RC[-4]-1 -> 0.85776613763403309 | AM11: 3289 | AN11: 1958 | AO11: =+RC[-1]/RC[-2]-1 -> -0.40468227424749159 | AP11: 10461277 | AQ11: 8565385 | AR11: 10279022 | AS11: =+RC[-1]/RC[-2]-1 -> 0.20006537943128078 | AT11: =+RC[-2]/RC[-4]-1 -> -1.7421869242158494E-2 | AU11: 5281 | AV11: 5790 | AW11: =+RC[-1]/RC[-2]-1 -> 9.6383260746070842E-2 | AX11: 5161481 | AY11: 5965112 | AZ11: 5955781 | BA11: =+RC[-1]/RC[-2]-1 -> -1.5642623306989512E-3 | BB11: =+RC[-2]/RC[-4]-1 -> 0.15388993972853915 | BC11: 3160 | BD11: 3174 | BE11: =+RC[-1]/RC[-2]-1 -> 4.4303797468354666E-3 | BF11: 1559990 | BG11: 1555814 | BH11: 1244078 | BI11: =+RC[-1]/RC[-2]-1 -> -0.20036842450318615 | BJ11: =+RC[-2]/RC[-4]-1 -> -0.20250899044224646 | BK11: 869 | BL11: 1106 | BM11: =+RC[-1]/RC[-2]-1 -> 0.27272727272727271 | BN11: 1268150 | BO11: 1300000 | BP11: 1083038 | BQ11: =+RC[-1]/RC[-2]-1 -> -0.16689384615384617 | BR11: =+RC[-2]/RC[-4]-1 -> -0.14597011394551118 | BS11: 1518 | BT11: 1752 | BU11: =+RC[-1]/RC[-2]-1 -> 0.1541501976284585 | BV11: 9901991 | BW11: 11277297 | BX11: 9488826 | BY11: =+RC[-1]/RC[-2]-1 -> -0.1585903962625087 | BZ11: =+RC[-2]/RC[-4]-1 -> -4.1725446932844079E-2 | CA11: 2523 | CB11: 2687 | CC11: =+RC[-1]/RC[-2]-1 -> 6.500198176773675E-2 | CD11: 2302661 | CE11: 2541063 | CF11: 2287084 | CG11: =+RC[-1]/RC[-2]-1 -> -9.9949902855615891E-2 | CH11: =+RC[-2]/RC[-4]-1 -> -6.7647821368408412E-3 | CI11: 1479 | CJ11: 1413 | CK11: =+RC[-1]/RC[-2]-1 -> -4.4624746450304231E-2 | CL11: 1581384 | CM11: 1213333 | CN11: 1629420 | CO11: =+RC[-1]/RC[-2]-1 -> 0.34292894036509347 | CP11: =+RC[-2]/RC[-4]-1 -> 3.0375923874277122E-2 | CQ11: 1112 | CR11: 1109 | CS11: =+RC[-1]/RC[-2]-1 -> -2.6978417266186883E-3 | CT11: 3201563 | CU11: 2722033 | CV11: 3037902 | CW11: =+RC[-1]/RC[-2]-1 -> 0.11604157627773071 | CX11: =+RC[-2]/RC[-4]-1 -> -5.1119094017515798E-2 | CY11: 1045 | CZ11: 1240 | DA11: =+RC[-1]/RC[-2]-1 -> 0.1866028708133971 | DB11: 0 | DC11: 0 | DD11: 0 | DE11: =+RC[-1]/RC[-2]-1 -> #DIV/0! | DF11: =+RC[-2]/RC[-4]-1 -> #DIV/0! | DG11: 0 | DH11: 0 | DI11: =+RC[-1]/RC[-2]-1 -> #DIV/0! | DJ11: 0 | DK11: 0 | DL11: 0 | DM11: =+RC[-1]/RC[-2]-1 -> #DIV/0! | DN11: =+RC[-2]/RC[-4]-1 -> #DIV/0! | DO11: 0 | DP11: 0 | DQ11: =+RC[-1]/RC[-2]-1 -> #DIV/0! | DR11: 2708345 | DS11: 2600000 | DT11: 1864088 | DU11: =+RC[-1]/RC[-2]-1 -> -0.28304307692307695 | DV11: =+RC[-2]/RC[-4]-1 -> -0.3117243187260117 | DW11: 1924 | DX11: 2719 | DY11: =+RC[-1]/RC[-2]-1 -> 0.41320166320166329 | DZ11: 1916695 | EA11: 1550000 | EB11: 1442575 | EC11: =+RC[-1]/RC[-2]-1 -> -6.9306451612903275E-2 | ED11: =+RC[-2]/RC[-4]-1 -> -0.24736329984687178 | EE11: 1031 | EF11: 1222 | EG11: =+RC[-1]/RC[-2]-1 -> 0.18525703200775956 | EH11: 3052866 | EI11: 3250188 | EJ11: 2732446 | EK11: =+RC[-1]/RC[-2]-1 -> -0.15929601610737598 | EL11: =+RC[-2]/RC[-4]-1 -> -0.10495711243140049 | EM11: 2073 | EN11: 2167 | EO11: =+RC[-1]/RC[-2]-1 -> 4.5344910757356471E-2 | EP11: 3275608 | EQ11: 3042115 | ER11: 4486302 | ES11: =+RC[-1]/RC[-2]-1 -> 0.47473123139657769 | ET11: =+RC[-2]/RC[-4]-1 -> 0.36960893977545539 | EU11: 2060 | EV11: 1745 | EW11: =+RC[-1]/RC[-2]-1 -> -0.15291262135922334 | EX11: 475761 | EY11: 380624 | EZ11: 198799 | FA11: =+RC[-1]/RC[-2]-1 -> -0.47770240447265544 | FB11: =+RC[-2]/RC[-4]-1 -> -0.58214523678906005 | FC11: 245 | FD11: 456 | FE11: =+RC[-1]/RC[-2]-1 -> 0.86122448979591826 | FF11: 2994952 | FG11: 2900000 | FH11: 2687451 | FI11: =+RC[-1]/RC[-2]-1 -> -7.3292758620689624E-2 | FJ11: =+RC[-2]/RC[-4]-1 -> -0.10267309793278823 | FK11: 1625 | FL11: 1887 | FM11: =+RC[-1]/RC[-2]-1 -> 0.16123076923076929 | FN11: 883566 | FO11: 400000 | FP11: 302354 | FQ11: =+RC[-1]/RC[-2]-1 -> -0.24411499999999997 | FR11: =+RC[-2]/RC[-4]-1 -> -0.65780258633763633 | FS11: 468 | FT11: 862 | FU11: =+RC[-1]/RC[-2]-1 -> 0.84188034188034178 | FV11: 4945426 | FW11: 5200000 | FX11: 5158087 | FY11: =+RC[-1]/RC[-2]-1 -> -8.0601923076922821E-3 | FZ11: =+RC[-2]/RC[-4]-1 -> 4.3001553354554245E-2 | GA11: 1956 | GB11: 2055 | GC11: =+RC[-1]/RC[-2]-1 -> 5.0613496932515378E-2 | GD11: 0 | GE11: 200000 | GF11: 0 | GG11: =+RC[-1]/RC[-2]-1 -> -1 | GH11: =+RC[-2]/RC[-4]-1 -> #DIV/0! | GI11: 0 | GJ11: 0 | GK11: =+RC[-1]/RC[-2]-1 -> #DIV/0! | GL11: 4607396 | GM11: 4793017 | GN11: 4476291 | GO11: =+RC[-1]/RC[-2]-1 -> -6.6080717009766476E-2 | GP11: =+RC[-2]/RC[-4]-1 -> -2.8455335725429243E-2 | GQ11: 3467 | GR11: 3172 | GS11: =+RC[-1]/RC[-2]-1 -> -8.5087972310354809E-2 | GT11: 1055928 | GU11: 950000 | GV11: 783013 | GW11: =+RC[-1]/RC[-2]-1 -> -0.17577578947368422 | GX11: =+RC[-2]/RC[-4]-1 -> -0.25845985711146968 | GY11: 757 | GZ11: 910 | HA11: =+RC[-1]/RC[-2]-1 -> 0.2021136063408191 | HB11: 2392498 | HC11: 2336385 | HD11: 1898249 | HE11: =+RC[-1]/RC[-2]-1 -> -0.18752731249344612 | HF11: =+RC[-2]/RC[-4]-1 -> -0.20658282681949991 | HG11: 1027 | HH11: 1269 | HI11: =+RC[-1]/RC[-2]-1 -> 0.23563777994157742 | HJ11: 1753371 | HK11: 2106964 | HL11: 1890727 | HM11: =+RC[-1]/RC[-2]-1 -> -0.10262966049728428 | HN11: =+RC[-2]/RC[-4]-1 -> 7.8338241022578803E-2 | HO11: 1338 | HP11: 1225 | HQ11: =+RC[-1]/RC[-2]-1 -> -8.4454409566517175E-2 | HR11: 1499574 | HS11: 1799982 | HT11: 1753858 | HU11: =+RC[-1]/RC[-2]-1 -> -2.5624700691451396E-2 | HV11: =+RC[-2]/RC[-4]-1 -> 0.16957082478090446 | HW11: 1528 | HX11: 1563 | HY11: =+RC[-1]/RC[-2]-1 -> 2.2905759162303641E-2 | HZ11: 1943762 | IA11: 2135217 | IB11: 2188690 | IC11: =+RC[-1]/RC[-2]-1 -> 2.5043356249037085E-2 | ID11: =+RC[-2]/RC[-4]-1 -> 0.12600719635428614 | IE11: 1233 | IF11: 1176 | IG11: =+RC[-1]/RC[-2]-1 -> -4.6228710462287159E-2 | IH11: 964397 | II11: 1185389 | IJ11: 973370 | IK11: =+RC[-1]/RC[-2]-1 -> -0.17886027287244943 | IL11: =+RC[-2]/RC[-4]-1 -> 9.3042595528605165E-3 | IM11: 661 | IN11: 668 | IO11: =+RC[-1]/RC[-2]-1 -> 1.0590015128593144E-2
A12: 08.01.2016 | B12: 62937573 | C12: 65178191 | D12: 64681413 | E12: =+RC[-1]/RC[-2]-1 -> -7.6218439385652426E-3 | F12: =+RC[-2]/RC[-4]-1 -> 2.7707455449545115E-2 | G12: 41474 | H12: 41518 | I12: =+RC[-1]/RC[-2]-1 -> 1.0609056276220663E-3 | J12: 0 | K12: 752168 | L12: 679336 | M12: =+RC[-1]/RC[-2]-1 -> -9.6829431722700199E-2 | N12: =+RC[-2]/RC[-4]-1 -> #DIV/0! | O12: 838 | P12: 0 | Q12: =+RC[-1]/RC[-2]-1 -> -1 | R12: 442552 | S12: 648628 | T12: 559375 | U12: =+RC[-1]/RC[-2]-1 -> -0.13760275535437883 | V12: =+RC[-2]/RC[-4]-1 -> 0.26397575878088908 | W12: 644 | X12: 552 | Y12: =+RC[-1]/RC[-2]-1 -> -0.1428571428571429 | Z12: 0 | AA12: 900000 | AB12: 612924 | AC12: =+RC[-1]/RC[-2]-1 -> -0.31897333333333333 | AD12: =+RC[-2]/RC[-4]-1 -> #DIV/0! | AE12: 422 | AF12: 0 | AG12: =+RC[-1]/RC[-2]-1 -> -1 | AH12: 1481445 | AI12: 2511220 | AJ12: 2695108 | AK12: =+RC[-1]/RC[-2]-1 -> 7.3226559202300034E-2 | AL12: =+RC[-2]/RC[-4]-1 -> 0.81924269885145917 | AM12: 2639 | AN12: 1544 | AO12: =+RC[-1]/RC[-2]-1 -> -0.4149298976885184 | AP12: 8567584 | AQ12: 6661966 | AR12: 8115717 | AS12: =+RC[-1]/RC[-2]-1 -> 0.21821651446434887 | AT12: =+RC[-2]/RC[-4]-1 -> -5.274147297534526E-2 | AU12: 4443 | AV12: 4987 | AW12: =+RC[-1]/RC[-2]-1 -> 0.12243979293270302 | AX12: 4231054 | AY12: 4709299 | AZ12: 4780586 | BA12: =+RC[-1]/RC[-2]-1 -> 1.5137497109442455E-2 | BB12: =+RC[-2]/RC[-4]-1 -> 0.12988063967039887 | BC12: 2775 | BD12: 2769 | BE12: =+RC[-1]/RC[-2]-1 -> -2.1621621621621401E-3 | BF12: 1386410 | BG12: 1555814 | BH12: 1364640 | BI12: =+RC[-1]/RC[-2]-1 -> -0.12287715626675166 | BJ12: =+RC[-2]/RC[-4]-1 -> -1.5702425689370414E-2 | BK12: 1043 | BL12: 1260 | BM12: =+RC[-1]/RC[-2]-1 -> 0.20805369127516782 | BN12: 1028550 | BO12: 1100000 | BP12: 1069431 | BQ12: =+RC[-1]/RC[-2]-1 -> -2.7789999999999981E-2 | BR12: =+RC[-2]/RC[-4]-1 -> 3.9746244713431578E-2 | BS12: 1387 | BT12: 1609 | BU12: =+RC[-1]/RC[-2]-1 -> 0.16005767844268215 | BV12: 8285064 | BW12: 9739484 | BX12: 9660700 | BY12: =+RC[-1]/RC[-2]-1 -> -8.0891349069416307E-3 | BZ12: =+RC[-2]/RC[-4]-1 -> 0.16603806560818368 | CA12: 2844 | CB12: 2778 | CC12: =+RC[-1]/RC[-2]-1 -> -2.320675105485237E-2 | CD12: 1901530 | CE12: 2635176 | CF12: 2112609 | CG12: =+RC[-1]/RC[-2]-1 -> -0.19830440167943242 | CH12: =+RC[-2]/RC[-4]-1 -> 0.11100482243246224 | CI12: 1571 | CJ12: 1339 | CK12: =+RC[-1]/RC[-2]-1 -> -0.14767663908338635 | CL12: 1224077 | CM12: 1126667 | CN12: 1482594 | CO12: =+RC[-1]/RC[-2]-1 -> 0.31591144499661383 | CP12: =+RC[-2]/RC[-4]-1 -> 0.21119341348624321 | CQ12: 1047 | CR12: 974 | CS12: =+RC[-1]/RC[-2]-1 -> -6.9723018147086924E-2 | CT12: 2836090 | CU12: 2419585 | CV12: 2351974 | CW12: =+RC[-1]/RC[-2]-1 -> -2.7943221668178642E-2 | CX12: =+RC[-2]/RC[-4]-1 -> -0.17069839109478191 | CY12: 1079 | CZ12: 1284 | DA12: =+RC[-1]/RC[-2]-1 -> 0.18999073215940676 | DB12: 0 | DC12: 0 | DD12: 0 | DE12: =+RC[-1]/RC[-2]-1 -> #DIV/0! | DF12: =+RC[-2]/RC[-4]-1 -> #DIV/0! | DG12: 0 | DH12: 0 | DI12: =+RC[-1]/RC[-2]-1 -> #DIV/0! | DJ12: 0 | DK12: 0 | DL12: 0 | DM12: =+RC[-1]/RC[-2]-1 -> #DIV/0! | DN12: =+RC[-2]/RC[-4]-1 -> #DIV/0! | DO12: 0 | DP12: 0 | DQ12: =+RC[-1]/RC[-2]-1 -> #DIV/0! | DR12: 1963687 | DS12: 1800000 | DT12: 1388199 | DU12: =+RC[-1]/RC[-2]-1 -> -0.22877833333333331 | DV12: =+RC[-2]/RC[-4]-1 -> -0.29306503531367267 | DW12: 1536 | DX12: 2369 | DY12: =+RC[-1]/RC[-2]-1 -> 0.54231770833333326 | DZ12: 1587677 | EA12: 1600000 | EB12: 1351615 | EC12: =+RC[-1]/RC[-2]-1 -> -0.15524062500000002 | ED12: =+RC[-2]/RC[-4]-1 -> -0.14868389477204746 | EE12: 1002 | EF12: 1129 | EG12: =+RC[-1]/RC[-2]-1 -> 0.12674650698602785 | EH12: 3495194 | EI12: 3774412 | EJ12: 3507092 | EK12: =+RC[-1]/RC[-2]-1 -> -7.0824276735025227E-2 | EL12: =+RC[-2]/RC[-4]-1 -> 3.4041028909983506E-3 | EM12: 2813 | EN12: 3001 | EO12: =+RC[-1]/RC[-2]-1 -> 6.6832563099893383E-2 | EP12: 2555340 | EQ12: 2857744 | ER12: 3357660 | ES12: =+RC[-1]/RC[-2]-1 -> 0.17493379392975728 | ET12: =+RC[-2]/RC[-4]-1 -> 0.31397778769165741 | EU12: 1951 | EV12: 1595 | EW12: =+RC[-1]/RC[-2]-1 -> -0.18247052793439267 | EX12: 390573 | EY12: 342430 | EZ12: 137769 | FA12: =+RC[-1]/RC[-2]-1 -> -0.59767251701077595 | FB12: =+RC[-2]/RC[-4]-1 -> -0.64726440383743888 | FC12: 225 | FD12: 404 | FE12: =+RC[-1]/RC[-2]-1 -> 0.79555555555555557 | FF12: 2600108 | FG12: 2700000 | FH12: 2448388 | FI12: =+RC[-1]/RC[-2]-1 -> -9.3189629629629622E-2 | FJ12: =+RC[-2]/RC[-4]-1 -> -5.8351422325534141E-2 | FK12: 1702 | FL12: 1871 | FM12: =+RC[-1]/RC[-2]-1 -> 9.9294947121034038E-2 | FN12: 750151 | FO12: 450000 | FP12: 222513 | FQ12: =+RC[-1]/RC[-2]-1 -> -0.50552666666666668 | FR12: =+RC[-2]/RC[-4]-1 -> -0.70337572035496854 | FS12: 388 | FT12: 741 | FU12: =+RC[-1]/RC[-2]-1 -> 0.90979381443298979 | FV12: 3926588 | FW12: 3600000 | FX12: 4613782 | FY12: =+RC[-1]/RC[-2]-1 -> 0.281606111111111 | FZ12: =+RC[-2]/RC[-4]-1 -> 0.1750104671027366 | GA12: 1837 | GB12: 1745 | GC12: =+RC[-1]/RC[-2]-1 -> -5.0081654872074055E-2 | GD12: 0 | GE12: 85000 | GF12: 0 | GG12: =+RC[-1]/RC[-2]-1 -> -1 | GH12: =+RC[-2]/RC[-4]-1 -> #DIV/0! | GI12: 0 | GJ12: 0 | GK12: =+RC[-1]/RC[-2]-1 -> #DIV/0! | GL12: 3605913 | GM12: 3500000 | GN12: 3556235 | GO12: =+RC[-1]/RC[-2]-1 -> 1.6067142857142835E-2 | GP12: =+RC[-2]/RC[-4]-1 -> -1.3776816024124838E-2 | GQ12: 2585 | GR12: 2670 | GS12: =+RC[-1]/RC[-2]-1 -> 3.2882011605415817E-2 | GT12: 930162 | GU12: 950000 | GV12: 791281 | GW12: =+RC[-1]/RC[-2]-1 -> -0.16707263157894736 | GX12: =+RC[-2]/RC[-4]-1 -> -0.14930840004214319 | GY12: 825 | GZ12: 854 | HA12: =+RC[-1]/RC[-2]-1 -> 3.5151515151515156E-2 | HB12: 2303221 | HC12: 2499389 | HD12: 1766496 | HE12: =+RC[-1]/RC[-2]-1 -> -0.29322886513463886 | HF12: =+RC[-2]/RC[-4]-1 -> -0.23303234904509817 | HG12: 1054 | HH12: 1205 | HI12: =+RC[-1]/RC[-2]-1 -> 0.14326375711574957 | HJ12: 3551764 | HK12: 1885179 | HL12: 1829684 | HM12: =+RC[-1]/RC[-2]-1 -> -2.9437522908965175E-2 | HN12: =+RC[-2]/RC[-4]-1 -> -0.48485203408785038 | HO12: 1449 | HP12: 1431 | HQ12: =+RC[-1]/RC[-2]-1 -> -1.2422360248447228E-2 | HR12: 1059298 | HS12: 1099989 | HT12: 1302112 | HU12: =+RC[-1]/RC[-2]-1 -> 0.18375001931837498 | HV12: =+RC[-2]/RC[-4]-1 -> 0.22922161658003692 | HW12: 1349 | HX12: 1322 | HY12: =+RC[-1]/RC[-2]-1 -> -2.0014825796886626E-2 | HZ12: 1833905 | IA12: 2385000 | IB12: 2102333 | IC12: =+RC[-1]/RC[-2]-1 -> -0.11851865828092245 | ID12: =+RC[-2]/RC[-4]-1 -> 0.14636963201474451 | IE12: 1367 | IF12: 1306 | IG12: =+RC[-1]/RC[-2]-1 -> -4.4623262618873394E-2 | IH12: 999636 | II12: 889041 | IJ12: 821260 | IK12: =+RC[-1]/RC[-2]-1 -> -7.6240578331033149E-2 | IL12: =+RC[-2]/RC[-4]-1 -> -0.17844095250671244 | IM12: 659 | IN12: 779 | IO12: =+RC[-1]/RC[-2]-1 -> 0.18209408194233689
A13: 09.01.2016 | B13: 63202392 | C13: 75050319 | D13: 76813187 | E13: =+RC[-1]/RC[-2]-1 -> 2.3489147327941495E-2 | F13: =+RC[-2]/RC[-4]-1 -> 0.21535252969539509 | G13: 42318 | H13: 39908 | I13: =+RC[-1]/RC[-2]-1 -> -5.6949761330875703E-2 | J13: 0 | K13: 1181979 | L13: 882217 | M13: =+RC[-1]/RC[-2]-1 -> -0.25361025872710086 | N13: =+RC[-2]/RC[-4]-1 -> #DIV/0! | O13: 950 | P13: 0 | Q13: =+RC[-1]/RC[-2]-1 -> -1 | R13: 409631 | S13: 648628 | T13: 609437 | U13: =+RC[-1]/RC[-2]-1 -> -6.0421381747318925E-2 | V13: =+RC[-2]/RC[-4]-1 -> 0.48777070094792641 | W13: 620 | X13: 469 | Y13: =+RC[-1]/RC[-2]-1 -> -0.24354838709677418 | Z13: 0 | AA13: 950000 | AB13: 725493 | AC13: =+RC[-1]/RC[-2]-1 -> -0.23632315789473679 | AD13: =+RC[-2]/RC[-4]-1 -> #DIV/0! | AE13: 396 | AF13: 0 | AG13: =+RC[-1]/RC[-2]-1 -> -1 | AH13: 1479826 | AI13: 2976260 | AJ13: 3340801 | AK13: =+RC[-1]/RC[-2]-1 -> 0.12248291479911022 | AL13: =+RC[-2]/RC[-4]-1 -> 1.2575633892092717 | AM13: 2922 | AN13: 1471 | AO13: =+RC[-1]/RC[-2]-1 -> -0.49657768651608492 | AP13: 7699743 | AQ13: 9041239 | AR13: 10025006 | AS13: =+RC[-1]/RC[-2]-1 -> 0.10880887011171803 | AT13: =+RC[-2]/RC[-4]-1 -> 0.3019922872750429 | AU13: 4784 | AV13: 4650 | AW13: =+RC[-1]/RC[-2]-1 -> -2.8010033444816007E-2 | AX13: 4445766 | AY13: 5755810 | AZ13: 6125464 | BA13: =+RC[-1]/RC[-2]-1 -> 6.4222759264117579E-2 | BB13: =+RC[-2]/RC[-4]-1 -> 0.37781970531062581 | BC13: 3102 | BD13: 2525 | BE13: =+RC[-1]/RC[-2]-1 -> -0.1860090264345583 | BF13: 1611134 | BG13: 1244651 | BH13: 1295976 | BI13: =+RC[-1]/RC[-2]-1 -> 4.1236459055590702E-2 | BJ13: =+RC[-2]/RC[-4]-1 -> -0.19561253129783118 | BK13: 976 | BL13: 1262 | BM13: =+RC[-1]/RC[-2]-1 -> 0.29303278688524581 | BN13: 1175896 | BO13: 1300000 | BP13: 1066960 | BQ13: =+RC[-1]/RC[-2]-1 -> -0.17926153846153847 | BR13: =+RC[-2]/RC[-4]-1 -> -9.2640845789083381E-2 | BS13: 1444 | BT13: 1517 | BU13: =+RC[-1]/RC[-2]-1 -> 5.0554016620498521E-2 | BV13: 8769579 | BW13: 11277297 | BX13: 12283680 | BY13: =+RC[-1]/RC[-2]-1 -> 8.9239735372758311E-2 | BZ13: =+RC[-2]/RC[-4]-1 -> 0.40071490318976544 | CA13: 2610 | CB13: 2829 | CC13: =+RC[-1]/RC[-2]-1 -> 8.3908045977011403E-2 | CD13: 1802771 | CE13: 2541063 | CF13: 2108488 | CG13: =+RC[-1]/RC[-2]-1 -> -0.17023387456351924 | CH13: =+RC[-2]/RC[-4]-1 -> 0.16958171614697592 | CI13: 1508 | CJ13: 1324 | CK13: =+RC[-1]/RC[-2]-1 -> -0.12201591511936338 | CL13: 1333806 | CM13: 1473333 | CN13: 1769924 | CO13: =+RC[-1]/RC[-2]-1 -> 0.20130615414166386 | CP13: =+RC[-2]/RC[-4]-1 -> 0.32697258821747699 | CQ13: 1143 | CR13: 965 | CS13: =+RC[-1]/RC[-2]-1 -> -0.1557305336832896 | CT13: 2769735 | CU13: 2722033 | CV13: 3386057 | CW13: =+RC[-1]/RC[-2]-1 -> 0.24394414028044475 | CX13: =+RC[-2]/RC[-4]-1 -> 0.22252020500156156 | CY13: 1134 | CZ13: 1210 | DA13: =+RC[-1]/RC[-2]-1 -> 6.7019400352733793E-2 | DB13: 0 | DC13: 0 | DD13: 0 | DE13: =+RC[-1]/RC[-2]-1 -> #DIV/0! | DF13: =+RC[-2]/RC[-4]-1 -> #DIV/0! | DG13: 0 | DH13: 0 | DI13: =+RC[-1]/RC[-2]-1 -> #DIV/0! | DJ13: 0 | DK13: 0 | DL13: 0 | DM13: =+RC[-1]/RC[-2]-1 -> #DIV/0! | DN13: =+RC[-2]/RC[-4]-1 -> #DIV/0! | DO13: 0 | DP13: 0 | DQ13: =+RC[-1]/RC[-2]-1 -> #DIV/0! | DR13: 1758124 | DS13: 1900000 | DT13: 1506590 | DU13: =+RC[-1]/RC[-2]-1 -> -0.20705789473684211 | DV13: =+RC[-2]/RC[-4]-1 -> -0.14306954458274845 | DW13: 1528 | DX13: 1615 | DY13: =+RC[-1]/RC[-2]-1 -> 5.6937172774869094E-2 | DZ13: 1636115 | EA13: 1500000 | EB13: 1549344 | EC13: =+RC[-1]/RC[-2]-1 -> 3.2896000000000036E-2 | ED13: =+RC[-2]/RC[-4]-1 -> -5.3034780562491002E-2 | EE13: 1012 | EF13: 1182 | EG13: =+RC[-1]/RC[-2]-1 -> 0.16798418972332008 | EH13: 3580768 | EI13: 3564723 | EJ13: 3273252 | EK13: =+RC[-1]/RC[-2]-1 -> -8.1765399443378906E-2 | EL13: =+RC[-2]/RC[-4]-1 -> -8.5879900624670436E-2 | EM13: 2239 | EN13: 2898 | EO13: =+RC[-1]/RC[-2]-1 -> 0.29432782492184018 | EP13: 2655754 | EQ13: 3042115 | ER13: 4093334 | ES13: =+RC[-1]/RC[-2]-1 -> 0.34555531266898187 | ET13: =+RC[-2]/RC[-4]-1 -> 0.54130766629740545 | EU13: 1956 | EV13: 1580 | EW13: =+RC[-1]/RC[-2]-1 -> -0.19222903885480569 | EX13: 376505 | EY13: 348363 | EZ13: 179532 | FA13: =+RC[-1]/RC[-2]-1 -> -0.48464102100395279 | FB13: =+RC[-2]/RC[-4]-1 -> -0.52316171099985387 | FC13: 262 | FD13: 411 | FE13: =+RC[-1]/RC[-2]-1 -> 0.56870229007633588 | FF13: 3382715 | FG13: 2900000 | FH13: 2776547 | FI13: =+RC[-1]/RC[-2]-1 -> -4.2569999999999997E-2 | FJ13: =+RC[-2]/RC[-4]-1 -> -0.1791957052249451 | FK13: 1725 | FL13: 1893 | FM13: =+RC[-1]/RC[-2]-1 -> 9.7391304347826058E-2 | FN13: 636863 | FO13: 550000 | FP13: 278859 | FQ13: =+RC[-1]/RC[-2]-1 -> -0.4929836363636364 | FR13: =+RC[-2]/RC[-4]-1 -> -0.56213659766700219 | FS13: 446 | FT13: 699 | FU13: =+RC[-1]/RC[-2]-1 -> 0.56726457399103136 | FV13: 4135951 | FW13: 5200000 | FX13: 5509509 | FY13: =+RC[-1]/RC[-2]-1 -> 5.9520961538461536E-2 | FZ13: =+RC[-2]/RC[-4]-1 -> 0.33210209695424342 | GA13: 1876 | GB13: 1763 | GC13: =+RC[-1]/RC[-2]-1 -> -6.0234541577825151E-2 | GD13: 0 | GE13: 160000 | GF13: 0 | GG13: =+RC[-1]/RC[-2]-1 -> -1 | GH13: =+RC[-2]/RC[-4]-1 -> #DIV/0! | GI13: 0 | GJ13: 0 | GK13: =+RC[-1]/RC[-2]-1 -> #DIV/0! | GL13: 3897911 | GM13: 3700000 | GN13: 4003643 | GO13: =+RC[-1]/RC[-2]-1 -> 8.2065675675675687E-2 | GP13: =+RC[-2]/RC[-4]-1 -> 2.7125298653560836E-2 | GQ13: 2783 | GR13: 2543 | GS13: =+RC[-1]/RC[-2]-1 -> -8.6237872799137638E-2 | GT13: 1126323 | GU13: 1200000 | GV13: 898085 | GW13: =+RC[-1]/RC[-2]-1 -> -0.25159583333333335 | GX13: =+RC[-2]/RC[-4]-1 -> -0.20263991767903167 | GY13: 831 | GZ13: 1004 | HA13: =+RC[-1]/RC[-2]-1 -> 0.20818291215403129 | HB13: 2418644 | HC13: 2336385 | HD13: 1991719 | HE13: =+RC[-1]/RC[-2]-1 -> -0.14752106352334915 | HF13: =+RC[-2]/RC[-4]-1 -> -0.17651419555751069 | HG13: 1111 | HH13: 1318 | HI13: =+RC[-1]/RC[-2]-1 -> 0.18631863186318642 | HJ13: 1858639 | HK13: 1996071 | HL13: 1953265 | HM13: =+RC[-1]/RC[-2]-1 -> -2.1445128955833725E-2 | HN13: =+RC[-2]/RC[-4]-1 -> 5.0911446493913104E-2 | HO13: 1430 | HP13: 1363 | HQ13: =+RC[-1]/RC[-2]-1 -> -4.6853146853146899E-2 | HR13: 1304876 | HS13: 1999980 | HT13: 1808858 | HU13: =+RC[-1]/RC[-2]-1 -> -9.556195561955616E-2 | HV13: =+RC[-2]/RC[-4]-1 -> 0.38622980267856866 | HW13: 1520 | HX13: 1372 | HY13: =+RC[-1]/RC[-2]-1 -> -9.7368421052631549E-2 | HZ13: 2057046 | IA13: 2355000 | IB13: 2332969 | IC13: =+RC[-1]/RC[-2]-1 -> -9.3549893842886922E-3 | ID13: =+RC[-2]/RC[-4]-1 -> 0.13413555166000179 | IE13: 1321 | IF13: 1338 | IG13: =+RC[-1]/RC[-2]-1 -> 1.2869038607115746E-2 | IH13: 878271 | II13: 1185389 | IJ13: 1038178 | IK13: =+RC[-1]/RC[-2]-1 -> -0.12418792480780572 | IL13: =+RC[-2]/RC[-4]-1 -> 0.18207022661570282 | IM13: 689 | IN13: 707 | IO13: =+RC[-1]/RC[-2]-1 -> 2.6124818577648812E-2
A14: 10.01.2016 | B14: 76361493 | C14: 70469395 | D14: 70164923 | E14: =+RC[-1]/RC[-2]-1 -> -4.3206274156319946E-3 | F14: =+RC[-2]/RC[-4]-1 -> -8.1147837169710635E-2 | G14: 40243 | H14: 41182 | I14: =+RC[-1]/RC[-2]-1 -> 2.3333250503193126E-2 | J14: 0 | K14: 1181979 | L14: 860857 | M14: =+RC[-1]/RC[-2]-1 -> -0.27168164578220089 | N14: =+RC[-2]/RC[-4]-1 -> #DIV/0! | O14: 935 | P14: 0 | Q14: =+RC[-1]/RC[-2]-1 -> -1 | R14: 408049 | S14: 555967 | T14: 487437 | U14: =+RC[-1]/RC[-2]-1 -> -0.12326271163576252 | V14: =+RC[-2]/RC[-4]-1 -> 0.19455506569064007 | W14: 550 | X14: 443 | Y14: =+RC[-1]/RC[-2]-1 -> -0.19454545454545458 | Z14: 0 | AA14: 950000 | AB14: 539791 | AC14: =+RC[-1]/RC[-2]-1 -> -0.43179894736842106 | AD14: =+RC[-2]/RC[-4]-1 -> #DIV/0! | AE14: 281 | AF14: 0 | AG14: =+RC[-1]/RC[-2]-1 -> -1 | AH14: 1794542 | AI14: 2790244 | AJ14: 3116578 | AK14: =+RC[-1]/RC[-2]-1 -> 0.11695536304351872 | AL14: =+RC[-2]/RC[-4]-1 -> 0.73669827733204341 | AM14: 2863 | AN14: 1676 | AO14: =+RC[-1]/RC[-2]-1 -> -0.41460006985679354 | AP14: 10585525 | AQ14: 8089530 | AR14: 9294426 | AS14: =+RC[-1]/RC[-2]-1 -> 0.14894511794875598 | AT14: =+RC[-2]/RC[-4]-1 -> -0.1219683482869296 | AU14: 4905 | AV14: 5307 | AW14: =+RC[-1]/RC[-2]-1 -> 8.1957186544342475E-2 | AX14: 5250691 | AY14: 5232554 | AZ14: 6321606 | BA14: =+RC[-1]/RC[-2]-1 -> 0.20813010243181429 | BB14: =+RC[-2]/RC[-4]-1 -> 0.20395696490233384 | BC14: 3067 | BD14: 2749 | BE14: =+RC[-1]/RC[-2]-1 -> -0.10368438213237696 | BF14: 1396354 | BG14: 1244651 | BH14: 1198815 | BI14: =+RC[-1]/RC[-2]-1 -> -3.6826387477292832E-2 | BJ14: =+RC[-2]/RC[-4]-1 -> -0.141467708045381 | BK14: 792 | BL14: 973 | BM14: =+RC[-1]/RC[-2]-1 -> 0.22853535353535359 | BN14: 1483443 | BO14: 1200000 | BP14: 1072070 | BQ14: =+RC[-1]/RC[-2]-1 -> -0.1066083333333333 | BR14: =+RC[-2]/RC[-4]-1 -> -0.27730961014342981 | BS14: 1480 | BT14: 1792 | BU14: =+RC[-1]/RC[-2]-1 -> 0.21081081081081088 | BV14: 11330117 | BW14: 10764692 | BX14: 10040838 | BY14: =+RC[-1]/RC[-2]-1 -> -6.7243354477768635E-2 | BZ14: =+RC[-2]/RC[-4]-1 -> -0.11379220532321066 | CA14: 2426 | CB14: 2601 | CC14: =+RC[-1]/RC[-2]-1 -> 7.2135201978565489E-2 | CD14: 2462885 | CE14: 2541063 | CF14: 2010062 | CG14: =+RC[-1]/RC[-2]-1 -> -0.20896805785610195 | CH14: =+RC[-2]/RC[-4]-1 -> -0.18385876725872297 | CI14: 1440 | CJ14: 1426 | CK14: =+RC[-1]/RC[-2]-1 -> -9.7222222222221877E-3 | CL14: 1805676 | CM14: 1386667 | CN14: 1643725 | CO14: =+RC[-1]/RC[-2]-1 -> 0.18537832082251904 | CP14: =+RC[-2]/RC[-4]-1 -> -8.9689955451587089E-2 | CQ14: 1061 | CR14: 1067 | CS14: =+RC[-1]/RC[-2]-1 -> 5.655042412818112E-3 | CT14: 3315618 | CU14: 2722033 | CV14: 3047587 | CW14: =+RC[-1]/RC[-2]-1 -> 0.11959957869724569 | CX14: =+RC[-2]/RC[-4]-1 -> -8.0838926559090973E-2 | CY14: 1055 | CZ14: 1144 | DA14: =+RC[-1]/RC[-2]-1 -> 8.436018957345981E-2 | DB14: 0 | DC14: 0 | DD14: 0 | DE14: =+RC[-1]/RC[-2]-1 -> #DIV/0! | DF14: =+RC[-2]/RC[-4]-1 -> #DIV/0! | DG14: 0 | DH14: 0 | DI14: =+RC[-1]/RC[-2]-1 -> #DIV/0! | DJ14: 0 | DK14: 0 | DL14: 0 | DM14: =+RC[-1]/RC[-2]-1 -> #DIV/0! | DN14: =+RC[-2]/RC[-4]-1 -> #DIV/0! | DO14: 0 | DP14: 0 | DQ14: =+RC[-1]/RC[-2]-1 -> #DIV/0! | DR14: 2129314 | DS14: 1900000 | DT14: 1264502 | DU14: =+RC[-1]/RC[-2]-1 -> -0.33447263157894735 | DV14: =+RC[-2]/RC[-4]-1 -> -0.40614582912618802 | DW14: 1353 | DX14: 1948 | DY14: =+RC[-1]/RC[-2]-1 -> 0.43976348854397629 | DZ14: 1847446 | EA14: 1450000 | EB14: 1364843 | EC14: =+RC[-1]/RC[-2]-1 -> -5.8728965517241383E-2 | ED14: =+RC[-2]/RC[-4]-1 -> -0.26122712111747781 | EE14: 903 | EF14: 1192 | EG14: =+RC[-1]/RC[-2]-1 -> 0.3200442967884829 | EH14: 3399981 | EI14: 3355033 | EJ14: 2809371 | EK14: =+RC[-1]/RC[-2]-1 -> -0.16263983096440482 | EL14: =+RC[-2]/RC[-4]-1 -> -0.17370979426061495 | EM14: 1935 | EN14: 2294 | EO14: =+RC[-1]/RC[-2]-1 -> 0.18552971576227395 | EP14: 3103732 | EQ14: 2857744 | ER14: 3980162 | ES14: =+RC[-1]/RC[-2]-1 -> 0.39276366252540473 | ET14: =+RC[-2]/RC[-4]-1 -> 0.28237940646937298 | EU14: 2045 | EV14: 1635 | EW14: =+RC[-1]/RC[-2]-1 -> -0.20048899755501226 | EX14: 432338 | EY14: 342430 | EZ14: 129593 | FA14: =+RC[-1]/RC[-2]-1 -> -0.62154892970826148 | FB14: =+RC[-2]/RC[-4]-1 -> -0.70025072975310976 | FC14: 236 | FD14: 439 | FE14: =+RC[-1]/RC[-2]-1 -> 0.86016949152542366 | FF14: 3497894 | FG14: 2500000 | FH14: 2510574 | FI14: =+RC[-1]/RC[-2]-1 -> 4.2295999999999445E-3 | FJ14: =+RC[-2]/RC[-4]-1 -> -0.28226126920941574 | FK14: 1634 | FL14: 1916 | FM14: =+RC[-1]/RC[-2]-1 -> 0.1725826193390454 | FN14: 818551 | FO14: 550000 | FP14: 248044 | FQ14: =+RC[-1]/RC[-2]-1 -> -0.5490109090909091 | FR14: =+RC[-2]/RC[-4]-1 -> -0.69697184414899005 | FS14: 411 | FT14: 860 | FU14: =+RC[-1]/RC[-2]-1 -> 1.0924574209245743 | FV14: 5723611 | FW14: 4500000 | FX14: 5405997 | FY14: =+RC[-1]/RC[-2]-1 -> 0.2013326666666666 | FZ14: =+RC[-2]/RC[-4]-1 -> -5.5491891395134996E-2 | GA14: 1937 | GB14: 1812 | GC14: =+RC[-1]/RC[-2]-1 -> -6.4532782653587972E-2 | GD14: 0 | GE14: 180000 | GF14: 0 | GG14: =+RC[-1]/RC[-2]-1 -> -1 | GH14: =+RC[-2]/RC[-4]-1 -> #DIV/0! | GI14: 0 | GJ14: 0 | GK14: =+RC[-1]/RC[-2]-1 -> #DIV/0! | GL14: 4605872 | GM14: 4000000 | GN14: 3820035 | GO14: =+RC[-1]/RC[-2]-1 -> -4.4991250000000038E-2 | GP14: =+RC[-2]/RC[-4]-1 -> -0.17061633497413731 | GQ14: 2645 | GR14: 2796 | GS14: =+RC[-1]/RC[-2]-1 -> 5.7088846880907429E-2 | GT14: 1052759 | GU14: 1100000 | GV14: 745347 | GW14: =+RC[-1]/RC[-2]-1 -> -0.32241181818181819 | GX14: =+RC[-2]/RC[-4]-1 -> -0.2920060526673246 | GY14: 675 | GZ14: 912 | HA14: =+RC[-1]/RC[-2]-1 -> 0.35111111111111115 | HB14: 2825296 | HC14: 2227716 | HD14: 1614812 | HE14: =+RC[-1]/RC[-2]-1 -> -0.27512663194051667 | HF14: =+RC[-2]/RC[-4]-1 -> -0.42844501956609149 | HG14: 909 | HH14: 1337 | HI14: =+RC[-1]/RC[-2]-1 -> 0.47084708470847092 | HJ14: 2379099 | HK14: 1774286 | HL14: 1799045 | HM14: =+RC[-1]/RC[-2]-1 -> 1.3954345579010319E-2 | HN14: =+RC[-2]/RC[-4]-1 -> -0.24381246850173111 | HO14: 1349 | HP14: 1470 | HQ14: =+RC[-1]/RC[-2]-1 -> 8.9696071163825053E-2 | HR14: 1664622 | HS14: 1799982 | HT14: 1804601 | HU14: =+RC[-1]/RC[-2]-1 -> 2.5661367724787443E-3 | HV14: =+RC[-2]/RC[-4]-1 -> 8.4090562301831984E-2 | HW14: 1547 | HX14: 1571 | HY14: =+RC[-1]/RC[-2]-1 -> 1.5513897866838988E-2 | HZ14: 1917694 | IA14: 2285000 | IB14: 2082052 | IC14: =+RC[-1]/RC[-2]-1 -> -8.8817505470459523E-2 | ID14: =+RC[-2]/RC[-4]-1 -> 8.5706061551008572E-2 | IE14: 1191 | IF14: 1149 | IG14: =+RC[-1]/RC[-2]-1 -> -3.5264483627204024E-2 | IH14: 1130384 | II14: 987824 | IJ14: 952153 | IK14: =+RC[-1]/RC[-2]-1 -> -3.6110683684542955E-2 | IL14: =+RC[-2]/RC[-4]-1 -> -0.15767296777024442 | IM14: 618 | IN14: 673 | IO14: =+RC[-1]/RC[-2]-1 -> 8.8996763754045416E-2
A15: 11.01.2016 | B15: 71062263 | C15: 63641755 | D15: 61108667 | E15: =+RC[-1]/RC[-2]-1 -> -3.9802296464011677E-2 | F15: =+RC[-2]/RC[-4]-1 -> -0.14006866063356305 | G15: 39828 | H15: 39784 | I15: =+RC[-1]/RC[-2]-1 -> -1.1047504268354436E-3 | J15: 0 | K15: 752168 | L15: 660954 | M15: =+RC[-1]/RC[-2]-1 -> -0.12126812095170225 | N15: =+RC[-2]/RC[-4]-1 -> #DIV/0! | O15: 743 | P15: 0 | Q15: =+RC[-1]/RC[-2]-1 -> -1 | R15: 355896 | S15: 648628 | T15: 593495 | U15: =+RC[-1]/RC[-2]-1 -> -8.4999414148017038E-2 | V15: =+RC[-2]/RC[-4]-1 -> 0.66760795288511243 | W15: 684 | X15: 419 | Y15: =+RC[-1]/RC[-2]-1 -> -0.38742690058479534 | Z15: 0 | AA15: 800000 | AB15: 658623 | AC15: =+RC[-1]/RC[-2]-1 -> -0.17672125000000005 | AD15: =+RC[-2]/RC[-4]-1 -> #DIV/0! | AE15: 466 | AF15: 0 | AG15: =+RC[-1]/RC[-2]-1 -> -1 | AH15: 2373525 | AI15: 2046179 | AJ15: 2235556 | AK15: =+RC[-1]/RC[-2]-1 -> 9.2551531415384414E-2 | AL15: =+RC[-2]/RC[-4]-1 -> -5.8128311266997357E-2 | AM15: 2388 | AN15: 1797 | AO15: =+RC[-1]/RC[-2]-1 -> -0.24748743718592969 | AP15: 10553755 | AQ15: 6471624 | AR15: 7122509 | AS15: =+RC[-1]/RC[-2]-1 -> 0.10057521883224374 | AT15: =+RC[-2]/RC[-4]-1 -> -0.32512086930196882 | AU15: 3817 | AV15: 5439 | AW15: =+RC[-1]/RC[-2]-1 -> 0.42494105318312814 | AX15: 4895984 | AY15: 4395346 | AZ15: 4510606 | BA15: =+RC[-1]/RC[-2]-1 -> 2.6223191530314161E-2 | BB15: =+RC[-2]/RC[-4]-1 -> -7.8713084029686353E-2 | BC15: 2587 | BD15: 2715 | BE15: =+RC[-1]/RC[-2]-1 -> 4.9478160030923757E-2 | BF15: 1162350 | BG15: 1452093 | BH15: 1312306 | BI15: =+RC[-1]/RC[-2]-1 -> -9.6265872778120931E-2 | BJ15: =+RC[-2]/RC[-4]-1 -> 0.12901105518991707 | BK15: 1184 | BL15: 855 | BM15: =+RC[-1]/RC[-2]-1 -> -0.2778716216216216 | BN15: 1223999 | BO15: 1100000 | BP15: 798185 | BQ15: =+RC[-1]/RC[-2]-1 -> -0.27437727272727275 | BR15: =+RC[-2]/RC[-4]-1 -> -0.34788753912380643 | BS15: 1165 | BT15: 1635 | BU15: =+RC[-1]/RC[-2]-1 -> 0.40343347639484972 | BV15: 9337214 | BW15: 10252088 | BX15: 10248626 | BY15: =+RC[-1]/RC[-2]-1 -> -3.3768730818539705E-4 | BZ15: =+RC[-2]/RC[-4]-1 -> 9.7610700579423337E-2 | CA15: 2965 | CB15: 2431 | CC15: =+RC[-1]/RC[-2]-1 -> -0.18010118043844858 | CD15: 2149858 | CE15: 2494006 | CF15: 1946163 | CG15: =+RC[-1]/RC[-2]-1 -> -0.21966386608532618 | CH15: =+RC[-2]/RC[-4]-1 -> -9.4748118247809821E-2 | CI15: 1645 | CJ15: 1358 | CK15: =+RC[-1]/RC[-2]-1 -> -0.17446808510638301 | CL15: 1534183 | CM15: 1213333 | CN15: 1359611 | CO15: =+RC[-1]/RC[-2]-1 -> 0.12055882432934739 | CP15: =+RC[-2]/RC[-4]-1 -> -0.11378825081492883 | CQ15: 1057 | CR15: 1022 | CS15: =+RC[-1]/RC[-2]-1 -> -3.3112582781456901E-2 | CT15: 3388950 | CU15: 2419585 | CV15: 2634115 | CW15: =+RC[-1]/RC[-2]-1 -> 8.8663965101453357E-2 | CX15: =+RC[-2]/RC[-4]-1 -> -0.22273418020330782 | CY15: 1158 | CZ15: 1100 | DA15: =+RC[-1]/RC[-2]-1 -> -5.0086355785837644E-2 | DB15: 0 | DC15: 0 | DD15: 0 | DE15: =+RC[-1]/RC[-2]-1 -> #DIV/0! | DF15: =+RC[-2]/RC[-4]-1 -> #DIV/0! | DG15: 0 | DH15: 0 | DI15: =+RC[-1]/RC[-2]-1 -> #DIV/0! | DJ15: 0 | DK15: 0 | DL15: 0 | DM15: =+RC[-1]/RC[-2]-1 -> #DIV/0! | DN15: =+RC[-2]/RC[-4]-1 -> #DIV/0! | DO15: 0 | DP15: 0 | DQ15: =+RC[-1]/RC[-2]-1 -> #DIV/0! | DR15: 1973711 | DS15: 1800000 | DT15: 1076163 | DU15: =+RC[-1]/RC[-2]-1 -> -0.40213166666666667 | DV15: =+RC[-2]/RC[-4]-1 -> -0.45475148083990002 | DW15: 1183 | DX15: 1787 | DY15: =+RC[-1]/RC[-2]-1 -> 0.51056635672020279 | DZ15: 1553248 | EA15: 1500000 | EB15: 1472156 | EC15: =+RC[-1]/RC[-2]-1 -> -1.8562666666666616E-2 | ED15: =+RC[-2]/RC[-4]-1 -> -5.2208018294567227E-2 | EE15: 1071 | EF15: 1104 | EG15: =+RC[-1]/RC[-2]-1 -> 3.0812324929971879E-2 | EH15: 3148648 | EI15: 3721990 | EJ15: 3308802 | EK15: =+RC[-1]/RC[-2]-1 -> -0.11101265720756903 | EL15: =+RC[-2]/RC[-4]-1 -> 5.0864370993518593E-2 | EM15: 2865 | EN15: 2047 | EO15: =+RC[-1]/RC[-2]-1 -> -0.28551483420593371 | EP15: 3549065 | EQ15: 2489003 | ER15: 2863433 | ES15: =+RC[-1]/RC[-2]-1 -> 0.15043372788220832 | ET15: =+RC[-2]/RC[-4]-1 -> -0.19318665620381703 | EU15: 1776 | EV15: 1825 | EW15: =+RC[-1]/RC[-2]-1 -> 2.7590090090090058E-2 | EX15: 424242 | EY15: 308506 | EZ15: 115808 | FA15: =+RC[-1]/RC[-2]-1 -> -0.62461670113385148 | FB15: =+RC[-2]/RC[-4]-1 -> -0.72702372702372697 | FC15: 221 | FD15: 425 | FE15: =+RC[-1]/RC[-2]-1 -> 0.92307692307692313 | FF15: 3100103 | FG15: 2700000 | FH15: 2627723 | FI15: =+RC[-1]/RC[-2]-1 -> -2.6769259259259215E-2 | FJ15: =+RC[-2]/RC[-4]-1 -> -0.15237558235968285 | FK15: 1830 | FL15: 1716 | FM15: =+RC[-1]/RC[-2]-1 -> -6.2295081967213117E-2 | FN15: 722335 | FO15: 450000 | FP15: 206488 | FQ15: =+RC[-1]/RC[-2]-1 -> -0.54113777777777772 | FR15: =+RC[-2]/RC[-4]-1 -> -0.71413817688468639 | FS15: 348 | FT15: 818 | FU15: =+RC[-1]/RC[-2]-1 -> 1.3505747126436782 | FV15: 5528184 | FW15: 3600000 | FX15: 4171457 | FY15: =+RC[-1]/RC[-2]-1 -> 0.15873805555555554 | FZ15: =+RC[-2]/RC[-4]-1 -> -0.24542001496332244 | GA15: 1640 | GB15: 1984 | GC15: =+RC[-1]/RC[-2]-1 -> 0.20975609756097557 | GD15: 0 | GE15: 90000 | GF15: 0 | GG15: =+RC[-1]/RC[-2]-1 -> -1 | GH15: =+RC[-2]/RC[-4]-1 -> #DIV/0! | GI15: 0 | GJ15: 0 | GK15: =+RC[-1]/RC[-2]-1 -> #DIV/0! | GL15: 4421800 | GM15: 3000000 | GN15: 2514834 | GO15: =+RC[-1]/RC[-2]-1 -> -0.16172200000000003 | GP15: =+RC[-2]/RC[-4]-1 -> -0.43126464335790859 | GQ15: 2064 | GR15: 2810 | GS15: =+RC[-1]/RC[-2]-1 -> 0.36143410852713176 | GT15: 871498 | GU15: 900000 | GV15: 803034 | GW15: =+RC[-1]/RC[-2]-1 -> -0.10773999999999995 | GX15: =+RC[-2]/RC[-4]-1 -> -7.855898693972907E-2 | GY15: 804 | GZ15: 795 | HA15: =+RC[-1]/RC[-2]-1 -> -1.1194029850746245E-2 | HB15: 2536113 | HC15: 2309218 | HD15: 1746751 | HE15: =+RC[-1]/RC[-2]-1 -> -0.24357466467003119 | HF15: =+RC[-2]/RC[-4]-1 -> -0.31124874956281523 | HG15: 1051 | HH15: 1251 | HI15: =+RC[-1]/RC[-2]-1 -> 0.19029495718363454 | HJ15: 1858465 | HK15: 1885179 | HL15: 1776974 | HM15: =+RC[-1]/RC[-2]-1 -> -5.739773252301239E-2 | HN15: =+RC[-2]/RC[-4]-1 -> -4.3848552434401555E-2 | HO15: 1429 | HP15: 1245 | HQ15: =+RC[-1]/RC[-2]-1 -> -0.12876137158852341 | HR15: 1518788 | HS15: 1549985 | HT15: 1285898 | HU15: =+RC[-1]/RC[-2]-1 -> -0.17038035851959854 | HV15: =+RC[-2]/RC[-4]-1 -> -0.15333937323708113 | HW15: 1376 | HX15: 1547 | HY15: =+RC[-1]/RC[-2]-1 -> 0.12427325581395343 | HZ15: 2024384 | IA15: 2305000 | IB15: 2228549 | IC15: =+RC[-1]/RC[-2]-1 -> -3.3167462039045525E-2 | ID15: =+RC[-2]/RC[-4]-1 -> 0.10085290142581638 | IE15: 1579 | IF15: 1096 | IG15: =+RC[-1]/RC[-2]-1 -> -0.30588980367321095 | IH15: 855965 | II15: 987824 | IJ15: 829848 | IK15: =+RC[-1]/RC[-2]-1 -> -0.15992322518991242 | IL15: =+RC[-2]/RC[-4]-1 -> -3.0511761579036567E-2 | IM15: 732 | IN15: 563 | IO15: =+RC[-1]/RC[-2]-1 -> -0.23087431693989069
A16: 12.01.2016 | B16: 63253360 | C16: 63049942 | D16: 62740045 | E16: =+RC[-1]/RC[-2]-1 -> -4.91510364910408E-3 | F16: =+RC[-2]/RC[-4]-1 -> -8.1152210728410168E-3 | G16: 38686 | H16: 39288 | I16: =+RC[-1]/RC[-2]-1 -> 1.5561184924778981E-2 | J16: 0 | K16: 752168 | L16: 2057386 | M16: =+RC[-1]/RC[-2]-1 -> 1.7352745663202902 | N16: =+RC[-2]/RC[-4]-1 -> #DIV/0! | O16: 759 | P16: 0 | Q16: =+RC[-1]/RC[-2]-1 -> -1 | R16: 503428 | S16: 694958 | T16: 561033 | U16: =+RC[-1]/RC[-2]-1 -> -0.19270948747981897 | V16: =+RC[-2]/RC[-4]-1 -> 0.1144254987803619 | W16: 642 | X16: 560 | Y16: =+RC[-1]/RC[-2]-1 -> -0.12772585669781933 | Z16: 0 | AA16: 900000 | AB16: 542912 | AC16: =+RC[-1]/RC[-2]-1 -> -0.39676444444444448 | AD16: =+RC[-2]/RC[-4]-1 -> #DIV/0! | AE16: 405 | AF16: 0 | AG16: =+RC[-1]/RC[-2]-1 -> -1 | AH16: 1128413 | AI16: 2046179 | AJ16: 2325322 | AK16: =+RC[-1]/RC[-2]-1 -> 0.13642159361424389 | AL16: =+RC[-2]/RC[-4]-1 -> 1.0607011794440511 | AM16: 2243 | AN16: 1304 | AO16: =+RC[-1]/RC[-2]-1 -> -0.4186357556843513 | AP16: 8150618 | AQ16: 6471624 | AR16: 7090374 | AS16: =+RC[-1]/RC[-2]-1 -> 9.5609695495288305E-2 | AT16: =+RC[-2]/RC[-4]-1 -> -0.13008142450057159 | AU16: 3656 | AV16: 4406 | AW16: =+RC[-1]/RC[-2]-1 -> 0.2051422319474836 | AX16: 4093267 | AY16: 4499997 | AZ16: 4540463 | BA16: =+RC[-1]/RC[-2]-1 -> 8.9924504394114368E-3 | BB16: =+RC[-2]/RC[-4]-1 -> 0.10925160757898267 | BC16: 2742 | BD16: 2319 | BE16: =+RC[-1]/RC[-2]-1 -> -0.15426695842450766 | BF16: 1584281 | BG16: 1503953 | BH16: 1178827 | BI16: =+RC[-1]/RC[-2]-1 -> -0.21618095778259028 | BJ16: =+RC[-2]/RC[-4]-1 -> -0.25592303385573645 | BK16: 1088 | BL16: 1336 | BM16: =+RC[-1]/RC[-2]-1 -> 0.22794117647058831 | BN16: 1088922 | BO16: 1100000 | BP16: 946314 | BQ16: =+RC[-1]/RC[-2]-1 -> -0.13971454545454542 | BR16: =+RC[-2]/RC[-4]-1 -> -0.13096254828169507 | BS16: 1364 | BT16: 1436 | BU16: =+RC[-1]/RC[-2]-1 -> 5.2785923753665642E-2 | BV16: 9819547 | BW16: 9431921 | BX16: 9849967 | BY16: =+RC[-1]/RC[-2]-1 -> 4.43224662293078E-2 | BZ16: =+RC[-2]/RC[-4]-1 -> 3.0979025814530381E-3 | CA16: 2735 | CB16: 2985 | CC16: =+RC[-1]/RC[-2]-1 -> 9.1407678244972645E-2 | CD16: 2234079 | CE16: 2494006 | CF16: 2141109 | CG16: =+RC[-1]/RC[-2]-1 -> -0.14149805573843843 | CH16: =+RC[-2]/RC[-4]-1 -> -4.1614463946888169E-2 | CI16: 1510 | CJ16: 1481 | CK16: =+RC[-1]/RC[-2]-1 -> -1.9205298013244998E-2 | CL16: 1334274 | CM16: 1213333 | CN16: 1198854 | CO16: =+RC[-1]/RC[-2]-1 -> -1.1933245036605755E-2 | CP16: =+RC[-2]/RC[-4]-1 -> -0.10149339640883359 | CQ16: 962 | CR16: 1026 | CS16: =+RC[-1]/RC[-2]-1 -> 6.6528066528066532E-2 | CT16: 2841106 | CU16: 2419585 | CV16: 2600343 | CW16: =+RC[-1]/RC[-2]-1 -> 7.4706199616876523E-2 | CX16: =+RC[-2]/RC[-4]-1 -> -8.4742702313817198E-2 | CY16: 1169 | CZ16: 1212 | DA16: =+RC[-1]/RC[-2]-1 -> 3.678357570573132E-2 | DB16: 0 | DC16: 0 | DD16: 0 | DE16: =+RC[-1]/RC[-2]-1 -> #DIV/0! | DF16: =+RC[-2]/RC[-4]-1 -> #DIV/0! | DG16: 0 | DH16: 0 | DI16: =+RC[-1]/RC[-2]-1 -> #DIV/0! | DJ16: 0 | DK16: 0 | DL16: 0 | DM16: =+RC[-1]/RC[-2]-1 -> #DIV/0! | DN16: =+RC[-2]/RC[-4]-1 -> #DIV/0! | DO16: 0 | DP16: 0 | DQ16: =+RC[-1]/RC[-2]-1 -> #DIV/0! | DR16: 1747764 | DS16: 1800000 | DT16: 1090514 | DU16: =+RC[-1]/RC[-2]-1 -> -0.39415888888888884 | DV16: =+RC[-2]/RC[-4]-1 -> -0.37605191547600247 | DW16: 1214 | DX16: 1787 | DY16: =+RC[-1]/RC[-2]-1 -> 0.47199341021416807 | DZ16: 1571160 | EA16: 1500000 | EB16: 1288212 | EC16: =+RC[-1]/RC[-2]-1 -> -0.14119199999999998 | ED16: =+RC[-2]/RC[-4]-1 -> -0.18008859696020774 | EE16: 1018 | EF16: 1087 | EG16: =+RC[-1]/RC[-2]-1 -> 6.7779960707269105E-2 | EH16: 3263836 | EI16: 3721990 | EJ16: 3458900 | EK16: =+RC[-1]/RC[-2]-1 -> -7.0685305441443913E-2 | EL16: =+RC[-2]/RC[-4]-1 -> 5.9765257813198858E-2 | EM16: 2849 | EN16: 2893 | EO16: =+RC[-1]/RC[-2]-1 -> 1.5444015444015413E-2 | EP16: 2334992 | EQ16: 2489003 | ER16: 3644156 | ES16: =+RC[-1]/RC[-2]-1 -> 0.46410269493447776 | ET16: =+RC[-2]/RC[-4]-1 -> 0.56067172821148858 | EU16: 1886 | EV16: 1596 | EW16: =+RC[-1]/RC[-2]-1 -> -0.1537645811240721 | EX16: 395430 | EY16: 308506 | EZ16: 135178 | FA16: =+RC[-1]/RC[-2]-1 -> -0.56183023993050374 | FB16: =+RC[-2]/RC[-4]-1 -> -0.65814935639683381 | FC16: 209 | FD16: 441 | FE16: =+RC[-1]/RC[-2]-1 -> 1.1100478468899522 | FF16: 3035794 | FG16: 2700000 | FH16: 2730464 | FI16: =+RC[-1]/RC[-2]-1 -> 1.1282962962962939E-2 | FJ16: =+RC[-2]/RC[-4]-1 -> -0.1005766530930623 | FK16: 1754 | FL16: 1913 | FM16: =+RC[-1]/RC[-2]-1 -> 9.064994298745721E-2 | FN16: 506279 | FO16: 450000 | FP16: 167800 | FQ16: =+RC[-1]/RC[-2]-1 -> -0.62711111111111117 | FR16: =+RC[-2]/RC[-4]-1 -> -0.66856219594334343 | FS16: 333 | FT16: 650 | FU16: =+RC[-1]/RC[-2]-1 -> 0.95195195195195192 | FV16: 3830153 | FW16: 3700000 | FX16: 4148558 | FY16: =+RC[-1]/RC[-2]-1 -> 0.12123189189189199 | FZ16: =+RC[-2]/RC[-4]-1 -> 8.3131143847256173E-2 | GA16: 1716 | GB16: 1615 | GC16: =+RC[-1]/RC[-2]-1 -> -5.8857808857808891E-2 | GD16: 0 | GE16: 0 | GF16: 0 | GG16: =+RC[-1]/RC[-2]-1 -> #DIV/0! | GH16: =+RC[-2]/RC[-4]-1 -> #DIV/0! | GI16: 0 | GJ16: 0 | GK16: =+RC[-1]/RC[-2]-1 -> #DIV/0! | GL16: 3669686 | GM16: 3000000 | GN16: 2574456 | GO16: =+RC[-1]/RC[-2]-1 -> -0.14184799999999997 | GP16: =+RC[-2]/RC[-4]-1 -> -0.29845332815941206 | GQ16: 1881 | GR16: 2193 | GS16: =+RC[-1]/RC[-2]-1 -> 0.1658692185007975 | GT16: 840502 | GU16: 900000 | GV16: 746541 | GW16: =+RC[-1]/RC[-2]-1 -> -0.17051000000000005 | GX16: =+RC[-2]/RC[-4]-1 -> -0.11179152458887665 | GY16: 772 | GZ16: 893 | HA16: =+RC[-1]/RC[-2]-1 -> 0.15673575129533668 | HB16: 2328726 | HC16: 2445054 | HD16: 1787418 | HE16: =+RC[-1]/RC[-2]-1 -> -0.26896583879129055 | HF16: =+RC[-2]/RC[-4]-1 -> -0.23244812828988903 | HG16: 951 | HH16: 1255 | HI16: =+RC[-1]/RC[-2]-1 -> 0.31966351209253419 | HJ16: 2760288 | HK16: 1996071 | HL16: 1870954 | HM16: =+RC[-1]/RC[-2]-1 -> -6.2681638078004198E-2 | HN16: =+RC[-2]/RC[-4]-1 -> -0.32218884406264858 | HO16: 1452 | HP16: 1450 | HQ16: =+RC[-1]/RC[-2]-1 -> -1.3774104683195176E-3 | HR16: 1143600 | HS16: 1199988 | HT16: 1116012 | HU16: =+RC[-1]/RC[-2]-1 -> -6.9980699806998059E-2 | HV16: =+RC[-2]/RC[-4]-1 -> -2.4123819517313794E-2 | HW16: 1233 | HX16: 1358 | HY16: =+RC[-1]/RC[-2]-1 -> 0.10137875101378757 | HZ16: 2075937 | IA16: 2225000 | IB16: 2038938 | IC16: =+RC[-1]/RC[-2]-1 -> -8.3623370786516826E-2 | ID16: =+RC[-2]/RC[-4]-1 -> -1.7822795200432395E-2 | IE16: 1381 | IF16: 1372 | IG16: =+RC[-1]/RC[-2]-1 -> -6.5170166545981401E-3 | IH16: 971278 | II16: 1086606 | IJ16: 909040 | IK16: =+RC[-1]/RC[-2]-1 -> -0.16341341755889438 | IL16: =+RC[-2]/RC[-4]-1 -> -6.4078461573308543E-2 | IM16: 762 | IN16: 720 | IO16: =+RC[-1]/RC[-2]-1 -> -5.5118110236220486E-2
A17: 13.01.2016 | B17: 63085394 | C17: 64201783 | D17: 64681870 | E17: =+RC[-1]/RC[-2]-1 -> 7.4777829768373216E-3 | F17: =+RC[-2]/RC[-4]-1 -> 2.5306586814691112E-2 | G17: 39404 | H17: 39042 | I17: =+RC[-1]/RC[-2]-1 -> -9.1868845802456356E-3 | J17: 0 | K17: 859621 | L17: 785614 | M17: =+RC[-1]/RC[-2]-1 -> -8.609259196785557E-2 | N17: =+RC[-2]/RC[-4]-1 -> #DIV/0! | O17: 733 | P17: 0 | Q17: =+RC[-1]/RC[-2]-1 -> -1 | R17: 528617 | S17: 694958 | T17: 653178 | U17: =+RC[-1]/RC[-2]-1 -> -6.0118740988664099E-2 | V17: =+RC[-2]/RC[-4]-1 -> 0.23563563033349277 | W17: 696 | X17: 563 | Y17: =+RC[-1]/RC[-2]-1 -> -0.19109195402298851 | Z17: 0 | AA17: 900000 | AB17: 677981 | AC17: =+RC[-1]/RC[-2]-1 -> -0.24668777777777773 | AD17: =+RC[-2]/RC[-4]-1 -> #DIV/0! | AE17: 416 | AF17: 0 | AG17: =+RC[-1]/RC[-2]-1 -> -1 | AH17: 1203052 | AI17: 2046179 | AJ17: 2472596 | AK17: =+RC[-1]/RC[-2]-1 -> 0.20839672384478591 | AL17: =+RC[-2]/RC[-4]-1 -> 1.0552694314127735 | AM17: 2391 | AN17: 1319 | AO17: =+RC[-1]/RC[-2]-1 -> -0.44834797156001671 | AP17: 8123563 | AQ17: 6471624 | AR17: 7356950 | AS17: =+RC[-1]/RC[-2]-1 -> 0.13680121094797837 | AT17: =+RC[-2]/RC[-4]-1 -> -9.4369059487813378E-2 | AU17: 3608 | AV17: 4313 | AW17: =+RC[-1]/RC[-2]-1 -> 0.19539911308203983 | AX17: 4237511 | AY17: 4499997 | AZ17: 4793290 | BA17: =+RC[-1]/RC[-2]-1 -> 6.5176265673066114E-2 | BB17: =+RC[-2]/RC[-4]-1 -> 0.1311569456692856 | BC17: 2502 | BD17: 2455 | BE17: =+RC[-1]/RC[-2]-1 -> -1.8784972022382052E-2 | BF17: 1632479 | BG17: 1607674 | BH17: 1460359 | BI17: =+RC[-1]/RC[-2]-1 -> -9.1632383182162602E-2 | BJ17: =+RC[-2]/RC[-4]-1 -> -0.10543474066128877 | BK17: 1169 | BL17: 1276 | BM17: =+RC[-1]/RC[-2]-1 -> 9.1531223267750317E-2 | BN17: 1103019 | BO17: 1200000 | BP17: 956761 | BQ17: =+RC[-1]/RC[-2]-1 -> -0.20269916666666665 | BR17: =+RC[-2]/RC[-4]-1 -> -0.13259789722570514 | BS17: 1239 | BT17: 1436 | BU17: =+RC[-1]/RC[-2]-1 -> 0.15899919289749809 | BV17: 9023734 | BW17: 9431921 | BX17: 10183578 | BY17: =+RC[-1]/RC[-2]-1 -> 7.9692885468400254E-2 | BZ17: =+RC[-2]/RC[-4]-1 -> 0.12853260080583051 | CA17: 3059 | CB17: 2892 | CC17: =+RC[-1]/RC[-2]-1 -> -5.4593004249754773E-2 | CD17: 2161096 | CE17: 2541063 | CF17: 1747364 | CG17: =+RC[-1]/RC[-2]-1 -> -0.31234920188913062 | CH17: =+RC[-2]/RC[-4]-1 -> -0.19144545175225902 | CI17: 1430 | CJ17: 1494 | CK17: =+RC[-1]/RC[-2]-1 -> 4.4755244755244838E-2 | CL17: 1329949 | CM17: 1213333 | CN17: 1762375 | CO17: =+RC[-1]/RC[-2]-1 -> 0.45250726717232626 | CP17: =+RC[-2]/RC[-4]-1 -> 0.32514479878551739 | CQ17: 1141 | CR17: 920 | CS17: =+RC[-1]/RC[-2]-1 -> -0.19368974583698506 | CT17: 2916389 | CU17: 2419585 | CV17: 2602102 | CW17: =+RC[-1]/RC[-2]-1 -> 7.5433183789782143E-2 | CX17: =+RC[-2]/RC[-4]-1 -> -0.10776580216150866 | CY17: 1098 | CZ17: 1262 | DA17: =+RC[-1]/RC[-2]-1 -> 0.14936247723132978 | DB17: 0 | DC17: 0 | DD17: 0 | DE17: =+RC[-1]/RC[-2]-1 -> #DIV/0! | DF17: =+RC[-2]/RC[-4]-1 -> #DIV/0! | DG17: 0 | DH17: 0 | DI17: =+RC[-1]/RC[-2]-1 -> #DIV/0! | DJ17: 0 | DK17: 0 | DL17: 0 | DM17: =+RC[-1]/RC[-2]-1 -> #DIV/0! | DN17: =+RC[-2]/RC[-4]-1 -> #DIV/0! | DO17: 0 | DP17: 0 | DQ17: =+RC[-1]/RC[-2]-1 -> #DIV/0! | DR17: 1902405 | DS17: 1800000 | DT17: 1065806 | DU17: =+RC[-1]/RC[-2]-1 -> -0.4078855555555555 | DV17: =+RC[-2]/RC[-4]-1 -> -0.43975862132406085 | DW17: 1033 | DX17: 1688 | DY17: =+RC[-1]/RC[-2]-1 -> 0.63407550822846082 | DZ17: 1669748 | EA17: 1500000 | EB17: 1609178 | EC17: =+RC[-1]/RC[-2]-1 -> 7.2785333333333257E-2 | ED17: =+RC[-2]/RC[-4]-1 -> -3.627493490035627E-2 | EE17: 1078 | EF17: 1155 | EG17: =+RC[-1]/RC[-2]-1 -> 7.1428571428571397E-2 | EH17: 3581366 | EI17: 3721990 | EJ17: 3623170 | EK17: =+RC[-1]/RC[-2]-1 -> -2.6550313138939075E-2 | EL17: =+RC[-2]/RC[-4]-1 -> 1.1672641109565562E-2 | EM17: 2846 | EN17: 2870 | EO17: =+RC[-1]/RC[-2]-1 -> 8.4328882642306091E-3 | EP17: 2653413 | EQ17: 2765559 | ER17: 3600440 | ES17: =+RC[-1]/RC[-2]-1 -> 0.30188508001456493 | ET17: =+RC[-2]/RC[-4]-1 -> 0.35690900738030606 | EU17: 1898 | EV17: 1612 | EW17: =+RC[-1]/RC[-2]-1 -> -0.15068493150684936 | EX17: 459612 | EY17: 308506 | EZ17: 171621 | FA17: =+RC[-1]/RC[-2]-1 -> -0.44370287773981709 | FB17: =+RC[-2]/RC[-4]-1 -> -0.62659591133390768 | FC17: 250 | FD17: 440 | FE17: =+RC[-1]/RC[-2]-1 -> 0.76 | FF17: 3059458 | FG17: 2700000 | FH17: 2591126 | FI17: =+RC[-1]/RC[-2]-1 -> -4.032370370370375E-2 | FJ17: =+RC[-2]/RC[-4]-1 -> -0.15307678680341419 | FK17: 1801 | FL17: 1915 | FM17: =+RC[-1]/RC[-2]-1 -> 6.32981676846196E-2 | FN17: 610172 | FO17: 450000 | FP17: 239398 | FQ17: =+RC[-1]/RC[-2]-1 -> -0.46800444444444445 | FR17: =+RC[-2]/RC[-4]-1 -> -0.60765489075211576 | FS17: 335 | FT17: 642 | FU17: =+RC[-1]/RC[-2]-1 -> 0.91641791044776122 | FV17: 3669222 | FW17: 3700000 | FX17: 4276729 | FY17: =+RC[-1]/RC[-2]-1 -> 0.1558727027027027 | FZ17: =+RC[-2]/RC[-4]-1 -> 0.16556834119058483 | GA17: 1766 | GB17: 1611 | GC17: =+RC[-1]/RC[-2]-1 -> -8.7768969422423515E-2 | GD17: 0 | GE17: 200000 | GF17: 0 | GG17: =+RC[-1]/RC[-2]-1 -> -1 | GH17: =+RC[-2]/RC[-4]-1 -> #DIV/0! | GI17: 0 | GJ17: 0 | GK17: =+RC[-1]/RC[-2]-1 -> #DIV/0! | GL17: 3503777 | GM17: 3200000 | GN17: 2585231 | GO17: =+RC[-1]/RC[-2]-1 -> -0.19211531250000002 | GP17: =+RC[-2]/RC[-4]-1 -> -0.26215880748118392 | GQ17: 1953 | GR17: 2153 | GS17: =+RC[-1]/RC[-2]-1 -> 0.1024065540194572 | GT17: 1157959 | GU17: 900000 | GV17: 838558 | GW17: =+RC[-1]/RC[-2]-1 -> -6.8268888888888934E-2 | GX17: =+RC[-2]/RC[-4]-1 -> -0.27583100956078754 | GY17: 804 | GZ17: 1030 | HA17: =+RC[-1]/RC[-2]-1 -> 0.28109452736318419 | HB17: 2487264 | HC17: 2499389 | HD17: 1827612 | HE17: =+RC[-1]/RC[-2]-1 -> -0.26877648897390527 | HF17: =+RC[-2]/RC[-4]-1 -> -0.26521189548033497 | HG17: 1068 | HH17: 1296 | HI17: =+RC[-1]/RC[-2]-1 -> 0.21348314606741581 | HJ17: 1848576 | HK17: 2106964 | HL17: 2073847 | HM17: =+RC[-1]/RC[-2]-1 -> -1.5717876527553409E-2 | HN17: =+RC[-2]/RC[-4]-1 -> 0.12186190884226566 | HO17: 1478 | HP17: 1332 | HQ17: =+RC[-1]/RC[-2]-1 -> -9.8782138024357202E-2 | HR17: 1218044 | HS17: 1299987 | HT17: 1313524 | HU17: =+RC[-1]/RC[-2]-1 -> 1.0413181054887533E-2 | HV17: =+RC[-2]/RC[-4]-1 -> 7.8387972848271481E-2 | HW17: 1305 | HX17: 1279 | HY17: =+RC[-1]/RC[-2]-1 -> -1.9923371647509569E-2 | HZ17: 1966260 | IA17: 2225000 | IB17: 2398567 | IC17: =+RC[-1]/RC[-2]-1 -> 7.8007640449438309E-2 | ID17: =+RC[-2]/RC[-4]-1 -> 0.21986258175419326 | IE17: 1515 | IF17: 1325 | IG17: =+RC[-1]/RC[-2]-1 -> -0.12541254125412538 | IH17: 1038709 | II17: 938433 | IJ17: 1014915 | IK17: =+RC[-1]/RC[-2]-1 -> 8.1499691507012306E-2 | IL17: =+RC[-2]/RC[-4]-1 -> -2.2907282020277142E-2 | IM17: 792 | IN17: 764 | IO17: =+RC[-1]/RC[-2]-1 -> -3.5353535353535359E-2
A18: 14.01.2016 | B18: 58658841 | C18: 64524685 | D18: 58938549 | E18: =+RC[-1]/RC[-2]-1 -> -8.6573626822044947E-2 | F18: =+RC[-2]/RC[-4]-1 -> 4.7683860647707021E-3 | G18: 37515 | H18: 38165 | I18: =+RC[-1]/RC[-2]-1 -> 1.7326402772224414E-2 | J18: 0 | K18: 859621 | L18: 732000 | M18: =+RC[-1]/RC[-2]-1 -> -0.14846193845892552 | N18: =+RC[-2]/RC[-4]-1 -> #DIV/0! | O18: 756 | P18: 0 | Q18: =+RC[-1]/RC[-2]-1 -> -1 | R18: 385060 | S18: 694958 | T18: 567422 | U18: =+RC[-1]/RC[-2]-1 -> -0.18351612615438628 | V18: =+RC[-2]/RC[-4]-1 -> 0.47359372565314506 | W18: 655 | X18: 516 | Y18: =+RC[-1]/RC[-2]-1 -> -0.21221374045801522 | Z18: 0 | AA18: 900000 | AB18: 560873 | AC18: =+RC[-1]/RC[-2]-1 -> -0.37680777777777774 | AD18: =+RC[-2]/RC[-4]-1 -> #DIV/0! | AE18: 401 | AF18: 0 | AG18: =+RC[-1]/RC[-2]-1 -> -1 | AH18: 1277787 | AI18: 2046179 | AJ18: 2257000 | AK18: =+RC[-1]/RC[-2]-1 -> 0.10303155295797684 | AL18: =+RC[-2]/RC[-4]-1 -> 0.76633507775552578 | AM18: 2275 | AN18: 1355 | AO18: =+RC[-1]/RC[-2]-1 -> -0.4043956043956044 | AP18: 6985625 | AQ18: 6471624 | AR18: 6875584 | AS18: =+RC[-1]/RC[-2]-1 -> 6.2420190048123825E-2 | AT18: =+RC[-2]/RC[-4]-1 -> -1.5752491724076223E-2 | AU18: 3712 | AV18: 4192 | AW18: =+RC[-1]/RC[-2]-1 -> 0.1293103448275863 | AX18: 4332401 | AY18: 4604648 | AZ18: 4562874 | BA18: =+RC[-1]/RC[-2]-1 -> -9.0721375444985375E-3 | BB18: =+RC[-2]/RC[-4]-1 -> 5.3197522574664813E-2 | BC18: 2464 | BD18: 2326 | BE18: =+RC[-1]/RC[-2]-1 -> -5.600649350649356E-2 | BF18: 1393760 | BG18: 1555814 | BH18: 1406670 | BI18: =+RC[-1]/RC[-2]-1 -> -9.5862358868090913E-2 | BJ18: =+RC[-2]/RC[-4]-1 -> 9.2627138101251116E-3 | BK18: 1093 | BL18: 1234 | BM18: =+RC[-1]/RC[-2]-1 -> 0.12900274473924966 | BN18: 1017442 | BO18: 1200000 | BP18: 841722 | BQ18: =+RC[-1]/RC[-2]-1 -> -0.29856499999999997 | BR18: =+RC[-2]/RC[-4]-1 -> -0.17270763345723883 | BS18: 1220 | BT18: 1338 | BU18: =+RC[-1]/RC[-2]-1 -> 9.6721311475409744E-2 | BV18: 8471374 | BW18: 9739484 | BX18: 9556691 | BY18: =+RC[-1]/RC[-2]-1 -> -1.8768242752901454E-2 | BZ18: =+RC[-2]/RC[-4]-1 -> 0.12811581686748807 | CA18: 2770 | CB18: 2941 | CC18: =+RC[-1]/RC[-2]-1 -> 6.1732851985559556E-2 | CD18: 1858312 | CE18: 2541063 | CF18: 1941643 | CG18: =+RC[-1]/RC[-2]-1 -> -0.23589340366610356 | CH18: =+RC[-2]/RC[-4]-1 -> 4.4842308503631356E-2 | CI18: 1437 | CJ18: 1347 | CK18: =+RC[-1]/RC[-2]-1 -> -6.2630480167014668E-2 | CL18: 1131211 | CM18: 1213333 | CN18: 1393198 | CO18: =+RC[-1]/RC[-2]-1 -> 0.14824042534077608 | CP18: =+RC[-2]/RC[-4]-1 -> 0.23159870262930604 | CQ18: 1018 | CR18: 991 | CS18: =+RC[-1]/RC[-2]-1 -> -2.6522593320235766E-2 | CT18: 3496568 | CU18: 2520401 | CV18: 2649658 | CW18: =+RC[-1]/RC[-2]-1 -> 5.1284299601531691E-2 | CX18: =+RC[-2]/RC[-4]-1 -> -0.24221179167686713 | CY18: 1132 | CZ18: 1302 | DA18: =+RC[-1]/RC[-2]-1 -> 0.15017667844522964 | DB18: 0 | DC18: 0 | DD18: 0 | DE18: =+RC[-1]/RC[-2]-1 -> #DIV/0! | DF18: =+RC[-2]/RC[-4]-1 -> #DIV/0! | DG18: 0 | DH18: 0 | DI18: =+RC[-1]/RC[-2]-1 -> #DIV/0! | DJ18: 0 | DK18: 0 | DL18: 0 | DM18: =+RC[-1]/RC[-2]-1 -> #DIV/0! | DN18: =+RC[-2]/RC[-4]-1 -> #DIV/0! | DO18: 0 | DP18: 0 | DQ18: =+RC[-1]/RC[-2]-1 -> #DIV/0! | DR18: 1556793 | DS18: 1800000 | DT18: 921107 | DU18: =+RC[-1]/RC[-2]-1 -> -0.4882738888888889 | DV18: =+RC[-2]/RC[-4]-1 -> -0.40833045883428309 | DW18: 929 | DX18: 1529 | DY18: =+RC[-1]/RC[-2]-1 -> 0.64585575888051672 | DZ18: 1327304 | EA18: 1500000 | EB18: 1475657 | EC18: =+RC[-1]/RC[-2]-1 -> -1.6228666666666669E-2 | ED18: =+RC[-2]/RC[-4]-1 -> 0.11177017473012962 | EE18: 1059 | EF18: 1115 | EG18: =+RC[-1]/RC[-2]-1 -> 5.2880075542965033E-2 | EH18: 3237069 | EI18: 3721990 | EJ18: 3174231 | EK18: =+RC[-1]/RC[-2]-1 -> -0.14716831587403512 | EL18: =+RC[-2]/RC[-4]-1 -> -1.9412005119445963E-2 | EM18: 2623 | EN18: 2756 | EO18: =+RC[-1]/RC[-2]-1 -> 5.0705299275638493E-2 | EP18: 2535948 | EQ18: 2857744 | ER18: 3044954 | ES18: =+RC[-1]/RC[-2]-1 -> 6.5509716755594694E-2 | ET18: =+RC[-2]/RC[-4]-1 -> 0.20071626074351689 | EU18: 1836 | EV18: 1622 | EW18: =+RC[-1]/RC[-2]-1 -> -0.11655773420479298 | EX18: 417554 | EY18: 308506 | EZ18: 112745 | FA18: =+RC[-1]/RC[-2]-1 -> -0.63454519523121111 | FB18: =+RC[-2]/RC[-4]-1 -> -0.7299870196429683 | FC18: 195 | FD18: 420 | FE18: =+RC[-1]/RC[-2]-1 -> 1.1538461538461537 | FF18: 3438800 | FG18: 2700000 | FH18: 2221949 | FI18: =+RC[-1]/RC[-2]-1 -> -0.17705592592592589 | FJ18: =+RC[-2]/RC[-4]-1 -> -0.35385919506804697 | FK18: 1635 | FL18: 1924 | FM18: =+RC[-1]/RC[-2]-1 -> 0.17675840978593271 | FN18: 495648 | FO18: 450000 | FP18: 167084 | FQ18: =+RC[-1]/RC[-2]-1 -> -0.62870222222222227 | FR18: =+RC[-2]/RC[-4]-1 -> -0.66289786299954812 | FS18: 320 | FT18: 644 | FU18: =+RC[-1]/RC[-2]-1 -> 1.0125000000000002 | FV18: 3628258 | FW18: 3900000 | FX18: 3364809 | FY18: =+RC[-1]/RC[-2]-1 -> -0.13722846153846158 | FZ18: =+RC[-2]/RC[-4]-1 -> -7.261032704950976E-2 | GA18: 1636 | GB18: 1659 | GC18: =+RC[-1]/RC[-2]-1 -> 1.4058679706601573E-2 | GD18: 0 | GE18: 200000 | GF18: 0 | GG18: =+RC[-1]/RC[-2]-1 -> -1 | GH18: =+RC[-2]/RC[-4]-1 -> #DIV/0! | GI18: 0 | GJ18: 0 | GK18: =+RC[-1]/RC[-2]-1 -> #DIV/0! | GL18: 2989756 | GM18: 3500000 | GN18: 2739842 | GO18: =+RC[-1]/RC[-2]-1 -> -0.21718800000000005 | GP18: =+RC[-2]/RC[-4]-1 -> -8.3590098991355832E-2 | GQ18: 1806 | GR18: 2042 | GS18: =+RC[-1]/RC[-2]-1 -> 0.13067552602436328 | GT18: 900141 | GU18: 900000 | GV18: 652181 | GW18: =+RC[-1]/RC[-2]-1 -> -0.27535444444444446 | GX18: =+RC[-2]/RC[-4]-1 -> -0.27546795446491157 | GY18: 728 | GZ18: 916 | HA18: =+RC[-1]/RC[-2]-1 -> 0.25824175824175821 | HB18: 2120494 | HC18: 2390719 | HD18: 1829467 | HE18: =+RC[-1]/RC[-2]-1 -> -0.23476284749483312 | HF18: =+RC[-2]/RC[-4]-1 -> -0.13724490613979567 | HG18: 1008 | HH18: 1208 | HI18: =+RC[-1]/RC[-2]-1 -> 0.19841269841269837 | HJ18: 1872636 | HK18: 1885179 | HL18: 1716847 | HM18: =+RC[-1]/RC[-2]-1 -> -8.929231653864167E-2 | HN18: =+RC[-2]/RC[-4]-1 -> -8.3192355588592726E-2 | HO18: 1407 | HP18: 1419 | HQ18: =+RC[-1]/RC[-2]-1 -> 8.5287846481876262E-3 | HR18: 1063564 | HS18: 1099989 | HT18: 1189648 | HU18: =+RC[-1]/RC[-2]-1 -> 8.1508996908150833E-2 | HV18: =+RC[-2]/RC[-4]-1 -> 0.11854857817677167 | HW18: 1252 | HX18: 1350 | HY18: =+RC[-1]/RC[-2]-1 -> 7.8274760383386655E-2 | HZ18: 1857277 | IA18: 2025000 | IB18: 2034824 | IC18: =+RC[-1]/RC[-2]-1 -> 4.8513580246913879E-3 | ID18: =+RC[-2]/RC[-4]-1 -> 9.5595325845310164E-2 | IE18: 1401 | IF18: 1301 | IG18: =+RC[-1]/RC[-2]-1 -> -7.1377587437544632E-2 | IH18: 868059 | II18: 938433 | IJ18: 947869 | IK18: =+RC[-1]/RC[-2]-1 -> 1.0055059871082905E-2 | IL18: =+RC[-2]/RC[-4]-1 -> 9.19407551790834E-2 | IM18: 747 | IN18: 718 | IO18: =+RC[-1]/RC[-2]-1 -> -3.8821954484605126E-2
A19: 15.01.2016 | B19: 58130847 | C19: 66899116 | D19: 64397433 | E19: =+RC[-1]/RC[-2]-1 -> -3.7394858849853829E-2 | F19: =+RC[-2]/RC[-4]-1 -> 0.10780138813391105 | G19: 39633 | H19: 37845 | I19: =+RC[-1]/RC[-2]-1 -> -4.5113920218000203E-2 | J19: 0 | K19: 859621 | L19: 655830 | M19: =+RC[-1]/RC[-2]-1 -> -0.23707075560043323 | N19: =+RC[-2]/RC[-4]-1 -> #DIV/0! | O19: 773 | P19: 0 | Q19: =+RC[-1]/RC[-2]-1 -> -1 | R19: 466026 | S19: 694958 | T19: 614500 | U19: =+RC[-1]/RC[-2]-1 -> -0.11577390288333966 | V19: =+RC[-2]/RC[-4]-1 -> 0.3185959581654243 | W19: 711 | X19: 519 | Y19: =+RC[-1]/RC[-2]-1 -> -0.27004219409282704 | Z19: 0 | AA19: 950000 | AB19: 641887 | AC19: =+RC[-1]/RC[-2]-1 -> -0.3243294736842105 | AD19: =+RC[-2]/RC[-4]-1 -> #DIV/0! | AE19: 387 | AF19: 0 | AG19: =+RC[-1]/RC[-2]-1 -> -1 | AH19: 1366657 | AI19: 2232195 | AJ19: 2625149 | AK19: =+RC[-1]/RC[-2]-1 -> 0.17603927972242572 | AL19: =+RC[-2]/RC[-4]-1 -> 0.92085431823786079 | AM19: 2413 | AN19: 1340 | AO19: =+RC[-1]/RC[-2]-1 -> -0.4446746788230419 | AP19: 7183207 | AQ19: 6661966 | AR19: 7943592 | AS19: =+RC[-1]/RC[-2]-1 -> 0.1923795468184617 | AT19: =+RC[-2]/RC[-4]-1 -> 0.10585592201366323 | AU19: 3912 | AV19: 4194 | AW19: =+RC[-1]/RC[-2]-1 -> 7.2085889570552064E-2 | AX19: 3989646 | AY19: 4656973 | AZ19: 4742623 | BA19: =+RC[-1]/RC[-2]-1 -> 1.839177508652079E-2 | BB19: =+RC[-2]/RC[-4]-1 -> 0.18873278481348965 | BC19: 2644 | BD19: 2402 | BE19: =+RC[-1]/RC[-2]-1 -> -9.1527987897125573E-2 | BF19: 1278375 | BG19: 1555814 | BH19: 1402202 | BI19: =+RC[-1]/RC[-2]-1 -> -9.873416745189334E-2 | BJ19: =+RC[-2]/RC[-4]-1 -> 9.6862814119487606E-2 | BK19: 1115 | BL19: 1173 | BM19: =+RC[-1]/RC[-2]-1 -> 5.2017937219730914E-2 | BN19: 1069458 | BO19: 1300000 | BP19: 827296 | BQ19: =+RC[-1]/RC[-2]-1 -> -0.36361846153846156 | BR19: =+RC[-2]/RC[-4]-1 -> -0.22643432467661184 | BS19: 1249 | BT19: 1414 | BU19: =+RC[-1]/RC[-2]-1 -> 0.13210568454763805 | BV19: 8787195 | BW19: 10252088 | BX19: 10284670 | BY19: =+RC[-1]/RC[-2]-1 -> 3.1780843082891419E-3 | BZ19: =+RC[-2]/RC[-4]-1 -> 0.1704155876818485 | CA19: 2863 | CB19: 2790 | CC19: =+RC[-1]/RC[-2]-1 -> -2.5497729654208823E-2 | CD19: 1915186 | CE19: 2635176 | CF19: 2149715 | CG19: =+RC[-1]/RC[-2]-1 -> -0.18422336876170697 | CH19: =+RC[-2]/RC[-4]-1 -> 0.12245755764714228 | CI19: 1598 | CJ19: 1365 | CK19: =+RC[-1]/RC[-2]-1 -> -0.14580725907384229 | CL19: 1184405 | CM19: 1300000 | CN19: 1531764 | CO19: =+RC[-1]/RC[-2]-1 -> 0.17827999999999999 | CP19: =+RC[-2]/RC[-4]-1 -> 0.29327721514177996 | CQ19: 970 | CR19: 967 | CS19: =+RC[-1]/RC[-2]-1 -> -3.0927835051546282E-3 | CT19: 2947980 | CU19: 2419585 | CV19: 2699376 | CW19: =+RC[-1]/RC[-2]-1 -> 0.11563594583368642 | CX19: =+RC[-2]/RC[-4]-1 -> -8.4330287179695929E-2 | CY19: 1117 | CZ19: 1256 | DA19: =+RC[-1]/RC[-2]-1 -> 0.12444046553267674 | DB19: 0 | DC19: 0 | DD19: 0 | DE19: =+RC[-1]/RC[-2]-1 -> #DIV/0! | DF19: =+RC[-2]/RC[-4]-1 -> #DIV/0! | DG19: 0 | DH19: 0 | DI19: =+RC[-1]/RC[-2]-1 -> #DIV/0! | DJ19: 0 | DK19: 0 | DL19: 0 | DM19: =+RC[-1]/RC[-2]-1 -> #DIV/0! | DN19: =+RC[-2]/RC[-4]-1 -> #DIV/0! | DO19: 0 | DP19: 0 | DQ19: =+RC[-1]/RC[-2]-1 -> #DIV/0! | DR19: 1399261 | DS19: 1800000 | DT19: 841353 | DU19: =+RC[-1]/RC[-2]-1 -> -0.53258166666666673 | DV19: =+RC[-2]/RC[-4]-1 -> -0.39871617946901972 | DW19: 1042 | DX19: 1504 | DY19: =+RC[-1]/RC[-2]-1 -> 0.44337811900191948 | DZ19: 1513416 | EA19: 1500000 | EB19: 1407572 | EC19: =+RC[-1]/RC[-2]-1 -> -6.161866666666671E-2 | ED19: =+RC[-2]/RC[-4]-1 -> -6.9937148807730276E-2 | EE19: 1052 | EF19: 1154 | EG19: =+RC[-1]/RC[-2]-1 -> 9.6958174904943073E-2 | EH19: 3307392 | EI19: 3984102 | EJ19: 3651846 | EK19: =+RC[-1]/RC[-2]-1 -> -8.3395455236838778E-2 | EL19: =+RC[-2]/RC[-4]-1 -> 0.10414671136653886 | EM19: 2785 | EN19: 2792 | EO19: =+RC[-1]/RC[-2]-1 -> 2.5134649910232287E-3 | EP19: 2338447 | EQ19: 2949930 | ER19: 3391249 | ES19: =+RC[-1]/RC[-2]-1 -> 0.14960321092364914 | ET19: =+RC[-2]/RC[-4]-1 -> 0.45021418060789919 | EU19: 1897 | EV19: 1624 | EW19: =+RC[-1]/RC[-2]-1 -> -0.14391143911439119 | EX19: 355754 | EY19: 342430 | EZ19: 198517 | FA19: =+RC[-1]/RC[-2]-1 -> -0.42026983617089619 | FB19: =+RC[-2]/RC[-4]-1 -> -0.4419823810835577 | FC19: 257 | FD19: 353 | FE19: =+RC[-1]/RC[-2]-1 -> 0.37354085603112841 | FF19: 2719959 | FG19: 2700000 | FH19: 2527129 | FI19: =+RC[-1]/RC[-2]-1 -> -6.4026296296296303E-2 | FJ19: =+RC[-2]/RC[-4]-1 -> -7.0894450982533219E-2 | FK19: 1679 | FL19: 1803 | FM19: =+RC[-1]/RC[-2]-1 -> 7.3853484216795717E-2 | FN19: 622263 | FO19: 450000 | FP19: 198830 | FQ19: =+RC[-1]/RC[-2]-1 -> -0.55815555555555552 | FR19: =+RC[-2]/RC[-4]-1 -> -0.68047272616241039 | FS19: 324 | FT19: 648 | FU19: =+RC[-1]/RC[-2]-1 -> 1 | FV19: 3771147 | FW19: 3800000 | FX19: 3798495 | FY19: =+RC[-1]/RC[-2]-1 -> -3.9605263157893589E-4 | FZ19: =+RC[-2]/RC[-4]-1 -> 7.2519050570025723E-3 | GA19: 1730 | GB19: 1765 | GC19: =+RC[-1]/RC[-2]-1 -> 2.0231213872832443E-2 | GD19: 0 | GE19: 85000 | GF19: 0 | GG19: =+RC[-1]/RC[-2]-1 -> -1 | GH19: =+RC[-2]/RC[-4]-1 -> #DIV/0! | GI19: 0 | GJ19: 0 | GK19: =+RC[-1]/RC[-2]-1 -> #DIV/0! | GL19: 2993649 | GM19: 3500000 | GN19: 2740727 | GO19: =+RC[-1]/RC[-2]-1 -> -0.21693514285714288 | GP19: =+RC[-2]/RC[-4]-1 -> -8.4486190598831112E-2 | GQ19: 2007 | GR19: 2032 | GS19: =+RC[-1]/RC[-2]-1 -> 1.2456402590931726E-2 | GT19: 896480 | GU19: 1200000 | GV19: 802400 | GW19: =+RC[-1]/RC[-2]-1 -> -0.33133333333333337 | GX19: =+RC[-2]/RC[-4]-1 -> -0.10494378011779404 | GY19: 851 | GZ19: 908 | HA19: =+RC[-1]/RC[-2]-1 -> 6.6980023501762576E-2 | HB19: 2476860 | HC19: 2390719 | HD19: 1815757 | HE19: =+RC[-1]/RC[-2]-1 -> -0.24049752396663937 | HF19: =+RC[-2]/RC[-4]-1 -> -0.26691173501933896 | HG19: 1083 | HH19: 1313 | HI19: =+RC[-1]/RC[-2]-1 -> 0.21237303785780237 | HJ19: 1938338 | HK19: 2106964 | HL19: 1939782 | HM19: =+RC[-1]/RC[-2]-1 -> -7.9347345279748516E-2 | HN19: =+RC[-2]/RC[-4]-1 -> 7.449681118567586E-4 | HO19: 1495 | HP19: 1346 | HQ19: =+RC[-1]/RC[-2]-1 -> -9.9665551839464905E-2 | HR19: 1011196 | HS19: 1099989 | HT19: 1601854 | HU19: =+RC[-1]/RC[-2]-1 -> 0.45624547154562456 | HV19: =+RC[-2]/RC[-4]-1 -> 0.58411821249292917 | HW19: 1399 | HX19: 1293 | HY19: =+RC[-1]/RC[-2]-1 -> -7.5768406004288802E-2 | HZ19: 1733390 | IA19: 2385000 | IB19: 2396653 | IC19: =+RC[-1]/RC[-2]-1 -> 4.8859538784067347E-3 | ID19: =+RC[-2]/RC[-4]-1 -> 0.38263922141006934 | IE19: 1499 | IF19: 1180 | IG19: =+RC[-1]/RC[-2]-1 -> -0.21280853902601737 | IH19: 865160 | II19: 1086606 | IJ19: 966665 | IK19: =+RC[-1]/RC[-2]-1 -> -0.1103813157667084 | IL19: =+RC[-2]/RC[-4]-1 -> 0.11732511905312304 | IM19: 781 | IN19: 710 | IO19: =+RC[-1]/RC[-2]-1 -> -9.0909090909090939E-2
A20: 16.01.2016 | B20: 65349786 | C20: 76286279 | D20: 80608073 | E20: =+RC[-1]/RC[-2]-1 -> 5.6652310961450958E-2 | F20: =+RC[-2]/RC[-4]-1 -> 0.23348641111081836 | G20: 42203 | H20: 39499 | I20: =+RC[-1]/RC[-2]-1 -> -6.4071274553941682E-2 | J20: 0 | K20: 1181979 | L20: 914972 | M20: =+RC[-1]/RC[-2]-1 -> -0.22589826045978822 | N20: =+RC[-2]/RC[-4]-1 -> #DIV/0! | O20: 909 | P20: 0 | Q20: =+RC[-1]/RC[-2]-1 -> -1 | R20: 524187 | S20: 741289 | T20: 640066 | U20: =+RC[-1]/RC[-2]-1 -> -0.13654998253043005 | V20: =+RC[-2]/RC[-4]-1 -> 0.22106423852556434 | W20: 647 | X20: 533 | Y20: =+RC[-1]/RC[-2]-1 -> -0.1761978361669243 | Z20: 0 | AA20: 950000 | AB20: 742696 | AC20: =+RC[-1]/RC[-2]-1 -> -0.21821473684210524 | AD20: =+RC[-2]/RC[-4]-1 -> #DIV/0! | AE20: 488 | AF20: 0 | AG20: =+RC[-1]/RC[-2]-1 -> -1 | AH20: 1392590 | AI20: 2883252 | AJ20: 3477331 | AK20: =+RC[-1]/RC[-2]-1 -> 0.20604477166754753 | AL20: =+RC[-2]/RC[-4]-1 -> 1.4970242497791886 | AM20: 2819 | AN20: 1354 | AO20: =+RC[-1]/RC[-2]-1 -> -0.51968783256473927 | AP20: 7944408 | AQ20: 9041239 | AR20: 10315491 | AS20: =+RC[-1]/RC[-2]-1 -> 0.14093776306543826 | AT20: =+RC[-2]/RC[-4]-1 -> 0.29845936915626692 | AU20: 4647 | AV20: 4372 | AW20: =+RC[-1]/RC[-2]-1 -> -5.9177964278028794E-2 | AX20: 4494864 | AY20: 5755810 | AZ20: 6578926 | BA20: =+RC[-1]/RC[-2]-1 -> 0.14300611034763144 | BB20: =+RC[-2]/RC[-4]-1 -> 0.46365407273723958 | BC20: 3094 | BD20: 2377 | BE20: =+RC[-1]/RC[-2]-1 -> -0.23173884938590816 | BF20: 1767997 | BG20: 1244651 | BH20: 1369454 | BI20: =+RC[-1]/RC[-2]-1 -> 0.10027148172459599 | BJ20: =+RC[-2]/RC[-4]-1 -> -0.22542063136984958 | BK20: 959 | BL20: 1322 | BM20: =+RC[-1]/RC[-2]-1 -> 0.37851929092805014 | BN20: 1128139 | BO20: 1300000 | BP20: 955483 | BQ20: =+RC[-1]/RC[-2]-1 -> -0.26501307692307696 | BR20: =+RC[-2]/RC[-4]-1 -> -0.15304497052224952 | BS20: 1385 | BT20: 1369 | BU20: =+RC[-1]/RC[-2]-1 -> -1.1552346570397165E-2 | BV20: 9882625 | BW20: 11789901 | BX20: 12877401 | BY20: =+RC[-1]/RC[-2]-1 -> 9.2239960284653755E-2 | BZ20: =+RC[-2]/RC[-4]-1 -> 0.30303446705708259 | CA20: 2827 | CB20: 2967 | CC20: =+RC[-1]/RC[-2]-1 -> 4.9522461973823928E-2 | CD20: 2453446 | CE20: 2635176 | CF20: 2519467 | CG20: =+RC[-1]/RC[-2]-1 -> -4.3909401117800062E-2 | CH20: =+RC[-2]/RC[-4]-1 -> 2.6909497906210333E-2 | CI20: 1644 | CJ20: 1513 | CK20: =+RC[-1]/RC[-2]-1 -> -7.9683698296836969E-2 | CL20: 1299998 | CM20: 1473333 | CN20: 1685459 | CO20: =+RC[-1]/RC[-2]-1 -> 0.14397695565089497 | CP20: =+RC[-2]/RC[-4]-1 -> 0.29650891770602716 | CQ20: 1129 | CR20: 999 | CS20: =+RC[-1]/RC[-2]-1 -> -0.11514614703277237 | CT20: 3077712 | CU20: 2419585 | CV20: 3633613 | CW20: =+RC[-1]/RC[-2]-1 -> 0.50175050680178623 | CX20: =+RC[-2]/RC[-4]-1 -> 0.18062151364390178 | CY20: 1163 | CZ20: 1255 | DA20: =+RC[-1]/RC[-2]-1 -> 7.9105760963026572E-2 | DB20: 0 | DC20: 0 | DD20: 0 | DE20: =+RC[-1]/RC[-2]-1 -> #DIV/0! | DF20: =+RC[-2]/RC[-4]-1 -> #DIV/0! | DG20: 0 | DH20: 0 | DI20: =+RC[-1]/RC[-2]-1 -> #DIV/0! | DJ20: 0 | DK20: 0 | DL20: 0 | DM20: =+RC[-1]/RC[-2]-1 -> #DIV/0! | DN20: =+RC[-2]/RC[-4]-1 -> #DIV/0! | DO20: 0 | DP20: 0 | DQ20: =+RC[-1]/RC[-2]-1 -> #DIV/0! | DR20: 1592724 | DS20: 1900000 | DT20: 1110024 | DU20: =+RC[-1]/RC[-2]-1 -> -0.41577684210526311 | DV20: =+RC[-2]/RC[-4]-1 -> -0.30306569123087235 | DW20: 1237 | DX20: 1668 | DY20: =+RC[-1]/RC[-2]-1 -> 0.34842360549717055 | DZ20: 1856936 | EA20: 1650000 | EB20: 1647354 | EC20: =+RC[-1]/RC[-2]-1 -> -1.6036363636363626E-3 | ED20: =+RC[-2]/RC[-4]-1 -> -0.11286441751358156 | EE20: 1037 | EF20: 1208 | EG20: =+RC[-1]/RC[-2]-1 -> 0.16489874638379942 | EH20: 3551596 | EI20: 3564723 | EJ20: 3784264 | EK20: =+RC[-1]/RC[-2]-1 -> 6.1587113500824575E-2 | EL20: =+RC[-2]/RC[-4]-1 -> 6.551082949749909E-2 | EM20: 2316 | EN20: 2848 | EO20: =+RC[-1]/RC[-2]-1 -> 0.22970639032815199 | EP20: 2864825 | EQ20: 2949930 | ER20: 4638165 | ES20: =+RC[-1]/RC[-2]-1 -> 0.5722966307675097 | ET20: =+RC[-2]/RC[-4]-1 -> 0.61900465124396775 | EU20: 2143 | EV20: 1582 | EW20: =+RC[-1]/RC[-2]-1 -> -0.26178254783014465 | EX20: 434625 | EY20: 348363 | EZ20: 144847 | FA20: =+RC[-1]/RC[-2]-1 -> -0.58420670392665119 | FB20: =+RC[-2]/RC[-4]-1 -> -0.66673109002013231 | FC20: 233 | FD20: 448 | FE20: =+RC[-1]/RC[-2]-1 -> 0.92274678111587982 | FF20: 2872155 | FG20: 2900000 | FH20: 2797867 | FI20: =+RC[-1]/RC[-2]-1 -> -3.5218275862068937E-2 | FJ20: =+RC[-2]/RC[-4]-1 -> -2.5864899352576742E-2 | FK20: 1737 | FL20: 1892 | FM20: =+RC[-1]/RC[-2]-1 -> 8.9234312032239416E-2 | FN20: 603834 | FO20: 500000 | FP20: 267349 | FQ20: =+RC[-1]/RC[-2]-1 -> -0.46530199999999999 | FR20: =+RC[-2]/RC[-4]-1 -> -0.55724752166986291 | FS20: 413 | FT20: 670 | FU20: =+RC[-1]/RC[-2]-1 -> 0.62227602905569013 | FV20: 3954025 | FW20: 6000000 | FX20: 6316593 | FY20: =+RC[-1]/RC[-2]-1 -> 5.2765500000000021E-2 | FZ20: =+RC[-2]/RC[-4]-1 -> 0.59750962626690529 | GA20: 1869 | GB20: 1749 | GC20: =+RC[-1]/RC[-2]-1 -> -6.4205457463884397E-2 | GD20: 0 | GE20: 160000 | GF20: 0 | GG20: =+RC[-1]/RC[-2]-1 -> -1 | GH20: =+RC[-2]/RC[-4]-1 -> #DIV/0! | GI20: 0 | GJ20: 0 | GK20: =+RC[-1]/RC[-2]-1 -> #DIV/0! | GL20: 3885188 | GM20: 4000000 | GN20: 3811800 | GO20: =+RC[-1]/RC[-2]-1 -> -4.7050000000000036E-2 | GP20: =+RC[-2]/RC[-4]-1 -> -1.8889176019281417E-2 | GQ20: 2535 | GR20: 2299 | GS20: =+RC[-1]/RC[-2]-1 -> -9.3096646942800843E-2 | GT20: 846241 | GU20: 1200000 | GV20: 917975 | GW20: =+RC[-1]/RC[-2]-1 -> -0.23502083333333335 | GX20: =+RC[-2]/RC[-4]-1 -> 8.4767814369665295E-2 | GY20: 871 | GZ20: 884 | HA20: =+RC[-1]/RC[-2]-1 -> 1.4925373134328401E-2 | HB20: 2401401 | HC20: 2336385 | HD20: 2143136 | HE20: =+RC[-1]/RC[-2]-1 -> -8.2712823443054084E-2 | HF20: =+RC[-2]/RC[-4]-1 -> -0.10754763573430681 | HG20: 1076 | HH20: 1310 | HI20: =+RC[-1]/RC[-2]-1 -> 0.21747211895910779 | HJ20: 2170741 | HK20: 2217857 | HL20: 2250330 | HM20: =+RC[-1]/RC[-2]-1 -> 1.4641611249057052E-2 | HN20: =+RC[-2]/RC[-4]-1 -> 3.6664438548864142E-2 | HO20: 1414 | HP20: 1438 | HQ20: =+RC[-1]/RC[-2]-1 -> 1.6973125884016893E-2 | HR20: 1264316 | HS20: 1799982 | HT20: 1620282 | HU20: =+RC[-1]/RC[-2]-1 -> -9.9834331676650123E-2 | HV20: =+RC[-2]/RC[-4]-1 -> 0.2815482838151222 | HW20: 1489 | HX20: 1314 | HY20: =+RC[-1]/RC[-2]-1 -> -0.11752854264607115 | HZ20: 2131648 | IA20: 2355000 | IB20: 2451979 | IC20: =+RC[-1]/RC[-2]-1 -> 4.1180042462845012E-2 | ID20: =+RC[-2]/RC[-4]-1 -> 0.15027387260936131 | IE20: 1406 | IF20: 1384 | IG20: =+RC[-1]/RC[-2]-1 -> -1.5647226173541973E-2 | IH20: 953565 | II20: 987824 | IJ20: 995749 | IK20: =+RC[-1]/RC[-2]-1 -> 8.0226842028539025E-3 | IL20: =+RC[-2]/RC[-4]-1 -> 4.423820085678476E-2 | IM20: 716 | IN20: 744 | IO20: =+RC[-1]/RC[-2]-1 -> 3.9106145251396551E-2
A21: 17.01.2016 | B21: 79922700 | C21: 70595331 | D21: 72581204 | E21: =+RC[-1]/RC[-2]-1 -> 2.8130373097903671E-2 | F21: =+RC[-2]/RC[-4]-1 -> -9.1857457268085252E-2 | G21: 41272 | H21: 42010 | I21: =+RC[-1]/RC[-2]-1 -> 1.7881372358984349E-2 | J21: 0 | K21: 1181979 | L21: 853013 | M21: =+RC[-1]/RC[-2]-1 -> -0.27831797350037524 | N21: =+RC[-2]/RC[-4]-1 -> #DIV/0! | O21: 929 | P21: 0 | Q21: =+RC[-1]/RC[-2]-1 -> -1 | R21: 500284 | S21: 555967 | T21: 632704 | U21: =+RC[-1]/RC[-2]-1 -> 0.13802437914480525 | V21: =+RC[-2]/RC[-4]-1 -> 0.26468965627523566 | W21: 607 | X21: 485 | Y21: =+RC[-1]/RC[-2]-1 -> -0.20098846787479407 | Z21: 0 | AA21: 950000 | AB21: 557527 | AC21: =+RC[-1]/RC[-2]-1 -> -0.41312947368421049 | AD21: =+RC[-2]/RC[-4]-1 -> #DIV/0! | AE21: 303 | AF21: 0 | AG21: =+RC[-1]/RC[-2]-1 -> -1 | AH21: 2096981 | AI21: 2790244 | AJ21: 3586024 | AK21: =+RC[-1]/RC[-2]-1 -> 0.28520086415381596 | AL21: =+RC[-2]/RC[-4]-1 -> 0.71008893261312345 | AM21: 3047 | AN21: 1677 | AO21: =+RC[-1]/RC[-2]-1 -> -0.44962257958647855 | AP21: 11583442 | AQ21: 8089530 | AR21: 9851549 | AS21: =+RC[-1]/RC[-2]-1 -> 0.21781475561621 | AT21: =+RC[-2]/RC[-4]-1 -> -0.14951453980604379 | AU21: 4954 | AV21: 5774 | AW21: =+RC[-1]/RC[-2]-1 -> 0.16552280985062584 | AX21: 5648153 | AY21: 5232554 | AZ21: 6013501 | BA21: =+RC[-1]/RC[-2]-1 -> 0.14924776696045572 | BB21: =+RC[-2]/RC[-4]-1 -> 6.4684508369373228E-2 | BC21: 3105 | BD21: 2996 | BE21: =+RC[-1]/RC[-2]-1 -> -3.5104669887278561E-2 | BF21: 1515311 | BG21: 1244651 | BH21: 1162387 | BI21: =+RC[-1]/RC[-2]-1 -> -6.6094029571341695E-2 | BJ21: =+RC[-2]/RC[-4]-1 -> -0.23290532438555522 | BK21: 800 | BL21: 978 | BM21: =+RC[-1]/RC[-2]-1 -> 0.22249999999999992 | BN21: 1515610 | BO21: 1200000 | BP21: 895761 | BQ21: =+RC[-1]/RC[-2]-1 -> -0.25353250000000005 | BR21: =+RC[-2]/RC[-4]-1 -> -0.40897658368577672 | BS21: 1377 | BT21: 1655 | BU21: =+RC[-1]/RC[-2]-1 -> 0.20188816267247645 | BV21: 11883275 | BW21: 10764692 | BX21: 9520525 | BY21: =+RC[-1]/RC[-2]-1 -> -0.11557850424331695 | BZ21: =+RC[-2]/RC[-4]-1 -> -0.1988298680288052 | CA21: 2313 | CB21: 2779 | CC21: =+RC[-1]/RC[-2]-1 -> 0.20146995244271504 | CD21: 2666663 | CE21: 2541063 | CF21: 2179206 | CG21: =+RC[-1]/RC[-2]-1 -> -0.14240378928031305 | CH21: =+RC[-2]/RC[-4]-1 -> -0.1827966263453612 | CI21: 1515 | CJ21: 1508 | CK21: =+RC[-1]/RC[-2]-1 -> -4.6204620462045876E-3 | CL21: 1777807 | CM21: 1386667 | CN21: 1529253 | CO21: =+RC[-1]/RC[-2]-1 -> 0.10282641758980349 | CP21: =+RC[-2]/RC[-4]-1 -> -0.13980932688418934 | CQ21: 1008 | CR21: 1173 | CS21: =+RC[-1]/RC[-2]-1 -> 0.16369047619047628 | CT21: 3768510 | CU21: 2419585 | CV21: 3233413 | CW21: =+RC[-1]/RC[-2]-1 -> 0.33635024188032236 | CX21: =+RC[-2]/RC[-4]-1 -> -0.141991662487296 | CY21: 1058 | CZ21: 1210 | DA21: =+RC[-1]/RC[-2]-1 -> 0.14366729678638945 | DB21: 0 | DC21: 0 | DD21: 0 | DE21: =+RC[-1]/RC[-2]-1 -> #DIV/0! | DF21: =+RC[-2]/RC[-4]-1 -> #DIV/0! | DG21: 0 | DH21: 0 | DI21: =+RC[-1]/RC[-2]-1 -> #DIV/0! | DJ21: 0 | DK21: 0 | DL21: 0 | DM21: =+RC[-1]/RC[-2]-1 -> #DIV/0! | DN21: =+RC[-2]/RC[-4]-1 -> #DIV/0! | DO21: 0 | DP21: 0 | DQ21: =+RC[-1]/RC[-2]-1 -> #DIV/0! | DR21: 2131210 | DS21: 1900000 | DT21: 1237363 | DU21: =+RC[-1]/RC[-2]-1 -> -0.34875631578947364 | DV21: =+RC[-2]/RC[-4]-1 -> -0.41940822349744977 | DW21: 1345 | DX21: 1955 | DY21: =+RC[-1]/RC[-2]-1 -> 0.45353159851301106 | DZ21: 2170017 | EA21: 1450000 | EB21: 1246743 | EC21: =+RC[-1]/RC[-2]-1 -> -0.14017724137931031 | ED21: =+RC[-2]/RC[-4]-1 -> -0.42546855623711699 | EE21: 843 | EF21: 1223 | EG21: =+RC[-1]/RC[-2]-1 -> 0.45077105575326226 | EH21: 3547472 | EI21: 3355033 | EJ21: 3073399 | EK21: =+RC[-1]/RC[-2]-1 -> -8.3943734681596327E-2 | EL21: =+RC[-2]/RC[-4]-1 -> -0.13363685463902186 | EM21: 2001 | EN21: 2359 | EO21: =+RC[-1]/RC[-2]-1 -> 0.17891054472763623 | EP21: 3488013 | EQ21: 2765559 | ER21: 4929502 | ES21: =+RC[-1]/RC[-2]-1 -> 0.78246133964236519 | ET21: =+RC[-2]/RC[-4]-1 -> 0.41326938861753093 | EU21: 2312 | EV21: 1722 | EW21: =+RC[-1]/RC[-2]-1 -> -0.25519031141868509 | EX21: 458307 | EY21: 342430 | EZ21: 177082 | FA21: =+RC[-1]/RC[-2]-1 -> -0.48286657127004062 | FB21: =+RC[-2]/RC[-4]-1 -> -0.61361707327184623 | FC21: 256 | FD21: 501 | FE21: =+RC[-1]/RC[-2]-1 -> 0.95703125 | FF21: 3139096 | FG21: 2600000 | FH21: 2648260 | FI21: =+RC[-1]/RC[-2]-1 -> 1.8561538461538518E-2 | FJ21: =+RC[-2]/RC[-4]-1 -> -0.15636221383481108 | FK21: 1579 | FL21: 1688 | FM21: =+RC[-1]/RC[-2]-1 -> 6.9031032298923378E-2 | FN21: 879967 | FO21: 500000 | FP21: 231089 | FQ21: =+RC[-1]/RC[-2]-1 -> -0.53782200000000002 | FR21: =+RC[-2]/RC[-4]-1 -> -0.73738901572445337 | FS21: 408 | FT21: 788 | FU21: =+RC[-1]/RC[-2]-1 -> 0.93137254901960786 | FV21: 5972985 | FW21: 5200000 | FX21: 5769986 | FY21: =+RC[-1]/RC[-2]-1 -> 0.10961269230769233 | FZ21: =+RC[-2]/RC[-4]-1 -> -3.3986189484822127E-2 | GA21: 2006 | GB21: 1959 | GC21: =+RC[-1]/RC[-2]-1 -> -2.3429710867397757E-2 | GD21: 0 | GE21: 180000 | GF21: 0 | GG21: =+RC[-1]/RC[-2]-1 -> -1 | GH21: =+RC[-2]/RC[-4]-1 -> #DIV/0! | GI21: 0 | GJ21: 0 | GK21: =+RC[-1]/RC[-2]-1 -> #DIV/0! | GL21: 4837966 | GM21: 3800000 | GN21: 3701405 | GO21: =+RC[-1]/RC[-2]-1 -> -2.5946052631578898E-2 | GP21: =+RC[-2]/RC[-4]-1 -> -0.23492537979803907 | GQ21: 2989 | GR21: 2707 | GS21: =+RC[-1]/RC[-2]-1 -> -9.4345935095349609E-2 | GT21: 911187 | GU21: 950000 | GV21: 765063 | GW21: =+RC[-1]/RC[-2]-1 -> -0.19467052631578952 | GX21: =+RC[-2]/RC[-4]-1 -> -0.16036664263208322 | GY21: 742 | GZ21: 833 | HA21: =+RC[-1]/RC[-2]-1 -> 0.12264150943396235 | HB21: 2916083 | HC21: 2227716 | HD21: 1808135 | HE21: =+RC[-1]/RC[-2]-1 -> -0.18834582146018608 | HF21: =+RC[-2]/RC[-4]-1 -> -0.37994391792003179 | HG21: 968 | HH21: 1323 | HI21: =+RC[-1]/RC[-2]-1 -> 0.36673553719008267 | HJ21: 2047346 | HK21: 1996071 | HL21: 1924675 | HM21: =+RC[-1]/RC[-2]-1 -> -3.5768266760050071E-2 | HN21: =+RC[-2]/RC[-4]-1 -> -5.9917082896589036E-2 | HO21: 1336 | HP21: 1268 | HQ21: =+RC[-1]/RC[-2]-1 -> -5.0898203592814384E-2 | HR21: 1576801 | HS21: 1599984 | HT21: 1689980 | HU21: =+RC[-1]/RC[-2]-1 -> 5.624806248062475E-2 | HV21: =+RC[-2]/RC[-4]-1 -> 7.1777605417551182E-2 | HW21: 1525 | HX21: 1578 | HY21: =+RC[-1]/RC[-2]-1 -> 3.4754098360655794E-2 | HZ21: 1940940 | IA21: 2285000 | IB21: 2473500 | IC21: =+RC[-1]/RC[-2]-1 -> 8.2494529540481309E-2 | ID21: =+RC[-2]/RC[-4]-1 -> 0.27438251568827465 | IE21: 1291 | IF21: 1193 | IG21: =+RC[-1]/RC[-2]-1 -> -7.5910147172734366E-2 | IH21: 949274 | II21: 1086606 | IJ21: 890159 | IK21: =+RC[-1]/RC[-2]-1 -> -0.18078954101118527 | IL21: =+RC[-2]/RC[-4]-1 -> -6.2273906164079129E-2 | IM21: 655 | IN21: 678 | IO21: =+RC[-1]/RC[-2]-1 -> 3.5114503816793929E-2
A22: 18.01.2016 | B22: 69993796 | C22: 62840096 | D22: 60509577 | E22: =+RC[-1]/RC[-2]-1 -> -3.7086496494212917E-2 | F22: =+RC[-2]/RC[-4]-1 -> -0.13550085210409224 | G22: 38232 | H22: 40882 | I22: =+RC[-1]/RC[-2]-1 -> 6.9313663946432236E-2 | J22: 0 | K22: 752168 | L22: 605709 | M22: =+RC[-1]/RC[-2]-1 -> -0.19471580817051515 | N22: =+RC[-2]/RC[-4]-1 -> #DIV/0! | O22: 728 | P22: 0 | Q22: =+RC[-1]/RC[-2]-1 -> -1 | R22: 408179 | S22: 694958 | T22: 566790 | U22: =+RC[-1]/RC[-2]-1 -> -0.18442553362937042 | V22: =+RC[-2]/RC[-4]-1 -> 0.38858197016505014 | W22: 632 | X22: 435 | Y22: =+RC[-1]/RC[-2]-1 -> -0.31170886075949367 | Z22: 0 | AA22: 800000 | AB22: 510147 | AC22: =+RC[-1]/RC[-2]-1 -> -0.36231625000000001 | AD22: =+RC[-2]/RC[-4]-1 -> #DIV/0! | AE22: 393 | AF22: 0 | AG22: =+RC[-1]/RC[-2]-1 -> -1 | AH22: 1961133 | AI22: 2046179 | AJ22: 2311024 | AK22: =+RC[-1]/RC[-2]-1 -> 0.12943393515425572 | AL22: =+RC[-2]/RC[-4]-1 -> 0.1784126828726047 | AM22: 2375 | AN22: 1854 | AO22: =+RC[-1]/RC[-2]-1 -> -0.21936842105263155 | AP22: 10838278 | AQ22: 6471624 | AR22: 7101807 | AS22: =+RC[-1]/RC[-2]-1 -> 9.7376330886961293E-2 | AT22: =+RC[-2]/RC[-4]-1 -> -0.34474766194408368 | AU22: 3700 | AV22: 5687 | AW22: =+RC[-1]/RC[-2]-1 -> 0.53702702702702698 | AX22: 5406979 | AY22: 4395346 | AZ22: 4354681 | BA22: =+RC[-1]/RC[-2]-1 -> -9.2518313689070597E-3 | BB22: =+RC[-2]/RC[-4]-1 -> -0.19461847364304541 | BC22: 2416 | BD22: 2913 | BE22: =+RC[-1]/RC[-2]-1 -> 0.20571192052980125 | BF22: 1340732 | BG22: 1452093 | BH22: 1295318 | BI22: =+RC[-1]/RC[-2]-1 -> -0.10796484798149986 | BJ22: =+RC[-2]/RC[-4]-1 -> -3.3872541268501033E-2 | BK22: 1141 | BL22: 906 | BM22: =+RC[-1]/RC[-2]-1 -> -0.20595968448729185 | BN22: 1374853 | BO22: 1100000 | BP22: 828079 | BQ22: =+RC[-1]/RC[-2]-1 -> -0.24720090909090908 | BR22: =+RC[-2]/RC[-4]-1 -> -0.39769633553550821 | BS22: 1053 | BT22: 1789 | BU22: =+RC[-1]/RC[-2]-1 -> 0.6989553656220322 | BV22: 9037978 | BW22: 10252088 | BX22: 10211346 | BY22: =+RC[-1]/RC[-2]-1 -> -3.9740197313952175E-3 | BZ22: =+RC[-2]/RC[-4]-1 -> 0.12982638373317568 | CA22: 2887 | CB22: 2381 | CC22: =+RC[-1]/RC[-2]-1 -> -0.17526844475233805 | CD22: 2322525 | CE22: 2494006 | CF22: 1998192 | CG22: =+RC[-1]/RC[-2]-1 -> -0.19880224827045323 | CH22: =+RC[-2]/RC[-4]-1 -> -0.13964672070268347 | CI22: 1584 | CJ22: 1361 | CK22: =+RC[-1]/RC[-2]-1 -> -0.14078282828282829 | CL22: 1620765 | CM22: 1213333 | CN22: 1308483 | CO22: =+RC[-1]/RC[-2]-1 -> 7.8420351214382178E-2 | CP22: =+RC[-2]/RC[-4]-1 -> -0.19267568092845044 | CQ22: 971 | CR22: 1084 | CS22: =+RC[-1]/RC[-2]-1 -> 0.1163748712667354 | CT22: 3179326 | CU22: 2217953 | CV22: 2362961 | CW22: =+RC[-1]/RC[-2]-1 -> 6.5379203256335838E-2 | CX22: =+RC[-2]/RC[-4]-1 -> -0.2567729764107235 | CY22: 1133 | CZ22: 1205 | DA22: =+RC[-1]/RC[-2]-1 -> 6.3548102383053751E-2 | DB22: 0 | DC22: 0 | DD22: 0 | DE22: =+RC[-1]/RC[-2]-1 -> #DIV/0! | DF22: =+RC[-2]/RC[-4]-1 -> #DIV/0! | DG22: 0 | DH22: 0 | DI22: =+RC[-1]/RC[-2]-1 -> #DIV/0! | DJ22: 0 | DK22: 0 | DL22: 0 | DM22: =+RC[-1]/RC[-2]-1 -> #DIV/0! | DN22: =+RC[-2]/RC[-4]-1 -> #DIV/0! | DO22: 0 | DP22: 0 | DQ22: =+RC[-1]/RC[-2]-1 -> #DIV/0! | DR22: 2179869 | DS22: 1600000 | DT22: 938499 | DU22: =+RC[-1]/RC[-2]-1 -> -0.41343812499999999 | DV22: =+RC[-2]/RC[-4]-1 -> -0.56947000026148364 | DW22: 1032 | DX22: 2088 | DY22: =+RC[-1]/RC[-2]-1 -> 1.0232558139534884 | DZ22: 1454284 | EA22: 1500000 | EB22: 1326308 | EC22: =+RC[-1]/RC[-2]-1 -> -0.11579466666666671 | ED22: =+RC[-2]/RC[-4]-1 -> -8.7999317877388461E-2 | EE22: 1029 | EF22: 997 | EG22: =+RC[-1]/RC[-2]-1 -> -3.1098153547133189E-2 | EH22: 2610909 | EI22: 3774412 | EJ22: 3335365 | EK22: =+RC[-1]/RC[-2]-1 -> -0.11632195955290514 | EL22: =+RC[-2]/RC[-4]-1 -> 0.27747271161116682 | EM22: 2845 | EN22: 1996 | EO22: =+RC[-1]/RC[-2]-1 -> -0.29841827768014062 | EP22: 3325644 | EQ22: 2489003 | ER22: 3328224 | ES22: =+RC[-1]/RC[-2]-1 -> 0.33717155021508605 | ET22: =+RC[-2]/RC[-4]-1 -> 7.7578959142954318E-4 | EU22: 1764 | EV22: 1777 | EW22: =+RC[-1]/RC[-2]-1 -> 7.369614512471756E-3 | EX22: 463686 | EY22: 308506 | EZ22: 146091 | FA22: =+RC[-1]/RC[-2]-1 -> -0.52645653569136419 | FB22: =+RC[-2]/RC[-4]-1 -> -0.68493549514110841 | FC22: 265 | FD22: 474 | FE22: =+RC[-1]/RC[-2]-1 -> 0.78867924528301891 | FF22: 2747841 | FG22: 2700000 | FH22: 2288233 | FI22: =+RC[-1]/RC[-2]-1 -> -0.15250629629629631 | FJ22: =+RC[-2]/RC[-4]-1 -> -0.1672614972991523 | FK22: 1638 | FL22: 1571 | FM22: =+RC[-1]/RC[-2]-1 -> -4.0903540903540869E-2 | FN22: 644146 | FO22: 400000 | FP22: 171273 | FQ22: =+RC[-1]/RC[-2]-1 -> -0.57181749999999998 | FR22: =+RC[-2]/RC[-4]-1 -> -0.73410841641491209 | FS22: 304 | FT22: 833 | FU22: =+RC[-1]/RC[-2]-1 -> 1.7401315789473686 | FV22: 5063921 | FW22: 3650000 | FX22: 3660084 | FY22: =+RC[-1]/RC[-2]-1 -> 2.7627397260274744E-3 | FZ22: =+RC[-2]/RC[-4]-1 -> -0.27722332161184982 | GA22: 1601 | GB22: 2010 | GC22: =+RC[-1]/RC[-2]-1 -> 0.25546533416614614 | GD22: 0 | GE22: 90000 | GF22: 0 | GG22: =+RC[-1]/RC[-2]-1 -> -1 | GH22: =+RC[-2]/RC[-4]-1 -> #DIV/0! | GI22: 0 | GJ22: 0 | GK22: =+RC[-1]/RC[-2]-1 -> #DIV/0! | GL22: 4640609 | GM22: 3000000 | GN22: 2893867 | GO22: =+RC[-1]/RC[-2]-1 -> -3.5377666666666641E-2 | GP22: =+RC[-2]/RC[-4]-1 -> -0.37640361426700675 | GQ22: 1966 | GR22: 2899 | GS22: =+RC[-1]/RC[-2]-1 -> 0.47456765005086465 | GT22: 929017 | GU22: 950000 | GV22: 727778 | GW22: =+RC[-1]/RC[-2]-1 -> -0.2339178947368421 | GX22: =+RC[-2]/RC[-4]-1 -> -0.21661498121132339 | GY22: 835 | GZ22: 778 | HA22: =+RC[-1]/RC[-2]-1 -> -6.8263473053892243E-2 | HB22: 2258303 | HC22: 2309218 | HD22: 1677049 | HE22: =+RC[-1]/RC[-2]-1 -> -0.27375890886005561 | HF22: =+RC[-2]/RC[-4]-1 -> -0.25738530214944588 | HG22: 968 | HH22: 1126 | HI22: =+RC[-1]/RC[-2]-1 -> 0.16322314049586772 | HJ22: 1738433 | HK22: 1885179 | HL22: 1943781 | HM22: =+RC[-1]/RC[-2]-1 -> 3.108564226527033E-2 | HN22: =+RC[-2]/RC[-4]-1 -> 0.11812247006355725 | HO22: 1429 | HP22: 1315 | HQ22: =+RC[-1]/RC[-2]-1 -> -7.9776067179846089E-2 | HR22: 1573991 | HS22: 1099989 | HT22: 1195515 | HU22: =+RC[-1]/RC[-2]-1 -> 8.6842686608684216E-2 | HV22: =+RC[-2]/RC[-4]-1 -> -0.24045626690368627 | HW22: 1231 | HX22: 1592 | HY22: =+RC[-1]/RC[-2]-1 -> 0.29325751421608448 | HZ22: 1989539 | IA22: 2305000 | IB22: 2398679 | IC22: =+RC[-1]/RC[-2]-1 -> 4.0641648590021617E-2 | ID22: =+RC[-2]/RC[-4]-1 -> 0.20564562946491627 | IE22: 1563 | IF22: 1181 | IG22: =+RC[-1]/RC[-2]-1 -> -0.24440179142674345 | IH22: 882856 | II22: 889041 | IJ22: 1024294 | IK22: =+RC[-1]/RC[-2]-1 -> 0.15213359113921632 | IL22: =+RC[-2]/RC[-4]-1 -> 0.1602050617541253 | IM22: 749 | IN22: 630 | IO22: =+RC[-1]/RC[-2]-1 -> -0.15887850467289721
A23: 19.01.2016 | B23: 59740756 | C23: 61653379 | D23: 59141338 | E23: =+RC[-1]/RC[-2]-1 -> -4.0744579465790465E-2 | F23: =+RC[-2]/RC[-4]-1 -> -1.0033652737839516E-2 | G23: 38753 | H23: 38345 | I23: =+RC[-1]/RC[-2]-1 -> -1.0528217170283627E-2 | J23: 0 | K23: 752168 | L23: 664649 | M23: =+RC[-1]/RC[-2]-1 -> -0.11635565458780484 | N23: =+RC[-2]/RC[-4]-1 -> #DIV/0! | O23: 726 | P23: 0 | Q23: =+RC[-1]/RC[-2]-1 -> -1 | R23: 516012 | S23: 694958 | T23: 625752 | U23: =+RC[-1]/RC[-2]-1 -> -9.9582996382515221E-2 | V23: =+RC[-2]/RC[-4]-1 -> 0.21266947280295811 | W23: 691 | X23: 535 | Y23: =+RC[-1]/RC[-2]-1 -> -0.22575976845151957 | Z23: 0 | AA23: 800000 | AB23: 616590 | AC23: =+RC[-1]/RC[-2]-1 -> -0.22926250000000004 | AD23: =+RC[-2]/RC[-4]-1 -> #DIV/0! | AE23: 370 | AF23: 0 | AG23: =+RC[-1]/RC[-2]-1 -> -1 | AH23: 1191162 | AI23: 2046179 | AJ23: 2194320 | AK23: =+RC[-1]/RC[-2]-1 -> 7.2398846826206231E-2 | AL23: =+RC[-2]/RC[-4]-1 -> 0.84216756410966775 | AM23: 2402 | AN23: 1374 | AO23: =+RC[-1]/RC[-2]-1 -> -0.4279766860949209 | AP23: 7138870 | AQ23: 6471624 | AR23: 6954261 | AS23: =+RC[-1]/RC[-2]-1 -> 7.4577416734964874E-2 | AT23: =+RC[-2]/RC[-4]-1 -> -2.5859694881682938E-2 | AU23: 3745 | AV23: 4312 | AW23: =+RC[-1]/RC[-2]-1 -> 0.15140186915887854 | AX23: 3713759 | AY23: 4186043 | AZ23: 4289016 | BA23: =+RC[-1]/RC[-2]-1 -> 2.4599126191489296E-2 | BB23: =+RC[-2]/RC[-4]-1 -> 0.15489885046390994 | BC23: 2579 | BD23: 2199 | BE23: =+RC[-1]/RC[-2]-1 -> -0.14734393175649474 | BF23: 1576795 | BG23: 1503953 | BH23: 1171908 | BI23: =+RC[-1]/RC[-2]-1 -> -0.22078150048571998 | BJ23: =+RC[-2]/RC[-4]-1 -> -0.25677846517778147 | BK23: 1087 | BL23: 1349 | BM23: =+RC[-1]/RC[-2]-1 -> 0.2410303587856486 | BN23: 917293 | BO23: 1100000 | BP23: 760107 | BQ23: =+RC[-1]/RC[-2]-1 -> -0.30899363636363641 | BR23: =+RC[-2]/RC[-4]-1 -> -0.17135855173864845 | BS23: 1255 | BT23: 1326 | BU23: =+RC[-1]/RC[-2]-1 -> 5.6573705179282952E-2 | BV23: 8600657 | BW23: 9431921 | BX23: 9647232 | BY23: =+RC[-1]/RC[-2]-1 -> 2.2827905365195411E-2 | BZ23: =+RC[-2]/RC[-4]-1 -> 0.1216854712378368 | CA23: 2801 | CB23: 2919 | CC23: =+RC[-1]/RC[-2]-1 -> 4.2127811495894285E-2 | CD23: 2325540 | CE23: 2494006 | CF23: 2052724 | CG23: =+RC[-1]/RC[-2]-1 -> -0.17693702420924406 | CH23: =+RC[-2]/RC[-4]-1 -> -0.11731296817083348 | CI23: 1606 | CJ23: 1504 | CK23: =+RC[-1]/RC[-2]-1 -> -6.3511830635118338E-2 | CL23: 1309885 | CM23: 1213333 | CN23: 1272395 | CO23: =+RC[-1]/RC[-2]-1 -> 4.8677485900408213E-2 | CP23: =+RC[-2]/RC[-4]-1 -> -2.8620833126572154E-2 | CQ23: 988 | CR23: 996 | CS23: =+RC[-1]/RC[-2]-1 -> 8.0971659919029104E-3 | CT23: 2385797 | CU23: 2217953 | CV23: 2705953 | CW23: =+RC[-1]/RC[-2]-1 -> 0.22002269660357987 | CX23: =+RC[-2]/RC[-4]-1 -> 0.13419247320706673 | CY23: 1132 | CZ23: 1196 | DA23: =+RC[-1]/RC[-2]-1 -> 5.6537102473498191E-2 | DB23: 0 | DC23: 0 | DD23: 0 | DE23: =+RC[-1]/RC[-2]-1 -> #DIV/0! | DF23: =+RC[-2]/RC[-4]-1 -> #DIV/0! | DG23: 0 | DH23: 0 | DI23: =+RC[-1]/RC[-2]-1 -> #DIV/0! | DJ23: 0 | DK23: 0 | DL23: 0 | DM23: =+RC[-1]/RC[-2]-1 -> #DIV/0! | DN23: =+RC[-2]/RC[-4]-1 -> #DIV/0! | DO23: 0 | DP23: 0 | DQ23: =+RC[-1]/RC[-2]-1 -> #DIV/0! | DR23: 1545704 | DS23: 1600000 | DT23: 960483 | DU23: =+RC[-1]/RC[-2]-1 -> -0.39969812500000002 | DV23: =+RC[-2]/RC[-4]-1 -> -0.37861129944672456 | DW23: 1256 | DX23: 1651 | DY23: =+RC[-1]/RC[-2]-1 -> 0.31449044585987251 | DZ23: 1505421 | EA23: 1500000 | EB23: 1415604 | EC23: =+RC[-1]/RC[-2]-1 -> -5.6263999999999981E-2 | ED23: =+RC[-2]/RC[-4]-1 -> -5.9662380158108541E-2 | EE23: 973 | EF23: 1085 | EG23: =+RC[-1]/RC[-2]-1 -> 0.1151079136690647 | EH23: 3343233 | EI23: 3774412 | EJ23: 3317580 | EK23: =+RC[-1]/RC[-2]-1 -> -0.12103395177844922 | EL23: =+RC[-2]/RC[-4]-1 -> -7.6731116257825471E-3 | EM23: 2877 | EN23: 2841 | EO23: =+RC[-1]/RC[-2]-1 -> -1.2513034410844615E-2 | EP23: 2383470 | EQ23: 2489003 | ER23: 3222202 | ES23: =+RC[-1]/RC[-2]-1 -> 0.29457537817350965 | ET23: =+RC[-2]/RC[-4]-1 -> 0.35189534586128635 | EU23: 1763 | EV23: 1524 | EW23: =+RC[-1]/RC[-2]-1 -> -0.13556437889960293 | EX23: 546972 | EY23: 308506 | EZ23: 143768 | FA23: =+RC[-1]/RC[-2]-1 -> -0.53398637303650498 | FB23: =+RC[-2]/RC[-4]-1 -> -0.73715656377291705 | FC23: 239 | FD23: 532 | FE23: =+RC[-1]/RC[-2]-1 -> 1.2259414225941421 | FF23: 3839075 | FG23: 2700000 | FH23: 2459383 | FI23: =+RC[-1]/RC[-2]-1 -> -8.9117407407407367E-2 | FJ23: =+RC[-2]/RC[-4]-1 -> -0.35938136139564869 | FK23: 1722 | FL23: 1775 | FM23: =+RC[-1]/RC[-2]-1 -> 3.0778164924506468E-2 | FN23: 625095 | FO23: 400000 | FP23: 217014 | FQ23: =+RC[-1]/RC[-2]-1 -> -0.45746500000000001 | FR23: =+RC[-2]/RC[-4]-1 -> -0.65283036978379294 | FS23: 334 | FT23: 614 | FU23: =+RC[-1]/RC[-2]-1 -> 0.83832335329341312 | FV23: 3562347 | FW23: 3600000 | FX23: 3579916 | FY23: =+RC[-1]/RC[-2]-1 -> -5.578888888888911E-3 | FZ23: =+RC[-2]/RC[-4]-1 -> 4.931860933255594E-3 | GA23: 1664 | GB23: 1599 | GC23: =+RC[-1]/RC[-2]-1 -> -3.90625E-2 | GD23: 0 | GE23: 0 | GF23: 0 | GG23: =+RC[-1]/RC[-2]-1 -> #DIV/0! | GH23: =+RC[-2]/RC[-4]-1 -> #DIV/0! | GI23: 0 | GJ23: 0 | GK23: =+RC[-1]/RC[-2]-1 -> #DIV/0! | GL23: 4084338 | GM23: 3000000 | GN23: 2532857 | GO23: =+RC[-1]/RC[-2]-1 -> -0.15571433333333329 | GP23: =+RC[-2]/RC[-4]-1 -> -0.37986106928466745 | GQ23: 1805 | GR23: 2249 | GS23: =+RC[-1]/RC[-2]-1 -> 0.24598337950138505 | GT23: 779655 | GU23: 950000 | GV23: 726810 | GW23: =+RC[-1]/RC[-2]-1 -> -0.23493684210526311 | GX23: =+RC[-2]/RC[-4]-1 -> -6.7779979606364393E-2 | GY23: 829 | GZ23: 887 | HA23: =+RC[-1]/RC[-2]-1 -> 6.99638118214716E-2 | HB23: 2211966 | HC23: 2309218 | HD23: 1642775 | HE23: =+RC[-1]/RC[-2]-1 -> -0.28860116281788895 | HF23: =+RC[-2]/RC[-4]-1 -> -0.25732357549799589 | HG23: 1019 | HH23: 1248 | HI23: =+RC[-1]/RC[-2]-1 -> 0.22473012757605493 | HJ23: 1985243 | HK23: 1996071 | HL23: 1615645 | HM23: =+RC[-1]/RC[-2]-1 -> -0.19058740896491155 | HN23: =+RC[-2]/RC[-4]-1 -> -0.18617267508310065 | HO23: 1374 | HP23: 1367 | HQ23: =+RC[-1]/RC[-2]-1 -> -5.0946142649199722E-3 | HR23: 913314 | HS23: 999990 | HT23: 1228865 | HU23: =+RC[-1]/RC[-2]-1 -> 0.22887728877288782 | HV23: =+RC[-2]/RC[-4]-1 -> 0.34550110914756593 | HW23: 1284 | HX23: 1246 | HY23: =+RC[-1]/RC[-2]-1 -> -2.9595015576323935E-2 | HZ23: 1888396 | IA23: 2225000 | IB23: 2206642 | IC23: =+RC[-1]/RC[-2]-1 -> -8.2507865168539585E-3 | ID23: =+RC[-2]/RC[-4]-1 -> 0.16852715214393599 | IE23: 1504 | IF23: 1314 | IG23: =+RC[-1]/RC[-2]-1 -> -0.12632978723404253 | IH23: 850757 | II23: 889041 | IJ23: 916887 | IK23: =+RC[-1]/RC[-2]-1 -> 3.1321390127114546E-2 | IL23: =+RC[-2]/RC[-4]-1 -> 7.7730773887255689E-2 | IM23: 728 | IN23: 703 | IO23: =+RC[-1]/RC[-2]-1 -> -3.434065934065933E-2
A24: 20.01.2016 | B24: 58801905 | C24: 62792827 | D24: 60762134 | E24: =+RC[-1]/RC[-2]-1 -> -3.2339569613580199E-2 | F24: =+RC[-2]/RC[-4]-1 -> 3.3336147867998545E-2 | G24: 38788 | H24: 37871 | I24: =+RC[-1]/RC[-2]-1 -> -2.3641332370836321E-2 | J24: 0 | K24: 752168 | L24: 689724 | M24: =+RC[-1]/RC[-2]-1 -> -8.3018687314536099E-2 | N24: =+RC[-2]/RC[-4]-1 -> #DIV/0! | O24: 723 | P24: 0 | Q24: =+RC[-1]/RC[-2]-1 -> -1 | R24: 412782 | S24: 694958 | T24: 585670 | U24: =+RC[-1]/RC[-2]-1 -> -0.15725842425009862 | V24: =+RC[-2]/RC[-4]-1 -> 0.41883609265907906 | W24: 691 | X24: 509 | Y24: =+RC[-1]/RC[-2]-1 -> -0.26338639652677276 | Z24: 0 | AA24: 800000 | AB24: 671117 | AC24: =+RC[-1]/RC[-2]-1 -> -0.16110374999999999 | AD24: =+RC[-2]/RC[-4]-1 -> #DIV/0! | AE24: 370 | AF24: 0 | AG24: =+RC[-1]/RC[-2]-1 -> -1 | AH24: 1124526 | AI24: 2046179 | AJ24: 2368636 | AK24: =+RC[-1]/RC[-2]-1 -> 0.15758982962878609 | AL24: =+RC[-2]/RC[-4]-1 -> 1.106341694189374 | AM24: 2465 | AN24: 1307 | AO24: =+RC[-1]/RC[-2]-1 -> -0.46977687626774844 | AP24: 7764438 | AQ24: 6471624 | AR24: 7098279 | AS24: =+RC[-1]/RC[-2]-1 -> 9.6831181786828147E-2 | AT24: =+RC[-2]/RC[-4]-1 -> -8.5796164513130213E-2 | AU24: 3781 | AV24: 4300 | AW24: =+RC[-1]/RC[-2]-1 -> 0.13726527373710651 | AX24: 3891549 | AY24: 4186043 | AZ24: 4382313 | BA24: =+RC[-1]/RC[-2]-1 -> 4.6886761555005485E-2 | BB24: =+RC[-2]/RC[-4]-1 -> 0.1261101941668985 | BC24: 2413 | BD24: 2312 | BE24: =+RC[-1]/RC[-2]-1 -> -4.1856610029009533E-2 | BF24: 1515356 | BG24: 1503953 | BH24: 1272684 | BI24: =+RC[-1]/RC[-2]-1 -> -0.15377408735512343 | BJ24: =+RC[-2]/RC[-4]-1 -> -0.16014190724819777 | BK24: 1117 | BL24: 1249 | BM24: =+RC[-1]/RC[-2]-1 -> 0.1181736794986572 | BN24: 934375 | BO24: 1100000 | BP24: 652443 | BQ24: =+RC[-1]/RC[-2]-1 -> -0.40686999999999995 | BR24: =+RC[-2]/RC[-4]-1 -> -0.30173324414715719 | BS24: 1068 | BT24: 1311 | BU24: =+RC[-1]/RC[-2]-1 -> 0.22752808988764039 | BV24: 8590037 | BW24: 9431921 | BX24: 9470470 | BY24: =+RC[-1]/RC[-2]-1 -> 4.0870783374882258E-3 | BZ24: =+RC[-2]/RC[-4]-1 -> 0.10249466911492933 | CA24: 2840 | CB24: 2815 | CC24: =+RC[-1]/RC[-2]-1 -> -8.8028169014084945E-3 | CD24: 2133198 | CE24: 2541063 | CF24: 1860041 | CG24: =+RC[-1]/RC[-2]-1 -> -0.26800673576373357 | CH24: =+RC[-2]/RC[-4]-1 -> -0.12805046695149724 | CI24: 1486 | CJ24: 1496 | CK24: =+RC[-1]/RC[-2]-1 -> 6.7294751009421283E-3 | CL24: 1133808 | CM24: 1213333 | CN24: 1221092 | CO24: =+RC[-1]/RC[-2]-1 -> 6.3947819765883818E-3 | CP24: =+RC[-2]/RC[-4]-1 -> 7.6983051804185632E-2 | CQ24: 991 | CR24: 933 | CS24: =+RC[-1]/RC[-2]-1 -> -5.8526740665993948E-2 | CT24: 2414765 | CU24: 2217953 | CV24: 2708613 | CW24: =+RC[-1]/RC[-2]-1 -> 0.22122200064654218 | CX24: =+RC[-2]/RC[-4]-1 -> 0.12168803175464271 | CY24: 1191 | CZ24: 1157 | DA24: =+RC[-1]/RC[-2]-1 -> -2.8547439126784258E-2 | DB24: 0 | DC24: 0 | DD24: 0 | DE24: =+RC[-1]/RC[-2]-1 -> #DIV/0! | DF24: =+RC[-2]/RC[-4]-1 -> #DIV/0! | DG24: 0 | DH24: 0 | DI24: =+RC[-1]/RC[-2]-1 -> #DIV/0! | DJ24: 0 | DK24: 0 | DL24: 0 | DM24: =+RC[-1]/RC[-2]-1 -> #DIV/0! | DN24: =+RC[-2]/RC[-4]-1 -> #DIV/0! | DO24: 0 | DP24: 0 | DQ24: =+RC[-1]/RC[-2]-1 -> #DIV/0! | DR24: 1537997 | DS24: 1600000 | DT24: 868946 | DU24: =+RC[-1]/RC[-2]-1 -> -0.45690874999999997 | DV24: =+RC[-2]/RC[-4]-1 -> -0.43501450262906882 | DW24: 1155 | DX24: 1373 | DY24: =+RC[-1]/RC[-2]-1 -> 0.18874458874458866 | DZ24: 1537868 | EA24: 1500000 | EB24: 1449588 | EC24: =+RC[-1]/RC[-2]-1 -> -3.3607999999999971E-2 | ED24: =+RC[-2]/RC[-4]-1 -> -5.7404146519727361E-2 | EE24: 1000 | EF24: 1094 | EG24: =+RC[-1]/RC[-2]-1 -> 9.4000000000000083E-2 | EH24: 3310521 | EI24: 3774412 | EJ24: 3358618 | EK24: =+RC[-1]/RC[-2]-1 -> -0.11016126485396927 | EL24: =+RC[-2]/RC[-4]-1 -> 1.4528528893186232E-2 | EM24: 2749 | EN24: 2863 | EO24: =+RC[-1]/RC[-2]-1 -> 4.1469625318297565E-2 | EP24: 2513544 | EQ24: 2489003 | ER24: 3805143 | ES24: =+RC[-1]/RC[-2]-1 -> 0.52878200628926519 | ET24: =+RC[-2]/RC[-4]-1 -> 0.51385573516914773 | EU24: 1839 | EV24: 1603 | EW24: =+RC[-1]/RC[-2]-1 -> -0.12833061446438276 | EX24: 494470 | EY24: 308506 | EZ24: 130610 | FA24: =+RC[-1]/RC[-2]-1 -> -0.57663708323338936 | FB24: =+RC[-2]/RC[-4]-1 -> -0.73585859607256254 | FC24: 237 | FD24: 498 | FE24: =+RC[-1]/RC[-2]-1 -> 1.1012658227848102 | FF24: 2993873 | FG24: 2700000 | FH24: 2721290 | FI24: =+RC[-1]/RC[-2]-1 -> 7.8851851851851062E-3 | FJ24: =+RC[-2]/RC[-4]-1 -> -9.1046948217242352E-2 | FK24: 1723 | FL24: 1768 | FM24: =+RC[-1]/RC[-2]-1 -> 2.6117237376668712E-2 | FN24: 421059 | FO24: 400000 | FP24: 194668 | FQ24: =+RC[-1]/RC[-2]-1 -> -0.51333000000000006 | FR24: =+RC[-2]/RC[-4]-1 -> -0.53767049273379741 | FS24: 349 | FT24: 625 | FU24: =+RC[-1]/RC[-2]-1 -> 0.79083094555873923 | FV24: 3796131 | FW24: 3800000 | FX24: 3771727 | FY24: =+RC[-1]/RC[-2]-1 -> -7.4402631578946998E-3 | FZ24: =+RC[-2]/RC[-4]-1 -> -6.4286506445642155E-3 | GA24: 1670 | GB24: 1649 | GC24: =+RC[-1]/RC[-2]-1 -> -1.2574850299401197E-2 | GD24: 0 | GE24: 200000 | GF24: 0 | GG24: =+RC[-1]/RC[-2]-1 -> -1 | GH24: =+RC[-2]/RC[-4]-1 -> #DIV/0! | GI24: 0 | GJ24: 0 | GK24: =+RC[-1]/RC[-2]-1 -> #DIV/0! | GL24: 3598375 | GM24: 3200000 | GN24: 2616033 | GO24: =+RC[-1]/RC[-2]-1 -> -0.18248968750000005 | GP24: =+RC[-2]/RC[-4]-1 -> -0.27299600514120959 | GQ24: 1998 | GR24: 2219 | GS24: =+RC[-1]/RC[-2]-1 -> 0.11061061061061062 | GT24: 889245 | GU24: 950000 | GV24: 721480 | GW24: =+RC[-1]/RC[-2]-1 -> -0.24054736842105262 | GX24: =+RC[-2]/RC[-4]-1 -> -0.18866004307024498 | GY24: 787 | GZ24: 871 | HA24: =+RC[-1]/RC[-2]-1 -> 0.10673443456162635 | HB24: 2097143 | HC24: 2390719 | HD24: 1667765 | HE24: =+RC[-1]/RC[-2]-1 -> -0.30240024026244827 | HF24: =+RC[-2]/RC[-4]-1 -> -0.20474426398199841 | HG24: 969 | HH24: 1234 | HI24: =+RC[-1]/RC[-2]-1 -> 0.27347781217750256 | HJ24: 1862379 | HK24: 2106964 | HL24: 1699035 | HM24: =+RC[-1]/RC[-2]-1 -> -0.19360985759604821 | HN24: =+RC[-2]/RC[-4]-1 -> -8.7707174533217969E-2 | HO24: 1430 | HP24: 1383 | HQ24: =+RC[-1]/RC[-2]-1 -> -3.2867132867132831E-2 | HR24: 1121182 | HS24: 1299987 | HT24: 1439667 | HU24: =+RC[-1]/RC[-2]-1 -> 0.10744722831843712 | HV24: =+RC[-2]/RC[-4]-1 -> 0.28406182047160944 | HW24: 1412 | HX24: 1308 | HY24: =+RC[-1]/RC[-2]-1 -> -7.3654390934844161E-2 | HZ24: 1822236 | IA24: 2225000 | IB24: 2339018 | IC24: =+RC[-1]/RC[-2]-1 -> 5.1244044943820288E-2 | ID24: =+RC[-2]/RC[-4]-1 -> 0.2835977337732325 | IE24: 1546 | IF24: 1280 | IG24: =+RC[-1]/RC[-2]-1 -> -0.17205692108667525 | IH24: 891048 | II24: 889041 | IJ24: 997464 | IK24: =+RC[-1]/RC[-2]-1 -> 0.12195500544969251 | IL24: =+RC[-2]/RC[-4]-1 -> 0.11942790960756322 | IM24: 788 | IN24: 714 | IO24: =+RC[-1]/RC[-2]-1 -> -9.3908629441624369E-2
A25: 21.01.2016 | B25: 56870084 | C25: 63524938 | D25: 59542763 | E25: =+RC[-1]/RC[-2]-1 -> -6.2686798686840128E-2 | F25: =+RC[-2]/RC[-4]-1 -> 4.6996220367812258E-2 | G25: 38693 | H25: 37867 | I25: =+RC[-1]/RC[-2]-1 -> -2.1347530561083405E-2 | J25: 0 | K25: 752168 | L25: 698322 | M25: =+RC[-1]/RC[-2]-1 -> -7.1587730400655136E-2 | N25: =+RC[-2]/RC[-4]-1 -> #DIV/0! | O25: 774 | P25: 0 | Q25: =+RC[-1]/RC[-2]-1 -> -1 | R25: 482405 | S25: 694958 | T25: 613449 | U25: =+RC[-1]/RC[-2]-1 -> -0.11728622449126425 | V25: =+RC[-2]/RC[-4]-1 -> 0.27164726733761047 | W25: 653 | X25: 565 | Y25: =+RC[-1]/RC[-2]-1 -> -0.13476263399693722 | Z25: 0 | AA25: 700000 | AB25: 607946 | AC25: =+RC[-1]/RC[-2]-1 -> -0.13150571428571434 | AD25: =+RC[-2]/RC[-4]-1 -> #DIV/0! | AE25: 383 | AF25: 0 | AG25: =+RC[-1]/RC[-2]-1 -> -1 | AH25: 1300923 | AI25: 2046179 | AJ25: 2491749 | AK25: =+RC[-1]/RC[-2]-1 -> 0.21775709749733529 | AL25: =+RC[-2]/RC[-4]-1 -> 0.91537008723806101 | AM25: 2553 | AN25: 1343 | AO25: =+RC[-1]/RC[-2]-1 -> -0.4739522130826479 | AP25: 7217874 | AQ25: 6471624 | AR25: 7143348 | AS25: =+RC[-1]/RC[-2]-1 -> 0.1037952761161649 | AT25: =+RC[-2]/RC[-4]-1 -> -1.0325201021796682E-2 | AU25: 3710 | AV25: 4275 | AW25: =+RC[-1]/RC[-2]-1 -> 0.15229110512129385 | AX25: 3734398 | AY25: 4656973 | AZ25: 4467159 | BA25: =+RC[-1]/RC[-2]-1 -> -4.0759093943641078E-2 | BB25: =+RC[-2]/RC[-4]-1 -> 0.19621931031454065 | BC25: 2512 | BD25: 2386 | BE25: =+RC[-1]/RC[-2]-1 -> -5.015923566878977E-2 | BF25: 1480098 | BG25: 1555814 | BH25: 1232443 | BI25: =+RC[-1]/RC[-2]-1 -> -0.20784682487752393 | BJ25: =+RC[-2]/RC[-4]-1 -> -0.16732337993835544 | BK25: 1088 | BL25: 1339 | BM25: =+RC[-1]/RC[-2]-1 -> 0.23069852941176472 | BN25: 979535 | BO25: 1200000 | BP25: 797727 | BQ25: =+RC[-1]/RC[-2]-1 -> -0.33522750000000001 | BR25: =+RC[-2]/RC[-4]-1 -> -0.1856064357067384 | BS25: 1188 | BT25: 1339 | BU25: =+RC[-1]/RC[-2]-1 -> 0.12710437710437716 | BV25: 8224878 | BW25: 9944525 | BX25: 8859705 | BY25: =+RC[-1]/RC[-2]-1 -> -0.10908716102579052 | BZ25: =+RC[-2]/RC[-4]-1 -> 7.7183758835085436E-2 | CA25: 2793 | CB25: 2854 | CC25: =+RC[-1]/RC[-2]-1 -> 2.1840315073397676E-2 | CD25: 2291041 | CE25: 2541063 | CF25: 1838293 | CG25: =+RC[-1]/RC[-2]-1 -> -0.27656535867076104 | CH25: =+RC[-2]/RC[-4]-1 -> -0.19761671659302471 | CI25: 1464 | CJ25: 1437 | CK25: =+RC[-1]/RC[-2]-1 -> -1.8442622950819665E-2 | CL25: 1187327 | CM25: 1213333 | CN25: 1213138 | CO25: =+RC[-1]/RC[-2]-1 -> -1.6071432986652923E-4 | CP25: =+RC[-2]/RC[-4]-1 -> 2.1738745939408499E-2 | CQ25: 914 | CR25: 963 | CS25: =+RC[-1]/RC[-2]-1 -> 5.361050328227579E-2 | CT25: 2680008 | CU25: 2217953 | CV25: 2572083 | CW25: =+RC[-1]/RC[-2]-1 -> 0.15966524087751188 | CX25: =+RC[-2]/RC[-4]-1 -> -4.0270402177903897E-2 | CY25: 1189 | CZ25: 1199 | DA25: =+RC[-1]/RC[-2]-1 -> 8.410428931875602E-3 | DB25: 0 | DC25: 0 | DD25: 0 | DE25: =+RC[-1]/RC[-2]-1 -> #DIV/0! | DF25: =+RC[-2]/RC[-4]-1 -> #DIV/0! | DG25: 0 | DH25: 0 | DI25: =+RC[-1]/RC[-2]-1 -> #DIV/0! | DJ25: 0 | DK25: 0 | DL25: 0 | DM25: =+RC[-1]/RC[-2]-1 -> #DIV/0! | DN25: =+RC[-2]/RC[-4]-1 -> #DIV/0! | DO25: 0 | DP25: 0 | DQ25: =+RC[-1]/RC[-2]-1 -> #DIV/0! | DR25: 1492388 | DS25: 1600000 | DT25: 779828 | DU25: =+RC[-1]/RC[-2]-1 -> -0.51260749999999999 | DV25: =+RC[-2]/RC[-4]-1 -> -0.47746296539505817 | DW25: 1057 | DX25: 1548 | DY25: =+RC[-1]/RC[-2]-1 -> 0.46452223273415316 | DZ25: 1272077 | EA25: 1500000 | EB25: 1229997 | EC25: =+RC[-1]/RC[-2]-1 -> -0.180002 | ED25: =+RC[-2]/RC[-4]-1 -> -3.3079758536629478E-2 | EE25: 1017 | EF25: 1068 | EG25: =+RC[-1]/RC[-2]-1 -> 5.0147492625368661E-2 | EH25: 3233670 | EI25: 3774412 | EJ25: 3475437 | EK25: =+RC[-1]/RC[-2]-1 -> -7.9211013530054442E-2 | EL25: =+RC[-2]/RC[-4]-1 -> 7.4765514106263087E-2 | EM25: 2801 | EN25: 2779 | EO25: =+RC[-1]/RC[-2]-1 -> -7.8543377365226652E-3 | EP25: 2514782 | EQ25: 2489003 | ER25: 3393055 | ES25: =+RC[-1]/RC[-2]-1 -> 0.36321852565063195 | ET25: =+RC[-2]/RC[-4]-1 -> 0.34924418895952014 | EU25: 1819 | EV25: 1582 | EW25: =+RC[-1]/RC[-2]-1 -> -0.13029136888400217 | EX25: 420826 | EY25: 308506 | EZ25: 175376 | FA25: =+RC[-1]/RC[-2]-1 -> -0.43153131543632861 | FB25: =+RC[-2]/RC[-4]-1 -> -0.58325768845080872 | FC25: 239 | FD25: 424 | FE25: =+RC[-1]/RC[-2]-1 -> 0.77405857740585771 | FF25: 3106012 | FG25: 2700000 | FH25: 2342684 | FI25: =+RC[-1]/RC[-2]-1 -> -0.13233925925925927 | FJ25: =+RC[-2]/RC[-4]-1 -> -0.24575822630434141 | FK25: 1718 | FL25: 1731 | FM25: =+RC[-1]/RC[-2]-1 -> 7.5669383003491575E-3 | FN25: 562441 | FO25: 400000 | FP25: 155823 | FQ25: =+RC[-1]/RC[-2]-1 -> -0.6104425 | FR25: =+RC[-2]/RC[-4]-1 -> -0.72295227410519503 | FS25: 351 | FT25: 591 | FU25: =+RC[-1]/RC[-2]-1 -> 0.68376068376068377 | FV25: 3478139 | FW25: 3900000 | FX25: 4091229 | FY25: =+RC[-1]/RC[-2]-1 -> 4.9033076923076901E-2 | FZ25: =+RC[-2]/RC[-4]-1 -> 0.17626955104439479 | GA25: 1731 | GB25: 1583 | GC25: =+RC[-1]/RC[-2]-1 -> -8.5499711149624513E-2 | GD25: 0 | GE25: 200000 | GF25: 0 | GG25: =+RC[-1]/RC[-2]-1 -> -1 | GH25: =+RC[-2]/RC[-4]-1 -> #DIV/0! | GI25: 0 | GJ25: 0 | GK25: =+RC[-1]/RC[-2]-1 -> #DIV/0! | GL25: 2811364 | GM25: 3500000 | GN25: 2717713 | GO25: =+RC[-1]/RC[-2]-1 -> -0.22351057142857145 | GP25: =+RC[-2]/RC[-4]-1 -> -3.3311588253957858E-2 | GQ25: 1969 | GR25: 1941 | GS25: =+RC[-1]/RC[-2]-1 -> -1.4220416455053342E-2 | GT25: 815406 | GU25: 950000 | GV25: 709066 | GW25: =+RC[-1]/RC[-2]-1 -> -0.25361473684210523 | GX25: =+RC[-2]/RC[-4]-1 -> -0.13041356085189459 | GY25: 782 | GZ25: 885 | HA25: =+RC[-1]/RC[-2]-1 -> 0.13171355498721238 | HB25: 2123953 | HC25: 2309218 | HD25: 1668056 | HE25: =+RC[-1]/RC[-2]-1 -> -0.27765330081438822 | HF25: =+RC[-2]/RC[-4]-1 -> -0.21464552181710239 | HG25: 989 | HH25: 1265 | HI25: =+RC[-1]/RC[-2]-1 -> 0.27906976744186052 | HJ25: 1735225 | HK25: 1885179 | HL25: 1626939 | HM25: =+RC[-1]/RC[-2]-1 -> -0.13698433941816668 | HN25: =+RC[-2]/RC[-4]-1 -> -6.2404587301358561E-2 | HO25: 1335 | HP25: 1425 | HQ25: =+RC[-1]/RC[-2]-1 -> 6.7415730337078594E-2 | HR25: 1066648 | HS25: 1099989 | HT25: 1352005 | HU25: =+RC[-1]/RC[-2]-1 -> 0.2291077456229107 | HV25: =+RC[-2]/RC[-4]-1 -> 0.26752686922021129 | HW25: 1365 | HX25: 1345 | HY25: =+RC[-1]/RC[-2]-1 -> -1.46520146520146E-2 | HZ25: 1809174 | IA25: 2025000 | IB25: 2421231 | IC25: =+RC[-1]/RC[-2]-1 -> 0.19566962962962964 | ID25: =+RC[-2]/RC[-4]-1 -> 0.33830742648302481 | IE25: 1554 | IF25: 1287 | IG25: =+RC[-1]/RC[-2]-1 -> -0.1718146718146718 | IH25: 849492 | II25: 889041 | IJ25: 868962 | IK25: =+RC[-1]/RC[-2]-1 -> -2.2585010140139805E-2 | IL25: =+RC[-2]/RC[-4]-1 -> 2.2919580172620746E-2 | IM25: 745 | IN25: 713 | IO25: =+RC[-1]/RC[-2]-1 -> -4.2953020134228193E-2
A26: 22.01.2016 | B26: 58575202 | C26: 66426542 | D26: 65483164 | E26: =+RC[-1]/RC[-2]-1 -> -1.4201823120643553E-2 | F26: =+RC[-2]/RC[-4]-1 -> 0.11793321685856073 | G26: 40037 | H26: 37644 | I26: =+RC[-1]/RC[-2]-1 -> -5.9769713015460746E-2 | J26: 0 | K26: 859621 | L26: 585813 | M26: =+RC[-1]/RC[-2]-1 -> -0.31852176715087233 | N26: =+RC[-2]/RC[-4]-1 -> #DIV/0! | O26: 771 | P26: 0 | Q26: =+RC[-1]/RC[-2]-1 -> -1 | R26: 428514 | S26: 694958 | T26: 600112 | U26: =+RC[-1]/RC[-2]-1 -> -0.13647731229800941 | V26: =+RC[-2]/RC[-4]-1 -> 0.40044899349846208 | W26: 683 | X26: 519 | Y26: =+RC[-1]/RC[-2]-1 -> -0.24011713030746706 | Z26: 0 | AA26: 900000 | AB26: 624922 | AC26: =+RC[-1]/RC[-2]-1 -> -0.30564222222222226 | AD26: =+RC[-2]/RC[-4]-1 -> #DIV/0! | AE26: 389 | AF26: 0 | AG26: =+RC[-1]/RC[-2]-1 -> -1 | AH26: 1446320 | AI26: 2232195 | AJ26: 2686031 | AK26: =+RC[-1]/RC[-2]-1 -> 0.20331377859013222 | AL26: =+RC[-2]/RC[-4]-1 -> 0.85714848719508829 | AM26: 2520 | AN26: 1389 | AO26: =+RC[-1]/RC[-2]-1 -> -0.44880952380952377 | AP26: 7378369 | AQ26: 6661966 | AR26: 7895348 | AS26: =+RC[-1]/RC[-2]-1 -> 0.18513784069147166 | AT26: =+RC[-2]/RC[-4]-1 -> 7.0066839975067685E-2 | AU26: 4055 | AV26: 4340 | AW26: =+RC[-1]/RC[-2]-1 -> 7.0283600493218357E-2 | AX26: 4272317 | AY26: 4709299 | AZ26: 4889310 | BA26: =+RC[-1]/RC[-2]-1 -> 3.8224585017855084E-2 | BB26: =+RC[-2]/RC[-4]-1 -> 0.14441648407643903 | BC26: 2602 | BD26: 2359 | BE26: =+RC[-1]/RC[-2]-1 -> -9.3389700230591899E-2 | BF26: 1392318 | BG26: 1555814 | BH26: 1276862 | BI26: =+RC[-1]/RC[-2]-1 -> -0.17929649688201799 | BJ26: =+RC[-2]/RC[-4]-1 -> -8.2923584985613918E-2 | BK26: 1168 | BL26: 1245 | BM26: =+RC[-1]/RC[-2]-1 -> 6.5924657534246478E-2 | BN26: 985286 | BO26: 1300000 | BP26: 791658 | BQ26: =+RC[-1]/RC[-2]-1 -> -0.39103230769230768 | BR26: =+RC[-2]/RC[-4]-1 -> -0.19651958923601875 | BS26: 1210 | BT26: 1347 | BU26: =+RC[-1]/RC[-2]-1 -> 0.11322314049586768 | BV26: 8621380 | BW26: 10252088 | BX26: 10696925 | BY26: =+RC[-1]/RC[-2]-1 -> 4.3389892868652691E-2 | BZ26: =+RC[-2]/RC[-4]-1 -> 0.24074394122518661 | CA26: 2899 | CB26: 2808 | CC26: =+RC[-1]/RC[-2]-1 -> -3.1390134529147962E-2 | CD26: 2175402 | CE26: 2635176 | CF26: 1997647 | CG26: =+RC[-1]/RC[-2]-1 -> -0.24193033027016031 | CH26: =+RC[-2]/RC[-4]-1 -> -8.1711334272929759E-2 | CI26: 1606 | CJ26: 1373 | CK26: =+RC[-1]/RC[-2]-1 -> -0.14508094645080949 | CL26: 1268478 | CM26: 1300000 | CN26: 1260268 | CO26: =+RC[-1]/RC[-2]-1 -> -3.0563076923076915E-2 | CP26: =+RC[-2]/RC[-4]-1 -> -6.4723235247280408E-3 | CQ26: 918 | CR26: 951 | CS26: =+RC[-1]/RC[-2]-1 -> 3.5947712418300748E-2 | CT26: 2430863 | CU26: 2217953 | CV26: 2706325 | CW26: =+RC[-1]/RC[-2]-1 -> 0.22019041882312207 | CX26: =+RC[-2]/RC[-4]-1 -> 0.11331860331084065 | CY26: 1193 | CZ26: 1101 | DA26: =+RC[-1]/RC[-2]-1 -> -7.7116512992456032E-2 | DB26: 0 | DC26: 0 | DD26: 0 | DE26: =+RC[-1]/RC[-2]-1 -> #DIV/0! | DF26: =+RC[-2]/RC[-4]-1 -> #DIV/0! | DG26: 0 | DH26: 0 | DI26: =+RC[-1]/RC[-2]-1 -> #DIV/0! | DJ26: 0 | DK26: 0 | DL26: 0 | DM26: =+RC[-1]/RC[-2]-1 -> #DIV/0! | DN26: =+RC[-2]/RC[-4]-1 -> #DIV/0! | DO26: 0 | DP26: 0 | DQ26: =+RC[-1]/RC[-2]-1 -> #DIV/0! | DR26: 1571716 | DS26: 1600000 | DT26: 836243 | DU26: =+RC[-1]/RC[-2]-1 -> -0.47734812500000001 | DV26: =+RC[-2]/RC[-4]-1 -> -0.46794268175675502 | DW26: 1109 | DX26: 1551 | DY26: =+RC[-1]/RC[-2]-1 -> 0.39855725879170434 | DZ26: 1471976 | EA26: 1600000 | EB26: 1465804 | EC26: =+RC[-1]/RC[-2]-1 -> -8.3872500000000016E-2 | ED26: =+RC[-2]/RC[-4]-1 -> -4.1930031467903861E-3 | EE26: 1033 | EF26: 1083 | EG26: =+RC[-1]/RC[-2]-1 -> 4.8402710551790795E-2 | EH26: 3021910 | EI26: 3984102 | EJ26: 3506564 | EK26: =+RC[-1]/RC[-2]-1 -> -0.11986088709576215 | EL26: =+RC[-2]/RC[-4]-1 -> 0.16038002455400724 | EM26: 2855 | EN26: 2694 | EO26: =+RC[-1]/RC[-2]-1 -> -5.6392294220665495E-2 | EP26: 2688880 | EQ26: 2765559 | ER26: 3820614 | ES26: =+RC[-1]/RC[-2]-1 -> 0.38149791778081754 | ET26: =+RC[-2]/RC[-4]-1 -> 0.4208942013031447 | EU26: 1899 | EV26: 1615 | EW26: =+RC[-1]/RC[-2]-1 -> -0.14955239599789361 | EX26: 389670 | EY26: 342430 | EZ26: 171509 | FA26: =+RC[-1]/RC[-2]-1 -> -0.4991414303653301 | FB26: =+RC[-2]/RC[-4]-1 -> -0.55986090794775067 | FC26: 243 | FD26: 417 | FE26: =+RC[-1]/RC[-2]-1 -> 0.71604938271604945 | FF26: 2539798 | FG26: 2700000 | FH26: 2531309 | FI26: =+RC[-1]/RC[-2]-1 -> -6.2478148148148116E-2 | FJ26: =+RC[-2]/RC[-4]-1 -> -3.3423917965129668E-3 | FK26: 1628 | FL26: 1714 | FM26: =+RC[-1]/RC[-2]-1 -> 5.2825552825552791E-2 | FN26: 480049 | FO26: 400000 | FP26: 241268 | FQ26: =+RC[-1]/RC[-2]-1 -> -0.39683000000000002 | FR26: =+RC[-2]/RC[-4]-1 -> -0.49740963943264127 | FS26: 372 | FT26: 614 | FU26: =+RC[-1]/RC[-2]-1 -> 0.65053763440860224 | FV26: 3916979 | FW26: 4000000 | FX26: 4648694 | FY26: =+RC[-1]/RC[-2]-1 -> 0.16217349999999997 | FZ26: =+RC[-2]/RC[-4]-1 -> 0.18680595428262436 | GA26: 1798 | GB26: 1616 | GC26: =+RC[-1]/RC[-2]-1 -> -0.10122358175750834 | GD26: 0 | GE26: 85000 | GF26: 0 | GG26: =+RC[-1]/RC[-2]-1 -> -1 | GH26: =+RC[-2]/RC[-4]-1 -> #DIV/0! | GI26: 0 | GJ26: 0 | GK26: =+RC[-1]/RC[-2]-1 -> #DIV/0! | GL26: 3139769 | GM26: 3500000 | GN26: 2913053 | GO26: =+RC[-1]/RC[-2]-1 -> -0.16769914285714282 | GP26: =+RC[-2]/RC[-4]-1 -> -7.2207859877589708E-2 | GQ26: 2086 | GR26: 1973 | GS26: =+RC[-1]/RC[-2]-1 -> -5.417066155321193E-2 | GT26: 854293 | GU26: 950000 | GV26: 762335 | GW26: =+RC[-1]/RC[-2]-1 -> -0.19754210526315785 | GX26: =+RC[-2]/RC[-4]-1 -> -0.10764222579372651 | GY26: 819 | GZ26: 940 | HA26: =+RC[-1]/RC[-2]-1 -> 0.14774114774114766 | HB26: 2328613 | HC26: 2499389 | HD26: 1796218 | HE26: =+RC[-1]/RC[-2]-1 -> -0.28133715880161114 | HF26: =+RC[-2]/RC[-4]-1 -> -0.22863180786158976 | HG26: 1003 | HH26: 1231 | HI26: =+RC[-1]/RC[-2]-1 -> 0.22731804586241267 | HJ26: 1875843 | HK26: 2106964 | HL26: 1828377 | HM26: =+RC[-1]/RC[-2]-1 -> -0.1322220028439024 | HN26: =+RC[-2]/RC[-4]-1 -> -2.5303823400998904E-2 | HO26: 1444 | HP26: 1414 | HQ26: =+RC[-1]/RC[-2]-1 -> -2.0775623268698085E-2 | HR26: 1233666 | HS26: 1299987 | HT26: 1305618 | HU26: =+RC[-1]/RC[-2]-1 -> 4.3315817773561527E-3 | HV26: =+RC[-2]/RC[-4]-1 -> 5.8323727816118831E-2 | HW26: 1362 | HX26: 1355 | HY26: =+RC[-1]/RC[-2]-1 -> -5.1395007342144305E-3 | HZ26: 1845970 | IA26: 2385000 | IB26: 2652777 | IC26: =+RC[-1]/RC[-2]-1 -> 0.11227547169811314 | ID26: =+RC[-2]/RC[-4]-1 -> 0.43706398262160273 | IE26: 1614 | IF26: 1273 | IG26: =+RC[-1]/RC[-2]-1 -> -0.21127633209417596 | IH26: 816823 | II26: 889041 | IJ26: 991560 | IK26: =+RC[-1]/RC[-2]-1 -> 0.11531414186747302 | IL26: =+RC[-2]/RC[-4]-1 -> 0.21392272254821432 | IM26: 758 | IN26: 722 | IO26: =+RC[-1]/RC[-2]-1 -> -4.7493403693931402E-2
A27: 23.01.2016 | B27: 62624910 | C27: 76524176 | D27: 80517318 | E27: =+RC[-1]/RC[-2]-1 -> 5.2181443940017003E-2 | F27: =+RC[-2]/RC[-4]-1 -> 0.28570752437009483 | G27: 42661 | H27: 38874 | I27: =+RC[-1]/RC[-2]-1 -> -8.8769602212793841E-2 | J27: 0 | K27: 1181979 | L27: 951332 | M27: =+RC[-1]/RC[-2]-1 -> -0.19513629260756749 | N27: =+RC[-2]/RC[-4]-1 -> #DIV/0! | O27: 944 | P27: 0 | Q27: =+RC[-1]/RC[-2]-1 -> -1 | R27: 502394 | S27: 741289 | T27: 617178 | U27: =+RC[-1]/RC[-2]-1 -> -0.16742592969813397 | V27: =+RC[-2]/RC[-4]-1 -> 0.22847406617117239 | W27: 635 | X27: 567 | Y27: =+RC[-1]/RC[-2]-1 -> -0.1070866141732284 | Z27: 0 | AA27: 900000 | AB27: 725165 | AC27: =+RC[-1]/RC[-2]-1 -> -0.19426111111111111 | AD27: =+RC[-2]/RC[-4]-1 -> #DIV/0! | AE27: 397 | AF27: 0 | AG27: =+RC[-1]/RC[-2]-1 -> -1 | AH27: 1340034 | AI27: 2883252 | AJ27: 3478407 | AK27: =+RC[-1]/RC[-2]-1 -> 0.20641796138526924 | AL27: =+RC[-2]/RC[-4]-1 -> 1.5957602568293043 | AM27: 2835 | AN27: 1433 | AO27: =+RC[-1]/RC[-2]-1 -> -0.49453262786596119 | AP27: 7844433 | AQ27: 9041239 | AR27: 10297481 | AS27: =+RC[-1]/RC[-2]-1 -> 0.1389457794446094 | AT27: =+RC[-2]/RC[-4]-1 -> 0.3127119576392583 | AU27: 4933 | AV27: 4512 | AW27: =+RC[-1]/RC[-2]-1 -> -8.5343604297587694E-2 | AX27: 4393161 | AY27: 5755810 | AZ27: 6431494 | BA27: =+RC[-1]/RC[-2]-1 -> 0.11739164426900817 | BB27: =+RC[-2]/RC[-4]-1 -> 0.46397867048350827 | BC27: 3058 | BD27: 2353 | BE27: =+RC[-1]/RC[-2]-1 -> -0.23054283845650747 | BF27: 1589112 | BG27: 1244651 | BH27: 1253213 | BI27: =+RC[-1]/RC[-2]-1 -> 6.8790367741640157E-3 | BJ27: =+RC[-2]/RC[-4]-1 -> -0.21137528380630188 | BK27: 982 | BL27: 1343 | BM27: =+RC[-1]/RC[-2]-1 -> 0.36761710794297353 | BN27: 925035 | BO27: 1400000 | BP27: 896287 | BQ27: =+RC[-1]/RC[-2]-1 -> -0.35979499999999998 | BR27: =+RC[-2]/RC[-4]-1 -> -3.1077743004318759E-2 | BS27: 1397 | BT27: 1271 | BU27: =+RC[-1]/RC[-2]-1 -> -9.0193271295633481E-2 | BV27: 9171312 | BW27: 11789901 | BX27: 12916766 | BY27: =+RC[-1]/RC[-2]-1 -> 9.5578834801072654E-2 | BZ27: =+RC[-2]/RC[-4]-1 -> 0.40838802561727272 | CA27: 2875 | CB27: 2911 | CC27: =+RC[-1]/RC[-2]-1 -> 1.2521739130434861E-2 | CD27: 1909931 | CE27: 2572466 | CF27: 2459060 | CG27: =+RC[-1]/RC[-2]-1 -> -4.4084547667491036E-2 | CH27: =+RC[-2]/RC[-4]-1 -> 0.28751248081736991 | CI27: 1678 | CJ27: 1485 | CK27: =+RC[-1]/RC[-2]-1 -> -0.11501787842669842 | CL27: 1356579 | CM27: 1473333 | CN27: 1702863 | CO27: =+RC[-1]/RC[-2]-1 -> 0.15578962800670326 | CP27: =+RC[-2]/RC[-4]-1 -> 0.2552626865077523 | CQ27: 1095 | CR27: 1017 | CS27: =+RC[-1]/RC[-2]-1 -> -7.1232876712328808E-2 | CT27: 3002616 | CU27: 2419585 | CV27: 3618448 | CW27: =+RC[-1]/RC[-2]-1 -> 0.49548290305982223 | CX27: =+RC[-2]/RC[-4]-1 -> 0.20509848745227499 | CY27: 1212 | CZ27: 1257 | DA27: =+RC[-1]/RC[-2]-1 -> 3.7128712871287162E-2 | DB27: 0 | DC27: 0 | DD27: 0 | DE27: =+RC[-1]/RC[-2]-1 -> #DIV/0! | DF27: =+RC[-2]/RC[-4]-1 -> #DIV/0! | DG27: 0 | DH27: 0 | DI27: =+RC[-1]/RC[-2]-1 -> #DIV/0! | DJ27: 0 | DK27: 0 | DL27: 0 | DM27: =+RC[-1]/RC[-2]-1 -> #DIV/0! | DN27: =+RC[-2]/RC[-4]-1 -> #DIV/0! | DO27: 0 | DP27: 0 | DQ27: =+RC[-1]/RC[-2]-1 -> #DIV/0! | DR27: 1599252 | DS27: 1900000 | DT27: 1090630 | DU27: =+RC[-1]/RC[-2]-1 -> -0.42598421052631574 | DV27: =+RC[-2]/RC[-4]-1 -> -0.31803743249969363 | DW27: 1318 | DX27: 1574 | DY27: =+RC[-1]/RC[-2]-1 -> 0.19423368740515934 | DZ27: 1718360 | EA27: 1600000 | EB27: 1526004 | EC27: =+RC[-1]/RC[-2]-1 -> -4.6247499999999997E-2 | ED27: =+RC[-2]/RC[-4]-1 -> -0.11194161875276432 | EE27: 988 | EF27: 1148 | EG27: =+RC[-1]/RC[-2]-1 -> 0.16194331983805665 | EH27: 3290568 | EI27: 3564723 | EJ27: 3541122 | EK27: =+RC[-1]/RC[-2]-1 -> -6.6207107817353172E-3 | EL27: =+RC[-2]/RC[-4]-1 -> 7.6143085327518012E-2 | EM27: 2290 | EN27: 2771 | EO27: =+RC[-1]/RC[-2]-1 -> 0.21004366812227082 | EP27: 2473627 | EQ27: 2949930 | ER27: 5240935 | ES27: =+RC[-1]/RC[-2]-1 -> 0.77663029292220487 | ET27: =+RC[-2]/RC[-4]-1 -> 1.1187248522109439 | EU27: 2118 | EV27: 1614 | EW27: =+RC[-1]/RC[-2]-1 -> -0.23796033994334276 | EX27: 396751 | EY27: 348363 | EZ27: 159079 | FA27: =+RC[-1]/RC[-2]-1 -> -0.54335276708490854 | FB27: =+RC[-2]/RC[-4]-1 -> -0.59904574909704067 | FC27: 254 | FD27: 432 | FE27: =+RC[-1]/RC[-2]-1 -> 0.70078740157480324 | FF27: 3145943 | FG27: 2900000 | FH27: 2895796 | FI27: =+RC[-1]/RC[-2]-1 -> -1.4496551724137996E-3 | FJ27: =+RC[-2]/RC[-4]-1 -> -7.9514155215145377E-2 | FK27: 1681 | FL27: 1815 | FM27: =+RC[-1]/RC[-2]-1 -> 7.9714455681142216E-2 | FN27: 577784 | FO27: 550000 | FP27: 335824 | FQ27: =+RC[-1]/RC[-2]-1 -> -0.38941090909090914 | FR27: =+RC[-2]/RC[-4]-1 -> -0.41877241322016534 | FS27: 469 | FT27: 579 | FU27: =+RC[-1]/RC[-2]-1 -> 0.23454157782515983 | FV27: 3746382 | FW27: 6200000 | FX27: 6377316 | FY27: =+RC[-1]/RC[-2]-1 -> 2.8599354838709568E-2 | FZ27: =+RC[-2]/RC[-4]-1 -> 0.70225994039048878 | GA27: 2024 | GB27: 1629 | GC27: =+RC[-1]/RC[-2]-1 -> -0.19515810276679846 | GD27: 0 | GE27: 160000 | GF27: 0 | GG27: =+RC[-1]/RC[-2]-1 -> -1 | GH27: =+RC[-2]/RC[-4]-1 -> #DIV/0! | GI27: 0 | GJ27: 0 | GK27: =+RC[-1]/RC[-2]-1 -> #DIV/0! | GL27: 3967206 | GM27: 4000000 | GN27: 3928239 | GO27: =+RC[-1]/RC[-2]-1 -> -1.7940249999999991E-2 | GP27: =+RC[-2]/RC[-4]-1 -> -9.8222779457380893E-3 | GQ27: 2652 | GR27: 2123 | GS27: =+RC[-1]/RC[-2]-1 -> -0.19947209653092002 | GT27: 930886 | GU27: 1100000 | GV27: 844527 | GW27: =+RC[-1]/RC[-2]-1 -> -0.23224818181818185 | GX27: =+RC[-2]/RC[-4]-1 -> -9.2770758180915847E-2 | GY27: 807 | GZ27: 901 | HA27: =+RC[-1]/RC[-2]-1 -> 0.11648079306071879 | HB27: 2256944 | HC27: 2336385 | HD27: 2134029 | HE27: =+RC[-1]/RC[-2]-1 -> -8.661072554394933E-2 | HF27: =+RC[-2]/RC[-4]-1 -> -5.4460810724590414E-2 | HG27: 1060 | HH27: 1268 | HI27: =+RC[-1]/RC[-2]-1 -> 0.19622641509433958 | HJ27: 1944002 | HK27: 2217857 | HL27: 1942740 | HM27: =+RC[-1]/RC[-2]-1 -> -0.12404632038945707 | HN27: =+RC[-2]/RC[-4]-1 -> -6.4917628685567941E-4 | HO27: 1318 | HP27: 1461 | HQ27: =+RC[-1]/RC[-2]-1 -> 0.10849772382397571 | HR27: 1465117 | HS27: 1999980 | HT27: 1629273 | HU27: =+RC[-1]/RC[-2]-1 -> -0.1853553535535355 | HV27: =+RC[-2]/RC[-4]-1 -> 0.11204292899474932 | HW27: 1556 | HX27: 1351 | HY27: =+RC[-1]/RC[-2]-1 -> -0.1317480719794345 | HZ27: 2227588 | IA27: 2355000 | IB27: 2564982 | IC27: =+RC[-1]/RC[-2]-1 -> 8.9164331210191072E-2 | ID27: =+RC[-2]/RC[-4]-1 -> 0.15146158086683892 | IE27: 1400 | IF27: 1337 | IG27: =+RC[-1]/RC[-2]-1 -> -4.500000000000004E-2 | IH27: 849893 | II27: 938433 | IJ27: 959128 | IK27: =+RC[-1]/RC[-2]-1 -> 2.2052719799921849E-2 | IL27: =+RC[-2]/RC[-4]-1 -> 0.12852794410590507 | IM27: 685 | IN27: 722 | IO27: =+RC[-1]/RC[-2]-1 -> 5.4014598540145897E-2
A28: 24.01.2016 | B28: 77828273 | C28: 71741138 | D28: 71490278 | E28: =+RC[-1]/RC[-2]-1 -> -3.4967385100581616E-3 | F28: =+RC[-2]/RC[-4]-1 -> -8.1435637149497087E-2 | G28: 41877 | H28: 40738 | I28: =+RC[-1]/RC[-2]-1 -> -2.7198700957566158E-2 | J28: 0 | K28: 1181979 | L28: 1004354 | M28: =+RC[-1]/RC[-2]-1 -> -0.15027762760590502 | N28: =+RC[-2]/RC[-4]-1 -> #DIV/0! | O28: 935 | P28: 0 | Q28: =+RC[-1]/RC[-2]-1 -> -1 | R28: 483166 | S28: 555967 | T28: 640128 | U28: =+RC[-1]/RC[-2]-1 -> 0.15137768968302079 | V28: =+RC[-2]/RC[-4]-1 -> 0.32486143478638807 | W28: 615 | X28: 558 | Y28: =+RC[-1]/RC[-2]-1 -> -9.2682926829268264E-2 | Z28: 0 | AA28: 900000 | AB28: 577418 | AC28: =+RC[-1]/RC[-2]-1 -> -0.35842444444444443 | AD28: =+RC[-2]/RC[-4]-1 -> #DIV/0! | AE28: 330 | AF28: 0 | AG28: =+RC[-1]/RC[-2]-1 -> -1 | AH28: 2284639 | AI28: 2790244 | AJ28: 3502715 | AK28: =+RC[-1]/RC[-2]-1 -> 0.25534361869427902 | AL28: =+RC[-2]/RC[-4]-1 -> 0.53315906801906121 | AM28: 2995 | AN28: 1789 | AO28: =+RC[-1]/RC[-2]-1 -> -0.40267111853088478 | AP28: 11910384 | AQ28: 8089530 | AR28: 9131509 | AS28: =+RC[-1]/RC[-2]-1 -> 0.12880587623755635 | AT28: =+RC[-2]/RC[-4]-1 -> -0.23331531544239048 | AU28: 4937 | AV28: 5722 | AW28: =+RC[-1]/RC[-2]-1 -> 0.15900344338667205 | AX28: 5712498 | AY28: 5232554 | AZ28: 5727827 | BA28: =+RC[-1]/RC[-2]-1 -> 9.46522482137786E-2 | BB28: =+RC[-2]/RC[-4]-1 -> 2.6834145062282211E-3 | BC28: 3105 | BD28: 2794 | BE28: =+RC[-1]/RC[-2]-1 -> -0.10016103059581316 | BF28: 1530759 | BG28: 1244651 | BH28: 965925 | BI28: =+RC[-1]/RC[-2]-1 -> -0.22393908011161356 | BJ28: =+RC[-2]/RC[-4]-1 -> -0.36898950128661667 | BK28: 758 | BL28: 1001 | BM28: =+RC[-1]/RC[-2]-1 -> 0.32058047493403685 | BN28: 1203881 | BO28: 1300000 | BP28: 972234 | BQ28: =+RC[-1]/RC[-2]-1 -> -0.25212769230769227 | BR28: =+RC[-2]/RC[-4]-1 -> -0.19241685847687606 | BS28: 1484 | BT28: 1452 | BU28: =+RC[-1]/RC[-2]-1 -> -2.1563342318059342E-2 | BV28: 12732931 | BW28: 11277297 | BX28: 10019265 | BY28: =+RC[-1]/RC[-2]-1 -> -0.11155439109212073 | BZ28: =+RC[-2]/RC[-4]-1 -> -0.21312186487148954 | CA28: 2427 | CB28: 2805 | CC28: =+RC[-1]/RC[-2]-1 -> 0.15574783683559956 | CD28: 2389297 | CE28: 2572440 | CF28: 2016894 | CG28: =+RC[-1]/RC[-2]-1 -> -0.21596072211596773 | CH28: =+RC[-2]/RC[-4]-1 -> -0.15586300070690251 | CI28: 1515 | CJ28: 1522 | CK28: =+RC[-1]/RC[-2]-1 -> 4.6204620462046986E-3 | CL28: 1648554 | CM28: 1386667 | CN28: 1439317 | CO28: =+RC[-1]/RC[-2]-1 -> 3.796874087289881E-2 | CP28: =+RC[-2]/RC[-4]-1 -> -0.12692153244601023 | CQ28: 1045 | CR28: 1110 | CS28: =+RC[-1]/RC[-2]-1 -> 6.2200956937799035E-2 | CT28: 3461502 | CU28: 2419585 | CV28: 3459322 | CW28: =+RC[-1]/RC[-2]-1 -> 0.42971707958182903 | CX28: =+RC[-2]/RC[-4]-1 -> -6.2978441150696174E-4 | CY28: 1118 | CZ28: 1100 | DA28: =+RC[-1]/RC[-2]-1 -> -1.610017889087656E-2 | DB28: 0 | DC28: 0 | DD28: 0 | DE28: =+RC[-1]/RC[-2]-1 -> #DIV/0! | DF28: =+RC[-2]/RC[-4]-1 -> #DIV/0! | DG28: 0 | DH28: 0 | DI28: =+RC[-1]/RC[-2]-1 -> #DIV/0! | DJ28: 0 | DK28: 0 | DL28: 0 | DM28: =+RC[-1]/RC[-2]-1 -> #DIV/0! | DN28: =+RC[-2]/RC[-4]-1 -> #DIV/0! | DO28: 0 | DP28: 0 | DQ28: =+RC[-1]/RC[-2]-1 -> #DIV/0! | DR28: 1758127 | DS28: 1800000 | DT28: 1158717 | DU28: =+RC[-1]/RC[-2]-1 -> -0.3562683333333333 | DV28: =+RC[-2]/RC[-4]-1 -> -0.34093669001158622 | DW28: 1517 | DX28: 1583 | DY28: =+RC[-1]/RC[-2]-1 -> 4.3506921555702016E-2 | DZ28: 1633601 | EA28: 1450000 | EB28: 1263834 | EC28: =+RC[-1]/RC[-2]-1 -> -0.12839034482758616 | ED28: =+RC[-2]/RC[-4]-1 -> -0.22635086535818727 | EE28: 841 | EF28: 1121 | EG28: =+RC[-1]/RC[-2]-1 -> 0.33293697978596914 | EH28: 3162328 | EI28: 3355033 | EJ28: 3000133 | EK28: =+RC[-1]/RC[-2]-1 -> -0.10578137383447495 | EL28: =+RC[-2]/RC[-4]-1 -> -5.1289746035199424E-2 | EM28: 2102 | EN28: 2163 | EO28: =+RC[-1]/RC[-2]-1 -> 2.9019980970504289E-2 | EP28: 3291417 | EQ28: 2765559 | ER28: 4785398 | ES28: =+RC[-1]/RC[-2]-1 -> 0.73035469501825845 | ET28: =+RC[-2]/RC[-4]-1 -> 0.45390207318003162 | EU28: 2284 | EV28: 1746 | EW28: =+RC[-1]/RC[-2]-1 -> -0.23555166374781089 | EX28: 451647 | EY28: 342430 | EZ28: 132964 | FA28: =+RC[-1]/RC[-2]-1 -> -0.61170458195835642 | FB28: =+RC[-2]/RC[-4]-1 -> -0.70560194133914322 | FC28: 223 | FD28: 439 | FE28: =+RC[-1]/RC[-2]-1 -> 0.96860986547085193 | FF28: 2737249 | FG28: 2600000 | FH28: 2567303 | FI28: =+RC[-1]/RC[-2]-1 -> -1.2575769230769196E-2 | FJ28: =+RC[-2]/RC[-4]-1 -> -6.2086423266571655E-2 | FK28: 1487 | FL28: 1699 | FM28: =+RC[-1]/RC[-2]-1 -> 0.14256893073301957 | FN28: 712248 | FO28: 550000 | FP28: 211081 | FQ28: =+RC[-1]/RC[-2]-1 -> -0.61621636363636356 | FR28: =+RC[-2]/RC[-4]-1 -> -0.70364114746548956 | FS28: 425 | FT28: 707 | FU28: =+RC[-1]/RC[-2]-1 -> 0.66352941176470592 | FV28: 5582414 | FW28: 5500000 | FX28: 5787394 | FY28: =+RC[-1]/RC[-2]-1 -> 5.2253454545454492E-2 | FZ28: =+RC[-2]/RC[-4]-1 -> 3.6718881831408368E-2 | GA28: 2081 | GB28: 1896 | GC28: =+RC[-1]/RC[-2]-1 -> -8.889956751561745E-2 | GD28: 0 | GE28: 180000 | GF28: 0 | GG28: =+RC[-1]/RC[-2]-1 -> -1 | GH28: =+RC[-2]/RC[-4]-1 -> #DIV/0! | GI28: 0 | GJ28: 0 | GK28: =+RC[-1]/RC[-2]-1 -> #DIV/0! | GL28: 4330669 | GM28: 3800000 | GN28: 3942643 | GO28: =+RC[-1]/RC[-2]-1 -> 3.7537631578947295E-2 | GP28: =+RC[-2]/RC[-4]-1 -> -8.9599551478074191E-2 | GQ28: 3106 | GR28: 2618 | GS28: =+RC[-1]/RC[-2]-1 -> -0.15711526078557625 | GT28: 939091 | GU28: 1150000 | GV28: 796633 | GW28: =+RC[-1]/RC[-2]-1 -> -0.30727565217391306 | GX28: =+RC[-2]/RC[-4]-1 -> -0.15169775879014924 | GY28: 699 | GZ28: 823 | HA28: =+RC[-1]/RC[-2]-1 -> 0.1773962804005722 | HB28: 2863759 | HC28: 2227716 | HD28: 1644557 | HE28: =+RC[-1]/RC[-2]-1 -> -0.26177439134970526 | HF28: =+RC[-2]/RC[-4]-1 -> -0.42573484710130982 | HG28: 958 | HH28: 1331 | HI28: =+RC[-1]/RC[-2]-1 -> 0.38935281837160751 | HJ28: 2197166 | HK28: 1996071 | HL28: 1678356 | HM28: =+RC[-1]/RC[-2]-1 -> -0.15917018983793663 | HN28: =+RC[-2]/RC[-4]-1 -> -0.2361269016542219 | HO28: 1238 | HP28: 1391 | HQ28: =+RC[-1]/RC[-2]-1 -> 0.12358642972536349 | HR28: 1745007 | HS28: 1849982 | HT28: 1846855 | HU28: =+RC[-1]/RC[-2]-1 -> -1.6902867163032242E-3 | HV28: =+RC[-2]/RC[-4]-1 -> 5.8365381915373327E-2 | HW28: 1604 | HX28: 1486 | HY28: =+RC[-1]/RC[-2]-1 -> -7.3566084788029951E-2 | HZ28: 2149120 | IA28: 2285000 | IB28: 2196597 | IC28: =+RC[-1]/RC[-2]-1 -> -3.8688402625820517E-2 | ID28: =+RC[-2]/RC[-4]-1 -> 2.2091367629541336E-2 | IE28: 1314 | IF28: 1212 | IG28: =+RC[-1]/RC[-2]-1 -> -7.7625570776255759E-2 | IH28: 916819 | II28: 938433 | IJ28: 1020905 | IK28: =+RC[-1]/RC[-2]-1 -> 8.7882672497663572E-2 | IL28: =+RC[-2]/RC[-4]-1 -> 0.11352949709811866 | IM28: 734 | IN28: 670 | IO28: =+RC[-1]/RC[-2]-1 -> -8.719346049046317E-2
A29: 25.01.2016 | B29: 70464499 | C29: 62009381 | D29: 59717953 | E29: =+RC[-1]/RC[-2]-1 -> -3.6952924913086993E-2 | F29: =+RC[-2]/RC[-4]-1 -> -0.15251007461218169 | G29: 39303 | H29: 39190 | I29: =+RC[-1]/RC[-2]-1 -> -2.8750985929827388E-3 | J29: 0 | K29: 752168 | L29: 528510 | M29: =+RC[-1]/RC[-2]-1 -> -0.29735112368513417 | N29: =+RC[-2]/RC[-4]-1 -> #DIV/0! | O29: 740 | P29: 0 | Q29: =+RC[-1]/RC[-2]-1 -> -1 | R29: 407354 | S29: 685692 | T29: 548515 | U29: =+RC[-1]/RC[-2]-1 -> -0.20005629349620524 | V29: =+RC[-2]/RC[-4]-1 -> 0.3465315180408195 | W29: 707 | X29: 469 | Y29: =+RC[-1]/RC[-2]-1 -> -0.3366336633663366 | Z29: 0 | AA29: 750000 | AB29: 558330 | AC29: =+RC[-1]/RC[-2]-1 -> -0.25556000000000001 | AD29: =+RC[-2]/RC[-4]-1 -> #DIV/0! | AE29: 397 | AF29: 0 | AG29: =+RC[-1]/RC[-2]-1 -> -1 | AH29: 2302332 | AI29: 2046179 | AJ29: 2391363 | AK29: =+RC[-1]/RC[-2]-1 -> 0.16869687353843421 | AL29: =+RC[-2]/RC[-4]-1 -> 3.8669922495973674E-2 | AM29: 2506 | AN29: 1814 | AO29: =+RC[-1]/RC[-2]-1 -> -0.27613727055067838 | AP29: 10766444 | AQ29: 6471624 | AR29: 7634972 | AS29: =+RC[-1]/RC[-2]-1 -> 0.17976137056170138 | AT29: =+RC[-2]/RC[-4]-1 -> -0.29085480777125672 | AU29: 3912 | AV29: 5784 | AW29: =+RC[-1]/RC[-2]-1 -> 0.47852760736196309 | AX29: 4861908 | AY29: 4395346 | AZ29: 4322362 | BA29: =+RC[-1]/RC[-2]-1 -> -1.6604836115291066E-2 | BB29: =+RC[-2]/RC[-4]-1 -> -0.11097412785268668 | BC29: 2434 | BD29: 2654 | BE29: =+RC[-1]/RC[-2]-1 -> 9.0386195562859539E-2 | BF29: 1245423 | BG29: 1452093 | BH29: 1331420 | BI29: =+RC[-1]/RC[-2]-1 -> -8.3102804021505494E-2 | BJ29: =+RC[-2]/RC[-4]-1 -> 6.9050435073063632E-2 | BK29: 1193 | BL29: 870 | BM29: =+RC[-1]/RC[-2]-1 -> -0.27074601844090529 | BN29: 1129440 | BO29: 1100000 | BP29: 728581 | BQ29: =+RC[-1]/RC[-2]-1 -> -0.33765363636363632 | BR29: =+RC[-2]/RC[-4]-1 -> -0.35491836662416776 | BS29: 1175 | BT29: 1397 | BU29: =+RC[-1]/RC[-2]-1 -> 0.18893617021276587 | BV29: 9317627 | BW29: 9739484 | BX29: 9452969 | BY29: =+RC[-1]/RC[-2]-1 -> -2.9417882918643334E-2 | BZ29: =+RC[-2]/RC[-4]-1 -> 1.4525372178989304E-2 | CA29: 2973 | CB29: 2401 | CC29: =+RC[-1]/RC[-2]-1 -> -0.19239825092499163 | CD29: 2461794 | CE29: 2494006 | CF29: 2213799 | CG29: =+RC[-1]/RC[-2]-1 -> -0.11235217557616139 | CH29: =+RC[-2]/RC[-4]-1 -> -0.10073751093714589 | CI29: 1710 | CJ29: 1424 | CK29: =+RC[-1]/RC[-2]-1 -> -0.1672514619883041 | CL29: 1617388 | CM29: 1213333 | CN29: 1186605 | CO29: =+RC[-1]/RC[-2]-1 -> -2.2028577480378453E-2 | CP29: =+RC[-2]/RC[-4]-1 -> -0.26634487210242686 | CQ29: 973 | CR29: 1075 | CS29: =+RC[-1]/RC[-2]-1 -> 0.10483042137718401 | CT29: 3311106 | CU29: 2217953 | CV29: 2768044 | CW29: =+RC[-1]/RC[-2]-1 -> 0.24801742868311449 | CX29: =+RC[-2]/RC[-4]-1 -> -0.16401226659611623 | CY29: 1215 | CZ29: 989 | DA29: =+RC[-1]/RC[-2]-1 -> -0.18600823045267489 | DB29: 0 | DC29: 0 | DD29: 0 | DE29: =+RC[-1]/RC[-2]-1 -> #DIV/0! | DF29: =+RC[-2]/RC[-4]-1 -> #DIV/0! | DG29: 0 | DH29: 0 | DI29: =+RC[-1]/RC[-2]-1 -> #DIV/0! | DJ29: 0 | DK29: 0 | DL29: 0 | DM29: =+RC[-1]/RC[-2]-1 -> #DIV/0! | DN29: =+RC[-2]/RC[-4]-1 -> #DIV/0! | DO29: 0 | DP29: 0 | DQ29: =+RC[-1]/RC[-2]-1 -> #DIV/0! | DR29: 2137933 | DS29: 1500000 | DT29: 736201 | DU29: =+RC[-1]/RC[-2]-1 -> -0.50919933333333334 | DV29: =+RC[-2]/RC[-4]-1 -> -0.65564823593629917 | DW29: 1049 | DX29: 1925 | DY29: =+RC[-1]/RC[-2]-1 -> 0.83508102955195418 | DZ29: 1544498 | EA29: 1500000 | EB29: 1249040 | EC29: =+RC[-1]/RC[-2]-1 -> -0.16730666666666671 | ED29: =+RC[-2]/RC[-4]-1 -> -0.19129710753914864 | EE29: 971 | EF29: 1006 | EG29: =+RC[-1]/RC[-2]-1 -> 3.6045314109165894E-2 | EH29: 2814049 | EI29: 3596176 | EJ29: 3400248 | EK29: =+RC[-1]/RC[-2]-1 -> -5.4482316772037853E-2 | EL29: =+RC[-2]/RC[-4]-1 -> 0.20831158234984537 | EM29: 3007 | EN29: 2004 | EO29: =+RC[-1]/RC[-2]-1 -> -0.33355503824409716 | EP29: 3440876 | EQ29: 2489003 | ER29: 2869071 | ES29: =+RC[-1]/RC[-2]-1 -> 0.15269889188562646 | ET29: =+RC[-2]/RC[-4]-1 -> -0.16618006577394828 | EU29: 1745 | EV29: 1708 | EW29: =+RC[-1]/RC[-2]-1 -> -2.1203438395415497E-2 | EX29: 443142 | EY29: 308506 | EZ29: 133953 | FA29: =+RC[-1]/RC[-2]-1 -> -0.56580098928383893 | FB29: =+RC[-2]/RC[-4]-1 -> -0.69771991822034474 | FC29: 225 | FD29: 444 | FE29: =+RC[-1]/RC[-2]-1 -> 0.97333333333333338 | FF29: 2611449 | FG29: 2650000 | FH29: 2329911 | FI29: =+RC[-1]/RC[-2]-1 -> -0.12078830188679246 | FJ29: =+RC[-2]/RC[-4]-1 -> -0.10780911287181949 | FK29: 1625 | FL29: 1589 | FM29: =+RC[-1]/RC[-2]-1 -> -2.2153846153846191E-2 | FN29: 713629 | FO29: 450000 | FP29: 166578 | FQ29: =+RC[-1]/RC[-2]-1 -> -0.62982666666666665 | FR29: =+RC[-2]/RC[-4]-1 -> -0.76657619014922318 | FS29: 325 | FT29: 778 | FU29: =+RC[-1]/RC[-2]-1 -> 1.393846153846154 | FV29: 5058706 | FW29: 3520000 | FX29: 3673608 | FY29: =+RC[-1]/RC[-2]-1 -> 4.3638636363636296E-2 | FZ29: =+RC[-2]/RC[-4]-1 -> -0.27380480304647081 | GA29: 1647 | GB29: 1874 | GC29: =+RC[-1]/RC[-2]-1 -> 0.13782635094110507 | GD29: 0 | GE29: 90000 | GF29: 0 | GG29: =+RC[-1]/RC[-2]-1 -> -1 | GH29: =+RC[-2]/RC[-4]-1 -> #DIV/0! | GI29: 0 | GJ29: 0 | GK29: =+RC[-1]/RC[-2]-1 -> #DIV/0! | GL29: 4839806 | GM29: 3000000 | GN29: 2935464 | GO29: =+RC[-1]/RC[-2]-1 -> -2.1511999999999976E-2 | GP29: =+RC[-2]/RC[-4]-1 -> -0.39347486242217145 | GQ29: 2012 | GR29: 2728 | GS29: =+RC[-1]/RC[-2]-1 -> 0.35586481113320079 | GT29: 755036 | GU29: 950000 | GV29: 708972 | GW29: =+RC[-1]/RC[-2]-1 -> -0.25371368421052631 | GX29: =+RC[-2]/RC[-4]-1 -> -6.1009011490842813E-2 | GY29: 763 | GZ29: 739 | HA29: =+RC[-1]/RC[-2]-1 -> -3.1454783748361748E-2 | HB29: 2357689 | HC29: 2309218 | HD29: 1743476 | HE29: =+RC[-1]/RC[-2]-1 -> -0.24499289369821298 | HF29: =+RC[-2]/RC[-4]-1 -> -0.26051485161953081 | HG29: 996 | HH29: 1136 | HI29: =+RC[-1]/RC[-2]-1 -> 0.14056224899598391 | HJ29: 1770230 | HK29: 1885179 | HL29: 1646521 | HM29: =+RC[-1]/RC[-2]-1 -> -0.12659699688995052 | HN29: =+RC[-2]/RC[-4]-1 -> -6.9883009552430986E-2 | HO29: 1341 | HP29: 1220 | HQ29: =+RC[-1]/RC[-2]-1 -> -9.0231170768083513E-2 | HR29: 1662524 | HS29: 1199988 | HT29: 1129605 | HU29: =+RC[-1]/RC[-2]-1 -> -5.8653086530865317E-2 | HV29: =+RC[-2]/RC[-4]-1 -> -0.32054815449280727 | HW29: 1272 | HX29: 1409 | HY29: =+RC[-1]/RC[-2]-1 -> 0.10770440251572322 | HZ29: 1971470 | IA29: 2305000 | IB29: 2477676 | IC29: =+RC[-1]/RC[-2]-1 -> 7.4913665943600938E-2 | ID29: =+RC[-2]/RC[-4]-1 -> 0.25676576361801096 | IE29: 1666 | IF29: 1183 | IG29: =+RC[-1]/RC[-2]-1 -> -0.28991596638655459 | IH29: 922646 | II29: 938433 | IJ29: 852159 | IK29: =+RC[-1]/RC[-2]-1 -> -9.1934107176537938E-2 | IL29: =+RC[-2]/RC[-4]-1 -> -7.6396581137294306E-2 | IM29: 724 | IN29: 570 | IO29: =+RC[-1]/RC[-2]-1 -> -0.21270718232044195
A30: 26.01.2016 | B30: 58036960 | C30: 62045761 | D30: 57784809 | E30: =+RC[-1]/RC[-2]-1 -> -6.8674345053161612E-2 | F30: =+RC[-2]/RC[-4]-1 -> -4.3446624357995622E-3 | G30: 39270 | H30: 37337 | I30: =+RC[-1]/RC[-2]-1 -> -4.9223325693913966E-2 | J30: 0 | K30: 752168 | L30: 644292 | M30: =+RC[-1]/RC[-2]-1 -> -0.14342008700184006 | N30: =+RC[-2]/RC[-4]-1 -> #DIV/0! | O30: 723 | P30: 0 | Q30: =+RC[-1]/RC[-2]-1 -> -1 | R30: 530289 | S30: 648628 | T30: 601947 | U30: =+RC[-1]/RC[-2]-1 -> -7.1968832674506822E-2 | V30: =+RC[-2]/RC[-4]-1 -> 0.13513008944179505 | W30: 730 | X30: 571 | Y30: =+RC[-1]/RC[-2]-1 -> -0.21780821917808224 | Z30: 0 | AA30: 750000 | AB30: 729028 | AC30: =+RC[-1]/RC[-2]-1 -> -2.7962666666666691E-2 | AD30: =+RC[-2]/RC[-4]-1 -> #DIV/0! | AE30: 392 | AF30: 0 | AG30: =+RC[-1]/RC[-2]-1 -> -1 | AH30: 1205847 | AI30: 2046179 | AJ30: 2374912 | AK30: =+RC[-1]/RC[-2]-1 -> 0.16065700996833621 | AL30: =+RC[-2]/RC[-4]-1 -> 0.96949695939866332 | AM30: 2443 | AN30: 1284 | AO30: =+RC[-1]/RC[-2]-1 -> -0.47441670077773235 | AP30: 7986193 | AQ30: 6471624 | AR30: 6590035 | AS30: =+RC[-1]/RC[-2]-1 -> 1.8296952975018321E-2 | AT30: =+RC[-2]/RC[-4]-1 -> -0.17482147000454407 | AU30: 3699 | AV30: 4374 | AW30: =+RC[-1]/RC[-2]-1 -> 0.18248175182481763 | AX30: 3725878 | AY30: 4447671 | AZ30: 4396618 | BA30: =+RC[-1]/RC[-2]-1 -> -1.147859182929678E-2 | BB30: =+RC[-2]/RC[-4]-1 -> 0.18002199749964976 | BC30: 2829 | BD30: 2253 | BE30: =+RC[-1]/RC[-2]-1 -> -0.2036055143160127 | BF30: 1450189 | BG30: 1503953 | BH30: 1130470 | BI30: =+RC[-1]/RC[-2]-1 -> -0.24833422321043275 | BJ30: =+RC[-2]/RC[-4]-1 -> -0.22046712531952728 | BK30: 1123 | BL30: 1354 | BM30: =+RC[-1]/RC[-2]-1 -> 0.20569902048085487 | BN30: 960665 | BO30: 1100000 | BP30: 771765 | BQ30: =+RC[-1]/RC[-2]-1 -> -0.29839545454545457 | BR30: =+RC[-2]/RC[-4]-1 -> -0.19663462289143463 | BS30: 1298 | BT30: 1148 | BU30: =+RC[-1]/RC[-2]-1 -> -0.11556240369799697 | BV30: 8096507 | BW30: 9739484 | BX30: 9012219 | BY30: =+RC[-1]/RC[-2]-1 -> -7.4671820396234545E-2 | BZ30: =+RC[-2]/RC[-4]-1 -> 0.11309963667048017 | CA30: 2847 | CB30: 2749 | CC30: =+RC[-1]/RC[-2]-1 -> -3.4422198805760473E-2 | CD30: 2194095 | CE30: 2494006 | CF30: 2226631 | CG30: =+RC[-1]/RC[-2]-1 -> -0.10720703959814049 | CH30: =+RC[-2]/RC[-4]-1 -> 1.4828893006000099E-2 | CI30: 1682 | CJ30: 1530 | CK30: =+RC[-1]/RC[-2]-1 -> -9.0368608799048733E-2 | CL30: 1148147 | CM30: 1213333 | CN30: 1069057 | CO30: =+RC[-1]/RC[-2]-1 -> -0.11890882387605051 | CP30: =+RC[-2]/RC[-4]-1 -> -6.8884907594584988E-2 | CQ30: 923 | CR30: 991 | CS30: =+RC[-1]/RC[-2]-1 -> 7.3672806067172303E-2 | CT30: 2362181 | CU30: 2016321 | CV30: 2571908 | CW30: =+RC[-1]/RC[-2]-1 -> 0.27554491571530515 | CX30: =+RC[-2]/RC[-4]-1 -> 8.8785321700580955E-2 | CY30: 1154 | CZ30: 1157 | DA30: =+RC[-1]/RC[-2]-1 -> 2.5996533795493715E-3 | DB30: 0 | DC30: 0 | DD30: 0 | DE30: =+RC[-1]/RC[-2]-1 -> #DIV/0! | DF30: =+RC[-2]/RC[-4]-1 -> #DIV/0! | DG30: 0 | DH30: 0 | DI30: =+RC[-1]/RC[-2]-1 -> #DIV/0! | DJ30: 0 | DK30: 0 | DL30: 0 | DM30: =+RC[-1]/RC[-2]-1 -> #DIV/0! | DN30: =+RC[-2]/RC[-4]-1 -> #DIV/0! | DO30: 0 | DP30: 0 | DQ30: =+RC[-1]/RC[-2]-1 -> #DIV/0! | DR30: 1598787 | DS30: 1500000 | DT30: 789385 | DU30: =+RC[-1]/RC[-2]-1 -> -0.47374333333333329 | DV30: =+RC[-2]/RC[-4]-1 -> -0.50626005840677957 | DW30: 1204 | DX30: 1593 | DY30: =+RC[-1]/RC[-2]-1 -> 0.32308970099667778 | DZ30: 1632455 | EA30: 1500000 | EB30: 1300775 | EC30: =+RC[-1]/RC[-2]-1 -> -0.13281666666666669 | ED30: =+RC[-2]/RC[-4]-1 -> -0.20317864810974884 | EE30: 951 | EF30: 1094 | EG30: =+RC[-1]/RC[-2]-1 -> 0.1503680336487907 | EH30: 3112598 | EI30: 3596176 | EJ30: 3272730 | EK30: =+RC[-1]/RC[-2]-1 -> -8.9941649129519852E-2 | EL30: =+RC[-2]/RC[-4]-1 -> 5.1446412289669174E-2 | EM30: 2992 | EN30: 2863 | EO30: =+RC[-1]/RC[-2]-1 -> -4.3114973262032064E-2 | EP30: 2197182 | EQ30: 2489003 | ER30: 3160621 | ES30: =+RC[-1]/RC[-2]-1 -> 0.26983414644337511 | ET30: =+RC[-2]/RC[-4]-1 -> 0.43848848206475388 | EU30: 1789 | EV30: 1528 | EW30: =+RC[-1]/RC[-2]-1 -> -0.14589155953046395 | EX30: 396950 | EY30: 308506 | EZ30: 146028 | FA30: =+RC[-1]/RC[-2]-1 -> -0.52666074565810717 | FB30: =+RC[-2]/RC[-4]-1 -> -0.63212495276483183 | FC30: 266 | FD30: 422 | FE30: =+RC[-1]/RC[-2]-1 -> 0.58646616541353391 | FF30: 2395481 | FG30: 2650000 | FH30: 2303320 | FI30: =+RC[-1]/RC[-2]-1 -> -0.13082264150943401 | FJ30: =+RC[-2]/RC[-4]-1 -> -3.8472857851930331E-2 | FK30: 1623 | FL30: 1656 | FM30: =+RC[-1]/RC[-2]-1 -> 2.0332717190388205E-2 | FN30: 552056 | FO30: 450000 | FP30: 244256 | FQ30: =+RC[-1]/RC[-2]-1 -> -0.45720888888888889 | FR30: =+RC[-2]/RC[-4]-1 -> -0.55755213239236601 | FS30: 339 | FT30: 558 | FU30: =+RC[-1]/RC[-2]-1 -> 0.64601769911504414 | FV30: 3219731 | FW30: 3650000 | FX30: 3801178 | FY30: =+RC[-1]/RC[-2]-1 -> 4.1418630136986323E-2 | FZ30: =+RC[-2]/RC[-4]-1 -> 0.18058868893084545 | GA30: 1600 | GB30: 1414 | GC30: =+RC[-1]/RC[-2]-1 -> -0.11624999999999996 | GD30: 0 | GE30: 0 | GF30: 0 | GG30: =+RC[-1]/RC[-2]-1 -> #DIV/0! | GH30: =+RC[-2]/RC[-4]-1 -> #DIV/0! | GI30: 0 | GJ30: 0 | GK30: =+RC[-1]/RC[-2]-1 -> #DIV/0! | GL30: 4104990 | GM30: 3000000 | GN30: 2650933 | GO30: =+RC[-1]/RC[-2]-1 -> -0.11635566666666664 | GP30: =+RC[-2]/RC[-4]-1 -> -0.35421694084516653 | GQ30: 1968 | GR30: 2020 | GS30: =+RC[-1]/RC[-2]-1 -> 2.6422764227642226E-2 | GT30: 776437 | GU30: 950000 | GV30: 617677 | GW30: =+RC[-1]/RC[-2]-1 -> -0.34981368421052628 | GX30: =+RC[-2]/RC[-4]-1 -> -0.20447248134748863 | GY30: 719 | GZ30: 822 | HA30: =+RC[-1]/RC[-2]-1 -> 0.14325452016689844 | HB30: 2239910 | HC30: 2309218 | HD30: 1552147 | HE30: =+RC[-1]/RC[-2]-1 -> -0.32784734918920599 | HF30: =+RC[-2]/RC[-4]-1 -> -0.30704939037729195 | HG30: 1003 | HH30: 1262 | HI30: =+RC[-1]/RC[-2]-1 -> 0.2582253240279162 | HJ30: 2176529 | HK30: 1996071 | HL30: 1710984 | HM30: =+RC[-1]/RC[-2]-1 -> -0.14282407790103657 | HN30: =+RC[-2]/RC[-4]-1 -> -0.21389331361998853 | HO30: 1411 | HP30: 1393 | HQ30: =+RC[-1]/RC[-2]-1 -> -1.275690999291279E-2 | HR30: 1146196 | HS30: 1299987 | HT30: 1173028 | HU30: =+RC[-1]/RC[-2]-1 -> -9.7661745848227732E-2 | HV30: =+RC[-2]/RC[-4]-1 -> 2.3409608827809514E-2 | HW30: 1273 | HX30: 1309 | HY30: =+RC[-1]/RC[-2]-1 -> 2.8279654359780082E-2 | HZ30: 1900272 | IA30: 2225000 | IB30: 2102572 | IC30: =+RC[-1]/RC[-2]-1 -> -5.5023820224719078E-2 | ID30: =+RC[-2]/RC[-4]-1 -> 0.10645844384382874 | IE30: 1559 | IF30: 1291 | IG30: =+RC[-1]/RC[-2]-1 -> -0.17190506735086597 | IH30: 927395 | II30: 938433 | IJ30: 840293 | IK30: =+RC[-1]/RC[-2]-1 -> -0.10457859005384507 | IL30: =+RC[-2]/RC[-4]-1 -> -9.3921144711800242E-2 | IM30: 730 | IN30: 701 | IO30: =+RC[-1]/RC[-2]-1 -> -3.9726027397260277E-2
A31: 27.01.2016 | B31: 57585442 | C31: 62676571 | D31: 58376257 | E31: =+RC[-1]/RC[-2]-1 -> -6.861118806260158E-2 | F31: =+RC[-2]/RC[-4]-1 -> 1.373289797792987E-2 | G31: 37947 | H31: 36932 | I31: =+RC[-1]/RC[-2]-1 -> -2.6747832503228208E-2 | J31: 0 | K31: 752168 | L31: 635025 | M31: =+RC[-1]/RC[-2]-1 -> -0.15574047287308157 | N31: =+RC[-2]/RC[-4]-1 -> #DIV/0! | O31: 749 | P31: 0 | Q31: =+RC[-1]/RC[-2]-1 -> -1 | R31: 466664 | S31: 648628 | T31: 581633 | U31: =+RC[-1]/RC[-2]-1 -> -0.10328724631067421 | V31: =+RC[-2]/RC[-4]-1 -> 0.24636355064886084 | W31: 614 | X31: 539 | Y31: =+RC[-1]/RC[-2]-1 -> -0.12214983713355054 | Z31: 0 | AA31: 750000 | AB31: 584948 | AC31: =+RC[-1]/RC[-2]-1 -> -0.22006933333333334 | AD31: =+RC[-2]/RC[-4]-1 -> #DIV/0! | AE31: 375 | AF31: 0 | AG31: =+RC[-1]/RC[-2]-1 -> -1 | AH31: 1287727 | AI31: 2046179 | AJ31: 2382009 | AK31: =+RC[-1]/RC[-2]-1 -> 0.16412542597690627 | AL31: =+RC[-2]/RC[-4]-1 -> 0.84977794206380697 | AM31: 2440 | AN31: 1293 | AO31: =+RC[-1]/RC[-2]-1 -> -0.47008196721311479 | AP31: 7225350 | AQ31: 6471624 | AR31: 7223746 | AS31: =+RC[-1]/RC[-2]-1 -> 0.11621843296211276 | AT31: =+RC[-2]/RC[-4]-1 -> -2.219961662757175E-4 | AU31: 3663 | AV31: 4216 | AW31: =+RC[-1]/RC[-2]-1 -> 0.15096915096915087 | AX31: 3761828 | AY31: 4552322 | AZ31: 4131440 | BA31: =+RC[-1]/RC[-2]-1 -> -9.245435626038756E-2 | BB31: =+RC[-2]/RC[-4]-1 -> 9.825329600396393E-2 | BC31: 2447 | BD31: 2343 | BE31: =+RC[-1]/RC[-2]-1 -> -4.2501021659174465E-2 | BF31: 1401223 | BG31: 1503953 | BH31: 1256776 | BI31: =+RC[-1]/RC[-2]-1 -> -0.16435154556026688 | BJ31: =+RC[-2]/RC[-4]-1 -> -0.10308637525932707 | BK31: 1228 | BL31: 1312 | BM31: =+RC[-1]/RC[-2]-1 -> 6.8403908794788304E-2 | BN31: 840975 | BO31: 1100000 | BP31: 653840 | BQ31: =+RC[-1]/RC[-2]-1 -> -0.40559999999999996 | BR31: =+RC[-2]/RC[-4]-1 -> -0.22252147804631528 | BS31: 1116 | BT31: 1241 | BU31: =+RC[-1]/RC[-2]-1 -> 0.11200716845878134 | BV31: 8683471 | BW31: 9739484 | BX31: 8353720 | BY31: =+RC[-1]/RC[-2]-1 -> -0.14228310247236919 | BZ31: =+RC[-2]/RC[-4]-1 -> -3.7974561094290538E-2 | CA31: 2768 | CB31: 2679 | CC31: =+RC[-1]/RC[-2]-1 -> -3.2153179190751446E-2 | CD31: 2209106 | CE31: 2541063 | CF31: 2051427 | CG31: =+RC[-1]/RC[-2]-1 -> -0.19268943745196399 | CH31: =+RC[-2]/RC[-4]-1 -> -7.1376837508023594E-2 | CI31: 1484 | CJ31: 1455 | CK31: =+RC[-1]/RC[-2]-1 -> -1.9541778975741275E-2 | CL31: 1278963 | CM31: 1213333 | CN31: 1120810 | CO31: =+RC[-1]/RC[-2]-1 -> -7.6255240729461771E-2 | CP31: =+RC[-2]/RC[-4]-1 -> -0.12365721291389975 | CQ31: 901 | CR31: 938 | CS31: =+RC[-1]/RC[-2]-1 -> 4.1065482796892372E-2 | CT31: 2334491 | CU31: 2016321 | CV31: 2616229 | CW31: =+RC[-1]/RC[-2]-1 -> 0.29752603876069328 | CX31: =+RC[-2]/RC[-4]-1 -> 0.12068498015199025 | CY31: 1217 | CZ31: 1191 | DA31: =+RC[-1]/RC[-2]-1 -> -2.1364009860312283E-2 | DB31: 0 | DC31: 0 | DD31: 0 | DE31: =+RC[-1]/RC[-2]-1 -> #DIV/0! | DF31: =+RC[-2]/RC[-4]-1 -> #DIV/0! | DG31: 0 | DH31: 0 | DI31: =+RC[-1]/RC[-2]-1 -> #DIV/0! | DJ31: 0 | DK31: 0 | DL31: 0 | DM31: =+RC[-1]/RC[-2]-1 -> #DIV/0! | DN31: =+RC[-2]/RC[-4]-1 -> #DIV/0! | DO31: 0 | DP31: 0 | DQ31: =+RC[-1]/RC[-2]-1 -> #DIV/0! | DR31: 1719457 | DS31: 1500000 | DT31: 715961 | DU31: =+RC[-1]/RC[-2]-1 -> -0.52269266666666669 | DV31: =+RC[-2]/RC[-4]-1 -> -0.58361215197588545 | DW31: 909 | DX31: 1576 | DY31: =+RC[-1]/RC[-2]-1 -> 0.73377337733773373 | DZ31: 1503227 | EA31: 1500000 | EB31: 1086924 | EC31: =+RC[-1]/RC[-2]-1 -> -0.27538399999999996 | ED31: =+RC[-2]/RC[-4]-1 -> -0.27693954406087706 | EE31: 922 | EF31: 1064 | EG31: =+RC[-1]/RC[-2]-1 -> 0.15401301518438171 | EH31: 3111166 | EI31: 3596176 | EJ31: 2987040 | EK31: =+RC[-1]/RC[-2]-1 -> -0.1693843682845334 | EL31: =+RC[-2]/RC[-4]-1 -> -3.9896938961148321E-2 | EM31: 2776 | EN31: 2787 | EO31: =+RC[-1]/RC[-2]-1 -> 3.9625360230548523E-3 | EP31: 2895410 | EQ31: 2489003 | ER31: 3553949 | ES31: =+RC[-1]/RC[-2]-1 -> 0.42786047264708005 | ET31: =+RC[-2]/RC[-4]-1 -> 0.22744240021275042 | EU31: 1855 | EV31: 1627 | EW31: =+RC[-1]/RC[-2]-1 -> -0.12291105121293799 | EX31: 419408 | EY31: 308506 | EZ31: 124977 | FA31: =+RC[-1]/RC[-2]-1 -> -0.59489604740264368 | FB31: =+RC[-2]/RC[-4]-1 -> -0.70201569831762867 | FC31: 255 | FD31: 426 | FE31: =+RC[-1]/RC[-2]-1 -> 0.67058823529411771 | FF31: 2458600 | FG31: 2650000 | FH31: 2722574 | FI31: =+RC[-1]/RC[-2]-1 -> 2.73864150943397E-2 | FJ31: =+RC[-2]/RC[-4]-1 -> 0.10736760758155039 | FK31: 1670 | FL31: 1667 | FM31: =+RC[-1]/RC[-2]-1 -> -1.79640718562879E-3 | FN31: 477752 | FO31: 450000 | FP31: 315103 | FQ31: =+RC[-1]/RC[-2]-1 -> -0.2997711111111111 | FR31: =+RC[-2]/RC[-4]-1 -> -0.34044650781158425 | FS31: 446 | FT31: 540 | FU31: =+RC[-1]/RC[-2]-1 -> 0.21076233183856496 | FV31: 3354773 | FW31: 3555205 | FX31: 3610937 | FY31: =+RC[-1]/RC[-2]-1 -> 1.5676170572442416E-2 | FZ31: =+RC[-2]/RC[-4]-1 -> 7.6358072513400987E-2 | GA31: 1555 | GB31: 1474 | GC31: =+RC[-1]/RC[-2]-1 -> -5.2090032154340826E-2 | GD31: 0 | GE31: 200000 | GF31: 0 | GG31: =+RC[-1]/RC[-2]-1 -> -1 | GH31: =+RC[-2]/RC[-4]-1 -> #DIV/0! | GI31: 0 | GJ31: 0 | GK31: =+RC[-1]/RC[-2]-1 -> #DIV/0! | GL31: 3240118 | GM31: 3200000 | GN31: 3125120 | GO31: =+RC[-1]/RC[-2]-1 -> -2.3399999999999976E-2 | GP31: =+RC[-2]/RC[-4]-1 -> -3.5491917269679707E-2 | GQ31: 1879 | GR31: 1968 | GS31: =+RC[-1]/RC[-2]-1 -> 4.7365620010644038E-2 | GT31: 766674 | GU31: 950000 | GV31: 733149 | GW31: =+RC[-1]/RC[-2]-1 -> -0.22826421052631574 | GX31: =+RC[-2]/RC[-4]-1 -> -4.3727842603244693E-2 | GY31: 715 | GZ31: 833 | HA31: =+RC[-1]/RC[-2]-1 -> 0.16503496503496495 | HB31: 2461233 | HC31: 2472221 | HD31: 1632326 | HE31: =+RC[-1]/RC[-2]-1 -> -0.33973297694664029 | HF31: =+RC[-2]/RC[-4]-1 -> -0.33678526169606859 | HG31: 957 | HH31: 1282 | HI31: =+RC[-1]/RC[-2]-1 -> 0.33960292580982232 | HJ31: 1945914 | HK31: 2106964 | HL31: 1648026 | HM31: =+RC[-1]/RC[-2]-1 -> -0.2178195735665156 | HN31: =+RC[-2]/RC[-4]-1 -> -0.15308384645981277 | HO31: 1340 | HP31: 1308 | HQ31: =+RC[-1]/RC[-2]-1 -> -2.3880597014925398E-2 | HR31: 1122473 | HS31: 1199988 | HT31: 1325814 | HU31: =+RC[-1]/RC[-2]-1 -> 0.10485604856048569 | HV31: =+RC[-2]/RC[-4]-1 -> 0.18115446874891417 | HW31: 1330 | HX31: 1269 | HY31: =+RC[-1]/RC[-2]-1 -> -4.5864661654135386E-2 | HZ31: 1749036 | IA31: 2225000 | IB31: 2219213 | IC31: =+RC[-1]/RC[-2]-1 -> -2.6008988764044672E-3 | ID31: =+RC[-2]/RC[-4]-1 -> 0.26882065320553727 | IE31: 1576 | IF31: 1247 | IG31: =+RC[-1]/RC[-2]-1 -> -0.20875634517766495 | IH31: 870403 | II31: 938433 | IJ31: 983541 | IK31: =+RC[-1]/RC[-2]-1 -> 4.8067363359984183E-2 | IL31: =+RC[-2]/RC[-4]-1 -> 0.12998346742830624 | IM31: 760 | IN31: 657 | IO31: =+RC[-1]/RC[-2]-1 -> -0.13552631578947372
A32: 28.01.2016 | B32: 57733134 | C32: 63206705 | D32: 60468042 | E32: =+RC[-1]/RC[-2]-1 -> -4.3328678500168638E-2 | F32: =+RC[-2]/RC[-4]-1 -> 4.7371549238951705E-2 | G32: 38775 | H32: 37728 | I32: =+RC[-1]/RC[-2]-1 -> -2.7001934235976743E-2 | J32: 0 | K32: 805895 | L32: 829885 | M32: =+RC[-1]/RC[-2]-1 -> 2.9768145974351512E-2 | N32: =+RC[-2]/RC[-4]-1 -> #DIV/0! | O32: 777 | P32: 0 | Q32: =+RC[-1]/RC[-2]-1 -> -1 | R32: 469431 | S32: 648628 | T32: 657174 | U32: =+RC[-1]/RC[-2]-1 -> 1.317550275350432E-2 | V32: =+RC[-2]/RC[-4]-1 -> 0.39993737098742943 | W32: 671 | X32: 538 | Y32: =+RC[-1]/RC[-2]-1 -> -0.19821162444113261 | Z32: 0 | AA32: 750000 | AB32: 540292 | AC32: =+RC[-1]/RC[-2]-1 -> -0.27961066666666667 | AD32: =+RC[-2]/RC[-4]-1 -> #DIV/0! | AE32: 379 | AF32: 0 | AG32: =+RC[-1]/RC[-2]-1 -> -1 | AH32: 1152241 | AI32: 2046179 | AJ32: 2384998 | AK32: =+RC[-1]/RC[-2]-1 -> 0.16558619749298575 | AL32: =+RC[-2]/RC[-4]-1 -> 1.0698777425903088 | AM32: 2387 | AN32: 1240 | AO32: =+RC[-1]/RC[-2]-1 -> -0.48051948051948057 | AP32: 7040431 | AQ32: 6471624 | AR32: 7446402 | AS32: =+RC[-1]/RC[-2]-1 -> 0.1506233983927372 | AT32: =+RC[-2]/RC[-4]-1 -> 5.7662805018613206E-2 | AU32: 3668 | AV32: 4272 | AW32: =+RC[-1]/RC[-2]-1 -> 0.16466739367502736 | AX32: 3474865 | AY32: 4709299 | AZ32: 4488692 | BA32: =+RC[-1]/RC[-2]-1 -> -4.6844976290526419E-2 | BB32: =+RC[-2]/RC[-4]-1 -> 0.29176011154390169 | BC32: 2554 | BD32: 2256 | BE32: =+RC[-1]/RC[-2]-1 -> -0.11667971808927169 | BF32: 1413512 | BG32: 1555814 | BH32: 1381628 | BI32: =+RC[-1]/RC[-2]-1 -> -0.11195811324489946 | BJ32: =+RC[-2]/RC[-4]-1 -> -2.255658246976322E-2 | BK32: 1207 | BL32: 1359 | BM32: =+RC[-1]/RC[-2]-1 -> 0.12593206296603143 | BN32: 868994 | BO32: 1200000 | BP32: 744964 | BQ32: =+RC[-1]/RC[-2]-1 -> -0.37919666666666663 | BR32: =+RC[-2]/RC[-4]-1 -> -0.14272825819280688 | BS32: 1200 | BT32: 1289 | BU32: =+RC[-1]/RC[-2]-1 -> 7.4166666666666714E-2 | BV32: 8230569 | BW32: 10047046 | BX32: 9168385 | BY32: =+RC[-1]/RC[-2]-1 -> -8.7454660802787187E-2 | BZ32: =+RC[-2]/RC[-4]-1 -> 0.11394303358613489 | CA32: 2804 | CB32: 2911 | CC32: =+RC[-1]/RC[-2]-1 -> 3.8159771754636251E-2 | CD32: 2187155 | CE32: 2541063 | CF32: 2039477 | CG32: =+RC[-1]/RC[-2]-1 -> -0.19739219373939176 | CH32: =+RC[-2]/RC[-4]-1 -> -6.7520591819052567E-2 | CI32: 1571 | CJ32: 1368 | CK32: =+RC[-1]/RC[-2]-1 -> -0.12921705919796311 | CL32: 1252384 | CM32: 1213333 | CN32: 1160593 | CO32: =+RC[-1]/RC[-2]-1 -> -4.3467044908528818E-2 | CP32: =+RC[-2]/RC[-4]-1 -> -7.3293015560722541E-2 | CQ32: 951 | CR32: 1039 | CS32: =+RC[-1]/RC[-2]-1 -> 9.2534174553102089E-2 | CT32: 2729938 | CU32: 2016321 | CV32: 2722938 | CW32: =+RC[-1]/RC[-2]-1 -> 0.35044866368003902 | CX32: =+RC[-2]/RC[-4]-1 -> -2.5641607977909819E-3 | CY32: 1235 | CZ32: 1201 | DA32: =+RC[-1]/RC[-2]-1 -> -2.7530364372469585E-2 | DB32: 0 | DC32: 0 | DD32: 0 | DE32: =+RC[-1]/RC[-2]-1 -> #DIV/0! | DF32: =+RC[-2]/RC[-4]-1 -> #DIV/0! | DG32: 0 | DH32: 0 | DI32: =+RC[-1]/RC[-2]-1 -> #DIV/0! | DJ32: 0 | DK32: 0 | DL32: 0 | DM32: =+RC[-1]/RC[-2]-1 -> #DIV/0! | DN32: =+RC[-2]/RC[-4]-1 -> #DIV/0! | DO32: 0 | DP32: 0 | DQ32: =+RC[-1]/RC[-2]-1 -> #DIV/0! | DR32: 1528565 | DS32: 1500000 | DT32: 792401 | DU32: =+RC[-1]/RC[-2]-1 -> -0.47173266666666669 | DV32: =+RC[-2]/RC[-4]-1 -> -0.4816046422625142 | DW32: 914 | DX32: 1632 | DY32: =+RC[-1]/RC[-2]-1 -> 0.78555798687089706 | DZ32: 1439028 | EA32: 1500000 | EB32: 1338279 | EC32: =+RC[-1]/RC[-2]-1 -> -0.10781399999999997 | ED32: =+RC[-2]/RC[-4]-1 -> -7.0011841326228508E-2 | EE32: 976 | EF32: 1083 | EG32: =+RC[-1]/RC[-2]-1 -> 0.10963114754098369 | EH32: 3208206 | EI32: 3596176 | EJ32: 3350165 | EK32: =+RC[-1]/RC[-2]-1 -> -6.8409054506787248E-2 | EL32: =+RC[-2]/RC[-4]-1 -> 4.4248717195841003E-2 | EM32: 2861 | EN32: 2803 | EO32: =+RC[-1]/RC[-2]-1 -> -2.0272631946871678E-2 | EP32: 2438324 | EQ32: 2489003 | ER32: 3406510 | ES32: =+RC[-1]/RC[-2]-1 -> 0.36862430459103512 | ET32: =+RC[-2]/RC[-4]-1 -> 0.39707028270238087 | EU32: 1872 | EV32: 1593 | EW32: =+RC[-1]/RC[-2]-1 -> -0.14903846153846156 | EX32: 383749 | EY32: 308506 | EZ32: 111583 | FA32: =+RC[-1]/RC[-2]-1 -> -0.63831173461780322 | FB32: =+RC[-2]/RC[-4]-1 -> -0.70922920971781034 | FC32: 244 | FD32: 424 | FE32: =+RC[-1]/RC[-2]-1 -> 0.73770491803278682 | FF32: 2377879 | FG32: 2650000 | FH32: 2301975 | FI32: =+RC[-1]/RC[-2]-1 -> -0.13133018867924529 | FJ32: =+RC[-2]/RC[-4]-1 -> -3.1920884115634096E-2 | FK32: 1647 | FL32: 1653 | FM32: =+RC[-1]/RC[-2]-1 -> 3.6429872495447047E-3 | FN32: 524692 | FO32: 450000 | FP32: 290367 | FQ32: =+RC[-1]/RC[-2]-1 -> -0.35474000000000006 | FR32: =+RC[-2]/RC[-4]-1 -> -0.44659533593041256 | FS32: 408 | FT32: 627 | FU32: =+RC[-1]/RC[-2]-1 -> 0.53676470588235303 | FV32: 3627829 | FW32: 3700000 | FX32: 3712142 | FY32: =+RC[-1]/RC[-2]-1 -> 3.2816216216215999E-3 | FZ32: =+RC[-2]/RC[-4]-1 -> 2.3240621319251753E-2 | GA32: 1582 | GB32: 1518 | GC32: =+RC[-1]/RC[-2]-1 -> -4.0455120101137831E-2 | GD32: 0 | GE32: 200000 | GF32: 0 | GG32: =+RC[-1]/RC[-2]-1 -> -1 | GH32: =+RC[-2]/RC[-4]-1 -> #DIV/0! | GI32: 0 | GJ32: 0 | GK32: =+RC[-1]/RC[-2]-1 -> #DIV/0! | GL32: 3691169 | GM32: 3500000 | GN32: 2797276 | GO32: =+RC[-1]/RC[-2]-1 -> -0.20077828571428569 | GP32: =+RC[-2]/RC[-4]-1 -> -0.2421707052697939 | GQ32: 1967 | GR32: 2100 | GS32: =+RC[-1]/RC[-2]-1 -> 6.7615658362989217E-2 | GT32: 936781 | GU32: 950000 | GV32: 681573 | GW32: =+RC[-1]/RC[-2]-1 -> -0.2825547368421053 | GX32: =+RC[-2]/RC[-4]-1 -> -0.27243080293046085 | GY32: 761 | GZ32: 867 | HA32: =+RC[-1]/RC[-2]-1 -> 0.13929040735873843 | HB32: 2563907 | HC32: 2309218 | HD32: 1810964 | HE32: =+RC[-1]/RC[-2]-1 -> -0.21576741563594259 | HF32: =+RC[-2]/RC[-4]-1 -> -0.29367016822373038 | HG32: 1028 | HH32: 1243 | HI32: =+RC[-1]/RC[-2]-1 -> 0.20914396887159525 | HJ32: 2273683 | HK32: 1885179 | HL32: 1715809 | HM32: =+RC[-1]/RC[-2]-1 -> -8.9842927382492555E-2 | HN32: =+RC[-2]/RC[-4]-1 -> -0.24536138063221657 | HO32: 1371 | HP32: 1408 | HQ32: =+RC[-1]/RC[-2]-1 -> 2.6987600291757952E-2 | HR32: 973445 | HS32: 1199988 | HT32: 1304241 | HU32: =+RC[-1]/RC[-2]-1 -> 8.687836878368782E-2 | HV32: =+RC[-2]/RC[-4]-1 -> 0.33981991792037558 | HW32: 1332 | HX32: 1281 | HY32: =+RC[-1]/RC[-2]-1 -> -3.8288288288288341E-2 | HZ32: 2020930 | IA32: 2025000 | IB32: 2323223 | IC32: =+RC[-1]/RC[-2]-1 -> 0.14727061728395063 | ID32: =+RC[-2]/RC[-4]-1 -> 0.14958113343856549 | IE32: 1612 | IF32: 1335 | IG32: =+RC[-1]/RC[-2]-1 -> -0.17183622828784118 | IH32: 925427 | II32: 938433 | IJ32: 966106 | IK32: =+RC[-1]/RC[-2]-1 -> 2.9488519691869275E-2 | IL32: =+RC[-2]/RC[-4]-1 -> 4.3957005793001436E-2 | IM32: 796 | IN32: 688 | IO32: =+RC[-1]/RC[-2]-1 -> -0.13567839195979903
A33: 29.01.2016 | B33: 57825339 | C33: 66080296 | D33: 65566081 | E33: =+RC[-1]/RC[-2]-1 -> -7.78166913780165E-3 | F33: =+RC[-2]/RC[-4]-1 -> 0.13386418711700077 | G33: 40421 | H33: 36972 | I33: =+RC[-1]/RC[-2]-1 -> -8.5326934019445355E-2 | J33: 0 | K33: 805895 | L33: 744666 | M33: =+RC[-1]/RC[-2]-1 -> -7.5976398910528098E-2 | N33: =+RC[-2]/RC[-4]-1 -> #DIV/0! | O33: 771 | P33: 0 | Q33: =+RC[-1]/RC[-2]-1 -> -1 | R33: 491798 | S33: 648628 | T33: 593101 | U33: =+RC[-1]/RC[-2]-1 -> -8.5606850151396463E-2 | V33: =+RC[-2]/RC[-4]-1 -> 0.20598497757209255 | W33: 637 | X33: 564 | Y33: =+RC[-1]/RC[-2]-1 -> -0.11459968602825743 | Z33: 0 | AA33: 800000 | AB33: 536829 | AC33: =+RC[-1]/RC[-2]-1 -> -0.32896375 | AD33: =+RC[-2]/RC[-4]-1 -> #DIV/0! | AE33: 344 | AF33: 0 | AG33: =+RC[-1]/RC[-2]-1 -> -1 | AH33: 1208764 | AI33: 2232195 | AJ33: 2737868 | AK33: =+RC[-1]/RC[-2]-1 -> 0.22653621211408503 | AL33: =+RC[-2]/RC[-4]-1 -> 1.2650145106902588 | AM33: 2667 | AN33: 1314 | AO33: =+RC[-1]/RC[-2]-1 -> -0.50731158605174353 | AP33: 7340275 | AQ33: 6661966 | AR33: 7768154 | AS33: =+RC[-1]/RC[-2]-1 -> 0.16604527852588857 | AT33: =+RC[-2]/RC[-4]-1 -> 5.8291957726379406E-2 | AU33: 3954 | AV33: 4145 | AW33: =+RC[-1]/RC[-2]-1 -> 4.8305513404147682E-2 | AX33: 3694710 | AY33: 4604648 | AZ33: 4884658 | BA33: =+RC[-1]/RC[-2]-1 -> 6.0810294293939471E-2 | BB33: =+RC[-2]/RC[-4]-1 -> 0.32206803781622906 | BC33: 2705 | BD33: 2304 | BE33: =+RC[-1]/RC[-2]-1 -> -0.14824399260628462 | BF33: 1399222 | BG33: 1555814 | BH33: 1362242 | BI33: =+RC[-1]/RC[-2]-1 -> -0.1244184716167871 | BJ33: =+RC[-2]/RC[-4]-1 -> -2.6428972671956319E-2 | BK33: 1201 | BL33: 1252 | BM33: =+RC[-1]/RC[-2]-1 -> 4.2464612822647796E-2 | BN33: 945896 | BO33: 1200000 | BP33: 836512 | BQ33: =+RC[-1]/RC[-2]-1 -> -0.30290666666666666 | BR33: =+RC[-2]/RC[-4]-1 -> -0.11564062011045617 | BS33: 1203 | BT33: 1244 | BU33: =+RC[-1]/RC[-2]-1 -> 3.408146300914372E-2 | BV33: 8502346 | BW33: 10252088 | BX33: 10250334 | BY33: =+RC[-1]/RC[-2]-1 -> -1.7108709952551315E-4 | BZ33: =+RC[-2]/RC[-4]-1 -> 0.20558890452117562 | CA33: 2901 | CB33: 2641 | CC33: =+RC[-1]/RC[-2]-1 -> -8.9624267493967569E-2 | CD33: 2408086 | CE33: 2729290 | CF33: 2363474 | CG33: =+RC[-1]/RC[-2]-1 -> -0.13403339330008901 | CH33: =+RC[-2]/RC[-4]-1 -> -1.8525916433217104E-2 | CI33: 1724 | CJ33: 1362 | CK33: =+RC[-1]/RC[-2]-1 -> -0.20997679814385151 | CL33: 1237285 | CM33: 1386667 | CN33: 1184282 | CO33: =+RC[-1]/RC[-2]-1 -> -0.14595068606954664 | CP33: =+RC[-2]/RC[-4]-1 -> -4.2838149658324443E-2 | CQ33: 939 | CR33: 1012 | CS33: =+RC[-1]/RC[-2]-1 -> 7.7742279020234228E-2 | CT33: 2627891 | CU33: 2217953 | CV33: 2897967 | CW33: =+RC[-1]/RC[-2]-1 -> 0.30659531559054676 | CX33: =+RC[-2]/RC[-4]-1 -> 0.10277290800874161 | CY33: 1219 | CZ33: 1269 | DA33: =+RC[-1]/RC[-2]-1 -> 4.1017227235438991E-2 | DB33: 0 | DC33: 0 | DD33: 0 | DE33: =+RC[-1]/RC[-2]-1 -> #DIV/0! | DF33: =+RC[-2]/RC[-4]-1 -> #DIV/0! | DG33: 0 | DH33: 0 | DI33: =+RC[-1]/RC[-2]-1 -> #DIV/0! | DJ33: 0 | DK33: 0 | DL33: 0 | DM33: =+RC[-1]/RC[-2]-1 -> #DIV/0! | DN33: =+RC[-2]/RC[-4]-1 -> #DIV/0! | DO33: 0 | DP33: 0 | DQ33: =+RC[-1]/RC[-2]-1 -> #DIV/0! | DR33: 1333436 | DS33: 1500000 | DT33: 779874 | DU33: =+RC[-1]/RC[-2]-1 -> -0.48008399999999996 | DV33: =+RC[-2]/RC[-4]-1 -> -0.41513953425586225 | DW33: 937 | DX33: 1454 | DY33: =+RC[-1]/RC[-2]-1 -> 0.55176093916755597 | DZ33: 1569660 | EA33: 1600000 | EB33: 1536418 | EC33: =+RC[-1]/RC[-2]-1 -> -3.9738750000000045E-2 | ED33: =+RC[-2]/RC[-4]-1 -> -2.1177834690315089E-2 | EE33: 1027 | EF33: 1031 | EG33: =+RC[-1]/RC[-2]-1 -> 3.894839337877265E-3 | EH33: 3212369 | EI33: 4088946 | EJ33: 3829564 | EK33: =+RC[-1]/RC[-2]-1 -> -6.3434929196912848E-2 | EL33: =+RC[-2]/RC[-4]-1 -> 0.19213079194824756 | EM33: 3062 | EN33: 2832 | EO33: =+RC[-1]/RC[-2]-1 -> -7.5114304376224683E-2 | EP33: 2643403 | EQ33: 2489003 | ER33: 3678203 | ES33: =+RC[-1]/RC[-2]-1 -> 0.47778166599236727 | ET33: =+RC[-2]/RC[-4]-1 -> 0.3914650925341312 | EU33: 1893 | EV33: 1648 | EW33: =+RC[-1]/RC[-2]-1 -> -0.12942419440042263 | EX33: 422253 | EY33: 342430 | EZ33: 170192 | FA33: =+RC[-1]/RC[-2]-1 -> -0.5029874718920655 | FB33: =+RC[-2]/RC[-4]-1 -> -0.59694306493973992 | FC33: 252 | FD33: 425 | FE33: =+RC[-1]/RC[-2]-1 -> 0.68650793650793651 | FF33: 2344645 | FG33: 2650000 | FH33: 2555218 | FI33: =+RC[-1]/RC[-2]-1 -> -3.5766792452830209E-2 | FJ33: =+RC[-2]/RC[-4]-1 -> 8.9810184484218292E-2 | FK33: 1673 | FL33: 1603 | FM33: =+RC[-1]/RC[-2]-1 -> -4.1841004184100417E-2 | FN33: 515391 | FO33: 450000 | FP33: 296694 | FQ33: =+RC[-1]/RC[-2]-1 -> -0.34067999999999998 | FR33: =+RC[-2]/RC[-4]-1 -> -0.42433220603386557 | FS33: 416 | FT33: 612 | FU33: =+RC[-1]/RC[-2]-1 -> 0.47115384615384626 | FV33: 3811870 | FW33: 4100000 | FX33: 4247788 | FY33: =+RC[-1]/RC[-2]-1 -> 3.6045853658536631E-2 | FZ33: =+RC[-2]/RC[-4]-1 -> 0.11435804473919631 | GA33: 1782 | GB33: 1537 | GC33: =+RC[-1]/RC[-2]-1 -> -0.13748597081930414 | GD33: 0 | GE33: 85000 | GF33: 0 | GG33: =+RC[-1]/RC[-2]-1 -> -1 | GH33: =+RC[-2]/RC[-4]-1 -> #DIV/0! | GI33: 0 | GJ33: 0 | GK33: =+RC[-1]/RC[-2]-1 -> #DIV/0! | GL33: 3373693 | GM33: 3500000 | GN33: 2858952 | GO33: =+RC[-1]/RC[-2]-1 -> -0.18315657142857145 | GP33: =+RC[-2]/RC[-4]-1 -> -0.15257493790928811 | GQ33: 2029 | GR33: 1997 | GS33: =+RC[-1]/RC[-2]-1 -> -1.5771315919172024E-2 | GT33: 878631 | GU33: 950000 | GV33: 858308 | GW33: =+RC[-1]/RC[-2]-1 -> -9.6517894736842136E-2 | GX33: =+RC[-2]/RC[-4]-1 -> -2.313030157142193E-2 | GY33: 806 | GZ33: 880 | HA33: =+RC[-1]/RC[-2]-1 -> 9.1811414392059643E-2 | HB33: 2323383 | HC33: 2499389 | HD33: 1966312 | HE33: =+RC[-1]/RC[-2]-1 -> -0.21328292634719925 | HF33: =+RC[-2]/RC[-4]-1 -> -0.15368581073374477 | HG33: 1085 | HH33: 1268 | HI33: =+RC[-1]/RC[-2]-1 -> 0.16866359447004609 | HJ33: 1709502 | HK33: 2106964 | HL33: 1813827 | HM33: =+RC[-1]/RC[-2]-1 -> -0.13912767375237545 | HN33: =+RC[-2]/RC[-4]-1 -> 6.1026544572629904E-2 | HO33: 1429 | HP33: 1266 | HQ33: =+RC[-1]/RC[-2]-1 -> -0.11406578026592018 | HR33: 1188838 | HS33: 1299987 | HT33: 1255630 | HU33: =+RC[-1]/RC[-2]-1 -> -3.4121110441873603E-2 | HV33: =+RC[-2]/RC[-4]-1 -> 5.6182591740842724E-2 | HW33: 1359 | HX33: 1324 | HY33: =+RC[-1]/RC[-2]-1 -> -2.5754231052244281E-2 | HZ33: 1778057 | IA33: 2385000 | IB33: 2558813 | IC33: =+RC[-1]/RC[-2]-1 -> 7.2877568134172011E-2 | ID33: =+RC[-2]/RC[-4]-1 -> 0.43910628286944675 | IE33: 1605 | IF33: 1274 | IG33: =+RC[-1]/RC[-2]-1 -> -0.20623052959501553 | IH33: 863935 | II33: 938433 | IJ33: 1000201 | IK33: =+RC[-1]/RC[-2]-1 -> 6.5820362242163366E-2 | IL33: =+RC[-2]/RC[-4]-1 -> 0.15772714382447761 | IM33: 801 | IN33: 714 | IO33: =+RC[-1]/RC[-2]-1 -> -0.10861423220973787
A34: 30.01.2016 | B34: 73052674 | C34: 75886201 | D34: 83714477 | E34: =+RC[-1]/RC[-2]-1 -> 0.10315809589677571 | F34: =+RC[-2]/RC[-4]-1 -> 0.14594678628738489 | G34: 44196 | H34: 42099 | I34: =+RC[-1]/RC[-2]-1 -> -4.7447732826500166E-2 | J34: 0 | K34: 1074526 | L34: 988653 | M34: =+RC[-1]/RC[-2]-1 -> -7.9917098329868264E-2 | N34: =+RC[-2]/RC[-4]-1 -> #DIV/0! | O34: 956 | P34: 0 | Q34: =+RC[-1]/RC[-2]-1 -> -1 | R34: 453760 | S34: 648628 | T34: 652358 | U34: =+RC[-1]/RC[-2]-1 -> 5.7505997274247544E-3 | V34: =+RC[-2]/RC[-4]-1 -> 0.43767189703808174 | W34: 634 | X34: 516 | Y34: =+RC[-1]/RC[-2]-1 -> -0.18611987381703465 | Z34: 5090440 | AA34: 900000 | AB34: 954228 | AC34: =+RC[-1]/RC[-2]-1 -> 6.025333333333327E-2 | AD34: =+RC[-2]/RC[-4]-1 -> -0.81254508451135854 | AE34: 425 | AF34: 1965 | AG34: =+RC[-1]/RC[-2]-1 -> 3.6235294117647054 | AH34: 1337300 | AI34: 2883252 | AJ34: 3706559 | AK34: =+RC[-1]/RC[-2]-1 -> 0.28554805476593792 | AL34: =+RC[-2]/RC[-4]-1 -> 1.7716735212742094 | AM34: 2992 | AN34: 1505 | AO34: =+RC[-1]/RC[-2]-1 -> -0.49699197860962563 | AP34: 8802456 | AQ34: 9041239 | AR34: 11812651 | AS34: =+RC[-1]/RC[-2]-1 -> 0.30653011163624799 | AT34: =+RC[-2]/RC[-4]-1 -> 0.34197217231190935 | AU34: 5010 | AV34: 4778 | AW34: =+RC[-1]/RC[-2]-1 -> -4.6307385229540921E-2 | AX34: 4721203 | AY34: 5755810 | AZ34: 6597292 | BA34: =+RC[-1]/RC[-2]-1 -> 0.14619697314539559 | BB34: =+RC[-2]/RC[-4]-1 -> 0.39737520288790806 | BC34: 3264 | BD34: 2553 | BE34: =+RC[-1]/RC[-2]-1 -> -0.21783088235294112 | BF34: 1639813 | BG34: 1244651 | BH34: 1308239 | BI34: =+RC[-1]/RC[-2]-1 -> 5.1089020134961638E-2 | BJ34: =+RC[-2]/RC[-4]-1 -> -0.20220232428941598 | BK34: 985 | BL34: 1326 | BM34: =+RC[-1]/RC[-2]-1 -> 0.34619289340101522 | BN34: 944974 | BO34: 1300000 | BP34: 981560 | BQ34: =+RC[-1]/RC[-2]-1 -> -0.24495384615384619 | BR34: =+RC[-2]/RC[-4]-1 -> 3.8716409128716878E-2 | BS34: 1455 | BT34: 1311 | BU34: =+RC[-1]/RC[-2]-1 -> -9.8969072164948435E-2 | BV34: 9867051 | BW34: 11789901 | BX34: 12642451 | BY34: =+RC[-1]/RC[-2]-1 -> 7.231188794545429E-2 | BZ34: =+RC[-2]/RC[-4]-1 -> 0.28127958394053088 | CA34: 2804 | CB34: 2998 | CC34: =+RC[-1]/RC[-2]-1 -> 6.9186875891583455E-2 | CD34: 3215842 | CE34: 2729290 | CF34: 2874199 | CG34: =+RC[-1]/RC[-2]-1 -> 5.3094028117202541E-2 | CH34: =+RC[-2]/RC[-4]-1 -> -0.10623749549884598 | CI34: 1805 | CJ34: 1495 | CK34: =+RC[-1]/RC[-2]-1 -> -0.17174515235457066 | CL34: 1683003 | CM34: 1560000 | CN34: 1434316 | CO34: =+RC[-1]/RC[-2]-1 -> -8.0566666666666675E-2 | CP34: =+RC[-2]/RC[-4]-1 -> -0.14776384831161915 | CQ34: 1013 | CR34: 1064 | CS34: =+RC[-1]/RC[-2]-1 -> 5.0345508390918114E-2 | CT34: 3190366 | CU34: 2419585 | CV34: 3733087 | CW34: =+RC[-1]/RC[-2]-1 -> 0.54286251567934163 | CX34: =+RC[-2]/RC[-4]-1 -> 0.17011245731680935 | CY34: 1248 | CZ34: 1313 | DA34: =+RC[-1]/RC[-2]-1 -> 5.2083333333333259E-2 | DB34: 0 | DC34: 0 | DD34: 0 | DE34: =+RC[-1]/RC[-2]-1 -> #DIV/0! | DF34: =+RC[-2]/RC[-4]-1 -> #DIV/0! | DG34: 0 | DH34: 0 | DI34: =+RC[-1]/RC[-2]-1 -> #DIV/0! | DJ34: 0 | DK34: 0 | DL34: 0 | DM34: =+RC[-1]/RC[-2]-1 -> #DIV/0! | DN34: =+RC[-2]/RC[-4]-1 -> #DIV/0! | DO34: 0 | DP34: 0 | DQ34: =+RC[-1]/RC[-2]-1 -> #DIV/0! | DR34: 1478641 | DS34: 1800000 | DT34: 987597 | DU34: =+RC[-1]/RC[-2]-1 -> -0.45133500000000004 | DV34: =+RC[-2]/RC[-4]-1 -> -0.33209142719564788 | DW34: 1168 | DX34: 1583 | DY34: =+RC[-1]/RC[-2]-1 -> 0.35530821917808209 | DZ34: 1533083 | EA34: 1600000 | EB34: 1699934 | EC34: =+RC[-1]/RC[-2]-1 -> 6.2458750000000007E-2 | ED34: =+RC[-2]/RC[-4]-1 -> 0.10883363783956912 | EE34: 1046 | EF34: 1052 | EG34: =+RC[-1]/RC[-2]-1 -> 5.7361376673039643E-3 | EH34: 3966614 | EI34: 3669567 | EJ34: 3621054 | EK34: =+RC[-1]/RC[-2]-1 -> -1.3220360876365023E-2 | EL34: =+RC[-2]/RC[-4]-1 -> -8.7117123067684377E-2 | EM34: 2508 | EN34: 3040 | EO34: =+RC[-1]/RC[-2]-1 -> 0.21212121212121215 | EP34: 2653325 | EQ34: 2765559 | ER34: 5330072 | ES34: =+RC[-1]/RC[-2]-1 -> 0.927303666275064 | ET34: =+RC[-2]/RC[-4]-1 -> 1.0088274146589655 | EU34: 2222 | EV34: 1588 | EW34: =+RC[-1]/RC[-2]-1 -> -0.2853285328532853 | EX34: 421415 | EY34: 348363 | EZ34: 225494 | FA34: =+RC[-1]/RC[-2]-1 -> -0.35270393239236086 | FB34: =+RC[-2]/RC[-4]-1 -> -0.46491225988633533 | FC34: 320 | FD34: 440 | FE34: =+RC[-1]/RC[-2]-1 -> 0.375 | FF34: 2486369 | FG34: 2900000 | FH34: 2766187 | FI34: =+RC[-1]/RC[-2]-1 -> -4.6142413793103465E-2 | FJ34: =+RC[-2]/RC[-4]-1 -> 0.11254081755362932 | FK34: 1694 | FL34: 1747 | FM34: =+RC[-1]/RC[-2]-1 -> 3.1286894923258535E-2 | FN34: 624982 | FO34: 500000 | FP34: 295814 | FQ34: =+RC[-1]/RC[-2]-1 -> -0.40837199999999996 | FR34: =+RC[-2]/RC[-4]-1 -> -0.52668396849829269 | FS34: 486 | FT34: 671 | FU34: =+RC[-1]/RC[-2]-1 -> 0.38065843621399176 | FV34: 3730926 | FW34: 6000000 | FX34: 6162861 | FY34: =+RC[-1]/RC[-2]-1 -> 2.7143499999999987E-2 | FZ34: =+RC[-2]/RC[-4]-1 -> 0.65183147561758137 | GA34: 2063 | GB34: 1678 | GC34: =+RC[-1]/RC[-2]-1 -> -0.18662142510906443 | GD34: 0 | GE34: 160000 | GF34: 0 | GG34: =+RC[-1]/RC[-2]-1 -> -1 | GH34: =+RC[-2]/RC[-4]-1 -> #DIV/0! | GI34: 0 | GJ34: 0 | GK34: =+RC[-1]/RC[-2]-1 -> #DIV/0! | GL34: 3849949 | GM34: 4000000 | GN34: 4399161 | GO34: =+RC[-1]/RC[-2]-1 -> 9.979025000000008E-2 | GP34: =+RC[-2]/RC[-4]-1 -> 0.14265435723953757 | GQ34: 3019 | GR34: 2193 | GS34: =+RC[-1]/RC[-2]-1 -> -0.2736005299768135 | GT34: 1055487 | GU34: 1000000 | GV34: 860130 | GW34: =+RC[-1]/RC[-2]-1 -> -0.13987000000000005 | GX34: =+RC[-2]/RC[-4]-1 -> -0.18508707354993481 | GY34: 795 | GZ34: 962 | HA34: =+RC[-1]/RC[-2]-1 -> 0.21006289308176096 | HB34: 2574779 | HC34: 2336385 | HD34: 2215881 | HE34: =+RC[-1]/RC[-2]-1 -> -5.157711592909564E-2 | HF34: =+RC[-2]/RC[-4]-1 -> -0.13938982724342552 | HG34: 1102 | HH34: 1364 | HI34: =+RC[-1]/RC[-2]-1 -> 0.23774954627949185 | HJ34: 3545135 | HK34: 2217857 | HL34: 2006733 | HM34: =+RC[-1]/RC[-2]-1 -> -9.5192791960888368E-2 | HN34: =+RC[-2]/RC[-4]-1 -> -0.43394736730759198 | HO34: 1393 | HP34: 1503 | HQ34: =+RC[-1]/RC[-2]-1 -> 7.896625987078254E-2 | HR34: 1159037 | HS34: 1799982 | HT34: 1676252 | HU34: =+RC[-1]/RC[-2]-1 -> -6.8739576284651771E-2 | HV34: =+RC[-2]/RC[-4]-1 -> 0.44624546067122961 | HW34: 1580 | HX34: 1333 | HY34: =+RC[-1]/RC[-2]-1 -> -0.15632911392405058 | HZ34: 2118115 | IA34: 2355000 | IB34: 2627408 | IC34: =+RC[-1]/RC[-2]-1 -> 0.11567218683651803 | ID34: =+RC[-2]/RC[-4]-1 -> 0.24044634026008982 | IE34: 1454 | IF34: 1389 | IG34: =+RC[-1]/RC[-2]-1 -> -4.4704264099037161E-2 | IH34: 908609 | II34: 1086606 | IJ34: 1154306 | IK34: =+RC[-1]/RC[-2]-1 -> 6.230409182353136E-2 | IL34: =+RC[-2]/RC[-4]-1 -> 0.27041004436451765 | IM34: 755 | IN34: 732 | IO34: =+RC[-1]/RC[-2]-1 -> -3.0463576158940353E-2
A35: 31.01.2016 | B35: 88057501 | C35: 70289486 | D35: 76849704 | E35: =+RC[-1]/RC[-2]-1 -> 9.3331426552187402E-2 | F35: =+RC[-2]/RC[-4]-1 -> -0.12727816339007847 | G35: 43460 | H35: 44222 | I35: =+RC[-1]/RC[-2]-1 -> 1.7533364012885411E-2 | J35: 0 | K35: 1074531 | L35: 860419 | M35: =+RC[-1]/RC[-2]-1 -> -0.19926088684272492 | N35: =+RC[-2]/RC[-4]-1 -> #DIV/0! | O35: 958 | P35: 0 | Q35: =+RC[-1]/RC[-2]-1 -> -1 | R35: 543271 | S35: 555968 | T35: 554489 | U35: =+RC[-1]/RC[-2]-1 -> -2.6602250489237145E-3 | V35: =+RC[-2]/RC[-4]-1 -> 2.0648994700618983E-2 | W35: 571 | X35: 501 | Y35: =+RC[-1]/RC[-2]-1 -> -0.12259194395796846 | Z35: 3016426 | AA35: 900000 | AB35: 648016 | AC35: =+RC[-1]/RC[-2]-1 -> -0.27998222222222224 | AD35: =+RC[-2]/RC[-4]-1 -> -0.78517092744857653 | AE35: 349 | AF35: 1323 | AG35: =+RC[-1]/RC[-2]-1 -> 2.7908309455587395 | AH35: 2364900 | AI35: 2790242 | AJ35: 3371354 | AK35: =+RC[-1]/RC[-2]-1 -> 0.20826580633507774 | AL35: =+RC[-2]/RC[-4]-1 -> 0.42557993995517784 | AM35: 3159 | AN35: 1913 | AO35: =+RC[-1]/RC[-2]-1 -> -0.39442861665083884 | AP35: 12104930 | AQ35: 8089529 | AR35: 10667940 | AS35: =+RC[-1]/RC[-2]-1 -> 0.3187343787258814 | AT35: =+RC[-2]/RC[-4]-1 -> -0.11871113670215361 | AU35: 5082 | AV35: 5966 | AW35: =+RC[-1]/RC[-2]-1 -> 0.17394726485635581 | AX35: 5586592 | AY35: 5232552 | AZ35: 6030575 | BA35: =+RC[-1]/RC[-2]-1 -> 0.15251124116874526 | BB35: =+RC[-2]/RC[-4]-1 -> 7.9472959543134714E-2 | BC35: 3467 | BD35: 3115 | BE35: =+RC[-1]/RC[-2]-1 -> -0.10152869916354201 | BF35: 1333305 | BG35: 1244657 | BH35: 1156330 | BI35: =+RC[-1]/RC[-2]-1 -> -7.0964932507510126E-2 | BJ35: =+RC[-2]/RC[-4]-1 -> -0.13273407059900022 | BK35: 961 | BL35: 1006 | BM35: =+RC[-1]/RC[-2]-1 -> 4.6826222684703378E-2 | BN35: 1205425 | BO35: 1300000 | BP35: 938530 | BQ35: =+RC[-1]/RC[-2]-1 -> -0.27805384615384621 | BR35: =+RC[-2]/RC[-4]-1 -> -0.22141153535060254 | BS35: 1549 | BT35: 1589 | BU35: =+RC[-1]/RC[-2]-1 -> 2.58231116849581E-2 | BV35: 12680386 | BW35: 10457127 | BX35: 10659068 | BY35: =+RC[-1]/RC[-2]-1 -> 1.9311327097777387E-2 | BZ35: =+RC[-2]/RC[-4]-1 -> -0.15940508435626488 | CA35: 2483 | CB35: 2841 | CC35: =+RC[-1]/RC[-2]-1 -> 0.14418042690294008 | CD35: 2513957 | CE35: 2635173 | CF35: 2523391 | CG35: =+RC[-1]/RC[-2]-1 -> -4.2419226365783214E-2 | CH35: =+RC[-2]/RC[-4]-1 -> 3.7526497072146725E-3 | CI35: 1675 | CJ35: 1565 | CK35: =+RC[-1]/RC[-2]-1 -> -6.5671641791044788E-2 | CL35: 1805370 | CM35: 1386670 | CN35: 1206051 | CO35: =+RC[-1]/RC[-2]-1 -> -0.13025377342842925 | CP35: =+RC[-2]/RC[-4]-1 -> -0.33196463882749794 | CQ35: 973 | CR35: 1131 | CS35: =+RC[-1]/RC[-2]-1 -> 0.16238437821171625 | CT35: 4077127 | CU35: 2413768 | CV35: 3245901 | CW35: =+RC[-1]/RC[-2]-1 -> 0.34474439962747039 | CX35: =+RC[-2]/RC[-4]-1 -> -0.20387542502355216 | CY35: 1143 | CZ35: 1243 | DA35: =+RC[-1]/RC[-2]-1 -> 8.7489063867016714E-2 | DB35: 0 | DC35: 0 | DD35: 0 | DE35: =+RC[-1]/RC[-2]-1 -> #DIV/0! | DF35: =+RC[-2]/RC[-4]-1 -> #DIV/0! | DG35: 0 | DH35: 0 | DI35: =+RC[-1]/RC[-2]-1 -> #DIV/0! | DJ35: 0 | DK35: 0 | DL35: 0 | DM35: =+RC[-1]/RC[-2]-1 -> #DIV/0! | DN35: =+RC[-2]/RC[-4]-1 -> #DIV/0! | DO35: 0 | DP35: 0 | DQ35: =+RC[-1]/RC[-2]-1 -> #DIV/0! | DR35: 1831889 | DS35: 1700000 | DT35: 1127527 | DU35: =+RC[-1]/RC[-2]-1 -> -0.33674882352941171 | DV35: =+RC[-2]/RC[-4]-1 -> -0.38450037092858791 | DW35: 1536 | DX35: 1629 | DY35: =+RC[-1]/RC[-2]-1 -> 6.0546875E-2 | DZ35: 1752471 | EA35: 1450000 | EB35: 1572820 | EC35: =+RC[-1]/RC[-2]-1 -> 8.4703448275861959E-2 | ED35: =+RC[-2]/RC[-4]-1 -> -0.10251296597775372 | EE35: 1021 | EF35: 1112 | EG35: =+RC[-1]/RC[-2]-1 -> 8.912830558276208E-2 | EH35: 3606357 | EI35: 3456616 | EJ35: 3042334 | EK35: =+RC[-1]/RC[-2]-1 -> -0.1198519013972047 | EL35: =+RC[-2]/RC[-4]-1 -> -0.15639688472328173 | EM35: 2104 | EN35: 2400 | EO35: =+RC[-1]/RC[-2]-1 -> 0.14068441064638781 | EP35: 3886163 | EQ35: 2489008 | ER35: 4513308 | ES35: =+RC[-1]/RC[-2]-1 -> 0.81329589941052816 | ET35: =+RC[-2]/RC[-4]-1 -> 0.16137897458238371 | EU35: 2193 | EV35: 1864 | EW35: =+RC[-1]/RC[-2]-1 -> -0.15002279981760147 | EX35: 514563 | EY35: 342434 | EZ35: 138033 | FA35: =+RC[-1]/RC[-2]-1 -> -0.59690626514890455 | FB35: =+RC[-2]/RC[-4]-1 -> -0.73174713300412186 | FC35: 248 | FD35: 506 | FE35: =+RC[-1]/RC[-2]-1 -> 1.0403225806451615 | FF35: 2819620 | FG35: 2600000 | FH35: 2580597 | FI35: =+RC[-1]/RC[-2]-1 -> -7.4626923076922536E-3 | FJ35: =+RC[-2]/RC[-4]-1 -> -8.4771352168022673E-2 | FK35: 1635 | FL35: 1793 | FM35: =+RC[-1]/RC[-2]-1 -> 9.6636085626911283E-2 | FN35: 4873679 | FO35: 500000 | FP35: 3405201 | FQ35: =+RC[-1]/RC[-2]-1 -> 5.8104019999999998 | FR35: =+RC[-2]/RC[-4]-1 -> -0.30130790312615996 | FS35: 552 | FT35: 792 | FU35: =+RC[-1]/RC[-2]-1 -> 0.43478260869565211 | FV35: 5466411 | FW35: 5200000 | FX35: 5619694 | FY35: =+RC[-1]/RC[-2]-1 -> 8.0710384615384712E-2 | FZ35: =+RC[-2]/RC[-4]-1 -> 2.8040884595029514E-2 | GA35: 2286 | GB35: 1834 | GC35: =+RC[-1]/RC[-2]-1 -> -0.19772528433945757 | GD35: 0 | GE35: 180000 | GF35: 0 | GG35: =+RC[-1]/RC[-2]-1 -> -1 | GH35: =+RC[-2]/RC[-4]-1 -> #DIV/0! | GI35: 0 | GJ35: 0 | GK35: =+RC[-1]/RC[-2]-1 -> #DIV/0! | GL35: 5072718 | GM35: 3800000 | GN35: 4113805 | GO35: =+RC[-1]/RC[-2]-1 -> 8.2580263157894684E-2 | GP35: =+RC[-2]/RC[-4]-1 -> -0.18903337421871269 | GQ35: 3052 | GR35: 2907 | GS35: =+RC[-1]/RC[-2]-1 -> -4.750982961992134E-2 | GT35: 1019732 | GU35: 1100000 | GV35: 693983 | GW35: =+RC[-1]/RC[-2]-1 -> -0.36910636363636362 | GX35: =+RC[-2]/RC[-4]-1 -> -0.31944569749698937 | GY35: 751 | GZ35: 908 | HA35: =+RC[-1]/RC[-2]-1 -> 0.20905459387483361 | HB35: 2921439 | HC35: 2200546 | HD35: 1533564 | HE35: =+RC[-1]/RC[-2]-1 -> -0.30309841284844763 | HF35: =+RC[-2]/RC[-4]-1 -> -0.47506554133083045 | HG35: 919 | HH35: 1348 | HI35: =+RC[-1]/RC[-2]-1 -> 0.46681175190424384 | HJ35: 2093294 | HK35: 2217860 | HL35: 1581585 | HM35: =+RC[-1]/RC[-2]-1 -> -0.28688690900237168 | HN35: =+RC[-2]/RC[-4]-1 -> -0.24445156772054 | HO35: 1210 | HP35: 1314 | HQ35: =+RC[-1]/RC[-2]-1 -> 8.5950413223140565E-2 | HR35: 1680729 | HS35: 1699983 | HT35: 1791635 | HU35: =+RC[-1]/RC[-2]-1 -> 5.3913480311273743E-2 | HV35: =+RC[-2]/RC[-4]-1 -> 6.5986842614127461E-2 | HW35: 1573 | HX35: 1621 | HY35: =+RC[-1]/RC[-2]-1 -> 3.0514939605848612E-2 | HZ35: 2222145 | IA35: 2285000 | IB35: 2275250 | IC35: =+RC[-1]/RC[-2]-1 -> -4.2669584245076386E-3 | ID35: =+RC[-2]/RC[-4]-1 -> 2.3898080458296E-2 | IE35: 1313 | IF35: 1267 | IG35: =+RC[-1]/RC[-2]-1 -> -3.5034272658035048E-2 | IH35: 1064602 | II35: 987822 | IJ35: 998304 | IK35: =+RC[-1]/RC[-2]-1 -> 1.0611223479533693E-2 | IL35: =+RC[-2]/RC[-4]-1 -> -6.2274915884058091E-2 | IM35: 697 | IN35: 734 | IO35: =+RC[-1]/RC[-2]-1 -> 5.3084648493543662E-2
A36: OCAK | B36: 2056774932 | C36: 2092724461 | D36: 2096215769 | E36: =+RC[-1]/RC[-2]-1 -> 1.6683075412287085E-3 | F36: =+RC[-2]/RC[-4]-1 -> 1.9176058783275662E-2 | G36: 1257919 | H36: 1236283 | I36: =+RC[-1]/RC[-2]-1 -> -1.7199835601497404E-2 | J36: 0 | K36: 27000000 | L36: 25756655 | M36: =+RC[-1]/RC[-2]-1 -> -4.6049814814814849E-2 | N36: =+RC[-2]/RC[-4]-1 -> #DIV/0! | O36: 25913 | P36: 0 | Q36: =+RC[-1]/RC[-2]-1 -> -1 | R36: 14319959 | S36: 20537715 | T36: 18318025 | U36: =+RC[-1]/RC[-2]-1 -> -0.10807872248689787 | V36: =+RC[-2]/RC[-4]-1 -> 0.2791953524447941 | W36: 19721 | X36: 15848 | Y36: =+RC[-1]/RC[-2]-1 -> -0.19638963541402565 | Z36: 8106866 | AA36: 26000000 | AB36: 20207718 | AC36: =+RC[-1]/RC[-2]-1 -> -0.22278007692307689 | AD36: =+RC[-2]/RC[-4]-1 -> 1.4926670799788724 | AE36: 12091 | AF36: 3288 | AG36: =+RC[-1]/RC[-2]-1 -> -0.72806219502109004 | AH36: 51845785 | AI36: 76266667 | AJ36: 90329835 | AK36: =+RC[-1]/RC[-2]-1 -> 0.18439468450876451 | AL36: =+RC[-2]/RC[-4]-1 -> 0.74227924217947505 | AM36: 84281 | AN36: 48967 | AO36: =+RC[-1]/RC[-2]-1 -> -0.41900309678337944 | AP36: 278387407 | AQ36: 222700000 | AR36: 264536730 | AS36: =+RC[-1]/RC[-2]-1 -> 0.18786138302649302 | AT36: =+RC[-2]/RC[-4]-1 -> -4.9753245483550201E-2 | AU36: 134376 | AV36: 153113 | AW36: =+RC[-1]/RC[-2]-1 -> 0.13943710186342795 | AX36: 139000996 | AY36: 153313840 | AZ36: 160549658 | BA36: =+RC[-1]/RC[-2]-1 -> 4.7196117454236353E-2 | BB36: =+RC[-2]/RC[-4]-1 -> 0.15502523449544214 | BC36: 87508 | BD36: 80183 | BE36: =+RC[-1]/RC[-2]-1 -> -8.3706632536453829E-2 | BF36: 45513490 | BG36: 44600000 | BH36: 39104972 | BI36: =+RC[-1]/RC[-2]-1 -> -0.12320690582959637 | BJ36: =+RC[-2]/RC[-4]-1 -> -0.14080480314737454 | BK36: 31731 | BL36: 35816 | BM36: =+RC[-1]/RC[-2]-1 -> 0.12873845765970193 | BN36: 37186627 | BO36: 37900000 | BP36: 30658817 | BQ36: =+RC[-1]/RC[-2]-1 -> -0.1910602374670185 | BR36: =+RC[-2]/RC[-4]-1 -> -0.17554186885516665 | BS36: 42154 | BT36: 46532 | BU36: =+RC[-1]/RC[-2]-1 -> 0.10385728519238979 | BV36: 287962963 | BW36: 314739100 | BX36: 312096967 | BY36: =+RC[-1]/RC[-2]-1 -> -8.3946767338408668E-3 | BZ36: =+RC[-2]/RC[-4]-1 -> 8.380940294742012E-2 | CA36: 83596 | CB36: 84110 | CC36: =+RC[-1]/RC[-2]-1 -> 6.1486195511746278E-3 | CD36: 72671790 | CE36: 81188561 | CF36: 69560652 | CG36: =+RC[-1]/RC[-2]-1 -> -0.14322102592753183 | CH36: =+RC[-2]/RC[-4]-1 -> -4.2810807329776823E-2 | CI36: 48950 | CJ36: 45027 | CK36: =+RC[-1]/RC[-2]-1 -> -8.0143003064351404E-2 | CL36: 43436451 | CM36: 39000000 | CN36: 43129882 | CO36: =+RC[-1]/RC[-2]-1 -> 0.10589441025641033 | CP36: =+RC[-2]/RC[-4]-1 -> -7.0578740422416741E-3 | CQ36: 30618 | CR36: 31027 | CS36: =+RC[-1]/RC[-2]-1 -> 1.3358155333464072E-2 | CT36: 91693428 | CU36: 73791526 | CV36: 89689039 | CW36: =+RC[-1]/RC[-2]-1 -> 0.21543819272689935 | CX36: =+RC[-2]/RC[-4]-1 -> -2.1859680063439191E-2 | CY36: 35035 | CZ36: 36518 | DA36: =+RC[-1]/RC[-2]-1 -> 4.2329099471956511E-2 | DB36: 0 | DC36: 0 | DD36: 0 | DE36: =+RC[-1]/RC[-2]-1 -> #DIV/0! | DF36: =+RC[-2]/RC[-4]-1 -> #DIV/0! | DG36: 0 | DH36: 0 | DI36: =+RC[-1]/RC[-2]-1 -> #DIV/0! | DJ36: 0 | DK36: 0 | DL36: 0 | DM36: =+RC[-1]/RC[-2]-1 -> #DIV/0! | DN36: =+RC[-2]/RC[-4]-1 -> #DIV/0! | DO36: 0 | DP36: 0 | DQ36: =+RC[-1]/RC[-2]-1 -> #DIV/0! | DR36: 60104702 | DS36: 58000000 | DT36: 37880100 | DU36: =+RC[-1]/RC[-2]-1 -> -0.34689482758620693 | DV36: =+RC[-2]/RC[-4]-1 -> -0.36976478146418557 | DW36: 43095 | DX36: 58435 | DY36: =+RC[-1]/RC[-2]-1 -> 0.35595776772247367 | DZ36: 50937545 | EA36: 47400000 | EB36: 43952169 | EC36: =+RC[-1]/RC[-2]-1 -> -7.2739050632911417E-2 | ED36: =+RC[-2]/RC[-4]-1 -> -0.13713609480001443 | EE36: 31068 | EF36: 35114 | EG36: =+RC[-1]/RC[-2]-1 -> 0.13023046221192214 | EH36: 99738745 | EI36: 109895038 | EJ36: 100505542 | EK36: =+RC[-1]/RC[-2]-1 -> -8.5440581948750038E-2 | EL36: =+RC[-2]/RC[-4]-1 -> 7.6880554292115821E-3 | EM36: 77820 | EN36: 79094 | EO36: =+RC[-1]/RC[-2]-1 -> 1.6371112824466794E-2 | EP36: 86355728 | EQ36: 82966774 | ER36: 118732873 | ES36: =+RC[-1]/RC[-2]-1 -> 0.43108942623224089 | ET36: =+RC[-2]/RC[-4]-1 -> 0.37492759021150279 | EU36: 59696 | EV36: 49836 | EW36: =+RC[-1]/RC[-2]-1 -> -0.16517019565800051 | EX36: 13598697 | EY36: 10345471 | EZ36: 4954919 | FA36: =+RC[-1]/RC[-2]-1 -> -0.52105428549362331 | FB36: =+RC[-2]/RC[-4]-1 -> -0.63563281099652413 | FC36: 7653 | FD36: 13732 | FE36: =+RC[-1]/RC[-2]-1 -> 0.79432902129883698 | FF36: 89047650 | FG36: 85352657 | FH36: 79899061 | FI36: =+RC[-1]/RC[-2]-1 -> -6.3894859184055575E-2 | FJ36: =+RC[-2]/RC[-4]-1 -> -0.10273812952952721 | FK36: 51120 | FL36: 54129 | FM36: =+RC[-1]/RC[-2]-1 -> 5.8861502347417938E-2 | FN36: 25536239 | FO36: 15000000 | FP36: 11027682 | FQ36: =+RC[-1]/RC[-2]-1 -> -0.26482119999999998 | FR36: =+RC[-2]/RC[-4]-1 -> -0.56815559252871961 | FS36: 12397 | FT36: 22759 | FU36: =+RC[-1]/RC[-2]-1 -> 0.83584738243123335 | FV36: 132608315 | FW36: 134525205 | FX36: 142827810 | FY36: =+RC[-1]/RC[-2]-1 -> 6.1717839419014542E-2 | FZ36: =+RC[-2]/RC[-4]-1 -> 7.7065265477507916E-2 | GA36: 55572 | GB36: 54326 | GC36: =+RC[-1]/RC[-2]-1 -> -2.2421363276470152E-2 | GD36: 0 | GE36: 4000000 | GF36: 0 | GG36: =+RC[-1]/RC[-2]-1 -> -1 | GH36: =+RC[-2]/RC[-4]-1 -> #DIV/0! | GI36: 0 | GJ36: 0 | GK36: =+RC[-1]/RC[-2]-1 -> #DIV/0! | GL36: 130016881 | GM36: 117493017 | GN36: 111349486 | GO36: =+RC[-1]/RC[-2]-1 -> -5.2288477705870862E-2 | GP36: =+RC[-2]/RC[-4]-1 -> -0.1435767021668517 | GQ36: 79002 | GR36: 79434 | GS36: =+RC[-1]/RC[-2]-1 -> 5.4682159945318443E-3 | GT36: 29444632 | GU36: 31500000 | GV36: 24402667 | GW36: =+RC[-1]/RC[-2]-1 -> -0.22531215873015875 | GX36: =+RC[-2]/RC[-4]-1 -> -0.17123545643226246 | GY36: 23796 | GZ36: 27335 | HA36: =+RC[-1]/RC[-2]-1 -> 0.14872247436543962 | HB36: 75655954 | HC36: 71721585 | HD36: 56642634 | HE36: =+RC[-1]/RC[-2]-1 -> -0.21024285785095242 | HF36: =+RC[-2]/RC[-4]-1 -> -0.25131293698312229 | HG36: 31275 | HH36: 38966 | HI36: =+RC[-1]/RC[-2]-1 -> 0.24591526778577144 | HJ36: 64690105 | HK36: 62100000 | HL36: 56114520 | HM36: =+RC[-1]/RC[-2]-1 -> -9.6384541062801921E-2 | HN36: =+RC[-2]/RC[-4]-1 -> -0.13256409152528037 | HO36: 41940 | HP36: 41585 | HQ36: =+RC[-1]/RC[-2]-1 -> -8.46447305674769E-3 | HR36: 41090499 | HS36: 45199550 | HT36: 45177904 | HU36: =+RC[-1]/RC[-2]-1 -> -4.7889857310523531E-4 | HV36: =+RC[-2]/RC[-4]-1 -> 9.947323832694277E-2 | HW36: 42419 | HX36: 42289 | HY36: =+RC[-1]/RC[-2]-1 -> -3.0646644192461325E-3 | HZ36: 59803429 | IA36: 69565217 | IB36: 69999051 | IC36: =+RC[-1]/RC[-2]-1 -> 6.2363637850795239E-3 | ID36: =+RC[-2]/RC[-4]-1 -> 0.1704855753338157 | IE36: 43350 | IF36: 37953 | IG36: =+RC[-1]/RC[-2]-1 -> -0.12449826989619373 | IH36: 28020049 | II36: 30622538 | IJ36: 28810401 | IK36: =+RC[-1]/RC[-2]-1 -> -5.9176577721937962E-2 | IL36: =+RC[-2]/RC[-4]-1 -> 2.820666016679696E-2 | IM36: 21742 | IN36: 20867 | IO36: =+RC[-1]/RC[-2]-1 -> -4.0244687701223469E-2
A37: 01.02.2016 | B37: 74156539 | C37: 55285822 | D37: 61956621 | E37: =+RC[-1]/RC[-2]-1 -> 0.12066021194366972 | F37: =+RC[-2]/RC[-4]-1 -> -0.16451574149111792 | G37: 41130 | H37: 42617 | I37: =+RC[-1]/RC[-2]-1 -> 3.6153659129589011E-2 | J37: 0 | K37: 777111 | L37: 616732 | M37: =+RC[-1]/RC[-2]-1 -> -0.20637849676558429 | N37: =+RC[-2]/RC[-4]-1 -> #DIV/0! | O37: 756 | P37: 0 | Q37: =+RC[-1]/RC[-2]-1 -> -1 | R37: 416181 | S37: 593424 | T37: 620695 | U37: =+RC[-1]/RC[-2]-1 -> 4.5955337161961873E-2 | V37: =+RC[-2]/RC[-4]-1 -> 0.49140638328035169 | W37: 724 | X37: 456 | Y37: =+RC[-1]/RC[-2]-1 -> -0.37016574585635365 | Z37: 2235102 | AA37: 816000 | AB37: 722260 | AC37: =+RC[-1]/RC[-2]-1 -> -0.11487745098039215 | AD37: =+RC[-2]/RC[-4]-1 -> -0.67685591082644103 | AE37: 537 | AF37: 968 | AG37: =+RC[-1]/RC[-2]-1 -> 0.80260707635009321 | AH37: 2145430 | AI37: 2192821 | AJ37: 3059295 | AK37: =+RC[-1]/RC[-2]-1 -> 0.39514123587835037 | AL37: =+RC[-2]/RC[-4]-1 -> 0.42595889868231551 | AM37: 2923 | AN37: 1953 | AO37: =+RC[-1]/RC[-2]-1 -> -0.33185083817995209 | AP37: 11592221 | AQ37: 6057283 | AR37: 7425352 | AS37: =+RC[-1]/RC[-2]-1 -> 0.22585522254779899 | AT37: =+RC[-2]/RC[-4]-1 -> -0.35945389584963916 | AU37: 3918 | AV37: 6170 | AW37: =+RC[-1]/RC[-2]-1 -> 0.5747830525778459 | AX37: 5036675 | AY37: 4502924 | AZ37: 4496211 | BA37: =+RC[-1]/RC[-2]-1 -> -1.4908090831646792E-3 | BB37: =+RC[-2]/RC[-4]-1 -> -0.10730571259809296 | BC37: 2631 | BD37: 2976 | BE37: =+RC[-1]/RC[-2]-1 -> 0.13112884834663618 | BF37: 1384227 | BG37: 1437677 | BH37: 1480365 | BI37: =+RC[-1]/RC[-2]-1 -> 2.9692343968777513E-2 | BJ37: =+RC[-2]/RC[-4]-1 -> 6.9452481421038659E-2 | BK37: 1329 | BL37: 995 | BM37: =+RC[-1]/RC[-2]-1 -> -0.25131677953348386 | BN37: 1286849 | BO37: 0 | BP37: 648987 | BQ37: =+RC[-1]/RC[-2]-1 -> #DIV/0! | BR37: =+RC[-2]/RC[-4]-1 -> -0.49567742602278897 | BS37: 1114 | BT37: 1691 | BU37: =+RC[-1]/RC[-2]-1 -> 0.51795332136445249 | BV37: 9670498 | BW37: 10238536 | BX37: 9929640 | BY37: =+RC[-1]/RC[-2]-1 -> -3.0169938358374671E-2 | BZ37: =+RC[-2]/RC[-4]-1 -> 2.6797172182859708E-2 | CA37: 3033 | CB37: 2555 | CC37: =+RC[-1]/RC[-2]-1 -> -0.1575997362347511 | CD37: 2267554 | CE37: 2302688 | CF37: 2499095 | CG37: =+RC[-1]/RC[-2]-1 -> 8.5294664322739244E-2 | CH37: =+RC[-2]/RC[-4]-1 -> 0.10211046793152456 | CI37: 1775 | CJ37: 1405 | CK37: =+RC[-1]/RC[-2]-1 -> -0.20845070422535217 | CL37: 1697330 | CM37: 0 | CN37: 1006416 | CO37: =+RC[-1]/RC[-2]-1 -> #DIV/0! | CP37: =+RC[-2]/RC[-4]-1 -> -0.40705932258311583 | CQ37: 909 | CR37: 1119 | CS37: =+RC[-1]/RC[-2]-1 -> 0.23102310231023093 | CT37: 3508347 | CU37: 2478074 | CV37: 2481494 | CW37: =+RC[-1]/RC[-2]-1 -> 1.380104064689025E-3 | CX37: =+RC[-2]/RC[-4]-1 -> -0.29268855104697455 | CY37: 1191 | CZ37: 1259 | DA37: =+RC[-1]/RC[-2]-1 -> 5.7094878253568515E-2 | DB37: 0 | DC37: 0 | DD37: 0 | DE37: =+RC[-1]/RC[-2]-1 -> #DIV/0! | DF37: =+RC[-2]/RC[-4]-1 -> #DIV/0! | DG37: 0 | DH37: 0 | DI37: =+RC[-1]/RC[-2]-1 -> #DIV/0! | DJ37: 0 | DK37: 0 | DL37: 0 | DM37: =+RC[-1]/RC[-2]-1 -> #DIV/0! | DN37: =+RC[-2]/RC[-4]-1 -> #DIV/0! | DO37: 0 | DP37: 0 | DQ37: =+RC[-1]/RC[-2]-1 -> #DIV/0! | DR37: 2164759 | DS37: 0 | DT37: 760633 | DU37: =+RC[-1]/RC[-2]-1 -> #DIV/0! | DV37: =+RC[-2]/RC[-4]-1 -> -0.64862924695081525 | DW37: 1047 | DX37: 1947 | DY37: =+RC[-1]/RC[-2]-1 -> 0.8595988538681949 | DZ37: 1398296 | EA37: 0 | EB37: 1405139 | EC37: =+RC[-1]/RC[-2]-1 -> #DIV/0! | ED37: =+RC[-2]/RC[-4]-1 -> 4.893813613140674E-3 | EE37: 1126 | EF37: 992 | EG37: =+RC[-1]/RC[-2]-1 -> -0.1190053285968028 | EH37: 3027745 | EI37: 3840908 | EJ37: 3476708 | EK37: =+RC[-1]/RC[-2]-1 -> -9.482132870664961E-2 | EL37: =+RC[-2]/RC[-4]-1 -> 0.14828296306326982 | EM37: 3225 | EN37: 2046 | EO37: =+RC[-1]/RC[-2]-1 -> -0.36558139534883716 | EP37: 3133594 | EQ37: 2270754 | ER37: 3017275 | ES37: =+RC[-1]/RC[-2]-1 -> 0.3287546779615933 | ET37: =+RC[-2]/RC[-4]-1 -> -3.7119997038544295E-2 | EU37: 1786 | EV37: 1712 | EW37: =+RC[-1]/RC[-2]-1 -> -4.1433370660694302E-2 | EX37: 426893 | EY37: 316158 | EZ37: 124466 | FA37: =+RC[-1]/RC[-2]-1 -> -0.60631709461724836 | FB37: =+RC[-2]/RC[-4]-1 -> -0.70843747730695983 | FC37: 248 | FD37: 426 | FE37: =+RC[-1]/RC[-2]-1 -> 0.717741935483871 | FF37: 2561702 | FG37: 2550000 | FH37: 2373093 | FI37: =+RC[-1]/RC[-2]-1 -> -6.9375294117647091E-2 | FJ37: =+RC[-2]/RC[-4]-1 -> -7.3626440546168181E-2 | FK37: 1757 | FL37: 1679 | FM37: =+RC[-1]/RC[-2]-1 -> -4.4393853158793406E-2 | FN37: 617381 | FO37: 450000 | FP37: 214480 | FQ37: =+RC[-1]/RC[-2]-1 -> -0.52337777777777772 | FR37: =+RC[-2]/RC[-4]-1 -> -0.65259701869672049 | FS37: 390 | FT37: 790 | FU37: =+RC[-1]/RC[-2]-1 -> 1.0256410256410255 | FV37: 5134879 | FW37: 3600000 | FX37: 3816384 | FY37: =+RC[-1]/RC[-2]-1 -> 6.0106666666666753E-2 | FZ37: =+RC[-2]/RC[-4]-1 -> -0.25677236016661731 | GA37: 1684 | GB37: 1970 | GC37: =+RC[-1]/RC[-2]-1 -> 0.16983372921615203 | GD37: 0 | GE37: 144000 | GF37: 0 | GG37: =+RC[-1]/RC[-2]-1 -> -1 | GH37: =+RC[-2]/RC[-4]-1 -> #DIV/0! | GI37: 0 | GJ37: 0 | GK37: =+RC[-1]/RC[-2]-1 -> #DIV/0! | GL37: 4760367 | GM37: 3194035 | GN37: 3024005 | GO37: =+RC[-1]/RC[-2]-1 -> -5.3233605768252423E-2 | GP37: =+RC[-2]/RC[-4]-1 -> -0.36475380994784645 | GQ37: 2077 | GR37: 2905 | GS37: =+RC[-1]/RC[-2]-1 -> 0.39865190178141541 | GT37: 916976 | GU37: 950000 | GV37: 639388 | GW37: =+RC[-1]/RC[-2]-1 -> -0.32696000000000003 | GX37: =+RC[-2]/RC[-4]-1 -> -0.30272111810996138 | GY37: 747 | GZ37: 820 | HA37: =+RC[-1]/RC[-2]-1 -> 9.7724230254350841E-2 | HB37: 2449983 | HC37: 2139501 | HD37: 1610443 | HE37: =+RC[-1]/RC[-2]-1 -> -0.24728102487449177 | HF37: =+RC[-2]/RC[-4]-1 -> -0.3426717654775564 | HG37: 979 | HH37: 1193 | HI37: =+RC[-1]/RC[-2]-1 -> 0.21859039836567917 | HJ37: 1775475 | HK37: 0 | HL37: 1679974 | HM37: =+RC[-1]/RC[-2]-1 -> #DIV/0! | HN37: =+RC[-2]/RC[-4]-1 -> -5.3788986045987697E-2 | HO37: 1418 | HP37: 1147 | HQ37: =+RC[-1]/RC[-2]-1 -> -0.19111424541607902 | HR37: 1674027 | HS37: 1049734 | HT37: 1408405 | HU37: =+RC[-1]/RC[-2]-1 -> 0.34167798699480056 | HV37: =+RC[-2]/RC[-4]-1 -> -0.15867247063518086 | HW37: 1384 | HX37: 1666 | HY37: =+RC[-1]/RC[-2]-1 -> 0.20375722543352603 | HZ37: 1853603 | IA37: 2328244 | IB37: 2535677 | IC37: =+RC[-1]/RC[-2]-1 -> 8.9094184286526712E-2 | ID37: =+RC[-2]/RC[-4]-1 -> 0.36797199831894956 | IE37: 1646 | IF37: 1127 | IG37: =+RC[-1]/RC[-2]-1 -> -0.31530984204131229 | IH37: 1020445 | II37: 1055950 | IJ37: 884009 | IK37: =+RC[-1]/RC[-2]-1 -> -0.16283062645011603 | IL37: =+RC[-2]/RC[-4]-1 -> -0.13370245334143438 | IM37: 776 | IN37: 650 | IO37: =+RC[-1]/RC[-2]-1 -> -0.16237113402061853
A38: 02.02.2016 | B38: 61918125 | C38: 54170979 | D38: 61631175 | E38: =+RC[-1]/RC[-2]-1 -> 0.13771573151742378 | F38: =+RC[-2]/RC[-4]-1 -> -4.634345759016445E-3 | G38: 40973 | H38: 39956 | I38: =+RC[-1]/RC[-2]-1 -> -2.4821223732702014E-2 | J38: 0 | K38: 777111 | L38: 759186 | M38: =+RC[-1]/RC[-2]-1 -> -2.3066202897655597E-2 | N38: =+RC[-2]/RC[-4]-1 -> #DIV/0! | O38: 684 | P38: 0 | Q38: =+RC[-1]/RC[-2]-1 -> -1 | R38: 579819 | S38: 642876 | T38: 664954 | U38: =+RC[-1]/RC[-2]-1 -> 3.4342548174142395E-2 | V38: =+RC[-2]/RC[-4]-1 -> 0.14683030393967766 | W38: 744 | X38: 577 | Y38: =+RC[-1]/RC[-2]-1 -> -0.22446236559139787 | Z38: 1815923 | AA38: 756000 | AB38: 667355 | AC38: =+RC[-1]/RC[-2]-1 -> -0.11725529100529097 | AD38: =+RC[-2]/RC[-4]-1 -> -0.63249818411904024 | AE38: 467 | AF38: 1005 | AG38: =+RC[-1]/RC[-2]-1 -> 1.1520342612419698 | AH38: 1295415 | AI38: 2101453 | AJ38: 2665610 | AK38: =+RC[-1]/RC[-2]-1 -> 0.26846044141838998 | AL38: =+RC[-2]/RC[-4]-1 -> 1.057726674463396 | AM38: 2648 | AN38: 1458 | AO38: =+RC[-1]/RC[-2]-1 -> -0.44939577039274925 | AP38: 7609296 | AQ38: 5840951 | AR38: 7488993 | AS38: =+RC[-1]/RC[-2]-1 -> 0.28215302610824855 | AT38: =+RC[-2]/RC[-4]-1 -> -1.5810003974086384E-2 | AU38: 3787 | AV38: 4447 | AW38: =+RC[-1]/RC[-2]-1 -> 0.17428043306046992 | AX38: 3772161 | AY38: 4610136 | AZ38: 4237117 | BA38: =+RC[-1]/RC[-2]-1 -> -8.0912797366498479E-2 | BB38: =+RC[-2]/RC[-4]-1 -> 0.12325985025559616 | BC38: 2832 | BD38: 2371 | BE38: =+RC[-1]/RC[-2]-1 -> -0.16278248587570621 | BF38: 1609743 | BG38: 1437677 | BH38: 1400716 | BI38: =+RC[-1]/RC[-2]-1 -> -2.5708834460035135E-2 | BJ38: =+RC[-2]/RC[-4]-1 -> -0.12985116257688334 | BK38: 1225 | BL38: 1481 | BM38: =+RC[-1]/RC[-2]-1 -> 0.20897959183673476 | BN38: 901209 | BO38: 0 | BP38: 809321 | BQ38: =+RC[-1]/RC[-2]-1 -> #DIV/0! | BR38: =+RC[-2]/RC[-4]-1 -> -0.10196081042244365 | BS38: 1439 | BT38: 1285 | BU38: =+RC[-1]/RC[-2]-1 -> -0.10701876302988189 | BV38: 9179727 | BW38: 9317068 | BX38: 9302610 | BY38: =+RC[-1]/RC[-2]-1 -> -1.5517757303048496E-3 | BZ38: =+RC[-2]/RC[-4]-1 -> 1.3386345803094057E-2 | CA38: 2829 | CB38: 2916 | CC38: =+RC[-1]/RC[-2]-1 -> 3.0752916224814353E-2 | CD38: 2068073 | CE38: 2302688 | CF38: 2384698 | CG38: =+RC[-1]/RC[-2]-1 -> 3.5614898761795022E-2 | CH38: =+RC[-2]/RC[-4]-1 -> 0.1531014620857194 | CI38: 1772 | CJ38: 1489 | CK38: =+RC[-1]/RC[-2]-1 -> -0.15970654627539504 | CL38: 1383090 | CM38: 0 | CN38: 1063150 | CO38: =+RC[-1]/RC[-2]-1 -> #DIV/0! | CP38: =+RC[-2]/RC[-4]-1 -> -0.23132261819548983 | CQ38: 927 | CR38: 1006 | CS38: =+RC[-1]/RC[-2]-1 -> 8.5221143473570571E-2 | CT38: 2846964 | CU38: 2596077 | CV38: 2511358 | CW38: =+RC[-1]/RC[-2]-1 -> -3.26334696544055E-2 | CX38: =+RC[-2]/RC[-4]-1 -> -0.1178820666506496 | CY38: 1212 | CZ38: 1259 | DA38: =+RC[-1]/RC[-2]-1 -> 3.8778877887788887E-2 | DB38: 0 | DC38: 0 | DD38: 0 | DE38: =+RC[-1]/RC[-2]-1 -> #DIV/0! | DF38: =+RC[-2]/RC[-4]-1 -> #DIV/0! | DG38: 0 | DH38: 0 | DI38: =+RC[-1]/RC[-2]-1 -> #DIV/0! | DJ38: 0 | DK38: 0 | DL38: 0 | DM38: =+RC[-1]/RC[-2]-1 -> #DIV/0! | DN38: =+RC[-2]/RC[-4]-1 -> #DIV/0! | DO38: 0 | DP38: 0 | DQ38: =+RC[-1]/RC[-2]-1 -> #DIV/0! | DR38: 1679398 | DS38: 0 | DT38: 870042 | DU38: =+RC[-1]/RC[-2]-1 -> #DIV/0! | DV38: =+RC[-2]/RC[-4]-1 -> -0.48193221618699078 | DW38: 1397 | DX38: 1607 | DY38: =+RC[-1]/RC[-2]-1 -> 0.15032211882605573 | DZ38: 1549013 | EA38: 0 | EB38: 1282896 | EC38: =+RC[-1]/RC[-2]-1 -> #DIV/0! | ED38: =+RC[-2]/RC[-4]-1 -> -0.17179778349181063 | EE38: 979 | EF38: 1117 | EG38: =+RC[-1]/RC[-2]-1 -> 0.14096016343207363 | EH38: 3703528 | EI38: 3840908 | EJ38: 3746325 | EK38: =+RC[-1]/RC[-2]-1 -> -2.4625166757443862E-2 | EL38: =+RC[-2]/RC[-4]-1 -> 1.15557382042204E-2 | EM38: 3400 | EN38: 3072 | EO38: =+RC[-1]/RC[-2]-1 -> -9.6470588235294086E-2 | EP38: 2265723 | EQ38: 2422138 | ER38: 3206726 | ES38: =+RC[-1]/RC[-2]-1 -> 0.32392374010068781 | ET38: =+RC[-2]/RC[-4]-1 -> 0.41532129037839138 | EU38: 1812 | EV38: 1581 | EW38: =+RC[-1]/RC[-2]-1 -> -0.12748344370860931 | EX38: 395281 | EY38: 306226 | EZ38: 133142 | FA38: =+RC[-1]/RC[-2]-1 -> -0.56521653941859928 | FB38: =+RC[-2]/RC[-4]-1 -> -0.66317126297494688 | FC38: 230 | FD38: 438 | FE38: =+RC[-1]/RC[-2]-1 -> 0.90434782608695663 | FF38: 2521964 | FG38: 2550000 | FH38: 2405134 | FI38: =+RC[-1]/RC[-2]-1 -> -5.6810196078431408E-2 | FJ38: =+RC[-2]/RC[-4]-1 -> -4.6325007018339637E-2 | FK38: 1720 | FL38: 1731 | FM38: =+RC[-1]/RC[-2]-1 -> 6.3953488372092693E-3 | FN38: 478139 | FO38: 450000 | FP38: 223773 | FQ38: =+RC[-1]/RC[-2]-1 -> -0.50272666666666666 | FR38: =+RC[-2]/RC[-4]-1 -> -0.53199174298687202 | FS38: 380 | FT38: 567 | FU38: =+RC[-1]/RC[-2]-1 -> 0.49210526315789482 | FV38: 2875126 | FW38: 3600000 | FX38: 4162012 | FY38: =+RC[-1]/RC[-2]-1 -> 0.15611444444444444 | FZ38: =+RC[-2]/RC[-4]-1 -> 0.44759290549353326 | GA38: 1659 | GB38: 1429 | GC38: =+RC[-1]/RC[-2]-1 -> -0.13863773357444242 | GD38: 0 | GE38: 0 | GF38: 0 | GG38: =+RC[-1]/RC[-2]-1 -> #DIV/0! | GH38: =+RC[-2]/RC[-4]-1 -> #DIV/0! | GI38: 0 | GJ38: 0 | GK38: =+RC[-1]/RC[-2]-1 -> #DIV/0! | GL38: 3917511 | GM38: 3194035 | GN38: 2911952 | GO38: =+RC[-1]/RC[-2]-1 -> -8.8315563229582672E-2 | GP38: =+RC[-2]/RC[-4]-1 -> -0.25668313375508067 | GQ38: 1964 | GR38: 2225 | GS38: =+RC[-1]/RC[-2]-1 -> 0.13289205702647666 | GT38: 839371 | GU38: 950000 | GV38: 714308 | GW38: =+RC[-1]/RC[-2]-1 -> -0.24809684210526317 | GX38: =+RC[-2]/RC[-4]-1 -> -0.14899609350334952 | GY38: 752 | GZ38: 837 | HA38: =+RC[-1]/RC[-2]-1 -> 0.11303191489361697 | HB38: 2497561 | HC38: 2139501 | HD38: 1760615 | HE38: =+RC[-1]/RC[-2]-1 -> -0.17709082631884721 | HF38: =+RC[-2]/RC[-4]-1 -> -0.29506626664974345 | HG38: 1021 | HH38: 1222 | HI38: =+RC[-1]/RC[-2]-1 -> 0.19686581782566104 | HJ38: 2083020 | HK38: 0 | HL38: 1674067 | HM38: =+RC[-1]/RC[-2]-1 -> #DIV/0! | HN38: =+RC[-2]/RC[-4]-1 -> -0.19632696757592338 | HO38: 1358 | HP38: 1390 | HQ38: =+RC[-1]/RC[-2]-1 -> 2.356406480117812E-2 | HR38: 1191289 | HS38: 1207194 | HT38: 1140597 | HU38: =+RC[-1]/RC[-2]-1 -> -5.5166775182779237E-2 | HV38: =+RC[-2]/RC[-4]-1 -> -4.2552227041465218E-2 | HW38: 1273 | HX38: 1337 | HY38: =+RC[-1]/RC[-2]-1 -> 5.0274941084053504E-2 | HZ38: 2066526 | IA38: 2125788 | IB38: 2507894 | IC38: =+RC[-1]/RC[-2]-1 -> 0.17974793347219942 | ID38: =+RC[-2]/RC[-4]-1 -> 0.21357969848915515 | IE38: 1648 | IF38: 1355 | IG38: =+RC[-1]/RC[-2]-1 -> -0.17779126213592233 | IH38: 793255 | II38: 1003152 | IJ38: 936624 | IK38: =+RC[-1]/RC[-2]-1 -> -6.6318962629790867E-2 | IL38: =+RC[-2]/RC[-4]-1 -> 0.18073507258069599 | IM38: 814 | IN38: 754 | IO38: =+RC[-1]/RC[-2]-1 -> -7.3710073710073765E-2
A39: 03.02.2016 | B39: 60974389 | C39: 54878887 | D39: 60873497 | E39: =+RC[-1]/RC[-2]-1 -> 0.10923344709961036 | F39: =+RC[-2]/RC[-4]-1 -> -1.6546619269935947E-3 | G39: 39762 | H39: 39390 | I39: =+RC[-1]/RC[-2]-1 -> -9.3556662139731017E-3 | J39: 0 | K39: 777111 | L39: 628072 | M39: =+RC[-1]/RC[-2]-1 -> -0.19178598681526837 | N39: =+RC[-2]/RC[-4]-1 -> #DIV/0! | O39: 770 | P39: 0 | Q39: =+RC[-1]/RC[-2]-1 -> -1 | R39: 433129 | S39: 642876 | T39: 573315 | U39: =+RC[-1]/RC[-2]-1 -> -0.10820282605043585 | V39: =+RC[-2]/RC[-4]-1 -> 0.32365877140528565 | W39: 701 | X39: 519 | Y39: =+RC[-1]/RC[-2]-1 -> -0.25962910128388017 | Z39: 1450246 | AA39: 720000 | AB39: 514826 | AC39: =+RC[-1]/RC[-2]-1 -> -0.28496388888888891 | AD39: =+RC[-2]/RC[-4]-1 -> -0.64500781246767791 | AE39: 429 | AF39: 858 | AG39: =+RC[-1]/RC[-2]-1 -> 1 | AH39: 1290500 | AI39: 2147137 | AJ39: 2432692 | AK39: =+RC[-1]/RC[-2]-1 -> 0.13299337676170642 | AL39: =+RC[-2]/RC[-4]-1 -> 0.88507710189848887 | AM39: 2595 | AN39: 1471 | AO39: =+RC[-1]/RC[-2]-1 -> -0.43314065510597299 | AP39: 7822212 | AQ39: 6057283 | AR39: 7203623 | AS39: =+RC[-1]/RC[-2]-1 -> 0.18924986664813259 | AT39: =+RC[-2]/RC[-4]-1 -> -7.9081083458234058E-2 | AU39: 3799 | AV39: 4302 | AW39: =+RC[-1]/RC[-2]-1 -> 0.13240326401684643 | AX39: 3952727 | AY39: 4610136 | AZ39: 4183563 | BA39: =+RC[-1]/RC[-2]-1 -> -9.2529374404572873E-2 | BB39: =+RC[-2]/RC[-4]-1 -> 5.8399176062500668E-2 | BC39: 2520 | BD39: 2481 | BE39: =+RC[-1]/RC[-2]-1 -> -1.5476190476190421E-2 | BF39: 1354270 | BG39: 1437677 | BH39: 1312262 | BI39: =+RC[-1]/RC[-2]-1 -> -8.723447617232527E-2 | BJ39: =+RC[-2]/RC[-4]-1 -> -3.101892532508288E-2 | BK39: 1237 | BL39: 1321 | BM39: =+RC[-1]/RC[-2]-1 -> 6.7906224737267484E-2 | BN39: 994915 | BO39: 0 | BP39: 670419 | BQ39: =+RC[-1]/RC[-2]-1 -> #DIV/0! | BR39: =+RC[-2]/RC[-4]-1 -> -0.32615449561017773 | BS39: 1135 | BT39: 1292 | BU39: =+RC[-1]/RC[-2]-1 -> 0.13832599118942723 | BV39: 8689161 | BW39: 9317068 | BX39: 10385463 | BY39: =+RC[-1]/RC[-2]-1 -> 0.11467073117852089 | BZ39: =+RC[-2]/RC[-4]-1 -> 0.19522045914444441 | CA39: 2879 | CB39: 2792 | CC39: =+RC[-1]/RC[-2]-1 -> -3.021882598124348E-2 | CD39: 2522847 | CE39: 2302688 | CF39: 2146610 | CG39: =+RC[-1]/RC[-2]-1 -> -6.7780784891396495E-2 | CH39: =+RC[-2]/RC[-4]-1 -> -0.14913191327099895 | CI39: 1656 | CJ39: 1524 | CK39: =+RC[-1]/RC[-2]-1 -> -7.9710144927536253E-2 | CL39: 1248075 | CM39: 0 | CN39: 983991 | CO39: =+RC[-1]/RC[-2]-1 -> #DIV/0! | CP39: =+RC[-2]/RC[-4]-1 -> -0.21159305330208522 | CQ39: 927 | CR39: 1024 | CS39: =+RC[-1]/RC[-2]-1 -> 0.1046386192017259 | CT39: 2661994 | CU39: 2596077 | CV39: 2215012 | CW39: =+RC[-1]/RC[-2]-1 -> -0.14678493742674037 | CX39: =+RC[-2]/RC[-4]-1 -> -0.16791247463367687 | CY39: 1112 | CZ39: 1298 | DA39: =+RC[-1]/RC[-2]-1 -> 0.16726618705035978 | DB39: 0 | DC39: 0 | DD39: 0 | DE39: =+RC[-1]/RC[-2]-1 -> #DIV/0! | DF39: =+RC[-2]/RC[-4]-1 -> #DIV/0! | DG39: 0 | DH39: 0 | DI39: =+RC[-1]/RC[-2]-1 -> #DIV/0! | DJ39: 0 | DK39: 0 | DL39: 0 | DM39: =+RC[-1]/RC[-2]-1 -> #DIV/0! | DN39: =+RC[-2]/RC[-4]-1 -> #DIV/0! | DO39: 0 | DP39: 0 | DQ39: =+RC[-1]/RC[-2]-1 -> #DIV/0! | DR39: 1520146 | DS39: 0 | DT39: 777296 | DU39: =+RC[-1]/RC[-2]-1 -> #DIV/0! | DV39: =+RC[-2]/RC[-4]-1 -> -0.48867016720762346 | DW39: 1064 | DX39: 1577 | DY39: =+RC[-1]/RC[-2]-1 -> 0.48214285714285721 | DZ39: 1459180 | EA39: 0 | EB39: 1354177 | EC39: =+RC[-1]/RC[-2]-1 -> #DIV/0! | ED39: =+RC[-2]/RC[-4]-1 -> -7.1960279060842347E-2 | EE39: 974 | EF39: 1064 | EG39: =+RC[-1]/RC[-2]-1 -> 9.2402464065708401E-2 | EH39: 3576751 | EI39: 3840908 | EJ39: 3576458 | EK39: =+RC[-1]/RC[-2]-1 -> -6.8850907129251682E-2 | EL39: =+RC[-2]/RC[-4]-1 -> -8.19179193631836E-5 | EM39: 3020 | EN39: 3034 | EO39: =+RC[-1]/RC[-2]-1 -> 4.6357615894039306E-3 | EP39: 2351223 | EQ39: 2497829 | ER39: 3668741 | ES39: =+RC[-1]/RC[-2]-1 -> 0.46877188150189619 | ET39: =+RC[-2]/RC[-4]-1 -> 0.56035433474408847 | EU39: 1918 | EV39: 1555 | EW39: =+RC[-1]/RC[-2]-1 -> -0.18925964546402507 | EX39: 417193 | EY39: 306226 | EZ39: 135341 | FA39: =+RC[-1]/RC[-2]-1 -> -0.55803556850169489 | FB39: =+RC[-2]/RC[-4]-1 -> -0.67559139295242243 | FC39: 231 | FD39: 451 | FE39: =+RC[-1]/RC[-2]-1 -> 0.95238095238095233 | FF39: 2335016 | FG39: 2550000 | FH39: 2408430 | FI39: =+RC[-1]/RC[-2]-1 -> -5.551764705882356E-2 | FJ39: =+RC[-2]/RC[-4]-1 -> 3.1440469786930825E-2 | FK39: 1855 | FL39: 1658 | FM39: =+RC[-1]/RC[-2]-1 -> -0.10619946091644206 | FN39: 558663 | FO39: 450000 | FP39: 225423 | FQ39: =+RC[-1]/RC[-2]-1 -> -0.49905999999999995 | FR39: =+RC[-2]/RC[-4]-1 -> -0.59649556172504714 | FS39: 356 | FT39: 615 | FU39: =+RC[-1]/RC[-2]-1 -> 0.72752808988764039 | FV39: 3419408 | FW39: 3600000 | FX39: 4143283 | FY39: =+RC[-1]/RC[-2]-1 -> 0.15091194444444445 | FZ39: =+RC[-2]/RC[-4]-1 -> 0.21169600117915155 | GA39: 1716 | GB39: 1482 | GC39: =+RC[-1]/RC[-2]-1 -> -0.13636363636363635 | GD39: 0 | GE39: 200000 | GF39: 0 | GG39: =+RC[-1]/RC[-2]-1 -> -1 | GH39: =+RC[-2]/RC[-4]-1 -> #DIV/0! | GI39: 0 | GJ39: 0 | GK39: =+RC[-1]/RC[-2]-1 -> #DIV/0! | GL39: 3819981 | GM39: 3194035 | GN39: 2831345 | GO39: =+RC[-1]/RC[-2]-1 -> -0.11355229357223695 | GP39: =+RC[-2]/RC[-4]-1 -> -0.25880652285966865 | GQ39: 2064 | GR39: 2127 | GS39: =+RC[-1]/RC[-2]-1 -> 3.0523255813953432E-2 | GT39: 824937 | GU39: 950000 | GV39: 722519 | GW39: =+RC[-1]/RC[-2]-1 -> -0.23945368421052626 | GX39: =+RC[-2]/RC[-4]-1 -> -0.12415251104023706 | GY39: 772 | GZ39: 901 | HA39: =+RC[-1]/RC[-2]-1 -> 0.16709844559585485 | HB39: 2072711 | HC39: 2139501 | HD39: 1727534 | HE39: =+RC[-1]/RC[-2]-1 -> -0.19255284292926245 | HF39: =+RC[-2]/RC[-4]-1 -> -0.16653407059643144 | HG39: 1029 | HH39: 1246 | HI39: =+RC[-1]/RC[-2]-1 -> 0.21088435374149661 | HJ39: 2252742 | HK39: 0 | HL39: 1516717 | HM39: =+RC[-1]/RC[-2]-1 -> #DIV/0! | HN39: =+RC[-2]/RC[-4]-1 -> -0.3267240545077954 | HO39: 1326 | HP39: 1343 | HQ39: =+RC[-1]/RC[-2]-1 -> 1.2820512820512775E-2 | HR39: 1099944 | HS39: 1312167 | HT39: 1302182 | HU39: =+RC[-1]/RC[-2]-1 -> -7.6095496990855604E-3 | HV39: =+RC[-2]/RC[-4]-1 -> 0.18386208752445587 | HW39: 1315 | HX39: 1306 | HY39: =+RC[-1]/RC[-2]-1 -> -6.8441064638783411E-3 | HZ39: 1957470 | IA39: 2227016 | IB39: 2332467 | IC39: =+RC[-1]/RC[-2]-1 -> 4.735080484379095E-2 | ID39: =+RC[-2]/RC[-4]-1 -> 0.19157228463271458 | IE39: 1607 | IF39: 1378 | IG39: =+RC[-1]/RC[-2]-1 -> -0.14250155569383949 | IH39: 888948 | II39: 1003152 | IJ39: 901736 | IK39: =+RC[-1]/RC[-2]-1 -> -0.10109734118059877 | IL39: =+RC[-2]/RC[-4]-1 -> 1.4385543361366437E-2 | IM39: 755 | IN39: 771 | IO39: =+RC[-1]/RC[-2]-1 -> 2.1192052980132381E-2
A40: 04.02.2016 | B40: 62224517 | C40: 54918543 | D40: 60229724 | E40: =+RC[-1]/RC[-2]-1 -> 9.671015853424958E-2 | F40: =+RC[-2]/RC[-4]-1 -> -3.2057990904131861E-2 | G40: 39895 | H40: 40812 | I40: =+RC[-1]/RC[-2]-1 -> 2.2985336508334342E-2 | J40: 0 | K40: 836889 | L40: 664235 | M40: =+RC[-1]/RC[-2]-1 -> -0.2063045397896256 | N40: =+RC[-2]/RC[-4]-1 -> #DIV/0! | O40: 778 | P40: 0 | Q40: =+RC[-1]/RC[-2]-1 -> -1 | R40: 458760 | S40: 642876 | T40: 604074 | U40: =+RC[-1]/RC[-2]-1 -> -6.0356896197711563E-2 | V40: =+RC[-2]/RC[-4]-1 -> 0.31675385822652369 | W40: 657 | X40: 533 | Y40: =+RC[-1]/RC[-2]-1 -> -0.18873668188736681 | Z40: 1199809 | AA40: 720000 | AB40: 655832 | AC40: =+RC[-1]/RC[-2]-1 -> -8.9122222222222214E-2 | AD40: =+RC[-2]/RC[-4]-1 -> -0.45338633065762968 | AE40: 421 | AF40: 755 | AG40: =+RC[-1]/RC[-2]-1 -> 0.79334916864608074 | AH40: 1395351 | AI40: 2147137 | AJ40: 2480346 | AK40: =+RC[-1]/RC[-2]-1 -> 0.1551875823480291 | AL40: =+RC[-2]/RC[-4]-1 -> 0.77757854475325572 | AM40: 2600 | AN40: 1511 | AO40: =+RC[-1]/RC[-2]-1 -> -0.41884615384615387 | AP40: 7449229 | AQ40: 6057283 | AR40: 6843162 | AS40: =+RC[-1]/RC[-2]-1 -> 0.12974117273371566 | AT40: =+RC[-2]/RC[-4]-1 -> -8.1359695077168337E-2 | AU40: 3892 | AV40: 4445 | AW40: =+RC[-1]/RC[-2]-1 -> 0.1420863309352518 | AX40: 4172283 | AY40: 4610136 | AZ40: 4492760 | BA40: =+RC[-1]/RC[-2]-1 -> -2.5460420256582461E-2 | BB40: =+RC[-2]/RC[-4]-1 -> 7.6810944991027696E-2 | BC40: 2599 | BD40: 2476 | BE40: =+RC[-1]/RC[-2]-1 -> -4.7325894574836491E-2 | BF40: 1473280 | BG40: 1437677 | BH40: 1355564 | BI40: =+RC[-1]/RC[-2]-1 -> -5.711505435504638E-2 | BJ40: =+RC[-2]/RC[-4]-1 -> -7.9900629887054708E-2 | BK40: 1215 | BL40: 1377 | BM40: =+RC[-1]/RC[-2]-1 -> 0.1333333333333333 | BN40: 896888 | BO40: 0 | BP40: 732316 | BQ40: =+RC[-1]/RC[-2]-1 -> #DIV/0! | BR40: =+RC[-2]/RC[-4]-1 -> -0.18349225321333318 | BS40: 1196 | BT40: 1307 | BU40: =+RC[-1]/RC[-2]-1 -> 9.2809364548495088E-2 | BV40: 8644341 | BW40: 9317068 | BX40: 9045640 | BY40: =+RC[-1]/RC[-2]-1 -> -2.9132340775016363E-2 | BZ40: =+RC[-2]/RC[-4]-1 -> 4.6423319024550214E-2 | CA40: 2773 | CB40: 2872 | CC40: =+RC[-1]/RC[-2]-1 -> 3.5701406419040849E-2 | CD40: 2203903 | CE40: 2302688 | CF40: 2079483 | CG40: =+RC[-1]/RC[-2]-1 -> -9.6932367737183722E-2 | CH40: =+RC[-2]/RC[-4]-1 -> -5.6454390234052965E-2 | CI40: 1528 | CJ40: 1469 | CK40: =+RC[-1]/RC[-2]-1 -> -3.8612565445026226E-2 | CL40: 1341502 | CM40: 0 | CN40: 971793 | CO40: =+RC[-1]/RC[-2]-1 -> #DIV/0! | CP40: =+RC[-2]/RC[-4]-1 -> -0.27559332747919874 | CQ40: 932 | CR40: 1092 | CS40: =+RC[-1]/RC[-2]-1 -> 0.17167381974248919 | CT40: 2643287 | CU40: 2596077 | CV40: 2314051 | CW40: =+RC[-1]/RC[-2]-1 -> -0.10863545264643537 | CX40: =+RC[-2]/RC[-4]-1 -> -0.12455552499596145 | CY40: 1159 | CZ40: 1302 | DA40: =+RC[-1]/RC[-2]-1 -> 0.12338222605694571 | DB40: 0 | DC40: 0 | DD40: 0 | DE40: =+RC[-1]/RC[-2]-1 -> #DIV/0! | DF40: =+RC[-2]/RC[-4]-1 -> #DIV/0! | DG40: 0 | DH40: 0 | DI40: =+RC[-1]/RC[-2]-1 -> #DIV/0! | DJ40: 0 | DK40: 0 | DL40: 0 | DM40: =+RC[-1]/RC[-2]-1 -> #DIV/0! | DN40: =+RC[-2]/RC[-4]-1 -> #DIV/0! | DO40: 0 | DP40: 0 | DQ40: =+RC[-1]/RC[-2]-1 -> #DIV/0! | DR40: 1815231 | DS40: 0 | DT40: 780904 | DU40: =+RC[-1]/RC[-2]-1 -> #DIV/0! | DV40: =+RC[-2]/RC[-4]-1 -> -0.56980461439893881 | DW40: 975 | DX40: 1765 | DY40: =+RC[-1]/RC[-2]-1 -> 0.81025641025641026 | DZ40: 1554953 | EA40: 0 | EB40: 1200609 | EC40: =+RC[-1]/RC[-2]-1 -> #DIV/0! | ED40: =+RC[-2]/RC[-4]-1 -> -0.22788084270071185 | EE40: 945 | EF40: 1079 | EG40: =+RC[-1]/RC[-2]-1 -> 0.14179894179894181 | EH40: 3620613 | EI40: 3840908 | EJ40: 3481565 | EK40: =+RC[-1]/RC[-2]-1 -> -9.3556783968790747E-2 | EL40: =+RC[-2]/RC[-4]-1 -> -3.8404546412444507E-2 | EM40: 3038 | EN40: 3070 | EO40: =+RC[-1]/RC[-2]-1 -> 1.0533245556286985E-2 | EP40: 2486367 | EQ40: 2573521 | ER40: 3427066 | ES40: =+RC[-1]/RC[-2]-1 -> 0.33166428406840276 | ET40: =+RC[-2]/RC[-4]-1 -> 0.37834277884157896 | EU40: 1929 | EV40: 1641 | EW40: =+RC[-1]/RC[-2]-1 -> -0.14930015552099529 | EX40: 449271 | EY40: 306226 | EZ40: 118531 | FA40: =+RC[-1]/RC[-2]-1 -> -0.61292966632487111 | FB40: =+RC[-2]/RC[-4]-1 -> -0.73617037378330674 | FC40: 236 | FD40: 470 | FE40: =+RC[-1]/RC[-2]-1 -> 0.99152542372881358 | FF40: 2624454 | FG40: 2550000 | FH40: 2503837 | FI40: =+RC[-1]/RC[-2]-1 -> -1.810313725490198E-2 | FJ40: =+RC[-2]/RC[-4]-1 -> -4.5958892783032224E-2 | FK40: 1811 | FL40: 1902 | FM40: =+RC[-1]/RC[-2]-1 -> 5.0248481501932618E-2 | FN40: 557818 | FO40: 450000 | FP40: 197698 | FQ40: =+RC[-1]/RC[-2]-1 -> -0.56067111111111112 | FR40: =+RC[-2]/RC[-4]-1 -> -0.64558691186014072 | FS40: 350 | FT40: 634 | FU40: =+RC[-1]/RC[-2]-1 -> 0.81142857142857139 | FV40: 4012056 | FW40: 3600000 | FX40: 4296735 | FY40: =+RC[-1]/RC[-2]-1 -> 0.19353749999999992 | FZ40: =+RC[-2]/RC[-4]-1 -> 7.0955888950702484E-2 | GA40: 1730 | GB40: 1746 | GC40: =+RC[-1]/RC[-2]-1 -> 9.2485549132947931E-3 | GD40: 0 | GE40: 90000 | GF40: 0 | GG40: =+RC[-1]/RC[-2]-1 -> -1 | GH40: =+RC[-2]/RC[-4]-1 -> #DIV/0! | GI40: 0 | GJ40: 0 | GK40: =+RC[-1]/RC[-2]-1 -> #DIV/0! | GL40: 3958600 | GM40: 3194035 | GN40: 3007280 | GO40: =+RC[-1]/RC[-2]-1 -> -5.8469929102217155E-2 | GP40: =+RC[-2]/RC[-4]-1 -> -0.24031728388824336 | GQ40: 2100 | GR40: 2243 | GS40: =+RC[-1]/RC[-2]-1 -> 6.8095238095237987E-2 | GT40: 864771 | GU40: 950000 | GV40: 804754 | GW40: =+RC[-1]/RC[-2]-1 -> -0.15289052631578948 | GX40: =+RC[-2]/RC[-4]-1 -> -6.9402188556276778E-2 | GY40: 845 | GZ40: 964 | HA40: =+RC[-1]/RC[-2]-1 -> 0.140828402366864 | HB40: 2125862 | HC40: 2202428 | HD40: 1674844 | HE40: =+RC[-1]/RC[-2]-1 -> -0.23954653682208904 | HF40: =+RC[-2]/RC[-4]-1 -> -0.21215770355742758 | HG40: 1049 | HH40: 1228 | HI40: =+RC[-1]/RC[-2]-1 -> 0.17063870352716881 | HJ40: 2218783 | HK40: 0 | HL40: 1699717 | HM40: =+RC[-1]/RC[-2]-1 -> #DIV/0! | HN40: =+RC[-2]/RC[-4]-1 -> -0.23394175996480959 | HO40: 1427 | HP40: 1422 | HQ40: =+RC[-1]/RC[-2]-1 -> -3.5038542396635952E-3 | HR40: 1039211 | HS40: 1364654 | HT40: 1222804 | HU40: =+RC[-1]/RC[-2]-1 -> -0.10394576207595474 | HV40: =+RC[-2]/RC[-4]-1 -> 0.1766657589267242 | HW40: 1318 | HX40: 1261 | HY40: =+RC[-1]/RC[-2]-1 -> -4.324734446130496E-2 | HZ40: 2070430 | IA40: 2125788 | IB40: 2715154 | IC40: =+RC[-1]/RC[-2]-1 -> 0.27724589658046805 | ID40: =+RC[-2]/RC[-4]-1 -> 0.31139618340151554 | IE40: 1662 | IF40: 1467 | IG40: =+RC[-1]/RC[-2]-1 -> -0.11732851985559567 | IH40: 947464 | II40: 1003152 | IJ40: 858970 | IK40: =+RC[-1]/RC[-2]-1 -> -0.14372896629822796 | IL40: =+RC[-2]/RC[-4]-1 -> -9.3400910219280098E-2 | IM40: 730 | IN40: 781 | IO40: =+RC[-1]/RC[-2]-1 -> 6.9863013698630239E-2
A41: 05.02.2016 | B41: 61045002 | C41: 58377555 | D41: 68693410 | E41: =+RC[-1]/RC[-2]-1 -> 0.17670926779992757 | F41: =+RC[-2]/RC[-4]-1 -> 0.12529130558468982 | G41: 42960 | H41: 40633 | I41: =+RC[-1]/RC[-2]-1 -> -5.4166666666666696E-2 | J41: 0 | K41: 896667 | L41: 708213 | M41: =+RC[-1]/RC[-2]-1 -> -0.21017166908116391 | N41: =+RC[-2]/RC[-4]-1 -> #DIV/0! | O41: 823 | P41: 0 | Q41: =+RC[-1]/RC[-2]-1 -> -1 | R41: 441723 | S41: 642876 | T41: 621698 | U41: =+RC[-1]/RC[-2]-1 -> -3.2942589239604581E-2 | V41: =+RC[-2]/RC[-4]-1 -> 0.4074385983976383 | W41: 722 | X41: 535 | Y41: =+RC[-1]/RC[-2]-1 -> -0.25900277008310246 | Z41: 1101300 | AA41: 840000 | AB41: 728339 | AC41: =+RC[-1]/RC[-2]-1 -> -0.13292976190476191 | AD41: =+RC[-2]/RC[-4]-1 -> -0.33865522564242256 | AE41: 467 | AF41: 673 | AG41: =+RC[-1]/RC[-2]-1 -> 0.4411134903640257 | AH41: 1307998 | AI41: 2375556 | AJ41: 2812627 | AK41: =+RC[-1]/RC[-2]-1 -> 0.18398682245335407 | AL41: =+RC[-2]/RC[-4]-1 -> 1.1503297405653528 | AM41: 2846 | AN41: 1493 | AO41: =+RC[-1]/RC[-2]-1 -> -0.47540407589599443 | AP41: 7479051 | AQ41: 6922609 | AR41: 7849458 | AS41: =+RC[-1]/RC[-2]-1 -> 0.13388723817855386 | AT41: =+RC[-2]/RC[-4]-1 -> 4.9525935843999447E-2 | AU41: 4220 | AV41: 4571 | AW41: =+RC[-1]/RC[-2]-1 -> 8.3175355450237021E-2 | AX41: 4375462 | AY41: 4610136 | AZ41: 5267737 | BA41: =+RC[-1]/RC[-2]-1 -> 0.1426424296376505 | BB41: =+RC[-2]/RC[-4]-1 -> 0.20392703673349244 | BC41: 2827 | BD41: 2441 | BE41: =+RC[-1]/RC[-2]-1 -> -0.13654050229925718 | BF41: 1567839 | BG41: 1414674 | BH41: 1453260 | BI41: =+RC[-1]/RC[-2]-1 -> 2.7275541926973901E-2 | BJ41: =+RC[-2]/RC[-4]-1 -> -7.3080845673567207E-2 | BK41: 1313 | BL41: 1448 | BM41: =+RC[-1]/RC[-2]-1 -> 0.10281797410510274 | BN41: 956632 | BO41: 0 | BP41: 758274 | BQ41: =+RC[-1]/RC[-2]-1 -> #DIV/0! | BR41: =+RC[-2]/RC[-4]-1 -> -0.20735037088451991 | BS41: 1294 | BT41: 1383 | BU41: =+RC[-1]/RC[-2]-1 -> 6.8778979907264226E-2 | BV41: 8427448 | BW41: 9521838 | BX41: 10377624 | BY41: =+RC[-1]/RC[-2]-1 -> 8.9876135258759815E-2 | BZ41: =+RC[-2]/RC[-4]-1 -> 0.23140765745454606 | CA41: 3112 | CB41: 2747 | CC41: =+RC[-1]/RC[-2]-1 -> -0.11728791773778924 | CD41: 2218335 | CE41: 2302688 | CF41: 2331842 | CG41: =+RC[-1]/RC[-2]-1 -> 1.2660855487152345E-2 | CH41: =+RC[-2]/RC[-4]-1 -> 5.1167655020544656E-2 | CI41: 1716 | CJ41: 1399 | CK41: =+RC[-1]/RC[-2]-1 -> -0.18473193473193472 | CL41: 1354293 | CM41: 0 | CN41: 1103732 | CO41: =+RC[-1]/RC[-2]-1 -> #DIV/0! | CP41: =+RC[-2]/RC[-4]-1 -> -0.18501240130459218 | CQ41: 931 | CR41: 1095 | CS41: =+RC[-1]/RC[-2]-1 -> 0.17615467239527383 | CT41: 2682853 | CU41: 2832084 | CV41: 2422334 | CW41: =+RC[-1]/RC[-2]-1 -> -0.14468144306454189 | CX41: =+RC[-2]/RC[-4]-1 -> -9.7105208522419995E-2 | CY41: 1235 | CZ41: 1284 | DA41: =+RC[-1]/RC[-2]-1 -> 3.9676113360323839E-2 | DB41: 0 | DC41: 0 | DD41: 0 | DE41: =+RC[-1]/RC[-2]-1 -> #DIV/0! | DF41: =+RC[-2]/RC[-4]-1 -> #DIV/0! | DG41: 0 | DH41: 0 | DI41: =+RC[-1]/RC[-2]-1 -> #DIV/0! | DJ41: 0 | DK41: 0 | DL41: 0 | DM41: =+RC[-1]/RC[-2]-1 -> #DIV/0! | DN41: =+RC[-2]/RC[-4]-1 -> #DIV/0! | DO41: 0 | DP41: 0 | DQ41: =+RC[-1]/RC[-2]-1 -> #DIV/0! | DR41: 1610356 | DS41: 0 | DT41: 729052 | DU41: =+RC[-1]/RC[-2]-1 -> #DIV/0! | DV41: =+RC[-2]/RC[-4]-1 -> -0.54727277695118348 | DW41: 1074 | DX41: 1783 | DY41: =+RC[-1]/RC[-2]-1 -> 0.66014897579143383 | DZ41: 1489371 | EA41: 0 | EB41: 1554272 | EC41: =+RC[-1]/RC[-2]-1 -> #DIV/0! | ED41: =+RC[-2]/RC[-4]-1 -> 4.3576113674833161E-2 | EE41: 1032 | EF41: 1086 | EG41: =+RC[-1]/RC[-2]-1 -> 5.232558139534893E-2 | EH41: 3580093 | EI41: 3840908 | EJ41: 3808883 | EK41: =+RC[-1]/RC[-2]-1 -> -8.3378721906383069E-3 | EL41: =+RC[-2]/RC[-4]-1 -> 6.3906161096932479E-2 | EM41: 3171 | EN41: 3052 | EO41: =+RC[-1]/RC[-2]-1 -> -3.7527593818984517E-2 | EP41: 2593867 | EQ41: 2725185 | ER41: 4252785 | ES41: =+RC[-1]/RC[-2]-1 -> 0.56054910033630745 | ET41: =+RC[-2]/RC[-4]-1 -> 0.6395539940945314 | EU41: 2066 | EV41: 1659 | EW41: =+RC[-1]/RC[-2]-1 -> -0.19699903194578894 | EX41: 362952 | EY41: 351746 | EZ41: 154149 | FA41: =+RC[-1]/RC[-2]-1 -> -0.56176047488812952 | FB41: =+RC[-2]/RC[-4]-1 -> -0.57529094756331411 | FC41: 244 | FD41: 424 | FE41: =+RC[-1]/RC[-2]-1 -> 0.73770491803278682 | FF41: 2622682 | FG41: 2550000 | FH41: 3239630 | FI41: =+RC[-1]/RC[-2]-1 -> 0.27044313725490188 | FJ41: =+RC[-2]/RC[-4]-1 -> 0.2352355337017602 | FK41: 2035 | FL41: 1873 | FM41: =+RC[-1]/RC[-2]-1 -> -7.9606879606879621E-2 | FN41: 677009 | FO41: 450000 | FP41: 243014 | FQ41: =+RC[-1]/RC[-2]-1 -> -0.45996888888888887 | FR41: =+RC[-2]/RC[-4]-1 -> -0.64104760793431104 | FS41: 360 | FT41: 670 | FU41: =+RC[-1]/RC[-2]-1 -> 0.86111111111111116 | FV41: 4153423 | FW41: 3800000 | FX41: 4855881 | FY41: =+RC[-1]/RC[-2]-1 -> 0.27786342105263162 | FZ41: =+RC[-2]/RC[-4]-1 -> 0.16912748833913627 | GA41: 1874 | GB41: 1810 | GC41: =+RC[-1]/RC[-2]-1 -> -3.4151547491995782E-2 | GD41: 0 | GE41: 180000 | GF41: 0 | GG41: =+RC[-1]/RC[-2]-1 -> -1 | GH41: =+RC[-2]/RC[-4]-1 -> #DIV/0! | GI41: 0 | GJ41: 0 | GK41: =+RC[-1]/RC[-2]-1 -> #DIV/0! | GL41: 3373552 | GM41: 3992543 | GN41: 3377072 | GO41: =+RC[-1]/RC[-2]-1 -> -0.15415513370801515 | GP41: =+RC[-2]/RC[-4]-1 -> 1.0434106247658725E-3 | GQ41: 2302 | GR41: 2269 | GS41: =+RC[-1]/RC[-2]-1 -> -1.4335360556038235E-2 | GT41: 872952 | GU41: 950000 | GV41: 922704 | GW41: =+RC[-1]/RC[-2]-1 -> -2.8732631578947343E-2 | GX41: =+RC[-2]/RC[-4]-1 -> 5.6992824347730453E-2 | GY41: 839 | GZ41: 990 | HA41: =+RC[-1]/RC[-2]-1 -> 0.17997616209773537 | HB41: 2209606 | HC41: 2328281 | HD41: 1994109 | HE41: =+RC[-1]/RC[-2]-1 -> -0.14352734914728937 | HF41: =+RC[-2]/RC[-4]-1 -> -9.7527341978615234E-2 | HG41: 1102 | HH41: 1261 | HI41: =+RC[-1]/RC[-2]-1 -> 0.14428312159709611 | HJ41: 1760819 | HK41: 0 | HL41: 1894526 | HM41: =+RC[-1]/RC[-2]-1 -> #DIV/0! | HN41: =+RC[-2]/RC[-4]-1 -> 7.5934550910684129E-2 | HO41: 1451 | HP41: 1332 | HQ41: =+RC[-1]/RC[-2]-1 -> -8.2012405237767094E-2 | HR41: 992633 | HS41: 1417140 | HT41: 1477788 | HU41: =+RC[-1]/RC[-2]-1 -> 4.2796054024302421E-2 | HV41: =+RC[-2]/RC[-4]-1 -> 0.48875566296909323 | HW41: 1373 | HX41: 1286 | HY41: =+RC[-1]/RC[-2]-1 -> -6.3364894391842674E-2 | HZ41: 1843440 | IA41: 2429472 | IB41: 2782367 | IC41: =+RC[-1]/RC[-2]-1 -> 0.14525584159850369 | ID41: =+RC[-2]/RC[-4]-1 -> 0.50933417957731209 | IE41: 1755 | IF41: 1313 | IG41: =+RC[-1]/RC[-2]-1 -> -0.25185185185185188 | IH41: 989313 | II41: 1003152 | IJ41: 972040 | IK41: =+RC[-1]/RC[-2]-1 -> -3.1014243105730754E-2 | IL41: =+RC[-2]/RC[-4]-1 -> -1.7459590645225509E-2 | IM41: 776 | IN41: 756 | IO41: =+RC[-1]/RC[-2]-1 -> -2.5773195876288679E-2
A42: 06.02.2016 | B42: 69002390 | C42: 70201367 | D42: 83277316 | E42: =+RC[-1]/RC[-2]-1 -> 0.18626345267607114 | F42: =+RC[-2]/RC[-4]-1 -> 0.20687581980856029 | G42: 45642 | H42: 43108 | I42: =+RC[-1]/RC[-2]-1 -> -5.5519039481179644E-2 | J42: 0 | K42: 1195556 | L42: 894855 | M42: =+RC[-1]/RC[-2]-1 -> -0.25151561281947477 | N42: =+RC[-2]/RC[-4]-1 -> #DIV/0! | O42: 975 | P42: 0 | Q42: =+RC[-1]/RC[-2]-1 -> -1 | R42: 513281 | S42: 642876 | T42: 615209 | U42: =+RC[-1]/RC[-2]-1 -> -4.3036293157622918E-2 | V42: =+RC[-2]/RC[-4]-1 -> 0.19858128393608965 | W42: 671 | X42: 558 | Y42: =+RC[-1]/RC[-2]-1 -> -0.16840536512667659 | Z42: 1312000 | AA42: 876000 | AB42: 910336 | AC42: =+RC[-1]/RC[-2]-1 -> 3.9196347031963397E-2 | AD42: =+RC[-2]/RC[-4]-1 -> -0.30614634146341468 | AE42: 501 | AF42: 739 | AG42: =+RC[-1]/RC[-2]-1 -> 0.47504990019960069 | AH42: 1685775 | AI42: 3197863 | AJ42: 3751459 | AK42: =+RC[-1]/RC[-2]-1 -> 0.17311435793215657 | AL42: =+RC[-2]/RC[-4]-1 -> 1.2253616289243818 | AM42: 3261 | AN42: 1618 | AO42: =+RC[-1]/RC[-2]-1 -> -0.50383318000613309 | AP42: 8725660 | AQ42: 9085924 | AR42: 11127566 | AS42: =+RC[-1]/RC[-2]-1 -> 0.2247038385969331 | AT42: =+RC[-2]/RC[-4]-1 -> 0.27526926329928059 | AU42: 5212 | AV42: 4911 | AW42: =+RC[-1]/RC[-2]-1 -> -5.775134305448959E-2 | AX42: 4875474 | AY42: 6432749 | AZ42: 6980207 | BA42: =+RC[-1]/RC[-2]-1 -> 8.5104828433380408E-2 | BB42: =+RC[-2]/RC[-4]-1 -> 0.43169812822301989 | BC42: 3282 | BD42: 2615 | BE42: =+RC[-1]/RC[-2]-1 -> -0.20322973796465571 | BF42: 1631215 | BG42: 1265156 | BH42: 1295151 | BI42: =+RC[-1]/RC[-2]-1 -> 2.370853870985079E-2 | BJ42: =+RC[-2]/RC[-4]-1 -> -0.20602066557749898 | BK42: 971 | BL42: 1409 | BM42: =+RC[-1]/RC[-2]-1 -> 0.45108135942327499 | BN42: 995582 | BO42: 0 | BP42: 995308 | BQ42: =+RC[-1]/RC[-2]-1 -> #DIV/0! | BR42: =+RC[-2]/RC[-4]-1 -> -2.7521590386325734E-4 | BS42: 1601 | BT42: 1413 | BU42: =+RC[-1]/RC[-2]-1 -> -0.11742660836976893 | BV42: 9524314 | BW42: 11262389 | BX42: 12619912 | BY42: =+RC[-1]/RC[-2]-1 -> 0.12053597154209461 | BZ42: =+RC[-2]/RC[-4]-1 -> 0.3250205736602132 | CA42: 2779 | CB42: 3085 | CC42: =+RC[-1]/RC[-2]-1 -> 0.11011155091759628 | CD42: 2288766 | CE42: 2512023 | CF42: 2659272 | CG42: =+RC[-1]/RC[-2]-1 -> 5.8617695777467116E-2 | CH42: =+RC[-2]/RC[-4]-1 -> 0.16188024463837714 | CI42: 1726 | CJ42: 1491 | CK42: =+RC[-1]/RC[-2]-1 -> -0.13615295480880651 | CL42: 1644584 | CM42: 0 | CN42: 1343018 | CO42: =+RC[-1]/RC[-2]-1 -> #DIV/0! | CP42: =+RC[-2]/RC[-4]-1 -> -0.18336916813005599 | CQ42: 1171 | CR42: 1134 | CS42: =+RC[-1]/RC[-2]-1 -> -3.1596925704525991E-2 | CT42: 2932643 | CU42: 3068091 | CV42: 3182297 | CW42: =+RC[-1]/RC[-2]-1 -> 3.722379812072063E-2 | CX42: =+RC[-2]/RC[-4]-1 -> 8.5129352601049701E-2 | CY42: 1173 | CZ42: 1312 | DA42: =+RC[-1]/RC[-2]-1 -> 0.1184995737425405 | DB42: 0 | DC42: 0 | DD42: 0 | DE42: =+RC[-1]/RC[-2]-1 -> #DIV/0! | DF42: =+RC[-2]/RC[-4]-1 -> #DIV/0! | DG42: 0 | DH42: 0 | DI42: =+RC[-1]/RC[-2]-1 -> #DIV/0! | DJ42: 0 | DK42: 0 | DL42: 0 | DM42: =+RC[-1]/RC[-2]-1 -> #DIV/0! | DN42: =+RC[-2]/RC[-4]-1 -> #DIV/0! | DO42: 0 | DP42: 0 | DQ42: =+RC[-1]/RC[-2]-1 -> #DIV/0! | DR42: 1892800 | DS42: 0 | DT42: 1263348 | DU42: =+RC[-1]/RC[-2]-1 -> #DIV/0! | DV42: =+RC[-2]/RC[-4]-1 -> -0.33255071851225693 | DW42: 1465 | DX42: 1879 | DY42: =+RC[-1]/RC[-2]-1 -> 0.28259385665529013 | DZ42: 1690471 | EA42: 0 | EB42: 1539126 | EC42: =+RC[-1]/RC[-2]-1 -> #DIV/0! | ED42: =+RC[-2]/RC[-4]-1 -> -8.9528303058733383E-2 | EE42: 1025 | EF42: 1099 | EG42: =+RC[-1]/RC[-2]-1 -> 7.2195121951219576E-2 | EH42: 3854936 | EI42: 3840908 | EJ42: 3829148 | EK42: =+RC[-1]/RC[-2]-1 -> -3.0617760175458697E-3 | EL42: =+RC[-2]/RC[-4]-1 -> -6.6896052230179803E-3 | EM42: 2589 | EN42: 3133 | EO42: =+RC[-1]/RC[-2]-1 -> 0.2101197373503283 | EP42: 2867382 | EQ42: 3103364 | ER42: 5395196 | ES42: =+RC[-1]/RC[-2]-1 -> 0.7384992543575295 | ET42: =+RC[-2]/RC[-4]-1 -> 0.88157559753112769 | EU42: 2395 | EV42: 1681 | EW42: =+RC[-1]/RC[-2]-1 -> -0.29812108559498951 | EX42: 450563 | EY42: 351746 | EZ42: 207664 | FA42: =+RC[-1]/RC[-2]-1 -> -0.40961944130139361 | FB42: =+RC[-2]/RC[-4]-1 -> -0.53910108020410019 | FC42: 257 | FD42: 457 | FE42: =+RC[-1]/RC[-2]-1 -> 0.77821011673151741 | FF42: 3077106 | FG42: 2800000 | FH42: 3305559 | FI42: =+RC[-1]/RC[-2]-1 -> 0.18055678571428579 | FJ42: =+RC[-2]/RC[-4]-1 -> 7.4242811264870312E-2 | FK42: 2014 | FL42: 2004 | FM42: =+RC[-1]/RC[-2]-1 -> -4.9652432969214955E-3 | FN42: 640370 | FO42: 550000 | FP42: 263413 | FQ42: =+RC[-1]/RC[-2]-1 -> -0.52106727272727271 | FR42: =+RC[-2]/RC[-4]-1 -> -0.58865499633024654 | FS42: 456 | FT42: 704 | FU42: =+RC[-1]/RC[-2]-1 -> 0.54385964912280693 | FV42: 4469455 | FW42: 5500000 | FX42: 6935601 | FY42: =+RC[-1]/RC[-2]-1 -> 0.26101836363636366 | FZ42: =+RC[-2]/RC[-4]-1 -> 0.55177778946202616 | GA42: 2201 | GB42: 1982 | GC42: =+RC[-1]/RC[-2]-1 -> -9.950022716946838E-2 | GD42: 0 | GE42: 160000 | GF42: 0 | GG42: =+RC[-1]/RC[-2]-1 -> -1 | GH42: =+RC[-2]/RC[-4]-1 -> #DIV/0! | GI42: 0 | GJ42: 0 | GK42: =+RC[-1]/RC[-2]-1 -> #DIV/0! | GL42: 4005243 | GM42: 5133270 | GN42: 3619500 | GO42: =+RC[-1]/RC[-2]-1 -> -0.29489389804159927 | GP42: =+RC[-2]/RC[-4]-1 -> -9.6309512306743894E-2 | GQ42: 2783 | GR42: 2560 | GS42: =+RC[-1]/RC[-2]-1 -> -8.0129356809198748E-2 | GT42: 966960 | GU42: 1100000 | GV42: 911429 | GW42: =+RC[-1]/RC[-2]-1 -> -0.17142818181818187 | GX42: =+RC[-2]/RC[-4]-1 -> -5.7428435509224829E-2 | GY42: 803 | GZ42: 1038 | HA42: =+RC[-1]/RC[-2]-1 -> 0.29265255292652559 | HB42: 2535681 | HC42: 2642914 | HD42: 2035833 | HE42: =+RC[-1]/RC[-2]-1 -> -0.22970138264052486 | HF42: =+RC[-2]/RC[-4]-1 -> -0.19712574255200077 | HG42: 1036 | HH42: 1321 | HI42: =+RC[-1]/RC[-2]-1 -> 0.27509652509652516 | HJ42: 2061651 | HK42: 0 | HL42: 1744866 | HM42: =+RC[-1]/RC[-2]-1 -> #DIV/0! | HN42: =+RC[-2]/RC[-4]-1 -> -0.15365597766062244 | HO42: 1294 | HP42: 1431 | HQ42: =+RC[-1]/RC[-2]-1 -> 0.10587326120556417 | HR42: 1341857 | HS42: 1889521 | HT42: 2092639 | HU42: =+RC[-1]/RC[-2]-1 -> 0.1074970852401218 | HV42: =+RC[-2]/RC[-4]-1 -> 0.55950969440111731 | HW42: 1710 | HX42: 1390 | HY42: =+RC[-1]/RC[-2]-1 -> -0.1871345029239766 | HZ42: 2156477 | IA42: 2429472 | IB42: 2625587 | IC42: =+RC[-1]/RC[-2]-1 -> 8.0723301194662866E-2 | ID42: =+RC[-2]/RC[-4]-1 -> 0.21753535975574967 | IE42: 1503 | IF42: 1391 | IG42: =+RC[-1]/RC[-2]-1 -> -7.4517631403858919E-2 | IH42: 862144 | II42: 1161545 | IJ42: 1133817 | IK42: =+RC[-1]/RC[-2]-1 -> -2.3871653702611573E-2 | IL42: =+RC[-2]/RC[-4]-1 -> 0.31511325254249867 | IM42: 788 | IN42: 753 | IO42: =+RC[-1]/RC[-2]-1 -> -4.4416243654822329E-2
A43: 07.02.2016 | B43: 85155712 | C43: 64194969 | D43: 77596056 | E43: =+RC[-1]/RC[-2]-1 -> 0.20875603195633596 | F43: =+RC[-2]/RC[-4]-1 -> -8.8774502877740025E-2 | G43: 44612 | H43: 47762 | I43: =+RC[-1]/RC[-2]-1 -> 7.060880480588172E-2 | J43: 0 | K43: 1195556 | L43: 1001685 | M43: =+RC[-1]/RC[-2]-1 -> -0.16215969808189667 | N43: =+RC[-2]/RC[-4]-1 -> #DIV/0! | O43: 1058 | P43: 0 | Q43: =+RC[-1]/RC[-2]-1 -> -1 | R43: 457368 | S43: 543972 | T43: 625360 | U43: =+RC[-1]/RC[-2]-1 -> 0.14961799504386253 | V43: =+RC[-2]/RC[-4]-1 -> 0.36730160396004963 | W43: 617 | X43: 484 | Y43: =+RC[-1]/RC[-2]-1 -> -0.21555915721231766 | Z43: 1733285 | AA43: 840000 | AB43: 783550 | AC43: =+RC[-1]/RC[-2]-1 -> -6.7202380952380958E-2 | AD43: =+RC[-2]/RC[-4]-1 -> -0.54793931753866221 | AE43: 381 | AF43: 793 | AG43: =+RC[-1]/RC[-2]-1 -> 1.0813648293963256 | AH43: 2473422 | AI43: 3106496 | AJ43: 3686435 | AK43: =+RC[-1]/RC[-2]-1 -> 0.18668589948288994 | AL43: =+RC[-2]/RC[-4]-1 -> 0.49041894185464519 | AM43: 3356 | AN43: 2191 | AO43: =+RC[-1]/RC[-2]-1 -> -0.34713945172824789 | AP43: 13015966 | AQ43: 8220598 | AR43: 10682615 | AS43: =+RC[-1]/RC[-2]-1 -> 0.29949366213990758 | AT43: =+RC[-2]/RC[-4]-1 -> -0.17926836932425916 | AU43: 5613 | AV43: 7006 | AW43: =+RC[-1]/RC[-2]-1 -> 0.24817388205950475 | AX43: 6136444 | AY43: 5360624 | AZ43: 6011942 | BA43: =+RC[-1]/RC[-2]-1 -> 0.12150040741525614 | BB43: =+RC[-2]/RC[-4]-1 -> -2.0288949104725784E-2 | BC43: 3302 | BD43: 3033 | BE43: =+RC[-1]/RC[-2]-1 -> -8.1465778316171966E-2 | BF43: 1330618 | BG43: 1265156 | BH43: 1263167 | BI43: =+RC[-1]/RC[-2]-1 -> -1.5721381394863121E-3 | BJ43: =+RC[-2]/RC[-4]-1 -> -5.069148320554806E-2 | BK43: 849 | BL43: 1012 | BM43: =+RC[-1]/RC[-2]-1 -> 0.19199057714958778 | BN43: 1345039 | BO43: 0 | BP43: 877637 | BQ43: =+RC[-1]/RC[-2]-1 -> #DIV/0! | BR43: =+RC[-2]/RC[-4]-1 -> -0.34750070444054038 | BS43: 1699 | BT43: 1674 | BU43: =+RC[-1]/RC[-2]-1 -> -1.4714537963507968E-2 | BV43: 11265764 | BW43: 10238536 | BX43: 11178569 | BY43: =+RC[-1]/RC[-2]-1 -> 9.1813224078129974E-2 | BZ43: =+RC[-2]/RC[-4]-1 -> -7.7398212850899872E-3 | CA43: 2665 | CB43: 2802 | CC43: =+RC[-1]/RC[-2]-1 -> 5.1407129455909972E-2 | CD43: 2355958 | CE43: 2407355 | CF43: 2577514 | CG43: =+RC[-1]/RC[-2]-1 -> 7.0682969483104818E-2 | CH43: =+RC[-2]/RC[-4]-1 -> 9.4040725683564919E-2 | CI43: 1614 | CJ43: 1551 | CK43: =+RC[-1]/RC[-2]-1 -> -3.9033457249070591E-2 | CL43: 1733240 | CM43: 0 | CN43: 1206113 | CO43: =+RC[-1]/RC[-2]-1 -> #DIV/0! | CP43: =+RC[-2]/RC[-4]-1 -> -0.30412810689806369 | CQ43: 1062 | CR43: 1162 | CS43: =+RC[-1]/RC[-2]-1 -> 9.4161958568738324E-2 | CT43: 3701117 | CU43: 2950088 | CV43: 2839712 | CW43: =+RC[-1]/RC[-2]-1 -> -3.7414477127461931E-2 | CX43: =+RC[-2]/RC[-4]-1 -> -0.2327418992698691 | CY43: 1109 | CZ43: 1199 | DA43: =+RC[-1]/RC[-2]-1 -> 8.1154192966636618E-2 | DB43: 0 | DC43: 0 | DD43: 0 | DE43: =+RC[-1]/RC[-2]-1 -> #DIV/0! | DF43: =+RC[-2]/RC[-4]-1 -> #DIV/0! | DG43: 0 | DH43: 0 | DI43: =+RC[-1]/RC[-2]-1 -> #DIV/0! | DJ43: 0 | DK43: 0 | DL43: 0 | DM43: =+RC[-1]/RC[-2]-1 -> #DIV/0! | DN43: =+RC[-2]/RC[-4]-1 -> #DIV/0! | DO43: 0 | DP43: 0 | DQ43: =+RC[-1]/RC[-2]-1 -> #DIV/0! | DR43: 2429625 | DS43: 0 | DT43: 982785 | DU43: =+RC[-1]/RC[-2]-1 -> #DIV/0! | DV43: =+RC[-2]/RC[-4]-1 -> -0.59549930544837171 | DW43: 1281 | DX43: 2104 | DY43: =+RC[-1]/RC[-2]-1 -> 0.64246682279469169 | DZ43: 1931702 | EA43: 0 | EB43: 1456452 | EC43: =+RC[-1]/RC[-2]-1 -> #DIV/0! | ED43: =+RC[-2]/RC[-4]-1 -> -0.24602656103270593 | EE43: 893 | EF43: 1130 | EG43: =+RC[-1]/RC[-2]-1 -> 0.26539753639417696 | EH43: 3545804 | EI43: 3401947 | EJ43: 3108306 | EK43: =+RC[-1]/RC[-2]-1 -> -8.6315571641768618E-2 | EL43: =+RC[-2]/RC[-4]-1 -> -0.12338471049161204 | EM43: 2276 | EN43: 2537 | EO43: =+RC[-1]/RC[-2]-1 -> 0.11467486818980666 | EP43: 3860485 | EQ43: 3179056 | ER43: 5241324 | ES43: =+RC[-1]/RC[-2]-1 -> 0.64870452109053756 | ET43: =+RC[-2]/RC[-4]-1 -> 0.35768536854825239 | EU43: 2414 | EV43: 1890 | EW43: =+RC[-1]/RC[-2]-1 -> -0.21706710853355426 | EX43: 470542 | EY43: 310364 | EZ43: 158490 | FA43: =+RC[-1]/RC[-2]-1 -> -0.48934154734440849 | FB43: =+RC[-2]/RC[-4]-1 -> -0.66317565700830106 | FC43: 242 | FD43: 478 | FE43: =+RC[-1]/RC[-2]-1 -> 0.97520661157024802 | FF43: 3101217 | FG43: 2550000 | FH43: 2696908 | FI43: =+RC[-1]/RC[-2]-1 -> 5.7610980392156952E-2 | FJ43: =+RC[-2]/RC[-4]-1 -> -0.13037107690303518 | FK43: 1693 | FL43: 1855 | FM43: =+RC[-1]/RC[-2]-1 -> 9.5688127584170113E-2 | FN43: 790283 | FO43: 550000 | FP43: 292823 | FQ43: =+RC[-1]/RC[-2]-1 -> -0.46759454545454548 | FR43: =+RC[-2]/RC[-4]-1 -> -0.62947070859426302 | FS43: 451 | FT43: 837 | FU43: =+RC[-1]/RC[-2]-1 -> 0.85587583148558766 | FV43: 5720552 | FW43: 4800000 | FX43: 6730109 | FY43: =+RC[-1]/RC[-2]-1 -> 0.40210604166666664 | FZ43: =+RC[-2]/RC[-4]-1 -> 0.17647894818541987 | GA43: 2293 | GB43: 2004 | GC43: =+RC[-1]/RC[-2]-1 -> -0.12603576101177494 | GD43: 0 | GE43: 190000 | GF43: 0 | GG43: =+RC[-1]/RC[-2]-1 -> -1 | GH43: =+RC[-2]/RC[-4]-1 -> #DIV/0! | GI43: 0 | GJ43: 0 | GK43: =+RC[-1]/RC[-2]-1 -> #DIV/0! | GL43: 6339143 | GM43: 4676979 | GN43: 4367164 | GO43: =+RC[-1]/RC[-2]-1 -> -6.6242546737969143E-2 | GP43: =+RC[-2]/RC[-4]-1 -> -0.31107974689954143 | GQ43: 3115 | GR43: 4601 | GS43: =+RC[-1]/RC[-2]-1 -> 0.47704654895666132 | GT43: 1076157 | GU43: 1100000 | GV43: 917545 | GW43: =+RC[-1]/RC[-2]-1 -> -0.16586818181818186 | GX43: =+RC[-2]/RC[-4]-1 -> -0.14738741652008025 | GY43: 741 | GZ43: 998 | HA43: =+RC[-1]/RC[-2]-1 -> 0.34682860998650478 | HB43: 2976371 | HC43: 2139501 | HD43: 1675486 | HE43: =+RC[-1]/RC[-2]-1 -> -0.21688001080625807 | HF43: =+RC[-2]/RC[-4]-1 -> -0.43707084903058124 | HG43: 911 | HH43: 1337 | HI43: =+RC[-1]/RC[-2]-1 -> 0.46761800219538974 | HJ43: 2218047 | HK43: 0 | HL43: 1861631 | HM43: =+RC[-1]/RC[-2]-1 -> #DIV/0! | HN43: =+RC[-2]/RC[-4]-1 -> -0.1606891107357058 | HO43: 1352 | HP43: 1351 | HQ43: =+RC[-1]/RC[-2]-1 -> -7.3964497041423272E-4 | HR43: 1771148 | HS43: 1784547 | HT43: 2114284 | HU43: =+RC[-1]/RC[-2]-1 -> 0.18477350274327331 | HV43: =+RC[-2]/RC[-4]-1 -> 0.19373649181209029 | HW43: 1642 | HX43: 1662 | HY43: =+RC[-1]/RC[-2]-1 -> 1.2180267965895331E-2 | HZ43: 2343368 | IA43: 2328244 | IB43: 2299405 | IC43: =+RC[-1]/RC[-2]-1 -> -1.2386588347269467E-2 | ID43: =+RC[-2]/RC[-4]-1 -> -1.876060439504168E-2 | IE43: 1321 | IF43: 1322 | IG43: =+RC[-1]/RC[-2]-1 -> 7.570022710068347E-4 | IH43: 1033047 | II43: 1055950 | IJ43: 959045 | IK43: =+RC[-1]/RC[-2]-1 -> -9.1770443676310376E-2 | IL43: =+RC[-2]/RC[-4]-1 -> -7.1634688450767481E-2 | IM43: 662 | IN43: 749 | IO43: =+RC[-1]/RC[-2]-1 -> 0.13141993957703924
A44: 08.02.2016 | B44: 76151047 | C44: 55262122 | D44: 62966136 | E44: =+RC[-1]/RC[-2]-1 -> 0.13940858079970209 | F44: =+RC[-2]/RC[-4]-1 -> -0.17314155903857764 | G44: 41194 | H44: 45342 | I44: =+RC[-1]/RC[-2]-1 -> 0.10069427586541724 | J44: 0 | K44: 717333 | L44: 631211 | M44: =+RC[-1]/RC[-2]-1 -> -0.12005860597518869 | N44: =+RC[-2]/RC[-4]-1 -> #DIV/0! | O44: 788 | P44: 0 | Q44: =+RC[-1]/RC[-2]-1 -> -1 | R44: 369581 | S44: 642876 | T44: 585038 | U44: =+RC[-1]/RC[-2]-1 -> -8.9967583173115817E-2 | V44: =+RC[-2]/RC[-4]-1 -> 0.58297639759619679 | W44: 697 | X44: 404 | Y44: =+RC[-1]/RC[-2]-1 -> -0.4203730272596844 | Z44: 1706087 | AA44: 780000 | AB44: 783745 | AC44: =+RC[-1]/RC[-2]-1 -> 4.801282051281941E-3 | AD44: =+RC[-2]/RC[-4]-1 -> -0.54061838581502586 | AE44: 557 | AF44: 741 | AG44: =+RC[-1]/RC[-2]-1 -> 0.33034111310592462 | AH44: 2263963 | AI44: 2192821 | AJ44: 2500771 | AK44: =+RC[-1]/RC[-2]-1 -> 0.14043553942615472 | AL44: =+RC[-2]/RC[-4]-1 -> 0.10459888257891148 | AM44: 2685 | AN44: 2344 | AO44: =+RC[-1]/RC[-2]-1 -> -0.12700186219739296 | AP44: 11996100 | AQ44: 6057283 | AR44: 7359949 | AS44: =+RC[-1]/RC[-2]-1 -> 0.21505780727101564 | AT44: =+RC[-2]/RC[-4]-1 -> -0.38647151991063766 | AU44: 3981 | AV44: 6976 | AW44: =+RC[-1]/RC[-2]-1 -> 0.75232353679979913 | AX44: 5486518 | AY44: 4502924 | AZ44: 4598672 | BA44: =+RC[-1]/RC[-2]-1 -> 2.1263516772657143E-2 | BB44: =+RC[-2]/RC[-4]-1 -> -0.16182321829619439 | BC44: 2588 | BD44: 2993 | BE44: =+RC[-1]/RC[-2]-1 -> 0.1564914992272024 | BF44: 1335040 | BG44: 1437677 | BH44: 1445953 | BI44: =+RC[-1]/RC[-2]-1 -> 5.7565085898987345E-3 | BJ44: =+RC[-2]/RC[-4]-1 -> 8.3078409635666262E-2 | BK44: 1380 | BL44: 958 | BM44: =+RC[-1]/RC[-2]-1 -> -0.30579710144927541 | BN44: 1265853 | BO44: 0 | BP44: 695935 | BQ44: =+RC[-1]/RC[-2]-1 -> #DIV/0! | BR44: =+RC[-2]/RC[-4]-1 -> -0.45022447314182612 | BS44: 1190 | BT44: 1711 | BU44: =+RC[-1]/RC[-2]-1 -> 0.43781512605042017 | BV44: 10182361 | BW44: 10238536 | BX44: 9760983 | BY44: =+RC[-1]/RC[-2]-1 -> -4.6642703605281111E-2 | BZ44: =+RC[-2]/RC[-4]-1 -> -4.1383133047433684E-2 | CA44: 3015 | CB44: 2579 | CC44: =+RC[-1]/RC[-2]-1 -> -0.14461028192371472 | CD44: 2266642 | CE44: 2302688 | CF44: 2380591 | CG44: =+RC[-1]/RC[-2]-1 -> 3.3831331035728773E-2 | CH44: =+RC[-2]/RC[-4]-1 -> 5.0272164726498536E-2 | CI44: 1737 | CJ44: 1411 | CK44: =+RC[-1]/RC[-2]-1 -> -0.18767990788716182 | CL44: 1632284 | CM44: 0 | CN44: 849327 | CO44: =+RC[-1]/RC[-2]-1 -> #DIV/0! | CP44: =+RC[-2]/RC[-4]-1 -> -0.47966959181122892 | CQ44: 873 | CR44: 1196 | CS44: =+RC[-1]/RC[-2]-1 -> 0.36998854524627722 | CT44: 3226287 | CU44: 2478074 | CV44: 2323839 | CW44: =+RC[-1]/RC[-2]-1 -> -6.2239868543070176E-2 | CX44: =+RC[-2]/RC[-4]-1 -> -0.27971721052714782 | CY44: 1167 | CZ44: 1114 | DA44: =+RC[-1]/RC[-2]-1 -> -4.5415595544130216E-2 | DB44: 0 | DC44: 0 | DD44: 0 | DE44: =+RC[-1]/RC[-2]-1 -> #DIV/0! | DF44: =+RC[-2]/RC[-4]-1 -> #DIV/0! | DG44: 0 | DH44: 0 | DI44: =+RC[-1]/RC[-2]-1 -> #DIV/0! | DJ44: 0 | DK44: 0 | DL44: 0 | DM44: =+RC[-1]/RC[-2]-1 -> #DIV/0! | DN44: =+RC[-2]/RC[-4]-1 -> #DIV/0! | DO44: 0 | DP44: 0 | DQ44: =+RC[-1]/RC[-2]-1 -> #DIV/0! | DR44: 2605806 | DS44: 0 | DT44: 665532 | DU44: =+RC[-1]/RC[-2]-1 -> #DIV/0! | DV44: =+RC[-2]/RC[-4]-1 -> -0.74459648953145396 | DW44: 877 | DX44: 2665 | DY44: =+RC[-1]/RC[-2]-1 -> 2.0387685290763966 | DZ44: 1546323 | EA44: 0 | EB44: 1457505 | EC44: =+RC[-1]/RC[-2]-1 -> #DIV/0! | ED44: =+RC[-2]/RC[-4]-1 -> -5.7438193702092022E-2 | EE44: 1035 | EF44: 1035 | EG44: =+RC[-1]/RC[-2]-1 -> 0 | EH44: 3127256 | EI44: 3731168 | EJ44: 3506001 | EK44: =+RC[-1]/RC[-2]-1 -> -6.0347590888429559E-2 | EL44: =+RC[-2]/RC[-4]-1 -> 0.12111096757029172 | EM44: 2998 | EN44: 2155 | EO44: =+RC[-1]/RC[-2]-1 -> -0.28118745830553704 | EP44: 3492022 | EQ44: 2422138 | ER44: 3796403 | ES44: =+RC[-1]/RC[-2]-1 -> 0.56737683814877604 | ET44: =+RC[-2]/RC[-4]-1 -> 8.7164685674947062E-2 | EU44: 1967 | EV44: 1779 | EW44: =+RC[-1]/RC[-2]-1 -> -9.557702084392472E-2 | EX44: 403401 | EY44: 316158 | EZ44: 194648 | FA44: =+RC[-1]/RC[-2]-1 -> -0.38433314988075584 | FB44: =+RC[-2]/RC[-4]-1 -> -0.51748260415814529 | FC44: 281 | FD44: 438 | FE44: =+RC[-1]/RC[-2]-1 -> 0.5587188612099645 | FF44: 2804406 | FG44: 2550000 | FH44: 2731405 | FI44: =+RC[-1]/RC[-2]-1 -> 7.113921568627446E-2 | FJ44: =+RC[-2]/RC[-4]-1 -> -2.6030824352822002E-2 | FK44: 1908 | FL44: 1774 | FM44: =+RC[-1]/RC[-2]-1 -> -7.023060796645697E-2 | FN44: 775390 | FO44: 450000 | FP44: 220215 | FQ44: =+RC[-1]/RC[-2]-1 -> -0.51063333333333327 | FR44: =+RC[-2]/RC[-4]-1 -> -0.71599453178400552 | FS44: 345 | FT44: 874 | FU44: =+RC[-1]/RC[-2]-1 -> 1.5333333333333332 | FV44: 5240867 | FW44: 3500000 | FX44: 4094429 | FY44: =+RC[-1]/RC[-2]-1 -> 0.16983685714285723 | FZ44: =+RC[-2]/RC[-4]-1 -> -0.21874968397404471 | GA44: 1805 | GB44: 2160 | GC44: =+RC[-1]/RC[-2]-1 -> 0.19667590027700821 | GD44: 0 | GE44: 144000 | GF44: 0 | GG44: =+RC[-1]/RC[-2]-1 -> -1 | GH44: =+RC[-2]/RC[-4]-1 -> #DIV/0! | GI44: 0 | GJ44: 0 | GK44: =+RC[-1]/RC[-2]-1 -> #DIV/0! | GL44: 4637359 | GM44: 3194035 | GN44: 3420276 | GO44: =+RC[-1]/RC[-2]-1 -> 7.0832348424485048E-2 | GP44: =+RC[-2]/RC[-4]-1 -> -0.26245175325007186 | GQ44: 2296 | GR44: 3225 | GS44: =+RC[-1]/RC[-2]-1 -> 0.40461672473867605 | GT44: 949218 | GU44: 850000 | GV44: 702588 | GW44: =+RC[-1]/RC[-2]-1 -> -0.17342588235294121 | GX44: =+RC[-2]/RC[-4]-1 -> -0.25982440282421948 | GY44: 830 | GZ44: 918 | HA44: =+RC[-1]/RC[-2]-1 -> 0.10602409638554211 | HB44: 2263300 | HC44: 2139501 | HD44: 1750587 | HE44: =+RC[-1]/RC[-2]-1 -> -0.18177790054783804 | HF44: =+RC[-2]/RC[-4]-1 -> -0.22653338046215699 | HG44: 1016 | HH44: 1168 | HI44: =+RC[-1]/RC[-2]-1 -> 0.14960629921259838 | HJ44: 1845917 | HK44: 0 | HL44: 1747655 | HM44: =+RC[-1]/RC[-2]-1 -> #DIV/0! | HN44: =+RC[-2]/RC[-4]-1 -> -5.3232079232164775E-2 | HO44: 1365 | HP44: 1298 | HQ44: =+RC[-1]/RC[-2]-1 -> -4.9084249084249132E-2 | HR44: 1719880 | HS44: 1336311 | HT44: 1260221 | HU44: =+RC[-1]/RC[-2]-1 -> -5.6940337990183387E-2 | HV44: =+RC[-2]/RC[-4]-1 -> -0.26726225085471078 | HW44: 1331 | HX44: 1611 | HY44: =+RC[-1]/RC[-2]-1 -> 0.21036814425244188 | HZ44: 2032344 | IA44: 2328244 | IB44: 2524656 | IC44: =+RC[-1]/RC[-2]-1 -> 8.4360573891739898E-2 | ID44: =+RC[-2]/RC[-4]-1 -> 0.24223851867597213 | IE44: 1671 | IF44: 1150 | IG44: =+RC[-1]/RC[-2]-1 -> -0.31178934769599043 | IH44: 976842 | II44: 950355 | IJ44: 978001 | IK44: =+RC[-1]/RC[-2]-1 -> 2.9090182089850591E-2 | IL44: =+RC[-2]/RC[-4]-1 -> 1.1864764209565948E-3 | IM44: 811 | IN44: 665 | IO44: =+RC[-1]/RC[-2]-1 -> -0.18002466091245373
A45: 09.02.2016 | B45: 61353876 | C45: 54043084 | D45: 59966810 | E45: =+RC[-1]/RC[-2]-1 -> 0.10961117614975491 | F45: =+RC[-2]/RC[-4]-1 -> -2.2607634438613133E-2 | G45: 39746 | H45: 41172 | I45: =+RC[-1]/RC[-2]-1 -> 3.5877824183565554E-2 | J45: 0 | K45: 777111 | L45: 680187 | M45: =+RC[-1]/RC[-2]-1 -> -0.1247234950991557 | N45: =+RC[-2]/RC[-4]-1 -> #DIV/0! | O45: 799 | P45: 0 | Q45: =+RC[-1]/RC[-2]-1 -> -1 | R45: 448175 | S45: 642876 | T45: 626285 | U45: =+RC[-1]/RC[-2]-1 -> -2.5807465203242952E-2 | V45: =+RC[-2]/RC[-4]-1 -> 0.39741172533050695 | W45: 696 | X45: 538 | Y45: =+RC[-1]/RC[-2]-1 -> -0.22701149425287359 | Z45: 1205464 | AA45: 780000 | AB45: 634415 | AC45: =+RC[-1]/RC[-2]-1 -> -0.18664743589743593 | AD45: =+RC[-2]/RC[-4]-1 -> -0.47371717446560002 | AE45: 528 | AF45: 784 | AG45: =+RC[-1]/RC[-2]-1 -> 0.48484848484848486 | AH45: 1232158 | AI45: 2101453 | AJ45: 2436195 | AK45: =+RC[-1]/RC[-2]-1 -> 0.1592907383605533 | AL45: =+RC[-2]/RC[-4]-1 -> 0.97717743990624584 | AM45: 2584 | AN45: 1528 | AO45: =+RC[-1]/RC[-2]-1 -> -0.40866873065015474 | AP45: 7367021 | AQ45: 5840951 | AR45: 7174937 | AS45: =+RC[-1]/RC[-2]-1 -> 0.22838506948611625 | AT45: =+RC[-2]/RC[-4]-1 -> -2.6073497007813584E-2 | AU45: 3779 | AV45: 4560 | AW45: =+RC[-1]/RC[-2]-1 -> 0.20666843080179942 | AX45: 4059743 | AY45: 4610136 | AZ45: 4745957 | BA45: =+RC[-1]/RC[-2]-1 -> 2.9461386822427826E-2 | BB45: =+RC[-2]/RC[-4]-1 -> 0.16902892621528021 | BC45: 2812 | BD45: 2328 | BE45: =+RC[-1]/RC[-2]-1 -> -0.17211948790896159 | BF45: 1435720 | BG45: 1437677 | BH45: 1379638 | BI45: =+RC[-1]/RC[-2]-1 -> -4.0369985747841786E-2 | BJ45: =+RC[-2]/RC[-4]-1 -> -3.9061934081854432E-2 | BK45: 1196 | BL45: 1466 | BM45: =+RC[-1]/RC[-2]-1 -> 0.22575250836120397 | BN45: 925571 | BO45: 0 | BP45: 723379 | BQ45: =+RC[-1]/RC[-2]-1 -> #DIV/0! | BR45: =+RC[-2]/RC[-4]-1 -> -0.21845109667437723 | BS45: 1307 | BT45: 1330 | BU45: =+RC[-1]/RC[-2]-1 -> 1.7597551644988441E-2 | BV45: 8809666 | BW45: 9317068 | BX45: 8889384 | BY45: =+RC[-1]/RC[-2]-1 -> -4.590328201962246E-2 | BZ45: =+RC[-2]/RC[-4]-1 -> 9.0489242157421046E-3 | CA45: 2676 | CB45: 2975 | CC45: =+RC[-1]/RC[-2]-1 -> 0.11173393124065778 | CD45: 2018501 | CE45: 2302688 | CF45: 2104637 | CG45: =+RC[-1]/RC[-2]-1 -> -8.600861254325376E-2 | CH45: =+RC[-2]/RC[-4]-1 -> 4.2673251090784792E-2 | CI45: 1639 | CJ45: 1498 | CK45: =+RC[-1]/RC[-2]-1 -> -8.6028065893837713E-2 | CL45: 1374485 | CM45: 0 | CN45: 683293 | CO45: =+RC[-1]/RC[-2]-1 -> #DIV/0! | CP45: =+RC[-2]/RC[-4]-1 -> -0.50287343987020594 | CQ45: 774 | CR45: 1151 | CS45: =+RC[-1]/RC[-2]-1 -> 0.48708010335917318 | CT45: 2522731 | CU45: 2596077 | CV45: 2068386 | CW45: =+RC[-1]/RC[-2]-1 -> -0.20326477219281247 | CX45: =+RC[-2]/RC[-4]-1 -> -0.18010045462635538 | CY45: 1083 | CZ45: 1233 | DA45: =+RC[-1]/RC[-2]-1 -> 0.13850415512465375 | DB45: 0 | DC45: 0 | DD45: 0 | DE45: =+RC[-1]/RC[-2]-1 -> #DIV/0! | DF45: =+RC[-2]/RC[-4]-1 -> #DIV/0! | DG45: 0 | DH45: 0 | DI45: =+RC[-1]/RC[-2]-1 -> #DIV/0! | DJ45: 0 | DK45: 0 | DL45: 0 | DM45: =+RC[-1]/RC[-2]-1 -> #DIV/0! | DN45: =+RC[-2]/RC[-4]-1 -> #DIV/0! | DO45: 0 | DP45: 0 | DQ45: =+RC[-1]/RC[-2]-1 -> #DIV/0! | DR45: 1700622 | DS45: 0 | DT45: 840941 | DU45: =+RC[-1]/RC[-2]-1 -> #DIV/0! | DV45: =+RC[-2]/RC[-4]-1 -> -0.50550974878603239 | DW45: 870 | DX45: 1819 | DY45: =+RC[-1]/RC[-2]-1 -> 1.0908045977011493 | DZ45: 1452829 | EA45: 0 | EB45: 1279166 | EC45: =+RC[-1]/RC[-2]-1 -> #DIV/0! | ED45: =+RC[-2]/RC[-4]-1 -> -0.11953437052812133 | EE45: 935 | EF45: 1102 | EG45: =+RC[-1]/RC[-2]-1 -> 0.17860962566844929 | EH45: 3518857 | EI45: 3731168 | EJ45: 3444076 | EK45: =+RC[-1]/RC[-2]-1 -> -7.6944270534052617E-2 | EL45: =+RC[-2]/RC[-4]-1 -> -2.1251502973834935E-2 | EM45: 3046 | EN45: 3188 | EO45: =+RC[-1]/RC[-2]-1 -> 4.6618516086671002E-2 | EP45: 2673541 | EQ45: 2497829 | ER45: 3509082 | ES45: =+RC[-1]/RC[-2]-1 -> 0.40485277414907106 | ET45: =+RC[-2]/RC[-4]-1 -> 0.31252223175182281 | EU45: 1953 | EV45: 1589 | EW45: =+RC[-1]/RC[-2]-1 -> -0.18637992831541217 | EX45: 363250 | EY45: 306226 | EZ45: 134953 | FA45: =+RC[-1]/RC[-2]-1 -> -0.55930260657161712 | FB45: =+RC[-2]/RC[-4]-1 -> -0.62848451479697176 | FC45: 246 | FD45: 408 | FE45: =+RC[-1]/RC[-2]-1 -> 0.65853658536585358 | FF45: 2892366 | FG45: 2550000 | FH45: 2600328 | FI45: =+RC[-1]/RC[-2]-1 -> 1.9736470588235244E-2 | FJ45: =+RC[-2]/RC[-4]-1 -> -0.10096854962338786 | FK45: 1822 | FL45: 1875 | FM45: =+RC[-1]/RC[-2]-1 -> 2.9088913282107498E-2 | FN45: 547959 | FO45: 450000 | FP45: 217578 | FQ45: =+RC[-1]/RC[-2]-1 -> -0.51649333333333336 | FR45: =+RC[-2]/RC[-4]-1 -> -0.60293014623356855 | FS45: 356 | FT45: 622 | FU45: =+RC[-1]/RC[-2]-1 -> 0.74719101123595499 | FV45: 3586985 | FW45: 3600000 | FX45: 4549550 | FY45: =+RC[-1]/RC[-2]-1 -> 0.26376388888888891 | FZ45: =+RC[-2]/RC[-4]-1 -> 0.26834932401445788 | GA45: 1966 | GB45: 1632 | GC45: =+RC[-1]/RC[-2]-1 -> -0.16988809766022384 | GD45: 0 | GE45: 0 | GF45: 0 | GG45: =+RC[-1]/RC[-2]-1 -> #DIV/0! | GH45: =+RC[-2]/RC[-4]-1 -> #DIV/0! | GI45: 0 | GJ45: 0 | GK45: =+RC[-1]/RC[-2]-1 -> #DIV/0! | GL45: 3878961 | GM45: 3194035 | GN45: 2889288 | GO45: =+RC[-1]/RC[-2]-1 -> -9.5411290107966895E-2 | GP45: =+RC[-2]/RC[-4]-1 -> -0.2551386827555111 | GQ45: 2007 | GR45: 2437 | GS45: =+RC[-1]/RC[-2]-1 -> 0.21425012456402581 | GT45: 922739 | GU45: 850000 | GV45: 707912 | GW45: =+RC[-1]/RC[-2]-1 -> -0.16716235294117643 | GX45: =+RC[-2]/RC[-4]-1 -> -0.23281447950070389 | GY45: 867 | GZ45: 920 | HA45: =+RC[-1]/RC[-2]-1 -> 6.1130334486735771E-2 | HB45: 2465962 | HC45: 2139501 | HD45: 1680890 | HE45: =+RC[-1]/RC[-2]-1 -> -0.21435418819621954 | HF45: =+RC[-2]/RC[-4]-1 -> -0.31836338110644036 | HG45: 1001 | HH45: 1321 | HI45: =+RC[-1]/RC[-2]-1 -> 0.31968031968031974 | HJ45: 1858963 | HK45: 0 | HL45: 1537313 | HM45: =+RC[-1]/RC[-2]-1 -> #DIV/0! | HN45: =+RC[-2]/RC[-4]-1 -> -0.17302657449341385 | HO45: 1305 | HP45: 1361 | HQ45: =+RC[-1]/RC[-2]-1 -> 4.2911877394635978E-2 | HR45: 1194237 | HS45: 1189348 | HT45: 1418287 | HU45: =+RC[-1]/RC[-2]-1 -> 0.19249118004150167 | HV45: =+RC[-2]/RC[-4]-1 -> 0.18760932712686018 | HW45: 1293 | HX45: 1364 | HY45: =+RC[-1]/RC[-2]-1 -> 5.491105955143083E-2 | HZ45: 2060372 | IA45: 2125788 | IB45: 2109083 | IC45: =+RC[-1]/RC[-2]-1 -> -7.8582624419744063E-3 | ID45: =+RC[-2]/RC[-4]-1 -> 2.3641847200408517E-2 | IE45: 1462 | IF45: 1409 | IG45: =+RC[-1]/RC[-2]-1 -> -3.6251709986320102E-2 | IH45: 836998 | II45: 1003152 | IJ45: 901670 | IK45: =+RC[-1]/RC[-2]-1 -> -0.10116313380225528 | IL45: =+RC[-2]/RC[-4]-1 -> 7.7266612345549213E-2 | IM45: 744 | IN45: 734 | IO45: =+RC[-1]/RC[-2]-1 -> -1.3440860215053752E-2
A46: 10.02.2016 | B46: 61722056 | C46: 54919566 | D46: 61591410 | E46: =+RC[-1]/RC[-2]-1 -> 0.12148391704333572 | F46: =+RC[-2]/RC[-4]-1 -> -2.1166825680596357E-3 | G46: 39621 | H46: 42142 | I46: =+RC[-1]/RC[-2]-1 -> 6.3627874107165416E-2 | J46: 0 | K46: 836889 | L46: 629320 | M46: =+RC[-1]/RC[-2]-1 -> -0.24802452893991911 | N46: =+RC[-2]/RC[-4]-1 -> #DIV/0! | O46: 734 | P46: 0 | Q46: =+RC[-1]/RC[-2]-1 -> -1 | R46: 508791 | S46: 642876 | T46: 621036 | U46: =+RC[-1]/RC[-2]-1 -> -3.3972336811453507E-2 | V46: =+RC[-2]/RC[-4]-1 -> 0.22061121364175085 | W46: 684 | X46: 553 | Y46: =+RC[-1]/RC[-2]-1 -> -0.19152046783625731 | Z46: 1562959 | AA46: 876000 | AB46: 570364 | AC46: =+RC[-1]/RC[-2]-1 -> -0.34889954337899542 | AD46: =+RC[-2]/RC[-4]-1 -> -0.63507424059108397 | AE46: 417 | AF46: 812 | AG46: =+RC[-1]/RC[-2]-1 -> 0.9472422062350121 | AH46: 1452527 | AI46: 2147137 | AJ46: 2503389 | AK46: =+RC[-1]/RC[-2]-1 -> 0.16591954775126139 | AL46: =+RC[-2]/RC[-4]-1 -> 0.72347157746465296 | AM46: 2480 | AN46: 1590 | AO46: =+RC[-1]/RC[-2]-1 -> -0.3588709677419355 | AP46: 7489617 | AQ46: 6057283 | AR46: 7222399 | AS46: =+RC[-1]/RC[-2]-1 -> 0.1923496062508554 | AT46: =+RC[-2]/RC[-4]-1 -> -3.5678459926589023E-2 | AU46: 3730 | AV46: 4800 | AW46: =+RC[-1]/RC[-2]-1 -> 0.28686327077747986 | AX46: 4051108 | AY46: 4610136 | AZ46: 4637111 | BA46: =+RC[-1]/RC[-2]-1 -> 5.8512373604595602E-3 | BB46: =+RC[-2]/RC[-4]-1 -> 0.14465252469201029 | BC46: 2489 | BD46: 2522 | BE46: =+RC[-1]/RC[-2]-1 -> 1.3258336681398086E-2 | BF46: 1432537 | BG46: 1437677 | BH46: 1261341 | BI46: =+RC[-1]/RC[-2]-1 -> -0.12265341937027585 | BJ46: =+RC[-2]/RC[-4]-1 -> -0.11950546478031632 | BK46: 1171 | BL46: 1362 | BM46: =+RC[-1]/RC[-2]-1 -> 0.16310845431255339 | BN46: 914262 | BO46: 0 | BP46: 694123 | BQ46: =+RC[-1]/RC[-2]-1 -> #DIV/0! | BR46: =+RC[-2]/RC[-4]-1 -> -0.24078327656623588 | BS46: 1209 | BT46: 1399 | BU46: =+RC[-1]/RC[-2]-1 -> 0.15715467328370547 | BV46: 8507195 | BW46: 9317068 | BX46: 9352015 | BY46: =+RC[-1]/RC[-2]-1 -> 3.7508581025704757E-3 | BZ46: =+RC[-2]/RC[-4]-1 -> 9.9306528179970099E-2 | CA46: 2767 | CB46: 2993 | CC46: =+RC[-1]/RC[-2]-1 -> 8.1676906396819682E-2 | CD46: 2217404 | CE46: 2302688 | CF46: 2292124 | CG46: =+RC[-1]/RC[-2]-1 -> -4.5876818744007286E-3 | CH46: =+RC[-2]/RC[-4]-1 -> 3.3697061969762743E-2 | CI46: 1650 | CJ46: 1520 | CK46: =+RC[-1]/RC[-2]-1 -> -7.878787878787874E-2 | CL46: 1186006 | CM46: 0 | CN46: 884869 | CO46: =+RC[-1]/RC[-2]-1 -> #DIV/0! | CP46: =+RC[-2]/RC[-4]-1 -> -0.25390849624706791 | CQ46: 833 | CR46: 1046 | CS46: =+RC[-1]/RC[-2]-1 -> 0.25570228091236502 | CT46: 2860261 | CU46: 2596077 | CV46: 1980714 | CW46: =+RC[-1]/RC[-2]-1 -> -0.2370357273686412 | CX46: =+RC[-2]/RC[-4]-1 -> -0.30750585348679715 | CY46: 1064 | CZ46: 1319 | DA46: =+RC[-1]/RC[-2]-1 -> 0.23966165413533824 | DB46: 0 | DC46: 0 | DD46: 0 | DE46: =+RC[-1]/RC[-2]-1 -> #DIV/0! | DF46: =+RC[-2]/RC[-4]-1 -> #DIV/0! | DG46: 0 | DH46: 0 | DI46: =+RC[-1]/RC[-2]-1 -> #DIV/0! | DJ46: 0 | DK46: 0 | DL46: 0 | DM46: =+RC[-1]/RC[-2]-1 -> #DIV/0! | DN46: =+RC[-2]/RC[-4]-1 -> #DIV/0! | DO46: 0 | DP46: 0 | DQ46: =+RC[-1]/RC[-2]-1 -> #DIV/0! | DR46: 1474456 | DS46: 0 | DT46: 597637 | DU46: =+RC[-1]/RC[-2]-1 -> #DIV/0! | DV46: =+RC[-2]/RC[-4]-1 -> -0.59467288274455121 | DW46: 785 | DX46: 1815 | DY46: =+RC[-1]/RC[-2]-1 -> 1.3121019108280256 | DZ46: 1498564 | EA46: 0 | EB46: 1374028 | EC46: =+RC[-1]/RC[-2]-1 -> #DIV/0! | ED46: =+RC[-2]/RC[-4]-1 -> -8.3103557806006312E-2 | EE46: 981 | EF46: 1126 | EG46: =+RC[-1]/RC[-2]-1 -> 0.14780835881753318 | EH46: 3353055 | EI46: 3731168 | EJ46: 3374244 | EK46: =+RC[-1]/RC[-2]-1 -> -9.5660125730066325E-2 | EL46: =+RC[-2]/RC[-4]-1 -> 6.3193117917839103E-3 | EM46: 2952 | EN46: 3156 | EO46: =+RC[-1]/RC[-2]-1 -> 6.9105691056910556E-2 | EP46: 2567724 | EQ46: 2497829 | ER46: 3533733 | ES46: =+RC[-1]/RC[-2]-1 -> 0.41472174436280462 | ET46: =+RC[-2]/RC[-4]-1 -> 0.37621216298948013 | EU46: 2089 | EV46: 1626 | EW46: =+RC[-1]/RC[-2]-1 -> -0.22163714696026804 | EX46: 354635 | EY46: 306226 | EZ46: 143643 | FA46: =+RC[-1]/RC[-2]-1 -> -0.53092487247980258 | FB46: =+RC[-2]/RC[-4]-1 -> -0.59495537665487053 | FC46: 221 | FD46: 411 | FE46: =+RC[-1]/RC[-2]-1 -> 0.85972850678733037 | FF46: 2793685 | FG46: 2550000 | FH46: 2954672 | FI46: =+RC[-1]/RC[-2]-1 -> 0.1586949019607844 | FJ46: =+RC[-2]/RC[-4]-1 -> 5.7625322826302838E-2 | FK46: 1905 | FL46: 1962 | FM46: =+RC[-1]/RC[-2]-1 -> 2.9921259842519587E-2 | FN46: 573072 | FO46: 450000 | FP46: 270851 | FQ46: =+RC[-1]/RC[-2]-1 -> -0.39810888888888885 | FR46: =+RC[-2]/RC[-4]-1 -> -0.52737003378284053 | FS46: 424 | FT46: 668 | FU46: =+RC[-1]/RC[-2]-1 -> 0.57547169811320753 | FV46: 3801653 | FW46: 3600000 | FX46: 4652030 | FY46: =+RC[-1]/RC[-2]-1 -> 0.29223055555555555 | FZ46: =+RC[-2]/RC[-4]-1 -> 0.22368611759147927 | GA46: 2128 | GB46: 1706 | GC46: =+RC[-1]/RC[-2]-1 -> -0.19830827067669177 | GD46: 0 | GE46: 200000 | GF46: 0 | GG46: =+RC[-1]/RC[-2]-1 -> -1 | GH46: =+RC[-2]/RC[-4]-1 -> #DIV/0! | GI46: 0 | GJ46: 0 | GK46: =+RC[-1]/RC[-2]-1 -> #DIV/0! | GL46: 3941566 | GM46: 3194035 | GN46: 2763298 | GO46: =+RC[-1]/RC[-2]-1 -> -0.13485669380579735 | GP46: =+RC[-2]/RC[-4]-1 -> -0.29893397700304902 | GQ46: 1940 | GR46: 2553 | GS46: =+RC[-1]/RC[-2]-1 -> 0.31597938144329896 | GT46: 955744 | GU46: 850000 | GV46: 977986 | GW46: =+RC[-1]/RC[-2]-1 -> 0.1505717647058824 | GX46: =+RC[-2]/RC[-4]-1 -> 2.3271922188368377E-2 | GY46: 876 | GZ46: 946 | HA46: =+RC[-1]/RC[-2]-1 -> 7.9908675799086781E-2 | HB46: 2227945 | HC46: 2139501 | HD46: 1658525 | HE46: =+RC[-1]/RC[-2]-1 -> -0.22480756026755766 | HF46: =+RC[-2]/RC[-4]-1 -> -0.25558081550487111 | HG46: 979 | HH46: 1291 | HI46: =+RC[-1]/RC[-2]-1 -> 0.31869254341164455 | HJ46: 1802744 | HK46: 0 | HL46: 1887664 | HM46: =+RC[-1]/RC[-2]-1 -> #DIV/0! | HN46: =+RC[-2]/RC[-4]-1 -> 4.7105967347554678E-2 | HO46: 1424 | HP46: 1404 | HQ46: =+RC[-1]/RC[-2]-1 -> -1.4044943820224698E-2 | HR46: 1367588 | HS46: 1346808 | HT46: 1439059 | HU46: =+RC[-1]/RC[-2]-1 -> 6.8496029129616165E-2 | HV46: =+RC[-2]/RC[-4]-1 -> 5.22606223511759E-2 | HW46: 1305 | HX46: 1426 | HY46: =+RC[-1]/RC[-2]-1 -> 9.27203065134099E-2 | HZ46: 1843256 | IA46: 2227016 | IB46: 2304571 | IC46: =+RC[-1]/RC[-2]-1 -> 3.482462631611094E-2 | ID46: =+RC[-2]/RC[-4]-1 -> 0.25027180163797103 | IE46: 1602 | IF46: 1339 | IG46: =+RC[-1]/RC[-2]-1 -> -0.16416978776529334 | IH46: 983702 | II46: 1003152 | IJ46: 1010664 | IK46: =+RC[-1]/RC[-2]-1 -> 7.4883965739986902E-3 | IL46: =+RC[-2]/RC[-4]-1 -> 2.7408707108453667E-2 | IM46: 782 | IN46: 797 | IO46: =+RC[-1]/RC[-2]-1 -> 1.9181585677749302E-2
A47: 11.02.2016 | B47: 61417123 | C47: 54983563 | D47: 64739321 | E47: =+RC[-1]/RC[-2]-1 -> 0.17743044407653241 | F47: =+RC[-2]/RC[-4]-1 -> 5.4092374206456961E-2 | G47: 40796 | H47: 42556 | I47: =+RC[-1]/RC[-2]-1 -> 4.3141484459260804E-2 | J47: 0 | K47: 836889 | L47: 706399 | M47: =+RC[-1]/RC[-2]-1 -> -0.15592270898530147 | N47: =+RC[-2]/RC[-4]-1 -> #DIV/0! | O47: 766 | P47: 0 | Q47: =+RC[-1]/RC[-2]-1 -> -1 | R47: 442094 | S47: 642876 | T47: 657241 | U47: =+RC[-1]/RC[-2]-1 -> 2.2344900105152554E-2 | V47: =+RC[-2]/RC[-4]-1 -> 0.48665442191027242 | W47: 682 | X47: 540 | Y47: =+RC[-1]/RC[-2]-1 -> -0.2082111436950147 | Z47: 1505283 | AA47: 876000 | AB47: 689439 | AC47: =+RC[-1]/RC[-2]-1 -> -0.21296917808219173 | AD47: =+RC[-2]/RC[-4]-1 -> -0.54198712135857507 | AE47: 471 | AF47: 818 | AG47: =+RC[-1]/RC[-2]-1 -> 0.73673036093418265 | AH47: 1463243 | AI47: 2147137 | AJ47: 2377904 | AK47: =+RC[-1]/RC[-2]-1 -> 0.10747660722161645 | AL47: =+RC[-2]/RC[-4]-1 -> 0.62509166283385609 | AM47: 2493 | AN47: 1578 | AO47: =+RC[-1]/RC[-2]-1 -> -0.36702767749699161 | AP47: 8021413 | AQ47: 6057283 | AR47: 8031070 | AS47: =+RC[-1]/RC[-2]-1 -> 0.32585352211544349 | AT47: =+RC[-2]/RC[-4]-1 -> 1.2039026041921197E-3 | AU47: 4039 | AV47: 4710 | AW47: =+RC[-1]/RC[-2]-1 -> 0.16613023025501361 | AX47: 4116575 | AY47: 4717349 | AZ47: 4402921 | BA47: =+RC[-1]/RC[-2]-1 -> -6.6653537823892162E-2 | BB47: =+RC[-2]/RC[-4]-1 -> 6.9559281684409946E-2 | BC47: 2642 | BD47: 2727 | BE47: =+RC[-1]/RC[-2]-1 -> 3.2172596517789476E-2 | BF47: 1419114 | BG47: 1437677 | BH47: 1588514 | BI47: =+RC[-1]/RC[-2]-1 -> 0.10491716845995303 | BJ47: =+RC[-2]/RC[-4]-1 -> 0.11937025496189868 | BK47: 1346 | BL47: 1479 | BM47: =+RC[-1]/RC[-2]-1 -> 9.8811292719167998E-2 | BN47: 982707 | BO47: 0 | BP47: 769894 | BQ47: =+RC[-1]/RC[-2]-1 -> #DIV/0! | BR47: =+RC[-2]/RC[-4]-1 -> -0.21655793639406251 | BS47: 1311 | BT47: 1450 | BU47: =+RC[-1]/RC[-2]-1 -> 0.10602593440122043 | BV47: 8520508 | BW47: 9317068 | BX47: 10137887 | BY47: =+RC[-1]/RC[-2]-1 -> 8.8098423237868317E-2 | BZ47: =+RC[-2]/RC[-4]-1 -> 0.18982189794317428 | CA47: 2903 | CB47: 3149 | CC47: =+RC[-1]/RC[-2]-1 -> 8.4739924216328033E-2 | CD47: 1975779 | CE47: 2302688 | CF47: 2247566 | CG47: =+RC[-1]/RC[-2]-1 -> -2.3938110590753015E-2 | CH47: =+RC[-2]/RC[-4]-1 -> 0.13755941327446042 | CI47: 1596 | CJ47: 1482 | CK47: =+RC[-1]/RC[-2]-1 -> -7.1428571428571397E-2 | CL47: 1368322 | CM47: 0 | CN47: 873086 | CO47: =+RC[-1]/RC[-2]-1 -> #DIV/0! | CP47: =+RC[-2]/RC[-4]-1 -> -0.36192942889173751 | CQ47: 845 | CR47: 1162 | CS47: =+RC[-1]/RC[-2]-1 -> 0.37514792899408289 | CT47: 2705233 | CU47: 2596077 | CV47: 2070616 | CW47: =+RC[-1]/RC[-2]-1 -> -0.20240578380379315 | CX47: =+RC[-2]/RC[-4]-1 -> -0.23458866574524262 | CY47: 1077 | CZ47: 1298 | DA47: =+RC[-1]/RC[-2]-1 -> 0.20519962859795737 | DB47: 0 | DC47: 0 | DD47: 0 | DE47: =+RC[-1]/RC[-2]-1 -> #DIV/0! | DF47: =+RC[-2]/RC[-4]-1 -> #DIV/0! | DG47: 0 | DH47: 0 | DI47: =+RC[-1]/RC[-2]-1 -> #DIV/0! | DJ47: 0 | DK47: 0 | DL47: 0 | DM47: =+RC[-1]/RC[-2]-1 -> #DIV/0! | DN47: =+RC[-2]/RC[-4]-1 -> #DIV/0! | DO47: 0 | DP47: 0 | DQ47: =+RC[-1]/RC[-2]-1 -> #DIV/0! | DR47: 1676732 | DS47: 0 | DT47: 684257 | DU47: =+RC[-1]/RC[-2]-1 -> #DIV/0! | DV47: =+RC[-2]/RC[-4]-1 -> -0.59191033510423852 | DW47: 979 | DX47: 1730 | DY47: =+RC[-1]/RC[-2]-1 -> 0.76710929519918292 | DZ47: 1570362 | EA47: 0 | EB47: 1332264 | EC47: =+RC[-1]/RC[-2]-1 -> #DIV/0! | ED47: =+RC[-2]/RC[-4]-1 -> -0.15161981759619758 | EE47: 983 | EF47: 1151 | EG47: =+RC[-1]/RC[-2]-1 -> 0.1709053916581893 | EH47: 3392862 | EI47: 3731168 | EJ47: 3844366 | EK47: =+RC[-1]/RC[-2]-1 -> 3.0338489180867789E-2 | EL47: =+RC[-2]/RC[-4]-1 -> 0.13307467265099504 | EM47: 3266 | EN47: 3197 | EO47: =+RC[-1]/RC[-2]-1 -> -2.1126760563380254E-2 | EP47: 2654527 | EQ47: 2573521 | ER47: 3794520 | ES47: =+RC[-1]/RC[-2]-1 -> 0.47444687647779049 | ET47: =+RC[-2]/RC[-4]-1 -> 0.42945240338485924 | EU47: 2018 | EV47: 1730 | EW47: =+RC[-1]/RC[-2]-1 -> -0.14271555996035679 | EX47: 376198 | EY47: 306226 | EZ47: 132805 | FA47: =+RC[-1]/RC[-2]-1 -> -0.56631703382469156 | FB47: =+RC[-2]/RC[-4]-1 -> -0.64698111101069111 | FC47: 215 | FD47: 411 | FE47: =+RC[-1]/RC[-2]-1 -> 0.91162790697674412 | FF47: 2389305 | FG47: 2550000 | FH47: 2568264 | FI47: =+RC[-1]/RC[-2]-1 -> 7.1623529411763975E-3 | FJ47: =+RC[-2]/RC[-4]-1 -> 7.4900023228511969E-2 | FK47: 1751 | FL47: 1765 | FM47: =+RC[-1]/RC[-2]-1 -> 7.9954311821817114E-3 | FN47: 563400 | FO47: 450000 | FP47: 219848 | FQ47: =+RC[-1]/RC[-2]-1 -> -0.51144888888888884 | FR47: =+RC[-2]/RC[-4]-1 -> -0.60978345757898467 | FS47: 374 | FT47: 684 | FU47: =+RC[-1]/RC[-2]-1 -> 0.82887700534759357 | FV47: 3758567 | FW47: 3600000 | FX47: 4879514 | FY47: =+RC[-1]/RC[-2]-1 -> 0.35542055555555563 | FZ47: =+RC[-2]/RC[-4]-1 -> 0.29823786565464983 | GA47: 1922 | GB47: 1673 | GC47: =+RC[-1]/RC[-2]-1 -> -0.12955254942767946 | GD47: 0 | GE47: 90000 | GF47: 0 | GG47: =+RC[-1]/RC[-2]-1 -> -1 | GH47: =+RC[-2]/RC[-4]-1 -> #DIV/0! | GI47: 0 | GJ47: 0 | GK47: =+RC[-1]/RC[-2]-1 -> #DIV/0! | GL47: 3226682 | GM47: 3194035 | GN47: 3497002 | GO47: =+RC[-1]/RC[-2]-1 -> 9.485400128677357E-2 | GP47: =+RC[-2]/RC[-4]-1 -> 8.3776461392848667E-2 | GQ47: 2134 | GR47: 2316 | GS47: =+RC[-1]/RC[-2]-1 -> 8.528584817244611E-2 | GT47: 845056 | GU47: 850000 | GV47: 723866 | GW47: =+RC[-1]/RC[-2]-1 -> -0.14839294117647062 | GX47: =+RC[-2]/RC[-4]-1 -> -0.14341061420781587 | GY47: 864 | GZ47: 1026 | HA47: =+RC[-1]/RC[-2]-1 -> 0.1875 | HB47: 2369919 | HC47: 2202428 | HD47: 1890965 | HE47: =+RC[-1]/RC[-2]-1 -> -0.14141801684322941 | HF47: =+RC[-2]/RC[-4]-1 -> -0.20209720247822816 | HG47: 1025 | HH47: 1415 | HI47: =+RC[-1]/RC[-2]-1 -> 0.38048780487804867 | HJ47: 1822779 | HK47: 0 | HL47: 1873855 | HM47: =+RC[-1]/RC[-2]-1 -> #DIV/0! | HN47: =+RC[-2]/RC[-4]-1 -> 2.8020950427890545E-2 | HO47: 1415 | HP47: 1350 | HQ47: =+RC[-1]/RC[-2]-1 -> -4.5936395759717308E-2 | HR47: 1272219 | HS47: 1376201 | HT47: 1470861 | HU47: =+RC[-1]/RC[-2]-1 -> 6.8783557053075928E-2 | HV47: =+RC[-2]/RC[-4]-1 -> 0.1561382120531134 | HW47: 1380 | HX47: 1423 | HY47: =+RC[-1]/RC[-2]-1 -> 3.1159420289855078E-2 | HZ47: 2033323 | IA47: 2125788 | IB47: 2233241 | IC47: =+RC[-1]/RC[-2]-1 -> 5.0547373491618197E-2 | ID47: =+RC[-2]/RC[-4]-1 -> 9.8320827532074384E-2 | IE47: 1481 | IF47: 1470 | IG47: =+RC[-1]/RC[-2]-1 -> -7.4274139095206193E-3 | IH47: 944921 | II47: 1003152 | IJ47: 1041156 | IK47: =+RC[-1]/RC[-2]-1 -> 3.7884587779319689E-2 | IL47: =+RC[-2]/RC[-4]-1 -> 0.1018444928200346 | IM47: 818 | IN47: 822 | IO47: =+RC[-1]/RC[-2]-1 -> 4.8899755501221609E-3
A48: 12.02.2016 | B48: 62037831 | C48: 58929301 | D48: 68659562 | E48: =+RC[-1]/RC[-2]-1 -> 0.16511753635088944 | F48: =+RC[-2]/RC[-4]-1 -> 0.10673698440553148 | G48: 41530 | H48: 42500 | I48: =+RC[-1]/RC[-2]-1 -> 2.3356609679749507E-2 | J48: 0 | K48: 956444 | L48: 713811 | M48: =+RC[-1]/RC[-2]-1 -> -0.25368239018698424 | N48: =+RC[-2]/RC[-4]-1 -> #DIV/0! | O48: 881 | P48: 0 | Q48: =+RC[-1]/RC[-2]-1 -> -1 | R48: 424239 | S48: 642876 | T48: 635640 | U48: =+RC[-1]/RC[-2]-1 -> -1.1255669833684867E-2 | V48: =+RC[-2]/RC[-4]-1 -> 0.49830637918720333 | W48: 659 | X48: 509 | Y48: =+RC[-1]/RC[-2]-1 -> -0.22761760242792106 | Z48: 1372148 | AA48: 960000 | AB48: 858571 | AC48: =+RC[-1]/RC[-2]-1 -> -0.10565520833333331 | AD48: =+RC[-2]/RC[-4]-1 -> -0.37428688450517 | AE48: 490 | AF48: 775 | AG48: =+RC[-1]/RC[-2]-1 -> 0.58163265306122458 | AH48: 1529178 | AI48: 2375556 | AJ48: 2578930 | AK48: =+RC[-1]/RC[-2]-1 -> 8.561111588192416E-2 | AL48: =+RC[-2]/RC[-4]-1 -> 0.68648123370856751 | AM48: 2676 | AN48: 1714 | AO48: =+RC[-1]/RC[-2]-1 -> -0.35949177877428995 | AP48: 7560213 | AQ48: 6922609 | AR48: 8852679 | AS48: =+RC[-1]/RC[-2]-1 -> 0.27880673312619564 | AT48: =+RC[-2]/RC[-4]-1 -> 0.17095629448535377 | AU48: 4131 | AV48: 4792 | AW48: =+RC[-1]/RC[-2]-1 -> 0.16000968288549977 | AX48: 4149333 | AY48: 4717349 | AZ48: 5267995 | BA48: =+RC[-1]/RC[-2]-1 -> 0.11672784862854124 | BB48: =+RC[-2]/RC[-4]-1 -> 0.26960043939592215 | BC48: 2804 | BD48: 2594 | BE48: =+RC[-1]/RC[-2]-1 -> -7.4893009985734671E-2 | BF48: 1424527 | BG48: 1426176 | BH48: 1460090 | BI48: =+RC[-1]/RC[-2]-1 -> 2.3779673756955555E-2 | BJ48: =+RC[-2]/RC[-4]-1 -> 2.4964777782379599E-2 | BK48: 1233 | BL48: 1519 | BM48: =+RC[-1]/RC[-2]-1 -> 0.23195458231954591 | BN48: 1081640 | BO48: 0 | BP48: 882662 | BQ48: =+RC[-1]/RC[-2]-1 -> #DIV/0! | BR48: =+RC[-2]/RC[-4]-1 -> -0.18395954291631222 | BS48: 1379 | BT48: 1529 | BU48: =+RC[-1]/RC[-2]-1 -> 0.10877447425670783 | BV48: 8846924 | BW48: 9726609 | BX48: 10643402 | BY48: =+RC[-1]/RC[-2]-1 -> 9.4256179106202431E-2 | BZ48: =+RC[-2]/RC[-4]-1 -> 0.20306244294627152 | CA48: 2950 | CB48: 2889 | CC48: =+RC[-1]/RC[-2]-1 -> -2.0677966101694922E-2 | CD48: 1912315 | CE48: 2302688 | CF48: 2480360 | CG48: =+RC[-1]/RC[-2]-1 -> 7.7158520824358368E-2 | CH48: =+RC[-2]/RC[-4]-1 -> 0.29704572729911138 | CI48: 1683 | CJ48: 1422 | CK48: =+RC[-1]/RC[-2]-1 -> -0.15508021390374327 | CL48: 1381593 | CM48: 0 | CN48: 727079 | CO48: =+RC[-1]/RC[-2]-1 -> #DIV/0! | CP48: =+RC[-2]/RC[-4]-1 -> -0.47373864806784627 | CQ48: 769 | CR48: 1165 | CS48: =+RC[-1]/RC[-2]-1 -> 0.51495448634590368 | CT48: 2816316 | CU48: 2832084 | CV48: 2223402 | CW48: =+RC[-1]/RC[-2]-1 -> -0.2149237098899609 | CX48: =+RC[-2]/RC[-4]-1 -> -0.21052822197509091 | CY48: 1109 | CZ48: 1256 | DA48: =+RC[-1]/RC[-2]-1 -> 0.13255184851217305 | DB48: 0 | DC48: 0 | DD48: 0 | DE48: =+RC[-1]/RC[-2]-1 -> #DIV/0! | DF48: =+RC[-2]/RC[-4]-1 -> #DIV/0! | DG48: 0 | DH48: 0 | DI48: =+RC[-1]/RC[-2]-1 -> #DIV/0! | DJ48: 0 | DK48: 0 | DL48: 0 | DM48: =+RC[-1]/RC[-2]-1 -> #DIV/0! | DN48: =+RC[-2]/RC[-4]-1 -> #DIV/0! | DO48: 0 | DP48: 0 | DQ48: =+RC[-1]/RC[-2]-1 -> #DIV/0! | DR48: 1618253 | DS48: 0 | DT48: 653382 | DU48: =+RC[-1]/RC[-2]-1 -> #DIV/0! | DV48: =+RC[-2]/RC[-4]-1 -> -0.59624236754079862 | DW48: 996 | DX48: 1745 | DY48: =+RC[-1]/RC[-2]-1 -> 0.75200803212851408 | DZ48: 1611141 | EA48: 0 | EB48: 1284299 | EC48: =+RC[-1]/RC[-2]-1 -> #DIV/0! | ED48: =+RC[-2]/RC[-4]-1 -> -0.20286368480474393 | EE48: 948 | EF48: 1157 | EG48: =+RC[-1]/RC[-2]-1 -> 0.22046413502109696 | EH48: 3214344 | EI48: 4060389 | EJ48: 3948952 | EK48: =+RC[-1]/RC[-2]-1 -> -2.744490737217542E-2 | EL48: =+RC[-2]/RC[-4]-1 -> 0.22854056690883118 | EM48: 3055 | EN48: 3140 | EO48: =+RC[-1]/RC[-2]-1 -> 2.7823240589198051E-2 | EP48: 2666107 | EQ48: 2649213 | ER48: 3810767 | ES48: =+RC[-1]/RC[-2]-1 -> 0.43845247626370543 | ET48: =+RC[-2]/RC[-4]-1 -> 0.42933760723031744 | EU48: 2009 | EV48: 1737 | EW48: =+RC[-1]/RC[-2]-1 -> -0.13539074166251863 | EX48: 409524 | EY48: 351746 | EZ48: 184748 | FA48: =+RC[-1]/RC[-2]-1 -> -0.4747687251596322 | FB48: =+RC[-2]/RC[-4]-1 -> -0.54887137261796615 | FC48: 269 | FD48: 397 | FE48: =+RC[-1]/RC[-2]-1 -> 0.47583643122676578 | FF48: 2581782 | FG48: 2550000 | FH48: 2694568 | FI48: =+RC[-1]/RC[-2]-1 -> 5.6693333333333262E-2 | FJ48: =+RC[-2]/RC[-4]-1 -> 4.3685330519772858E-2 | FK48: 1783 | FL48: 1837 | FM48: =+RC[-1]/RC[-2]-1 -> 3.0286034772854631E-2 | FN48: 595264 | FO48: 450000 | FP48: 194133 | FQ48: =+RC[-1]/RC[-2]-1 -> -0.56859333333333328 | FR48: =+RC[-2]/RC[-4]-1 -> -0.67387075314482314 | FS48: 339 | FT48: 707 | FU48: =+RC[-1]/RC[-2]-1 -> 1.0855457227138645 | FV48: 4248561 | FW48: 3700000 | FX48: 5026134 | FY48: =+RC[-1]/RC[-2]-1 -> 0.35841459459459468 | FZ48: =+RC[-2]/RC[-4]-1 -> 0.1830203214688455 | GA48: 1960 | GB48: 1856 | GC48: =+RC[-1]/RC[-2]-1 -> -5.3061224489795888E-2 | GD48: 0 | GE48: 180000 | GF48: 0 | GG48: =+RC[-1]/RC[-2]-1 -> -1 | GH48: =+RC[-2]/RC[-4]-1 -> #DIV/0! | GI48: 0 | GJ48: 0 | GK48: =+RC[-1]/RC[-2]-1 -> #DIV/0! | GL48: 3413111 | GM48: 3992543 | GN48: 3616737 | GO48: =+RC[-1]/RC[-2]-1 -> -9.4126976215409552E-2 | GP48: =+RC[-2]/RC[-4]-1 -> 5.9659940740280692E-2 | GQ48: 2298 | GR48: 2445 | GS48: =+RC[-1]/RC[-2]-1 -> 6.3968668407310636E-2 | GT48: 903048 | GU48: 850000 | GV48: 822115 | GW48: =+RC[-1]/RC[-2]-1 -> -3.2805882352941129E-2 | GX48: =+RC[-2]/RC[-4]-1 -> -8.9622035595007143E-2 | GY48: 899 | GZ48: 991 | HA48: =+RC[-1]/RC[-2]-1 -> 0.1023359288097887 | HB48: 2265968 | HC48: 2328281 | HD48: 2026140 | HE48: =+RC[-1]/RC[-2]-1 -> -0.12976998910354898 | HF48: =+RC[-2]/RC[-4]-1 -> -0.1058390939324827 | HG48: 965 | HH48: 1272 | HI48: =+RC[-1]/RC[-2]-1 -> 0.31813471502590684 | HJ48: 1881191 | HK48: 0 | HL48: 2071277 | HM48: =+RC[-1]/RC[-2]-1 -> #DIV/0! | HN48: =+RC[-2]/RC[-4]-1 -> 0.10104556103021967 | HO48: 1487 | HP48: 1406 | HQ48: =+RC[-1]/RC[-2]-1 -> -5.4472091459314087E-2 | HR48: 1295031 | HS48: 1522114 | HT48: 1465146 | HU48: =+RC[-1]/RC[-2]-1 -> -3.7426894437604497E-2 | HV48: =+RC[-2]/RC[-4]-1 -> 0.13135978984286867 | HW48: 1416 | HX48: 1406 | HY48: =+RC[-1]/RC[-2]-1 -> -7.0621468926553854E-3 | HZ48: 1851438 | IA48: 2429472 | IB48: 2571722 | IC48: =+RC[-1]/RC[-2]-1 -> 5.855181702032386E-2 | ID48: =+RC[-2]/RC[-4]-1 -> 0.38904030272685342 | IE48: 1533 | IF48: 1390 | IG48: =+RC[-1]/RC[-2]-1 -> -9.3281148075668674E-2 | IH48: 984642 | II48: 1003152 | IJ48: 964821 | IK48: =+RC[-1]/RC[-2]-1 -> -3.8210560313890585E-2 | IL48: =+RC[-2]/RC[-4]-1 -> -2.0130158981640056E-2 | IM48: 809 | IN48: 850 | IO48: =+RC[-1]/RC[-2]-1 -> 5.0679851668726794E-2
A49: 13.02.2016 | B49: 71670171 | C49: 71734549 | D49: 84052433 | E49: =+RC[-1]/RC[-2]-1 -> 0.17171480369940006 | F49: =+RC[-2]/RC[-4]-1 -> 0.17276730091797887 | G49: 46636 | H49: 46016 | I49: =+RC[-1]/RC[-2]-1 -> -1.3294450638991373E-2 | J49: 0 | K49: 1315111 | L49: 1141181 | M49: =+RC[-1]/RC[-2]-1 -> -0.13225499596612 | N49: =+RC[-2]/RC[-4]-1 -> #DIV/0! | O49: 1165 | P49: 0 | Q49: =+RC[-1]/RC[-2]-1 -> -1 | R49: 483741 | S49: 642876 | T49: 734316 | U49: =+RC[-1]/RC[-2]-1 -> 0.14223582774905275 | V49: =+RC[-2]/RC[-4]-1 -> 0.51799413322418397 | W49: 697 | X49: 531 | Y49: =+RC[-1]/RC[-2]-1 -> -0.23816355810616929 | Z49: 1315273 | AA49: 1020000 | AB49: 855701 | AC49: =+RC[-1]/RC[-2]-1 -> -0.16107745098039217 | AD49: =+RC[-2]/RC[-4]-1 -> -0.34941187114766292 | AE49: 488 | AF49: 737 | AG49: =+RC[-1]/RC[-2]-1 -> 0.51024590163934436 | AH49: 1762948 | AI49: 3197863 | AJ49: 3581536 | AK49: =+RC[-1]/RC[-2]-1 -> 0.1199779352648942 | AL49: =+RC[-2]/RC[-4]-1 -> 1.0315607720704185 | AM49: 3112 | AN49: 1744 | AO49: =+RC[-1]/RC[-2]-1 -> -0.43958868894601544 | AP49: 9271729 | AQ49: 9085924 | AR49: 11220798 | AS49: =+RC[-1]/RC[-2]-1 -> 0.23496498539939359 | AT49: =+RC[-2]/RC[-4]-1 -> 0.21021634691868152 | AU49: 5102 | AV49: 5247 | AW49: =+RC[-1]/RC[-2]-1 -> 2.8420227361818817E-2 | AX49: 4762259 | AY49: 6432749 | AZ49: 6667425 | BA49: =+RC[-1]/RC[-2]-1 -> 3.6481448289059637E-2 | BB49: =+RC[-2]/RC[-4]-1 -> 0.40005509990111832 | BC49: 3340 | BD49: 2840 | BE49: =+RC[-1]/RC[-2]-1 -> -0.14970059880239517 | BF49: 1818439 | BG49: 1380170 | BH49: 1430553 | BI49: =+RC[-1]/RC[-2]-1 -> 3.6504923306549086E-2 | BJ49: =+RC[-2]/RC[-4]-1 -> -0.21330712770678584 | BK49: 1094 | BL49: 1595 | BM49: =+RC[-1]/RC[-2]-1 -> 0.4579524680073126 | BN49: 1297497 | BO49: 0 | BP49: 1253912 | BQ49: =+RC[-1]/RC[-2]-1 -> #DIV/0! | BR49: =+RC[-2]/RC[-4]-1 -> -3.3591599826435004E-2 | BS49: 1897 | BT49: 1643 | BU49: =+RC[-1]/RC[-2]-1 -> -0.1338956246705324 | BV49: 10269185 | BW49: 11262389 | BX49: 12905050 | BY49: =+RC[-1]/RC[-2]-1 -> 0.14585369054469699 | BZ49: =+RC[-2]/RC[-4]-1 -> 0.25667713650109536 | CA49: 2848 | CB49: 3293 | CC49: =+RC[-1]/RC[-2]-1 -> 0.15625 | CD49: 2231777 | CE49: 2512023 | CF49: 2802108 | CG49: =+RC[-1]/RC[-2]-1 -> 0.11547864012391607 | CH49: =+RC[-2]/RC[-4]-1 -> 0.25555017369566935 | CI49: 1683 | CJ49: 1566 | CK49: =+RC[-1]/RC[-2]-1 -> -6.9518716577540052E-2 | CL49: 1533574 | CM49: 0 | CN49: 1032049 | CO49: =+RC[-1]/RC[-2]-1 -> #DIV/0! | CP49: =+RC[-2]/RC[-4]-1 -> -0.32703019221765628 | CQ49: 943 | CR49: 1192 | CS49: =+RC[-1]/RC[-2]-1 -> 0.26405090137857901 | CT49: 3173878 | CU49: 3068091 | CV49: 2379284 | CW49: =+RC[-1]/RC[-2]-1 -> -0.22450670465771716 | CX49: =+RC[-2]/RC[-4]-1 -> -0.25035429843239088 | CY49: 1029 | CZ49: 1372 | DA49: =+RC[-1]/RC[-2]-1 -> 0.33333333333333326 | DB49: 0 | DC49: 0 | DD49: 0 | DE49: =+RC[-1]/RC[-2]-1 -> #DIV/0! | DF49: =+RC[-2]/RC[-4]-1 -> #DIV/0! | DG49: 0 | DH49: 0 | DI49: =+RC[-1]/RC[-2]-1 -> #DIV/0! | DJ49: 0 | DK49: 0 | DL49: 0 | DM49: =+RC[-1]/RC[-2]-1 -> #DIV/0! | DN49: =+RC[-2]/RC[-4]-1 -> #DIV/0! | DO49: 0 | DP49: 0 | DQ49: =+RC[-1]/RC[-2]-1 -> #DIV/0! | DR49: 1852623 | DS49: 0 | DT49: 905643 | DU49: =+RC[-1]/RC[-2]-1 -> #DIV/0! | DV49: =+RC[-2]/RC[-4]-1 -> -0.51115634427511702 | DW49: 1278 | DX49: 1900 | DY49: =+RC[-1]/RC[-2]-1 -> 0.48669796557120493 | DZ49: 1862244 | EA49: 0 | EB49: 1571182 | EC49: =+RC[-1]/RC[-2]-1 -> #DIV/0! | ED49: =+RC[-2]/RC[-4]-1 -> -0.15629638221414599 | EE49: 951 | EF49: 1335 | EG49: =+RC[-1]/RC[-2]-1 -> 0.40378548895899047 | EH49: 4119572 | EI49: 4060389 | EJ49: 4097564 | EK49: =+RC[-1]/RC[-2]-1 -> 9.1555267241636429E-3 | EL49: =+RC[-2]/RC[-4]-1 -> -5.3423025498765542E-3 | EM49: 2742 | EN49: 3374 | EO49: =+RC[-1]/RC[-2]-1 -> 0.23048869438366149 | EP49: 2969258 | EQ49: 3103364 | ER49: 5663147 | ES49: =+RC[-1]/RC[-2]-1 -> 0.82484136569219735 | ET49: =+RC[-2]/RC[-4]-1 -> 0.90725999559485904 | EU49: 2387 | EV49: 1751 | EW49: =+RC[-1]/RC[-2]-1 -> -0.26644323418516969 | EX49: 357070 | EY49: 351746 | EZ49: 155792 | FA49: =+RC[-1]/RC[-2]-1 -> -0.55708949071204783 | FB49: =+RC[-2]/RC[-4]-1 -> -0.56369339345226432 | FC49: 247 | FD49: 409 | FE49: =+RC[-1]/RC[-2]-1 -> 0.65587044534412953 | FF49: 2779927 | FG49: 2800000 | FH49: 2962522 | FI49: =+RC[-1]/RC[-2]-1 -> 5.8043571428571417E-2 | FJ49: =+RC[-2]/RC[-4]-1 -> 6.5683379455647506E-2 | FK49: 1873 | FL49: 1909 | FM49: =+RC[-1]/RC[-2]-1 -> 1.9220501868659978E-2 | FN49: 683123 | FO49: 450000 | FP49: 270503 | FQ49: =+RC[-1]/RC[-2]-1 -> -0.39888222222222225 | FR49: =+RC[-2]/RC[-4]-1 -> -0.6040200666644221 | FS49: 437 | FT49: 891 | FU49: =+RC[-1]/RC[-2]-1 -> 1.0389016018306636 | FV49: 4192767 | FW49: 5500000 | FX49: 6272983 | FY49: =+RC[-1]/RC[-2]-1 -> 0.14054236363636363 | FZ49: =+RC[-2]/RC[-4]-1 -> 0.49614395457701321 | GA49: 2157 | GB49: 2026 | GC49: =+RC[-1]/RC[-2]-1 -> -6.0732498840982863E-2 | GD49: 0 | GE49: 160000 | GF49: 0 | GG49: =+RC[-1]/RC[-2]-1 -> -1 | GH49: =+RC[-2]/RC[-4]-1 -> #DIV/0! | GI49: 0 | GJ49: 0 | GK49: =+RC[-1]/RC[-2]-1 -> #DIV/0! | GL49: 3903589 | GM49: 6273997 | GN49: 5611150 | GO49: =+RC[-1]/RC[-2]-1 -> -0.10564987519120583 | GP49: =+RC[-2]/RC[-4]-1 -> 0.43743360276914389 | GQ49: 4159 | GR49: 2555 | GS49: =+RC[-1]/RC[-2]-1 -> -0.38566963212310656 | GT49: 1086401 | GU49: 1100000 | GV49: 918665 | GW49: =+RC[-1]/RC[-2]-1 -> -0.16485000000000005 | GX49: =+RC[-2]/RC[-4]-1 -> -0.15439602872235947 | GY49: 878 | GZ49: 1017 | HA49: =+RC[-1]/RC[-2]-1 -> 0.15831435079726641 | HB49: 2752174 | HC49: 2642914 | HD49: 2247687 | HE49: =+RC[-1]/RC[-2]-1 -> -0.14954213417462692 | HF49: =+RC[-2]/RC[-4]-1 -> -0.18330490732054006 | HG49: 1080 | HH49: 1432 | HI49: =+RC[-1]/RC[-2]-1 -> 0.32592592592592595 | HJ49: 2199821 | HK49: 0 | HL49: 1988968 | HM49: =+RC[-1]/RC[-2]-1 -> #DIV/0! | HN49: =+RC[-2]/RC[-4]-1 -> -9.585007143763058E-2 | HO49: 1346 | HP49: 1508 | HQ49: =+RC[-1]/RC[-2]-1 -> 0.12035661218424965 | HR49: 1517993 | HS49: 1889521 | HT49: 1763899 | HU49: =+RC[-1]/RC[-2]-1 -> -6.6483516192728187E-2 | HV49: =+RC[-2]/RC[-4]-1 -> 0.16199415939335693 | HW49: 1581 | HX49: 1673 | HY49: =+RC[-1]/RC[-2]-1 -> 5.8191018342820922E-2 | HZ49: 2386735 | IA49: 2429472 | IB49: 2517541 | IC49: =+RC[-1]/RC[-2]-1 -> 3.6250263431724994E-2 | ID49: =+RC[-2]/RC[-4]-1 -> 5.4805414090797644E-2 | IE49: 1387 | IF49: 1631 | IG49: =+RC[-1]/RC[-2]-1 -> 0.17591925018024512 | IH49: 1086574 | II49: 1055950 | IJ49: 1101274 | IK49: =+RC[-1]/RC[-2]-1 -> 4.2922486860173414E-2 | IL49: =+RC[-2]/RC[-4]-1 -> 1.3528761041585735E-2 | IM49: 735 | IN49: 845 | IO49: =+RC[-1]/RC[-2]-1 -> 0.14965986394557818
A50: 14.02.2016 | B50: 87848659 | C50: 65171555 | D50: 79444178 | E50: =+RC[-1]/RC[-2]-1 -> 0.21900080487568552 | F50: =+RC[-2]/RC[-4]-1 -> -9.5669997649025063E-2 | G50: 49209 | H50: 52138 | I50: =+RC[-1]/RC[-2]-1 -> 5.9521632221748E-2 | J50: 0 | K50: 1315111 | L50: 1161746 | M50: =+RC[-1]/RC[-2]-1 -> -0.11661753266454311 | N50: =+RC[-2]/RC[-4]-1 -> #DIV/0! | O50: 1262 | P50: 0 | Q50: =+RC[-1]/RC[-2]-1 -> -1 | R50: 547137 | S50: 642876 | T50: 631449 | U50: =+RC[-1]/RC[-2]-1 -> -1.7774811938849777E-2 | V50: =+RC[-2]/RC[-4]-1 -> 0.1540966887635089 | W50: 621 | X50: 571 | Y50: =+RC[-1]/RC[-2]-1 -> -8.0515297906602279E-2 | Z50: 1696468 | AA50: 960000 | AB50: 922230 | AC50: =+RC[-1]/RC[-2]-1 -> -3.9343750000000011E-2 | AD50: =+RC[-2]/RC[-4]-1 -> -0.45638231902989035 | AE50: 381 | AF50: 801 | AG50: =+RC[-1]/RC[-2]-1 -> 1.1023622047244093 | AH50: 2761510 | AI50: 3106496 | AJ50: 3561132 | AK50: =+RC[-1]/RC[-2]-1 -> 0.14635009991965231 | AL50: =+RC[-2]/RC[-4]-1 -> 0.28955969741192322 | AM50: 3658 | AN50: 2549 | AO50: =+RC[-1]/RC[-2]-1 -> -0.30317113176599231 | AP50: 12189288 | AQ50: 8220598 | AR50: 11197461 | AS50: =+RC[-1]/RC[-2]-1 -> 0.36212243926780019 | AT50: =+RC[-2]/RC[-4]-1 -> -8.1368739503078436E-2 | AU50: 5886 | AV50: 6964 | AW50: =+RC[-1]/RC[-2]-1 -> 0.18314644920149514 | AX50: 6074461 | AY50: 5360624 | AZ50: 6770230 | BA50: =+RC[-1]/RC[-2]-1 -> 0.26295558129053642 | BB50: =+RC[-2]/RC[-4]-1 -> 0.11454003902568477 | BC50: 3810 | BD50: 3652 | BE50: =+RC[-1]/RC[-2]-1 -> -4.1469816272965865E-2 | BF50: 1744473 | BG50: 1495184 | BH50: 1383062 | BI50: =+RC[-1]/RC[-2]-1 -> -7.4988763924707547E-2 | BJ50: =+RC[-2]/RC[-4]-1 -> -0.20717488892060809 | BK50: 1108 | BL50: 1415 | BM50: =+RC[-1]/RC[-2]-1 -> 0.27707581227436817 | BN50: 1628672 | BO50: 0 | BP50: 1190752 | BQ50: =+RC[-1]/RC[-2]-1 -> #DIV/0! | BR50: =+RC[-2]/RC[-4]-1 -> -0.26888164099339829 | BS50: 2116 | BT50: 2151 | BU50: =+RC[-1]/RC[-2]-1 -> 1.6540642722117305E-2 | BV50: 11150260 | BW50: 10238536 | BX50: 11070277 | BY50: =+RC[-1]/RC[-2]-1 -> 8.1236321286558999E-2 | BZ50: =+RC[-2]/RC[-4]-1 -> -7.1731959613497986E-3 | CA50: 2481 | CB50: 2993 | CC50: =+RC[-1]/RC[-2]-1 -> 0.20636839983877464 | CD50: 2667933 | CE50: 2407355 | CF50: 2813323 | CG50: =+RC[-1]/RC[-2]-1 -> 0.16863653262605638 | CH50: =+RC[-2]/RC[-4]-1 -> 5.4495371510453916E-2 | CI50: 1663 | CJ50: 1686 | CK50: =+RC[-1]/RC[-2]-1 -> 1.3830426939266394E-2 | CL50: 1893776 | CM50: 0 | CN50: 938140 | CO50: =+RC[-1]/RC[-2]-1 -> #DIV/0! | CP50: =+RC[-2]/RC[-4]-1 -> -0.50461934251991791 | CQ50: 929 | CR50: 1333 | CS50: =+RC[-1]/RC[-2]-1 -> 0.43487621097954787 | CT50: 3684234 | CU50: 2950088 | CV50: 2268471 | CW50: =+RC[-1]/RC[-2]-1 -> -0.23104971783892547 | CX50: =+RC[-2]/RC[-4]-1 -> -0.38427608018383197 | CY50: 1020 | CZ50: 1307 | DA50: =+RC[-1]/RC[-2]-1 -> 0.28137254901960795 | DB50: 0 | DC50: 0 | DD50: 0 | DE50: =+RC[-1]/RC[-2]-1 -> #DIV/0! | DF50: =+RC[-2]/RC[-4]-1 -> #DIV/0! | DG50: 0 | DH50: 0 | DI50: =+RC[-1]/RC[-2]-1 -> #DIV/0! | DJ50: 0 | DK50: 0 | DL50: 0 | DM50: =+RC[-1]/RC[-2]-1 -> #DIV/0! | DN50: =+RC[-2]/RC[-4]-1 -> #DIV/0! | DO50: 0 | DP50: 0 | DQ50: =+RC[-1]/RC[-2]-1 -> #DIV/0! | DR50: 2631418 | DS50: 0 | DT50: 1296552 | DU50: =+RC[-1]/RC[-2]-1 -> #DIV/0! | DV50: =+RC[-2]/RC[-4]-1 -> -0.50728010525123723 | DW50: 2175 | DX50: 2515 | DY50: =+RC[-1]/RC[-2]-1 -> 0.15632183908045971 | DZ50: 2194466 | EA50: 0 | EB50: 1264512 | EC50: =+RC[-1]/RC[-2]-1 -> #DIV/0! | ED50: =+RC[-2]/RC[-4]-1 -> -0.42377234370457328 | EE50: 873 | EF50: 1516 | EG50: =+RC[-1]/RC[-2]-1 -> 0.73654066437571597 | EH50: 4314847 | EI50: 3621428 | EJ50: 3867310 | EK50: =+RC[-1]/RC[-2]-1 -> 6.789642096984938E-2 | EL50: =+RC[-2]/RC[-4]-1 -> -0.10372024778630617 | EM50: 2934 | EN50: 3016 | EO50: =+RC[-1]/RC[-2]-1 -> 2.7948193592365334E-2 | EP50: 3847705 | EQ50: 3254747 | ER50: 4752434 | ES50: =+RC[-1]/RC[-2]-1 -> 0.46015466025469864 | ET50: =+RC[-2]/RC[-4]-1 -> 0.23513471017138787 | EU50: 2361 | EV50: 2029 | EW50: =+RC[-1]/RC[-2]-1 -> -0.14061838204150778 | EX50: 495770 | EY50: 310364 | EZ50: 161440 | FA50: =+RC[-1]/RC[-2]-1 -> -0.47983657898467602 | FB50: =+RC[-2]/RC[-4]-1 -> -0.67436512899126611 | FC50: 234 | FD50: 485 | FE50: =+RC[-1]/RC[-2]-1 -> 1.0726495726495728 | FF50: 3310451 | FG50: 2600000 | FH50: 3201030 | FI50: =+RC[-1]/RC[-2]-1 -> 0.23116538461538472 | FJ50: =+RC[-2]/RC[-4]-1 -> -3.3053200304127728E-2 | FK50: 1888 | FL50: 2031 | FM50: =+RC[-1]/RC[-2]-1 -> 7.5741525423728806E-2 | FN50: 1039195 | FO50: 450000 | FP50: 297002 | FQ50: =+RC[-1]/RC[-2]-1 -> -0.33999555555555561 | FR50: =+RC[-2]/RC[-4]-1 -> -0.71419993360245182 | FS50: 534 | FT50: 1149 | FU50: =+RC[-1]/RC[-2]-1 -> 1.1516853932584268 | FV50: 6442894 | FW50: 4900000 | FX50: 6162638 | FY50: =+RC[-1]/RC[-2]-1 -> 0.25768122448979591 | FZ50: =+RC[-2]/RC[-4]-1 -> -4.3498465130731634E-2 | GA50: 2859 | GB50: 2418 | GC50: =+RC[-1]/RC[-2]-1 -> -0.1542497376705142 | GD50: 0 | GE50: 190000 | GF50: 0 | GG50: =+RC[-1]/RC[-2]-1 -> -1 | GH50: =+RC[-2]/RC[-4]-1 -> #DIV/0! | GI50: 0 | GJ50: 0 | GK50: =+RC[-1]/RC[-2]-1 -> #DIV/0! | GL50: 5627701 | GM50: 4676979 | GN50: 4755436 | GO50: =+RC[-1]/RC[-2]-1 -> 1.6775144810357245E-2 | GP50: =+RC[-2]/RC[-4]-1 -> -0.15499490822273609 | GQ50: 3787 | GR50: 3737 | GS50: =+RC[-1]/RC[-2]-1 -> -1.3203063110641677E-2 | GT50: 1222405 | GU50: 1100000 | GV50: 858362 | GW50: =+RC[-1]/RC[-2]-1 -> -0.21967090909090914 | GX50: =+RC[-2]/RC[-4]-1 -> -0.29780882767986061 | GY50: 828 | GZ50: 1053 | HA50: =+RC[-1]/RC[-2]-1 -> 0.27173913043478271 | HB50: 2915578 | HC50: 2202428 | HD50: 1935172 | HE50: =+RC[-1]/RC[-2]-1 -> -0.1213460780556731 | HF50: =+RC[-2]/RC[-4]-1 -> -0.33626471320609497 | HG50: 1048 | HH50: 1491 | HI50: =+RC[-1]/RC[-2]-1 -> 0.42270992366412208 | HJ50: 2304432 | HK50: 0 | HL50: 1956652 | HM50: =+RC[-1]/RC[-2]-1 -> #DIV/0! | HN50: =+RC[-2]/RC[-4]-1 -> -0.1509178834524082 | HO50: 1249 | HP50: 1429 | HQ50: =+RC[-1]/RC[-2]-1 -> 0.14411529223378694 | HR50: 1887066 | HS50: 1784547 | HT50: 1760473 | HU50: =+RC[-1]/RC[-2]-1 -> -1.3490258312053416E-2 | HV50: =+RC[-2]/RC[-4]-1 -> -6.7084564079899711E-2 | HW50: 1549 | HX50: 1635 | HY50: =+RC[-1]/RC[-2]-1 -> 5.5519690122659782E-2 | HZ50: 2334879 | IA50: 2328244 | IB50: 2285499 | IC50: =+RC[-1]/RC[-2]-1 -> -1.8359330035855326E-2 | ID50: =+RC[-2]/RC[-4]-1 -> -2.1148847541992533E-2 | IE50: 1272 | IF50: 1394 | IG50: =+RC[-1]/RC[-2]-1 -> 9.5911949685534514E-2 | IH50: 1241640 | II50: 1055950 | IJ50: 981393 | IK50: =+RC[-1]/RC[-2]-1 -> -7.0606562810739182E-2 | IL50: =+RC[-2]/RC[-4]-1 -> -0.20959940079250028 | IM50: 683 | IN50: 818 | IO50: =+RC[-1]/RC[-2]-1 -> 0.19765739385065895
A51: 15.02.2016 | B51: 73731299 | C51: 55352535 | D51: 59807461 | E51: =+RC[-1]/RC[-2]-1 -> 8.0482781863558728E-2 | F51: =+RC[-2]/RC[-4]-1 -> -0.18884568953545766 | G51: 39726 | H51: 45721 | I51: =+RC[-1]/RC[-2]-1 -> 0.15090872476463768 | J51: 0 | K51: 777111 | L51: 742020 | M51: =+RC[-1]/RC[-2]-1 -> -4.5155711346255512E-2 | N51: =+RC[-2]/RC[-4]-1 -> #DIV/0! | O51: 770 | P51: 0 | Q51: =+RC[-1]/RC[-2]-1 -> -1 | R51: 426321 | S51: 642876 | T51: 619713 | U51: =+RC[-1]/RC[-2]-1 -> -3.6030276445224274E-2 | V51: =+RC[-2]/RC[-4]-1 -> 0.45363001118875212 | W51: 735 | X51: 473 | Y51: =+RC[-1]/RC[-2]-1 -> -0.35646258503401362 | Z51: 1161468 | AA51: 840000 | AB51: 689162 | AC51: =+RC[-1]/RC[-2]-1 -> -0.17956904761904757 | AD51: =+RC[-2]/RC[-4]-1 -> -0.40664572764811424 | AE51: 526 | AF51: 591 | AG51: =+RC[-1]/RC[-2]-1 -> 0.12357414448669202 | AH51: 2335270 | AI51: 2192821 | AJ51: 2455163 | AK51: =+RC[-1]/RC[-2]-1 -> 0.11963676013682822 | AL51: =+RC[-2]/RC[-4]-1 -> 5.1340102001053323E-2 | AM51: 2546 | AN51: 2113 | AO51: =+RC[-1]/RC[-2]-1 -> -0.17007069913589945 | AP51: 10511067 | AQ51: 6057283 | AR51: 7580264 | AS51: =+RC[-1]/RC[-2]-1 -> 0.25142972517546225 | AT51: =+RC[-2]/RC[-4]-1 -> -0.27883020819865389 | AU51: 3900 | AV51: 6349 | AW51: =+RC[-1]/RC[-2]-1 -> 0.62794871794871798 | AX51: 5692699 | AY51: 4610136 | AZ51: 4455654 | BA51: =+RC[-1]/RC[-2]-1 -> -3.3509206669824931E-2 | BB51: =+RC[-2]/RC[-4]-1 -> -0.2173037780497441 | BC51: 2560 | BD51: 3491 | BE51: =+RC[-1]/RC[-2]-1 -> 0.36367187500000009 | BF51: 1349717 | BG51: 1437677 | BH51: 1366508 | BI51: =+RC[-1]/RC[-2]-1 -> -4.9502774267098926E-2 | BJ51: =+RC[-2]/RC[-4]-1 -> 1.2440385651214303E-2 | BK51: 1300 | BL51: 1027 | BM51: =+RC[-1]/RC[-2]-1 -> -0.20999999999999996 | BN51: 1253722 | BO51: 0 | BP51: 723627 | BQ51: =+RC[-1]/RC[-2]-1 -> #DIV/0! | BR51: =+RC[-2]/RC[-4]-1 -> -0.42281702004112554 | BS51: 1221 | BT51: 2063 | BU51: =+RC[-1]/RC[-2]-1 -> 0.68959868959868964 | BV51: 9731580 | BW51: 10238536 | BX51: 9498553 | BY51: =+RC[-1]/RC[-2]-1 -> -7.227429780976502E-2 | BZ51: =+RC[-2]/RC[-4]-1 -> -2.3945443597031546E-2 | CA51: 2869 | CB51: 2564 | CC51: =+RC[-1]/RC[-2]-1 -> -0.10630881840362494 | CD51: 2208863 | CE51: 2302688 | CF51: 2161332 | CG51: =+RC[-1]/RC[-2]-1 -> -6.1387387262190951E-2 | CH51: =+RC[-2]/RC[-4]-1 -> -2.1518310551627673E-2 | CI51: 1634 | CJ51: 1423 | CK51: =+RC[-1]/RC[-2]-1 -> -0.12913096695226434 | CL51: 1510496 | CM51: 0 | CN51: 615804 | CO51: =+RC[-1]/RC[-2]-1 -> #DIV/0! | CP51: =+RC[-2]/RC[-4]-1 -> -0.59231669597271353 | CQ51: 699 | CR51: 1203 | CS51: =+RC[-1]/RC[-2]-1 -> 0.72103004291845485 | CT51: 3795197 | CU51: 2478074 | CV51: 1642616 | CW51: =+RC[-1]/RC[-2]-1 -> -0.33714005312190032 | CX51: =+RC[-2]/RC[-4]-1 -> -0.56718557692789062 | CY51: 998 | CZ51: 1172 | DA51: =+RC[-1]/RC[-2]-1 -> 0.17434869739478964 | DB51: 0 | DC51: 0 | DD51: 0 | DE51: =+RC[-1]/RC[-2]-1 -> #DIV/0! | DF51: =+RC[-2]/RC[-4]-1 -> #DIV/0! | DG51: 0 | DH51: 0 | DI51: =+RC[-1]/RC[-2]-1 -> #DIV/0! | DJ51: 0 | DK51: 0 | DL51: 0 | DM51: =+RC[-1]/RC[-2]-1 -> #DIV/0! | DN51: =+RC[-2]/RC[-4]-1 -> #DIV/0! | DO51: 0 | DP51: 0 | DQ51: =+RC[-1]/RC[-2]-1 -> #DIV/0! | DR51: 2320094 | DS51: 0 | DT51: 698986 | DU51: =+RC[-1]/RC[-2]-1 -> #DIV/0! | DV51: =+RC[-2]/RC[-4]-1 -> -0.69872513786079349 | DW51: 1004 | DX51: 2362 | DY51: =+RC[-1]/RC[-2]-1 -> 1.3525896414342631 | DZ51: 1545173 | EA51: 0 | EB51: 1291689 | EC51: =+RC[-1]/RC[-2]-1 -> #DIV/0! | ED51: =+RC[-2]/RC[-4]-1 -> -0.16404894468127518 | EE51: 981 | EF51: 1139 | EG51: =+RC[-1]/RC[-2]-1 -> 0.16106014271151881 | EH51: 3208878 | EI51: 3731168 | EJ51: 3397969 | EK51: =+RC[-1]/RC[-2]-1 -> -8.9301527028533667E-2 | EL51: =+RC[-2]/RC[-4]-1 -> 5.8927450654091551E-2 | EM51: 3062 | EN51: 2376 | EO51: =+RC[-1]/RC[-2]-1 -> -0.22403657740039185 | EP51: 3683332 | EQ51: 2422138 | ER51: 3293249 | ES51: =+RC[-1]/RC[-2]-1 -> 0.35964548675591557 | ET51: =+RC[-2]/RC[-4]-1 -> -0.10590492521445261 | EU51: 1896 | EV51: 1821 | EW51: =+RC[-1]/RC[-2]-1 -> -3.9556962025316444E-2 | EX51: 449943 | EY51: 316158 | EZ51: 132447 | FA51: =+RC[-1]/RC[-2]-1 -> -0.58107338735695446 | FB51: =+RC[-2]/RC[-4]-1 -> -0.7056360472326495 | FC51: 215 | FD51: 430 | FE51: =+RC[-1]/RC[-2]-1 -> 1 | FF51: 2301176 | FG51: 2550000 | FH51: 2416960 | FI51: =+RC[-1]/RC[-2]-1 -> -5.2172549019607883E-2 | FJ51: =+RC[-2]/RC[-4]-1 -> 5.0315143213730762E-2 | FK51: 1756 | FL51: 1616 | FM51: =+RC[-1]/RC[-2]-1 -> -7.9726651480637845E-2 | FN51: 654523 | FO51: 400000 | FP51: 226301 | FQ51: =+RC[-1]/RC[-2]-1 -> -0.43424750000000001 | FR51: =+RC[-2]/RC[-4]-1 -> -0.6542504999824299 | FS51: 319 | FT51: 891 | FU51: =+RC[-1]/RC[-2]-1 -> 1.7931034482758621 | FV51: 5260025 | FW51: 3600000 | FX51: 4349339 | FY51: =+RC[-1]/RC[-2]-1 -> 0.20814972222222217 | FZ51: =+RC[-2]/RC[-4]-1 -> -0.17313339765495406 | GA51: 1793 | GB51: 2441 | GC51: =+RC[-1]/RC[-2]-1 -> 0.36140546569994414 | GD51: 0 | GE51: 144000 | GF51: 0 | GG51: =+RC[-1]/RC[-2]-1 -> -1 | GH51: =+RC[-2]/RC[-4]-1 -> #DIV/0! | GI51: 0 | GJ51: 0 | GK51: =+RC[-1]/RC[-2]-1 -> #DIV/0! | GL51: 4736593 | GM51: 3194035 | GN51: 2898209 | GO51: =+RC[-1]/RC[-2]-1 -> -9.2618271246244999E-2 | GP51: =+RC[-2]/RC[-4]-1 -> -0.3881236998830172 | GQ51: 2155 | GR51: 3332 | GS51: =+RC[-1]/RC[-2]-1 -> 0.54617169373549879 | GT51: 880080 | GU51: 950000 | GV51: 690008 | GW51: =+RC[-1]/RC[-2]-1 -> -0.27367578947368421 | GX51: =+RC[-2]/RC[-4]-1 -> -0.21597127533860561 | GY51: 749 | GZ51: 820 | HA51: =+RC[-1]/RC[-2]-1 -> 9.4793057409879866E-2 | HB51: 2329086 | HC51: 2139501 | HD51: 1624637 | HE51: =+RC[-1]/RC[-2]-1 -> -0.24064676763413528 | HF51: =+RC[-2]/RC[-4]-1 -> -0.30245727293882663 | HG51: 1012 | HH51: 1228 | HI51: =+RC[-1]/RC[-2]-1 -> 0.21343873517786571 | HJ51: 1869972 | HK51: 0 | HL51: 1645422 | HM51: =+RC[-1]/RC[-2]-1 -> #DIV/0! | HN51: =+RC[-2]/RC[-4]-1 -> -0.12008201192317314 | HO51: 1361 | HP51: 1290 | HQ51: =+RC[-1]/RC[-2]-1 -> -5.216752387950041E-2 | HR51: 1724431 | HS51: 1049734 | HT51: 1183154 | HU51: =+RC[-1]/RC[-2]-1 -> 0.12709886504581158 | HV51: =+RC[-2]/RC[-4]-1 -> -0.31388730543582199 | HW51: 1279 | HX51: 1627 | HY51: =+RC[-1]/RC[-2]-1 -> 0.27208756841282256 | HZ51: 1745863 | IA51: 2328244 | IB51: 2417646 | IC51: =+RC[-1]/RC[-2]-1 -> 3.8398896335607446E-2 | ID51: =+RC[-2]/RC[-4]-1 -> 0.38478563323697212 | IE51: 1595 | IF51: 1167 | IG51: =+RC[-1]/RC[-2]-1 -> -0.26833855799373041 | IH51: 1045730 | II51: 950355 | IJ51: 991029 | IK51: =+RC[-1]/RC[-2]-1 -> 4.2798743627381342E-2 | IL51: =+RC[-2]/RC[-4]-1 -> -5.2308913390645806E-2 | IM51: 791 | IN51: 712 | IO51: =+RC[-1]/RC[-2]-1 -> -9.9873577749683973E-2
A52: 16.02.2016 | B52: 60067484 | C52: 54044443 | D52: 58541479 | E52: =+RC[-1]/RC[-2]-1 -> 8.3209961105529473E-2 | F52: =+RC[-2]/RC[-4]-1 -> -2.5404842992924448E-2 | G52: 40518 | H52: 41521 | I52: =+RC[-1]/RC[-2]-1 -> 2.4754430129818816E-2 | J52: 0 | K52: 777111 | L52: 768475 | M52: =+RC[-1]/RC[-2]-1 -> -1.1112955549464565E-2 | N52: =+RC[-2]/RC[-4]-1 -> #DIV/0! | O52: 795 | P52: 0 | Q52: =+RC[-1]/RC[-2]-1 -> -1 | R52: 475359 | S52: 642876 | T52: 594861 | U52: =+RC[-1]/RC[-2]-1 -> -7.4687809157598095E-2 | V52: =+RC[-2]/RC[-4]-1 -> 0.25139315759247216 | W52: 673 | X52: 516 | Y52: =+RC[-1]/RC[-2]-1 -> -0.23328380386329861 | Z52: 920066 | AA52: 816000 | AB52: 658206 | AC52: =+RC[-1]/RC[-2]-1 -> -0.19337499999999996 | AD52: =+RC[-2]/RC[-4]-1 -> -0.28461001710746836 | AE52: 521 | AF52: 557 | AG52: =+RC[-1]/RC[-2]-1 -> 6.909788867562372E-2 | AH52: 1229772 | AI52: 2101453 | AJ52: 2370219 | AK52: =+RC[-1]/RC[-2]-1 -> 0.12789531814416022 | AL52: =+RC[-2]/RC[-4]-1 -> 0.9273645846547165 | AM52: 2596 | AN52: 1671 | AO52: =+RC[-1]/RC[-2]-1 -> -0.35631741140215711 | AP52: 7503855 | AQ52: 5840951 | AR52: 7244104 | AS52: =+RC[-1]/RC[-2]-1 -> 0.24022680553218123 | AT52: =+RC[-2]/RC[-4]-1 -> -3.4615674210122682E-2 | AU52: 3675 | AV52: 4664 | AW52: =+RC[-1]/RC[-2]-1 -> 0.26911564625850337 | AX52: 4220072 | AY52: 4610136 | AZ52: 4915903 | BA52: =+RC[-1]/RC[-2]-1 -> 6.6324941390015324E-2 | BB52: =+RC[-2]/RC[-4]-1 -> 0.1648860493375468 | BC52: 2951 | BD52: 2457 | BE52: =+RC[-1]/RC[-2]-1 -> -0.16740088105726869 | BF52: 1506103 | BG52: 1437677 | BH52: 1286712 | BI52: =+RC[-1]/RC[-2]-1 -> -0.10500620097560165 | BJ52: =+RC[-2]/RC[-4]-1 -> -0.14566799216255466 | BK52: 1227 | BL52: 1566 | BM52: =+RC[-1]/RC[-2]-1 -> 0.27628361858190709 | BN52: 1019544 | BO52: 0 | BP52: 750678 | BQ52: =+RC[-1]/RC[-2]-1 -> #DIV/0! | BR52: =+RC[-2]/RC[-4]-1 -> -0.26371201242908593 | BS52: 1455 | BT52: 1496 | BU52: =+RC[-1]/RC[-2]-1 -> 2.8178694158075501E-2 | BV52: 9304652 | BW52: 9317068 | BX52: 8744664 | BY52: =+RC[-1]/RC[-2]-1 -> -6.1436065509020699E-2 | BZ52: =+RC[-2]/RC[-4]-1 -> -6.0183658668803486E-2 | CA52: 2673 | CB52: 3031 | CC52: =+RC[-1]/RC[-2]-1 -> 0.13393191170968954 | CD52: 1947546 | CE52: 2302688 | CF52: 2089803 | CG52: =+RC[-1]/RC[-2]-1 -> -9.245064898066957E-2 | CH52: =+RC[-2]/RC[-4]-1 -> 7.3044231047687758E-2 | CI52: 1563 | CJ52: 1451 | CK52: =+RC[-1]/RC[-2]-1 -> -7.1657069737683932E-2 | CL52: 1312450 | CM52: 0 | CN52: 555053 | CO52: =+RC[-1]/RC[-2]-1 -> #DIV/0! | CP52: =+RC[-2]/RC[-4]-1 -> -0.57708636519486456 | CQ52: 690 | CR52: 1090 | CS52: =+RC[-1]/RC[-2]-1 -> 0.57971014492753614 | CT52: 2438402 | CU52: 2596077 | CV52: 1705463 | CW52: =+RC[-1]/RC[-2]-1 -> -0.34306147313812341 | CX52: =+RC[-2]/RC[-4]-1 -> -0.30058169243627586 | CY52: 999 | CZ52: 1291 | DA52: =+RC[-1]/RC[-2]-1 -> 0.29229229229229237 | DB52: 0 | DC52: 0 | DD52: 0 | DE52: =+RC[-1]/RC[-2]-1 -> #DIV/0! | DF52: =+RC[-2]/RC[-4]-1 -> #DIV/0! | DG52: 0 | DH52: 0 | DI52: =+RC[-1]/RC[-2]-1 -> #DIV/0! | DJ52: 0 | DK52: 0 | DL52: 0 | DM52: =+RC[-1]/RC[-2]-1 -> #DIV/0! | DN52: =+RC[-2]/RC[-4]-1 -> #DIV/0! | DO52: 0 | DP52: 0 | DQ52: =+RC[-1]/RC[-2]-1 -> #DIV/0! | DR52: 1554514 | DS52: 0 | DT52: 727871 | DU52: =+RC[-1]/RC[-2]-1 -> #DIV/0! | DV52: =+RC[-2]/RC[-4]-1 -> -0.53176941474956152 | DW52: 1433 | DX52: 1590 | DY52: =+RC[-1]/RC[-2]-1 -> 0.10956036287508719 | DZ52: 1552438 | EA52: 0 | EB52: 1178601 | EC52: =+RC[-1]/RC[-2]-1 -> #DIV/0! | ED52: =+RC[-2]/RC[-4]-1 -> -0.2408063961330501 | EE52: 939 | EF52: 1174 | EG52: =+RC[-1]/RC[-2]-1 -> 0.2502662406815761 | EH52: 3559032 | EI52: 3731168 | EJ52: 3638989 | EK52: =+RC[-1]/RC[-2]-1 -> -2.4705132548306641E-2 | EL52: =+RC[-2]/RC[-4]-1 -> 2.2465940176991994E-2 | EM52: 3404 | EN52: 3316 | EO52: =+RC[-1]/RC[-2]-1 -> -2.5851938895417148E-2 | EP52: 2515683 | EQ52: 2497829 | ER52: 3097192 | ES52: =+RC[-1]/RC[-2]-1 -> 0.23995357568512499 | ET52: =+RC[-2]/RC[-4]-1 -> 0.23115352769009445 | EU52: 1845 | EV52: 1646 | EW52: =+RC[-1]/RC[-2]-1 -> -0.10785907859078592 | EX52: 397884 | EY52: 306226 | EZ52: 125408 | FA52: =+RC[-1]/RC[-2]-1 -> -0.59047239620411074 | FB52: =+RC[-2]/RC[-4]-1 -> -0.6848126589659298 | FC52: 235 | FD52: 466 | FE52: =+RC[-1]/RC[-2]-1 -> 0.98297872340425529 | FF52: 2591236 | FG52: 2550000 | FH52: 2554131 | FI52: =+RC[-1]/RC[-2]-1 -> 1.6199999999999548E-3 | FJ52: =+RC[-2]/RC[-4]-1 -> -1.4319421310911129E-2 | FK52: 1811 | FL52: 1839 | FM52: =+RC[-1]/RC[-2]-1 -> 1.5461071231363865E-2 | FN52: 500219 | FO52: 350000 | FP52: 214909 | FQ52: =+RC[-1]/RC[-2]-1 -> -0.38597428571428571 | FR52: =+RC[-2]/RC[-4]-1 -> -0.57037017786209643 | FS52: 347 | FT52: 634 | FU52: =+RC[-1]/RC[-2]-1 -> 0.82708933717579258 | FV52: 3367667 | FW52: 3600000 | FX52: 4051944 | FY52: =+RC[-1]/RC[-2]-1 -> 0.12553999999999998 | FZ52: =+RC[-2]/RC[-4]-1 -> 0.20319022041074719 | GA52: 1797 | GB52: 1606 | GC52: =+RC[-1]/RC[-2]-1 -> -0.1062882582081246 | GD52: 0 | GE52: 0 | GF52: 0 | GG52: =+RC[-1]/RC[-2]-1 -> #DIV/0! | GH52: =+RC[-2]/RC[-4]-1 -> #DIV/0! | GI52: 0 | GJ52: 0 | GK52: =+RC[-1]/RC[-2]-1 -> #DIV/0! | GL52: 3412894 | GM52: 3194035 | GN52: 2644528 | GO52: =+RC[-1]/RC[-2]-1 -> -0.17204163385811366 | GP52: =+RC[-2]/RC[-4]-1 -> -0.22513620405438906 | GQ52: 1975 | GR52: 2248 | GS52: =+RC[-1]/RC[-2]-1 -> 0.13822784810126576 | GT52: 850785 | GU52: 950000 | GV52: 666125 | GW52: =+RC[-1]/RC[-2]-1 -> -0.29881578947368426 | GX52: =+RC[-2]/RC[-4]-1 -> -0.21704660989556701 | GY52: 756 | GZ52: 920 | HA52: =+RC[-1]/RC[-2]-1 -> 0.21693121693121697 | HB52: 2189561 | HC52: 2139501 | HD52: 1809460 | HE52: =+RC[-1]/RC[-2]-1 -> -0.15426073649883776 | HF52: =+RC[-2]/RC[-4]-1 -> -0.17359689910443232 | HG52: 1094 | HH52: 1268 | HI52: =+RC[-1]/RC[-2]-1 -> 0.15904936014625237 | HJ52: 1981443 | HK52: 0 | HL52: 1668622 | HM52: =+RC[-1]/RC[-2]-1 -> #DIV/0! | HN52: =+RC[-2]/RC[-4]-1 -> -0.15787534640158718 | HO52: 1477 | HP52: 1500 | HQ52: =+RC[-1]/RC[-2]-1 -> 1.5572105619499066E-2 | HR52: 978213 | HS52: 1154707 | HT52: 1359945 | HU52: =+RC[-1]/RC[-2]-1 -> 0.17774032719988697 | HV52: =+RC[-2]/RC[-4]-1 -> 0.3902340287851418 | HW52: 1324 | HX52: 1294 | HY52: =+RC[-1]/RC[-2]-1 -> -2.2658610271903301E-2 | HZ52: 1858466 | IA52: 2125788 | IB52: 2218017 | IC52: =+RC[-1]/RC[-2]-1 -> 4.3385793879728407E-2 | ID52: =+RC[-2]/RC[-4]-1 -> 0.1934665471415673 | IE52: 1492 | IF52: 1445 | IG52: =+RC[-1]/RC[-2]-1 -> -3.1501340482573692E-2 | IH52: 879628 | II52: 1003152 | IJ52: 901596 | IK52: =+RC[-1]/RC[-2]-1 -> -0.10123690128714291 | IL52: =+RC[-2]/RC[-4]-1 -> 2.4974193636400743E-2 | IM52: 771 | IN52: 785 | IO52: =+RC[-1]/RC[-2]-1 -> 1.8158236057068677E-2
A53: 17.02.2016 | B53: 58867887 | C53: 54693258 | D53: 56656642 | E53: =+RC[-1]/RC[-2]-1 -> 3.5898099177050335E-2 | F53: =+RC[-2]/RC[-4]-1 -> -3.7562839651438473E-2 | G53: 38868 | H53: 40011 | I53: =+RC[-1]/RC[-2]-1 -> 2.9407224451991398E-2 | J53: 0 | K53: 836889 | L53: 657890 | M53: =+RC[-1]/RC[-2]-1 -> -0.21388619040278933 | N53: =+RC[-2]/RC[-4]-1 -> #DIV/0! | O53: 797 | P53: 0 | Q53: =+RC[-1]/RC[-2]-1 -> -1 | R53: 405107 | S53: 642876 | T53: 674441 | U53: =+RC[-1]/RC[-2]-1 -> 4.9099670854099386E-2 | V53: =+RC[-2]/RC[-4]-1 -> 0.66484657139965497 | W53: 750 | X53: 512 | Y53: =+RC[-1]/RC[-2]-1 -> -0.31733333333333336 | Z53: 958072 | AA53: 816000 | AB53: 551181 | AC53: =+RC[-1]/RC[-2]-1 -> -0.32453308823529414 | AD53: =+RC[-2]/RC[-4]-1 -> -0.42469772626691937 | AE53: 452 | AF53: 567 | AG53: =+RC[-1]/RC[-2]-1 -> 0.25442477876106184 | AH53: 1458987 | AI53: 2147137 | AJ53: 2356560 | AK53: =+RC[-1]/RC[-2]-1 -> 9.7535928075386025E-2 | AL53: =+RC[-2]/RC[-4]-1 -> 0.61520287706470311 | AM53: 2639 | AN53: 1492 | AO53: =+RC[-1]/RC[-2]-1 -> -0.43463433118605532 | AP53: 6787027 | AQ53: 6057283 | AR53: 6772451 | AS53: =+RC[-1]/RC[-2]-1 -> 0.11806745697699772 | AT53: =+RC[-2]/RC[-4]-1 -> -2.1476266412377987E-3 | AU53: 3690 | AV53: 4304 | AW53: =+RC[-1]/RC[-2]-1 -> 0.16639566395663952 | AX53: 4432561 | AY53: 4610136 | AZ53: 4368119 | BA53: =+RC[-1]/RC[-2]-1 -> -5.249671593202454E-2 | BB53: =+RC[-2]/RC[-4]-1 -> -1.4538322202446885E-2 | BC53: 2495 | BD53: 2670 | BE53: =+RC[-1]/RC[-2]-1 -> 7.0140280561122204E-2 | BF53: 1332889 | BG53: 1437677 | BH53: 1367329 | BI53: =+RC[-1]/RC[-2]-1 -> -4.8931714147197214E-2 | BJ53: =+RC[-2]/RC[-4]-1 -> 2.5838610717021426E-2 | BK53: 1311 | BL53: 1347 | BM53: =+RC[-1]/RC[-2]-1 -> 2.7459954233409523E-2 | BN53: 838908 | BO53: 0 | BP53: 675707 | BQ53: =+RC[-1]/RC[-2]-1 -> #DIV/0! | BR53: =+RC[-2]/RC[-4]-1 -> -0.19453980651036828 | BS53: 1205 | BT53: 1351 | BU53: =+RC[-1]/RC[-2]-1 -> 0.12116182572614109 | BV53: 8770387 | BW53: 9214682 | BX53: 8981707 | BY53: =+RC[-1]/RC[-2]-1 -> -2.5283021161229491E-2 | BZ53: =+RC[-2]/RC[-4]-1 -> 2.4094717827160883E-2 | CA53: 2787 | CB53: 2844 | CC53: =+RC[-1]/RC[-2]-1 -> 2.0452099031216253E-2 | CD53: 1943605 | CE53: 2302688 | CF53: 2034932 | CG53: =+RC[-1]/RC[-2]-1 -> -0.11627975652802292 | CH53: =+RC[-2]/RC[-4]-1 -> 4.6988457016729157E-2 | CI53: 1639 | CJ53: 1508 | CK53: =+RC[-1]/RC[-2]-1 -> -7.9926784624771208E-2 | CL53: 1293003 | CM53: 0 | CN53: 466788 | CO53: =+RC[-1]/RC[-2]-1 -> #DIV/0! | CP53: =+RC[-2]/RC[-4]-1 -> -0.63898923668390561 | CQ53: 617 | CR53: 1042 | CS53: =+RC[-1]/RC[-2]-1 -> 0.68881685575364671 | CT53: 2762205 | CU53: 2596077 | CV53: 1510447 | CW53: =+RC[-1]/RC[-2]-1 -> -0.41818097074932681 | CX53: =+RC[-2]/RC[-4]-1 -> -0.45317346105737988 | CY53: 965 | CZ53: 1310 | DA53: =+RC[-1]/RC[-2]-1 -> 0.35751295336787559 | DB53: 0 | DC53: 0 | DD53: 0 | DE53: =+RC[-1]/RC[-2]-1 -> #DIV/0! | DF53: =+RC[-2]/RC[-4]-1 -> #DIV/0! | DG53: 0 | DH53: 0 | DI53: =+RC[-1]/RC[-2]-1 -> #DIV/0! | DJ53: 0 | DK53: 0 | DL53: 0 | DM53: =+RC[-1]/RC[-2]-1 -> #DIV/0! | DN53: =+RC[-2]/RC[-4]-1 -> #DIV/0! | DO53: 0 | DP53: 0 | DQ53: =+RC[-1]/RC[-2]-1 -> #DIV/0! | DR53: 1539292 | DS53: 0 | DT53: 615259 | DU53: =+RC[-1]/RC[-2]-1 -> #DIV/0! | DV53: =+RC[-2]/RC[-4]-1 -> -0.6002974094583744 | DW53: 987 | DX53: 1739 | DY53: =+RC[-1]/RC[-2]-1 -> 0.76190476190476186 | DZ53: 1495306 | EA53: 0 | EB53: 1133000 | EC53: =+RC[-1]/RC[-2]-1 -> #DIV/0! | ED53: =+RC[-2]/RC[-4]-1 -> -0.24229555689604665 | EE53: 955 | EF53: 1129 | EG53: =+RC[-1]/RC[-2]-1 -> 0.1821989528795811 | EH53: 3426987 | EI53: 3731168 | EJ53: 3326829 | EK53: =+RC[-1]/RC[-2]-1 -> -0.10836794269247596 | EL53: =+RC[-2]/RC[-4]-1 -> -2.9226256183638832E-2 | EM53: 2966 | EN53: 3109 | EO53: =+RC[-1]/RC[-2]-1 -> 4.8213081591368834E-2 | EP53: 2846264 | EQ53: 2573521 | ER53: 3820320 | ES53: =+RC[-1]/RC[-2]-1 -> 0.48447205210293598 | ET53: =+RC[-2]/RC[-4]-1 -> 0.34222264695052873 | EU53: 1933 | EV53: 1623 | EW53: =+RC[-1]/RC[-2]-1 -> -0.16037247801345056 | EX53: 337610 | EY53: 306226 | EZ53: 112004 | FA53: =+RC[-1]/RC[-2]-1 -> -0.63424398973307294 | FB53: =+RC[-2]/RC[-4]-1 -> -0.66824442403957229 | FC53: 228 | FD53: 394 | FE53: =+RC[-1]/RC[-2]-1 -> 0.72807017543859653 | FF53: 2659352 | FG53: 2550000 | FH53: 2340641 | FI53: =+RC[-1]/RC[-2]-1 -> -8.2101568627450994E-2 | FJ53: =+RC[-2]/RC[-4]-1 -> -0.11984536082474229 | FK53: 1658 | FL53: 1766 | FM53: =+RC[-1]/RC[-2]-1 -> 6.5138721351025275E-2 | FN53: 517799 | FO53: 350000 | FP53: 159484 | FQ53: =+RC[-1]/RC[-2]-1 -> -0.54433142857142858 | FR53: =+RC[-2]/RC[-4]-1 -> -0.69199631517248972 | FS53: 311 | FT53: 618 | FU53: =+RC[-1]/RC[-2]-1 -> 0.98713826366559476 | FV53: 3808525 | FW53: 3600000 | FX53: 3781879 | FY53: =+RC[-1]/RC[-2]-1 -> 5.0521944444444467E-2 | FZ53: =+RC[-2]/RC[-4]-1 -> -6.9964093710820352E-3 | GA53: 1696 | GB53: 1669 | GC53: =+RC[-1]/RC[-2]-1 -> -1.5919811320754707E-2 | GD53: 0 | GE53: 200000 | GF53: 0 | GG53: =+RC[-1]/RC[-2]-1 -> -1 | GH53: =+RC[-2]/RC[-4]-1 -> #DIV/0! | GI53: 0 | GJ53: 0 | GK53: =+RC[-1]/RC[-2]-1 -> #DIV/0! | GL53: 2845316 | GM53: 3194035 | GN53: 2578322 | GO53: =+RC[-1]/RC[-2]-1 -> -0.19276964717042866 | GP53: =+RC[-2]/RC[-4]-1 -> -9.3836326088209576E-2 | GQ53: 2031 | GR53: 2110 | GS53: =+RC[-1]/RC[-2]-1 -> 3.8897095027080164E-2 | GT53: 844536 | GU53: 950000 | GV53: 663820 | GW53: =+RC[-1]/RC[-2]-1 -> -0.30124210526315787 | GX53: =+RC[-2]/RC[-4]-1 -> -0.21398258925611224 | GY53: 719 | GZ53: 893 | HA53: =+RC[-1]/RC[-2]-1 -> 0.24200278164116829 | HB53: 2168646 | HC53: 2139501 | HD53: 1579882 | HE53: =+RC[-1]/RC[-2]-1 -> -0.26156519674447454 | HF53: =+RC[-2]/RC[-4]-1 -> -0.27148921492949984 | HG53: 995 | HH53: 1237 | HI53: =+RC[-1]/RC[-2]-1 -> 0.24321608040201004 | HJ53: 1702826 | HK53: 0 | HL53: 1633301 | HM53: =+RC[-1]/RC[-2]-1 -> #DIV/0! | HN53: =+RC[-2]/RC[-4]-1 -> -4.0829186305588516E-2 | HO53: 1389 | HP53: 1436 | HQ53: =+RC[-1]/RC[-2]-1 -> 3.3837293016558689E-2 | HR53: 992478 | HS53: 1207194 | HT53: 1221239 | HU53: =+RC[-1]/RC[-2]-1 -> 1.1634418328785534E-2 | HV53: =+RC[-2]/RC[-4]-1 -> 0.23049478174831073 | HW53: 1327 | HX53: 1253 | HY53: =+RC[-1]/RC[-2]-1 -> -5.576488319517714E-2 | HZ53: 1700557 | IA53: 2227016 | IB53: 2357387 | IC53: =+RC[-1]/RC[-2]-1 -> 5.8540666075142633E-2 | ID53: =+RC[-2]/RC[-4]-1 -> 0.38624403651274264 | IE53: 1582 | IF53: 1298 | IG53: =+RC[-1]/RC[-2]-1 -> -0.17951959544879903 | IH53: 999642 | II53: 1003152 | IJ53: 915723 | IK53: =+RC[-1]/RC[-2]-1 -> -8.7154289678932018E-2 | IL53: =+RC[-2]/RC[-4]-1 -> -8.3949053761246506E-2 | IM53: 744 | IN53: 790 | IO53: =+RC[-1]/RC[-2]-1 -> 6.1827956989247257E-2
A54: 18.02.2016 | B54: 58458269 | C54: 54840032 | D54: 57673517 | E54: =+RC[-1]/RC[-2]-1 -> 5.16681864809998E-2 | F54: =+RC[-2]/RC[-4]-1 -> -1.3424140218725955E-2 | G54: 38654 | H54: 41197 | I54: =+RC[-1]/RC[-2]-1 -> 6.5788792880426383E-2 | J54: 0 | K54: 836889 | L54: 762044 | M54: =+RC[-1]/RC[-2]-1 -> -8.9432409793891443E-2 | N54: =+RC[-2]/RC[-4]-1 -> #DIV/0! | O54: 765 | P54: 0 | Q54: =+RC[-1]/RC[-2]-1 -> -1 | R54: 410130 | S54: 642876 | T54: 601605 | U54: =+RC[-1]/RC[-2]-1 -> -6.4197450208127282E-2 | V54: =+RC[-2]/RC[-4]-1 -> 0.46686416502084715 | W54: 653 | X54: 528 | Y54: =+RC[-1]/RC[-2]-1 -> -0.19142419601837668 | Z54: 821947 | AA54: 780000 | AB54: 543583 | AC54: =+RC[-1]/RC[-2]-1 -> -0.3030987179487179 | AD54: =+RC[-2]/RC[-4]-1 -> -0.33866417177749908 | AE54: 440 | AF54: 567 | AG54: =+RC[-1]/RC[-2]-1 -> 0.28863636363636358 | AH54: 1317925 | AI54: 2192821 | AJ54: 2553976 | AK54: =+RC[-1]/RC[-2]-1 -> 0.16469880578487706 | AL54: =+RC[-2]/RC[-4]-1 -> 0.93787658630043436 | AM54: 2544 | AN54: 1552 | AO54: =+RC[-1]/RC[-2]-1 -> -0.38993710691823902 | AP54: 7437122 | AQ54: 6057283 | AR54: 7104766 | AS54: =+RC[-1]/RC[-2]-1 -> 0.17292951311668947 | AT54: =+RC[-2]/RC[-4]-1 -> -4.4688792250550669E-2 | AU54: 3702 | AV54: 4481 | AW54: =+RC[-1]/RC[-2]-1 -> 0.21042679632631001 | AX54: 4165187 | AY54: 4717349 | AZ54: 4715800 | BA54: =+RC[-1]/RC[-2]-1 -> -3.2836239167377546E-4 | BB54: =+RC[-2]/RC[-4]-1 -> 0.13219406475627626 | BC54: 2599 | BD54: 2547 | BE54: =+RC[-1]/RC[-2]-1 -> -2.000769526741053E-2 | BF54: 1518788 | BG54: 1437677 | BH54: 1254284 | BI54: =+RC[-1]/RC[-2]-1 -> -0.12756203236192831 | BJ54: =+RC[-2]/RC[-4]-1 -> -0.17415465489587745 | BK54: 1232 | BL54: 1540 | BM54: =+RC[-1]/RC[-2]-1 -> 0.25 | BN54: 997614 | BO54: 0 | BP54: 660130 | BQ54: =+RC[-1]/RC[-2]-1 -> #DIV/0! | BR54: =+RC[-2]/RC[-4]-1 -> -0.3382911627142362 | BS54: 1188 | BT54: 1425 | BU54: =+RC[-1]/RC[-2]-1 -> 0.19949494949494939 | BV54: 8642024 | BW54: 9214682 | BX54: 9003626 | BY54: =+RC[-1]/RC[-2]-1 -> -2.2904317262386287E-2 | BZ54: =+RC[-2]/RC[-4]-1 -> 4.1842281391488934E-2 | CA54: 2819 | CB54: 3054 | CC54: =+RC[-1]/RC[-2]-1 -> 8.3362894643490559E-2 | CD54: 1813465 | CE54: 2302688 | CF54: 2100942 | CG54: =+RC[-1]/RC[-2]-1 -> -8.7613258939118088E-2 | CH54: =+RC[-2]/RC[-4]-1 -> 0.15852359984890807 | CI54: 1523 | CJ54: 1404 | CK54: =+RC[-1]/RC[-2]-1 -> -7.8135259356533204E-2 | CL54: 1373424 | CM54: 0 | CN54: 412935 | CO54: =+RC[-1]/RC[-2]-1 -> #DIV/0! | CP54: =+RC[-2]/RC[-4]-1 -> -0.69933902421976024 | CQ54: 612 | CR54: 1095 | CS54: =+RC[-1]/RC[-2]-1 -> 0.78921568627450989 | CT54: 2563494 | CU54: 2596077 | CV54: 1441085 | CW54: =+RC[-1]/RC[-2]-1 -> -0.4448989764171094 | CX54: =+RC[-2]/RC[-4]-1 -> -0.43784342775914431 | CY54: 962 | CZ54: 1301 | DA54: =+RC[-1]/RC[-2]-1 -> 0.35239085239085233 | DB54: 0 | DC54: 0 | DD54: 0 | DE54: =+RC[-1]/RC[-2]-1 -> #DIV/0! | DF54: =+RC[-2]/RC[-4]-1 -> #DIV/0! | DG54: 0 | DH54: 0 | DI54: =+RC[-1]/RC[-2]-1 -> #DIV/0! | DJ54: 0 | DK54: 0 | DL54: 0 | DM54: =+RC[-1]/RC[-2]-1 -> #DIV/0! | DN54: =+RC[-2]/RC[-4]-1 -> #DIV/0! | DO54: 0 | DP54: 0 | DQ54: =+RC[-1]/RC[-2]-1 -> #DIV/0! | DR54: 1470456 | DS54: 0 | DT54: 640203 | DU54: =+RC[-1]/RC[-2]-1 -> #DIV/0! | DV54: =+RC[-2]/RC[-4]-1 -> -0.56462281088315458 | DW54: 1005 | DX54: 1817 | DY54: =+RC[-1]/RC[-2]-1 -> 0.80796019900497518 | DZ54: 1279874 | EA54: 0 | EB54: 931563 | EC54: =+RC[-1]/RC[-2]-1 -> #DIV/0! | ED54: =+RC[-2]/RC[-4]-1 -> -0.27214475799961557 | EE54: 914 | EF54: 1035 | EG54: =+RC[-1]/RC[-2]-1 -> 0.13238512035010941 | EH54: 3315944 | EI54: 3731168 | EJ54: 3440822 | EK54: =+RC[-1]/RC[-2]-1 -> -7.7816383502431363E-2 | EL54: =+RC[-2]/RC[-4]-1 -> 3.7659863978402486E-2 | EM54: 3039 | EN54: 3187 | EO54: =+RC[-1]/RC[-2]-1 -> 4.8700230338927231E-2 | EP54: 2611730 | EQ54: 2649213 | ER54: 3449878 | ES54: =+RC[-1]/RC[-2]-1 -> 0.30222749171168939 | ET54: =+RC[-2]/RC[-4]-1 -> 0.32091678695730419 | EU54: 1999 | EV54: 1625 | EW54: =+RC[-1]/RC[-2]-1 -> -0.18709354677338674 | EX54: 359968 | EY54: 306226 | EZ54: 124171 | FA54: =+RC[-1]/RC[-2]-1 -> -0.59451189644249669 | FB54: =+RC[-2]/RC[-4]-1 -> -0.655049893323851 | FC54: 214 | FD54: 402 | FE54: =+RC[-1]/RC[-2]-1 -> 0.87850467289719636 | FF54: 2373226 | FG54: 2500000 | FH54: 2371749 | FI54: =+RC[-1]/RC[-2]-1 -> -5.1300400000000024E-2 | FJ54: =+RC[-2]/RC[-4]-1 -> -6.2235960671253032E-4 | FK54: 1605 | FL54: 1735 | FM54: =+RC[-1]/RC[-2]-1 -> 8.0996884735202501E-2 | FN54: 615322 | FO54: 350000 | FP54: 165205 | FQ54: =+RC[-1]/RC[-2]-1 -> -0.52798571428571428 | FR54: =+RC[-2]/RC[-4]-1 -> -0.73151455660613474 | FS54: 322 | FT54: 664 | FU54: =+RC[-1]/RC[-2]-1 -> 1.0621118012422359 | FV54: 3504894 | FW54: 3700000 | FX54: 4342099 | FY54: =+RC[-1]/RC[-2]-1 -> 0.17354027027027019 | FZ54: =+RC[-2]/RC[-4]-1 -> 0.23886742366530922 | GA54: 1748 | GB54: 1576 | GC54: =+RC[-1]/RC[-2]-1 -> -9.8398169336384456E-2 | GD54: 0 | GE54: 90000 | GF54: 0 | GG54: =+RC[-1]/RC[-2]-1 -> -1 | GH54: =+RC[-2]/RC[-4]-1 -> #DIV/0! | GI54: 0 | GJ54: 0 | GK54: =+RC[-1]/RC[-2]-1 -> #DIV/0! | GL54: 2844765 | GM54: 3194035 | GN54: 2719360 | GO54: =+RC[-1]/RC[-2]-1 -> -0.14861296134826329 | GP54: =+RC[-2]/RC[-4]-1 -> -4.4082727395760246E-2 | GQ54: 1973 | GR54: 2210 | GS54: =+RC[-1]/RC[-2]-1 -> 0.12012164216928545 | GT54: 929604 | GU54: 950000 | GV54: 640288 | GW54: =+RC[-1]/RC[-2]-1 -> -0.32601263157894733 | GX54: =+RC[-2]/RC[-4]-1 -> -0.31122499472893839 | GY54: 780 | GZ54: 942 | HA54: =+RC[-1]/RC[-2]-1 -> 0.20769230769230762 | HB54: 2187754 | HC54: 2202428 | HD54: 1623453 | HE54: =+RC[-1]/RC[-2]-1 -> -0.26288033025370183 | HF54: =+RC[-2]/RC[-4]-1 -> -0.25793622134846972 | HG54: 981 | HH54: 1313 | HI54: =+RC[-1]/RC[-2]-1 -> 0.33843017329255853 | HJ54: 1899137 | HK54: 0 | HL54: 1602394 | HM54: =+RC[-1]/RC[-2]-1 -> #DIV/0! | HN54: =+RC[-2]/RC[-4]-1 -> -0.15625149739065691 | HO54: 1376 | HP54: 1605 | HQ54: =+RC[-1]/RC[-2]-1 -> 0.16642441860465107 | HR54: 1110318 | HS54: 1259680 | HT54: 1267002 | HU54: =+RC[-1]/RC[-2]-1 -> 5.8125873237646619E-3 | HV54: =+RC[-2]/RC[-4]-1 -> 0.14111632883552283 | HW54: 1324 | HX54: 1323 | HY54: =+RC[-1]/RC[-2]-1 -> -7.5528700906346558E-4 | HZ54: 1974522 | IA54: 2125788 | IB54: 2152285 | IC54: =+RC[-1]/RC[-2]-1 -> 1.2464554320562593E-2 | ID54: =+RC[-2]/RC[-4]-1 -> 9.002837142356479E-2 | IE54: 1544 | IF54: 1488 | IG54: =+RC[-1]/RC[-2]-1 -> -3.6269430051813489E-2 | IH54: 919635 | II54: 1003152 | IJ54: 1048269 | IK54: =+RC[-1]/RC[-2]-1 -> 4.4975238049667521E-2 | IL54: =+RC[-2]/RC[-4]-1 -> 0.13987505912671883 | IM54: 791 | IN54: 781 | IO54: =+RC[-1]/RC[-2]-1 -> -1.2642225031605614E-2
A55: 19.02.2016 | B55: 60432637 | C55: 58579284 | D55: 62388963 | E55: =+RC[-1]/RC[-2]-1 -> 6.503457775277699E-2 | F55: =+RC[-2]/RC[-4]-1 -> 3.2372011170056947E-2 | G55: 40125 | H55: 40637 | I55: =+RC[-1]/RC[-2]-1 -> 1.276012461059195E-2 | J55: 0 | K55: 836889 | L55: 727559 | M55: =+RC[-1]/RC[-2]-1 -> -0.13063859125881683 | N55: =+RC[-2]/RC[-4]-1 -> #DIV/0! | O55: 819 | P55: 0 | Q55: =+RC[-1]/RC[-2]-1 -> -1 | R55: 419515 | S55: 642876 | T55: 628748 | U55: =+RC[-1]/RC[-2]-1 -> -2.1976244252390864E-2 | V55: =+RC[-2]/RC[-4]-1 -> 0.49874974673134442 | W55: 673 | X55: 529 | Y55: =+RC[-1]/RC[-2]-1 -> -0.21396731054977713 | Z55: 743588 | AA55: 840000 | AB55: 591194 | AC55: =+RC[-1]/RC[-2]-1 -> -0.2961976190476191 | AD55: =+RC[-2]/RC[-4]-1 -> -0.20494413573107684 | AE55: 403 | AF55: 573 | AG55: =+RC[-1]/RC[-2]-1 -> 0.42183622828784118 | AH55: 1478715 | AI55: 2375556 | AJ55: 2467147 | AK55: =+RC[-1]/RC[-2]-1 -> 3.8555605508773461E-2 | AL55: =+RC[-2]/RC[-4]-1 -> 0.66843982782348177 | AM55: 2675 | AN55: 1599 | AO55: =+RC[-1]/RC[-2]-1 -> -0.40224299065420566 | AP55: 7972977 | AQ55: 6922609 | AR55: 7682173 | AS55: =+RC[-1]/RC[-2]-1 -> 0.10972221600266607 | AT55: =+RC[-2]/RC[-4]-1 -> -3.6473703611586972E-2 | AU55: 4009 | AV55: 4664 | AW55: =+RC[-1]/RC[-2]-1 -> 0.1633823896233475 | AX55: 4300860 | AY55: 4824561 | AZ55: 5120438 | BA55: =+RC[-1]/RC[-2]-1 -> 6.1327237856459993E-2 | BB55: =+RC[-2]/RC[-4]-1 -> 0.19056142259920117 | BC55: 2781 | BD55: 2542 | BE55: =+RC[-1]/RC[-2]-1 -> -8.5940309241280155E-2 | BF55: 1373173 | BG55: 1426176 | BH55: 1458475 | BI55: =+RC[-1]/RC[-2]-1 -> 2.2647274950637231E-2 | BJ55: =+RC[-2]/RC[-4]-1 -> 6.212035919727521E-2 | BK55: 1258 | BL55: 1427 | BM55: =+RC[-1]/RC[-2]-1 -> 0.13434022257551659 | BN55: 958799 | BO55: 0 | BP55: 796504 | BQ55: =+RC[-1]/RC[-2]-1 -> #DIV/0! | BR55: =+RC[-2]/RC[-4]-1 -> -0.16926905430648131 | BS55: 1202 | BT55: 1349 | BU55: =+RC[-1]/RC[-2]-1 -> 0.12229617304492502 | BV55: 8805935 | BW55: 9726609 | BX55: 10052860 | BY55: =+RC[-1]/RC[-2]-1 -> 3.3542111130405283E-2 | BZ55: =+RC[-2]/RC[-4]-1 -> 0.14160052282920543 | CA55: 2994 | CB55: 2926 | CC55: =+RC[-1]/RC[-2]-1 -> -2.2712090848363342E-2 | CD55: 1807065 | CE55: 2302688 | CF55: 2077406 | CG55: =+RC[-1]/RC[-2]-1 -> -9.7834357064439437E-2 | CH55: =+RC[-2]/RC[-4]-1 -> 0.14960225559124884 | CI55: 1574 | CJ55: 1380 | CK55: =+RC[-1]/RC[-2]-1 -> -0.12325285895806859 | CL55: 1300237 | CM55: 0 | CN55: 427086 | CO55: =+RC[-1]/RC[-2]-1 -> #DIV/0! | CP55: =+RC[-2]/RC[-4]-1 -> -0.67153218990076424 | CQ55: 583 | CR55: 1003 | CS55: =+RC[-1]/RC[-2]-1 -> 0.72041166380789012 | CT55: 2507145 | CU55: 2832084 | CV55: 1754709 | CW55: =+RC[-1]/RC[-2]-1 -> -0.38041774184664012 | CX55: =+RC[-2]/RC[-4]-1 -> -0.30011666656695168 | CY55: 1031 | CZ55: 1225 | DA55: =+RC[-1]/RC[-2]-1 -> 0.18816682832201748 | DB55: 0 | DC55: 0 | DD55: 0 | DE55: =+RC[-1]/RC[-2]-1 -> #DIV/0! | DF55: =+RC[-2]/RC[-4]-1 -> #DIV/0! | DG55: 0 | DH55: 0 | DI55: =+RC[-1]/RC[-2]-1 -> #DIV/0! | DJ55: 0 | DK55: 0 | DL55: 0 | DM55: =+RC[-1]/RC[-2]-1 -> #DIV/0! | DN55: =+RC[-2]/RC[-4]-1 -> #DIV/0! | DO55: 0 | DP55: 0 | DQ55: =+RC[-1]/RC[-2]-1 -> #DIV/0! | DR55: 1399878 | DS55: 0 | DT55: 586679 | DU55: =+RC[-1]/RC[-2]-1 -> #DIV/0! | DV55: =+RC[-2]/RC[-4]-1 -> -0.58090705047154101 | DW55: 901 | DX55: 1611 | DY55: =+RC[-1]/RC[-2]-1 -> 0.78801331853496115 | DZ55: 1442504 | EA55: 0 | EB55: 1367743 | EC55: =+RC[-1]/RC[-2]-1 -> #DIV/0! | ED55: =+RC[-2]/RC[-4]-1 -> -5.1827239300549555E-2 | EE55: 962 | EF55: 1099 | EG55: =+RC[-1]/RC[-2]-1 -> 0.14241164241164239 | EH55: 3635744 | EI55: 3840908 | EJ55: 3502190 | EK55: =+RC[-1]/RC[-2]-1 -> -8.8186959958426514E-2 | EL55: =+RC[-2]/RC[-4]-1 -> -3.6733609407042955E-2 | EM55: 3031 | EN55: 3102 | EO55: =+RC[-1]/RC[-2]-1 -> 2.3424612339161932E-2 | EP55: 2860395 | EQ55: 2724905 | ER55: 3823564 | ES55: =+RC[-1]/RC[-2]-1 -> 0.40319167090228825 | ET55: =+RC[-2]/RC[-4]-1 -> 0.33672587177645052 | EU55: 2115 | EV55: 1795 | EW55: =+RC[-1]/RC[-2]-1 -> -0.15130023640661938 | EX55: 458346 | EY55: 351746 | EZ55: 137798 | FA55: =+RC[-1]/RC[-2]-1 -> -0.60824572276585953 | FB55: =+RC[-2]/RC[-4]-1 -> -0.69935812682994936 | FC55: 223 | FD55: 437 | FE55: =+RC[-1]/RC[-2]-1 -> 0.95964125560538127 | FF55: 2618961 | FG55: 2533575 | FH55: 2702827 | FI55: =+RC[-1]/RC[-2]-1 -> 6.6803627285555001E-2 | FJ55: =+RC[-2]/RC[-4]-1 -> 3.2022622711831206E-2 | FK55: 1707 | FL55: 1749 | FM55: =+RC[-1]/RC[-2]-1 -> 2.4604569420035194E-2 | FN55: 545228 | FO55: 350000 | FP55: 165346 | FQ55: =+RC[-1]/RC[-2]-1 -> -0.52758285714285713 | FR55: =+RC[-2]/RC[-4]-1 -> -0.69673971256061684 | FS55: 310 | FT55: 675 | FU55: =+RC[-1]/RC[-2]-1 -> 1.1774193548387095 | FV55: 3811715 | FW55: 3900000 | FX55: 4163683 | FY55: =+RC[-1]/RC[-2]-1 -> 6.7611025641025613E-2 | FZ55: =+RC[-2]/RC[-4]-1 -> 9.233848805590128E-2 | GA55: 1759 | GB55: 1686 | GC55: =+RC[-1]/RC[-2]-1 -> -4.1500852757248463E-2 | GD55: 0 | GE55: 180000 | GF55: 0 | GG55: =+RC[-1]/RC[-2]-1 -> -1 | GH55: =+RC[-2]/RC[-4]-1 -> #DIV/0! | GI55: 0 | GJ55: 0 | GK55: =+RC[-1]/RC[-2]-1 -> #DIV/0! | GL55: 3104540 | GM55: 3992543 | GN55: 2952569 | GO55: =+RC[-1]/RC[-2]-1 -> -0.26047909815874248 | GP55: =+RC[-2]/RC[-4]-1 -> -4.8951213384269443E-2 | GQ55: 2085 | GR55: 2119 | GS55: =+RC[-1]/RC[-2]-1 -> 1.6306954436450916E-2 | GT55: 907939 | GU55: 850000 | GV55: 711479 | GW55: =+RC[-1]/RC[-2]-1 -> -0.16296588235294118 | GX55: =+RC[-2]/RC[-4]-1 -> -0.21638017532014819 | GY55: 747 | GZ55: 911 | HA55: =+RC[-1]/RC[-2]-1 -> 0.21954484605087021 | HB55: 2222497 | HC55: 2328281 | HD55: 1728874 | HE55: =+RC[-1]/RC[-2]-1 -> -0.25744615877550858 | HF55: =+RC[-2]/RC[-4]-1 -> -0.22210288697802516 | HG55: 1023 | HH55: 1295 | HI55: =+RC[-1]/RC[-2]-1 -> 0.26588465298142716 | HJ55: 1892304 | HK55: 0 | HL55: 1911613 | HM55: =+RC[-1]/RC[-2]-1 -> #DIV/0! | HN55: =+RC[-2]/RC[-4]-1 -> 1.0203962999602689E-2 | HO55: 1571 | HP55: 1467 | HQ55: =+RC[-1]/RC[-2]-1 -> -6.6199872692552564E-2 | HR55: 1077508 | HS55: 1364654 | HT55: 1328190 | HU55: =+RC[-1]/RC[-2]-1 -> -2.6720326177917642E-2 | HV55: =+RC[-2]/RC[-4]-1 -> 0.23264978079049059 | HW55: 1297 | HX55: 1325 | HY55: =+RC[-1]/RC[-2]-1 -> 2.1588280647648395E-2 | HZ55: 1869550 | IA55: 2429472 | IB55: 2500524 | IC55: =+RC[-1]/RC[-2]-1 -> 2.9245860829019588E-2 | ID55: =+RC[-2]/RC[-4]-1 -> 0.33750046802706524 | IE55: 1594 | IF55: 1373 | IG55: =+RC[-1]/RC[-2]-1 -> -0.1386449184441656 | IH55: 917519 | II55: 1003152 | IJ55: 1021585 | IK55: =+RC[-1]/RC[-2]-1 -> 1.8375081742348032E-2 | IL55: =+RC[-2]/RC[-4]-1 -> 0.11342108446800547 | IM55: 798 | IN55: 776 | IO55: =+RC[-1]/RC[-2]-1 -> -2.7568922305764465E-2
A56: 20.02.2016 | B56: 65469741 | C56: 70135464 | D56: 76229606 | E56: =+RC[-1]/RC[-2]-1 -> 8.6891019926809143E-2 | F56: =+RC[-2]/RC[-4]-1 -> 0.16434867215986082 | G56: 43019 | H56: 43340 | I56: =+RC[-1]/RC[-2]-1 -> 7.4618191961690616E-3 | J56: 0 | K56: 1195556 | L56: 949369 | M56: =+RC[-1]/RC[-2]-1 -> -0.20591841787419407 | N56: =+RC[-2]/RC[-4]-1 -> #DIV/0! | O56: 1003 | P56: 0 | Q56: =+RC[-1]/RC[-2]-1 -> -1 | R56: 468655 | S56: 642876 | T56: 669828 | U56: =+RC[-1]/RC[-2]-1 -> 4.1924103559628945E-2 | V56: =+RC[-2]/RC[-4]-1 -> 0.42925606256201254 | W56: 676 | X56: 531 | Y56: =+RC[-1]/RC[-2]-1 -> -0.21449704142011838 | Z56: 903580 | AA56: 840000 | AB56: 697601 | AC56: =+RC[-1]/RC[-2]-1 -> -0.16952261904761901 | AD56: =+RC[-2]/RC[-4]-1 -> -0.22795878616171228 | AE56: 445 | AF56: 582 | AG56: =+RC[-1]/RC[-2]-1 -> 0.30786516853932588 | AH56: 1524413 | AI56: 3197863 | AJ56: 3440950 | AK56: =+RC[-1]/RC[-2]-1 -> 7.601545156875078E-2 | AL56: =+RC[-2]/RC[-4]-1 -> 1.2572295040779631 | AM56: 3023 | AN56: 1631 | AO56: =+RC[-1]/RC[-2]-1 -> -0.46046973205425079 | AP56: 7825368 | AQ56: 9085924 | AR56: 9960334 | AS56: =+RC[-1]/RC[-2]-1 -> 9.6237873000038388E-2 | AT56: =+RC[-2]/RC[-4]-1 -> 0.27282627475155152 | AU56: 5101 | AV56: 4920 | AW56: =+RC[-1]/RC[-2]-1 -> -3.5483238580670484E-2 | AX56: 4669908 | AY56: 6432749 | AZ56: 6688795 | BA56: =+RC[-1]/RC[-2]-1 -> 3.9803511686838711E-2 | BB56: =+RC[-2]/RC[-4]-1 -> 0.43231836687146719 | BC56: 3246 | BD56: 2674 | BE56: =+RC[-1]/RC[-2]-1 -> -0.17621688231669752 | BF56: 1661160 | BG56: 1265156 | BH56: 1308418 | BI56: =+RC[-1]/RC[-2]-1 -> 3.4194992554277936E-2 | BJ56: =+RC[-2]/RC[-4]-1 -> -0.21234679380673749 | BK56: 961 | BL56: 1500 | BM56: =+RC[-1]/RC[-2]-1 -> 0.56087408949011452 | BN56: 1254435 | BO56: 0 | BP56: 952594 | BQ56: =+RC[-1]/RC[-2]-1 -> #DIV/0! | BR56: =+RC[-2]/RC[-4]-1 -> -0.24061908349177119 | BS56: 1594 | BT56: 1523 | BU56: =+RC[-1]/RC[-2]-1 -> -4.4542032622333805E-2 | BV56: 9645136 | BW56: 11262389 | BX56: 12589778 | BY56: =+RC[-1]/RC[-2]-1 -> 0.11786034028837045 | BZ56: =+RC[-2]/RC[-4]-1 -> 0.30529813161784336 | CA56: 2812 | CB56: 3172 | CC56: =+RC[-1]/RC[-2]-1 -> 0.12802275960170695 | CD56: 2232031 | CE56: 2512023 | CF56: 2468155 | CG56: =+RC[-1]/RC[-2]-1 -> -1.7463215902083662E-2 | CH56: =+RC[-2]/RC[-4]-1 -> 0.10578885329101606 | CI56: 1590 | CJ56: 1612 | CK56: =+RC[-1]/RC[-2]-1 -> 1.3836477987421381E-2 | CL56: 1503592 | CM56: 0 | CN56: 420599 | CO56: =+RC[-1]/RC[-2]-1 -> #DIV/0! | CP56: =+RC[-2]/RC[-4]-1 -> -0.72027052551490034 | CQ56: 596 | CR56: 1124 | CS56: =+RC[-1]/RC[-2]-1 -> 0.88590604026845643 | CT56: 2814674 | CU56: 3068091 | CV56: 1694988 | CW56: =+RC[-1]/RC[-2]-1 -> -0.44754311394283941 | CX56: =+RC[-2]/RC[-4]-1 -> -0.3978030848332702 | CY56: 979 | CZ56: 1296 | DA56: =+RC[-1]/RC[-2]-1 -> 0.32379979570990813 | DB56: 0 | DC56: 0 | DD56: 0 | DE56: =+RC[-1]/RC[-2]-1 -> #DIV/0! | DF56: =+RC[-2]/RC[-4]-1 -> #DIV/0! | DG56: 0 | DH56: 0 | DI56: =+RC[-1]/RC[-2]-1 -> #DIV/0! | DJ56: 0 | DK56: 0 | DL56: 0 | DM56: =+RC[-1]/RC[-2]-1 -> #DIV/0! | DN56: =+RC[-2]/RC[-4]-1 -> #DIV/0! | DO56: 0 | DP56: 0 | DQ56: =+RC[-1]/RC[-2]-1 -> #DIV/0! | DR56: 1480459 | DS56: 0 | DT56: 884044 | DU56: =+RC[-1]/RC[-2]-1 -> #DIV/0! | DV56: =+RC[-2]/RC[-4]-1 -> -0.40285816763584803 | DW56: 1125 | DX56: 1641 | DY56: =+RC[-1]/RC[-2]-1 -> 0.45866666666666656 | DZ56: 1584836 | EA56: 0 | EB56: 1295758 | EC56: =+RC[-1]/RC[-2]-1 -> #DIV/0! | ED56: =+RC[-2]/RC[-4]-1 -> -0.18240246940377425 | EE56: 894 | EF56: 1190 | EG56: =+RC[-1]/RC[-2]-1 -> 0.33109619686800884 | EH56: 3686060 | EI56: 3840908 | EJ56: 3606103 | EK56: =+RC[-1]/RC[-2]-1 -> -6.1132680085021596E-2 | EL56: =+RC[-2]/RC[-4]-1 -> -2.1691725039744369E-2 | EM56: 2666 | EN56: 3160 | EO56: =+RC[-1]/RC[-2]-1 -> 0.18529632408102015 | EP56: 2844835 | EQ56: 3179056 | ER56: 5213564 | ES56: =+RC[-1]/RC[-2]-1 -> 0.63997236915612676 | ET56: =+RC[-2]/RC[-4]-1 -> 0.83264196341791341 | EU56: 2462 | EV56: 1804 | EW56: =+RC[-1]/RC[-2]-1 -> -0.26726238830219329 | EX56: 419392 | EY56: 351746 | EZ56: 177789 | FA56: =+RC[-1]/RC[-2]-1 -> -0.49455288759502591 | FB56: =+RC[-2]/RC[-4]-1 -> -0.57607918129101177 | FC56: 236 | FD56: 435 | FE56: =+RC[-1]/RC[-2]-1 -> 0.84322033898305082 | FF56: 2803847 | FG56: 2800000 | FH56: 2849955 | FI56: =+RC[-1]/RC[-2]-1 -> 1.7841071428571498E-2 | FJ56: =+RC[-2]/RC[-4]-1 -> 1.6444549221123594E-2 | FK56: 1627 | FL56: 1926 | FM56: =+RC[-1]/RC[-2]-1 -> 0.1837738168408114 | FN56: 516841 | FO56: 550000 | FP56: 268098 | FQ56: =+RC[-1]/RC[-2]-1 -> -0.51254909090909084 | FR56: =+RC[-2]/RC[-4]-1 -> -0.48127567278911698 | FS56: 392 | FT56: 635 | FU56: =+RC[-1]/RC[-2]-1 -> 0.61989795918367352 | FV56: 3937015 | FW56: 5500000 | FX56: 5981060 | FY56: =+RC[-1]/RC[-2]-1 -> 8.7465454545454513E-2 | FZ56: =+RC[-2]/RC[-4]-1 -> 0.51918649027245256 | GA56: 1945 | GB56: 1736 | GC56: =+RC[-1]/RC[-2]-1 -> -0.10745501285347048 | GD56: 0 | GE56: 160000 | GF56: 0 | GG56: =+RC[-1]/RC[-2]-1 -> -1 | GH56: =+RC[-2]/RC[-4]-1 -> #DIV/0! | GI56: 0 | GJ56: 0 | GK56: =+RC[-1]/RC[-2]-1 -> #DIV/0! | GL56: 3425576 | GM56: 5133270 | GN56: 3963922 | GO56: =+RC[-1]/RC[-2]-1 -> -0.22779787542833319 | GP56: =+RC[-2]/RC[-4]-1 -> 0.15715488431726521 | GQ56: 2752 | GR56: 2358 | GS56: =+RC[-1]/RC[-2]-1 -> -0.14316860465116277 | GT56: 1183775 | GU56: 1100000 | GV56: 702510 | GW56: =+RC[-1]/RC[-2]-1 -> -0.36135454545454548 | GX56: =+RC[-2]/RC[-4]-1 -> -0.40655107600684248 | GY56: 702 | GZ56: 1062 | HA56: =+RC[-1]/RC[-2]-1 -> 0.51282051282051277 | HB56: 2405460 | HC56: 2642914 | HD56: 2010687 | HE56: =+RC[-1]/RC[-2]-1 -> -0.23921588065294597 | HF56: =+RC[-2]/RC[-4]-1 -> -0.16411538749345245 | HG56: 1031 | HH56: 1389 | HI56: =+RC[-1]/RC[-2]-1 -> 0.34723569350145489 | HJ56: 2312538 | HK56: 0 | HL56: 2057546 | HM56: =+RC[-1]/RC[-2]-1 -> #DIV/0! | HN56: =+RC[-2]/RC[-4]-1 -> -0.11026499888866692 | HO56: 1374 | HP56: 1737 | HQ56: =+RC[-1]/RC[-2]-1 -> 0.26419213973799116 | HR56: 1230901 | HS56: 1889521 | HT56: 1746474 | HU56: =+RC[-1]/RC[-2]-1 -> -7.5705430106360327E-2 | HV56: =+RC[-2]/RC[-4]-1 -> 0.41885821849198268 | HW56: 1522 | HX56: 1342 | HY56: =+RC[-1]/RC[-2]-1 -> -0.11826544021024965 | HZ56: 2125864 | IA56: 2429472 | IB56: 2503799 | IC56: =+RC[-1]/RC[-2]-1 -> 3.0593890359716047E-2 | ID56: =+RC[-2]/RC[-4]-1 -> 0.17777948166016255 | IE56: 1513 | IF56: 1482 | IG56: =+RC[-1]/RC[-2]-1 -> -2.0489094514210215E-2 | IH56: 1009390 | II56: 1055950 | IJ56: 1126888 | IK56: =+RC[-1]/RC[-2]-1 -> 6.7179317202519018E-2 | IL56: =+RC[-2]/RC[-4]-1 -> 0.11640495744954871 | IM56: 752 | IN56: 878 | IO56: =+RC[-1]/RC[-2]-1 -> 0.16755319148936176
A57: 21.02.2016 | B57: 79000197 | C57: 64163504 | D57: 69887064 | E57: =+RC[-1]/RC[-2]-1 -> 8.920273431451009E-2 | F57: =+RC[-2]/RC[-4]-1 -> -0.11535582626458518 | G57: 42722 | H57: 44835 | I57: =+RC[-1]/RC[-2]-1 -> 4.9459294976826884E-2 | J57: 0 | K57: 1195556 | L57: 976647 | M57: =+RC[-1]/RC[-2]-1 -> -0.18310225535232139 | N57: =+RC[-2]/RC[-4]-1 -> #DIV/0! | O57: 1005 | P57: 0 | Q57: =+RC[-1]/RC[-2]-1 -> -1 | R57: 448597 | S57: 543972 | T57: 526238 | U57: =+RC[-1]/RC[-2]-1 -> -3.2600942695579893E-2 | V57: =+RC[-2]/RC[-4]-1 -> 0.17307516546031287 | W57: 555 | X57: 497 | Y57: =+RC[-1]/RC[-2]-1 -> -0.10450450450450455 | Z57: 1048257 | AA57: 840000 | AB57: 617069 | AC57: =+RC[-1]/RC[-2]-1 -> -0.26539404761904761 | AD57: =+RC[-2]/RC[-4]-1 -> -0.41133805927363232 | AE57: 325 | AF57: 600 | AG57: =+RC[-1]/RC[-2]-1 -> 0.84615384615384626 | AH57: 2104902 | AI57: 3106496 | AJ57: 3283329 | AK57: =+RC[-1]/RC[-2]-1 -> 5.6923620696759381E-2 | AL57: =+RC[-2]/RC[-4]-1 -> 0.55984886707314629 | AM57: 3192 | AN57: 1914 | AO57: =+RC[-1]/RC[-2]-1 -> -0.40037593984962405 | AP57: 11070171 | AQ57: 8220598 | AR57: 10016048 | AS57: =+RC[-1]/RC[-2]-1 -> 0.21840868511025602 | AT57: =+RC[-2]/RC[-4]-1 -> -9.522192565950427E-2 | AU57: 5456 | AV57: 6026 | AW57: =+RC[-1]/RC[-2]-1 -> 0.10447214076246336 | AX57: 5963879 | AY57: 5360624 | AZ57: 6415520 | BA57: =+RC[-1]/RC[-2]-1 -> 0.1967860458036228 | BB57: =+RC[-2]/RC[-4]-1 -> 7.5729403631428438E-2 | BC57: 3364 | BD57: 3174 | BE57: =+RC[-1]/RC[-2]-1 -> -5.6480380499405514E-2 | BF57: 1467742 | BG57: 1265156 | BH57: 1146856 | BI57: =+RC[-1]/RC[-2]-1 -> -9.3506255355070844E-2 | BJ57: =+RC[-2]/RC[-4]-1 -> -0.21862561676370917 | BK57: 853 | BL57: 1238 | BM57: =+RC[-1]/RC[-2]-1 -> 0.45134818288393896 | BN57: 1336018 | BO57: 0 | BP57: 886780 | BQ57: =+RC[-1]/RC[-2]-1 -> #DIV/0! | BR57: =+RC[-2]/RC[-4]-1 -> -0.33625145768994136 | BS57: 1727 | BT57: 1782 | BU57: =+RC[-1]/RC[-2]-1 -> 3.1847133757961776E-2 | BV57: 12227561 | BW57: 9931380 | BX57: 10149780 | BY57: =+RC[-1]/RC[-2]-1 -> 2.1990901566549592E-2 | BZ57: =+RC[-2]/RC[-4]-1 -> -0.16992603839800924 | CA57: 2399 | CB57: 2931 | CC57: =+RC[-1]/RC[-2]-1 -> 0.22175906627761566 | CD57: 2317438 | CE57: 2407355 | CF57: 2146996 | CG57: =+RC[-1]/RC[-2]-1 -> -0.10815147745139375 | CH57: =+RC[-2]/RC[-4]-1 -> -7.3547598684409299E-2 | CI57: 1492 | CJ57: 1537 | CK57: =+RC[-1]/RC[-2]-1 -> 3.0160857908847261E-2 | CL57: 1731995 | CM57: 0 | CN57: 431517 | CO57: =+RC[-1]/RC[-2]-1 -> #DIV/0! | CP57: =+RC[-2]/RC[-4]-1 -> -0.75085551632654823 | CQ57: 574 | CR57: 1208 | CS57: =+RC[-1]/RC[-2]-1 -> 1.1045296167247387 | CT57: 3376592 | CU57: 2950088 | CV57: 2064171 | CW57: =+RC[-1]/RC[-2]-1 -> -0.30030188929957347 | CX57: =+RC[-2]/RC[-4]-1 -> -0.38868213867710399 | CY57: 980 | CZ57: 1211 | DA57: =+RC[-1]/RC[-2]-1 -> 0.23571428571428577 | DB57: 0 | DC57: 0 | DD57: 0 | DE57: =+RC[-1]/RC[-2]-1 -> #DIV/0! | DF57: =+RC[-2]/RC[-4]-1 -> #DIV/0! | DG57: 0 | DH57: 0 | DI57: =+RC[-1]/RC[-2]-1 -> #DIV/0! | DJ57: 0 | DK57: 0 | DL57: 0 | DM57: =+RC[-1]/RC[-2]-1 -> #DIV/0! | DN57: =+RC[-2]/RC[-4]-1 -> #DIV/0! | DO57: 0 | DP57: 0 | DQ57: =+RC[-1]/RC[-2]-1 -> #DIV/0! | DR57: 2049101 | DS57: 0 | DT57: 800849 | DU57: =+RC[-1]/RC[-2]-1 -> #DIV/0! | DV57: =+RC[-2]/RC[-4]-1 -> -0.60917055821064947 | DW57: 1334 | DX57: 1904 | DY57: =+RC[-1]/RC[-2]-1 -> 0.42728635682158922 | DZ57: 1921954 | EA57: 0 | EB57: 873350 | EC57: =+RC[-1]/RC[-2]-1 -> #DIV/0! | ED57: =+RC[-2]/RC[-4]-1 -> -0.54559266246746807 | EE57: 712 | EF57: 1256 | EG57: =+RC[-1]/RC[-2]-1 -> 0.76404494382022481 | EH57: 3678545 | EI57: 3401947 | EJ57: 2957529 | EK57: =+RC[-1]/RC[-2]-1 -> -0.13063636793871269 | EL57: =+RC[-2]/RC[-4]-1 -> -0.19600575771126905 | EM57: 2255 | EN57: 2492 | EO57: =+RC[-1]/RC[-2]-1 -> 0.10509977827050987 | EP57: 3542851 | EQ57: 3254747 | ER57: 4947525 | ES57: =+RC[-1]/RC[-2]-1 -> 0.52009511031118549 | ET57: =+RC[-2]/RC[-4]-1 -> 0.39648125196346107 | EU57: 2327 | EV57: 1840 | EW57: =+RC[-1]/RC[-2]-1 -> -0.20928233777395788 | EX57: 486514 | EY57: 310364 | EZ57: 117465 | FA57: =+RC[-1]/RC[-2]-1 -> -0.62152504800814534 | FB57: =+RC[-2]/RC[-4]-1 -> -0.75855782156320273 | FC57: 216 | FD57: 451 | FE57: =+RC[-1]/RC[-2]-1 -> 1.0879629629629628 | FF57: 2680655 | FG57: 2550000 | FH57: 2691426 | FI57: =+RC[-1]/RC[-2]-1 -> 5.5461176470588125E-2 | FJ57: =+RC[-2]/RC[-4]-1 -> 4.0180478278628584E-3 | FK57: 1705 | FL57: 1641 | FM57: =+RC[-1]/RC[-2]-1 -> -3.7536656891495657E-2 | FN57: 853839 | FO57: 550000 | FP57: 250333 | FQ57: =+RC[-1]/RC[-2]-1 -> -0.54484909090909084 | FR57: =+RC[-2]/RC[-4]-1 -> -0.70681475079025435 | FS57: 436 | FT57: 864 | FU57: =+RC[-1]/RC[-2]-1 -> 0.9816513761467891 | FV57: 5482648 | FW57: 5000000 | FX57: 5817321 | FY57: =+RC[-1]/RC[-2]-1 -> 0.16346419999999995 | FZ57: =+RC[-2]/RC[-4]-1 -> 6.1042219015337018E-2 | GA57: 2150 | GB57: 1916 | GC57: =+RC[-1]/RC[-2]-1 -> -0.10883720930232554 | GD57: 0 | GE57: 190000 | GF57: 0 | GG57: =+RC[-1]/RC[-2]-1 -> -1 | GH57: =+RC[-2]/RC[-4]-1 -> #DIV/0! | GI57: 0 | GJ57: 0 | GK57: =+RC[-1]/RC[-2]-1 -> #DIV/0! | GL57: 4637979 | GM57: 4676979 | GN57: 4204704 | GO57: =+RC[-1]/RC[-2]-1 -> -0.10097864454811534 | GP57: =+RC[-2]/RC[-4]-1 -> -9.3418922336647059E-2 | GQ57: 3398 | GR57: 2936 | GS57: =+RC[-1]/RC[-2]-1 -> -0.13596233078281339 | GT57: 1042486 | GU57: 1100000 | GV57: 624858 | GW57: =+RC[-1]/RC[-2]-1 -> -0.43194727272727274 | GX57: =+RC[-2]/RC[-4]-1 -> -0.40060777794617863 | GY57: 675 | GZ57: 951 | HA57: =+RC[-1]/RC[-2]-1 -> 0.40888888888888886 | HB57: 2663359 | HC57: 2139501 | HD57: 1584238 | HE57: =+RC[-1]/RC[-2]-1 -> -0.2595292079788698 | HF57: =+RC[-2]/RC[-4]-1 -> -0.40517294138717308 | HG57: 910 | HH57: 1400 | HI57: =+RC[-1]/RC[-2]-1 -> 0.53846153846153855 | HJ57: 2224492 | HK57: 0 | HL57: 1595498 | HM57: =+RC[-1]/RC[-2]-1 -> #DIV/0! | HN57: =+RC[-2]/RC[-4]-1 -> -0.28275849047782597 | HO57: 1198 | HP57: 1398 | HQ57: =+RC[-1]/RC[-2]-1 -> 0.1669449081803005 | HR57: 1552917 | HS57: 1784547 | HT57: 1632355 | HU57: =+RC[-1]/RC[-2]-1 -> -8.5283267966604459E-2 | HV57: =+RC[-2]/RC[-4]-1 -> 5.1154053951370182E-2 | HW57: 1535 | HX57: 1519 | HY57: =+RC[-1]/RC[-2]-1 -> -1.0423452768729691E-2 | HZ57: 2100268 | IA57: 2328244 | IB57: 2241165 | IC57: =+RC[-1]/RC[-2]-1 -> -3.7401148676856844E-2 | ID57: =+RC[-2]/RC[-4]-1 -> 6.7085248168329059E-2 | IE57: 1325 | IF57: 1398 | IG57: =+RC[-1]/RC[-2]-1 -> 5.5094339622641542E-2 | IH57: 989437 | II57: 1055950 | IJ57: 887497 | IK57: =+RC[-1]/RC[-2]-1 -> -0.15952743974620009 | IL57: =+RC[-2]/RC[-4]-1 -> -0.10302828780407447 | IM57: 624 | IN57: 751 | IO57: =+RC[-1]/RC[-2]-1 -> 0.20352564102564097
A58: 22.02.2016 | B58: 68984984 | C58: 54499396 | D58: 59891626 | E58: =+RC[-1]/RC[-2]-1 -> 9.8941096521510064E-2 | F58: =+RC[-2]/RC[-4]-1 -> -0.13181648342485663 | G58: 39657 | H58: 42959 | I58: =+RC[-1]/RC[-2]-1 -> 8.3263988703129233E-2 | J58: 0 | K58: 777111 | L58: 666247 | M58: =+RC[-1]/RC[-2]-1 -> -0.14266173043490571 | N58: =+RC[-2]/RC[-4]-1 -> #DIV/0! | O58: 773 | P58: 0 | Q58: =+RC[-1]/RC[-2]-1 -> -1 | R58: 374419 | S58: 642876 | T58: 614140 | U58: =+RC[-1]/RC[-2]-1 -> -4.4699133269868518E-2 | V58: =+RC[-2]/RC[-4]-1 -> 0.64024795750215668 | W58: 741 | X58: 438 | Y58: =+RC[-1]/RC[-2]-1 -> -0.40890688259109309 | Z58: 918219 | AA58: 756000 | AB58: 627062 | AC58: =+RC[-1]/RC[-2]-1 -> -0.17055291005291007 | AD58: =+RC[-2]/RC[-4]-1 -> -0.31708884263993664 | AE58: 482 | AF58: 443 | AG58: =+RC[-1]/RC[-2]-1 -> -8.0912863070539465E-2 | AH58: 2019511 | AI58: 2192821 | AJ58: 2682396 | AK58: =+RC[-1]/RC[-2]-1 -> 0.22326263748842234 | AL58: =+RC[-2]/RC[-4]-1 -> 0.32824035125334805 | AM58: 2637 | AN58: 1962 | AO58: =+RC[-1]/RC[-2]-1 -> -0.25597269624573382 | AP58: 10299803 | AQ58: 6057283 | AR58: 7528365 | AS58: =+RC[-1]/RC[-2]-1 -> 0.24286169228018561 | AT58: =+RC[-2]/RC[-4]-1 -> -0.26907679690572728 | AU58: 3958 | AV58: 5939 | AW58: =+RC[-1]/RC[-2]-1 -> 0.50050530570995444 | AX58: 5234307 | AY58: 4502924 | AZ58: 4607208 | BA58: =+RC[-1]/RC[-2]-1 -> 2.3159173905666686E-2 | BB58: =+RC[-2]/RC[-4]-1 -> -0.11980554445889402 | BC58: 2669 | BD58: 3177 | BE58: =+RC[-1]/RC[-2]-1 -> 0.1903334582240539 | BF58: 1253743 | BG58: 1437677 | BH58: 1293228 | BI58: =+RC[-1]/RC[-2]-1 -> -0.10047388947586977 | BJ58: =+RC[-2]/RC[-4]-1 -> 3.1493695278856926E-2 | BK58: 1307 | BL58: 926 | BM58: =+RC[-1]/RC[-2]-1 -> -0.29150726855394027 | BN58: 1227080 | BO58: 0 | BP58: 777785 | BQ58: =+RC[-1]/RC[-2]-1 -> #DIV/0! | BR58: =+RC[-2]/RC[-4]-1 -> -0.36614972128956547 | BS58: 1258 | BT58: 1713 | BU58: =+RC[-1]/RC[-2]-1 -> 0.36168521462639114 | BV58: 8931617 | BW58: 9726609 | BX58: 10226746 | BY58: =+RC[-1]/RC[-2]-1 -> 5.1419461808323907E-2 | BZ58: =+RC[-2]/RC[-4]-1 -> 0.14500498621918068 | CA58: 3017 | CB58: 2441 | CC58: =+RC[-1]/RC[-2]-1 -> -0.19091813059330465 | CD58: 2214865 | CE58: 2302688 | CF58: 2326274 | CG58: =+RC[-1]/RC[-2]-1 -> 1.0242811878986569E-2 | CH58: =+RC[-2]/RC[-4]-1 -> 5.0300582654021708E-2 | CI58: 1739 | CJ58: 1404 | CK58: =+RC[-1]/RC[-2]-1 -> -0.19263944795859689 | CL58: 1567247 | CM58: 0 | CN58: 264089 | CO58: =+RC[-1]/RC[-2]-1 -> #DIV/0! | CP58: =+RC[-2]/RC[-4]-1 -> -0.8314949717562069 | CQ58: 470 | CR58: 1064 | CS58: =+RC[-1]/RC[-2]-1 -> 1.2638297872340427 | CT58: 3378386 | CU58: 2478074 | CV58: 1301878 | CW58: =+RC[-1]/RC[-2]-1 -> -0.47464119312014086 | CX58: =+RC[-2]/RC[-4]-1 -> -0.61464498136092205 | CY58: 908 | CZ58: 1263 | DA58: =+RC[-1]/RC[-2]-1 -> 0.3909691629955947 | DB58: 0 | DC58: 0 | DD58: 0 | DE58: =+RC[-1]/RC[-2]-1 -> #DIV/0! | DF58: =+RC[-2]/RC[-4]-1 -> #DIV/0! | DG58: 0 | DH58: 0 | DI58: =+RC[-1]/RC[-2]-1 -> #DIV/0! | DJ58: 0 | DK58: 0 | DL58: 0 | DM58: =+RC[-1]/RC[-2]-1 -> #DIV/0! | DN58: =+RC[-2]/RC[-4]-1 -> #DIV/0! | DO58: 0 | DP58: 0 | DQ58: =+RC[-1]/RC[-2]-1 -> #DIV/0! | DR58: 1945631 | DS58: 0 | DT58: 633973 | DU58: =+RC[-1]/RC[-2]-1 -> #DIV/0! | DV58: =+RC[-2]/RC[-4]-1 -> -0.67415558243058427 | DW58: 1084 | DX58: 2104 | DY58: =+RC[-1]/RC[-2]-1 -> 0.94095940959409585 | DZ58: 1298608 | EA58: 0 | EB58: 842339 | EC58: =+RC[-1]/RC[-2]-1 -> #DIV/0! | ED58: =+RC[-2]/RC[-4]-1 -> -0.3513523711543437 | EE58: 826 | EF58: 1046 | EG58: =+RC[-1]/RC[-2]-1 -> 0.26634382566585946 | EH58: 3069111 | EI58: 3731168 | EJ58: 3720745 | EK58: =+RC[-1]/RC[-2]-1 -> -2.7934952272318236E-3 | EL58: =+RC[-2]/RC[-4]-1 -> 0.2123201148475895 | EM58: 3075 | EN58: 2255 | EO58: =+RC[-1]/RC[-2]-1 -> -0.26666666666666672 | EP58: 3411621 | EQ58: 2422138 | ER58: 3423100 | ES58: =+RC[-1]/RC[-2]-1 -> 0.41325556182182854 | ET58: =+RC[-2]/RC[-4]-1 -> 3.3646762052408352E-3 | EU58: 2016 | EV58: 1823 | EW58: =+RC[-1]/RC[-2]-1 -> -9.5734126984126977E-2 | EX58: 370855 | EY58: 316158 | EZ58: 148674 | FA58: =+RC[-1]/RC[-2]-1 -> -0.52974778433568026 | FB58: =+RC[-2]/RC[-4]-1 -> -0.59910477140661444 | FC58: 240 | FD58: 404 | FE58: =+RC[-1]/RC[-2]-1 -> 0.68333333333333335 | FF58: 2373177 | FG58: 2500000 | FH58: 2353101 | FI58: =+RC[-1]/RC[-2]-1 -> -5.8759600000000023E-2 | FJ58: =+RC[-2]/RC[-4]-1 -> -8.4595460009936341E-3 | FK58: 1689 | FL58: 1656 | FM58: =+RC[-1]/RC[-2]-1 -> -1.9538188277087087E-2 | FN58: 643691 | FO58: 400000 | FP58: 171512 | FQ58: =+RC[-1]/RC[-2]-1 -> -0.57122000000000006 | FR58: =+RC[-2]/RC[-4]-1 -> -0.73354917188526791 | FS58: 309 | FT58: 846 | FU58: =+RC[-1]/RC[-2]-1 -> 1.737864077669903 | FV58: 4735371 | FW58: 3500000 | FX58: 4282329 | FY58: =+RC[-1]/RC[-2]-1 -> 0.22352257142857135 | FZ58: =+RC[-2]/RC[-4]-1 -> -9.5671912506960943E-2 | GA58: 1671 | GB58: 2058 | GC58: =+RC[-1]/RC[-2]-1 -> 0.23159784560143626 | GD58: 0 | GE58: 144000 | GF58: 0 | GG58: =+RC[-1]/RC[-2]-1 -> -1 | GH58: =+RC[-2]/RC[-4]-1 -> #DIV/0! | GI58: 0 | GJ58: 0 | GK58: =+RC[-1]/RC[-2]-1 -> #DIV/0! | GL58: 4151589 | GM58: 3194035 | GN58: 2795386 | GO58: =+RC[-1]/RC[-2]-1 -> -0.12481046701116305 | GP58: =+RC[-2]/RC[-4]-1 -> -0.32667082411096093 | GQ58: 2006 | GR58: 3046 | GS58: =+RC[-1]/RC[-2]-1 -> 0.51844466600199413 | GT58: 719499 | GU58: 950000 | GV58: 699972 | GW58: =+RC[-1]/RC[-2]-1 -> -0.26318736842105261 | GX58: =+RC[-2]/RC[-4]-1 -> -2.7139718053812434E-2 | GY58: 738 | GZ58: 788 | HA58: =+RC[-1]/RC[-2]-1 -> 6.7750677506775103E-2 | HB58: 2532878 | HC58: 2139501 | HD58: 1604651 | HE58: =+RC[-1]/RC[-2]-1 -> -0.24998819818266038 | HF58: =+RC[-2]/RC[-4]-1 -> -0.36647126312439837 | HG58: 981 | HH58: 1263 | HI58: =+RC[-1]/RC[-2]-1 -> 0.28746177370030579 | HJ58: 2039028 | HK58: 0 | HL58: 1794727 | HM58: =+RC[-1]/RC[-2]-1 -> #DIV/0! | HN58: =+RC[-2]/RC[-4]-1 -> -0.11981247927934291 | HO58: 1402 | HP58: 1446 | HQ58: =+RC[-1]/RC[-2]-1 -> 3.1383737517831634E-2 | HR58: 1442031 | HS58: 1049734 | HT58: 1164993 | HU58: =+RC[-1]/RC[-2]-1 -> 0.10979829175772138 | HV58: =+RC[-2]/RC[-4]-1 -> -0.19211653563619646 | HW58: 1280 | HX58: 1537 | HY58: =+RC[-1]/RC[-2]-1 -> 0.20078124999999991 | HZ58: 2009734 | IA58: 2328244 | IB58: 2429368 | IC58: =+RC[-1]/RC[-2]-1 -> 4.3433592011833833E-2 | ID58: =+RC[-2]/RC[-4]-1 -> 0.20880076666862379 | IE58: 1616 | IF58: 1298 | IG58: =+RC[-1]/RC[-2]-1 -> -0.19678217821782173 | IH58: 822963 | II58: 950355 | IJ58: 911338 | IK58: =+RC[-1]/RC[-2]-1 -> -4.1055184641528686E-2 | IL58: =+RC[-2]/RC[-4]-1 -> 0.10738635880349423 | IM58: 765 | IN58: 619 | IO58: =+RC[-1]/RC[-2]-1 -> -0.19084967320261437
A59: 23.02.2016 | B59: 63218169 | C59: 54715503 | D59: 58510093 | E59: =+RC[-1]/RC[-2]-1 -> 6.935127691323606E-2 | F59: =+RC[-2]/RC[-4]-1 -> -7.4473463475349888E-2 | G59: 39680 | H59: 41668 | I59: =+RC[-1]/RC[-2]-1 -> 5.0100806451612856E-2 | J59: 0 | K59: 777111 | L59: 711557 | M59: =+RC[-1]/RC[-2]-1 -> -8.4356031506438556E-2 | N59: =+RC[-2]/RC[-4]-1 -> #DIV/0! | O59: 764 | P59: 0 | Q59: =+RC[-1]/RC[-2]-1 -> -1 | R59: 439655 | S59: 642876 | T59: 564416 | U59: =+RC[-1]/RC[-2]-1 -> -0.12204530889316134 | V59: =+RC[-2]/RC[-4]-1 -> 0.28377022892950143 | W59: 691 | X59: 552 | Y59: =+RC[-1]/RC[-2]-1 -> -0.20115774240231543 | Z59: 877548 | AA59: 900000 | AB59: 665191 | AC59: =+RC[-1]/RC[-2]-1 -> -0.2608988888888889 | AD59: =+RC[-2]/RC[-4]-1 -> -0.24198904219484285 | AE59: 489 | AF59: 579 | AG59: =+RC[-1]/RC[-2]-1 -> 0.18404907975460127 | AH59: 1403497 | AI59: 2147137 | AJ59: 2484523 | AK59: =+RC[-1]/RC[-2]-1 -> 0.15713296356962791 | AL59: =+RC[-2]/RC[-4]-1 -> 0.7702374853669085 | AM59: 2666 | AN59: 1471 | AO59: =+RC[-1]/RC[-2]-1 -> -0.44823705926481616 | AP59: 7372133 | AQ59: 5840951 | AR59: 6873941 | AS59: =+RC[-1]/RC[-2]-1 -> 0.17685305012830965 | AT59: =+RC[-2]/RC[-4]-1 -> -6.7577728182603325E-2 | AU59: 3900 | AV59: 4479 | AW59: =+RC[-1]/RC[-2]-1 -> 0.14846153846153842 | AX59: 4249373 | AY59: 4824561 | AZ59: 4874481 | BA59: =+RC[-1]/RC[-2]-1 -> 1.0347055410844685E-2 | BB59: =+RC[-2]/RC[-4]-1 -> 0.14710593774658043 | BC59: 2872 | BD59: 2529 | BE59: =+RC[-1]/RC[-2]-1 -> -0.11942896935933145 | BF59: 1635446 | BG59: 1437677 | BH59: 1582602 | BI59: =+RC[-1]/RC[-2]-1 -> 0.10080497914343756 | BJ59: =+RC[-2]/RC[-4]-1 -> -3.231167522498446E-2 | BK59: 1298 | BL59: 1467 | BM59: =+RC[-1]/RC[-2]-1 -> 0.13020030816640982 | BN59: 989675 | BO59: 0 | BP59: 794247 | BQ59: =+RC[-1]/RC[-2]-1 -> #DIV/0! | BR59: =+RC[-2]/RC[-4]-1 -> -0.19746684517644686 | BS59: 1441 | BT59: 1415 | BU59: =+RC[-1]/RC[-2]-1 -> -1.8043025676613422E-2 | BV59: 9798461 | BW59: 9726609 | BX59: 8852296 | BY59: =+RC[-1]/RC[-2]-1 -> -8.9888778298788385E-2 | BZ59: =+RC[-2]/RC[-4]-1 -> -9.6562613251203411E-2 | CA59: 2779 | CB59: 3047 | CC59: =+RC[-1]/RC[-2]-1 -> 9.6437567470313068E-2 | CD59: 2525420 | CE59: 2302688 | CF59: 2347040 | CG59: =+RC[-1]/RC[-2]-1 -> 1.9260968051251437E-2 | CH59: =+RC[-2]/RC[-4]-1 -> -7.0633795566678037E-2 | CI59: 1653 | CJ59: 1657 | CK59: =+RC[-1]/RC[-2]-1 -> 2.4198427102237741E-3 | CL59: 1527931 | CM59: 0 | CN59: 224253 | CO59: =+RC[-1]/RC[-2]-1 -> #DIV/0! | CP59: =+RC[-2]/RC[-4]-1 -> -0.85323093778449421 | CQ59: 431 | CR59: 1183 | CS59: =+RC[-1]/RC[-2]-1 -> 1.7447795823665895 | CT59: 2815551 | CU59: 2596077 | CV59: 1366918 | CW59: =+RC[-1]/RC[-2]-1 -> -0.47346785168544692 | CX59: =+RC[-2]/RC[-4]-1 -> -0.51451136917782703 | CY59: 865 | CZ59: 1329 | DA59: =+RC[-1]/RC[-2]-1 -> 0.53641618497109822 | DB59: 0 | DC59: 0 | DD59: 0 | DE59: =+RC[-1]/RC[-2]-1 -> #DIV/0! | DF59: =+RC[-2]/RC[-4]-1 -> #DIV/0! | DG59: 0 | DH59: 0 | DI59: =+RC[-1]/RC[-2]-1 -> #DIV/0! | DJ59: 0 | DK59: 0 | DL59: 0 | DM59: =+RC[-1]/RC[-2]-1 -> #DIV/0! | DN59: =+RC[-2]/RC[-4]-1 -> #DIV/0! | DO59: 0 | DP59: 0 | DQ59: =+RC[-1]/RC[-2]-1 -> #DIV/0! | DR59: 1551191 | DS59: 0 | DT59: 720849 | DU59: =+RC[-1]/RC[-2]-1 -> #DIV/0! | DV59: =+RC[-2]/RC[-4]-1 -> -0.53529320373828881 | DW59: 1198 | DX59: 1757 | DY59: =+RC[-1]/RC[-2]-1 -> 0.46661101836393981 | DZ59: 1690427 | EA59: 0 | EB59: 562896 | EC59: =+RC[-1]/RC[-2]-1 -> #DIV/0! | ED59: =+RC[-2]/RC[-4]-1 -> -0.66700957805335581 | EE59: 694 | EF59: 1166 | EG59: =+RC[-1]/RC[-2]-1 -> 0.68011527377521608 | EH59: 3443944 | EI59: 3731168 | EJ59: 3626959 | EK59: =+RC[-1]/RC[-2]-1 -> -2.7929324007924583E-2 | EL59: =+RC[-2]/RC[-4]-1 -> 5.3141107985495761E-2 | EM59: 3148 | EN59: 3192 | EO59: =+RC[-1]/RC[-2]-1 -> 1.3977128335451061E-2 | EP59: 2611057 | EQ59: 2515239 | ER59: 3753388 | ES59: =+RC[-1]/RC[-2]-1 -> 0.49225898612418151 | ET59: =+RC[-2]/RC[-4]-1 -> 0.43749753452337492 | EU59: 1965 | EV59: 1692 | EW59: =+RC[-1]/RC[-2]-1 -> -0.13893129770992363 | EX59: 410068 | EY59: 306226 | EZ59: 128713 | FA59: =+RC[-1]/RC[-2]-1 -> -0.57967971367552074 | FB59: =+RC[-2]/RC[-4]-1 -> -0.68611791215115536 | FC59: 225 | FD59: 448 | FE59: =+RC[-1]/RC[-2]-1 -> 0.99111111111111105 | FF59: 2505221 | FG59: 2500000 | FH59: 2466121 | FI59: =+RC[-1]/RC[-2]-1 -> -1.3551599999999997E-2 | FJ59: =+RC[-2]/RC[-4]-1 -> -1.5607405494365567E-2 | FK59: 1736 | FL59: 1789 | FM59: =+RC[-1]/RC[-2]-1 -> 3.0529953917050712E-2 | FN59: 585643 | FO59: 400000 | FP59: 222953 | FQ59: =+RC[-1]/RC[-2]-1 -> -0.4426175 | FR59: =+RC[-2]/RC[-4]-1 -> -0.61930220287786253 | FS59: 359 | FT59: 671 | FU59: =+RC[-1]/RC[-2]-1 -> 0.86908077994428967 | FV59: 3882620 | FW59: 3500000 | FX59: 4346364 | FY59: =+RC[-1]/RC[-2]-1 -> 0.24181828571428565 | FZ59: =+RC[-2]/RC[-4]-1 -> 0.11944099602845504 | GA59: 1788 | GB59: 1694 | GC59: =+RC[-1]/RC[-2]-1 -> -5.2572706935123059E-2 | GD59: 0 | GE59: 0 | GF59: 0 | GG59: =+RC[-1]/RC[-2]-1 -> #DIV/0! | GH59: =+RC[-2]/RC[-4]-1 -> #DIV/0! | GI59: 0 | GJ59: 0 | GK59: =+RC[-1]/RC[-2]-1 -> #DIV/0! | GL59: 3227167 | GM59: 3194035 | GN59: 2542962 | GO59: =+RC[-1]/RC[-2]-1 -> -0.20384028352851491 | GP59: =+RC[-2]/RC[-4]-1 -> -0.21201412880089565 | GQ59: 1984 | GR59: 2159 | GS59: =+RC[-1]/RC[-2]-1 -> 8.8205645161290258E-2 | GT59: 981710 | GU59: 950000 | GV59: 756469 | GW59: =+RC[-1]/RC[-2]-1 -> -0.2037168421052632 | GX59: =+RC[-2]/RC[-4]-1 -> -0.22943741023316455 | GY59: 776 | GZ59: 996 | HA59: =+RC[-1]/RC[-2]-1 -> 0.28350515463917536 | HB59: 2540172 | HC59: 2139501 | HD59: 1732410 | HE59: =+RC[-1]/RC[-2]-1 -> -0.19027380683626693 | HF59: =+RC[-2]/RC[-4]-1 -> -0.31799500191325625 | HG59: 1022 | HH59: 1396 | HI59: =+RC[-1]/RC[-2]-1 -> 0.36594911937377694 | HJ59: 1818138 | HK59: 0 | HL59: 1695182 | HM59: =+RC[-1]/RC[-2]-1 -> #DIV/0! | HN59: =+RC[-2]/RC[-4]-1 -> -6.7627429821058738E-2 | HO59: 1355 | HP59: 1375 | HQ59: =+RC[-1]/RC[-2]-1 -> 1.4760147601476037E-2 | HR59: 1106349 | HS59: 1154707 | HT59: 1067214 | HU59: =+RC[-1]/RC[-2]-1 -> -7.5770736645746517E-2 | HV59: =+RC[-2]/RC[-4]-1 -> -3.5373105593262122E-2 | HW59: 1196 | HX59: 1331 | HY59: =+RC[-1]/RC[-2]-1 -> 0.1128762541806021 | HZ59: 2294504 | IA59: 2125788 | IB59: 2587594 | IC59: =+RC[-1]/RC[-2]-1 -> 0.2172399129169984 | ID59: =+RC[-2]/RC[-4]-1 -> 0.12773566749066467 | IE59: 1637 | IF59: 1502 | IG59: =+RC[-1]/RC[-2]-1 -> -8.2467929138668294E-2 | IH59: 935268 | II59: 1003152 | IJ59: 958554 | IK59: =+RC[-1]/RC[-2]-1 -> -4.4457868797550093E-2 | IL59: =+RC[-2]/RC[-4]-1 -> 2.489767638794449E-2 | IM59: 748 | IN59: 792 | IO59: =+RC[-1]/RC[-2]-1 -> 5.8823529411764719E-2
A60: 24.02.2016 | B60: 54270641 | C60: 54486329 | D60: 52619166 | E60: =+RC[-1]/RC[-2]-1 -> -3.4268467600377384E-2 | F60: =+RC[-2]/RC[-4]-1 -> -3.0430357363938287E-2 | G60: 37510 | H60: 38967 | I60: =+RC[-1]/RC[-2]-1 -> 3.8842975206611507E-2 | J60: 0 | K60: 836889 | L60: 638105 | M60: =+RC[-1]/RC[-2]-1 -> -0.23752731843769004 | N60: =+RC[-2]/RC[-4]-1 -> #DIV/0! | O60: 860 | P60: 0 | Q60: =+RC[-1]/RC[-2]-1 -> -1 | R60: 397962 | S60: 642876 | T60: 517630 | U60: =+RC[-1]/RC[-2]-1 -> -0.1948213963501515 | V60: =+RC[-2]/RC[-4]-1 -> 0.30070207708273644 | W60: 662 | X60: 516 | Y60: =+RC[-1]/RC[-2]-1 -> -0.22054380664652573 | Z60: 629933 | AA60: 756000 | AB60: 492582 | AC60: =+RC[-1]/RC[-2]-1 -> -0.34843650793650793 | AD60: =+RC[-2]/RC[-4]-1 -> -0.21804064876740858 | AE60: 413 | AF60: 488 | AG60: =+RC[-1]/RC[-2]-1 -> 0.18159806295399505 | AH60: 1107397 | AI60: 2147137 | AJ60: 2303358 | AK60: =+RC[-1]/RC[-2]-1 -> 7.2757816571555445E-2 | AL60: =+RC[-2]/RC[-4]-1 -> 1.0799749322058845 | AM60: 2537 | AN60: 1361 | AO60: =+RC[-1]/RC[-2]-1 -> -0.4635396137169886 | AP60: 6610486 | AQ60: 6057283 | AR60: 6637008 | AS60: =+RC[-1]/RC[-2]-1 -> 9.5707101682388052E-2 | AT60: =+RC[-2]/RC[-4]-1 -> 4.0121104560240095E-3 | AU60: 3717 | AV60: 4218 | AW60: =+RC[-1]/RC[-2]-1 -> 0.13478611783696537 | AX60: 4118502 | AY60: 4610136 | AZ60: 4414077 | BA60: =+RC[-1]/RC[-2]-1 -> -4.2527812628521122E-2 | BB60: =+RC[-2]/RC[-4]-1 -> 7.1767598995945647E-2 | BC60: 2703 | BD60: 2532 | BE60: =+RC[-1]/RC[-2]-1 -> -6.326304106548275E-2 | BF60: 1217057 | BG60: 1437677 | BH60: 1360380 | BI60: =+RC[-1]/RC[-2]-1 -> -5.3765205953771211E-2 | BJ60: =+RC[-2]/RC[-4]-1 -> 0.11776194541422469 | BK60: 1212 | BL60: 1326 | BM60: =+RC[-1]/RC[-2]-1 -> 9.4059405940594143E-2 | BN60: 862791 | BO60: 0 | BP60: 644538 | BQ60: =+RC[-1]/RC[-2]-1 -> #DIV/0! | BR60: =+RC[-2]/RC[-4]-1 -> -0.25296160947436863 | BS60: 1239 | BT60: 1371 | BU60: =+RC[-1]/RC[-2]-1 -> 0.10653753026634383 | BV60: 7744478 | BW60: 9214682 | BX60: 8497191 | BY60: =+RC[-1]/RC[-2]-1 -> -7.7863891559144416E-2 | BZ60: =+RC[-2]/RC[-4]-1 -> 9.7193510008034112E-2 | CA60: 2735 | CB60: 2851 | CC60: =+RC[-1]/RC[-2]-1 -> 4.2413162705667196E-2 | CD60: 2051499 | CE60: 2302688 | CF60: 1875755 | CG60: =+RC[-1]/RC[-2]-1 -> -0.1854063598715936 | CH60: =+RC[-2]/RC[-4]-1 -> -8.566613973489634E-2 | CI60: 1492 | CJ60: 1480 | CK60: =+RC[-1]/RC[-2]-1 -> -8.0428954423592547E-3 | CL60: 1384513 | CM60: 0 | CN60: 129632 | CO60: =+RC[-1]/RC[-2]-1 -> #DIV/0! | CP60: =+RC[-2]/RC[-4]-1 -> -0.90636996546800208 | CQ60: 306 | CR60: 1062 | CS60: =+RC[-1]/RC[-2]-1 -> 2.4705882352941178 | CT60: 2557875 | CU60: 2596077 | CV60: 1323034 | CW60: =+RC[-1]/RC[-2]-1 -> -0.4903718187095375 | CX60: =+RC[-2]/RC[-4]-1 -> -0.48276049455114112 | CY60: 948 | CZ60: 1281 | DA60: =+RC[-1]/RC[-2]-1 -> 0.35126582278481022 | DB60: 0 | DC60: 0 | DD60: 0 | DE60: =+RC[-1]/RC[-2]-1 -> #DIV/0! | DF60: =+RC[-2]/RC[-4]-1 -> #DIV/0! | DG60: 0 | DH60: 0 | DI60: =+RC[-1]/RC[-2]-1 -> #DIV/0! | DJ60: 0 | DK60: 0 | DL60: 0 | DM60: =+RC[-1]/RC[-2]-1 -> #DIV/0! | DN60: =+RC[-2]/RC[-4]-1 -> #DIV/0! | DO60: 0 | DP60: 0 | DQ60: =+RC[-1]/RC[-2]-1 -> #DIV/0! | DR60: 1335711 | DS60: 0 | DT60: 588269 | DU60: =+RC[-1]/RC[-2]-1 -> #DIV/0! | DV60: =+RC[-2]/RC[-4]-1 -> -0.55958362250516758 | DW60: 966 | DX60: 1499 | DY60: =+RC[-1]/RC[-2]-1 -> 0.55175983436852993 | DZ60: 1343378 | EA60: 0 | EB60: 240515 | EC60: =+RC[-1]/RC[-2]-1 -> #DIV/0! | ED60: =+RC[-2]/RC[-4]-1 -> -0.82096252878936538 | EE60: 432 | EF60: 1025 | EG60: =+RC[-1]/RC[-2]-1 -> 1.3726851851851851 | EH60: 3211259 | EI60: 3731168 | EJ60: 2825411 | EK60: =+RC[-1]/RC[-2]-1 -> -0.2427542796250397 | EL60: =+RC[-2]/RC[-4]-1 -> -0.12015474304626317 | EM60: 2877 | EN60: 3019 | EO60: =+RC[-1]/RC[-2]-1 -> 4.9356969064998202E-2 | EP60: 2624097 | EQ60: 2526592 | ER60: 3132244 | ES60: =+RC[-1]/RC[-2]-1 -> 0.23971104159278589 | ET60: =+RC[-2]/RC[-4]-1 -> 0.19364642389362885 | EU60: 1856 | EV60: 1663 | EW60: =+RC[-1]/RC[-2]-1 -> -0.10398706896551724 | EX60: 352072 | EY60: 306226 | EZ60: 122214 | FA60: =+RC[-1]/RC[-2]-1 -> -0.6009026013467178 | FB60: =+RC[-2]/RC[-4]-1 -> -0.65287213978958847 | FC60: 237 | FD60: 403 | FE60: =+RC[-1]/RC[-2]-1 -> 0.70042194092827015 | FF60: 2279981 | FG60: 2500000 | FH60: 2030976 | FI60: =+RC[-1]/RC[-2]-1 -> -0.18760960000000004 | FJ60: =+RC[-2]/RC[-4]-1 -> -0.109213629411824 | FK60: 1658 | FL60: 1753 | FM60: =+RC[-1]/RC[-2]-1 -> 5.7297949336549969E-2 | FN60: 448542 | FO60: 400000 | FP60: 175370 | FQ60: =+RC[-1]/RC[-2]-1 -> -0.56157499999999994 | FR60: =+RC[-2]/RC[-4]-1 -> -0.60902212055950167 | FS60: 350 | FT60: 633 | FU60: =+RC[-1]/RC[-2]-1 -> 0.8085714285714285 | FV60: 3051384 | FW60: 3500000 | FX60: 4189577 | FY60: =+RC[-1]/RC[-2]-1 -> 0.19702200000000003 | FZ60: =+RC[-2]/RC[-4]-1 -> 0.37300877241278063 | GA60: 1706 | GB60: 1458 | GC60: =+RC[-1]/RC[-2]-1 -> -0.14536928487690504 | GD60: 0 | GE60: 200000 | GF60: 0 | GG60: =+RC[-1]/RC[-2]-1 -> -1 | GH60: =+RC[-2]/RC[-4]-1 -> #DIV/0! | GI60: 0 | GJ60: 0 | GK60: =+RC[-1]/RC[-2]-1 -> #DIV/0! | GL60: 2526176 | GM60: 3194035 | GN60: 2393920 | GO60: =+RC[-1]/RC[-2]-1 -> -0.25050289054440544 | GP60: =+RC[-2]/RC[-4]-1 -> -5.2354230267408153E-2 | GQ60: 1957 | GR60: 1967 | GS60: =+RC[-1]/RC[-2]-1 -> 5.1098620337250988E-3 | GT60: 749558 | GU60: 950000 | GV60: 596478 | GW60: =+RC[-1]/RC[-2]-1 -> -0.37212842105263155 | GX60: =+RC[-2]/RC[-4]-1 -> -0.20422702445974827 | GY60: 738 | GZ60: 900 | HA60: =+RC[-1]/RC[-2]-1 -> 0.21951219512195119 | HB60: 2023784 | HC60: 2139501 | HD60: 1527935 | HE60: =+RC[-1]/RC[-2]-1 -> -0.28584515735211158 | HF60: =+RC[-2]/RC[-4]-1 -> -0.24501083119542399 | HG60: 991 | HH60: 1261 | HI60: =+RC[-1]/RC[-2]-1 -> 0.272452068617558 | HJ60: 1922075 | HK60: 0 | HL60: 1618622 | HM60: =+RC[-1]/RC[-2]-1 -> #DIV/0! | HN60: =+RC[-2]/RC[-4]-1 -> -0.15787781434127179 | HO60: 1388 | HP60: 1360 | HQ60: =+RC[-1]/RC[-2]-1 -> -2.0172910662824228E-2 | HR60: 1071239 | HS60: 1207194 | HT60: 1132437 | HU60: =+RC[-1]/RC[-2]-1 -> -6.1926252118549296E-2 | HV60: =+RC[-2]/RC[-4]-1 -> 5.7128241223480369E-2 | HW60: 1208 | HX60: 1329 | HY60: =+RC[-1]/RC[-2]-1 -> 0.10016556291390732 | HZ60: 1801967 | IA60: 2227016 | IB60: 2314230 | IC60: =+RC[-1]/RC[-2]-1 -> 3.9161820121633717E-2 | ID60: =+RC[-2]/RC[-4]-1 -> 0.28427990079729537 | IE60: 1578 | IF60: 1430 | IG60: =+RC[-1]/RC[-2]-1 -> -9.3789607097591876E-2 | IH60: 846925 | II60: 1003152 | IJ60: 897678 | IK60: =+RC[-1]/RC[-2]-1 -> -0.10514259055457198 | IL60: =+RC[-2]/RC[-4]-1 -> 5.9926203618974494E-2 | IM60: 744 | IN60: 781 | IO60: =+RC[-1]/RC[-2]-1 -> 4.9731182795698992E-2
A61: 25.02.2016 | B61: 56249836 | C61: 54711423 | D61: 53464543 | E61: =+RC[-1]/RC[-2]-1 -> -2.279012190927665E-2 | F61: =+RC[-2]/RC[-4]-1 -> -4.9516464368002833E-2 | G61: 37760 | H61: 40419 | I61: =+RC[-1]/RC[-2]-1 -> 7.0418432203389836E-2 | J61: 0 | K61: 836889 | L61: 624525 | M61: =+RC[-1]/RC[-2]-1 -> -0.25375408208257011 | N61: =+RC[-2]/RC[-4]-1 -> #DIV/0! | O61: 794 | P61: 0 | Q61: =+RC[-1]/RC[-2]-1 -> -1 | R61: 437547 | S61: 642876 | T61: 547257 | U61: =+RC[-1]/RC[-2]-1 -> -0.14873630373509039 | V61: =+RC[-2]/RC[-4]-1 -> 0.25073877777701603 | W61: 703 | X61: 559 | Y61: =+RC[-1]/RC[-2]-1 -> -0.20483641536273112 | Z61: 740331 | AA61: 756000 | AB61: 646885 | AC61: =+RC[-1]/RC[-2]-1 -> -0.14433201058201062 | AD61: =+RC[-2]/RC[-4]-1 -> -0.12622191965485707 | AE61: 504 | AF61: 522 | AG61: =+RC[-1]/RC[-2]-1 -> 3.5714285714285809E-2 | AH61: 1258963 | AI61: 2147137 | AJ61: 2391255 | AK61: =+RC[-1]/RC[-2]-1 -> 0.11369465478914487 | AL61: =+RC[-2]/RC[-4]-1 -> 0.89938465228922526 | AM61: 2596 | AN61: 1428 | AO61: =+RC[-1]/RC[-2]-1 -> -0.44992295839753471 | AP61: 6559335 | AQ61: 6057283 | AR61: 6322186 | AS61: =+RC[-1]/RC[-2]-1 -> 4.3732974008313663E-2 | AT61: =+RC[-2]/RC[-4]-1 -> -3.6154427239956544E-2 | AU61: 3862 | AV61: 4239 | AW61: =+RC[-1]/RC[-2]-1 -> 9.7617814603832231E-2 | AX61: 4449266 | AY61: 4824561 | AZ61: 4546806 | BA61: =+RC[-1]/RC[-2]-1 -> -5.7571041178668847E-2 | BB61: =+RC[-2]/RC[-4]-1 -> 2.1922717140310244E-2 | BC61: 2669 | BD61: 2792 | BE61: =+RC[-1]/RC[-2]-1 -> 4.6084675908580008E-2 | BF61: 1375954 | BG61: 1437677 | BH61: 1354011 | BI61: =+RC[-1]/RC[-2]-1 -> -5.8195269173813013E-2 | BJ61: =+RC[-2]/RC[-4]-1 -> -1.5947480802410596E-2 | BK61: 1272 | BL61: 1409 | BM61: =+RC[-1]/RC[-2]-1 -> 0.10770440251572322 | BN61: 825301 | BO61: 0 | BP61: 747738 | BQ61: =+RC[-1]/RC[-2]-1 -> #DIV/0! | BR61: =+RC[-2]/RC[-4]-1 -> -9.3981468579342531E-2 | BS61: 1277 | BT61: 1380 | BU61: =+RC[-1]/RC[-2]-1 -> 8.0657791699295212E-2 | BV61: 8199096 | BW61: 9214682 | BX61: 8869016 | BY61: =+RC[-1]/RC[-2]-1 -> -3.7512526205462082E-2 | BZ61: =+RC[-2]/RC[-4]-1 -> 8.1706568626590093E-2 | CA61: 2783 | CB61: 3002 | CC61: =+RC[-1]/RC[-2]-1 -> 7.8692058929213049E-2 | CD61: 1937767 | CE61: 2302688 | CF61: 1874087 | CG61: =+RC[-1]/RC[-2]-1 -> -0.18613073069386732 | CH61: =+RC[-2]/RC[-4]-1 -> -3.2862568100292755E-2 | CI61: 1527 | CJ61: 1500 | CK61: =+RC[-1]/RC[-2]-1 -> -1.7681728880157177E-2 | CL61: 1392606 | CM61: 0 | CN61: 0 | CO61: =+RC[-1]/RC[-2]-1 -> #DIV/0! | CP61: =+RC[-2]/RC[-4]-1 -> -1 | CQ61: 0 | CR61: 1104 | CS61: =+RC[-1]/RC[-2]-1 -> #DIV/0! | CT61: 2390901 | CU61: 2596077 | CV61: 1630451 | CW61: =+RC[-1]/RC[-2]-1 -> -0.37195583952247946 | CX61: =+RC[-2]/RC[-4]-1 -> -0.31806001168597109 | CY61: 1075 | CZ61: 1317 | DA61: =+RC[-1]/RC[-2]-1 -> 0.22511627906976739 | DB61: 0 | DC61: 0 | DD61: 0 | DE61: =+RC[-1]/RC[-2]-1 -> #DIV/0! | DF61: =+RC[-2]/RC[-4]-1 -> #DIV/0! | DG61: 0 | DH61: 0 | DI61: =+RC[-1]/RC[-2]-1 -> #DIV/0! | DJ61: 0 | DK61: 0 | DL61: 0 | DM61: =+RC[-1]/RC[-2]-1 -> #DIV/0! | DN61: =+RC[-2]/RC[-4]-1 -> #DIV/0! | DO61: 0 | DP61: 0 | DQ61: =+RC[-1]/RC[-2]-1 -> #DIV/0! | DR61: 1391035 | DS61: 0 | DT61: 643912 | DU61: =+RC[-1]/RC[-2]-1 -> #DIV/0! | DV61: =+RC[-2]/RC[-4]-1 -> -0.5370986351889061 | DW61: 936 | DX61: 1532 | DY61: =+RC[-1]/RC[-2]-1 -> 0.63675213675213671 | DZ61: 1297054 | EA61: 0 | EB61: 0 | EC61: =+RC[-1]/RC[-2]-1 -> #DIV/0! | ED61: =+RC[-2]/RC[-4]-1 -> -1 | EE61: 0 | EF61: 1070 | EG61: =+RC[-1]/RC[-2]-1 -> #DIV/0! | EH61: 3114686 | EI61: 3731168 | EJ61: 3183224 | EK61: =+RC[-1]/RC[-2]-1 -> -0.14685589070232163 | EL61: =+RC[-2]/RC[-4]-1 -> 2.200478635727654E-2 | EM61: 3044 | EN61: 3064 | EO61: =+RC[-1]/RC[-2]-1 -> 6.5703022339027584E-3 | EP61: 2852401 | EQ61: 2573521 | ER61: 2869310 | ES61: =+RC[-1]/RC[-2]-1 -> 0.11493552996070355 | ET61: =+RC[-2]/RC[-4]-1 -> 5.9279883859246763E-3 | EU61: 1955 | EV61: 1683 | EW61: =+RC[-1]/RC[-2]-1 -> -0.13913043478260867 | EX61: 356396 | EY61: 306226 | EZ61: 107923 | FA61: =+RC[-1]/RC[-2]-1 -> -0.64757074840150741 | FB61: =+RC[-2]/RC[-4]-1 -> -0.69718234772556364 | FC61: 216 | FD61: 377 | FE61: =+RC[-1]/RC[-2]-1 -> 0.74537037037037046 | FF61: 2259636 | FG61: 2500000 | FH61: 2201983 | FI61: =+RC[-1]/RC[-2]-1 -> -0.11920679999999995 | FJ61: =+RC[-2]/RC[-4]-1 -> -2.551428637178732E-2 | FK61: 1682 | FL61: 1783 | FM61: =+RC[-1]/RC[-2]-1 -> 6.0047562425683765E-2 | FN61: 417348 | FO61: 400000 | FP61: 198691 | FQ61: =+RC[-1]/RC[-2]-1 -> -0.50327250000000001 | FR61: =+RC[-2]/RC[-4]-1 -> -0.52392008587557626 | FS61: 332 | FT61: 630 | FU61: =+RC[-1]/RC[-2]-1 -> 0.89759036144578319 | FV61: 3535425 | FW61: 3559555 | FX61: 3812869 | FY61: =+RC[-1]/RC[-2]-1 -> 7.1164513541720709E-2 | FZ61: =+RC[-2]/RC[-4]-1 -> 7.8475430818077063E-2 | GA61: 1628 | GB61: 1617 | GC61: =+RC[-1]/RC[-2]-1 -> -6.7567567567567988E-3 | GD61: 0 | GE61: 90000 | GF61: 0 | GG61: =+RC[-1]/RC[-2]-1 -> -1 | GH61: =+RC[-2]/RC[-4]-1 -> #DIV/0! | GI61: 0 | GJ61: 0 | GK61: =+RC[-1]/RC[-2]-1 -> #DIV/0! | GL61: 2653993 | GM61: 3194035 | GN61: 2492561 | GO61: =+RC[-1]/RC[-2]-1 -> -0.21962001042568413 | GP61: =+RC[-2]/RC[-4]-1 -> -6.0826083565405087E-2 | GQ61: 2020 | GR61: 2022 | GS61: =+RC[-1]/RC[-2]-1 -> 9.9009900990099098E-4 | GT61: 841489 | GU61: 950000 | GV61: 767111 | GW61: =+RC[-1]/RC[-2]-1 -> -0.19251473684210529 | GX61: =+RC[-2]/RC[-4]-1 -> -8.8388558852225074E-2 | GY61: 755 | GZ61: 961 | HA61: =+RC[-1]/RC[-2]-1 -> 0.2728476821192054 | HB61: 2315076 | HC61: 2202428 | HD61: 1641314 | HE61: =+RC[-1]/RC[-2]-1 -> -0.25477064403467442 | HF61: =+RC[-2]/RC[-4]-1 -> -0.2910323462383092 | HG61: 971 | HH61: 1360 | HI61: =+RC[-1]/RC[-2]-1 -> 0.40061791967044291 | HJ61: 1729258 | HK61: 0 | HL61: 1569503 | HM61: =+RC[-1]/RC[-2]-1 -> #DIV/0! | HN61: =+RC[-2]/RC[-4]-1 -> -9.2383554102395404E-2 | HO61: 1444 | HP61: 1431 | HQ61: =+RC[-1]/RC[-2]-1 -> -9.0027700831024626E-3 | HR61: 1052381 | HS61: 1259680 | HT61: 1117712 | HU61: =+RC[-1]/RC[-2]-1 -> -0.11270163851136794 | HV61: =+RC[-2]/RC[-4]-1 -> 6.2079227960216032E-2 | HW61: 1286 | HX61: 1335 | HY61: =+RC[-1]/RC[-2]-1 -> 3.8102643856920748E-2 | HZ61: 1937680 | IA61: 2125788 | IB61: 2340350 | IC61: =+RC[-1]/RC[-2]-1 -> 0.10093292463782833 | ID61: =+RC[-2]/RC[-4]-1 -> 0.20781037116551748 | IE61: 1654 | IF61: 1482 | IG61: =+RC[-1]/RC[-2]-1 -> -0.10399032648125761 | IH61: 928911 | II61: 1003152 | IJ61: 963863 | IK61: =+RC[-1]/RC[-2]-1 -> -3.9165550185814357E-2 | IL61: =+RC[-2]/RC[-4]-1 -> 3.7626855532984393E-2 | IM61: 775 | IN61: 820 | IO61: =+RC[-1]/RC[-2]-1 -> 5.8064516129032295E-2
A62: 26.02.2016 | B62: 59224721 | C62: 58714674 | D62: 59536034 | E62: =+RC[-1]/RC[-2]-1 -> 1.398900724544605E-2 | F62: =+RC[-2]/RC[-4]-1 -> 5.2564705201396666E-3 | G62: 40372 | H62: 40453 | I62: =+RC[-1]/RC[-2]-1 -> 2.0063410284354433E-3 | J62: 0 | K62: 836889 | L62: 759993 | M62: =+RC[-1]/RC[-2]-1 -> -9.1883152962937698E-2 | N62: =+RC[-2]/RC[-4]-1 -> #DIV/0! | O62: 935 | P62: 0 | Q62: =+RC[-1]/RC[-2]-1 -> -1 | R62: 416010 | S62: 642876 | T62: 596295 | U62: =+RC[-1]/RC[-2]-1 -> -7.2457207921900912E-2 | V62: =+RC[-2]/RC[-4]-1 -> 0.43336698637051985 | W62: 694 | X62: 526 | Y62: =+RC[-1]/RC[-2]-1 -> -0.24207492795389052 | Z62: 675972 | AA62: 840000 | AB62: 648724 | AC62: =+RC[-1]/RC[-2]-1 -> -0.22770952380952381 | AD62: =+RC[-2]/RC[-4]-1 -> -4.0309361926233578E-2 | AE62: 499 | AF62: 518 | AG62: =+RC[-1]/RC[-2]-1 -> 3.8076152304609145E-2 | AH62: 1101218 | AI62: 2375556 | AJ62: 2468572 | AK62: =+RC[-1]/RC[-2]-1 -> 3.9155465078491103E-2 | AL62: =+RC[-2]/RC[-4]-1 -> 1.241674218910334 | AM62: 2791 | AN62: 1403 | AO62: =+RC[-1]/RC[-2]-1 -> -0.49731279111429594 | AP62: 7413501 | AQ62: 6922609 | AR62: 7780960 | AS62: =+RC[-1]/RC[-2]-1 -> 0.12399241384281567 | AT62: =+RC[-2]/RC[-4]-1 -> 4.9566190117192876E-2 | AU62: 4339 | AV62: 4266 | AW62: =+RC[-1]/RC[-2]-1 -> -1.6824153030652211E-2 | AX62: 4252622 | AY62: 4824561 | AZ62: 4863338 | BA62: =+RC[-1]/RC[-2]-1 -> 8.0374152176747593E-3 | BB62: =+RC[-2]/RC[-4]-1 -> 0.1436092838723968 | BC62: 2834 | BD62: 2603 | BE62: =+RC[-1]/RC[-2]-1 -> -8.1510232886379708E-2 | BF62: 1561519 | BG62: 1426176 | BH62: 1353855 | BI62: =+RC[-1]/RC[-2]-1 -> -5.0709730075390369E-2 | BJ62: =+RC[-2]/RC[-4]-1 -> -0.13298845547188343 | BK62: 1332 | BL62: 1388 | BM62: =+RC[-1]/RC[-2]-1 -> 4.2042042042041983E-2 | BN62: 1049401 | BO62: 0 | BP62: 861803 | BQ62: =+RC[-1]/RC[-2]-1 -> #DIV/0! | BR62: =+RC[-2]/RC[-4]-1 -> -0.1787667440759062 | BS62: 1365 | BT62: 1437 | BU62: =+RC[-1]/RC[-2]-1 -> 5.2747252747252782E-2 | BV62: 8270484 | BW62: 9726609 | BX62: 9821663 | BY62: =+RC[-1]/RC[-2]-1 -> 9.7725733603561959E-3 | BZ62: =+RC[-2]/RC[-4]-1 -> 0.18755601244135178 | CA62: 2969 | CB62: 2920 | CC62: =+RC[-1]/RC[-2]-1 -> -1.650387335803305E-2 | CD62: 1803653 | CE62: 2302688 | CF62: 2402874 | CG62: =+RC[-1]/RC[-2]-1 -> 4.3508282494198136E-2 | CH62: =+RC[-2]/RC[-4]-1 -> 0.33222632069472335 | CI62: 1779 | CJ62: 1395 | CK62: =+RC[-1]/RC[-2]-1 -> -0.21585160202360876 | CL62: 1319057 | CM62: 0 | CN62: 0 | CO62: =+RC[-1]/RC[-2]-1 -> #DIV/0! | CP62: =+RC[-2]/RC[-4]-1 -> -1 | CQ62: 0 | CR62: 1089 | CS62: =+RC[-1]/RC[-2]-1 -> #DIV/0! | CT62: 2757167 | CU62: 2832084 | CV62: 2133361 | CW62: =+RC[-1]/RC[-2]-1 -> -0.24671690528953238 | CX62: =+RC[-2]/RC[-4]-1 -> -0.22624889968580064 | CY62: 1103 | CZ62: 1316 | DA62: =+RC[-1]/RC[-2]-1 -> 0.19310970081595658 | DB62: 0 | DC62: 0 | DD62: 0 | DE62: =+RC[-1]/RC[-2]-1 -> #DIV/0! | DF62: =+RC[-2]/RC[-4]-1 -> #DIV/0! | DG62: 0 | DH62: 0 | DI62: =+RC[-1]/RC[-2]-1 -> #DIV/0! | DJ62: 0 | DK62: 0 | DL62: 0 | DM62: =+RC[-1]/RC[-2]-1 -> #DIV/0! | DN62: =+RC[-2]/RC[-4]-1 -> #DIV/0! | DO62: 0 | DP62: 0 | DQ62: =+RC[-1]/RC[-2]-1 -> #DIV/0! | DR62: 1663510 | DS62: 0 | DT62: 571331 | DU62: =+RC[-1]/RC[-2]-1 -> #DIV/0! | DV62: =+RC[-2]/RC[-4]-1 -> -0.65655090741865085 | DW62: 988 | DX62: 1516 | DY62: =+RC[-1]/RC[-2]-1 -> 0.53441295546558698 | DZ62: 1526617 | EA62: 0 | EB62: 0 | EC62: =+RC[-1]/RC[-2]-1 -> #DIV/0! | ED62: =+RC[-2]/RC[-4]-1 -> -1 | EE62: 0 | EF62: 1123 | EG62: =+RC[-1]/RC[-2]-1 -> #DIV/0! | EH62: 3596741 | EI62: 3909865 | EJ62: 3638525 | EK62: =+RC[-1]/RC[-2]-1 -> -6.9398815560128058E-2 | EL62: =+RC[-2]/RC[-4]-1 -> 1.1617183444679435E-2 | EM62: 3139 | EN62: 3100 | EO62: =+RC[-1]/RC[-2]-1 -> -1.2424338961452674E-2 | EP62: 2945112 | EQ62: 2724905 | ER62: 3261292 | ES62: =+RC[-1]/RC[-2]-1 -> 0.19684612858062933 | ET62: =+RC[-2]/RC[-4]-1 -> 0.1073575470134922 | EU62: 2279 | EV62: 1773 | EW62: =+RC[-1]/RC[-2]-1 -> -0.22202720491443617 | EX62: 346497 | EY62: 351746 | EZ62: 139367 | FA62: =+RC[-1]/RC[-2]-1 -> -0.60378511767013698 | FB62: =+RC[-2]/RC[-4]-1 -> -0.59778295338776388 | FC62: 214 | FD62: 430 | FE62: =+RC[-1]/RC[-2]-1 -> 1.0093457943925235 | FF62: 2230807 | FG62: 2550000 | FH62: 2539781 | FI62: =+RC[-1]/RC[-2]-1 -> -4.0074509803921243E-3 | FJ62: =+RC[-2]/RC[-4]-1 -> 0.13850324120374369 | FK62: 1778 | FL62: 1735 | FM62: =+RC[-1]/RC[-2]-1 -> -2.4184476940382504E-2 | FN62: 524398 | FO62: 400000 | FP62: 178652 | FQ62: =+RC[-1]/RC[-2]-1 -> -0.55336999999999992 | FR62: =+RC[-2]/RC[-4]-1 -> -0.65931982959507862 | FS62: 322 | FT62: 614 | FU62: =+RC[-1]/RC[-2]-1 -> 0.9068322981366459 | FV62: 3294388 | FW62: 3800000 | FX62: 4067646 | FY62: =+RC[-1]/RC[-2]-1 -> 7.0433157894736809E-2 | FZ62: =+RC[-2]/RC[-4]-1 -> 0.23471977192728977 | GA62: 1672 | GB62: 1630 | GC62: =+RC[-1]/RC[-2]-1 -> -2.5119617224880431E-2 | GD62: 0 | GE62: 180000 | GF62: 0 | GG62: =+RC[-1]/RC[-2]-1 -> -1 | GH62: =+RC[-2]/RC[-4]-1 -> #DIV/0! | GI62: 0 | GJ62: 0 | GK62: =+RC[-1]/RC[-2]-1 -> #DIV/0! | GL62: 3071188 | GM62: 3992543 | GN62: 2648072 | GO62: =+RC[-1]/RC[-2]-1 -> -0.33674552785029488 | GP62: =+RC[-2]/RC[-4]-1 -> -0.13776948854970783 | GQ62: 2157 | GR62: 2120 | GS62: =+RC[-1]/RC[-2]-1 -> -1.715345387111733E-2 | GT62: 926597 | GU62: 950000 | GV62: 688372 | GW62: =+RC[-1]/RC[-2]-1 -> -0.27539789473684206 | GX62: =+RC[-2]/RC[-4]-1 -> -0.2570966666199006 | GY62: 787 | GZ62: 1035 | HA62: =+RC[-1]/RC[-2]-1 -> 0.31512071156289712 | HB62: 2145106 | HC62: 2328281 | HD62: 1781061 | HE62: =+RC[-1]/RC[-2]-1 -> -0.23503176807266823 | HF62: =+RC[-2]/RC[-4]-1 -> -0.169709562138188 | HG62: 1063 | HH62: 1330 | HI62: =+RC[-1]/RC[-2]-1 -> 0.25117591721542798 | HJ62: 1966251 | HK62: 0 | HL62: 1786332 | HM62: =+RC[-1]/RC[-2]-1 -> #DIV/0! | HN62: =+RC[-2]/RC[-4]-1 -> -9.1503577111975987E-2 | HO62: 1476 | HP62: 1512 | HQ62: =+RC[-1]/RC[-2]-1 -> 2.4390243902439046E-2 | HR62: 1221074 | HS62: 1364654 | HT62: 1110697 | HU62: =+RC[-1]/RC[-2]-1 -> -0.18609625590076317 | HV62: =+RC[-2]/RC[-4]-1 -> -9.0393375012489008E-2 | HW62: 1345 | HX62: 1357 | HY62: =+RC[-1]/RC[-2]-1 -> 8.9219330855019319E-3 | HZ62: 2119544 | IA62: 2429480 | IB62: 2507603 | IC62: =+RC[-1]/RC[-2]-1 -> 3.2156263891861547E-2 | ID62: =+RC[-2]/RC[-4]-1 -> 0.18308607889244111 | IE62: 1740 | IF62: 1487 | IG62: =+RC[-1]/RC[-2]-1 -> -0.14540229885057476 | IH62: 1026287 | II62: 1003152 | IJ62: 925865 | IK62: =+RC[-1]/RC[-2]-1 -> -7.7044156817710596E-2 | IL62: =+RC[-2]/RC[-4]-1 -> -9.7849821736025078E-2 | IM62: 772 | IN62: 830 | IO62: =+RC[-1]/RC[-2]-1 -> 7.5129533678756522E-2
A63: 27.02.2016 | B63: 69313602 | C63: 69980490 | D63: 73860647 | E63: =+RC[-1]/RC[-2]-1 -> 5.5446267952682149E-2 | F63: =+RC[-2]/RC[-4]-1 -> 6.5601048983141785E-2 | G63: 43067 | H63: 43449 | I63: =+RC[-1]/RC[-2]-1 -> 8.869900387767915E-3 | J63: 0 | K63: 1195556 | L63: 976474 | M63: =+RC[-1]/RC[-2]-1 -> -0.18324695790075918 | N63: =+RC[-2]/RC[-4]-1 -> #DIV/0! | O63: 1061 | P63: 0 | Q63: =+RC[-1]/RC[-2]-1 -> -1 | R63: 423534 | S63: 642876 | T63: 611434 | U63: =+RC[-1]/RC[-2]-1 -> -4.8908343133045928E-2 | V63: =+RC[-2]/RC[-4]-1 -> 0.44364797159141878 | W63: 712 | X63: 532 | Y63: =+RC[-1]/RC[-2]-1 -> -0.2528089887640449 | Z63: 723979 | AA63: 840000 | AB63: 906857 | AC63: =+RC[-1]/RC[-2]-1 -> 7.9591666666666727E-2 | AD63: =+RC[-2]/RC[-4]-1 -> 0.25260124948375573 | AE63: 486 | AF63: 490 | AG63: =+RC[-1]/RC[-2]-1 -> 8.2304526748970819E-3 | AH63: 1582642 | AI63: 3197863 | AJ63: 3169002 | AK63: =+RC[-1]/RC[-2]-1 -> -9.0250895676269316E-3 | AL63: =+RC[-2]/RC[-4]-1 -> 1.0023492362770607 | AM63: 3027 | AN63: 1587 | AO63: =+RC[-1]/RC[-2]-1 -> -0.47571853320118929 | AP63: 9282274 | AQ63: 9085924 | AR63: 9899839 | AS63: =+RC[-1]/RC[-2]-1 -> 8.9579771963754107E-2 | AT63: =+RC[-2]/RC[-4]-1 -> 6.6531649464344644E-2 | AU63: 5538 | AV63: 4865 | AW63: =+RC[-1]/RC[-2]-1 -> -0.12152401589021311 | AX63: 5059007 | AY63: 6432749 | AZ63: 6610266 | BA63: =+RC[-1]/RC[-2]-1 -> 2.7595822563572847E-2 | BB63: =+RC[-2]/RC[-4]-1 -> 0.30663310013210099 | BC63: 3406 | BD63: 2969 | BE63: =+RC[-1]/RC[-2]-1 -> -0.12830299471520845 | BF63: 1732733 | BG63: 1265156 | BH63: 1145731 | BI63: =+RC[-1]/RC[-2]-1 -> -9.4395473759757653E-2 | BJ63: =+RC[-2]/RC[-4]-1 -> -0.33877233249438887 | BK63: 958 | BL63: 1484 | BM63: =+RC[-1]/RC[-2]-1 -> 0.54906054279749483 | BN63: 1069490 | BO63: 0 | BP63: 891654 | BQ63: =+RC[-1]/RC[-2]-1 -> #DIV/0! | BR63: =+RC[-2]/RC[-4]-1 -> -0.16628112464819678 | BS63: 1551 | BT63: 1520 | BU63: =+RC[-1]/RC[-2]-1 -> -1.9987105093488111E-2 | BV63: 10376848 | BW63: 11262389 | BX63: 12130320 | BY63: =+RC[-1]/RC[-2]-1 -> 7.7064555308824723E-2 | BZ63: =+RC[-2]/RC[-4]-1 -> 0.16897925073201425 | CA63: 2788 | CB63: 3239 | CC63: =+RC[-1]/RC[-2]-1 -> 0.16176470588235303 | CD63: 2058771 | CE63: 2512023 | CF63: 2654421 | CG63: =+RC[-1]/RC[-2]-1 -> 5.66865828855867E-2 | CH63: =+RC[-2]/RC[-4]-1 -> 0.28932309615785345 | CI63: 1759 | CJ63: 1522 | CK63: =+RC[-1]/RC[-2]-1 -> -0.13473564525298465 | CL63: 1641236 | CM63: 0 | CN63: 0 | CO63: =+RC[-1]/RC[-2]-1 -> #DIV/0! | CP63: =+RC[-2]/RC[-4]-1 -> -1 | CQ63: 0 | CR63: 1185 | CS63: =+RC[-1]/RC[-2]-1 -> #DIV/0! | CT63: 3285278 | CU63: 3068091 | CV63: 2392017 | CW63: =+RC[-1]/RC[-2]-1 -> -0.22035656699882766 | CX63: =+RC[-2]/RC[-4]-1 -> -0.27189814682349556 | CY63: 978 | CZ63: 1357 | DA63: =+RC[-1]/RC[-2]-1 -> 0.38752556237218805 | DB63: 0 | DC63: 0 | DD63: 0 | DE63: =+RC[-1]/RC[-2]-1 -> #DIV/0! | DF63: =+RC[-2]/RC[-4]-1 -> #DIV/0! | DG63: 0 | DH63: 0 | DI63: =+RC[-1]/RC[-2]-1 -> #DIV/0! | DJ63: 0 | DK63: 0 | DL63: 0 | DM63: =+RC[-1]/RC[-2]-1 -> #DIV/0! | DN63: =+RC[-2]/RC[-4]-1 -> #DIV/0! | DO63: 0 | DP63: 0 | DQ63: =+RC[-1]/RC[-2]-1 -> #DIV/0! | DR63: 1633565 | DS63: 0 | DT63: 840112 | DU63: =+RC[-1]/RC[-2]-1 -> #DIV/0! | DV63: =+RC[-2]/RC[-4]-1 -> -0.48571865827193894 | DW63: 1223 | DX63: 1744 | DY63: =+RC[-1]/RC[-2]-1 -> 0.4260016353229763 | DZ63: 1615186 | EA63: 0 | EB63: 0 | EC63: =+RC[-1]/RC[-2]-1 -> #DIV/0! | ED63: =+RC[-2]/RC[-4]-1 -> -1 | EE63: 0 | EF63: 1102 | EG63: =+RC[-1]/RC[-2]-1 -> #DIV/0! | EH63: 4334086 | EI63: 3840908 | EJ63: 3522262 | EK63: =+RC[-1]/RC[-2]-1 -> -8.2961112320315888E-2 | EL63: =+RC[-2]/RC[-4]-1 -> -0.18731146543931065 | EM63: 2607 | EN63: 3333 | EO63: =+RC[-1]/RC[-2]-1 -> 0.27848101265822778 | EP63: 3012131 | EQ63: 3179056 | ER63: 5162369 | ES63: =+RC[-1]/RC[-2]-1 -> 0.62386853204221637 | ET63: =+RC[-2]/RC[-4]-1 -> 0.71385939057763426 | EU63: 2453 | EV63: 1844 | EW63: =+RC[-1]/RC[-2]-1 -> -0.24826742763962495 | EX63: 400423 | EY63: 351746 | EZ63: 171173 | FA63: =+RC[-1]/RC[-2]-1 -> -0.51336191456334967 | FB63: =+RC[-2]/RC[-4]-1 -> -0.57251956056470288 | FC63: 256 | FD63: 407 | FE63: =+RC[-1]/RC[-2]-1 -> 0.58984375 | FF63: 2724797 | FG63: 2800000 | FH63: 3012611 | FI63: =+RC[-1]/RC[-2]-1 -> 7.5932499999999958E-2 | FJ63: =+RC[-2]/RC[-4]-1 -> 0.10562768529178501 | FK63: 1839 | FL63: 1829 | FM63: =+RC[-1]/RC[-2]-1 -> -5.4377379010331905E-3 | FN63: 594969 | FO63: 500000 | FP63: 199334 | FQ63: =+RC[-1]/RC[-2]-1 -> -0.60133199999999998 | FR63: =+RC[-2]/RC[-4]-1 -> -0.66496741847054208 | FS63: 373 | FT63: 731 | FU63: =+RC[-1]/RC[-2]-1 -> 0.95978552278820373 | FV63: 3950877 | FW63: 5500000 | FX63: 5978061 | FY63: =+RC[-1]/RC[-2]-1 -> 8.692018181818173E-2 | FZ63: =+RC[-2]/RC[-4]-1 -> 0.51309721866815905 | GA63: 1941 | GB63: 1843 | GC63: =+RC[-1]/RC[-2]-1 -> -5.0489438433797051E-2 | GD63: 0 | GE63: 160000 | GF63: 0 | GG63: =+RC[-1]/RC[-2]-1 -> -1 | GH63: =+RC[-2]/RC[-4]-1 -> #DIV/0! | GI63: 0 | GJ63: 0 | GK63: =+RC[-1]/RC[-2]-1 -> #DIV/0! | GL63: 3748208 | GM63: 5133270 | GN63: 3902955 | GO63: =+RC[-1]/RC[-2]-1 -> -0.2396747102723995 | GP63: =+RC[-2]/RC[-4]-1 -> 4.1285595676654019E-2 | GQ63: 3181 | GR63: 2330 | GS63: =+RC[-1]/RC[-2]-1 -> -0.2675259352404904 | GT63: 1024690 | GU63: 1100000 | GV63: 871032 | GW63: =+RC[-1]/RC[-2]-1 -> -0.20815272727272727 | GX63: =+RC[-2]/RC[-4]-1 -> -0.14995559632669397 | GY63: 769 | GZ63: 1021 | HA63: =+RC[-1]/RC[-2]-1 -> 0.32769830949284784 | HB63: 2624573 | HC63: 2642914 | HD63: 1867105 | HE63: =+RC[-1]/RC[-2]-1 -> -0.29354303620927502 | HF63: =+RC[-2]/RC[-4]-1 -> -0.28860618470128285 | HG63: 1045 | HH63: 1364 | HI63: =+RC[-1]/RC[-2]-1 -> 0.3052631578947369 | HJ63: 1855645 | HK63: 0 | HL63: 1746267 | HM63: =+RC[-1]/RC[-2]-1 -> #DIV/0! | HN63: =+RC[-2]/RC[-4]-1 -> -5.894338626191975E-2 | HO63: 1374 | HP63: 1404 | HQ63: =+RC[-1]/RC[-2]-1 -> 2.1834061135371119E-2 | HR63: 1323925 | HS63: 1784547 | HT63: 1571655 | HU63: =+RC[-1]/RC[-2]-1 -> -0.11929750239136316 | HV63: =+RC[-2]/RC[-4]-1 -> 0.18711785033140105 | HW63: 1440 | HX63: 1403 | HY63: =+RC[-1]/RC[-2]-1 -> -2.5694444444444464E-2 | HZ63: 2199006 | IA63: 2429472 | IB63: 2555379 | IC63: =+RC[-1]/RC[-2]-1 -> 5.1824840953095919E-2 | ID63: =+RC[-2]/RC[-4]-1 -> 0.16206094935620907 | IE63: 1539 | IF63: 1518 | IG63: =+RC[-1]/RC[-2]-1 -> -1.3645224171540016E-2 | IH63: 1035729 | II63: 1055950 | IJ63: 1072317 | IK63: =+RC[-1]/RC[-2]-1 -> 1.5499786921729264E-2 | IL63: =+RC[-2]/RC[-4]-1 -> 3.5325842956989817E-2 | IM63: 763 | IN63: 826 | IO63: =+RC[-1]/RC[-2]-1 -> 8.256880733944949E-2
A64: 28.02.2016 | B64: 90935586 | C64: 64239417 | D64: 66752543 | E64: =+RC[-1]/RC[-2]-1 -> 3.9121245449659003E-2 | F64: =+RC[-2]/RC[-4]-1 -> -0.26593596702615407 | G64: 42097 | H64: 47593 | I64: =+RC[-1]/RC[-2]-1 -> 0.13055562154072731 | J64: 0 | K64: 1195554 | L64: 1042121 | M64: =+RC[-1]/RC[-2]-1 -> -0.1283363193966981 | N64: =+RC[-2]/RC[-4]-1 -> #DIV/0! | O64: 1129 | P64: 0 | Q64: =+RC[-1]/RC[-2]-1 -> -1 | R64: 430050 | S64: 543972 | T64: 547944 | U64: =+RC[-1]/RC[-2]-1 -> 7.3018464185656828E-3 | V64: =+RC[-2]/RC[-4]-1 -> 0.27414021625392393 | W64: 592 | X64: 528 | Y64: =+RC[-1]/RC[-2]-1 -> -0.10810810810810811 | Z64: 910728 | AA64: 804000 | AB64: 595771 | AC64: =+RC[-1]/RC[-2]-1 -> -0.2589912935323383 | AD64: =+RC[-2]/RC[-4]-1 -> -0.34582992946302293 | AE64: 314 | AF64: 529 | AG64: =+RC[-1]/RC[-2]-1 -> 0.6847133757961783 | AH64: 2138536 | AI64: 3106490 | AJ64: 3442589 | AK64: =+RC[-1]/RC[-2]-1 -> 0.10819252596982443 | AL64: =+RC[-2]/RC[-4]-1 -> 0.60978772393824565 | AM64: 3127 | AN64: 1967 | AO64: =+RC[-1]/RC[-2]-1 -> -0.37096258394627435 | AP64: 12266454 | AQ64: 8220591 | AR64: 9410190 | AS64: =+RC[-1]/RC[-2]-1 -> 0.14470966868440471 | AT64: =+RC[-2]/RC[-4]-1 -> -0.23285164563450855 | AU64: 5599 | AV64: 6420 | AW64: =+RC[-1]/RC[-2]-1 -> 0.14663332737988921 | AX64: 7111847 | AY64: 5360624 | AZ64: 5621247 | BA64: =+RC[-1]/RC[-2]-1 -> 4.8618034019920042E-2 | BB64: =+RC[-2]/RC[-4]-1 -> -0.2095939353026014 | BC64: 3432 | BD64: 3571 | BE64: =+RC[-1]/RC[-2]-1 -> 4.0501165501165559E-2 | BF64: 1495176 | BG64: 1265156 | BH64: 989373 | BI64: =+RC[-1]/RC[-2]-1 -> -0.21798339493311492 | BJ64: =+RC[-2]/RC[-4]-1 -> -0.33828994044848237 | BK64: 802 | BL64: 1155 | BM64: =+RC[-1]/RC[-2]-1 -> 0.44014962593516205 | BN64: 1472369 | BO64: 0 | BP64: 952192 | BQ64: =+RC[-1]/RC[-2]-1 -> #DIV/0! | BR64: =+RC[-2]/RC[-4]-1 -> -0.35329255098416223 | BS64: 1620 | BT64: 1837 | BU64: =+RC[-1]/RC[-2]-1 -> 0.13395061728395063 | BV64: 12962039 | BW64: 10238536 | BX64: 9558006 | BY64: =+RC[-1]/RC[-2]-1 -> -6.6467510589404588E-2 | BZ64: =+RC[-2]/RC[-4]-1 -> -0.2626155499146392 | CA64: 2385 | CB64: 2977 | CC64: =+RC[-1]/RC[-2]-1 -> 0.24821802935010484 | CD64: 2697917 | CE64: 2407355 | CF64: 2250358 | CG64: =+RC[-1]/RC[-2]-1 -> -6.521555815407365E-2 | CH64: =+RC[-2]/RC[-4]-1 -> -0.16589057409846186 | CI64: 1592 | CJ64: 1727 | CK64: =+RC[-1]/RC[-2]-1 -> 8.479899497487442E-2 | CL64: 2299892 | CM64: 0 | CN64: 0 | CO64: =+RC[-1]/RC[-2]-1 -> #DIV/0! | CP64: =+RC[-2]/RC[-4]-1 -> -1 | CQ64: 0 | CR64: 1424 | CS64: =+RC[-1]/RC[-2]-1 -> #DIV/0! | CT64: 4081544 | CU64: 2950088 | CV64: 2836267 | CW64: =+RC[-1]/RC[-2]-1 -> -3.8582238902703958E-2 | CX64: =+RC[-2]/RC[-4]-1 -> -0.30509949176096107 | CY64: 1078 | CZ64: 1357 | DA64: =+RC[-1]/RC[-2]-1 -> 0.25881261595547311 | DB64: 0 | DC64: 0 | DD64: 0 | DE64: =+RC[-1]/RC[-2]-1 -> #DIV/0! | DF64: =+RC[-2]/RC[-4]-1 -> #DIV/0! | DG64: 0 | DH64: 0 | DI64: =+RC[-1]/RC[-2]-1 -> #DIV/0! | DJ64: 0 | DK64: 0 | DL64: 0 | DM64: =+RC[-1]/RC[-2]-1 -> #DIV/0! | DN64: =+RC[-2]/RC[-4]-1 -> #DIV/0! | DO64: 0 | DP64: 0 | DQ64: =+RC[-1]/RC[-2]-1 -> #DIV/0! | DR64: 2309500 | DS64: 0 | DT64: 810830 | DU64: =+RC[-1]/RC[-2]-1 -> #DIV/0! | DV64: =+RC[-2]/RC[-4]-1 -> -0.64891534964277975 | DW64: 1194 | DX64: 1915 | DY64: =+RC[-1]/RC[-2]-1 -> 0.60385259631490795 | DZ64: 1993116 | EA64: 0 | EB64: 0 | EC64: =+RC[-1]/RC[-2]-1 -> #DIV/0! | ED64: =+RC[-2]/RC[-4]-1 -> -1 | EE64: 0 | EF64: 1248 | EG64: =+RC[-1]/RC[-2]-1 -> #DIV/0! | EH64: 3998927 | EI64: 3511687 | EJ64: 2905051 | EK64: =+RC[-1]/RC[-2]-1 -> -0.17274774203965215 | EL64: =+RC[-2]/RC[-4]-1 -> -0.27354237774282952 | EM64: 2266 | EN64: 2671 | EO64: =+RC[-1]/RC[-2]-1 -> 0.17872903795233896 | EP64: 4332513 | EQ64: 3254748 | ER64: 4739157 | ES64: =+RC[-1]/RC[-2]-1 -> 0.45607494036404672 | ET64: =+RC[-2]/RC[-4]-1 -> 9.385869124916657E-2 | EU64: 2621 | EV64: 2047 | EW64: =+RC[-1]/RC[-2]-1 -> -0.21900038153376578 | EX64: 472593 | EY64: 310364 | EZ64: 128195 | FA64: =+RC[-1]/RC[-2]-1 -> -0.58695273936410153 | FB64: =+RC[-2]/RC[-4]-1 -> -0.72874122130458985 | FC64: 231 | FD64: 466 | FE64: =+RC[-1]/RC[-2]-1 -> 1.0173160173160172 | FF64: 2735481 | FG64: 2550000 | FH64: 2613544 | FI64: =+RC[-1]/RC[-2]-1 -> 2.4919215686274532E-2 | FJ64: =+RC[-2]/RC[-4]-1 -> -4.4576072727246174E-2 | FK64: 1681 | FL64: 1728 | FM64: =+RC[-1]/RC[-2]-1 -> 2.7959547888161795E-2 | FN64: 4573302 | FO64: 550000 | FP64: 221419 | FQ64: =+RC[-1]/RC[-2]-1 -> -0.59742000000000006 | FR64: =+RC[-2]/RC[-4]-1 -> -0.9515844350537096 | FS64: 420 | FT64: 798 | FU64: =+RC[-1]/RC[-2]-1 -> 0.89999999999999991 | FV64: 5756141 | FW64: 4800000 | FX64: 5549085 | FY64: =+RC[-1]/RC[-2]-1 -> 0.15605937499999989 | FZ64: =+RC[-2]/RC[-4]-1 -> -3.597132175879636E-2 | GA64: 2109 | GB64: 2064 | GC64: =+RC[-1]/RC[-2]-1 -> -2.1337126600284528E-2 | GD64: 0 | GE64: 190000 | GF64: 0 | GG64: =+RC[-1]/RC[-2]-1 -> -1 | GH64: =+RC[-2]/RC[-4]-1 -> #DIV/0! | GI64: 0 | GJ64: 0 | GK64: =+RC[-1]/RC[-2]-1 -> #DIV/0! | GL64: 5224904 | GM64: 4676979 | GN64: 3884610 | GO64: =+RC[-1]/RC[-2]-1 -> -0.16941897750663404 | GP64: =+RC[-2]/RC[-4]-1 -> -0.2565203111865787 | GQ64: 3405 | GR64: 3312 | GS64: =+RC[-1]/RC[-2]-1 -> -2.7312775330396444E-2 | GT64: 1084654 | GU64: 1100000 | GV64: 640085 | GW64: =+RC[-1]/RC[-2]-1 -> -0.41810454545454545 | GX64: =+RC[-2]/RC[-4]-1 -> -0.40987171946076817 | GY64: 697 | GZ64: 1023 | HA64: =+RC[-1]/RC[-2]-1 -> 0.46771879483500722 | HB64: 2849525 | HC64: 2139505 | HD64: 1651741 | HE64: =+RC[-1]/RC[-2]-1 -> -0.22797983645749831 | HF64: =+RC[-2]/RC[-4]-1 -> -0.42034514524350552 | HG64: 934 | HH64: 1458 | HI64: =+RC[-1]/RC[-2]-1 -> 0.56102783725910066 | HJ64: 2573969 | HK64: 0 | HL64: 1563156 | HM64: =+RC[-1]/RC[-2]-1 -> #DIV/0! | HN64: =+RC[-2]/RC[-4]-1 -> -0.39270597276035568 | HO64: 1301 | HP64: 1560 | HQ64: =+RC[-1]/RC[-2]-1 -> 0.19907763259031519 | HR64: 1779081 | HS64: 1679574 | HT64: 1453783 | HU64: =+RC[-1]/RC[-2]-1 -> -0.13443349325483722 | HV64: =+RC[-2]/RC[-4]-1 -> -0.18284608739006258 | HW64: 1461 | HX64: 1684 | HY64: =+RC[-1]/RC[-2]-1 -> 0.15263518138261456 | HZ64: 2292958 | IA64: 2328244 | IB64: 2387767 | IC64: =+RC[-1]/RC[-2]-1 -> 2.5565619411023865E-2 | ID64: =+RC[-2]/RC[-4]-1 -> 4.1347900833770268E-2 | IE64: 1423 | IF64: 1366 | IG64: =+RC[-1]/RC[-2]-1 -> -4.0056219255094838E-2 | IH64: 1092370 | II64: 1055950 | IJ64: 958062 | IK64: =+RC[-1]/RC[-2]-1 -> -9.2701358965860181E-2 | IL64: =+RC[-2]/RC[-4]-1 -> -0.12295101476605907 | IM64: 684 | IN64: 761 | IO64: =+RC[-1]/RC[-2]-1 -> 0.11257309941520477
A65: 29.02.2016 | B65: 0 | C65: 55656604 | D65: 59077332 | E65: =+RC[-1]/RC[-2]-1 -> 6.1461313737359857E-2 | F65: =+RC[-2]/RC[-4]-1 -> #DIV/0! | G65: 40154 | H65: 0 | I65: =+RC[-1]/RC[-2]-1 -> -1 | J65: 0 | K65: 777111 | L65: 587383 | M65: =+RC[-1]/RC[-2]-1 -> -0.24414530227985454 | N65: =+RC[-2]/RC[-4]-1 -> #DIV/0! | O65: 828 | P65: 0 | Q65: =+RC[-1]/RC[-2]-1 -> -1 | R65: 0 | S65: 642873 | T65: 578894 | U65: =+RC[-1]/RC[-2]-1 -> -9.9520434051515672E-2 | V65: =+RC[-2]/RC[-4]-1 -> #DIV/0! | W65: 726 | X65: 0 | Y65: =+RC[-1]/RC[-2]-1 -> -1 | Z65: 0 | AA65: 756000 | AB65: 645280 | AC65: =+RC[-1]/RC[-2]-1 -> -0.1464550264550265 | AD65: =+RC[-2]/RC[-4]-1 -> #DIV/0! | AE65: 442 | AF65: 0 | AG65: =+RC[-1]/RC[-2]-1 -> -1 | AH65: 0 | AI65: 2101453 | AJ65: 2820057 | AK65: =+RC[-1]/RC[-2]-1 -> 0.34195578011975525 | AL65: =+RC[-2]/RC[-4]-1 -> #DIV/0! | AM65: 2986 | AN65: 0 | AO65: =+RC[-1]/RC[-2]-1 -> -1 | AP65: 0 | AQ65: 6057283 | AR65: 7123021 | AS65: =+RC[-1]/RC[-2]-1 -> 0.1759432405585144 | AT65: =+RC[-2]/RC[-4]-1 -> #DIV/0! | AU65: 4110 | AV65: 0 | AW65: =+RC[-1]/RC[-2]-1 -> -1 | AX65: 0 | AY65: 4502927 | AZ65: 4906276 | BA65: =+RC[-1]/RC[-2]-1 -> 8.9574847649095846E-2 | BB65: =+RC[-2]/RC[-4]-1 -> #DIV/0! | BC65: 2806 | BD65: 0 | BE65: =+RC[-1]/RC[-2]-1 -> -1 | BF65: 0 | BG65: 1437676 | BH65: 1257294 | BI65: =+RC[-1]/RC[-2]-1 -> -0.12546776881578325 | BJ65: =+RC[-2]/RC[-4]-1 -> #DIV/0! | BK65: 1355 | BL65: 0 | BM65: =+RC[-1]/RC[-2]-1 -> -1 | BN65: 0 | BO65: 0 | BP65: 657699 | BQ65: =+RC[-1]/RC[-2]-1 -> #DIV/0! | BR65: =+RC[-2]/RC[-4]-1 -> #DIV/0! | BS65: 1180 | BT65: 0 | BU65: =+RC[-1]/RC[-2]-1 -> -1 | BV65: 0 | BW65: 10033761 | BX65: 10105246 | BY65: =+RC[-1]/RC[-2]-1 -> 7.1244471539635423E-3 | BZ65: =+RC[-2]/RC[-4]-1 -> #DIV/0! | CA65: 3071 | CB65: 0 | CC65: =+RC[-1]/RC[-2]-1 -> -1 | CD65: 0 | CE65: 2302687 | CF65: 2352696 | CG65: =+RC[-1]/RC[-2]-1 -> 2.17176715723848E-2 | CH65: =+RC[-2]/RC[-4]-1 -> #DIV/0! | CI65: 1757 | CJ65: 0 | CK65: =+RC[-1]/RC[-2]-1 -> -1 | CL65: 0 | CM65: 0 | CN65: 0 | CO65: =+RC[-1]/RC[-2]-1 -> #DIV/0! | CP65: =+RC[-2]/RC[-4]-1 -> #DIV/0! | CQ65: 0 | CR65: 0 | CS65: =+RC[-1]/RC[-2]-1 -> #DIV/0! | CT65: 0 | CU65: 2596077 | CV65: 2352010 | CW65: =+RC[-1]/RC[-2]-1 -> -9.401377540034439E-2 | CX65: =+RC[-2]/RC[-4]-1 -> #DIV/0! | CY65: 1144 | CZ65: 0 | DA65: =+RC[-1]/RC[-2]-1 -> -1 | DB65: 0 | DC65: 0 | DD65: 0 | DE65: =+RC[-1]/RC[-2]-1 -> #DIV/0! | DF65: =+RC[-2]/RC[-4]-1 -> #DIV/0! | DG65: 0 | DH65: 0 | DI65: =+RC[-1]/RC[-2]-1 -> #DIV/0! | DJ65: 0 | DK65: 0 | DL65: 0 | DM65: =+RC[-1]/RC[-2]-1 -> #DIV/0! | DN65: =+RC[-2]/RC[-4]-1 -> #DIV/0! | DO65: 0 | DP65: 0 | DQ65: =+RC[-1]/RC[-2]-1 -> #DIV/0! | DR65: 0 | DS65: 0 | DT65: 569585 | DU65: =+RC[-1]/RC[-2]-1 -> #DIV/0! | DV65: =+RC[-2]/RC[-4]-1 -> #DIV/0! | DW65: 1023 | DX65: 0 | DY65: =+RC[-1]/RC[-2]-1 -> -1 | DZ65: 0 | EA65: 0 | EB65: 0 | EC65: =+RC[-1]/RC[-2]-1 -> #DIV/0! | ED65: =+RC[-2]/RC[-4]-1 -> #DIV/0! | EE65: 0 | EF65: 0 | EG65: =+RC[-1]/RC[-2]-1 -> #DIV/0! | EH65: 0 | EI65: 4060389 | EJ65: 3537839 | EK65: =+RC[-1]/RC[-2]-1 -> -0.12869456596399997 | EL65: =+RC[-2]/RC[-4]-1 -> #DIV/0! | EM65: 3298 | EN65: 0 | EO65: =+RC[-1]/RC[-2]-1 -> -1 | EP65: 0 | EQ65: 2497829 | ER65: 3428596 | ES65: =+RC[-1]/RC[-2]-1 -> 0.37263039223261485 | ET65: =+RC[-2]/RC[-4]-1 -> #DIV/0! | EU65: 1963 | EV65: 0 | EW65: =+RC[-1]/RC[-2]-1 -> -1 | EX65: 0 | EY65: 316156 | EZ65: 138426 | FA65: =+RC[-1]/RC[-2]-1 -> -0.56215918723668068 | FB65: =+RC[-2]/RC[-4]-1 -> #DIV/0! | FC65: 250 | FD65: 0 | FE65: =+RC[-1]/RC[-2]-1 -> -1 | FF65: 0 | FG65: 2500000 | FH65: 2553200 | FI65: =+RC[-1]/RC[-2]-1 -> 2.1279999999999966E-2 | FJ65: =+RC[-2]/RC[-4]-1 -> #DIV/0! | FK65: 1781 | FL65: 0 | FM65: =+RC[-1]/RC[-2]-1 -> -1 | FN65: 0 | FO65: 550000 | FP65: 118885 | FQ65: =+RC[-1]/RC[-2]-1 -> -0.78384545454545451 | FR65: =+RC[-2]/RC[-4]-1 -> #DIV/0! | FS65: 272 | FT65: 0 | FU65: =+RC[-1]/RC[-2]-1 -> -1 | FV65: 0 | FW65: 3750000 | FX65: 3821252 | FY65: =+RC[-1]/RC[-2]-1 -> 1.9000533333333403E-2 | FZ65: =+RC[-2]/RC[-4]-1 -> #DIV/0! | GA65: 1668 | GB65: 0 | GC65: =+RC[-1]/RC[-2]-1 -> -1 | GD65: 0 | GE65: 144000 | GF65: 0 | GG65: =+RC[-1]/RC[-2]-1 -> -1 | GH65: =+RC[-2]/RC[-4]-1 -> #DIV/0! | GI65: 0 | GJ65: 0 | GK65: =+RC[-1]/RC[-2]-1 -> #DIV/0! | GL65: 0 | GM65: 3194033 | GN65: 2919096 | GO65: =+RC[-1]/RC[-2]-1 -> -8.6078321670439828E-2 | GP65: =+RC[-2]/RC[-4]-1 -> #DIV/0! | GQ65: 2382 | GR65: 0 | GS65: =+RC[-1]/RC[-2]-1 -> -1 | GT65: 0 | GU65: 800000 | GV65: 608165 | GW65: =+RC[-1]/RC[-2]-1 -> -0.23979375000000003 | GX65: =+RC[-2]/RC[-4]-1 -> #DIV/0! | GY65: 757 | GZ65: 0 | HA65: =+RC[-1]/RC[-2]-1 -> -1 | HB65: 0 | HC65: 2202428 | HD65: 1456011 | HE65: =+RC[-1]/RC[-2]-1 -> -0.33890642509085422 | HF65: =+RC[-2]/RC[-4]-1 -> #DIV/0! | HG65: 927 | HH65: 0 | HI65: =+RC[-1]/RC[-2]-1 -> -1 | HJ65: 0 | HK65: 0 | HL65: 1782140 | HM65: =+RC[-1]/RC[-2]-1 -> #DIV/0! | HN65: =+RC[-2]/RC[-4]-1 -> #DIV/0! | HO65: 1535 | HP65: 0 | HQ65: =+RC[-1]/RC[-2]-1 -> -1 | HR65: 0 | HS65: 1049731 | HT65: 1172221 | HU65: =+RC[-1]/RC[-2]-1 -> 0.11668703696470817 | HV65: =+RC[-2]/RC[-4]-1 -> #DIV/0! | HW65: 1260 | HX65: 0 | HY65: =+RC[-1]/RC[-2]-1 -> -1 | HZ65: 0 | IA65: 2328244 | IB65: 2678990 | IC65: =+RC[-1]/RC[-2]-1 -> 0.15064829974865179 | ID65: =+RC[-2]/RC[-4]-1 -> #DIV/0! | IE65: 1845 | IF65: 0 | IG65: =+RC[-1]/RC[-2]-1 -> -1 | IH65: 0 | II65: 1055946 | IJ65: 907070 | IK65: =+RC[-1]/RC[-2]-1 -> -0.14098827023351568 | IL65: =+RC[-2]/RC[-4]-1 -> #DIV/0! | IM65: 788 | IN65: 0 | IO65: =+RC[-1]/RC[-2]-1 -> -1
A66: SUBAT | B66: 1874902490 | C66: 1705884218 | D66: 1880574365 | E66: =+RC[-1]/RC[-2]-1 -> 0.10240445697118239 | F66: =+RC[-2]/RC[-4]-1 -> 3.0251573243149643E-3 | G66: 1197635 | H66: 1198914 | I66: =+RC[-1]/RC[-2]-1 -> 1.0679380612623746E-3 | J66: 0 | K66: 26900000 | L66: 22527242 | M66: =+RC[-1]/RC[-2]-1 -> -0.16255605947955387 | N66: =+RC[-2]/RC[-4]-1 -> #DIV/0! | O66: 25337 | P66: 0 | Q66: =+RC[-1]/RC[-2]-1 -> -1 | R66: 12496880 | S66: 18297237 | T66: 17709754 | U66: =+RC[-1]/RC[-2]-1 -> -3.2107743917838549E-2 | V66: =+RC[-2]/RC[-4]-1 -> 0.41713403665554916 | W66: 19808 | X66: 14545 | Y66: =+RC[-1]/RC[-2]-1 -> -0.26570072697899838 | Z66: 33245035 | AA66: 24000000 | AB66: 19873311 | AC66: =+RC[-1]/RC[-2]-1 -> -0.17194537499999996 | AD66: =+RC[-2]/RC[-4]-1 -> -0.40221717318089756 | AE66: 13276 | AF66: 18865 | AG66: =+RC[-1]/RC[-2]-1 -> 0.42098523651702324 | AH66: 46121166 | AI66: 71266667 | AJ66: 81117417 | AK66: =+RC[-1]/RC[-2]-1 -> 0.13822380665002898 | AL66: =+RC[-2]/RC[-4]-1 -> 0.75878938099700255 | AM66: 81499 | AN66: 47893 | AO66: =+RC[-1]/RC[-2]-1 -> -0.4123486177744512 | AP66: 246500589 | AQ66: 199025000 | AR66: 237615712 | AS66: =+RC[-1]/RC[-2]-1 -> 0.19389881673156628 | AT66: =+RC[-2]/RC[-4]-1 -> -3.6044039635134473E-2 | AU66: 125645 | AV66: 143735 | AW66: =+RC[-1]/RC[-2]-1 -> 0.1439770782760954 | AX66: 132941313 | AY66: 144736842 | AZ66: 149883776 | BA66: =+RC[-1]/RC[-2]-1 -> 3.5560634934953095E-2 | BB66: =+RC[-2]/RC[-4]-1 -> 0.12744317486919954 | BC66: 83865 | BD66: 77777 | BE66: =+RC[-1]/RC[-2]-1 -> -7.2592857568711588E-2 | BF66: 41442242 | BG66: 40600000 | BH66: 39034692 | BI66: =+RC[-1]/RC[-2]-1 -> -3.8554384236453187E-2 | BJ66: =+RC[-2]/RC[-4]-1 -> -5.8094106009032975E-2 | BK66: 34345 | BL66: 37637 | BM66: =+RC[-1]/RC[-2]-1 -> 9.5850924443150465E-2 | BN66: 30628463 | BO66: 0 | BP66: 23476595 | BQ66: =+RC[-1]/RC[-2]-1 -> #DIV/0! | BR66: =+RC[-2]/RC[-4]-1 -> -0.233503979615301 | BS66: 40410 | BT66: 42920 | BU66: =+RC[-1]/RC[-2]-1 -> 6.2113338282603348E-2 | BV66: 265097650 | BW66: 286679000 | BX66: 292679908 | BY66: =+RC[-1]/RC[-2]-1 -> 2.0932499415722727E-2 | BZ66: =+RC[-2]/RC[-4]-1 -> 0.10404565261140575 | CA66: 81590 | CB66: 81639 | CC66: =+RC[-1]/RC[-2]-1 -> 6.0056379458273135E-4 | CD66: 60775692 | CE66: 68033959 | CF66: 66962294 | CG66: =+RC[-1]/RC[-2]-1 -> -1.5751912952765235E-2 | CH66: =+RC[-2]/RC[-4]-1 -> 0.10179401988545034 | CI66: 47751 | CJ66: 41913 | CK66: =+RC[-1]/RC[-2]-1 -> -0.12225921970220521 | CL66: 41929833 | CM66: 0 | CN66: 17613812 | CO66: =+RC[-1]/RC[-2]-1 -> #DIV/0! | CP66: =+RC[-2]/RC[-4]-1 -> -0.57992172303667422 | CQ66: 18403 | CR66: 31753 | CS66: =+RC[-1]/RC[-2]-1 -> 0.72542520241265018 | CT66: 83490556 | CU66: 79062349 | CV66: 60430385 | CW66: =+RC[-1]/RC[-2]-1 -> -0.23566165482889967 | CX66: =+RC[-2]/RC[-4]-1 -> -0.27620095139862288 | CY66: 30753 | CZ66: 35838 | DA66: =+RC[-1]/RC[-2]-1 -> 0.16534972197834352 | DB66: 0 | DC66: 0 | DD66: 0 | DE66: =+RC[-1]/RC[-2]-1 -> #DIV/0! | DF66: =+RC[-2]/RC[-4]-1 -> #DIV/0! | DG66: 0 | DH66: 0 | DI66: =+RC[-1]/RC[-2]-1 -> #DIV/0! | DJ66: 0 | DK66: 0 | DL66: 0 | DM66: =+RC[-1]/RC[-2]-1 -> #DIV/0! | DN66: =+RC[-2]/RC[-4]-1 -> #DIV/0! | DO66: 0 | DP66: 0 | DQ66: =+RC[-1]/RC[-2]-1 -> #DIV/0! | DR66: 50316162 | DS66: 0 | DT66: 22140756 | DU66: =+RC[-1]/RC[-2]-1 -> #DIV/0! | DV66: =+RC[-2]/RC[-4]-1 -> -0.5599673122922213 | DW66: 32664 | DX66: 51582 | DY66: =+RC[-1]/RC[-2]-1 -> 0.57916972814107281 | DZ66: 44395386 | EA66: 0 | EB66: 29073081 | EC66: =+RC[-1]/RC[-2]-1 -> #DIV/0! | ED66: =+RC[-2]/RC[-4]-1 -> -0.34513282528954703 | EE66: 21989 | EF66: 31791 | EG66: =+RC[-1]/RC[-2]-1 -> 0.44576833871481192 | EH66: 99230207 | EI66: 109370229 | EJ66: 101940353 | EK66: =+RC[-1]/RC[-2]-1 -> -6.7933258144682096E-2 | EL66: =+RC[-2]/RC[-4]-1 -> 2.7311703582357794E-2 | EM66: 85589 | EN66: 82546 | EO66: =+RC[-1]/RC[-2]-1 -> -3.5553634228697617E-2 | EP66: 83123547 | EQ66: 78765925 | ER66: 114483947 | ES66: =+RC[-1]/RC[-2]-1 -> 0.45347048231833753 | ET66: =+RC[-2]/RC[-4]-1 -> 0.37727456457073472 | EU66: 60789 | EV66: 48639 | EW66: =+RC[-1]/RC[-2]-1 -> -0.19987168731184923 | EX66: 11351104 | EY66: 9310924 | EZ66: 4151579 | FA66: =+RC[-1]/RC[-2]-1 -> -0.55411740016350686 | FB66: =+RC[-2]/RC[-4]-1 -> -0.63425768982470787 | FC66: 6837 | FD66: 12053 | FE66: =+RC[-1]/RC[-2]-1 -> 0.76290770805909025 | FF66: 73533616 | FG66: 74683575 | FH66: 76344386 | FI66: =+RC[-1]/RC[-2]-1 -> 2.2237968656428242E-2 | FJ66: =+RC[-2]/RC[-4]-1 -> 3.8224286427040344E-2 | FK66: 51528 | FL66: 50400 | FM66: =+RC[-1]/RC[-2]-1 -> -2.1891010712622228E-2 | FN66: 21088730 | FO66: 13000000 | FP66: 6287246 | FQ66: =+RC[-1]/RC[-2]-1 -> -0.51636569230769225 | FR66: =+RC[-2]/RC[-4]-1 -> -0.70186701617404179 | FS66: 10726 | FT66: 20316 | FU66: =+RC[-1]/RC[-2]-1 -> 0.89408912921872097 | FV66: 118435888 | FW66: 117709555 | FX66: 139111791 | FY66: =+RC[-1]/RC[-2]-1 -> 0.18182241874926808 | FZ66: =+RC[-2]/RC[-4]-1 -> 0.17457464413151524 | GA66: 55025 | GB66: 50888 | GC66: =+RC[-1]/RC[-2]-1 -> -7.5184007269422981E-2 | GD66: 0 | GE66: 4000000 | GF66: 0 | GG66: =+RC[-1]/RC[-2]-1 -> -1 | GH66: =+RC[-2]/RC[-4]-1 -> #DIV/0! | GI66: 0 | GJ66: 0 | GK66: =+RC[-1]/RC[-2]-1 -> #DIV/0! | GL66: 108414254 | GM66: 110650488 | GN66: 95232681 | GO66: =+RC[-1]/RC[-2]-1 -> -0.13933790332673457 | GP66: =+RC[-2]/RC[-4]-1 -> -0.12158523915130204 | GQ66: 70487 | GR66: 72467 | GS66: =+RC[-1]/RC[-2]-1 -> 2.8090286152056443E-2 | GT66: 26214137 | GU66: 28000000 | GV66: 21670913 | GW66: =+RC[-1]/RC[-2]-1 -> -0.22603882142857146 | GX66: =+RC[-2]/RC[-4]-1 -> -0.17331198047831975 | GY66: 22686 | GZ66: 26642 | HA66: =+RC[-1]/RC[-2]-1 -> 0.17438067530635637 | HB66: 67326098 | HC66: 65191867 | HD66: 50892289 | HE66: =+RC[-1]/RC[-2]-1 -> -0.21934604204539809 | HF66: =+RC[-2]/RC[-4]-1 -> -0.24409269938679645 | HG66: 29221 | HH66: 36760 | HI66: =+RC[-1]/RC[-2]-1 -> 0.25799938400465416 | HJ66: 55873460 | HK66: 0 | HL66: 50805207 | HM66: =+RC[-1]/RC[-2]-1 -> #DIV/0! | HN66: =+RC[-2]/RC[-4]-1 -> -9.0709488905823976E-2 | HO66: 40238 | HP66: 39693 | HQ66: =+RC[-1]/RC[-2]-1 -> -1.3544410756001768E-2 | HR66: 37026969 | HS66: 40729665 | HT66: 40865716 | HU66: =+RC[-1]/RC[-2]-1 -> 3.3403417386319578E-3 | HV66: =+RC[-2]/RC[-4]-1 -> 0.1036743515246954 | HW66: 39954 | HX66: 40105 | HY66: =+RC[-1]/RC[-2]-1 -> 3.7793462481854334E-3 | HZ66: 56864144 | IA66: 66304348 | IB66: 70536968 | IC66: =+RC[-1]/RC[-2]-1 -> 6.3836235898134364E-2 | ID66: =+RC[-2]/RC[-4]-1 -> 0.2404471963914554 | IE66: 45227 | IF66: 38870 | IG66: =+RC[-1]/RC[-2]-1 -> -0.14055763150330558 | IH66: 27039369 | II66: 29566588 | IJ66: 28112554 | IK66: =+RC[-1]/RC[-2]-1 -> -4.9178281917413025E-2 | IL66: =+RC[-2]/RC[-4]-1 -> 3.9689720570032616E-2 | IM66: 21993 | IN66: 21647 | IO66: =+RC[-1]/RC[-2]-1 -> -1.5732278452234794E-2
A67: 01.03.2016 | B67: 78783871 | C67: 0 | D67: 59272621 | E67: =+RC[-1]/RC[-2]-1 -> #DIV/0! | F67: =+RC[-2]/RC[-4]-1 -> -0.2476553862147749 | G67: 40510 | H67: 45269 | I67: =+RC[-1]/RC[-2]-1 -> 0.11747716613181924 | J67: 0 | K67: 0 | L67: 708333 | M67: =+RC[-1]/RC[-2]-1 -> #DIV/0! | N67: =+RC[-2]/RC[-4]-1 -> #DIV/0! | O67: 918 | P67: 0 | Q67: =+RC[-1]/RC[-2]-1 -> -1 | R67: 433418 | S67: 0 | T67: 675936 | U67: =+RC[-1]/RC[-2]-1 -> #DIV/0! | V67: =+RC[-2]/RC[-4]-1 -> 0.55954759608507265 | W67: 793 | X67: 482 | Y67: =+RC[-1]/RC[-2]-1 -> -0.39218158890290034 | Z67: 782580 | AA67: 0 | AB67: 657164 | AC67: =+RC[-1]/RC[-2]-1 -> #DIV/0! | AD67: =+RC[-2]/RC[-4]-1 -> -0.16025965396508979 | AE67: 435 | AF67: 396 | AG67: =+RC[-1]/RC[-2]-1 -> -8.9655172413793061E-2 | AH67: 2232625 | AI67: 0 | AJ67: 2604774 | AK67: =+RC[-1]/RC[-2]-1 -> #DIV/0! | AL67: =+RC[-2]/RC[-4]-1 -> 0.16668674766250491 | AM67: 2936 | AN67: 2003 | AO67: =+RC[-1]/RC[-2]-1 -> -0.31777929155313356 | AP67: 11521268 | AQ67: 0 | AR67: 6503299 | AS67: =+RC[-1]/RC[-2]-1 -> #DIV/0! | AT67: =+RC[-2]/RC[-4]-1 -> -0.43553964719855487 | AU67: 4077 | AV67: 6180 | AW67: =+RC[-1]/RC[-2]-1 -> 0.51582045621780725 | AX67: 6038981 | AY67: 0 | AZ67: 5138358 | BA67: =+RC[-1]/RC[-2]-1 -> #DIV/0! | BB67: =+RC[-2]/RC[-4]-1 -> -0.14913492855831145 | BC67: 2903 | BD67: 3599 | BE67: =+RC[-1]/RC[-2]-1 -> 0.23975198070961068 | BF67: 1653045 | BG67: 0 | BH67: 1301384 | BI67: =+RC[-1]/RC[-2]-1 -> #DIV/0! | BJ67: =+RC[-2]/RC[-4]-1 -> -0.21273528548829579 | BK67: 1265 | BL67: 1240 | BM67: =+RC[-1]/RC[-2]-1 -> -1.9762845849802368E-2 | BN67: 1272180 | BO67: 0 | BP67: 819088 | BQ67: =+RC[-1]/RC[-2]-1 -> #DIV/0! | BR67: =+RC[-2]/RC[-4]-1 -> -0.35615400336430381 | BS67: 1309 | BT67: 1866 | BU67: =+RC[-1]/RC[-2]-1 -> 0.42551566080977854 | BV67: 11051487 | BW67: 0 | BX67: 8969291 | BY67: =+RC[-1]/RC[-2]-1 -> #DIV/0! | BZ67: =+RC[-2]/RC[-4]-1 -> -0.18840867296862407 | CA67: 2912 | CB67: 2626 | CC67: =+RC[-1]/RC[-2]-1 -> -9.8214285714285698E-2 | CD67: 2268127 | CE67: 0 | CF67: 2297283 | CG67: =+RC[-1]/RC[-2]-1 -> #DIV/0! | CH67: =+RC[-2]/RC[-4]-1 -> 1.2854659373130239E-2 | CI67: 1711 | CJ67: 1469 | CK67: =+RC[-1]/RC[-2]-1 -> -0.14143775569842199 | CL67: 2058250 | CM67: 0 | CN67: 0 | CO67: =+RC[-1]/RC[-2]-1 -> #DIV/0! | CP67: =+RC[-2]/RC[-4]-1 -> -1 | CQ67: 0 | CR67: 1340 | CS67: =+RC[-1]/RC[-2]-1 -> #DIV/0! | CT67: 4014321 | CU67: 0 | CV67: 2698747 | CW67: =+RC[-1]/RC[-2]-1 -> #DIV/0! | CX67: =+RC[-2]/RC[-4]-1 -> -0.32772017982617729 | CY67: 1238 | CZ67: 1294 | DA67: =+RC[-1]/RC[-2]-1 -> 4.5234248788368348E-2 | DB67: 0 | DC67: 0 | DD67: 0 | DE67: =+RC[-1]/RC[-2]-1 -> #DIV/0! | DF67: =+RC[-2]/RC[-4]-1 -> #DIV/0! | DG67: 0 | DH67: 0 | DI67: =+RC[-1]/RC[-2]-1 -> #DIV/0! | DJ67: 0 | DK67: 0 | DL67: 0 | DM67: =+RC[-1]/RC[-2]-1 -> #DIV/0! | DN67: =+RC[-2]/RC[-4]-1 -> #DIV/0! | DO67: 0 | DP67: 0 | DQ67: =+RC[-1]/RC[-2]-1 -> #DIV/0! | DR67: 2265266 | DS67: 0 | DT67: 668725 | DU67: =+RC[-1]/RC[-2]-1 -> #DIV/0! | DV67: =+RC[-2]/RC[-4]-1 -> -0.70479184343030798 | DW67: 1101 | DX67: 2207 | DY67: =+RC[-1]/RC[-2]-1 -> 1.0045413260672116 | DZ67: 1541391 | EA67: 0 | EB67: 0 | EC67: =+RC[-1]/RC[-2]-1 -> #DIV/0! | ED67: =+RC[-2]/RC[-4]-1 -> -1 | EE67: 0 | EF67: 1028 | EG67: =+RC[-1]/RC[-2]-1 -> #DIV/0! | EH67: 3396965 | EI67: 0 | EJ67: 3830896 | EK67: =+RC[-1]/RC[-2]-1 -> #DIV/0! | EL67: =+RC[-2]/RC[-4]-1 -> 0.12774079214828538 | EM67: 3428 | EN67: 2345 | EO67: =+RC[-1]/RC[-2]-1 -> -0.31592765460910155 | EP67: 3946483 | EQ67: 0 | ER67: 3559154 | ES67: =+RC[-1]/RC[-2]-1 -> #DIV/0! | ET67: =+RC[-2]/RC[-4]-1 -> -9.8145361325514435E-2 | EU67: 1928 | EV67: 1949 | EW67: =+RC[-1]/RC[-2]-1 -> 1.0892116182572575E-2 | EX67: 378769 | EY67: 0 | EZ67: 135841 | FA67: =+RC[-1]/RC[-2]-1 -> #DIV/0! | FB67: =+RC[-2]/RC[-4]-1 -> -0.64136188547637207 | FC67: 230 | FD67: 406 | FE67: =+RC[-1]/RC[-2]-1 -> 0.76521739130434785 | FF67: 2552251 | FG67: 0 | FH67: 2513653 | FI67: =+RC[-1]/RC[-2]-1 -> #DIV/0! | FJ67: =+RC[-2]/RC[-4]-1 -> -1.5123120727545958E-2 | FK67: 1775 | FL67: 1665 | FM67: =+RC[-1]/RC[-2]-1 -> -6.1971830985915521E-2 | FN67: 729118 | FO67: 0 | FP67: 235445 | FQ67: =+RC[-1]/RC[-2]-1 -> #DIV/0! | FR67: =+RC[-2]/RC[-4]-1 -> -0.67708244755992864 | FS67: 301 | FT67: 897 | FU67: =+RC[-1]/RC[-2]-1 -> 1.9800664451827243 | FV67: 5172332 | FW67: 0 | FX67: 4583682 | FY67: =+RC[-1]/RC[-2]-1 -> #DIV/0! | FZ67: =+RC[-2]/RC[-4]-1 -> -0.11380746634206773 | GA67: 1838 | GB67: 2101 | GC67: =+RC[-1]/RC[-2]-1 -> 0.14309031556039176 | GD67: 0 | GE67: 0 | GF67: 0 | GG67: =+RC[-1]/RC[-2]-1 -> #DIV/0! | GH67: =+RC[-2]/RC[-4]-1 -> #DIV/0! | GI67: 0 | GJ67: 0 | GK67: =+RC[-1]/RC[-2]-1 -> #DIV/0! | GL67: 4908047 | GM67: 0 | GN67: 2608989 | GO67: =+RC[-1]/RC[-2]-1 -> #DIV/0! | GP67: =+RC[-2]/RC[-4]-1 -> -0.46842623960202501 | GQ67: 2112 | GR67: 3071 | GS67: =+RC[-1]/RC[-2]-1 -> 0.45407196969696972 | GT67: 941539 | GU67: 0 | GV67: 764196 | GW67: =+RC[-1]/RC[-2]-1 -> #DIV/0! | GX67: =+RC[-2]/RC[-4]-1 -> -0.18835438574504082 | GY67: 824 | GZ67: 863 | HA67: =+RC[-1]/RC[-2]-1 -> 4.7330097087378675E-2 | HB67: 2537094 | HC67: 0 | HD67: 1828916 | HE67: =+RC[-1]/RC[-2]-1 -> #DIV/0! | HF67: =+RC[-2]/RC[-4]-1 -> -0.27912958684226918 | HG67: 1095 | HH67: 1297 | HI67: =+RC[-1]/RC[-2]-1 -> 0.18447488584474891 | HJ67: 2169845 | HK67: 0 | HL67: 1772022 | HM67: =+RC[-1]/RC[-2]-1 -> #DIV/0! | HN67: =+RC[-2]/RC[-4]-1 -> -0.18334166726194723 | HO67: 1517 | HP67: 1317 | HQ67: =+RC[-1]/RC[-2]-1 -> -0.13183915622940012 | HR67: 1868704 | HS67: 0 | HT67: 1166080 | HU67: =+RC[-1]/RC[-2]-1 -> #DIV/0! | HV67: =+RC[-2]/RC[-4]-1 -> -0.37599534222648423 | HW67: 1257 | HX67: 1707 | HY67: =+RC[-1]/RC[-2]-1 -> 0.35799522673031037 | HZ67: 2005852 | IA67: 0 | IB67: 2304560 | IC67: =+RC[-1]/RC[-2]-1 -> #DIV/0! | ID67: =+RC[-2]/RC[-4]-1 -> 0.14891826515615314 | IE67: 1785 | IF67: 1256 | IG67: =+RC[-1]/RC[-2]-1 -> -0.29635854341736689 | IH67: 1043933 | II67: 0 | IJ67: 926805 | IK67: =+RC[-1]/RC[-2]-1 -> #DIV/0! | IL67: =+RC[-2]/RC[-4]-1 -> -0.11219877137709033 | IM67: 822 | IN67: 665 | IO67: =+RC[-1]/RC[-2]-1 -> -0.19099756690997571
A68: 02.03.2016 | B68: 63881841 | C68: 0 | D68: 59905737 | E68: =+RC[-1]/RC[-2]-1 -> #DIV/0! | F68: =+RC[-2]/RC[-4]-1 -> -6.2241537466022567E-2 | G68: 38872 | H68: 42184 | I68: =+RC[-1]/RC[-2]-1 -> 8.5202716608355544E-2 | J68: 0 | K68: 0 | L68: 672100 | M68: =+RC[-1]/RC[-2]-1 -> #DIV/0! | N68: =+RC[-2]/RC[-4]-1 -> #DIV/0! | O68: 827 | P68: 0 | Q68: =+RC[-1]/RC[-2]-1 -> -1 | R68: 370870 | S68: 0 | T68: 633904 | U68: =+RC[-1]/RC[-2]-1 -> #DIV/0! | V68: =+RC[-2]/RC[-4]-1 -> 0.70923504192843856 | W68: 712 | X68: 492 | Y68: =+RC[-1]/RC[-2]-1 -> -0.3089887640449438 | Z68: 795721 | AA68: 0 | AB68: 568641 | AC68: =+RC[-1]/RC[-2]-1 -> #DIV/0! | AD68: =+RC[-2]/RC[-4]-1 -> -0.28537640705724743 | AE68: 401 | AF68: 584 | AG68: =+RC[-1]/RC[-2]-1 -> 0.45635910224438914 | AH68: 1085418 | AI68: 0 | AJ68: 2919256 | AK68: =+RC[-1]/RC[-2]-1 -> #DIV/0! | AL68: =+RC[-2]/RC[-4]-1 -> 1.6895223775540851 | AM68: 2748 | AN68: 1404 | AO68: =+RC[-1]/RC[-2]-1 -> -0.48908296943231444 | AP68: 7956338 | AQ68: 0 | AR68: 6895434 | AS68: =+RC[-1]/RC[-2]-1 -> #DIV/0! | AT68: =+RC[-2]/RC[-4]-1 -> -0.13334074042606037 | AU68: 3872 | AV68: 4592 | AW68: =+RC[-1]/RC[-2]-1 -> 0.18595041322314043 | AX68: 4118561 | AY68: 0 | AZ68: 5209841 | BA68: =+RC[-1]/RC[-2]-1 -> #DIV/0! | BB68: =+RC[-2]/RC[-4]-1 -> 0.26496633168720818 | BC68: 2743 | BD68: 2559 | BE68: =+RC[-1]/RC[-2]-1 -> -6.7079839591687951E-2 | BF68: 1638258 | BG68: 0 | BH68: 1429549 | BI68: =+RC[-1]/RC[-2]-1 -> #DIV/0! | BJ68: =+RC[-2]/RC[-4]-1 -> -0.12739690573767992 | BK68: 1313 | BL68: 1476 | BM68: =+RC[-1]/RC[-2]-1 -> 0.12414318354912424 | BN68: 969592 | BO68: 0 | BP68: 724764 | BQ68: =+RC[-1]/RC[-2]-1 -> #DIV/0! | BR68: =+RC[-2]/RC[-4]-1 -> -0.25250620879710228 | BS68: 1129 | BT68: 1426 | BU68: =+RC[-1]/RC[-2]-1 -> 0.26306465899025677 | BV68: 9799011 | BW68: 0 | BX68: 9047391 | BY68: =+RC[-1]/RC[-2]-1 -> #DIV/0! | BZ68: =+RC[-2]/RC[-4]-1 -> -7.6703659175400452E-2 | CA68: 2945 | CB68: 3208 | CC68: =+RC[-1]/RC[-2]-1 -> 8.9303904923599298E-2 | CD68: 2615855 | CE68: 0 | CF68: 2127327 | CG68: =+RC[-1]/RC[-2]-1 -> #DIV/0! | CH68: =+RC[-2]/RC[-4]-1 -> -0.18675652893604577 | CI68: 1598 | CJ68: 1691 | CK68: =+RC[-1]/RC[-2]-1 -> 5.8197747183980075E-2 | CL68: 1504872 | CM68: 0 | CN68: 0 | CO68: =+RC[-1]/RC[-2]-1 -> #DIV/0! | CP68: =+RC[-2]/RC[-4]-1 -> -1 | CQ68: 0 | CR68: 1139 | CS68: =+RC[-1]/RC[-2]-1 -> #DIV/0! | CT68: 2972435 | CU68: 0 | CV68: 2353046 | CW68: =+RC[-1]/RC[-2]-1 -> #DIV/0! | CX68: =+RC[-2]/RC[-4]-1 -> -0.20837764324535268 | CY68: 1196 | CZ68: 1305 | DA68: =+RC[-1]/RC[-2]-1 -> 9.1137123745819393E-2 | DB68: 0 | DC68: 0 | DD68: 0 | DE68: =+RC[-1]/RC[-2]-1 -> #DIV/0! | DF68: =+RC[-2]/RC[-4]-1 -> #DIV/0! | DG68: 0 | DH68: 0 | DI68: =+RC[-1]/RC[-2]-1 -> #DIV/0! | DJ68: 0 | DK68: 0 | DL68: 0 | DM68: =+RC[-1]/RC[-2]-1 -> #DIV/0! | DN68: =+RC[-2]/RC[-4]-1 -> #DIV/0! | DO68: 0 | DP68: 0 | DQ68: =+RC[-1]/RC[-2]-1 -> #DIV/0! | DR68: 1636200 | DS68: 0 | DT68: 561850 | DU68: =+RC[-1]/RC[-2]-1 -> #DIV/0! | DV68: =+RC[-2]/RC[-4]-1 -> -0.65661288351057334 | DW68: 849 | DX68: 1764 | DY68: =+RC[-1]/RC[-2]-1 -> 1.0777385159010602 | DZ68: 1673426 | EA68: 0 | EB68: 0 | EC68: =+RC[-1]/RC[-2]-1 -> #DIV/0! | ED68: =+RC[-2]/RC[-4]-1 -> -1 | EE68: 0 | EF68: 1186 | EG68: =+RC[-1]/RC[-2]-1 -> #DIV/0! | EH68: 3868905 | EI68: 0 | EJ68: 3525621 | EK68: =+RC[-1]/RC[-2]-1 -> #DIV/0! | EL68: =+RC[-2]/RC[-4]-1 -> -8.8728981455993394E-2 | EM68: 3034 | EN68: 3340 | EO68: =+RC[-1]/RC[-2]-1 -> 0.10085695451549115 | EP68: 2979649 | EQ68: 0 | ER68: 3676866 | ES68: =+RC[-1]/RC[-2]-1 -> #DIV/0! | ET68: =+RC[-2]/RC[-4]-1 -> 0.23399299716174626 | EU68: 1993 | EV68: 1744 | EW68: =+RC[-1]/RC[-2]-1 -> -0.12493728048168595 | EX68: 381707 | EY68: 0 | EZ68: 120701 | FA68: =+RC[-1]/RC[-2]-1 -> #DIV/0! | FB68: =+RC[-2]/RC[-4]-1 -> -0.68378625490232037 | FC68: 213 | FD68: 436 | FE68: =+RC[-1]/RC[-2]-1 -> 1.0469483568075115 | FF68: 2547788 | FG68: 0 | FH68: 2604158 | FI68: =+RC[-1]/RC[-2]-1 -> #DIV/0! | FJ68: =+RC[-2]/RC[-4]-1 -> 2.2125074770742215E-2 | FK68: 1773 | FL68: 1870 | FM68: =+RC[-1]/RC[-2]-1 -> 5.4709531866892203E-2 | FN68: 535825 | FO68: 0 | FP68: 214367 | FQ68: =+RC[-1]/RC[-2]-1 -> #DIV/0! | FR68: =+RC[-2]/RC[-4]-1 -> -0.59993094760416188 | FS68: 354 | FT68: 663 | FU68: =+RC[-1]/RC[-2]-1 -> 0.87288135593220328 | FV68: 3304458 | FW68: 0 | FX68: 4813071 | FY68: =+RC[-1]/RC[-2]-1 -> #DIV/0! | FZ68: =+RC[-2]/RC[-4]-1 -> 0.45653871224872589 | GA68: 1962 | GB68: 1624 | GC68: =+RC[-1]/RC[-2]-1 -> -0.17227319062181445 | GD68: 0 | GE68: 0 | GF68: 0 | GG68: =+RC[-1]/RC[-2]-1 -> #DIV/0! | GH68: =+RC[-2]/RC[-4]-1 -> #DIV/0! | GI68: 0 | GJ68: 0 | GK68: =+RC[-1]/RC[-2]-1 -> #DIV/0! | GL68: 3644202 | GM68: 0 | GN68: 2914975 | GO68: =+RC[-1]/RC[-2]-1 -> #DIV/0! | GP68: =+RC[-2]/RC[-4]-1 -> -0.20010608632562077 | GQ68: 2095 | GR68: 2250 | GS68: =+RC[-1]/RC[-2]-1 -> 7.398568019093088E-2 | GT68: 819273 | GU68: 0 | GV68: 739721 | GW68: =+RC[-1]/RC[-2]-1 -> #DIV/0! | GX68: =+RC[-2]/RC[-4]-1 -> -9.7100722225680558E-2 | GY68: 749 | GZ68: 919 | HA68: =+RC[-1]/RC[-2]-1 -> 0.22696929238985319 | HB68: 2373811 | HC68: 0 | HD68: 1536440 | HE68: =+RC[-1]/RC[-2]-1 -> #DIV/0! | HF68: =+RC[-2]/RC[-4]-1 -> -0.35275386288124877 | HG68: 985 | HH68: 1301 | HI68: =+RC[-1]/RC[-2]-1 -> 0.32081218274111678 | HJ68: 1952992 | HK68: 0 | HL68: 1767145 | HM68: =+RC[-1]/RC[-2]-1 -> #DIV/0! | HN68: =+RC[-2]/RC[-4]-1 -> -9.5160144025167592E-2 | HO68: 1519 | HP68: 1443 | HQ68: =+RC[-1]/RC[-2]-1 -> -5.0032916392363402E-2 | HR68: 1439266 | HS68: 0 | HT68: 1365638 | HU68: =+RC[-1]/RC[-2]-1 -> #DIV/0! | HV68: =+RC[-2]/RC[-4]-1 -> -5.1156631227306182E-2 | HW68: 1356 | HX68: 1469 | HY68: =+RC[-1]/RC[-2]-1 -> 8.3333333333333259E-2 | HZ68: 2003900 | IA68: 0 | IB68: 2557874 | IC68: =+RC[-1]/RC[-2]-1 -> #DIV/0! | ID68: =+RC[-2]/RC[-4]-1 -> 0.27644792654324069 | IE68: 1698 | IF68: 1544 | IG68: =+RC[-1]/RC[-2]-1 -> -9.0694935217903394E-2 | IH68: 893508 | II68: 0 | IJ68: 926057 | IK68: =+RC[-1]/RC[-2]-1 -> #DIV/0! | IL68: =+RC[-2]/RC[-4]-1 -> 3.6428325208056389E-2 | IM68: 808 | IN68: 755 | IO68: =+RC[-1]/RC[-2]-1 -> -6.5594059405940541E-2
A69: 03.03.2016 | B69: 65980191 | C69: 0 | D69: 65948135 | E69: =+RC[-1]/RC[-2]-1 -> #DIV/0! | F69: =+RC[-2]/RC[-4]-1 -> -4.8584278878494036E-4 | G69: 39790 | H69: 43138 | I69: =+RC[-1]/RC[-2]-1 -> 8.4141744156823295E-2 | J69: 0 | K69: 0 | L69: 772845 | M69: =+RC[-1]/RC[-2]-1 -> #DIV/0! | N69: =+RC[-2]/RC[-4]-1 -> #DIV/0! | O69: 765 | P69: 0 | Q69: =+RC[-1]/RC[-2]-1 -> -1 | R69: 424359 | S69: 0 | T69: 720431 | U69: =+RC[-1]/RC[-2]-1 -> #DIV/0! | V69: =+RC[-2]/RC[-4]-1 -> 0.69769228412735451 | W69: 724 | X69: 519 | Y69: =+RC[-1]/RC[-2]-1 -> -0.28314917127071826 | Z69: 719228 | AA69: 0 | AB69: 700162 | AC69: =+RC[-1]/RC[-2]-1 -> #DIV/0! | AD69: =+RC[-2]/RC[-4]-1 -> -2.6508979072005001E-2 | AE69: 368 | AF69: 508 | AG69: =+RC[-1]/RC[-2]-1 -> 0.38043478260869557 | AH69: 1439070 | AI69: 0 | AJ69: 3363630 | AK69: =+RC[-1]/RC[-2]-1 -> #DIV/0! | AL69: =+RC[-2]/RC[-4]-1 -> 1.3373637140653338 | AM69: 2788 | AN69: 1581 | AO69: =+RC[-1]/RC[-2]-1 -> -0.43292682926829273 | AP69: 7989394 | AQ69: 0 | AR69: 7852006 | AS69: =+RC[-1]/RC[-2]-1 -> #DIV/0! | AT69: =+RC[-2]/RC[-4]-1 -> -1.7196297992063014E-2 | AU69: 3915 | AV69: 4636 | AW69: =+RC[-1]/RC[-2]-1 -> 0.18416347381864617 | AX69: 4553550 | AY69: 0 | AZ69: 5241903 | BA69: =+RC[-1]/RC[-2]-1 -> #DIV/0! | BB69: =+RC[-2]/RC[-4]-1 -> 0.1511684290279014 | BC69: 2773 | BD69: 2779 | BE69: =+RC[-1]/RC[-2]-1 -> 2.1637216011540783E-3 | BF69: 1647828 | BG69: 0 | BH69: 1638133 | BI69: =+RC[-1]/RC[-2]-1 -> #DIV/0! | BJ69: =+RC[-2]/RC[-4]-1 -> -5.8835024043771833E-3 | BK69: 1309 | BL69: 1478 | BM69: =+RC[-1]/RC[-2]-1 -> 0.12910618792971729 | BN69: 1513744 | BO69: 0 | BP69: 666182 | BQ69: =+RC[-1]/RC[-2]-1 -> #DIV/0! | BR69: =+RC[-2]/RC[-4]-1 -> -0.55991105497362836 | BS69: 1233 | BT69: 1578 | BU69: =+RC[-1]/RC[-2]-1 -> 0.27980535279805352 | BV69: 9451459 | BW69: 0 | BX69: 9445635 | BY69: =+RC[-1]/RC[-2]-1 -> #DIV/0! | BZ69: =+RC[-2]/RC[-4]-1 -> -6.1620116005367542E-4 | CA69: 2852 | CB69: 3123 | CC69: =+RC[-1]/RC[-2]-1 -> 9.5021037868162628E-2 | CD69: 2254792 | CE69: 0 | CF69: 2288420 | CG69: =+RC[-1]/RC[-2]-1 -> #DIV/0! | CH69: =+RC[-2]/RC[-4]-1 -> 1.4914014241668383E-2 | CI69: 1720 | CJ69: 1538 | CK69: =+RC[-1]/RC[-2]-1 -> -0.10581395348837208 | CL69: 1508025 | CM69: 0 | CN69: 0 | CO69: =+RC[-1]/RC[-2]-1 -> #DIV/0! | CP69: =+RC[-2]/RC[-4]-1 -> -1 | CQ69: 0 | CR69: 1121 | CS69: =+RC[-1]/RC[-2]-1 -> #DIV/0! | CT69: 3342465 | CU69: 0 | CV69: 3046197 | CW69: =+RC[-1]/RC[-2]-1 -> #DIV/0! | CX69: =+RC[-2]/RC[-4]-1 -> -8.8637577356830977E-2 | CY69: 1229 | CZ69: 1447 | DA69: =+RC[-1]/RC[-2]-1 -> 0.17737998372660702 | DB69: 0 | DC69: 0 | DD69: 0 | DE69: =+RC[-1]/RC[-2]-1 -> #DIV/0! | DF69: =+RC[-2]/RC[-4]-1 -> #DIV/0! | DG69: 0 | DH69: 0 | DI69: =+RC[-1]/RC[-2]-1 -> #DIV/0! | DJ69: 0 | DK69: 0 | DL69: 0 | DM69: =+RC[-1]/RC[-2]-1 -> #DIV/0! | DN69: =+RC[-2]/RC[-4]-1 -> #DIV/0! | DO69: 0 | DP69: 0 | DQ69: =+RC[-1]/RC[-2]-1 -> #DIV/0! | DR69: 1757514 | DS69: 0 | DT69: 692531 | DU69: =+RC[-1]/RC[-2]-1 -> #DIV/0! | DV69: =+RC[-2]/RC[-4]-1 -> -0.60595989562529806 | DW69: 995 | DX69: 1811 | DY69: =+RC[-1]/RC[-2]-1 -> 0.82010050251256272 | DZ69: 1579173 | EA69: 0 | EB69: 0 | EC69: =+RC[-1]/RC[-2]-1 -> #DIV/0! | ED69: =+RC[-2]/RC[-4]-1 -> -1 | EE69: 0 | EF69: 1080 | EG69: =+RC[-1]/RC[-2]-1 -> #DIV/0! | EH69: 4072426 | EI69: 0 | EJ69: 4113293 | EK69: =+RC[-1]/RC[-2]-1 -> #DIV/0! | EL69: =+RC[-2]/RC[-4]-1 -> 1.0035050360645004E-2 | EM69: 3291 | EN69: 3444 | EO69: =+RC[-1]/RC[-2]-1 -> 4.6490428441203324E-2 | EP69: 2981367 | EQ69: 0 | ER69: 3999400 | ES69: =+RC[-1]/RC[-2]-1 -> #DIV/0! | ET69: =+RC[-2]/RC[-4]-1 -> 0.34146517352610406 | EU69: 2054 | EV69: 1761 | EW69: =+RC[-1]/RC[-2]-1 -> -0.14264849074975661 | EX69: 317707 | EY69: 0 | EZ69: 123895 | FA69: =+RC[-1]/RC[-2]-1 -> #DIV/0! | FB69: =+RC[-2]/RC[-4]-1 -> -0.61003377325649111 | FC69: 214 | FD69: 399 | FE69: =+RC[-1]/RC[-2]-1 -> 0.86448598130841114 | FF69: 2657690 | FG69: 0 | FH69: 2644953 | FI69: =+RC[-1]/RC[-2]-1 -> #DIV/0! | FJ69: =+RC[-2]/RC[-4]-1 -> -4.7925077793120607E-3 | FK69: 1821 | FL69: 1893 | FM69: =+RC[-1]/RC[-2]-1 -> 3.9538714991762758E-2 | FN69: 553544 | FO69: 0 | FP69: 148893 | FQ69: =+RC[-1]/RC[-2]-1 -> #DIV/0! | FR69: =+RC[-2]/RC[-4]-1 -> -0.73101867240905871 | FS69: 320 | FT69: 739 | FU69: =+RC[-1]/RC[-2]-1 -> 1.3093750000000002 | FV69: 3893585 | FW69: 0 | FX69: 5392359 | FY69: =+RC[-1]/RC[-2]-1 -> #DIV/0! | FZ69: =+RC[-2]/RC[-4]-1 -> 0.38493419303803567 | GA69: 2012 | GB69: 1740 | GC69: =+RC[-1]/RC[-2]-1 -> -0.13518886679920472 | GD69: 0 | GE69: 0 | GF69: 0 | GG69: =+RC[-1]/RC[-2]-1 -> #DIV/0! | GH69: =+RC[-2]/RC[-4]-1 -> #DIV/0! | GI69: 0 | GJ69: 0 | GK69: =+RC[-1]/RC[-2]-1 -> #DIV/0! | GL69: 3273956 | GM69: 0 | GN69: 3278274 | GO69: =+RC[-1]/RC[-2]-1 -> #DIV/0! | GP69: =+RC[-2]/RC[-4]-1 -> 1.3188937175698801E-3 | GQ69: 2085 | GR69: 2197 | GS69: =+RC[-1]/RC[-2]-1 -> 5.3717026378896859E-2 | GT69: 952083 | GU69: 0 | GV69: 1050519 | GW69: =+RC[-1]/RC[-2]-1 -> #DIV/0! | GX69: =+RC[-2]/RC[-4]-1 -> 0.10339014560705317 | GY69: 946 | GZ69: 972 | HA69: =+RC[-1]/RC[-2]-1 -> 2.748414376321362E-2 | HB69: 2588064 | HC69: 0 | HD69: 1799689 | HE69: =+RC[-1]/RC[-2]-1 -> #DIV/0! | HF69: =+RC[-2]/RC[-4]-1 -> -0.30461959209664058 | HG69: 1013 | HH69: 1418 | HI69: =+RC[-1]/RC[-2]-1 -> 0.39980256663376101 | HJ69: 2241235 | HK69: 0 | HL69: 1891291 | HM69: =+RC[-1]/RC[-2]-1 -> #DIV/0! | HN69: =+RC[-2]/RC[-4]-1 -> -0.15613891448241701 | HO69: 1464 | HP69: 1610 | HQ69: =+RC[-1]/RC[-2]-1 -> 9.9726775956284097E-2 | HR69: 1355483 | HS69: 0 | HT69: 1359933 | HU69: =+RC[-1]/RC[-2]-1 -> #DIV/0! | HV69: =+RC[-2]/RC[-4]-1 -> 3.2829626044739157E-3 | HW69: 1359 | HX69: 1414 | HY69: =+RC[-1]/RC[-2]-1 -> 4.0470934510669521E-2 | HZ69: 1992318 | IA69: 0 | IB69: 2746131 | IC69: =+RC[-1]/RC[-2]-1 -> #DIV/0! | ID69: =+RC[-2]/RC[-4]-1 -> 0.37835977991465208 | IE69: 1752 | IF69: 1549 | IG69: =+RC[-1]/RC[-2]-1 -> -0.1158675799086758 | IH69: 920132 | II69: 0 | IJ69: 971430 | IK69: =+RC[-1]/RC[-2]-1 -> #DIV/0! | IL69: =+RC[-2]/RC[-4]-1 -> 5.5750696639177866E-2 | IM69: 788 | IN69: 803 | IO69: =+RC[-1]/RC[-2]-1 -> 1.9035532994923887E-2
A70: 04.03.2016 | B70: 72018163 | C70: 0 | D70: 70486876 | E70: =+RC[-1]/RC[-2]-1 -> #DIV/0! | F70: =+RC[-2]/RC[-4]-1 -> -2.1262511236228021E-2 | G70: 38956 | H70: 45101 | I70: =+RC[-1]/RC[-2]-1 -> 0.1577420679741246 | J70: 0 | K70: 0 | L70: 791096 | M70: =+RC[-1]/RC[-2]-1 -> #DIV/0! | N70: =+RC[-2]/RC[-4]-1 -> #DIV/0! | O70: 930 | P70: 0 | Q70: =+RC[-1]/RC[-2]-1 -> -1 | R70: 389020 | S70: 0 | T70: 740390 | U70: =+RC[-1]/RC[-2]-1 -> #DIV/0! | V70: =+RC[-2]/RC[-4]-1 -> 0.90321834352989572 | W70: 677 | X70: 500 | Y70: =+RC[-1]/RC[-2]-1 -> -0.26144756277695713 | Z70: 623268 | AA70: 0 | AB70: 761064 | AC70: =+RC[-1]/RC[-2]-1 -> #DIV/0! | AD70: =+RC[-2]/RC[-4]-1 -> 0.22108627428329397 | AE70: 446 | AF70: 490 | AG70: =+RC[-1]/RC[-2]-1 -> 9.8654708520179435E-2 | AH70: 1490198 | AI70: 0 | AJ70: 3977918 | AK70: =+RC[-1]/RC[-2]-1 -> #DIV/0! | AL70: =+RC[-2]/RC[-4]-1 -> 1.6693888999985238 | AM70: 3100 | AN70: 1541 | AO70: =+RC[-1]/RC[-2]-1 -> -0.50290322580645164 | AP70: 9116644 | AQ70: 0 | AR70: 9486973 | AS70: =+RC[-1]/RC[-2]-1 -> #DIV/0! | AT70: =+RC[-2]/RC[-4]-1 -> 4.0621197888170313E-2 | AU70: 4533 | AV70: 5014 | AW70: =+RC[-1]/RC[-2]-1 -> 0.10611074343701743 | AX70: 5274046 | AY70: 0 | AZ70: 0 | BA70: =+RC[-1]/RC[-2]-1 -> #DIV/0! | BB70: =+RC[-2]/RC[-4]-1 -> -1 | BC70: 0 | BD70: 2850 | BE70: =+RC[-1]/RC[-2]-1 -> #DIV/0! | BF70: 1618008 | BG70: 0 | BH70: 2130542 | BI70: =+RC[-1]/RC[-2]-1 -> #DIV/0! | BJ70: =+RC[-2]/RC[-4]-1 -> 0.31676852030397873 | BK70: 1465 | BL70: 1533 | BM70: =+RC[-1]/RC[-2]-1 -> 4.6416382252559618E-2 | BN70: 1471843 | BO70: 0 | BP70: 1039393 | BQ70: =+RC[-1]/RC[-2]-1 -> #DIV/0! | BR70: =+RC[-2]/RC[-4]-1 -> -0.29381530502913689 | BS70: 1345 | BT70: 1560 | BU70: =+RC[-1]/RC[-2]-1 -> 0.1598513011152416 | BV70: 9900796 | BW70: 0 | BX70: 11451972 | BY70: =+RC[-1]/RC[-2]-1 -> #DIV/0! | BZ70: =+RC[-2]/RC[-4]-1 -> 0.15667184739489626 | CA70: 3270 | CB70: 3281 | CC70: =+RC[-1]/RC[-2]-1 -> 3.3639143730885834E-3 | CD70: 2319969 | CE70: 0 | CF70: 2783136 | CG70: =+RC[-1]/RC[-2]-1 -> #DIV/0! | CH70: =+RC[-2]/RC[-4]-1 -> 0.19964361592762669 | CI70: 1881 | CJ70: 1629 | CK70: =+RC[-1]/RC[-2]-1 -> -0.13397129186602874 | CL70: 1809943 | CM70: 0 | CN70: 0 | CO70: =+RC[-1]/RC[-2]-1 -> #DIV/0! | CP70: =+RC[-2]/RC[-4]-1 -> -1 | CQ70: 0 | CR70: 1243 | CS70: =+RC[-1]/RC[-2]-1 -> #DIV/0! | CT70: 3455475 | CU70: 0 | CV70: 3476831 | CW70: =+RC[-1]/RC[-2]-1 -> #DIV/0! | CX70: =+RC[-2]/RC[-4]-1 -> 6.1803370014252845E-3 | CY70: 1313 | CZ70: 1447 | DA70: =+RC[-1]/RC[-2]-1 -> 0.10205635948210201 | DB70: 0 | DC70: 0 | DD70: 0 | DE70: =+RC[-1]/RC[-2]-1 -> #DIV/0! | DF70: =+RC[-2]/RC[-4]-1 -> #DIV/0! | DG70: 0 | DH70: 0 | DI70: =+RC[-1]/RC[-2]-1 -> #DIV/0! | DJ70: 0 | DK70: 0 | DL70: 0 | DM70: =+RC[-1]/RC[-2]-1 -> #DIV/0! | DN70: =+RC[-2]/RC[-4]-1 -> #DIV/0! | DO70: 0 | DP70: 0 | DQ70: =+RC[-1]/RC[-2]-1 -> #DIV/0! | DR70: 2025412 | DS70: 0 | DT70: 827808 | DU70: =+RC[-1]/RC[-2]-1 -> #DIV/0! | DV70: =+RC[-2]/RC[-4]-1 -> -0.59128908093760679 | DW70: 1110 | DX70: 1843 | DY70: =+RC[-1]/RC[-2]-1 -> 0.66036036036036028 | DZ70: 1676889 | EA70: 0 | EB70: 0 | EC70: =+RC[-1]/RC[-2]-1 -> #DIV/0! | ED70: =+RC[-2]/RC[-4]-1 -> -1 | EE70: 0 | EF70: 1177 | EG70: =+RC[-1]/RC[-2]-1 -> #DIV/0! | EH70: 4099690 | EI70: 0 | EJ70: 4933373 | EK70: =+RC[-1]/RC[-2]-1 -> #DIV/0! | EL70: =+RC[-2]/RC[-4]-1 -> 0.20335269252065391 | EM70: 3426 | EN70: 3382 | EO70: =+RC[-1]/RC[-2]-1 -> -1.2842965557501418E-2 | EP70: 3320493 | EQ70: 0 | ER70: 4677193 | ES70: =+RC[-1]/RC[-2]-1 -> #DIV/0! | ET70: =+RC[-2]/RC[-4]-1 -> 0.40858390606455131 | EU70: 2228 | EV70: 1909 | EW70: =+RC[-1]/RC[-2]-1 -> -0.14317773788150812 | EX70: 369411 | EY70: 0 | EZ70: 147366 | FA70: =+RC[-1]/RC[-2]-1 -> #DIV/0! | FB70: =+RC[-2]/RC[-4]-1 -> -0.60107847357008859 | FC70: 240 | FD70: 443 | FE70: =+RC[-1]/RC[-2]-1 -> 0.84583333333333344 | FF70: 3103695 | FG70: 0 | FH70: 4093682 | FI70: =+RC[-1]/RC[-2]-1 -> #DIV/0! | FJ70: =+RC[-2]/RC[-4]-1 -> 0.31897045296010074 | FK70: 2151 | FL70: 2026 | FM70: =+RC[-1]/RC[-2]-1 -> -5.8112505811250603E-2 | FN70: 696552 | FO70: 0 | FP70: 252658 | FQ70: =+RC[-1]/RC[-2]-1 -> #DIV/0! | FR70: =+RC[-2]/RC[-4]-1 -> -0.63727331197096548 | FS70: 357 | FT70: 757 | FU70: =+RC[-1]/RC[-2]-1 -> 1.1204481792717087 | FV70: 4355738 | FW70: 0 | FX70: 6909050 | FY70: =+RC[-1]/RC[-2]-1 -> #DIV/0! | FZ70: =+RC[-2]/RC[-4]-1 -> 0.58619503744256418 | GA70: 2374 | GB70: 1739 | GC70: =+RC[-1]/RC[-2]-1 -> -0.26748104465037914 | GD70: 0 | GE70: 0 | GF70: 0 | GG70: =+RC[-1]/RC[-2]-1 -> #DIV/0! | GH70: =+RC[-2]/RC[-4]-1 -> #DIV/0! | GI70: 0 | GJ70: 0 | GK70: =+RC[-1]/RC[-2]-1 -> #DIV/0! | GL70: 3980204 | GM70: 0 | GN70: 0 | GO70: =+RC[-1]/RC[-2]-1 -> #DIV/0! | GP70: =+RC[-2]/RC[-4]-1 -> -1 | GQ70: 0 | GR70: 2490 | GS70: =+RC[-1]/RC[-2]-1 -> #DIV/0! | GT70: 1126408 | GU70: 0 | GV70: 1269619 | GW70: =+RC[-1]/RC[-2]-1 -> #DIV/0! | GX70: =+RC[-2]/RC[-4]-1 -> 0.12713954446346265 | GY70: 1095 | GZ70: 1110 | HA70: =+RC[-1]/RC[-2]-1 -> 1.3698630136986356E-2 | HB70: 2349946 | HC70: 0 | HD70: 1935273 | HE70: =+RC[-1]/RC[-2]-1 -> #DIV/0! | HF70: =+RC[-2]/RC[-4]-1 -> -0.17646065058516236 | HG70: 1110 | HH70: 1414 | HI70: =+RC[-1]/RC[-2]-1 -> 0.27387387387387396 | HJ70: 2542180 | HK70: 0 | HL70: 2410571 | HM70: =+RC[-1]/RC[-2]-1 -> #DIV/0! | HN70: =+RC[-2]/RC[-4]-1 -> -5.1770134294188419E-2 | HO70: 1670 | HP70: 1753 | HQ70: =+RC[-1]/RC[-2]-1 -> 4.9700598802395302E-2 | HR70: 1432659 | HS70: 0 | HT70: 1660604 | HU70: =+RC[-1]/RC[-2]-1 -> #DIV/0! | HV70: =+RC[-2]/RC[-4]-1 -> 0.15910624928890971 | HW70: 1457 | HX70: 1478 | HY70: =+RC[-1]/RC[-2]-1 -> 1.441317776252582E-2 | HZ70: 2445071 | IA70: 0 | IB70: 3393057 | IC70: =+RC[-1]/RC[-2]-1 -> #DIV/0! | ID70: =+RC[-2]/RC[-4]-1 -> 0.38771307663458443 | IE70: 1900 | IF70: 1664 | IG70: =+RC[-1]/RC[-2]-1 -> -0.12421052631578944 | IH70: 1024605 | II70: 0 | IJ70: 1337307 | IK70: =+RC[-1]/RC[-2]-1 -> #DIV/0! | IL70: =+RC[-2]/RC[-4]-1 -> 0.30519273280922898 | IM70: 878 | IN70: 828 | IO70: =+RC[-1]/RC[-2]-1 -> -5.6947608200455635E-2
A71: MART | B71: 280664066 | C71: 0 | D71: 255613369 | E71: =+RC[-1]/RC[-2]-1 -> #DIV/0! | F71: =+RC[-2]/RC[-4]-1 -> -8.9255091886255244E-2 | G71: 158128 | H71: 175692 | I71: =+RC[-1]/RC[-2]-1 -> 0.11107457249822938 | J71: 0 | K71: 0 | L71: 2944374 | M71: =+RC[-1]/RC[-2]-1 -> #DIV/0! | N71: =+RC[-2]/RC[-4]-1 -> #DIV/0! | O71: 3440 | P71: 0 | Q71: =+RC[-1]/RC[-2]-1 -> -1 | R71: 1617667 | S71: 0 | T71: 2770661 | U71: =+RC[-1]/RC[-2]-1 -> #DIV/0! | V71: =+RC[-2]/RC[-4]-1 -> 0.71275114099502557 | W71: 2906 | X71: 1993 | Y71: =+RC[-1]/RC[-2]-1 -> -0.31417756366139027 | Z71: 2920797 | AA71: 0 | AB71: 2687031 | AC71: =+RC[-1]/RC[-2]-1 -> #DIV/0! | AD71: =+RC[-2]/RC[-4]-1 -> -8.0035004144416777E-2 | AE71: 1650 | AF71: 1978 | AG71: =+RC[-1]/RC[-2]-1 -> 0.19878787878787874 | AH71: 6247311 | AI71: 0 | AJ71: 12865578 | AK71: =+RC[-1]/RC[-2]-1 -> #DIV/0! | AL71: =+RC[-2]/RC[-4]-1 -> 1.0593785070088555 | AM71: 11572 | AN71: 6529 | AO71: =+RC[-1]/RC[-2]-1 -> -0.43579329415831314 | AP71: 36583644 | AQ71: 0 | AR71: 30737712 | AS71: =+RC[-1]/RC[-2]-1 -> #DIV/0! | AT71: =+RC[-2]/RC[-4]-1 -> -0.15979632865441185 | AU71: 16397 | AV71: 20422 | AW71: =+RC[-1]/RC[-2]-1 -> 0.24547173263401834 | AX71: 19985138 | AY71: 0 | AZ71: 15590102 | BA71: =+RC[-1]/RC[-2]-1 -> #DIV/0! | BB71: =+RC[-2]/RC[-4]-1 -> -0.21991521899923838 | BC71: 8419 | BD71: 11787 | BE71: =+RC[-1]/RC[-2]-1 -> 0.40004751158094787 | BF71: 6557139 | BG71: 0 | BH71: 6499608 | BI71: =+RC[-1]/RC[-2]-1 -> #DIV/0! | BJ71: =+RC[-2]/RC[-4]-1 -> -8.7737960107296953E-3 | BK71: 5352 | BL71: 5727 | BM71: =+RC[-1]/RC[-2]-1 -> 7.0067264573991039E-2 | BN71: 5227359 | BO71: 0 | BP71: 3249427 | BQ71: =+RC[-1]/RC[-2]-1 -> #DIV/0! | BR71: =+RC[-2]/RC[-4]-1 -> -0.37838074637689889 | BS71: 5016 | BT71: 6430 | BU71: =+RC[-1]/RC[-2]-1 -> 0.28189792663476876 | BV71: 40202753 | BW71: 0 | BX71: 38914289 | BY71: =+RC[-1]/RC[-2]-1 -> #DIV/0! | BZ71: =+RC[-2]/RC[-4]-1 -> -3.2049148474981304E-2 | CA71: 11979 | CB71: 12238 | CC71: =+RC[-1]/RC[-2]-1 -> 2.162117038150102E-2 | CD71: 9458743 | CE71: 0 | CF71: 9496166 | CG71: =+RC[-1]/RC[-2]-1 -> #DIV/0! | CH71: =+RC[-2]/RC[-4]-1 -> 3.9564453754583617E-3 | CI71: 6910 | CJ71: 6327 | CK71: =+RC[-1]/RC[-2]-1 -> -8.4370477568740943E-2 | CL71: 6881090 | CM71: 0 | CN71: 0 | CO71: =+RC[-1]/RC[-2]-1 -> #DIV/0! | CP71: =+RC[-2]/RC[-4]-1 -> -1 | CQ71: 0 | CR71: 4843 | CS71: =+RC[-1]/RC[-2]-1 -> #DIV/0! | CT71: 13784696 | CU71: 0 | CV71: 11574821 | CW71: =+RC[-1]/RC[-2]-1 -> #DIV/0! | CX71: =+RC[-2]/RC[-4]-1 -> -0.16031365508532069 | CY71: 4976 | CZ71: 5493 | DA71: =+RC[-1]/RC[-2]-1 -> 0.10389871382636651 | DB71: 0 | DC71: 0 | DD71: 0 | DE71: =+RC[-1]/RC[-2]-1 -> #DIV/0! | DF71: =+RC[-2]/RC[-4]-1 -> #DIV/0! | DG71: 0 | DH71: 0 | DI71: =+RC[-1]/RC[-2]-1 -> #DIV/0! | DJ71: 0 | DK71: 0 | DL71: 0 | DM71: =+RC[-1]/RC[-2]-1 -> #DIV/0! | DN71: =+RC[-2]/RC[-4]-1 -> #DIV/0! | DO71: 0 | DP71: 0 | DQ71: =+RC[-1]/RC[-2]-1 -> #DIV/0! | DR71: 7684392 | DS71: 0 | DT71: 2750914 | DU71: =+RC[-1]/RC[-2]-1 -> #DIV/0! | DV71: =+RC[-2]/RC[-4]-1 -> -0.64201279684846901 | DW71: 4055 | DX71: 7625 | DY71: =+RC[-1]/RC[-2]-1 -> 0.88039457459926007 | DZ71: 6470879 | EA71: 0 | EB71: 0 | EC71: =+RC[-1]/RC[-2]-1 -> #DIV/0! | ED71: =+RC[-2]/RC[-4]-1 -> -1 | EE71: 0 | EF71: 4471 | EG71: =+RC[-1]/RC[-2]-1 -> #DIV/0! | EH71: 15437986 | EI71: 0 | EJ71: 16403183 | EK71: =+RC[-1]/RC[-2]-1 -> #DIV/0! | EL71: =+RC[-2]/RC[-4]-1 -> 6.2520914321336996E-2 | EM71: 13179 | EN71: 12511 | EO71: =+RC[-1]/RC[-2]-1 -> -5.0686698535548969E-2 | EP71: 13227992 | EQ71: 0 | ER71: 15912613 | ES71: =+RC[-1]/RC[-2]-1 -> #DIV/0! | ET71: =+RC[-2]/RC[-4]-1 -> 0.2029500017840955 | EU71: 8203 | EV71: 7363 | EW71: =+RC[-1]/RC[-2]-1 -> -0.10240156040473003 | EX71: 1447594 | EY71: 0 | EZ71: 527803 | FA71: =+RC[-1]/RC[-2]-1 -> #DIV/0! | FB71: =+RC[-2]/RC[-4]-1 -> -0.63539293475933167 | FC71: 897 | FD71: 1684 | FE71: =+RC[-1]/RC[-2]-1 -> 0.87736900780379035 | FF71: 10861424 | FG71: 0 | FH71: 11856446 | FI71: =+RC[-1]/RC[-2]-1 -> #DIV/0! | FJ71: =+RC[-2]/RC[-4]-1 -> 9.1610639636202418E-2 | FK71: 7520 | FL71: 7454 | FM71: =+RC[-1]/RC[-2]-1 -> -8.7765957446808152E-3 | FN71: 2515039 | FO71: 0 | FP71: 851363 | FQ71: =+RC[-1]/RC[-2]-1 -> #DIV/0! | FR71: =+RC[-2]/RC[-4]-1 -> -0.66149113393470238 | FS71: 1332 | FT71: 3056 | FU71: =+RC[-1]/RC[-2]-1 -> 1.2942942942942941 | FV71: 16726113 | FW71: 0 | FX71: 21698162 | FY71: =+RC[-1]/RC[-2]-1 -> #DIV/0! | FZ71: =+RC[-2]/RC[-4]-1 -> 0.29726266945583824 | GA71: 8186 | GB71: 7204 | GC71: =+RC[-1]/RC[-2]-1 -> -0.1199609088688004 | GD71: 0 | GE71: 0 | GF71: 0 | GG71: =+RC[-1]/RC[-2]-1 -> #DIV/0! | GH71: =+RC[-2]/RC[-4]-1 -> #DIV/0! | GI71: 0 | GJ71: 0 | GK71: =+RC[-1]/RC[-2]-1 -> #DIV/0! | GL71: 15806409 | GM71: 0 | GN71: 8802238 | GO71: =+RC[-1]/RC[-2]-1 -> #DIV/0! | GP71: =+RC[-2]/RC[-4]-1 -> -0.44312221707030353 | GQ71: 6292 | GR71: 10008 | GS71: =+RC[-1]/RC[-2]-1 -> 0.59059122695486321 | GT71: 3839303 | GU71: 0 | GV71: 3824055 | GW71: =+RC[-1]/RC[-2]-1 -> #DIV/0! | GX71: =+RC[-2]/RC[-4]-1 -> -3.9715542117931824E-3 | GY71: 3614 | GZ71: 3864 | HA71: =+RC[-1]/RC[-2]-1 -> 6.9175428887659152E-2 | HB71: 9848915 | HC71: 0 | HD71: 7100318 | HE71: =+RC[-1]/RC[-2]-1 -> #DIV/0! | HF71: =+RC[-2]/RC[-4]-1 -> -0.27907612158293582 | HG71: 4203 | HH71: 5430 | HI71: =+RC[-1]/RC[-2]-1 -> 0.29193433261955737 | HJ71: 8906252 | HK71: 0 | HL71: 7841029 | HM71: =+RC[-1]/RC[-2]-1 -> #DIV/0! | HN71: =+RC[-2]/RC[-4]-1 -> -0.11960395910647936 | HO71: 6170 | HP71: 6123 | HQ71: =+RC[-1]/RC[-2]-1 -> -7.6175040518638992E-3 | HR71: 6096112 | HS71: 0 | HT71: 5552255 | HU71: =+RC[-1]/RC[-2]-1 -> #DIV/0! | HV71: =+RC[-2]/RC[-4]-1 -> -8.9213748041374608E-2 | HW71: 5429 | HX71: 6068 | HY71: =+RC[-1]/RC[-2]-1 -> 0.1177012341130963 | HZ71: 8447141 | IA71: 0 | IB71: 11001622 | IC71: =+RC[-1]/RC[-2]-1 -> #DIV/0! | ID71: =+RC[-2]/RC[-4]-1 -> 0.30240776139524606 | IE71: 7135 | IF71: 6013 | IG71: =+RC[-1]/RC[-2]-1 -> -0.15725297827610374 | IH71: 3882178 | II71: 0 | IJ71: 4161599 | IK71: =+RC[-1]/RC[-2]-1 -> #DIV/0! | IL71: =+RC[-2]/RC[-4]-1 -> 7.1975319009071725E-2 | IM71: 3296 | IN71: 3051 | IO71: =+RC[-1]/RC[-2]-1 -> -7.4332524271844669E-2
A73: TOPLAM | B73: 4212341488 | C73: 3798608679 | D73: 4232403503 | E73: =+RC[-1]/RC[-2]-1 -> 0.11419834488300018 | F73: =+RC[-2]/RC[-4]-1 -> 4.7626753569605107E-3 | G73: 2613682 | H73: 2610889 | I73: =+RC[-1]/RC[-2]-1 -> -1.0686074281416325E-3 | J73: 0 | K73: 53900000 | L73: 51228271 | M73: =+RC[-1]/RC[-2]-1 -> -4.9568256029684621E-2 | N73: =+RC[-2]/RC[-4]-1 -> #DIV/0! | O73: 54690 | P73: 0 | Q73: =+RC[-1]/RC[-2]-1 -> -1 | R73: 28434506 | S73: 38834952 | T73: 38798440 | U73: =+RC[-1]/RC[-2]-1 -> -9.4018398683737292E-4 | V73: =+RC[-2]/RC[-4]-1 -> 0.3644844049690894 | W73: 42435 | X73: 32386 | Y73: =+RC[-1]/RC[-2]-1 -> -0.23680923765759399 | Z73: 44272698 | AA73: 50000000 | AB73: 42768060 | AC73: =+RC[-1]/RC[-2]-1 -> -0.14463879999999996 | AD73: =+RC[-2]/RC[-4]-1 -> -3.398568571538152E-2 | AE73: 27017 | AF73: 24131 | AG73: =+RC[-1]/RC[-2]-1 -> -0.10682163082503604 | AH73: 104214262 | AI73: 147533334 | AJ73: 184312830 | AK73: =+RC[-1]/RC[-2]-1 -> 0.24929617600860299 | AL73: =+RC[-2]/RC[-4]-1 -> 0.76859507002985827 | AM73: 177352 | AN73: 103389 | AO73: =+RC[-1]/RC[-2]-1 -> -0.41704068744643419 | AP73: 561471640 | AQ73: 421725000 | AR73: 532890154 | AS73: =+RC[-1]/RC[-2]-1 -> 0.26359631039184306 | AT73: =+RC[-2]/RC[-4]-1 -> -5.0904594219576271E-2 | AU73: 276418 | AV73: 317270 | AW73: =+RC[-1]/RC[-2]-1 -> 0.14779066486263548 | AX73: 291927447 | AY73: 298050682 | AZ73: 326023536 | BA73: =+RC[-1]/RC[-2]-1 -> 9.3852675700302646E-2 | BB73: =+RC[-2]/RC[-4]-1 -> 0.11679644839972858 | BC73: 179792 | BD73: 169747 | BE73: =+RC[-1]/RC[-2]-1 -> -5.5870116579158191E-2 | BF73: 93512871 | BG73: 85200000 | BH73: 84639272 | BI73: =+RC[-1]/RC[-2]-1 -> -6.5813145539905804E-3 | BJ73: =+RC[-2]/RC[-4]-1 -> -9.4891739555296062E-2 | BK73: 71428 | BL73: 79180 | BM73: =+RC[-1]/RC[-2]-1 -> 0.10852886823094576 | BN73: 73042449 | BO73: 37900000 | BP73: 57384839 | BQ73: =+RC[-1]/RC[-2]-1 -> 0.51411184696569912 | BR73: =+RC[-2]/RC[-4]-1 -> -0.21436315751132606 | BS73: 87580 | BT73: 95882 | BU73: =+RC[-1]/RC[-2]-1 -> 9.479333181091576E-2 | BV73: 593263366 | BW73: 601418100 | BX73: 643691164 | BY73: =+RC[-1]/RC[-2]-1 -> 7.0288978665590474E-2 | BZ73: =+RC[-2]/RC[-4]-1 -> 8.5000694278500211E-2 | CA73: 177165 | CB73: 177987 | CC73: =+RC[-1]/RC[-2]-1 -> 4.6397426128186314E-3 | CD73: 142906225 | CE73: 149222520 | CF73: 146019112 | CG73: =+RC[-1]/RC[-2]-1 -> -2.146732276066643E-2 | CH73: =+RC[-2]/RC[-4]-1 -> 2.1782725000258019E-2 | CI73: 103611 | CJ73: 93267 | CK73: =+RC[-1]/RC[-2]-1 -> -9.9834959608535723E-2 | CL73: 92247374 | CM73: 39000000 | CN73: 60743694 | CO73: =+RC[-1]/RC[-2]-1 -> 0.55753061538461535 | CP73: =+RC[-2]/RC[-4]-1 -> -0.34151302778548476 | CQ73: 49021 | CR73: 67623 | CS73: =+RC[-1]/RC[-2]-1 -> 0.37947002305134525 | CT73: 188968680 | CU73: 152853875 | CV73: 161694245 | CW73: =+RC[-1]/RC[-2]-1 -> 5.7835432696750511E-2 | CX73: =+RC[-2]/RC[-4]-1 -> -0.14433309795041172 | CY73: 70764 | CZ73: 77849 | DA73: =+RC[-1]/RC[-2]-1 -> 0.10012153072183594 | DB73: 0 | DC73: 0 | DD73: 0 | DE73: =+RC[-1]/RC[-2]-1 -> #DIV/0! | DF73: =+RC[-2]/RC[-4]-1 -> #DIV/0! | DG73: 0 | DH73: 0 | DI73: =+RC[-1]/RC[-2]-1 -> #DIV/0! | DJ73: 0 | DK73: 0 | DL73: 0 | DM73: =+RC[-1]/RC[-2]-1 -> #DIV/0! | DN73: =+RC[-2]/RC[-4]-1 -> #DIV/0! | DO73: 0 | DP73: 0 | DQ73: =+RC[-1]/RC[-2]-1 -> #DIV/0! | DR73: 118105256 | DS73: 58000000 | DT73: 62771770 | DU73: =+RC[-1]/RC[-2]-1 -> 8.2271896551724177E-2 | DV73: =+RC[-2]/RC[-4]-1 -> -0.46850993659418505 | DW73: 79814 | DX73: 117642 | DY73: =+RC[-1]/RC[-2]-1 -> 0.47395193825644633 | DZ73: 101803810 | EA73: 47400000 | EB73: 73025250 | EC73: =+RC[-1]/RC[-2]-1 -> 0.54061708860759494 | ED73: =+RC[-2]/RC[-4]-1 -> -0.28268647312905082 | EE73: 53057 | EF73: 71376 | EG73: =+RC[-1]/RC[-2]-1 -> 0.34527018112595886 | EH73: 214406938 | EI73: 219265267 | EJ73: 218849078 | EK73: =+RC[-1]/RC[-2]-1 -> -1.8981072820803968E-3 | EL73: =+RC[-2]/RC[-4]-1 -> 2.0718266122526252E-2 | EM73: 176588 | EN73: 174151 | EO73: =+RC[-1]/RC[-2]-1 -> -1.3800484744150188E-2 | EP73: 182707267 | EQ73: 161732699 | ER73: 249129433 | ES73: =+RC[-1]/RC[-2]-1 -> 0.54037763878533918 | ET73: =+RC[-2]/RC[-4]-1 -> 0.36354419334617938 | EU73: 128688 | EV73: 105838 | EW73: =+RC[-1]/RC[-2]-1 -> -0.1775612333706329 | EX73: 26397395 | EY73: 19656395 | EZ73: 9634301 | FA73: =+RC[-1]/RC[-2]-1 -> -0.50986429607260131 | FB73: =+RC[-2]/RC[-4]-1 -> -0.63502834275882147 | FC73: 15387 | FD73: 27469 | FE73: =+RC[-1]/RC[-2]-1 -> 0.78520829271462933 | FF73: 173442690 | FG73: 160036232 | FH73: 168099893 | FI73: =+RC[-1]/RC[-2]-1 -> 5.0386471233589081E-2 | FJ73: =+RC[-2]/RC[-4]-1 -> -3.0804394235352306E-2 | FK73: 110168 | FL73: 111983 | FM73: =+RC[-1]/RC[-2]-1 -> 1.6474838428581773E-2 | FN73: 49140008 | FO73: 28000000 | FP73: 18166291 | FQ73: =+RC[-1]/RC[-2]-1 -> -0.35120389285714282 | FR73: =+RC[-2]/RC[-4]-1 -> -0.63031566865027777 | FS73: 24455 | FT73: 46131 | FU73: =+RC[-1]/RC[-2]-1 -> 0.88636270701288078 | FV73: 267770316 | FW73: 252234760 | FX73: 303637763 | FY73: =+RC[-1]/RC[-2]-1 -> 0.20379032215861126 | FZ73: =+RC[-2]/RC[-4]-1 -> 0.13394855537310568 | GA73: 118783 | GB73: 112418 | GC73: =+RC[-1]/RC[-2]-1 -> -5.3585108980241269E-2 | GD73: 0 | GE73: 8000000 | GF73: 0 | GG73: =+RC[-1]/RC[-2]-1 -> -1 | GH73: =+RC[-2]/RC[-4]-1 -> #DIV/0! | GI73: 0 | GJ73: 0 | GK73: =+RC[-1]/RC[-2]-1 -> #DIV/0! | GL73: 254237544 | GM73: 228143505 | GN73: 215384405 | GO73: =+RC[-1]/RC[-2]-1 -> -5.5925764794399924E-2 | GP73: =+RC[-2]/RC[-4]-1 -> -0.15282219293307842 | GQ73: 155781 | GR73: 161909 | GS73: =+RC[-1]/RC[-2]-1 -> 3.933727476393134E-2 | GT73: 59498072 | GU73: 59500000 | GV73: 49897635 | GW73: =+RC[-1]/RC[-2]-1 -> -0.16138428571428576 | GX73: =+RC[-2]/RC[-4]-1 -> -0.16135711086571003 | GY73: 50096 | GZ73: 57841 | HA73: =+RC[-1]/RC[-2]-1 -> 0.15460316192909618 | HB73: 152830967 | HC73: 136913452 | HD73: 114635241 | HE73: =+RC[-1]/RC[-2]-1 -> -0.16271747351750365 | HF73: =+RC[-2]/RC[-4]-1 -> -0.24992137882632126 | HG73: 64699 | HH73: 81156 | HI73: =+RC[-1]/RC[-2]-1 -> 0.25436250946691596 | HJ73: 129469817 | HK73: 62100000 | HL73: 114760756 | HM73: =+RC[-1]/RC[-2]-1 -> 0.84799929146537845 | HN73: =+RC[-2]/RC[-4]-1 -> -0.11360996208096907 | HO73: 88348 | HP73: 87401 | HQ73: =+RC[-1]/RC[-2]-1 -> -1.0718974962647732E-2 | HR73: 84213580 | HS73: 85929215 | HT73: 91595875 | HU73: =+RC[-1]/RC[-2]-1 -> 6.5945674006215427E-2 | HV73: =+RC[-2]/RC[-4]-1 -> 8.7661574297162037E-2 | HW73: 87802 | HX73: 88462 | HY73: =+RC[-1]/RC[-2]-1 -> 7.5169130543724094E-3 | HZ73: 125114714 | IA73: 135869565 | IB73: 151537641 | IC73: =+RC[-1]/RC[-2]-1 -> 0.11531703954450734 | ID73: =+RC[-2]/RC[-4]-1 -> 0.21118960476543158 | IE73: 95712 | IF73: 82836 | IG73: =+RC[-1]/RC[-2]-1 -> -0.13452858575727178 | IH73: 58941596 | II73: 60189126 | IJ73: 61084554 | IK73: =+RC[-1]/RC[-2]-1 -> 1.4876906503011877E-2 | IL73: =+RC[-2]/RC[-4]-1 -> 3.6357312075499193E-2 | IM73: 47031 | IN73: 45565 | IO73: =+RC[-1]/RC[-2]-1 -> -3.1170929812251447E-2
A76: MAGAZA TOPLAM | B76: OCAK | C76: SUBAT | D76: MART
A77: NET SATIŞ GEÇEN YIL | B77: 2056774932 | C77: 1874902490 | D77: 280664066
A78: NET SATIŞ BÜTÇE | B78: 2092724461 | C78: 1705884218 | D78: 0
A79: NET SATIS FİİLİ | B79: 2096215769 | C79: 1880574365 | D79: 255613369
A80: Prog.Göre Artış | B80: =+RC[-1]/RC[16382]-1 -> #VALUE! | C80: =+RC[-1]/RC[-2]-1 -> #VALUE! | D80: =+RC[-1]/RC[-2]-1 -> #VALUE!
A81: G.Yıla Göre Artış | B81: =+RC[16382]/RC[16380]-1 -> #DIV/0! | C81: =+RC[-2]/RC[16380]-1 -> #VALUE! | D81: =+RC[-2]/RC[16380]-1 -> #DIV/0!
A82: MUSTERI SAYISI | B82: 1257919 | C82: 1197635 | D82: 158128
A83: MUSTERI SAYISI GEÇEN YIL | B83: 1236283 | C83: 1198914 | D83: 175692
A84: G.Yıla Göre Artış | B84: =+RC[-1]/RC[16382]-1 -> #VALUE! | C84: =+RC[-1]/RC[-2]-1 -> #VALUE! | D84: =+RC[-1]/RC[-2]-1 -> #VALUE!
A87: TOPTAN SATIS | B87: OCAK | C87: SUBAT | D87: MART
A88: NET SATIŞ GEÇEN YIL | B88: 9162863 | C88: 8208965 | D88: 8831881
A89: NET SATIŞ BÜTÇE | B89: 0 | C89: 0 | D89: 0
A90: NET SATIS FİİLİ | B90: 10798318 | C90: 7886717 | D90: 500551
A91: Prog.Göre Artış | B91: =+RC[-1]/RC[16382]-1 -> #VALUE! | C91: =+RC[-1]/RC[-2]-1 -> #VALUE! | D91: =+RC[-1]/RC[-2]-1 -> #VALUE!
A92: G.Yıla Göre Artış | B92: =+RC[16382]/RC[16380]-1 -> #DIV/0! | C92: =+RC[-2]/RC[16380]-1 -> #VALUE! | D92: =+RC[-2]/RC[16380]-1 -> #DIV/0!
A95: SIRKET TOPLAM | B95: OCAK | C95: SUBAT | D95: MART
A96: NET SATIŞ GEÇEN YIL | B96: 2065937795 | C96: 1883111455 | D96: 289495947
A97: NET SATIŞ BÜTÇE | B97: 2092724461 | C97: 1705884218 | D97: 0
A98: NET SATIS FİİLİ | B98: 2107014087 | C98: 1888461082 | D98: 256113920
A99: Prog.Göre Artış | B99: =+RC[-1]/RC[16382]-1 -> #VALUE! | C99: =+RC[-1]/RC[-2]-1 -> #VALUE! | D99: =+RC[-1]/RC[-2]-1 -> #VALUE!
A100: G.Yıla Göre Artış | B100: =+RC[16382]/RC[16380]-1 -> #DIV/0! | C100: =+RC[-2]/RC[16380]-1 -> #VALUE! | D100: =+RC[-2]/RC[16380]-1 -> #DIV/0!
A101: MUSTERI SAYISI | B101: 1257919 | C101: 1197635 | D101: 158128
A102: MUSTERI SAYISI GEÇEN YIL | B102: 1236283 | C102: 1198914 | D102: 175692
A103: G.Yıla Göre Artış | B103: =+RC[-1]/RC[16382]-1 -> #VALUE! | C103: =+RC[-1]/RC[-2]-1 -> #VALUE! | D103: =+RC[-1]/RC[-2]-1 -> #VALUE!
A106: SIRKET TOPLAM | B106: KUMULE
A107: NET SATIŞ GEÇEN YIL | B107: 4238545197
A108: NET SATIŞ BÜTÇE | B108: 3798608679
A109: NET SATIS FİİLİ | B109: 4251589089
A110: Prog.Göre Artış | B110: =+RC[-1]/RC[16382]-1 -> #VALUE!
A111: G.Yıla Göre Artış | B111: =+RC[16382]/RC[16380]-1 -> #DIV/0!
A112: MUSTERI SAYISI | B112: 2613682
A113: MUSTERI SAYISI GEÇEN YIL | B113: 2610889
A114: G.Yıla Göre Artış | B114: =+RC[-1]/RC[16382]-1 -> #VALUE!