Sheet: Yerel
A1: RAMSTORE KAZAKISTAN
A3: TARIH | B3: 100 SAMAL | H3: MAGAZA TOPLAM
B4: NET SATIŞ - GEÇEN YIL | C4: NET SATIŞ - BÜTÇE | D4: NET SATIS -FİİLİ | E4: Prog.Göre Artış | F4: G.Yıla Göre Artış | G4: MUSTERI SAYISI | H4: NET SATIŞ - GEÇEN YIL | I4: NET SATIŞ - BÜTÇE | J4: NET SATIS -FİİLİ | K4: Prog.Göre Artış | L4: G.Yıla Göre Artış | M4: MUSTERI SAYISI
A5: 01.01.2016 | B5: 5759157.9106999999 | C5: 6561336 | D5: 6496297.9106999999 | E5: =+RC[-1]/RC[-2]-1 -> -9.9123241516666516E-3 | F5: =+RC[-2]/RC[-4]-1 -> 0.1279944067222849 | G5: 1710 | H5: =+RC[-6]+#REF!+#REF!+#REF!+#REF!+#REF!+#REF!+#REF!+#REF!+#REF!+#REF!+#REF!+#REF!+#REF!+#REF!+#REF!+#REF!+#REF!+#REF!+#REF!+#REF!+#REF!+#REF!+#REF!+#REF!+#REF!+#REF!+#REF!+#REF!+#REF!+#REF! -> #REF! | I5: =+RC[-6]+#REF!+#REF!+#REF!+#REF!+#REF!+#REF!+#REF!+#REF!+#REF!+#REF!+#REF!+#REF!+#REF!+#REF!+#REF!+#REF!+#REF!+#REF!+#REF!+#REF!+#REF!+#REF!+#REF!+#REF!+#REF!+#REF!+#REF!+#REF!+#REF!+#REF! -> #REF! | J5: =+RC[-6]+#REF!+#REF!+#REF!+#REF!+#REF!+#REF!+#REF!+#REF!+#REF!+#REF!+#REF!+#REF!+#REF!+#REF!+#REF!+#REF!+#REF!+#REF!+#REF!+#REF!+#REF!+#REF!+#REF!+#REF!+#REF!+#REF!+#REF!+#REF!+#REF!+#REF! -> #REF! | K5: =+RC[-1]/RC[-2]-1 -> #REF! | L5: =+RC[-2]/RC[-4]-1 -> #REF! | M5: =+RC[-6]+#REF!+#REF!+#REF!+#REF!+#REF!+#REF!+#REF!+#REF!+#REF!+#REF!+#REF!+#REF!+#REF!+#REF!+#REF!+#REF!+#REF!+#REF!+#REF!+#REF!+#REF!+#REF!+#REF!+#REF!+#REF!+#REF!+#REF!+#REF!+#REF!+#REF! -> #REF!
A6: 02.01.2016 | B6: 8224687.5 | C6: 9739484 | D6: 9137862.2588999998 | E6: =+RC[-1]/RC[-2]-1 -> -6.1771418393418043E-2 | F6: =+RC[-2]/RC[-4]-1 -> 0.11102850520460494 | G6: 2244 | H6: =+RC[-6]+#REF!+#REF!+#REF!+#REF!+#REF!+#REF!+#REF!+#REF!+#REF!+#REF!+#REF!+#REF!+#REF!+#REF!+#REF!+#REF!+#REF!+#REF!+#REF!+#REF!+#REF!+#REF!+#REF!+#REF!+#REF!+#REF!+#REF!+#REF!+#REF!+#REF! -> #REF! | I6: =+RC[-6]+#REF!+#REF!+#REF!+#REF!+#REF!+#REF!+#REF!+#REF!+#REF!+#REF!+#REF!+#REF!+#REF!+#REF!+#REF!+#REF!+#REF!+#REF!+#REF!+#REF!+#REF!+#REF!+#REF!+#REF!+#REF!+#REF!+#REF!+#REF!+#REF!+#REF! -> #REF! | J6: =+RC[-6]+#REF!+#REF!+#REF!+#REF!+#REF!+#REF!+#REF!+#REF!+#REF!+#REF!+#REF!+#REF!+#REF!+#REF!+#REF!+#REF!+#REF!+#REF!+#REF!+#REF!+#REF!+#REF!+#REF!+#REF!+#REF!+#REF!+#REF!+#REF!+#REF!+#REF! -> #REF! | K6: =+RC[-1]/RC[-2]-1 -> #REF! | L6: =+RC[-2]/RC[-4]-1 -> #REF! | M6: =+RC[-6]+#REF!+#REF!+#REF!+#REF!+#REF!+#REF!+#REF!+#REF!+#REF!+#REF!+#REF!+#REF!+#REF!+#REF!+#REF!+#REF!+#REF!+#REF!+#REF!+#REF!+#REF!+#REF!+#REF!+#REF!+#REF!+#REF!+#REF!+#REF!+#REF!+#REF! -> #REF!
A7: 03.01.2016 | B7: 9207635.0304000005 | C7: 9534442 | D7: 10108341.4286 | E7: =+RC[-1]/RC[-2]-1 -> 6.0192240783466966E-2 | F7: =+RC[-2]/RC[-4]-1 -> 9.7821687678347313E-2 | G7: 2316 | H7: =+RC[-6]+#REF!+#REF!+#REF!+#REF!+#REF!+#REF!+#REF!+#REF!+#REF!+#REF!+#REF!+#REF!+#REF!+#REF!+#REF!+#REF!+#REF!+#REF!+#REF!+#REF!+#REF!+#REF!+#REF!+#REF!+#REF!+#REF!+#REF!+#REF!+#REF!+#REF! -> #REF! | I7: =+RC[-6]+#REF!+#REF!+#REF!+#REF!+#REF!+#REF!+#REF!+#REF!+#REF!+#REF!+#REF!+#REF!+#REF!+#REF!+#REF!+#REF!+#REF!+#REF!+#REF!+#REF!+#REF!+#REF!+#REF!+#REF!+#REF!+#REF!+#REF!+#REF!+#REF!+#REF! -> #REF! | J7: =+RC[-6]+#REF!+#REF!+#REF!+#REF!+#REF!+#REF!+#REF!+#REF!+#REF!+#REF!+#REF!+#REF!+#REF!+#REF!+#REF!+#REF!+#REF!+#REF!+#REF!+#REF!+#REF!+#REF!+#REF!+#REF!+#REF!+#REF!+#REF!+#REF!+#REF!+#REF! -> #REF! | K7: =+RC[-1]/RC[-2]-1 -> #REF! | L7: =+RC[-2]/RC[-4]-1 -> #REF! | M7: =+RC[-6]+#REF!+#REF!+#REF!+#REF!+#REF!+#REF!+#REF!+#REF!+#REF!+#REF!+#REF!+#REF!+#REF!+#REF!+#REF!+#REF!+#REF!+#REF!+#REF!+#REF!+#REF!+#REF!+#REF!+#REF!+#REF!+#REF!+#REF!+#REF!+#REF!+#REF! -> #REF!
A8: 04.01.2016 | B8: 8812604.2678999994 | C8: 9534442 | D8: 10587117.830399999 | E8: =+RC[-1]/RC[-2]-1 -> 0.1104077019294889 | F8: =+RC[-2]/RC[-4]-1 -> 0.20136085866963116 | G8: 2637 | H8: =+RC[-6]+#REF!+#REF!+#REF!+#REF!+#REF!+#REF!+#REF!+#REF!+#REF!+#REF!+#REF!+#REF!+#REF!+#REF!+#REF!+#REF!+#REF!+#REF!+#REF!+#REF!+#REF!+#REF!+#REF!+#REF!+#REF!+#REF!+#REF!+#REF!+#REF!+#REF! -> #REF! | I8: =+RC[-6]+#REF!+#REF!+#REF!+#REF!+#REF!+#REF!+#REF!+#REF!+#REF!+#REF!+#REF!+#REF!+#REF!+#REF!+#REF!+#REF!+#REF!+#REF!+#REF!+#REF!+#REF!+#REF!+#REF!+#REF!+#REF!+#REF!+#REF!+#REF!+#REF!+#REF! -> #REF! | J8: =+RC[-6]+#REF!+#REF!+#REF!+#REF!+#REF!+#REF!+#REF!+#REF!+#REF!+#REF!+#REF!+#REF!+#REF!+#REF!+#REF!+#REF!+#REF!+#REF!+#REF!+#REF!+#REF!+#REF!+#REF!+#REF!+#REF!+#REF!+#REF!+#REF!+#REF!+#REF! -> #REF! | K8: =+RC[-1]/RC[-2]-1 -> #REF! | L8: =+RC[-2]/RC[-4]-1 -> #REF! | M8: =+RC[-6]+#REF!+#REF!+#REF!+#REF!+#REF!+#REF!+#REF!+#REF!+#REF!+#REF!+#REF!+#REF!+#REF!+#REF!+#REF!+#REF!+#REF!+#REF!+#REF!+#REF!+#REF!+#REF!+#REF!+#REF!+#REF!+#REF!+#REF!+#REF!+#REF!+#REF! -> #REF!
A9: 05.01.2016 | B9: 10100528.0536 | C9: 9739484 | D9: 9919526.2982000001 | E9: =+RC[-1]/RC[-2]-1 -> 1.8485814874792172E-2 | F9: =+RC[-2]/RC[-4]-1 -> -1.7920028976652125E-2 | G9: 2786 | H9: =+RC[-6]+#REF!+#REF!+#REF!+#REF!+#REF!+#REF!+#REF!+#REF!+#REF!+#REF!+#REF!+#REF!+#REF!+#REF!+#REF!+#REF!+#REF!+#REF!+#REF!+#REF!+#REF!+#REF!+#REF!+#REF!+#REF!+#REF!+#REF!+#REF!+#REF!+#REF! -> #REF! | I9: =+RC[-6]+#REF!+#REF!+#REF!+#REF!+#REF!+#REF!+#REF!+#REF!+#REF!+#REF!+#REF!+#REF!+#REF!+#REF!+#REF!+#REF!+#REF!+#REF!+#REF!+#REF!+#REF!+#REF!+#REF!+#REF!+#REF!+#REF!+#REF!+#REF!+#REF!+#REF! -> #REF! | J9: =+RC[-6]+#REF!+#REF!+#REF!+#REF!+#REF!+#REF!+#REF!+#REF!+#REF!+#REF!+#REF!+#REF!+#REF!+#REF!+#REF!+#REF!+#REF!+#REF!+#REF!+#REF!+#REF!+#REF!+#REF!+#REF!+#REF!+#REF!+#REF!+#REF!+#REF!+#REF! -> #REF! | K9: =+RC[-1]/RC[-2]-1 -> #REF! | L9: =+RC[-2]/RC[-4]-1 -> #REF! | M9: =+RC[-6]+#REF!+#REF!+#REF!+#REF!+#REF!+#REF!+#REF!+#REF!+#REF!+#REF!+#REF!+#REF!+#REF!+#REF!+#REF!+#REF!+#REF!+#REF!+#REF!+#REF!+#REF!+#REF!+#REF!+#REF!+#REF!+#REF!+#REF!+#REF!+#REF!+#REF! -> #REF!
A10: 06.01.2016 | B10: 10009505.294600001 | C10: 10764692 | D10: 10360936.469599999 | E10: =+RC[-1]/RC[-2]-1 -> -3.7507392724287936E-2 | F10: =+RC[-2]/RC[-4]-1 -> 3.5109744653373687E-2 | G10: 2850 | H10: =+RC[-6]+#REF!+#REF!+#REF!+#REF!+#REF!+#REF!+#REF!+#REF!+#REF!+#REF!+#REF!+#REF!+#REF!+#REF!+#REF!+#REF!+#REF!+#REF!+#REF!+#REF!+#REF!+#REF!+#REF!+#REF!+#REF!+#REF!+#REF!+#REF!+#REF!+#REF! -> #REF! | I10: =+RC[-6]+#REF!+#REF!+#REF!+#REF!+#REF!+#REF!+#REF!+#REF!+#REF!+#REF!+#REF!+#REF!+#REF!+#REF!+#REF!+#REF!+#REF!+#REF!+#REF!+#REF!+#REF!+#REF!+#REF!+#REF!+#REF!+#REF!+#REF!+#REF!+#REF!+#REF! -> #REF! | J10: =+RC[-6]+#REF!+#REF!+#REF!+#REF!+#REF!+#REF!+#REF!+#REF!+#REF!+#REF!+#REF!+#REF!+#REF!+#REF!+#REF!+#REF!+#REF!+#REF!+#REF!+#REF!+#REF!+#REF!+#REF!+#REF!+#REF!+#REF!+#REF!+#REF!+#REF!+#REF! -> #REF! | K10: =+RC[-1]/RC[-2]-1 -> #REF! | L10: =+RC[-2]/RC[-4]-1 -> #REF! | M10: =+RC[-6]+#REF!+#REF!+#REF!+#REF!+#REF!+#REF!+#REF!+#REF!+#REF!+#REF!+#REF!+#REF!+#REF!+#REF!+#REF!+#REF!+#REF!+#REF!+#REF!+#REF!+#REF!+#REF!+#REF!+#REF!+#REF!+#REF!+#REF!+#REF!+#REF!+#REF! -> #REF!
A11: 07.01.2016 | B11: 9901991.0625 | C11: 11277297 | D11: 9480352.1963999998 | E11: =+RC[-1]/RC[-2]-1 -> -0.15934180004304221 | F11: =+RC[-2]/RC[-4]-1 -> -4.25812206291315E-2 | G11: 2521 | H11: =+RC[-6]+#REF!+#REF!+#REF!+#REF!+#REF!+#REF!+#REF!+#REF!+#REF!+#REF!+#REF!+#REF!+#REF!+#REF!+#REF!+#REF!+#REF!+#REF!+#REF!+#REF!+#REF!+#REF!+#REF!+#REF!+#REF!+#REF!+#REF!+#REF!+#REF!+#REF! -> #REF! | I11: =+RC[-6]+#REF!+#REF!+#REF!+#REF!+#REF!+#REF!+#REF!+#REF!+#REF!+#REF!+#REF!+#REF!+#REF!+#REF!+#REF!+#REF!+#REF!+#REF!+#REF!+#REF!+#REF!+#REF!+#REF!+#REF!+#REF!+#REF!+#REF!+#REF!+#REF!+#REF! -> #REF! | J11: =+RC[-6]+#REF!+#REF!+#REF!+#REF!+#REF!+#REF!+#REF!+#REF!+#REF!+#REF!+#REF!+#REF!+#REF!+#REF!+#REF!+#REF!+#REF!+#REF!+#REF!+#REF!+#REF!+#REF!+#REF!+#REF!+#REF!+#REF!+#REF!+#REF!+#REF!+#REF! -> #REF! | K11: =+RC[-1]/RC[-2]-1 -> #REF! | L11: =+RC[-2]/RC[-4]-1 -> #REF! | M11: =+RC[-6]+#REF!+#REF!+#REF!+#REF!+#REF!+#REF!+#REF!+#REF!+#REF!+#REF!+#REF!+#REF!+#REF!+#REF!+#REF!+#REF!+#REF!+#REF!+#REF!+#REF!+#REF!+#REF!+#REF!+#REF!+#REF!+#REF!+#REF!+#REF!+#REF!+#REF! -> #REF!
A12: 08.01.2016 | B12: 8285064.1606999999 | C12: 9739484 | D12: 9585909.4911000002 | E12: =+RC[-1]/RC[-2]-1 -> -1.5768238738315121E-2 | F12: =+RC[-2]/RC[-4]-1 -> 0.15701089396151313 | G12: 2836 | H12: =+RC[-6]+#REF!+#REF!+#REF!+#REF!+#REF!+#REF!+#REF!+#REF!+#REF!+#REF!+#REF!+#REF!+#REF!+#REF!+#REF!+#REF!+#REF!+#REF!+#REF!+#REF!+#REF!+#REF!+#REF!+#REF!+#REF!+#REF!+#REF!+#REF!+#REF!+#REF! -> #REF! | I12: =+RC[-6]+#REF!+#REF!+#REF!+#REF!+#REF!+#REF!+#REF!+#REF!+#REF!+#REF!+#REF!+#REF!+#REF!+#REF!+#REF!+#REF!+#REF!+#REF!+#REF!+#REF!+#REF!+#REF!+#REF!+#REF!+#REF!+#REF!+#REF!+#REF!+#REF!+#REF! -> #REF! | J12: =+RC[-6]+#REF!+#REF!+#REF!+#REF!+#REF!+#REF!+#REF!+#REF!+#REF!+#REF!+#REF!+#REF!+#REF!+#REF!+#REF!+#REF!+#REF!+#REF!+#REF!+#REF!+#REF!+#REF!+#REF!+#REF!+#REF!+#REF!+#REF!+#REF!+#REF!+#REF! -> #REF! | K12: =+RC[-1]/RC[-2]-1 -> #REF! | L12: =+RC[-2]/RC[-4]-1 -> #REF! | M12: =+RC[-6]+#REF!+#REF!+#REF!+#REF!+#REF!+#REF!+#REF!+#REF!+#REF!+#REF!+#REF!+#REF!+#REF!+#REF!+#REF!+#REF!+#REF!+#REF!+#REF!+#REF!+#REF!+#REF!+#REF!+#REF!+#REF!+#REF!+#REF!+#REF!+#REF!+#REF! -> #REF!
A13: 09.01.2016 | B13: 8769578.8392999992 | C13: 11277297 | D13: 12252309.7862 | E13: =+RC[-1]/RC[-2]-1 -> 8.6458021474472124E-2 | F13: =+RC[-2]/RC[-4]-1 -> 0.39713776576048176 | G13: 2607 | H13: =+RC[-6]+#REF!+#REF!+#REF!+#REF!+#REF!+#REF!+#REF!+#REF!+#REF!+#REF!+#REF!+#REF!+#REF!+#REF!+#REF!+#REF!+#REF!+#REF!+#REF!+#REF!+#REF!+#REF!+#REF!+#REF!+#REF!+#REF!+#REF!+#REF!+#REF!+#REF! -> #REF! | I13: =+RC[-6]+#REF!+#REF!+#REF!+#REF!+#REF!+#REF!+#REF!+#REF!+#REF!+#REF!+#REF!+#REF!+#REF!+#REF!+#REF!+#REF!+#REF!+#REF!+#REF!+#REF!+#REF!+#REF!+#REF!+#REF!+#REF!+#REF!+#REF!+#REF!+#REF!+#REF! -> #REF! | J13: =+RC[-6]+#REF!+#REF!+#REF!+#REF!+#REF!+#REF!+#REF!+#REF!+#REF!+#REF!+#REF!+#REF!+#REF!+#REF!+#REF!+#REF!+#REF!+#REF!+#REF!+#REF!+#REF!+#REF!+#REF!+#REF!+#REF!+#REF!+#REF!+#REF!+#REF!+#REF! -> #REF! | K13: =+RC[-1]/RC[-2]-1 -> #REF! | L13: =+RC[-2]/RC[-4]-1 -> #REF! | M13: =+RC[-6]+#REF!+#REF!+#REF!+#REF!+#REF!+#REF!+#REF!+#REF!+#REF!+#REF!+#REF!+#REF!+#REF!+#REF!+#REF!+#REF!+#REF!+#REF!+#REF!+#REF!+#REF!+#REF!+#REF!+#REF!+#REF!+#REF!+#REF!+#REF!+#REF!+#REF! -> #REF!
A14: 10.01.2016 | B14: 11330116.6116 | C14: 10764692 | D14: 9983872.4017999992 | E14: =+RC[-1]/RC[-2]-1 -> -7.2535247473871189E-2 | F14: =+RC[-2]/RC[-4]-1 -> -0.1188199782888103 | G14: 2422 | H14: =+RC[-6]+#REF!+#REF!+#REF!+#REF!+#REF!+#REF!+#REF!+#REF!+#REF!+#REF!+#REF!+#REF!+#REF!+#REF!+#REF!+#REF!+#REF!+#REF!+#REF!+#REF!+#REF!+#REF!+#REF!+#REF!+#REF!+#REF!+#REF!+#REF!+#REF!+#REF! -> #REF! | I14: =+RC[-6]+#REF!+#REF!+#REF!+#REF!+#REF!+#REF!+#REF!+#REF!+#REF!+#REF!+#REF!+#REF!+#REF!+#REF!+#REF!+#REF!+#REF!+#REF!+#REF!+#REF!+#REF!+#REF!+#REF!+#REF!+#REF!+#REF!+#REF!+#REF!+#REF!+#REF! -> #REF! | J14: =+RC[-6]+#REF!+#REF!+#REF!+#REF!+#REF!+#REF!+#REF!+#REF!+#REF!+#REF!+#REF!+#REF!+#REF!+#REF!+#REF!+#REF!+#REF!+#REF!+#REF!+#REF!+#REF!+#REF!+#REF!+#REF!+#REF!+#REF!+#REF!+#REF!+#REF!+#REF! -> #REF! | K14: =+RC[-1]/RC[-2]-1 -> #REF! | L14: =+RC[-2]/RC[-4]-1 -> #REF! | M14: =+RC[-6]+#REF!+#REF!+#REF!+#REF!+#REF!+#REF!+#REF!+#REF!+#REF!+#REF!+#REF!+#REF!+#REF!+#REF!+#REF!+#REF!+#REF!+#REF!+#REF!+#REF!+#REF!+#REF!+#REF!+#REF!+#REF!+#REF!+#REF!+#REF!+#REF!+#REF! -> #REF!
A15: 11.01.2016 | B15: 9337214.2357000001 | C15: 10252088 | D15: 10182821.033 | E15: =+RC[-1]/RC[-2]-1 -> -6.7563765547077326E-3 | F15: =+RC[-2]/RC[-4]-1 -> 9.0563071163870079E-2 | G15: 2958 | H15: =+RC[-6]+#REF!+#REF!+#REF!+#REF!+#REF!+#REF!+#REF!+#REF!+#REF!+#REF!+#REF!+#REF!+#REF!+#REF!+#REF!+#REF!+#REF!+#REF!+#REF!+#REF!+#REF!+#REF!+#REF!+#REF!+#REF!+#REF!+#REF!+#REF!+#REF!+#REF! -> #REF! | I15: =+RC[-6]+#REF!+#REF!+#REF!+#REF!+#REF!+#REF!+#REF!+#REF!+#REF!+#REF!+#REF!+#REF!+#REF!+#REF!+#REF!+#REF!+#REF!+#REF!+#REF!+#REF!+#REF!+#REF!+#REF!+#REF!+#REF!+#REF!+#REF!+#REF!+#REF!+#REF! -> #REF! | J15: =+RC[-6]+#REF!+#REF!+#REF!+#REF!+#REF!+#REF!+#REF!+#REF!+#REF!+#REF!+#REF!+#REF!+#REF!+#REF!+#REF!+#REF!+#REF!+#REF!+#REF!+#REF!+#REF!+#REF!+#REF!+#REF!+#REF!+#REF!+#REF!+#REF!+#REF!+#REF! -> #REF! | K15: =+RC[-1]/RC[-2]-1 -> #REF! | L15: =+RC[-2]/RC[-4]-1 -> #REF! | M15: =+RC[-6]+#REF!+#REF!+#REF!+#REF!+#REF!+#REF!+#REF!+#REF!+#REF!+#REF!+#REF!+#REF!+#REF!+#REF!+#REF!+#REF!+#REF!+#REF!+#REF!+#REF!+#REF!+#REF!+#REF!+#REF!+#REF!+#REF!+#REF!+#REF!+#REF!+#REF! -> #REF!
A16: 12.01.2016 | B16: 9819546.7588999998 | C16: 9431921 | D16: 9849966.9642999992 | E16: =+RC[-1]/RC[-2]-1 -> 4.4322462444288835E-2 | F16: =+RC[-2]/RC[-4]-1 -> 3.0979235749784007E-3 | G16: 2735 | H16: =+RC[-6]+#REF!+#REF!+#REF!+#REF!+#REF!+#REF!+#REF!+#REF!+#REF!+#REF!+#REF!+#REF!+#REF!+#REF!+#REF!+#REF!+#REF!+#REF!+#REF!+#REF!+#REF!+#REF!+#REF!+#REF!+#REF!+#REF!+#REF!+#REF!+#REF!+#REF! -> #REF! | I16: =+RC[-6]+#REF!+#REF!+#REF!+#REF!+#REF!+#REF!+#REF!+#REF!+#REF!+#REF!+#REF!+#REF!+#REF!+#REF!+#REF!+#REF!+#REF!+#REF!+#REF!+#REF!+#REF!+#REF!+#REF!+#REF!+#REF!+#REF!+#REF!+#REF!+#REF!+#REF! -> #REF! | J16: =+RC[-6]+#REF!+#REF!+#REF!+#REF!+#REF!+#REF!+#REF!+#REF!+#REF!+#REF!+#REF!+#REF!+#REF!+#REF!+#REF!+#REF!+#REF!+#REF!+#REF!+#REF!+#REF!+#REF!+#REF!+#REF!+#REF!+#REF!+#REF!+#REF!+#REF!+#REF! -> #REF! | K16: =+RC[-1]/RC[-2]-1 -> #REF! | L16: =+RC[-2]/RC[-4]-1 -> #REF! | M16: =+RC[-6]+#REF!+#REF!+#REF!+#REF!+#REF!+#REF!+#REF!+#REF!+#REF!+#REF!+#REF!+#REF!+#REF!+#REF!+#REF!+#REF!+#REF!+#REF!+#REF!+#REF!+#REF!+#REF!+#REF!+#REF!+#REF!+#REF!+#REF!+#REF!+#REF!+#REF! -> #REF!
A17: 13.01.2016 | B17: 9023733.9553999994 | C17: 9431921 | D17: 10054904.578600001 | E17: =+RC[-1]/RC[-2]-1 -> 6.6050550953512088E-2 | F17: =+RC[-2]/RC[-4]-1 -> 0.11427316322672909 | G17: 3048 | H17: =+RC[-6]+#REF!+#REF!+#REF!+#REF!+#REF!+#REF!+#REF!+#REF!+#REF!+#REF!+#REF!+#REF!+#REF!+#REF!+#REF!+#REF!+#REF!+#REF!+#REF!+#REF!+#REF!+#REF!+#REF!+#REF!+#REF!+#REF!+#REF!+#REF!+#REF!+#REF! -> #REF! | I17: =+RC[-6]+#REF!+#REF!+#REF!+#REF!+#REF!+#REF!+#REF!+#REF!+#REF!+#REF!+#REF!+#REF!+#REF!+#REF!+#REF!+#REF!+#REF!+#REF!+#REF!+#REF!+#REF!+#REF!+#REF!+#REF!+#REF!+#REF!+#REF!+#REF!+#REF!+#REF! -> #REF! | J17: =+RC[-6]+#REF!+#REF!+#REF!+#REF!+#REF!+#REF!+#REF!+#REF!+#REF!+#REF!+#REF!+#REF!+#REF!+#REF!+#REF!+#REF!+#REF!+#REF!+#REF!+#REF!+#REF!+#REF!+#REF!+#REF!+#REF!+#REF!+#REF!+#REF!+#REF!+#REF! -> #REF! | K17: =+RC[-1]/RC[-2]-1 -> #REF! | L17: =+RC[-2]/RC[-4]-1 -> #REF! | M17: =+RC[-6]+#REF!+#REF!+#REF!+#REF!+#REF!+#REF!+#REF!+#REF!+#REF!+#REF!+#REF!+#REF!+#REF!+#REF!+#REF!+#REF!+#REF!+#REF!+#REF!+#REF!+#REF!+#REF!+#REF!+#REF!+#REF!+#REF!+#REF!+#REF!+#REF!+#REF! -> #REF!
A18: 14.01.2016 | B18: 8471374.0446000006 | C18: 9739484 | D18: 9494158.8445999995 | E18: =+RC[-1]/RC[-2]-1 -> -2.5188722051394108E-2 | F18: =+RC[-2]/RC[-4]-1 -> 0.120734227365626 | G18: 2763 | H18: =+RC[-6]+#REF!+#REF!+#REF!+#REF!+#REF!+#REF!+#REF!+#REF!+#REF!+#REF!+#REF!+#REF!+#REF!+#REF!+#REF!+#REF!+#REF!+#REF!+#REF!+#REF!+#REF!+#REF!+#REF!+#REF!+#REF!+#REF!+#REF!+#REF!+#REF!+#REF! -> #REF! | I18: =+RC[-6]+#REF!+#REF!+#REF!+#REF!+#REF!+#REF!+#REF!+#REF!+#REF!+#REF!+#REF!+#REF!+#REF!+#REF!+#REF!+#REF!+#REF!+#REF!+#REF!+#REF!+#REF!+#REF!+#REF!+#REF!+#REF!+#REF!+#REF!+#REF!+#REF!+#REF! -> #REF! | J18: =+RC[-6]+#REF!+#REF!+#REF!+#REF!+#REF!+#REF!+#REF!+#REF!+#REF!+#REF!+#REF!+#REF!+#REF!+#REF!+#REF!+#REF!+#REF!+#REF!+#REF!+#REF!+#REF!+#REF!+#REF!+#REF!+#REF!+#REF!+#REF!+#REF!+#REF!+#REF! -> #REF! | K18: =+RC[-1]/RC[-2]-1 -> #REF! | L18: =+RC[-2]/RC[-4]-1 -> #REF! | M18: =+RC[-6]+#REF!+#REF!+#REF!+#REF!+#REF!+#REF!+#REF!+#REF!+#REF!+#REF!+#REF!+#REF!+#REF!+#REF!+#REF!+#REF!+#REF!+#REF!+#REF!+#REF!+#REF!+#REF!+#REF!+#REF!+#REF!+#REF!+#REF!+#REF!+#REF!+#REF! -> #REF!
A19: 15.01.2016 | B19: 8787194.875 | C19: 10252088 | D19: 10200762.8705 | E19: =+RC[-1]/RC[-2]-1 -> -5.0063098853618815E-3 | F19: =+RC[-2]/RC[-4]-1 -> 0.16086680853313839 | G19: 2853 | H19: =+RC[-6]+#REF!+#REF!+#REF!+#REF!+#REF!+#REF!+#REF!+#REF!+#REF!+#REF!+#REF!+#REF!+#REF!+#REF!+#REF!+#REF!+#REF!+#REF!+#REF!+#REF!+#REF!+#REF!+#REF!+#REF!+#REF!+#REF!+#REF!+#REF!+#REF!+#REF! -> #REF! | I19: =+RC[-6]+#REF!+#REF!+#REF!+#REF!+#REF!+#REF!+#REF!+#REF!+#REF!+#REF!+#REF!+#REF!+#REF!+#REF!+#REF!+#REF!+#REF!+#REF!+#REF!+#REF!+#REF!+#REF!+#REF!+#REF!+#REF!+#REF!+#REF!+#REF!+#REF!+#REF! -> #REF! | J19: =+RC[-6]+#REF!+#REF!+#REF!+#REF!+#REF!+#REF!+#REF!+#REF!+#REF!+#REF!+#REF!+#REF!+#REF!+#REF!+#REF!+#REF!+#REF!+#REF!+#REF!+#REF!+#REF!+#REF!+#REF!+#REF!+#REF!+#REF!+#REF!+#REF!+#REF!+#REF! -> #REF! | K19: =+RC[-1]/RC[-2]-1 -> #REF! | L19: =+RC[-2]/RC[-4]-1 -> #REF! | M19: =+RC[-6]+#REF!+#REF!+#REF!+#REF!+#REF!+#REF!+#REF!+#REF!+#REF!+#REF!+#REF!+#REF!+#REF!+#REF!+#REF!+#REF!+#REF!+#REF!+#REF!+#REF!+#REF!+#REF!+#REF!+#REF!+#REF!+#REF!+#REF!+#REF!+#REF!+#REF! -> #REF!
A20: 16.01.2016 | B20: 9882625.2366000004 | C20: 11789901 | D20: 12785800.411599999 | E20: =+RC[-1]/RC[-2]-1 -> 8.4470549125051919E-2 | F20: =+RC[-2]/RC[-4]-1 -> 0.2937655840927953 | G20: 2820 | H20: =+RC[-6]+#REF!+#REF!+#REF!+#REF!+#REF!+#REF!+#REF!+#REF!+#REF!+#REF!+#REF!+#REF!+#REF!+#REF!+#REF!+#REF!+#REF!+#REF!+#REF!+#REF!+#REF!+#REF!+#REF!+#REF!+#REF!+#REF!+#REF!+#REF!+#REF!+#REF! -> #REF! | I20: =+RC[-6]+#REF!+#REF!+#REF!+#REF!+#REF!+#REF!+#REF!+#REF!+#REF!+#REF!+#REF!+#REF!+#REF!+#REF!+#REF!+#REF!+#REF!+#REF!+#REF!+#REF!+#REF!+#REF!+#REF!+#REF!+#REF!+#REF!+#REF!+#REF!+#REF!+#REF! -> #REF! | J20: =+RC[-6]+#REF!+#REF!+#REF!+#REF!+#REF!+#REF!+#REF!+#REF!+#REF!+#REF!+#REF!+#REF!+#REF!+#REF!+#REF!+#REF!+#REF!+#REF!+#REF!+#REF!+#REF!+#REF!+#REF!+#REF!+#REF!+#REF!+#REF!+#REF!+#REF!+#REF! -> #REF! | K20: =+RC[-1]/RC[-2]-1 -> #REF! | L20: =+RC[-2]/RC[-4]-1 -> #REF! | M20: =+RC[-6]+#REF!+#REF!+#REF!+#REF!+#REF!+#REF!+#REF!+#REF!+#REF!+#REF!+#REF!+#REF!+#REF!+#REF!+#REF!+#REF!+#REF!+#REF!+#REF!+#REF!+#REF!+#REF!+#REF!+#REF!+#REF!+#REF!+#REF!+#REF!+#REF!+#REF! -> #REF!
A21: 17.01.2016 | B21: 11883274.580399999 | C21: 10764692 | D21: 9375348.0088999998 | E21: =+RC[-1]/RC[-2]-1 -> -0.12906490878698618 | F21: =+RC[-2]/RC[-4]-1 -> -0.21104675773767911 | G21: 2301 | H21: =+RC[-6]+#REF!+#REF!+#REF!+#REF!+#REF!+#REF!+#REF!+#REF!+#REF!+#REF!+#REF!+#REF!+#REF!+#REF!+#REF!+#REF!+#REF!+#REF!+#REF!+#REF!+#REF!+#REF!+#REF!+#REF!+#REF!+#REF!+#REF!+#REF!+#REF!+#REF! -> #REF! | I21: =+RC[-6]+#REF!+#REF!+#REF!+#REF!+#REF!+#REF!+#REF!+#REF!+#REF!+#REF!+#REF!+#REF!+#REF!+#REF!+#REF!+#REF!+#REF!+#REF!+#REF!+#REF!+#REF!+#REF!+#REF!+#REF!+#REF!+#REF!+#REF!+#REF!+#REF!+#REF! -> #REF! | J21: =+RC[-6]+#REF!+#REF!+#REF!+#REF!+#REF!+#REF!+#REF!+#REF!+#REF!+#REF!+#REF!+#REF!+#REF!+#REF!+#REF!+#REF!+#REF!+#REF!+#REF!+#REF!+#REF!+#REF!+#REF!+#REF!+#REF!+#REF!+#REF!+#REF!+#REF!+#REF! -> #REF! | K21: =+RC[-1]/RC[-2]-1 -> #REF! | L21: =+RC[-2]/RC[-4]-1 -> #REF! | M21: =+RC[-6]+#REF!+#REF!+#REF!+#REF!+#REF!+#REF!+#REF!+#REF!+#REF!+#REF!+#REF!+#REF!+#REF!+#REF!+#REF!+#REF!+#REF!+#REF!+#REF!+#REF!+#REF!+#REF!+#REF!+#REF!+#REF!+#REF!+#REF!+#REF!+#REF!+#REF! -> #REF!
A22: 18.01.2016 | B22: 9037978.0178999994 | C22: 10252088 | D22: 10120040.7125 | E22: =+RC[-1]/RC[-2]-1 -> -1.2880038437048102E-2 | F22: =+RC[-2]/RC[-4]-1 -> 0.11972397946276714 | G22: 2877 | H22: =+RC[-6]+#REF!+#REF!+#REF!+#REF!+#REF!+#REF!+#REF!+#REF!+#REF!+#REF!+#REF!+#REF!+#REF!+#REF!+#REF!+#REF!+#REF!+#REF!+#REF!+#REF!+#REF!+#REF!+#REF!+#REF!+#REF!+#REF!+#REF!+#REF!+#REF!+#REF! -> #REF! | I22: =+RC[-6]+#REF!+#REF!+#REF!+#REF!+#REF!+#REF!+#REF!+#REF!+#REF!+#REF!+#REF!+#REF!+#REF!+#REF!+#REF!+#REF!+#REF!+#REF!+#REF!+#REF!+#REF!+#REF!+#REF!+#REF!+#REF!+#REF!+#REF!+#REF!+#REF!+#REF! -> #REF! | J22: =+RC[-6]+#REF!+#REF!+#REF!+#REF!+#REF!+#REF!+#REF!+#REF!+#REF!+#REF!+#REF!+#REF!+#REF!+#REF!+#REF!+#REF!+#REF!+#REF!+#REF!+#REF!+#REF!+#REF!+#REF!+#REF!+#REF!+#REF!+#REF!+#REF!+#REF!+#REF! -> #REF! | K22: =+RC[-1]/RC[-2]-1 -> #REF! | L22: =+RC[-2]/RC[-4]-1 -> #REF! | M22: =+RC[-6]+#REF!+#REF!+#REF!+#REF!+#REF!+#REF!+#REF!+#REF!+#REF!+#REF!+#REF!+#REF!+#REF!+#REF!+#REF!+#REF!+#REF!+#REF!+#REF!+#REF!+#REF!+#REF!+#REF!+#REF!+#REF!+#REF!+#REF!+#REF!+#REF!+#REF! -> #REF!
A23: 19.01.2016 | B23: 8600656.5758999996 | C23: 9431921 | D23: 9647232 | E23: =+RC[-1]/RC[-2]-1 -> 2.2827905365195411E-2 | F23: =+RC[-2]/RC[-4]-1 -> 0.1216855265483594 | G23: 2801 | H23: =+RC[-6]+#REF!+#REF!+#REF!+#REF!+#REF!+#REF!+#REF!+#REF!+#REF!+#REF!+#REF!+#REF!+#REF!+#REF!+#REF!+#REF!+#REF!+#REF!+#REF!+#REF!+#REF!+#REF!+#REF!+#REF!+#REF!+#REF!+#REF!+#REF!+#REF!+#REF! -> #REF! | I23: =+RC[-6]+#REF!+#REF!+#REF!+#REF!+#REF!+#REF!+#REF!+#REF!+#REF!+#REF!+#REF!+#REF!+#REF!+#REF!+#REF!+#REF!+#REF!+#REF!+#REF!+#REF!+#REF!+#REF!+#REF!+#REF!+#REF!+#REF!+#REF!+#REF!+#REF!+#REF! -> #REF! | J23: =+RC[-6]+#REF!+#REF!+#REF!+#REF!+#REF!+#REF!+#REF!+#REF!+#REF!+#REF!+#REF!+#REF!+#REF!+#REF!+#REF!+#REF!+#REF!+#REF!+#REF!+#REF!+#REF!+#REF!+#REF!+#REF!+#REF!+#REF!+#REF!+#REF!+#REF!+#REF! -> #REF! | K23: =+RC[-1]/RC[-2]-1 -> #REF! | L23: =+RC[-2]/RC[-4]-1 -> #REF! | M23: =+RC[-6]+#REF!+#REF!+#REF!+#REF!+#REF!+#REF!+#REF!+#REF!+#REF!+#REF!+#REF!+#REF!+#REF!+#REF!+#REF!+#REF!+#REF!+#REF!+#REF!+#REF!+#REF!+#REF!+#REF!+#REF!+#REF!+#REF!+#REF!+#REF!+#REF!+#REF! -> #REF!
A24: 20.01.2016 | B24: 8590037.0982000008 | C24: 9431921 | D24: 9360691.0695999991 | E24: =+RC[-1]/RC[-2]-1 -> -7.5520066802935437E-3 | F24: =+RC[-2]/RC[-4]-1 -> 8.9714859504097522E-2 | G24: 2827 | H24: =+RC[-6]+#REF!+#REF!+#REF!+#REF!+#REF!+#REF!+#REF!+#REF!+#REF!+#REF!+#REF!+#REF!+#REF!+#REF!+#REF!+#REF!+#REF!+#REF!+#REF!+#REF!+#REF!+#REF!+#REF!+#REF!+#REF!+#REF!+#REF!+#REF!+#REF!+#REF! -> #REF! | I24: =+RC[-6]+#REF!+#REF!+#REF!+#REF!+#REF!+#REF!+#REF!+#REF!+#REF!+#REF!+#REF!+#REF!+#REF!+#REF!+#REF!+#REF!+#REF!+#REF!+#REF!+#REF!+#REF!+#REF!+#REF!+#REF!+#REF!+#REF!+#REF!+#REF!+#REF!+#REF! -> #REF! | J24: =+RC[-6]+#REF!+#REF!+#REF!+#REF!+#REF!+#REF!+#REF!+#REF!+#REF!+#REF!+#REF!+#REF!+#REF!+#REF!+#REF!+#REF!+#REF!+#REF!+#REF!+#REF!+#REF!+#REF!+#REF!+#REF!+#REF!+#REF!+#REF!+#REF!+#REF!+#REF! -> #REF! | K24: =+RC[-1]/RC[-2]-1 -> #REF! | L24: =+RC[-2]/RC[-4]-1 -> #REF! | M24: =+RC[-6]+#REF!+#REF!+#REF!+#REF!+#REF!+#REF!+#REF!+#REF!+#REF!+#REF!+#REF!+#REF!+#REF!+#REF!+#REF!+#REF!+#REF!+#REF!+#REF!+#REF!+#REF!+#REF!+#REF!+#REF!+#REF!+#REF!+#REF!+#REF!+#REF!+#REF! -> #REF!
A25: 21.01.2016 | B25: 8224877.5981999999 | C25: 9944525 | D25: 8778283.8438000008 | E25: =+RC[-1]/RC[-2]-1 -> -0.11727469700161641 | F25: =+RC[-2]/RC[-4]-1 -> 6.7284435420791322E-2 | G25: 2787 | H25: =+RC[-6]+#REF!+#REF!+#REF!+#REF!+#REF!+#REF!+#REF!+#REF!+#REF!+#REF!+#REF!+#REF!+#REF!+#REF!+#REF!+#REF!+#REF!+#REF!+#REF!+#REF!+#REF!+#REF!+#REF!+#REF!+#REF!+#REF!+#REF!+#REF!+#REF!+#REF! -> #REF! | I25: =+RC[-6]+#REF!+#REF!+#REF!+#REF!+#REF!+#REF!+#REF!+#REF!+#REF!+#REF!+#REF!+#REF!+#REF!+#REF!+#REF!+#REF!+#REF!+#REF!+#REF!+#REF!+#REF!+#REF!+#REF!+#REF!+#REF!+#REF!+#REF!+#REF!+#REF!+#REF! -> #REF! | J25: =+RC[-6]+#REF!+#REF!+#REF!+#REF!+#REF!+#REF!+#REF!+#REF!+#REF!+#REF!+#REF!+#REF!+#REF!+#REF!+#REF!+#REF!+#REF!+#REF!+#REF!+#REF!+#REF!+#REF!+#REF!+#REF!+#REF!+#REF!+#REF!+#REF!+#REF!+#REF! -> #REF! | K25: =+RC[-1]/RC[-2]-1 -> #REF! | L25: =+RC[-2]/RC[-4]-1 -> #REF! | M25: =+RC[-6]+#REF!+#REF!+#REF!+#REF!+#REF!+#REF!+#REF!+#REF!+#REF!+#REF!+#REF!+#REF!+#REF!+#REF!+#REF!+#REF!+#REF!+#REF!+#REF!+#REF!+#REF!+#REF!+#REF!+#REF!+#REF!+#REF!+#REF!+#REF!+#REF!+#REF! -> #REF!
A26: 22.01.2016 | B26: 8621380.0285999998 | C26: 10252088 | D26: 10654014.3116 | E26: =+RC[-1]/RC[-2]-1 -> 3.9204336872644907E-2 | F26: =+RC[-2]/RC[-4]-1 -> 0.23576669584881671 | G26: 2895 | H26: =+RC[-6]+#REF!+#REF!+#REF!+#REF!+#REF!+#REF!+#REF!+#REF!+#REF!+#REF!+#REF!+#REF!+#REF!+#REF!+#REF!+#REF!+#REF!+#REF!+#REF!+#REF!+#REF!+#REF!+#REF!+#REF!+#REF!+#REF!+#REF!+#REF!+#REF!+#REF! -> #REF! | I26: =+RC[-6]+#REF!+#REF!+#REF!+#REF!+#REF!+#REF!+#REF!+#REF!+#REF!+#REF!+#REF!+#REF!+#REF!+#REF!+#REF!+#REF!+#REF!+#REF!+#REF!+#REF!+#REF!+#REF!+#REF!+#REF!+#REF!+#REF!+#REF!+#REF!+#REF!+#REF! -> #REF! | J26: =+RC[-6]+#REF!+#REF!+#REF!+#REF!+#REF!+#REF!+#REF!+#REF!+#REF!+#REF!+#REF!+#REF!+#REF!+#REF!+#REF!+#REF!+#REF!+#REF!+#REF!+#REF!+#REF!+#REF!+#REF!+#REF!+#REF!+#REF!+#REF!+#REF!+#REF!+#REF! -> #REF! | K26: =+RC[-1]/RC[-2]-1 -> #REF! | L26: =+RC[-2]/RC[-4]-1 -> #REF! | M26: =+RC[-6]+#REF!+#REF!+#REF!+#REF!+#REF!+#REF!+#REF!+#REF!+#REF!+#REF!+#REF!+#REF!+#REF!+#REF!+#REF!+#REF!+#REF!+#REF!+#REF!+#REF!+#REF!+#REF!+#REF!+#REF!+#REF!+#REF!+#REF!+#REF!+#REF!+#REF! -> #REF!
A27: 23.01.2016 | B27: 9171311.8661000002 | C27: 11789901 | D27: 12780411.9571 | E27: =+RC[-1]/RC[-2]-1 -> 8.4013509282223842E-2 | F27: =+RC[-2]/RC[-4]-1 -> 0.39352059374846338 | G27: 2865 | H27: =+RC[-6]+#REF!+#REF!+#REF!+#REF!+#REF!+#REF!+#REF!+#REF!+#REF!+#REF!+#REF!+#REF!+#REF!+#REF!+#REF!+#REF!+#REF!+#REF!+#REF!+#REF!+#REF!+#REF!+#REF!+#REF!+#REF!+#REF!+#REF!+#REF!+#REF!+#REF! -> #REF! | I27: =+RC[-6]+#REF!+#REF!+#REF!+#REF!+#REF!+#REF!+#REF!+#REF!+#REF!+#REF!+#REF!+#REF!+#REF!+#REF!+#REF!+#REF!+#REF!+#REF!+#REF!+#REF!+#REF!+#REF!+#REF!+#REF!+#REF!+#REF!+#REF!+#REF!+#REF!+#REF! -> #REF! | J27: =+RC[-6]+#REF!+#REF!+#REF!+#REF!+#REF!+#REF!+#REF!+#REF!+#REF!+#REF!+#REF!+#REF!+#REF!+#REF!+#REF!+#REF!+#REF!+#REF!+#REF!+#REF!+#REF!+#REF!+#REF!+#REF!+#REF!+#REF!+#REF!+#REF!+#REF!+#REF! -> #REF! | K27: =+RC[-1]/RC[-2]-1 -> #REF! | L27: =+RC[-2]/RC[-4]-1 -> #REF! | M27: =+RC[-6]+#REF!+#REF!+#REF!+#REF!+#REF!+#REF!+#REF!+#REF!+#REF!+#REF!+#REF!+#REF!+#REF!+#REF!+#REF!+#REF!+#REF!+#REF!+#REF!+#REF!+#REF!+#REF!+#REF!+#REF!+#REF!+#REF!+#REF!+#REF!+#REF!+#REF! -> #REF!
A28: 24.01.2016 | B28: 12732930.723200001 | C28: 11277297 | D28: 9925078.2820999995 | E28: =+RC[-1]/RC[-2]-1 -> -0.11990627877407156 | F28: =+RC[-2]/RC[-4]-1 -> -0.2205189443137362 | G28: 2418 | H28: =+RC[-6]+#REF!+#REF!+#REF!+#REF!+#REF!+#REF!+#REF!+#REF!+#REF!+#REF!+#REF!+#REF!+#REF!+#REF!+#REF!+#REF!+#REF!+#REF!+#REF!+#REF!+#REF!+#REF!+#REF!+#REF!+#REF!+#REF!+#REF!+#REF!+#REF!+#REF! -> #REF! | I28: =+RC[-6]+#REF!+#REF!+#REF!+#REF!+#REF!+#REF!+#REF!+#REF!+#REF!+#REF!+#REF!+#REF!+#REF!+#REF!+#REF!+#REF!+#REF!+#REF!+#REF!+#REF!+#REF!+#REF!+#REF!+#REF!+#REF!+#REF!+#REF!+#REF!+#REF!+#REF! -> #REF! | J28: =+RC[-6]+#REF!+#REF!+#REF!+#REF!+#REF!+#REF!+#REF!+#REF!+#REF!+#REF!+#REF!+#REF!+#REF!+#REF!+#REF!+#REF!+#REF!+#REF!+#REF!+#REF!+#REF!+#REF!+#REF!+#REF!+#REF!+#REF!+#REF!+#REF!+#REF!+#REF! -> #REF! | K28: =+RC[-1]/RC[-2]-1 -> #REF! | L28: =+RC[-2]/RC[-4]-1 -> #REF! | M28: =+RC[-6]+#REF!+#REF!+#REF!+#REF!+#REF!+#REF!+#REF!+#REF!+#REF!+#REF!+#REF!+#REF!+#REF!+#REF!+#REF!+#REF!+#REF!+#REF!+#REF!+#REF!+#REF!+#REF!+#REF!+#REF!+#REF!+#REF!+#REF!+#REF!+#REF!+#REF! -> #REF!
A29: 25.01.2016 | B29: 9317627.2544999998 | C29: 9739484 | D29: 9375030.8392999992 | E29: =+RC[-1]/RC[-2]-1 -> -3.7420171407438141E-2 | F29: =+RC[-2]/RC[-4]-1 -> 6.1607513621320109E-3 | G29: 2966 | H29: =+RC[-6]+#REF!+#REF!+#REF!+#REF!+#REF!+#REF!+#REF!+#REF!+#REF!+#REF!+#REF!+#REF!+#REF!+#REF!+#REF!+#REF!+#REF!+#REF!+#REF!+#REF!+#REF!+#REF!+#REF!+#REF!+#REF!+#REF!+#REF!+#REF!+#REF!+#REF! -> #REF! | I29: =+RC[-6]+#REF!+#REF!+#REF!+#REF!+#REF!+#REF!+#REF!+#REF!+#REF!+#REF!+#REF!+#REF!+#REF!+#REF!+#REF!+#REF!+#REF!+#REF!+#REF!+#REF!+#REF!+#REF!+#REF!+#REF!+#REF!+#REF!+#REF!+#REF!+#REF!+#REF! -> #REF! | J29: =+RC[-6]+#REF!+#REF!+#REF!+#REF!+#REF!+#REF!+#REF!+#REF!+#REF!+#REF!+#REF!+#REF!+#REF!+#REF!+#REF!+#REF!+#REF!+#REF!+#REF!+#REF!+#REF!+#REF!+#REF!+#REF!+#REF!+#REF!+#REF!+#REF!+#REF!+#REF! -> #REF! | K29: =+RC[-1]/RC[-2]-1 -> #REF! | L29: =+RC[-2]/RC[-4]-1 -> #REF! | M29: =+RC[-6]+#REF!+#REF!+#REF!+#REF!+#REF!+#REF!+#REF!+#REF!+#REF!+#REF!+#REF!+#REF!+#REF!+#REF!+#REF!+#REF!+#REF!+#REF!+#REF!+#REF!+#REF!+#REF!+#REF!+#REF!+#REF!+#REF!+#REF!+#REF!+#REF!+#REF! -> #REF!
A30: 26.01.2016 | B30: 8096506.8304000003 | C30: 9739484 | D30: 9012218.5446000006 | E30: =+RC[-1]/RC[-2]-1 -> -7.4671867154358473E-2 | F30: =+RC[-2]/RC[-4]-1 -> 0.11309960374043926 | G30: 2847 | H30: =+RC[-6]+#REF!+#REF!+#REF!+#REF!+#REF!+#REF!+#REF!+#REF!+#REF!+#REF!+#REF!+#REF!+#REF!+#REF!+#REF!+#REF!+#REF!+#REF!+#REF!+#REF!+#REF!+#REF!+#REF!+#REF!+#REF!+#REF!+#REF!+#REF!+#REF!+#REF! -> #REF! | I30: =+RC[-6]+#REF!+#REF!+#REF!+#REF!+#REF!+#REF!+#REF!+#REF!+#REF!+#REF!+#REF!+#REF!+#REF!+#REF!+#REF!+#REF!+#REF!+#REF!+#REF!+#REF!+#REF!+#REF!+#REF!+#REF!+#REF!+#REF!+#REF!+#REF!+#REF!+#REF! -> #REF! | J30: =+RC[-6]+#REF!+#REF!+#REF!+#REF!+#REF!+#REF!+#REF!+#REF!+#REF!+#REF!+#REF!+#REF!+#REF!+#REF!+#REF!+#REF!+#REF!+#REF!+#REF!+#REF!+#REF!+#REF!+#REF!+#REF!+#REF!+#REF!+#REF!+#REF!+#REF!+#REF! -> #REF! | K30: =+RC[-1]/RC[-2]-1 -> #REF! | L30: =+RC[-2]/RC[-4]-1 -> #REF! | M30: =+RC[-6]+#REF!+#REF!+#REF!+#REF!+#REF!+#REF!+#REF!+#REF!+#REF!+#REF!+#REF!+#REF!+#REF!+#REF!+#REF!+#REF!+#REF!+#REF!+#REF!+#REF!+#REF!+#REF!+#REF!+#REF!+#REF!+#REF!+#REF!+#REF!+#REF!+#REF! -> #REF!
A31: 27.01.2016 | B31: 8683471.1607000008 | C31: 9739484 | D31: 8162219.3661000002 | E31: =+RC[-1]/RC[-2]-1 -> -0.16194540017725778 | F31: =+RC[-2]/RC[-4]-1 -> -6.0028044655586865E-2 | G31: 2752 | H31: =+RC[-6]+#REF!+#REF!+#REF!+#REF!+#REF!+#REF!+#REF!+#REF!+#REF!+#REF!+#REF!+#REF!+#REF!+#REF!+#REF!+#REF!+#REF!+#REF!+#REF!+#REF!+#REF!+#REF!+#REF!+#REF!+#REF!+#REF!+#REF!+#REF!+#REF!+#REF! -> #REF! | I31: =+RC[-6]+#REF!+#REF!+#REF!+#REF!+#REF!+#REF!+#REF!+#REF!+#REF!+#REF!+#REF!+#REF!+#REF!+#REF!+#REF!+#REF!+#REF!+#REF!+#REF!+#REF!+#REF!+#REF!+#REF!+#REF!+#REF!+#REF!+#REF!+#REF!+#REF!+#REF! -> #REF! | J31: =+RC[-6]+#REF!+#REF!+#REF!+#REF!+#REF!+#REF!+#REF!+#REF!+#REF!+#REF!+#REF!+#REF!+#REF!+#REF!+#REF!+#REF!+#REF!+#REF!+#REF!+#REF!+#REF!+#REF!+#REF!+#REF!+#REF!+#REF!+#REF!+#REF!+#REF!+#REF! -> #REF! | K31: =+RC[-1]/RC[-2]-1 -> #REF! | L31: =+RC[-2]/RC[-4]-1 -> #REF! | M31: =+RC[-6]+#REF!+#REF!+#REF!+#REF!+#REF!+#REF!+#REF!+#REF!+#REF!+#REF!+#REF!+#REF!+#REF!+#REF!+#REF!+#REF!+#REF!+#REF!+#REF!+#REF!+#REF!+#REF!+#REF!+#REF!+#REF!+#REF!+#REF!+#REF!+#REF!+#REF! -> #REF!
A32: 28.01.2016 | B32: 8230569.0536000002 | C32: 10047046 | D32: 9100361.9517999999 | E32: =+RC[-1]/RC[-2]-1 -> -9.4225113351725454E-2 | F32: =+RC[-2]/RC[-4]-1 -> 0.10567834283822175 | G32: 2799 | H32: =+RC[-6]+#REF!+#REF!+#REF!+#REF!+#REF!+#REF!+#REF!+#REF!+#REF!+#REF!+#REF!+#REF!+#REF!+#REF!+#REF!+#REF!+#REF!+#REF!+#REF!+#REF!+#REF!+#REF!+#REF!+#REF!+#REF!+#REF!+#REF!+#REF!+#REF!+#REF! -> #REF! | I32: =+RC[-6]+#REF!+#REF!+#REF!+#REF!+#REF!+#REF!+#REF!+#REF!+#REF!+#REF!+#REF!+#REF!+#REF!+#REF!+#REF!+#REF!+#REF!+#REF!+#REF!+#REF!+#REF!+#REF!+#REF!+#REF!+#REF!+#REF!+#REF!+#REF!+#REF!+#REF! -> #REF! | J32: =+RC[-6]+#REF!+#REF!+#REF!+#REF!+#REF!+#REF!+#REF!+#REF!+#REF!+#REF!+#REF!+#REF!+#REF!+#REF!+#REF!+#REF!+#REF!+#REF!+#REF!+#REF!+#REF!+#REF!+#REF!+#REF!+#REF!+#REF!+#REF!+#REF!+#REF!+#REF! -> #REF! | K32: =+RC[-1]/RC[-2]-1 -> #REF! | L32: =+RC[-2]/RC[-4]-1 -> #REF! | M32: =+RC[-6]+#REF!+#REF!+#REF!+#REF!+#REF!+#REF!+#REF!+#REF!+#REF!+#REF!+#REF!+#REF!+#REF!+#REF!+#REF!+#REF!+#REF!+#REF!+#REF!+#REF!+#REF!+#REF!+#REF!+#REF!+#REF!+#REF!+#REF!+#REF!+#REF!+#REF! -> #REF!
A33: 29.01.2016 | B33: 8502345.6963999998 | C33: 10252088 | D33: 10231983.9911 | E33: =+RC[-1]/RC[-2]-1 -> -1.9609672585720883E-3 | F33: =+RC[-2]/RC[-4]-1 -> 0.20343071858773643 | G33: 2899 | H33: =+RC[-6]+#REF!+#REF!+#REF!+#REF!+#REF!+#REF!+#REF!+#REF!+#REF!+#REF!+#REF!+#REF!+#REF!+#REF!+#REF!+#REF!+#REF!+#REF!+#REF!+#REF!+#REF!+#REF!+#REF!+#REF!+#REF!+#REF!+#REF!+#REF!+#REF!+#REF! -> #REF! | I33: =+RC[-6]+#REF!+#REF!+#REF!+#REF!+#REF!+#REF!+#REF!+#REF!+#REF!+#REF!+#REF!+#REF!+#REF!+#REF!+#REF!+#REF!+#REF!+#REF!+#REF!+#REF!+#REF!+#REF!+#REF!+#REF!+#REF!+#REF!+#REF!+#REF!+#REF!+#REF! -> #REF! | J33: =+RC[-6]+#REF!+#REF!+#REF!+#REF!+#REF!+#REF!+#REF!+#REF!+#REF!+#REF!+#REF!+#REF!+#REF!+#REF!+#REF!+#REF!+#REF!+#REF!+#REF!+#REF!+#REF!+#REF!+#REF!+#REF!+#REF!+#REF!+#REF!+#REF!+#REF!+#REF! -> #REF! | K33: =+RC[-1]/RC[-2]-1 -> #REF! | L33: =+RC[-2]/RC[-4]-1 -> #REF! | M33: =+RC[-6]+#REF!+#REF!+#REF!+#REF!+#REF!+#REF!+#REF!+#REF!+#REF!+#REF!+#REF!+#REF!+#REF!+#REF!+#REF!+#REF!+#REF!+#REF!+#REF!+#REF!+#REF!+#REF!+#REF!+#REF!+#REF!+#REF!+#REF!+#REF!+#REF!+#REF! -> #REF!
A34: 30.01.2016 | B34: 9867050.8972999994 | C34: 11789901 | D34: 12642450.723200001 | E34: =+RC[-1]/RC[-2]-1 -> 7.2311864467733855E-2 | F34: =+RC[-2]/RC[-4]-1 -> 0.2812795692236123 | G34: 2804 | H34: =+RC[-6]+#REF!+#REF!+#REF!+#REF!+#REF!+#REF!+#REF!+#REF!+#REF!+#REF!+#REF!+#REF!+#REF!+#REF!+#REF!+#REF!+#REF!+#REF!+#REF!+#REF!+#REF!+#REF!+#REF!+#REF!+#REF!+#REF!+#REF!+#REF!+#REF!+#REF! -> #REF! | I34: =+RC[-6]+#REF!+#REF!+#REF!+#REF!+#REF!+#REF!+#REF!+#REF!+#REF!+#REF!+#REF!+#REF!+#REF!+#REF!+#REF!+#REF!+#REF!+#REF!+#REF!+#REF!+#REF!+#REF!+#REF!+#REF!+#REF!+#REF!+#REF!+#REF!+#REF!+#REF! -> #REF! | J34: =+RC[-6]+#REF!+#REF!+#REF!+#REF!+#REF!+#REF!+#REF!+#REF!+#REF!+#REF!+#REF!+#REF!+#REF!+#REF!+#REF!+#REF!+#REF!+#REF!+#REF!+#REF!+#REF!+#REF!+#REF!+#REF!+#REF!+#REF!+#REF!+#REF!+#REF!+#REF! -> #REF! | K34: =+RC[-1]/RC[-2]-1 -> #REF! | L34: =+RC[-2]/RC[-4]-1 -> #REF! | M34: =+RC[-6]+#REF!+#REF!+#REF!+#REF!+#REF!+#REF!+#REF!+#REF!+#REF!+#REF!+#REF!+#REF!+#REF!+#REF!+#REF!+#REF!+#REF!+#REF!+#REF!+#REF!+#REF!+#REF!+#REF!+#REF!+#REF!+#REF!+#REF!+#REF!+#REF!+#REF! -> #REF!
A35: 31.01.2016 | B35: 12680385.541099999 | C35: 10457127 | D35: 10529120.669600001 | E35: =+RC[-1]/RC[-2]-1 -> 6.8846509753588414E-3 | F35: =+RC[-2]/RC[-4]-1 -> -0.16965295451997597 | G35: 2470 | H35: =+RC[-6]+#REF!+#REF!+#REF!+#REF!+#REF!+#REF!+#REF!+#REF!+#REF!+#REF!+#REF!+#REF!+#REF!+#REF!+#REF!+#REF!+#REF!+#REF!+#REF!+#REF!+#REF!+#REF!+#REF!+#REF!+#REF!+#REF!+#REF!+#REF!+#REF!+#REF! -> #REF! | I35: =+RC[-6]+#REF!+#REF!+#REF!+#REF!+#REF!+#REF!+#REF!+#REF!+#REF!+#REF!+#REF!+#REF!+#REF!+#REF!+#REF!+#REF!+#REF!+#REF!+#REF!+#REF!+#REF!+#REF!+#REF!+#REF!+#REF!+#REF!+#REF!+#REF!+#REF!+#REF! -> #REF! | J35: =+RC[-6]+#REF!+#REF!+#REF!+#REF!+#REF!+#REF!+#REF!+#REF!+#REF!+#REF!+#REF!+#REF!+#REF!+#REF!+#REF!+#REF!+#REF!+#REF!+#REF!+#REF!+#REF!+#REF!+#REF!+#REF!+#REF!+#REF!+#REF!+#REF!+#REF!+#REF! -> #REF! | K35: =+RC[-1]/RC[-2]-1 -> #REF! | L35: =+RC[-2]/RC[-4]-1 -> #REF! | M35: =+RC[-6]+#REF!+#REF!+#REF!+#REF!+#REF!+#REF!+#REF!+#REF!+#REF!+#REF!+#REF!+#REF!+#REF!+#REF!+#REF!+#REF!+#REF!+#REF!+#REF!+#REF!+#REF!+#REF!+#REF!+#REF!+#REF!+#REF!+#REF!+#REF!+#REF!+#REF! -> #REF!
A36: OCAK | B36: =SUM(R[-31]C:R[-1]C) -> 287962960.75999999 | C36: =SUM(R[-31]C:R[-1]C) -> 314739100 | D36: =SUM(R[-31]C:R[-1]C) -> 310175427.04580009 | E36: =+RC[-1]/RC[-2]-1 -> -1.4499860215015925E-2 | F36: =+RC[-2]/RC[-4]-1 -> 7.7136539460409548E-2 | G36: =SUM(R[-31]C:R[-1]C) -> 83414 | H36: =SUM(R[-31]C:R[-1]C) -> #REF! | I36: =SUM(R[-31]C:R[-1]C) -> #REF! | J36: =SUM(R[-31]C:R[-1]C) -> #REF! | K36: =+RC[-1]/RC[-2]-1 -> #REF! | L36: =+RC[-2]/RC[-4]-1 -> #REF! | M36: =SUM(R[-31]C:R[-1]C) -> #REF!
A37: 01.02.2016 | B37: 9670498.4571000002 | C37: 10238536 | D37: 9875863.625 | E37: =+RC[-1]/RC[-2]-1 -> -3.5422288401388613E-2 | F37: =+RC[-2]/RC[-4]-1 -> 2.1236254657506448E-2 | G37: 3027 | H37: =+RC[-6]+#REF!+#REF!+#REF!+#REF!+#REF!+#REF!+#REF!+#REF!+#REF!+#REF!+#REF!+#REF!+#REF!+#REF!+#REF!+#REF!+#REF!+#REF!+#REF!+#REF!+#REF!+#REF!+#REF!+#REF!+#REF!+#REF!+#REF!+#REF!+#REF!+#REF! -> #REF! | I37: =+RC[-6]+#REF!+#REF!+#REF!+#REF!+#REF!+#REF!+#REF!+#REF!+#REF!+#REF!+#REF!+#REF!+#REF!+#REF!+#REF!+#REF!+#REF!+#REF!+#REF!+#REF!+#REF!+#REF!+#REF!+#REF!+#REF!+#REF!+#REF!+#REF!+#REF!+#REF! -> #REF! | J37: =+RC[-6]+#REF!+#REF!+#REF!+#REF!+#REF!+#REF!+#REF!+#REF!+#REF!+#REF!+#REF!+#REF!+#REF!+#REF!+#REF!+#REF!+#REF!+#REF!+#REF!+#REF!+#REF!+#REF!+#REF!+#REF!+#REF!+#REF!+#REF!+#REF!+#REF!+#REF! -> #REF! | K37: =+RC[-1]/RC[-2]-1 -> #REF! | L37: =+RC[-2]/RC[-4]-1 -> #REF! | M37: =+RC[-6]+#REF!+#REF!+#REF!+#REF!+#REF!+#REF!+#REF!+#REF!+#REF!+#REF!+#REF!+#REF!+#REF!+#REF!+#REF!+#REF!+#REF!+#REF!+#REF!+#REF!+#REF!+#REF!+#REF!+#REF!+#REF!+#REF!+#REF!+#REF!+#REF!+#REF! -> #REF!
A38: 02.02.2016 | B38: 9179726.7893000003 | C38: 9317068 | D38: 9281028.1428999994 | E38: =+RC[-1]/RC[-2]-1 -> -3.8681543485569181E-3 | F38: =+RC[-2]/RC[-4]-1 -> 1.1035334267036845E-2 | G38: 2829 | H38: =+RC[-6]+#REF!+#REF!+#REF!+#REF!+#REF!+#REF!+#REF!+#REF!+#REF!+#REF!+#REF!+#REF!+#REF!+#REF!+#REF!+#REF!+#REF!+#REF!+#REF!+#REF!+#REF!+#REF!+#REF!+#REF!+#REF!+#REF!+#REF!+#REF!+#REF!+#REF! -> #REF! | I38: =+RC[-6]+#REF!+#REF!+#REF!+#REF!+#REF!+#REF!+#REF!+#REF!+#REF!+#REF!+#REF!+#REF!+#REF!+#REF!+#REF!+#REF!+#REF!+#REF!+#REF!+#REF!+#REF!+#REF!+#REF!+#REF!+#REF!+#REF!+#REF!+#REF!+#REF!+#REF! -> #REF! | J38: =+RC[-6]+#REF!+#REF!+#REF!+#REF!+#REF!+#REF!+#REF!+#REF!+#REF!+#REF!+#REF!+#REF!+#REF!+#REF!+#REF!+#REF!+#REF!+#REF!+#REF!+#REF!+#REF!+#REF!+#REF!+#REF!+#REF!+#REF!+#REF!+#REF!+#REF!+#REF! -> #REF! | K38: =+RC[-1]/RC[-2]-1 -> #REF! | L38: =+RC[-2]/RC[-4]-1 -> #REF! | M38: =+RC[-6]+#REF!+#REF!+#REF!+#REF!+#REF!+#REF!+#REF!+#REF!+#REF!+#REF!+#REF!+#REF!+#REF!+#REF!+#REF!+#REF!+#REF!+#REF!+#REF!+#REF!+#REF!+#REF!+#REF!+#REF!+#REF!+#REF!+#REF!+#REF!+#REF!+#REF! -> #REF!
A39: 03.02.2016 | B39: 8689161.2759000007 | C39: 9317068 | D39: 10223492.0911 | E39: =+RC[-1]/RC[-2]-1 -> 9.7286409318897205E-2 | F39: =+RC[-2]/RC[-4]-1 -> 0.17657985235647233 | G39: 2867 | H39: =+RC[-6]+#REF!+#REF!+#REF!+#REF!+#REF!+#REF!+#REF!+#REF!+#REF!+#REF!+#REF!+#REF!+#REF!+#REF!+#REF!+#REF!+#REF!+#REF!+#REF!+#REF!+#REF!+#REF!+#REF!+#REF!+#REF!+#REF!+#REF!+#REF!+#REF!+#REF! -> #REF! | I39: =+RC[-6]+#REF!+#REF!+#REF!+#REF!+#REF!+#REF!+#REF!+#REF!+#REF!+#REF!+#REF!+#REF!+#REF!+#REF!+#REF!+#REF!+#REF!+#REF!+#REF!+#REF!+#REF!+#REF!+#REF!+#REF!+#REF!+#REF!+#REF!+#REF!+#REF!+#REF! -> #REF! | J39: =+RC[-6]+#REF!+#REF!+#REF!+#REF!+#REF!+#REF!+#REF!+#REF!+#REF!+#REF!+#REF!+#REF!+#REF!+#REF!+#REF!+#REF!+#REF!+#REF!+#REF!+#REF!+#REF!+#REF!+#REF!+#REF!+#REF!+#REF!+#REF!+#REF!+#REF!+#REF! -> #REF! | K39: =+RC[-1]/RC[-2]-1 -> #REF! | L39: =+RC[-2]/RC[-4]-1 -> #REF! | M39: =+RC[-6]+#REF!+#REF!+#REF!+#REF!+#REF!+#REF!+#REF!+#REF!+#REF!+#REF!+#REF!+#REF!+#REF!+#REF!+#REF!+#REF!+#REF!+#REF!+#REF!+#REF!+#REF!+#REF!+#REF!+#REF!+#REF!+#REF!+#REF!+#REF!+#REF!+#REF! -> #REF!
A40: 04.02.2016 | B40: 8644340.6570999995 | C40: 9317068 | D40: 8933828.7375000007 | E40: =+RC[-1]/RC[-2]-1 -> -4.1133032677232673E-2 | F40: =+RC[-2]/RC[-4]-1 -> 3.3488740423739616E-2 | G40: 2763 | H40: =+RC[-6]+#REF!+#REF!+#REF!+#REF!+#REF!+#REF!+#REF!+#REF!+#REF!+#REF!+#REF!+#REF!+#REF!+#REF!+#REF!+#REF!+#REF!+#REF!+#REF!+#REF!+#REF!+#REF!+#REF!+#REF!+#REF!+#REF!+#REF!+#REF!+#REF!+#REF! -> #REF! | I40: =+RC[-6]+#REF!+#REF!+#REF!+#REF!+#REF!+#REF!+#REF!+#REF!+#REF!+#REF!+#REF!+#REF!+#REF!+#REF!+#REF!+#REF!+#REF!+#REF!+#REF!+#REF!+#REF!+#REF!+#REF!+#REF!+#REF!+#REF!+#REF!+#REF!+#REF!+#REF! -> #REF! | J40: =+RC[-6]+#REF!+#REF!+#REF!+#REF!+#REF!+#REF!+#REF!+#REF!+#REF!+#REF!+#REF!+#REF!+#REF!+#REF!+#REF!+#REF!+#REF!+#REF!+#REF!+#REF!+#REF!+#REF!+#REF!+#REF!+#REF!+#REF!+#REF!+#REF!+#REF!+#REF! -> #REF! | K40: =+RC[-1]/RC[-2]-1 -> #REF! | L40: =+RC[-2]/RC[-4]-1 -> #REF! | M40: =+RC[-6]+#REF!+#REF!+#REF!+#REF!+#REF!+#REF!+#REF!+#REF!+#REF!+#REF!+#REF!+#REF!+#REF!+#REF!+#REF!+#REF!+#REF!+#REF!+#REF!+#REF!+#REF!+#REF!+#REF!+#REF!+#REF!+#REF!+#REF!+#REF!+#REF!+#REF! -> #REF!
A41: 05.02.2016 | B41: 8427447.75 | C41: 9521838 | D41: 10262785.517899999 | E41: =+RC[-1]/RC[-2]-1 -> 7.7815597986439E-2 | F41: =+RC[-2]/RC[-4]-1 -> 0.21778097264382312 | G41: 3107 | H41: =+RC[-6]+#REF!+#REF!+#REF!+#REF!+#REF!+#REF!+#REF!+#REF!+#REF!+#REF!+#REF!+#REF!+#REF!+#REF!+#REF!+#REF!+#REF!+#REF!+#REF!+#REF!+#REF!+#REF!+#REF!+#REF!+#REF!+#REF!+#REF!+#REF!+#REF!+#REF! -> #REF! | I41: =+RC[-6]+#REF!+#REF!+#REF!+#REF!+#REF!+#REF!+#REF!+#REF!+#REF!+#REF!+#REF!+#REF!+#REF!+#REF!+#REF!+#REF!+#REF!+#REF!+#REF!+#REF!+#REF!+#REF!+#REF!+#REF!+#REF!+#REF!+#REF!+#REF!+#REF!+#REF! -> #REF! | J41: =+RC[-6]+#REF!+#REF!+#REF!+#REF!+#REF!+#REF!+#REF!+#REF!+#REF!+#REF!+#REF!+#REF!+#REF!+#REF!+#REF!+#REF!+#REF!+#REF!+#REF!+#REF!+#REF!+#REF!+#REF!+#REF!+#REF!+#REF!+#REF!+#REF!+#REF!+#REF! -> #REF! | K41: =+RC[-1]/RC[-2]-1 -> #REF! | L41: =+RC[-2]/RC[-4]-1 -> #REF! | M41: =+RC[-6]+#REF!+#REF!+#REF!+#REF!+#REF!+#REF!+#REF!+#REF!+#REF!+#REF!+#REF!+#REF!+#REF!+#REF!+#REF!+#REF!+#REF!+#REF!+#REF!+#REF!+#REF!+#REF!+#REF!+#REF!+#REF!+#REF!+#REF!+#REF!+#REF!+#REF! -> #REF!
A42: 06.02.2016 | B42: 9524313.5713999998 | C42: 11262389 | D42: 12492342.267899999 | E42: =+RC[-1]/RC[-2]-1 -> 0.10920891365943763 | F42: =+RC[-2]/RC[-4]-1 -> 0.31162652029984805 | G42: 2767 | H42: =+RC[-6]+#REF!+#REF!+#REF!+#REF!+#REF!+#REF!+#REF!+#REF!+#REF!+#REF!+#REF!+#REF!+#REF!+#REF!+#REF!+#REF!+#REF!+#REF!+#REF!+#REF!+#REF!+#REF!+#REF!+#REF!+#REF!+#REF!+#REF!+#REF!+#REF!+#REF! -> #REF! | I42: =+RC[-6]+#REF!+#REF!+#REF!+#REF!+#REF!+#REF!+#REF!+#REF!+#REF!+#REF!+#REF!+#REF!+#REF!+#REF!+#REF!+#REF!+#REF!+#REF!+#REF!+#REF!+#REF!+#REF!+#REF!+#REF!+#REF!+#REF!+#REF!+#REF!+#REF!+#REF! -> #REF! | J42: =+RC[-6]+#REF!+#REF!+#REF!+#REF!+#REF!+#REF!+#REF!+#REF!+#REF!+#REF!+#REF!+#REF!+#REF!+#REF!+#REF!+#REF!+#REF!+#REF!+#REF!+#REF!+#REF!+#REF!+#REF!+#REF!+#REF!+#REF!+#REF!+#REF!+#REF!+#REF! -> #REF! | K42: =+RC[-1]/RC[-2]-1 -> #REF! | L42: =+RC[-2]/RC[-4]-1 -> #REF! | M42: =+RC[-6]+#REF!+#REF!+#REF!+#REF!+#REF!+#REF!+#REF!+#REF!+#REF!+#REF!+#REF!+#REF!+#REF!+#REF!+#REF!+#REF!+#REF!+#REF!+#REF!+#REF!+#REF!+#REF!+#REF!+#REF!+#REF!+#REF!+#REF!+#REF!+#REF!+#REF! -> #REF!
A43: 07.02.2016 | B43: 11265764.102700001 | C43: 10238536 | D43: 11090228.25 | E43: =+RC[-1]/RC[-2]-1 -> 8.3184964139404238E-2 | F43: =+RC[-2]/RC[-4]-1 -> -1.5581353479426352E-2 | G43: 2656 | H43: =+RC[-6]+#REF!+#REF!+#REF!+#REF!+#REF!+#REF!+#REF!+#REF!+#REF!+#REF!+#REF!+#REF!+#REF!+#REF!+#REF!+#REF!+#REF!+#REF!+#REF!+#REF!+#REF!+#REF!+#REF!+#REF!+#REF!+#REF!+#REF!+#REF!+#REF!+#REF! -> #REF! | I43: =+RC[-6]+#REF!+#REF!+#REF!+#REF!+#REF!+#REF!+#REF!+#REF!+#REF!+#REF!+#REF!+#REF!+#REF!+#REF!+#REF!+#REF!+#REF!+#REF!+#REF!+#REF!+#REF!+#REF!+#REF!+#REF!+#REF!+#REF!+#REF!+#REF!+#REF!+#REF! -> #REF! | J43: =+RC[-6]+#REF!+#REF!+#REF!+#REF!+#REF!+#REF!+#REF!+#REF!+#REF!+#REF!+#REF!+#REF!+#REF!+#REF!+#REF!+#REF!+#REF!+#REF!+#REF!+#REF!+#REF!+#REF!+#REF!+#REF!+#REF!+#REF!+#REF!+#REF!+#REF!+#REF! -> #REF! | K43: =+RC[-1]/RC[-2]-1 -> #REF! | L43: =+RC[-2]/RC[-4]-1 -> #REF! | M43: =+RC[-6]+#REF!+#REF!+#REF!+#REF!+#REF!+#REF!+#REF!+#REF!+#REF!+#REF!+#REF!+#REF!+#REF!+#REF!+#REF!+#REF!+#REF!+#REF!+#REF!+#REF!+#REF!+#REF!+#REF!+#REF!+#REF!+#REF!+#REF!+#REF!+#REF!+#REF! -> #REF!
A44: SUBAT | B44: =SUM(R[-7]C:R[-1]C) -> 65401252.603500001 | C44: =SUM(R[-7]C:R[-1]C) -> 69212503 | D44: =SUM(R[-7]C:R[-1]C) -> 72159568.632299989 | E44: =+RC[-1]/RC[-2]-1 -> 4.2579960333178457E-2 | F44: =+RC[-2]/RC[-4]-1 -> 0.10333618638426989 | G44: =SUM(R[-7]C:R[-1]C) -> 20016 | H44: =SUM(R[-7]C:R[-1]C) -> #REF! | I44: =SUM(R[-7]C:R[-1]C) -> #REF! | J44: =SUM(R[-7]C:R[-1]C) -> #REF! | K44: =+RC[-1]/RC[-2]-1 -> #REF! | L44: =+RC[-2]/RC[-4]-1 -> #REF! | M44: =SUM(R[-7]C:R[-1]C) -> #REF!
A46: TOPLAM | B46: =R[-10]C+R[-2]C -> 353364213.3635 | C46: =R[-10]C+R[-2]C -> 383951603 | D46: =R[-10]C+R[-2]C -> 382334995.67810011 | E46: =RC[-1]/RC[-2]-1 -> -4.2104455594625945E-3 | F46: =RC[-2]/RC[-4]-1 -> 8.1985614895298875E-2 | G46: =R[-10]C+R[-2]C -> 103430 | H46: =R[-10]C+R[-2]C -> #REF! | I46: =R[-10]C+R[-2]C -> #REF! | J46: =R[-10]C+R[-2]C -> #REF! | K46: =RC[-1]/RC[-2]-1 -> #REF! | L46: =RC[-2]/RC[-4]-1 -> #REF! | M46: =R[-10]C+R[-2]C -> #REF!
A49: MAGAZA TOPLAM | B49: OCAK | C49: SUBAT
A50: NET SATIŞ - GEÇEN YIL | B50: 2039505214.9589286 | C50: 463142035.33749998
A51: NET SATIŞ - BÜTÇE | B51: 2039724461 | C51: 400004121
A52: NET SATIS -FİİLİ | B52: 2039453070.505357 | C52: 461302611.39285713
A53: Prog.Göre Artış | B53: =+R[-1]C/R[-2]C-1 -> -1.3305252735451578E-4 | C53: =+R[-1]C/R[-2]C-1 -> 0.15324464717916531
A54: G.Yıla Göre Artış | B54: =+R[-2]C/R[-4]C-1 -> -2.5567207766474809E-5 | C54: =+R[-2]C/R[-4]C-1 -> -3.9716195125808484E-3
A55: MUSTERI SAYISI | B55: 1219915 | C55: 285890
A58: TOPTAN SATIS | B58: OCAK | C58: SUBAT
A59: NET SATIŞ - GEÇEN YIL | B59: 9162862.5109821428 | C59: 486973.60535714269
A60: NET SATIŞ - BÜTÇE | B60: 0 | C60: 0
A61: NET SATIS -FİİLİ | B61: 10792143.803571429 | C61: 2504170.7321428573
A62: Prog.Göre Artış | B62: =+R[-1]C/R[-2]C-1 -> #DIV/0! | C62: =+R[-1]C/R[-2]C-1 -> #DIV/0!
A63: G.Yıla Göre Artış | B63: =+R[-2]C/R[-4]C-1 -> 0.1778135697918104 | C63: =+R[-2]C/R[-4]C-1 -> 4.1423130629560871
A66: SIRKET TOPLAM | B66: OCAK | C66: SUBAT
A67: NET SATIŞ - GEÇEN YIL | B67: =R[-17]C+R[-8]C -> 2048668077.4699106 | C67: =R[-17]C+R[-8]C -> 463629008.94285715
A68: NET SATIŞ - BÜTÇE | B68: =R[-17]C+R[-8]C -> 2039724461 | C68: =R[-17]C+R[-8]C -> 400004121
A69: NET SATIS -FİİLİ | B69: =R[-17]C+R[-8]C -> 2050245214.3089285 | C69: =R[-17]C+R[-8]C -> 463806782.125
A70: Prog.Göre Artış | B70: =+R[-1]C/R[-2]C-1 -> 5.1579286860004014E-3 | C70: =+R[-1]C/R[-2]C-1 -> 0.15950500951213953
A71: G.Yıla Göre Artış | B71: =+R[-2]C/R[-4]C-1 -> 7.6983521945916955E-4 | C71: =+R[-2]C/R[-4]C-1 -> 3.8343843615007422E-4
A72: MUSTERI SAYISI | B72: =R[-17]C -> 1219915 | C72: =R[-17]C -> 285890
A75: SIRKET TOPLAM | B75: KUMULE
A76: NET SATIŞ - GEÇEN YIL | B76: =SUM(R[-9]C:R[-9]C[1]) -> 2512297086.4127679
A77: NET SATIŞ - BÜTÇE | B77: =SUM(R[-9]C:R[-9]C[1]) -> 2439728582
A78: NET SATIS -FİİLİ | B78: =SUM(R[-9]C:R[-9]C[1]) -> 2514051996.4339285
A79: Prog.Göre Artış | B79: =+R[-1]C/R[-2]C-1 -> 3.0463804450329812E-2
A80: G.Yıla Göre Artış | B80: =+R[-2]C/R[-4]C-1 -> 6.9852806447601168E-4
A81: MUSTERI SAYISI | B81: =SUM(R[-9]C:R[-9]C[1]) -> 1505805

Sheet: USD
A1: RAMSTORE KAZAKISTAN
A3: TARIH | B3: 100 SAMAL | H3: MAGAZA TOPLAM
B4: NET SATIŞ - GEÇEN YIL | C4: NET SATIŞ - BÜTÇE | D4: NET SATIS -FİİLİ | E4: Prog.Göre Artış | F4: G.Yıla Göre Artış | G4: MUSTERI SAYISI | H4: NET SATIŞ - GEÇEN YIL | I4: NET SATIŞ - BÜTÇE | J4: NET SATIS -FİİLİ | K4: Prog.Göre Artış | L4: G.Yıla Göre Artış | M4: MUSTERI SAYISI
A5: 01.01.2016 | B5: 31582.988300000001 | C5: 20829.638095238097 | D5: 19106.196599999999 | E5: =+RC[-1]/RC[-2]-1 -> -8.2739867459919902E-2 | F5: =+RC[-2]/RC[-4]-1 -> -0.39504785239083917 | G5: 1710 | H5: =+RC[-6]+#REF!+#REF!+#REF!+#REF!+#REF!+#REF!+#REF!+#REF!+#REF!+#REF!+#REF!+#REF!+#REF!+#REF!+#REF!+#REF!+#REF!+#REF!+#REF!+#REF!+#REF!+#REF!+#REF!+#REF!+#REF!+#REF!+#REF!+#REF!+#REF!+#REF! -> #REF! | I5: =+RC[-6]+#REF!+#REF!+#REF!+#REF!+#REF!+#REF!+#REF!+#REF!+#REF!+#REF!+#REF!+#REF!+#REF!+#REF!+#REF!+#REF!+#REF!+#REF!+#REF!+#REF!+#REF!+#REF!+#REF!+#REF!+#REF!+#REF!+#REF!+#REF!+#REF!+#REF! -> #REF! | J5: =+RC[-6]+#REF!+#REF!+#REF!+#REF!+#REF!+#REF!+#REF!+#REF!+#REF!+#REF!+#REF!+#REF!+#REF!+#REF!+#REF!+#REF!+#REF!+#REF!+#REF!+#REF!+#REF!+#REF!+#REF!+#REF!+#REF!+#REF!+#REF!+#REF!+#REF!+#REF! -> #REF! | K5: =+RC[-1]/RC[-2]-1 -> #REF! | L5: =+RC[-2]/RC[-4]-1 -> #REF! | M5: =+RC[-6]+#REF!+#REF!+#REF!+#REF!+#REF!+#REF!+#REF!+#REF!+#REF!+#REF!+#REF!+#REF!+#REF!+#REF!+#REF!+#REF!+#REF!+#REF!+#REF!+#REF!+#REF!+#REF!+#REF!+#REF!+#REF!+#REF!+#REF!+#REF!+#REF!+#REF! -> #REF!
A6: 02.01.2016 | B6: 45103.852500000001 | C6: 30918.996825396825 | D6: 26875.275000000001 | E6: =+RC[-1]/RC[-2]-1 -> -0.13078437985010294 | F6: =+RC[-2]/RC[-4]-1 -> -0.40414679655135888 | G6: 2244 | H6: =+RC[-6]+#REF!+#REF!+#REF!+#REF!+#REF!+#REF!+#REF!+#REF!+#REF!+#REF!+#REF!+#REF!+#REF!+#REF!+#REF!+#REF!+#REF!+#REF!+#REF!+#REF!+#REF!+#REF!+#REF!+#REF!+#REF!+#REF!+#REF!+#REF!+#REF!+#REF! -> #REF! | I6: =+RC[-6]+#REF!+#REF!+#REF!+#REF!+#REF!+#REF!+#REF!+#REF!+#REF!+#REF!+#REF!+#REF!+#REF!+#REF!+#REF!+#REF!+#REF!+#REF!+#REF!+#REF!+#REF!+#REF!+#REF!+#REF!+#REF!+#REF!+#REF!+#REF!+#REF!+#REF! -> #REF! | J6: =+RC[-6]+#REF!+#REF!+#REF!+#REF!+#REF!+#REF!+#REF!+#REF!+#REF!+#REF!+#REF!+#REF!+#REF!+#REF!+#REF!+#REF!+#REF!+#REF!+#REF!+#REF!+#REF!+#REF!+#REF!+#REF!+#REF!+#REF!+#REF!+#REF!+#REF!+#REF! -> #REF! | K6: =+RC[-1]/RC[-2]-1 -> #REF! | L6: =+RC[-2]/RC[-4]-1 -> #REF! | M6: =+RC[-6]+#REF!+#REF!+#REF!+#REF!+#REF!+#REF!+#REF!+#REF!+#REF!+#REF!+#REF!+#REF!+#REF!+#REF!+#REF!+#REF!+#REF!+#REF!+#REF!+#REF!+#REF!+#REF!+#REF!+#REF!+#REF!+#REF!+#REF!+#REF!+#REF!+#REF! -> #REF!
A7: 03.01.2016 | B7: 50494.296799999996 | C7: 30268.06984126984 | D7: 29729.5416 | E7: =+RC[-1]/RC[-2]-1 -> -1.7791958459655977E-2 | F7: =+RC[-2]/RC[-4]-1 -> -0.41122971337230296 | G7: 2316 | H7: =+RC[-6]+#REF!+#REF!+#REF!+#REF!+#REF!+#REF!+#REF!+#REF!+#REF!+#REF!+#REF!+#REF!+#REF!+#REF!+#REF!+#REF!+#REF!+#REF!+#REF!+#REF!+#REF!+#REF!+#REF!+#REF!+#REF!+#REF!+#REF!+#REF!+#REF!+#REF! -> #REF! | I7: =+RC[-6]+#REF!+#REF!+#REF!+#REF!+#REF!+#REF!+#REF!+#REF!+#REF!+#REF!+#REF!+#REF!+#REF!+#REF!+#REF!+#REF!+#REF!+#REF!+#REF!+#REF!+#REF!+#REF!+#REF!+#REF!+#REF!+#REF!+#REF!+#REF!+#REF!+#REF! -> #REF! | J7: =+RC[-6]+#REF!+#REF!+#REF!+#REF!+#REF!+#REF!+#REF!+#REF!+#REF!+#REF!+#REF!+#REF!+#REF!+#REF!+#REF!+#REF!+#REF!+#REF!+#REF!+#REF!+#REF!+#REF!+#REF!+#REF!+#REF!+#REF!+#REF!+#REF!+#REF!+#REF! -> #REF! | K7: =+RC[-1]/RC[-2]-1 -> #REF! | L7: =+RC[-2]/RC[-4]-1 -> #REF! | M7: =+RC[-6]+#REF!+#REF!+#REF!+#REF!+#REF!+#REF!+#REF!+#REF!+#REF!+#REF!+#REF!+#REF!+#REF!+#REF!+#REF!+#REF!+#REF!+#REF!+#REF!+#REF!+#REF!+#REF!+#REF!+#REF!+#REF!+#REF!+#REF!+#REF!+#REF!+#REF! -> #REF!
A8: 04.01.2016 | B8: 48327.964200000002 | C8: 30268.06984126984 | D8: 31137.666000000001 | E8: =+RC[-1]/RC[-2]-1 -> 2.8729818693112863E-2 | F8: =+RC[-2]/RC[-4]-1 -> -0.35570085528245776 | G8: 2637 | H8: =+RC[-6]+#REF!+#REF!+#REF!+#REF!+#REF!+#REF!+#REF!+#REF!+#REF!+#REF!+#REF!+#REF!+#REF!+#REF!+#REF!+#REF!+#REF!+#REF!+#REF!+#REF!+#REF!+#REF!+#REF!+#REF!+#REF!+#REF!+#REF!+#REF!+#REF!+#REF! -> #REF! | I8: =+RC[-6]+#REF!+#REF!+#REF!+#REF!+#REF!+#REF!+#REF!+#REF!+#REF!+#REF!+#REF!+#REF!+#REF!+#REF!+#REF!+#REF!+#REF!+#REF!+#REF!+#REF!+#REF!+#REF!+#REF!+#REF!+#REF!+#REF!+#REF!+#REF!+#REF!+#REF! -> #REF! | J8: =+RC[-6]+#REF!+#REF!+#REF!+#REF!+#REF!+#REF!+#REF!+#REF!+#REF!+#REF!+#REF!+#REF!+#REF!+#REF!+#REF!+#REF!+#REF!+#REF!+#REF!+#REF!+#REF!+#REF!+#REF!+#REF!+#REF!+#REF!+#REF!+#REF!+#REF!+#REF! -> #REF! | K8: =+RC[-1]/RC[-2]-1 -> #REF! | L8: =+RC[-2]/RC[-4]-1 -> #REF! | M8: =+RC[-6]+#REF!+#REF!+#REF!+#REF!+#REF!+#REF!+#REF!+#REF!+#REF!+#REF!+#REF!+#REF!+#REF!+#REF!+#REF!+#REF!+#REF!+#REF!+#REF!+#REF!+#REF!+#REF!+#REF!+#REF!+#REF!+#REF!+#REF!+#REF!+#REF!+#REF! -> #REF!
A9: 05.01.2016 | B9: 55390.885999999999 | C9: 30918.996825396825 | D9: 29174.219300000001 | E9: =+RC[-1]/RC[-2]-1 -> -5.6430599454755481E-2 | F9: =+RC[-2]/RC[-4]-1 -> -0.47330289499250833 | G9: 2786 | H9: =+RC[-6]+#REF!+#REF!+#REF!+#REF!+#REF!+#REF!+#REF!+#REF!+#REF!+#REF!+#REF!+#REF!+#REF!+#REF!+#REF!+#REF!+#REF!+#REF!+#REF!+#REF!+#REF!+#REF!+#REF!+#REF!+#REF!+#REF!+#REF!+#REF!+#REF!+#REF! -> #REF! | I9: =+RC[-6]+#REF!+#REF!+#REF!+#REF!+#REF!+#REF!+#REF!+#REF!+#REF!+#REF!+#REF!+#REF!+#REF!+#REF!+#REF!+#REF!+#REF!+#REF!+#REF!+#REF!+#REF!+#REF!+#REF!+#REF!+#REF!+#REF!+#REF!+#REF!+#REF!+#REF! -> #REF! | J9: =+RC[-6]+#REF!+#REF!+#REF!+#REF!+#REF!+#REF!+#REF!+#REF!+#REF!+#REF!+#REF!+#REF!+#REF!+#REF!+#REF!+#REF!+#REF!+#REF!+#REF!+#REF!+#REF!+#REF!+#REF!+#REF!+#REF!+#REF!+#REF!+#REF!+#REF!+#REF! -> #REF! | K9: =+RC[-1]/RC[-2]-1 -> #REF! | L9: =+RC[-2]/RC[-4]-1 -> #REF! | M9: =+RC[-6]+#REF!+#REF!+#REF!+#REF!+#REF!+#REF!+#REF!+#REF!+#REF!+#REF!+#REF!+#REF!+#REF!+#REF!+#REF!+#REF!+#REF!+#REF!+#REF!+#REF!+#REF!+#REF!+#REF!+#REF!+#REF!+#REF!+#REF!+#REF!+#REF!+#REF! -> #REF!
A10: 06.01.2016 | B10: 54741.6204 | C10: 34173.625396825395 | D10: 30194.4876 | E10: =+RC[-1]/RC[-2]-1 -> -0.11643885454409653 | F10: =+RC[-2]/RC[-4]-1 -> -0.44841808884415124 | G10: 2850 | H10: =+RC[-6]+#REF!+#REF!+#REF!+#REF!+#REF!+#REF!+#REF!+#REF!+#REF!+#REF!+#REF!+#REF!+#REF!+#REF!+#REF!+#REF!+#REF!+#REF!+#REF!+#REF!+#REF!+#REF!+#REF!+#REF!+#REF!+#REF!+#REF!+#REF!+#REF!+#REF! -> #REF! | I10: =+RC[-6]+#REF!+#REF!+#REF!+#REF!+#REF!+#REF!+#REF!+#REF!+#REF!+#REF!+#REF!+#REF!+#REF!+#REF!+#REF!+#REF!+#REF!+#REF!+#REF!+#REF!+#REF!+#REF!+#REF!+#REF!+#REF!+#REF!+#REF!+#REF!+#REF!+#REF! -> #REF! | J10: =+RC[-6]+#REF!+#REF!+#REF!+#REF!+#REF!+#REF!+#REF!+#REF!+#REF!+#REF!+#REF!+#REF!+#REF!+#REF!+#REF!+#REF!+#REF!+#REF!+#REF!+#REF!+#REF!+#REF!+#REF!+#REF!+#REF!+#REF!+#REF!+#REF!+#REF!+#REF! -> #REF! | K10: =+RC[-1]/RC[-2]-1 -> #REF! | L10: =+RC[-2]/RC[-4]-1 -> #REF! | M10: =+RC[-6]+#REF!+#REF!+#REF!+#REF!+#REF!+#REF!+#REF!+#REF!+#REF!+#REF!+#REF!+#REF!+#REF!+#REF!+#REF!+#REF!+#REF!+#REF!+#REF!+#REF!+#REF!+#REF!+#REF!+#REF!+#REF!+#REF!+#REF!+#REF!+#REF!+#REF! -> #REF!
A11: 07.01.2016 | B11: 54094.460899999998 | C11: 35800.942857142858 | D11: 27478.4853 | E11: =+RC[-1]/RC[-2]-1 -> -0.23246475910849917 | F11: =+RC[-2]/RC[-4]-1 -> -0.49202774474826128 | G11: 2521 | H11: =+RC[-6]+#REF!+#REF!+#REF!+#REF!+#REF!+#REF!+#REF!+#REF!+#REF!+#REF!+#REF!+#REF!+#REF!+#REF!+#REF!+#REF!+#REF!+#REF!+#REF!+#REF!+#REF!+#REF!+#REF!+#REF!+#REF!+#REF!+#REF!+#REF!+#REF!+#REF! -> #REF! | I11: =+RC[-6]+#REF!+#REF!+#REF!+#REF!+#REF!+#REF!+#REF!+#REF!+#REF!+#REF!+#REF!+#REF!+#REF!+#REF!+#REF!+#REF!+#REF!+#REF!+#REF!+#REF!+#REF!+#REF!+#REF!+#REF!+#REF!+#REF!+#REF!+#REF!+#REF!+#REF! -> #REF! | J11: =+RC[-6]+#REF!+#REF!+#REF!+#REF!+#REF!+#REF!+#REF!+#REF!+#REF!+#REF!+#REF!+#REF!+#REF!+#REF!+#REF!+#REF!+#REF!+#REF!+#REF!+#REF!+#REF!+#REF!+#REF!+#REF!+#REF!+#REF!+#REF!+#REF!+#REF!+#REF! -> #REF! | K11: =+RC[-1]/RC[-2]-1 -> #REF! | L11: =+RC[-2]/RC[-4]-1 -> #REF! | M11: =+RC[-6]+#REF!+#REF!+#REF!+#REF!+#REF!+#REF!+#REF!+#REF!+#REF!+#REF!+#REF!+#REF!+#REF!+#REF!+#REF!+#REF!+#REF!+#REF!+#REF!+#REF!+#REF!+#REF!+#REF!+#REF!+#REF!+#REF!+#REF!+#REF!+#REF!+#REF! -> #REF!
A12: 08.01.2016 | B12: 45261.208200000001 | C12: 30918.996825396825 | D12: 27784.439600000002 | E12: =+RC[-1]/RC[-2]-1 -> -0.10137965481538858 | F12: =+RC[-2]/RC[-4]-1 -> -0.38613128758679494 | G12: 2836 | H12: =+RC[-6]+#REF!+#REF!+#REF!+#REF!+#REF!+#REF!+#REF!+#REF!+#REF!+#REF!+#REF!+#REF!+#REF!+#REF!+#REF!+#REF!+#REF!+#REF!+#REF!+#REF!+#REF!+#REF!+#REF!+#REF!+#REF!+#REF!+#REF!+#REF!+#REF!+#REF! -> #REF! | I12: =+RC[-6]+#REF!+#REF!+#REF!+#REF!+#REF!+#REF!+#REF!+#REF!+#REF!+#REF!+#REF!+#REF!+#REF!+#REF!+#REF!+#REF!+#REF!+#REF!+#REF!+#REF!+#REF!+#REF!+#REF!+#REF!+#REF!+#REF!+#REF!+#REF!+#REF!+#REF! -> #REF! | J12: =+RC[-6]+#REF!+#REF!+#REF!+#REF!+#REF!+#REF!+#REF!+#REF!+#REF!+#REF!+#REF!+#REF!+#REF!+#REF!+#REF!+#REF!+#REF!+#REF!+#REF!+#REF!+#REF!+#REF!+#REF!+#REF!+#REF!+#REF!+#REF!+#REF!+#REF!+#REF! -> #REF! | K12: =+RC[-1]/RC[-2]-1 -> #REF! | L12: =+RC[-2]/RC[-4]-1 -> #REF! | M12: =+RC[-6]+#REF!+#REF!+#REF!+#REF!+#REF!+#REF!+#REF!+#REF!+#REF!+#REF!+#REF!+#REF!+#REF!+#REF!+#REF!+#REF!+#REF!+#REF!+#REF!+#REF!+#REF!+#REF!+#REF!+#REF!+#REF!+#REF!+#REF!+#REF!+#REF!+#REF! -> #REF!
A13: 09.01.2016 | B13: 47908.106200000002 | C13: 35800.942857142858 | D13: 34819.568599999999 | E13: =+RC[-1]/RC[-2]-1 -> -2.7411966803747467E-2 | F13: =+RC[-2]/RC[-4]-1 -> -0.27320089726276853 | G13: 2607 | H13: =+RC[-6]+#REF!+#REF!+#REF!+#REF!+#REF!+#REF!+#REF!+#REF!+#REF!+#REF!+#REF!+#REF!+#REF!+#REF!+#REF!+#REF!+#REF!+#REF!+#REF!+#REF!+#REF!+#REF!+#REF!+#REF!+#REF!+#REF!+#REF!+#REF!+#REF!+#REF! -> #REF! | I13: =+RC[-6]+#REF!+#REF!+#REF!+#REF!+#REF!+#REF!+#REF!+#REF!+#REF!+#REF!+#REF!+#REF!+#REF!+#REF!+#REF!+#REF!+#REF!+#REF!+#REF!+#REF!+#REF!+#REF!+#REF!+#REF!+#REF!+#REF!+#REF!+#REF!+#REF!+#REF! -> #REF! | J13: =+RC[-6]+#REF!+#REF!+#REF!+#REF!+#REF!+#REF!+#REF!+#REF!+#REF!+#REF!+#REF!+#REF!+#REF!+#REF!+#REF!+#REF!+#REF!+#REF!+#REF!+#REF!+#REF!+#REF!+#REF!+#REF!+#REF!+#REF!+#REF!+#REF!+#REF!+#REF! -> #REF! | K13: =+RC[-1]/RC[-2]-1 -> #REF! | L13: =+RC[-2]/RC[-4]-1 -> #REF! | M13: =+RC[-6]+#REF!+#REF!+#REF!+#REF!+#REF!+#REF!+#REF!+#REF!+#REF!+#REF!+#REF!+#REF!+#REF!+#REF!+#REF!+#REF!+#REF!+#REF!+#REF!+#REF!+#REF!+#REF!+#REF!+#REF!+#REF!+#REF!+#REF!+#REF!+#REF!+#REF! -> #REF!
A14: 10.01.2016 | B14: 61896.294000000002 | C14: 34173.625396825395 | D14: 28372.946499999998 | E14: =+RC[-1]/RC[-2]-1 -> -0.16974139645611785 | F14: =+RC[-2]/RC[-4]-1 -> -0.5416050838197195 | G14: 2422 | H14: =+RC[-6]+#REF!+#REF!+#REF!+#REF!+#REF!+#REF!+#REF!+#REF!+#REF!+#REF!+#REF!+#REF!+#REF!+#REF!+#REF!+#REF!+#REF!+#REF!+#REF!+#REF!+#REF!+#REF!+#REF!+#REF!+#REF!+#REF!+#REF!+#REF!+#REF!+#REF! -> #REF! | I14: =+RC[-6]+#REF!+#REF!+#REF!+#REF!+#REF!+#REF!+#REF!+#REF!+#REF!+#REF!+#REF!+#REF!+#REF!+#REF!+#REF!+#REF!+#REF!+#REF!+#REF!+#REF!+#REF!+#REF!+#REF!+#REF!+#REF!+#REF!+#REF!+#REF!+#REF!+#REF! -> #REF! | J14: =+RC[-6]+#REF!+#REF!+#REF!+#REF!+#REF!+#REF!+#REF!+#REF!+#REF!+#REF!+#REF!+#REF!+#REF!+#REF!+#REF!+#REF!+#REF!+#REF!+#REF!+#REF!+#REF!+#REF!+#REF!+#REF!+#REF!+#REF!+#REF!+#REF!+#REF!+#REF! -> #REF! | K14: =+RC[-1]/RC[-2]-1 -> #REF! | L14: =+RC[-2]/RC[-4]-1 -> #REF! | M14: =+RC[-6]+#REF!+#REF!+#REF!+#REF!+#REF!+#REF!+#REF!+#REF!+#REF!+#REF!+#REF!+#REF!+#REF!+#REF!+#REF!+#REF!+#REF!+#REF!+#REF!+#REF!+#REF!+#REF!+#REF!+#REF!+#REF!+#REF!+#REF!+#REF!+#REF!+#REF! -> #REF!
A15: 11.01.2016 | B15: 51009.091699999997 | C15: 32546.31111111111 | D15: 28938.334200000001 | E15: =+RC[-1]/RC[-2]-1 -> -0.11085670811643433 | F15: =+RC[-2]/RC[-4]-1 -> -0.4326828172084467 | G15: 2958 | H15: =+RC[-6]+#REF!+#REF!+#REF!+#REF!+#REF!+#REF!+#REF!+#REF!+#REF!+#REF!+#REF!+#REF!+#REF!+#REF!+#REF!+#REF!+#REF!+#REF!+#REF!+#REF!+#REF!+#REF!+#REF!+#REF!+#REF!+#REF!+#REF!+#REF!+#REF!+#REF! -> #REF! | I15: =+RC[-6]+#REF!+#REF!+#REF!+#REF!+#REF!+#REF!+#REF!+#REF!+#REF!+#REF!+#REF!+#REF!+#REF!+#REF!+#REF!+#REF!+#REF!+#REF!+#REF!+#REF!+#REF!+#REF!+#REF!+#REF!+#REF!+#REF!+#REF!+#REF!+#REF!+#REF! -> #REF! | J15: =+RC[-6]+#REF!+#REF!+#REF!+#REF!+#REF!+#REF!+#REF!+#REF!+#REF!+#REF!+#REF!+#REF!+#REF!+#REF!+#REF!+#REF!+#REF!+#REF!+#REF!+#REF!+#REF!+#REF!+#REF!+#REF!+#REF!+#REF!+#REF!+#REF!+#REF!+#REF! -> #REF! | K15: =+RC[-1]/RC[-2]-1 -> #REF! | L15: =+RC[-2]/RC[-4]-1 -> #REF! | M15: =+RC[-6]+#REF!+#REF!+#REF!+#REF!+#REF!+#REF!+#REF!+#REF!+#REF!+#REF!+#REF!+#REF!+#REF!+#REF!+#REF!+#REF!+#REF!+#REF!+#REF!+#REF!+#REF!+#REF!+#REF!+#REF!+#REF!+#REF!+#REF!+#REF!+#REF!+#REF! -> #REF!
A16: 12.01.2016 | B16: 53644.068599999999 | C16: 29942.606349206348 | D16: 27600.221300000001 | E16: =+RC[-1]/RC[-2]-1 -> -7.8229163550033842E-2 | F16: =+RC[-2]/RC[-4]-1 -> -0.48549351269750629 | G16: 2735 | H16: =+RC[-6]+#REF!+#REF!+#REF!+#REF!+#REF!+#REF!+#REF!+#REF!+#REF!+#REF!+#REF!+#REF!+#REF!+#REF!+#REF!+#REF!+#REF!+#REF!+#REF!+#REF!+#REF!+#REF!+#REF!+#REF!+#REF!+#REF!+#REF!+#REF!+#REF!+#REF! -> #REF! | I16: =+RC[-6]+#REF!+#REF!+#REF!+#REF!+#REF!+#REF!+#REF!+#REF!+#REF!+#REF!+#REF!+#REF!+#REF!+#REF!+#REF!+#REF!+#REF!+#REF!+#REF!+#REF!+#REF!+#REF!+#REF!+#REF!+#REF!+#REF!+#REF!+#REF!+#REF!+#REF! -> #REF! | J16: =+RC[-6]+#REF!+#REF!+#REF!+#REF!+#REF!+#REF!+#REF!+#REF!+#REF!+#REF!+#REF!+#REF!+#REF!+#REF!+#REF!+#REF!+#REF!+#REF!+#REF!+#REF!+#REF!+#REF!+#REF!+#REF!+#REF!+#REF!+#REF!+#REF!+#REF!+#REF! -> #REF! | K16: =+RC[-1]/RC[-2]-1 -> #REF! | L16: =+RC[-2]/RC[-4]-1 -> #REF! | M16: =+RC[-6]+#REF!+#REF!+#REF!+#REF!+#REF!+#REF!+#REF!+#REF!+#REF!+#REF!+#REF!+#REF!+#REF!+#REF!+#REF!+#REF!+#REF!+#REF!+#REF!+#REF!+#REF!+#REF!+#REF!+#REF!+#REF!+#REF!+#REF!+#REF!+#REF!+#REF! -> #REF!
A17: 13.01.2016 | B17: 49162.266199999998 | C17: 29942.606349206348 | D17: 27542.401699999999 | E17: =+RC[-1]/RC[-2]-1 -> -8.0160177815314593E-2 | F17: =+RC[-2]/RC[-4]-1 -> -0.43976541707916628 | G17: 3048 | H17: =+RC[-6]+#REF!+#REF!+#REF!+#REF!+#REF!+#REF!+#REF!+#REF!+#REF!+#REF!+#REF!+#REF!+#REF!+#REF!+#REF!+#REF!+#REF!+#REF!+#REF!+#REF!+#REF!+#REF!+#REF!+#REF!+#REF!+#REF!+#REF!+#REF!+#REF!+#REF! -> #REF! | I17: =+RC[-6]+#REF!+#REF!+#REF!+#REF!+#REF!+#REF!+#REF!+#REF!+#REF!+#REF!+#REF!+#REF!+#REF!+#REF!+#REF!+#REF!+#REF!+#REF!+#REF!+#REF!+#REF!+#REF!+#REF!+#REF!+#REF!+#REF!+#REF!+#REF!+#REF!+#REF! -> #REF! | J17: =+RC[-6]+#REF!+#REF!+#REF!+#REF!+#REF!+#REF!+#REF!+#REF!+#REF!+#REF!+#REF!+#REF!+#REF!+#REF!+#REF!+#REF!+#REF!+#REF!+#REF!+#REF!+#REF!+#REF!+#REF!+#REF!+#REF!+#REF!+#REF!+#REF!+#REF!+#REF! -> #REF! | K17: =+RC[-1]/RC[-2]-1 -> #REF! | L17: =+RC[-2]/RC[-4]-1 -> #REF! | M17: =+RC[-6]+#REF!+#REF!+#REF!+#REF!+#REF!+#REF!+#REF!+#REF!+#REF!+#REF!+#REF!+#REF!+#REF!+#REF!+#REF!+#REF!+#REF!+#REF!+#REF!+#REF!+#REF!+#REF!+#REF!+#REF!+#REF!+#REF!+#REF!+#REF!+#REF!+#REF! -> #REF!
A18: 14.01.2016 | B18: 46152.950400000002 | C18: 30918.996825396825 | D18: 26019.235499999999 | E18: =+RC[-1]/RC[-2]-1 -> -0.1584709023085823 | F18: =+RC[-2]/RC[-4]-1 -> -0.43623895602565854 | G18: 2763 | H18: =+RC[-6]+#REF!+#REF!+#REF!+#REF!+#REF!+#REF!+#REF!+#REF!+#REF!+#REF!+#REF!+#REF!+#REF!+#REF!+#REF!+#REF!+#REF!+#REF!+#REF!+#REF!+#REF!+#REF!+#REF!+#REF!+#REF!+#REF!+#REF!+#REF!+#REF!+#REF! -> #REF! | I18: =+RC[-6]+#REF!+#REF!+#REF!+#REF!+#REF!+#REF!+#REF!+#REF!+#REF!+#REF!+#REF!+#REF!+#REF!+#REF!+#REF!+#REF!+#REF!+#REF!+#REF!+#REF!+#REF!+#REF!+#REF!+#REF!+#REF!+#REF!+#REF!+#REF!+#REF!+#REF! -> #REF! | J18: =+RC[-6]+#REF!+#REF!+#REF!+#REF!+#REF!+#REF!+#REF!+#REF!+#REF!+#REF!+#REF!+#REF!+#REF!+#REF!+#REF!+#REF!+#REF!+#REF!+#REF!+#REF!+#REF!+#REF!+#REF!+#REF!+#REF!+#REF!+#REF!+#REF!+#REF!+#REF! -> #REF! | K18: =+RC[-1]/RC[-2]-1 -> #REF! | L18: =+RC[-2]/RC[-4]-1 -> #REF! | M18: =+RC[-6]+#REF!+#REF!+#REF!+#REF!+#REF!+#REF!+#REF!+#REF!+#REF!+#REF!+#REF!+#REF!+#REF!+#REF!+#REF!+#REF!+#REF!+#REF!+#REF!+#REF!+#REF!+#REF!+#REF!+#REF!+#REF!+#REF!+#REF!+#REF!+#REF!+#REF! -> #REF!
A19: 15.01.2016 | B19: 47873.576000000001 | C19: 32546.31111111111 | D19: 27929.696 | E19: =+RC[-1]/RC[-2]-1 -> -0.14184756900252904 | F19: =+RC[-2]/RC[-4]-1 -> -0.41659474111564176 | G19: 2853 | H19: =+RC[-6]+#REF!+#REF!+#REF!+#REF!+#REF!+#REF!+#REF!+#REF!+#REF!+#REF!+#REF!+#REF!+#REF!+#REF!+#REF!+#REF!+#REF!+#REF!+#REF!+#REF!+#REF!+#REF!+#REF!+#REF!+#REF!+#REF!+#REF!+#REF!+#REF!+#REF! -> #REF! | I19: =+RC[-6]+#REF!+#REF!+#REF!+#REF!+#REF!+#REF!+#REF!+#REF!+#REF!+#REF!+#REF!+#REF!+#REF!+#REF!+#REF!+#REF!+#REF!+#REF!+#REF!+#REF!+#REF!+#REF!+#REF!+#REF!+#REF!+#REF!+#REF!+#REF!+#REF!+#REF! -> #REF! | J19: =+RC[-6]+#REF!+#REF!+#REF!+#REF!+#REF!+#REF!+#REF!+#REF!+#REF!+#REF!+#REF!+#REF!+#REF!+#REF!+#REF!+#REF!+#REF!+#REF!+#REF!+#REF!+#REF!+#REF!+#REF!+#REF!+#REF!+#REF!+#REF!+#REF!+#REF!+#REF! -> #REF! | K19: =+RC[-1]/RC[-2]-1 -> #REF! | L19: =+RC[-2]/RC[-4]-1 -> #REF! | M19: =+RC[-6]+#REF!+#REF!+#REF!+#REF!+#REF!+#REF!+#REF!+#REF!+#REF!+#REF!+#REF!+#REF!+#REF!+#REF!+#REF!+#REF!+#REF!+#REF!+#REF!+#REF!+#REF!+#REF!+#REF!+#REF!+#REF!+#REF!+#REF!+#REF!+#REF!+#REF! -> #REF!
A20: 16.01.2016 | B20: 53768.363599999997 | C20: 37428.257142857146 | D20: 35427.543400000002 | E20: =+RC[-1]/RC[-2]-1 -> -5.3454632825161164E-2 | F20: =+RC[-2]/RC[-4]-1 -> -0.34110802285974717 | G20: 2820 | H20: =+RC[-6]+#REF!+#REF!+#REF!+#REF!+#REF!+#REF!+#REF!+#REF!+#REF!+#REF!+#REF!+#REF!+#REF!+#REF!+#REF!+#REF!+#REF!+#REF!+#REF!+#REF!+#REF!+#REF!+#REF!+#REF!+#REF!+#REF!+#REF!+#REF!+#REF!+#REF! -> #REF! | I20: =+RC[-6]+#REF!+#REF!+#REF!+#REF!+#REF!+#REF!+#REF!+#REF!+#REF!+#REF!+#REF!+#REF!+#REF!+#REF!+#REF!+#REF!+#REF!+#REF!+#REF!+#REF!+#REF!+#REF!+#REF!+#REF!+#REF!+#REF!+#REF!+#REF!+#REF!+#REF! -> #REF! | J20: =+RC[-6]+#REF!+#REF!+#REF!+#REF!+#REF!+#REF!+#REF!+#REF!+#REF!+#REF!+#REF!+#REF!+#REF!+#REF!+#REF!+#REF!+#REF!+#REF!+#REF!+#REF!+#REF!+#REF!+#REF!+#REF!+#REF!+#REF!+#REF!+#REF!+#REF!+#REF! -> #REF! | K20: =+RC[-1]/RC[-2]-1 -> #REF! | L20: =+RC[-2]/RC[-4]-1 -> #REF! | M20: =+RC[-6]+#REF!+#REF!+#REF!+#REF!+#REF!+#REF!+#REF!+#REF!+#REF!+#REF!+#REF!+#REF!+#REF!+#REF!+#REF!+#REF!+#REF!+#REF!+#REF!+#REF!+#REF!+#REF!+#REF!+#REF!+#REF!+#REF!+#REF!+#REF!+#REF!+#REF! -> #REF!
A21: 17.01.2016 | B21: 64653.289299999997 | C21: 34173.625396825395 | D21: 25977.6891 | E21: =+RC[-1]/RC[-2]-1 -> -0.23983221568252944 | F21: =+RC[-2]/RC[-4]-1 -> -0.5982000392979232 | G21: 2301 | H21: =+RC[-6]+#REF!+#REF!+#REF!+#REF!+#REF!+#REF!+#REF!+#REF!+#REF!+#REF!+#REF!+#REF!+#REF!+#REF!+#REF!+#REF!+#REF!+#REF!+#REF!+#REF!+#REF!+#REF!+#REF!+#REF!+#REF!+#REF!+#REF!+#REF!+#REF!+#REF! -> #REF! | I21: =+RC[-6]+#REF!+#REF!+#REF!+#REF!+#REF!+#REF!+#REF!+#REF!+#REF!+#REF!+#REF!+#REF!+#REF!+#REF!+#REF!+#REF!+#REF!+#REF!+#REF!+#REF!+#REF!+#REF!+#REF!+#REF!+#REF!+#REF!+#REF!+#REF!+#REF!+#REF! -> #REF! | J21: =+RC[-6]+#REF!+#REF!+#REF!+#REF!+#REF!+#REF!+#REF!+#REF!+#REF!+#REF!+#REF!+#REF!+#REF!+#REF!+#REF!+#REF!+#REF!+#REF!+#REF!+#REF!+#REF!+#REF!+#REF!+#REF!+#REF!+#REF!+#REF!+#REF!+#REF!+#REF! -> #REF! | K21: =+RC[-1]/RC[-2]-1 -> #REF! | L21: =+RC[-2]/RC[-4]-1 -> #REF! | M21: =+RC[-6]+#REF!+#REF!+#REF!+#REF!+#REF!+#REF!+#REF!+#REF!+#REF!+#REF!+#REF!+#REF!+#REF!+#REF!+#REF!+#REF!+#REF!+#REF!+#REF!+#REF!+#REF!+#REF!+#REF!+#REF!+#REF!+#REF!+#REF!+#REF!+#REF!+#REF! -> #REF!
A22: 18.01.2016 | B22: 49172.894500000002 | C22: 32546.31111111111 | D22: 28041.1214 | E22: =+RC[-1]/RC[-2]-1 -> -0.13842397363346859 | F22: =+RC[-2]/RC[-4]-1 -> -0.42974434014658225 | G22: 2877 | H22: =+RC[-6]+#REF!+#REF!+#REF!+#REF!+#REF!+#REF!+#REF!+#REF!+#REF!+#REF!+#REF!+#REF!+#REF!+#REF!+#REF!+#REF!+#REF!+#REF!+#REF!+#REF!+#REF!+#REF!+#REF!+#REF!+#REF!+#REF!+#REF!+#REF!+#REF!+#REF! -> #REF! | I22: =+RC[-6]+#REF!+#REF!+#REF!+#REF!+#REF!+#REF!+#REF!+#REF!+#REF!+#REF!+#REF!+#REF!+#REF!+#REF!+#REF!+#REF!+#REF!+#REF!+#REF!+#REF!+#REF!+#REF!+#REF!+#REF!+#REF!+#REF!+#REF!+#REF!+#REF!+#REF! -> #REF! | J22: =+RC[-6]+#REF!+#REF!+#REF!+#REF!+#REF!+#REF!+#REF!+#REF!+#REF!+#REF!+#REF!+#REF!+#REF!+#REF!+#REF!+#REF!+#REF!+#REF!+#REF!+#REF!+#REF!+#REF!+#REF!+#REF!+#REF!+#REF!+#REF!+#REF!+#REF!+#REF! -> #REF! | K22: =+RC[-1]/RC[-2]-1 -> #REF! | L22: =+RC[-2]/RC[-4]-1 -> #REF! | M22: =+RC[-6]+#REF!+#REF!+#REF!+#REF!+#REF!+#REF!+#REF!+#REF!+#REF!+#REF!+#REF!+#REF!+#REF!+#REF!+#REF!+#REF!+#REF!+#REF!+#REF!+#REF!+#REF!+#REF!+#REF!+#REF!+#REF!+#REF!+#REF!+#REF!+#REF!+#REF! -> #REF!
A23: 19.01.2016 | B23: 46793.561300000001 | C23: 29942.606349206348 | D23: 25773.375 | E23: =+RC[-1]/RC[-2]-1 -> -0.13924076283081666 | F23: =+RC[-2]/RC[-4]-1 -> -0.44921108195284976 | G23: 2801 | H23: =+RC[-6]+#REF!+#REF!+#REF!+#REF!+#REF!+#REF!+#REF!+#REF!+#REF!+#REF!+#REF!+#REF!+#REF!+#REF!+#REF!+#REF!+#REF!+#REF!+#REF!+#REF!+#REF!+#REF!+#REF!+#REF!+#REF!+#REF!+#REF!+#REF!+#REF!+#REF! -> #REF! | I23: =+RC[-6]+#REF!+#REF!+#REF!+#REF!+#REF!+#REF!+#REF!+#REF!+#REF!+#REF!+#REF!+#REF!+#REF!+#REF!+#REF!+#REF!+#REF!+#REF!+#REF!+#REF!+#REF!+#REF!+#REF!+#REF!+#REF!+#REF!+#REF!+#REF!+#REF!+#REF! -> #REF! | J23: =+RC[-6]+#REF!+#REF!+#REF!+#REF!+#REF!+#REF!+#REF!+#REF!+#REF!+#REF!+#REF!+#REF!+#REF!+#REF!+#REF!+#REF!+#REF!+#REF!+#REF!+#REF!+#REF!+#REF!+#REF!+#REF!+#REF!+#REF!+#REF!+#REF!+#REF!+#REF! -> #REF! | K23: =+RC[-1]/RC[-2]-1 -> #REF! | L23: =+RC[-2]/RC[-4]-1 -> #REF! | M23: =+RC[-6]+#REF!+#REF!+#REF!+#REF!+#REF!+#REF!+#REF!+#REF!+#REF!+#REF!+#REF!+#REF!+#REF!+#REF!+#REF!+#REF!+#REF!+#REF!+#REF!+#REF!+#REF!+#REF!+#REF!+#REF!+#REF!+#REF!+#REF!+#REF!+#REF!+#REF! -> #REF!
A24: 20.01.2016 | B24: 46733.241399999999 | C24: 29942.606349206348 | D24: 24783.402399999999 | E24: =+RC[-1]/RC[-2]-1 -> -0.17230310177534358 | F24: =+RC[-2]/RC[-4]-1 -> -0.46968364150319775 | G24: 2827 | H24: =+RC[-6]+#REF!+#REF!+#REF!+#REF!+#REF!+#REF!+#REF!+#REF!+#REF!+#REF!+#REF!+#REF!+#REF!+#REF!+#REF!+#REF!+#REF!+#REF!+#REF!+#REF!+#REF!+#REF!+#REF!+#REF!+#REF!+#REF!+#REF!+#REF!+#REF!+#REF! -> #REF! | I24: =+RC[-6]+#REF!+#REF!+#REF!+#REF!+#REF!+#REF!+#REF!+#REF!+#REF!+#REF!+#REF!+#REF!+#REF!+#REF!+#REF!+#REF!+#REF!+#REF!+#REF!+#REF!+#REF!+#REF!+#REF!+#REF!+#REF!+#REF!+#REF!+#REF!+#REF!+#REF! -> #REF! | J24: =+RC[-6]+#REF!+#REF!+#REF!+#REF!+#REF!+#REF!+#REF!+#REF!+#REF!+#REF!+#REF!+#REF!+#REF!+#REF!+#REF!+#REF!+#REF!+#REF!+#REF!+#REF!+#REF!+#REF!+#REF!+#REF!+#REF!+#REF!+#REF!+#REF!+#REF!+#REF! -> #REF! | K24: =+RC[-1]/RC[-2]-1 -> #REF! | L24: =+RC[-2]/RC[-4]-1 -> #REF! | M24: =+RC[-6]+#REF!+#REF!+#REF!+#REF!+#REF!+#REF!+#REF!+#REF!+#REF!+#REF!+#REF!+#REF!+#REF!+#REF!+#REF!+#REF!+#REF!+#REF!+#REF!+#REF!+#REF!+#REF!+#REF!+#REF!+#REF!+#REF!+#REF!+#REF!+#REF!+#REF! -> #REF!
A25: 21.01.2016 | B25: 44749.061999999998 | C25: 31569.920634920636 | D25: 23433.752899999999 | E25: =+RC[-1]/RC[-2]-1 -> -0.25771897968982937 | F25: =+RC[-2]/RC[-4]-1 -> -0.47632974072171608 | G25: 2787 | H25: =+RC[-6]+#REF!+#REF!+#REF!+#REF!+#REF!+#REF!+#REF!+#REF!+#REF!+#REF!+#REF!+#REF!+#REF!+#REF!+#REF!+#REF!+#REF!+#REF!+#REF!+#REF!+#REF!+#REF!+#REF!+#REF!+#REF!+#REF!+#REF!+#REF!+#REF!+#REF! -> #REF! | I25: =+RC[-6]+#REF!+#REF!+#REF!+#REF!+#REF!+#REF!+#REF!+#REF!+#REF!+#REF!+#REF!+#REF!+#REF!+#REF!+#REF!+#REF!+#REF!+#REF!+#REF!+#REF!+#REF!+#REF!+#REF!+#REF!+#REF!+#REF!+#REF!+#REF!+#REF!+#REF! -> #REF! | J25: =+RC[-6]+#REF!+#REF!+#REF!+#REF!+#REF!+#REF!+#REF!+#REF!+#REF!+#REF!+#REF!+#REF!+#REF!+#REF!+#REF!+#REF!+#REF!+#REF!+#REF!+#REF!+#REF!+#REF!+#REF!+#REF!+#REF!+#REF!+#REF!+#REF!+#REF!+#REF! -> #REF! | K25: =+RC[-1]/RC[-2]-1 -> #REF! | L25: =+RC[-2]/RC[-4]-1 -> #REF! | M25: =+RC[-6]+#REF!+#REF!+#REF!+#REF!+#REF!+#REF!+#REF!+#REF!+#REF!+#REF!+#REF!+#REF!+#REF!+#REF!+#REF!+#REF!+#REF!+#REF!+#REF!+#REF!+#REF!+#REF!+#REF!+#REF!+#REF!+#REF!+#REF!+#REF!+#REF!+#REF! -> #REF!
A26: 22.01.2016 | B26: 46829.875200000002 | C26: 32546.31111111111 | D26: 27751.333200000001 | E26: =+RC[-1]/RC[-2]-1 -> -0.14732784599585957 | F26: =+RC[-2]/RC[-4]-1 -> -0.40740108570692923 | G26: 2895 | H26: =+RC[-6]+#REF!+#REF!+#REF!+#REF!+#REF!+#REF!+#REF!+#REF!+#REF!+#REF!+#REF!+#REF!+#REF!+#REF!+#REF!+#REF!+#REF!+#REF!+#REF!+#REF!+#REF!+#REF!+#REF!+#REF!+#REF!+#REF!+#REF!+#REF!+#REF!+#REF! -> #REF! | I26: =+RC[-6]+#REF!+#REF!+#REF!+#REF!+#REF!+#REF!+#REF!+#REF!+#REF!+#REF!+#REF!+#REF!+#REF!+#REF!+#REF!+#REF!+#REF!+#REF!+#REF!+#REF!+#REF!+#REF!+#REF!+#REF!+#REF!+#REF!+#REF!+#REF!+#REF!+#REF! -> #REF! | J26: =+RC[-6]+#REF!+#REF!+#REF!+#REF!+#REF!+#REF!+#REF!+#REF!+#REF!+#REF!+#REF!+#REF!+#REF!+#REF!+#REF!+#REF!+#REF!+#REF!+#REF!+#REF!+#REF!+#REF!+#REF!+#REF!+#REF!+#REF!+#REF!+#REF!+#REF!+#REF! -> #REF! | K26: =+RC[-1]/RC[-2]-1 -> #REF! | L26: =+RC[-2]/RC[-4]-1 -> #REF! | M26: =+RC[-6]+#REF!+#REF!+#REF!+#REF!+#REF!+#REF!+#REF!+#REF!+#REF!+#REF!+#REF!+#REF!+#REF!+#REF!+#REF!+#REF!+#REF!+#REF!+#REF!+#REF!+#REF!+#REF!+#REF!+#REF!+#REF!+#REF!+#REF!+#REF!+#REF!+#REF! -> #REF!
A27: 23.01.2016 | B27: 49817.0118 | C27: 37428.257142857146 | D27: 33530.307399999998 | E27: =+RC[-1]/RC[-2]-1 -> -0.10414456991623611 | F27: =+RC[-2]/RC[-4]-1 -> -0.32693057675530834 | G27: 2865 | H27: =+RC[-6]+#REF!+#REF!+#REF!+#REF!+#REF!+#REF!+#REF!+#REF!+#REF!+#REF!+#REF!+#REF!+#REF!+#REF!+#REF!+#REF!+#REF!+#REF!+#REF!+#REF!+#REF!+#REF!+#REF!+#REF!+#REF!+#REF!+#REF!+#REF!+#REF!+#REF! -> #REF! | I27: =+RC[-6]+#REF!+#REF!+#REF!+#REF!+#REF!+#REF!+#REF!+#REF!+#REF!+#REF!+#REF!+#REF!+#REF!+#REF!+#REF!+#REF!+#REF!+#REF!+#REF!+#REF!+#REF!+#REF!+#REF!+#REF!+#REF!+#REF!+#REF!+#REF!+#REF!+#REF! -> #REF! | J27: =+RC[-6]+#REF!+#REF!+#REF!+#REF!+#REF!+#REF!+#REF!+#REF!+#REF!+#REF!+#REF!+#REF!+#REF!+#REF!+#REF!+#REF!+#REF!+#REF!+#REF!+#REF!+#REF!+#REF!+#REF!+#REF!+#REF!+#REF!+#REF!+#REF!+#REF!+#REF! -> #REF! | K27: =+RC[-1]/RC[-2]-1 -> #REF! | L27: =+RC[-2]/RC[-4]-1 -> #REF! | M27: =+RC[-6]+#REF!+#REF!+#REF!+#REF!+#REF!+#REF!+#REF!+#REF!+#REF!+#REF!+#REF!+#REF!+#REF!+#REF!+#REF!+#REF!+#REF!+#REF!+#REF!+#REF!+#REF!+#REF!+#REF!+#REF!+#REF!+#REF!+#REF!+#REF!+#REF!+#REF! -> #REF!
A28: 24.01.2016 | B28: 69163.121799999994 | C28: 35800.942857142858 | D28: 26039.139200000001 | E28: =+RC[-1]/RC[-2]-1 -> -0.27266889858447463 | F28: =+RC[-2]/RC[-4]-1 -> -0.62351122213225485 | G28: 2418 | H28: =+RC[-6]+#REF!+#REF!+#REF!+#REF!+#REF!+#REF!+#REF!+#REF!+#REF!+#REF!+#REF!+#REF!+#REF!+#REF!+#REF!+#REF!+#REF!+#REF!+#REF!+#REF!+#REF!+#REF!+#REF!+#REF!+#REF!+#REF!+#REF!+#REF!+#REF!+#REF! -> #REF! | I28: =+RC[-6]+#REF!+#REF!+#REF!+#REF!+#REF!+#REF!+#REF!+#REF!+#REF!+#REF!+#REF!+#REF!+#REF!+#REF!+#REF!+#REF!+#REF!+#REF!+#REF!+#REF!+#REF!+#REF!+#REF!+#REF!+#REF!+#REF!+#REF!+#REF!+#REF!+#REF! -> #REF! | J28: =+RC[-6]+#REF!+#REF!+#REF!+#REF!+#REF!+#REF!+#REF!+#REF!+#REF!+#REF!+#REF!+#REF!+#REF!+#REF!+#REF!+#REF!+#REF!+#REF!+#REF!+#REF!+#REF!+#REF!+#REF!+#REF!+#REF!+#REF!+#REF!+#REF!+#REF!+#REF! -> #REF! | K28: =+RC[-1]/RC[-2]-1 -> #REF! | L28: =+RC[-2]/RC[-4]-1 -> #REF! | M28: =+RC[-6]+#REF!+#REF!+#REF!+#REF!+#REF!+#REF!+#REF!+#REF!+#REF!+#REF!+#REF!+#REF!+#REF!+#REF!+#REF!+#REF!+#REF!+#REF!+#REF!+#REF!+#REF!+#REF!+#REF!+#REF!+#REF!+#REF!+#REF!+#REF!+#REF!+#REF! -> #REF!
A29: 25.01.2016 | B29: 50611.772199999999 | C29: 30918.996825396825 | D29: 24596.051100000001 | E29: =+RC[-1]/RC[-2]-1 -> -0.204500351712678 | F29: =+RC[-2]/RC[-4]-1 -> -0.51402509671455454 | G29: 2966 | H29: =+RC[-6]+#REF!+#REF!+#REF!+#REF!+#REF!+#REF!+#REF!+#REF!+#REF!+#REF!+#REF!+#REF!+#REF!+#REF!+#REF!+#REF!+#REF!+#REF!+#REF!+#REF!+#REF!+#REF!+#REF!+#REF!+#REF!+#REF!+#REF!+#REF!+#REF!+#REF! -> #REF! | I29: =+RC[-6]+#REF!+#REF!+#REF!+#REF!+#REF!+#REF!+#REF!+#REF!+#REF!+#REF!+#REF!+#REF!+#REF!+#REF!+#REF!+#REF!+#REF!+#REF!+#REF!+#REF!+#REF!+#REF!+#REF!+#REF!+#REF!+#REF!+#REF!+#REF!+#REF!+#REF! -> #REF! | J29: =+RC[-6]+#REF!+#REF!+#REF!+#REF!+#REF!+#REF!+#REF!+#REF!+#REF!+#REF!+#REF!+#REF!+#REF!+#REF!+#REF!+#REF!+#REF!+#REF!+#REF!+#REF!+#REF!+#REF!+#REF!+#REF!+#REF!+#REF!+#REF!+#REF!+#REF!+#REF! -> #REF! | K29: =+RC[-1]/RC[-2]-1 -> #REF! | L29: =+RC[-2]/RC[-4]-1 -> #REF! | M29: =+RC[-6]+#REF!+#REF!+#REF!+#REF!+#REF!+#REF!+#REF!+#REF!+#REF!+#REF!+#REF!+#REF!+#REF!+#REF!+#REF!+#REF!+#REF!+#REF!+#REF!+#REF!+#REF!+#REF!+#REF!+#REF!+#REF!+#REF!+#REF!+#REF!+#REF!+#REF! -> #REF!
A30: 26.01.2016 | B30: 43978.853000000003 | C30: 30918.996825396825 | D30: 24168.5713 | E30: =+RC[-1]/RC[-2]-1 -> -0.21832614956808805 | F30: =+RC[-2]/RC[-4]-1 -> -0.45045016749299949 | G30: 2847 | H30: =+RC[-6]+#REF!+#REF!+#REF!+#REF!+#REF!+#REF!+#REF!+#REF!+#REF!+#REF!+#REF!+#REF!+#REF!+#REF!+#REF!+#REF!+#REF!+#REF!+#REF!+#REF!+#REF!+#REF!+#REF!+#REF!+#REF!+#REF!+#REF!+#REF!+#REF!+#REF! -> #REF! | I30: =+RC[-6]+#REF!+#REF!+#REF!+#REF!+#REF!+#REF!+#REF!+#REF!+#REF!+#REF!+#REF!+#REF!+#REF!+#REF!+#REF!+#REF!+#REF!+#REF!+#REF!+#REF!+#REF!+#REF!+#REF!+#REF!+#REF!+#REF!+#REF!+#REF!+#REF!+#REF! -> #REF! | J30: =+RC[-6]+#REF!+#REF!+#REF!+#REF!+#REF!+#REF!+#REF!+#REF!+#REF!+#REF!+#REF!+#REF!+#REF!+#REF!+#REF!+#REF!+#REF!+#REF!+#REF!+#REF!+#REF!+#REF!+#REF!+#REF!+#REF!+#REF!+#REF!+#REF!+#REF!+#REF! -> #REF! | K30: =+RC[-1]/RC[-2]-1 -> #REF! | L30: =+RC[-2]/RC[-4]-1 -> #REF! | M30: =+RC[-6]+#REF!+#REF!+#REF!+#REF!+#REF!+#REF!+#REF!+#REF!+#REF!+#REF!+#REF!+#REF!+#REF!+#REF!+#REF!+#REF!+#REF!+#REF!+#REF!+#REF!+#REF!+#REF!+#REF!+#REF!+#REF!+#REF!+#REF!+#REF!+#REF!+#REF! -> #REF!
A31: 27.01.2016 | B31: 47077.642500000002 | C31: 30918.996825396825 | D31: 21462.5805 | E31: =+RC[-1]/RC[-2]-1 -> -0.30584486226375029 | F31: =+RC[-2]/RC[-4]-1 -> -0.5441024792182404 | G31: 2752 | H31: =+RC[-6]+#REF!+#REF!+#REF!+#REF!+#REF!+#REF!+#REF!+#REF!+#REF!+#REF!+#REF!+#REF!+#REF!+#REF!+#REF!+#REF!+#REF!+#REF!+#REF!+#REF!+#REF!+#REF!+#REF!+#REF!+#REF!+#REF!+#REF!+#REF!+#REF!+#REF! -> #REF! | I31: =+RC[-6]+#REF!+#REF!+#REF!+#REF!+#REF!+#REF!+#REF!+#REF!+#REF!+#REF!+#REF!+#REF!+#REF!+#REF!+#REF!+#REF!+#REF!+#REF!+#REF!+#REF!+#REF!+#REF!+#REF!+#REF!+#REF!+#REF!+#REF!+#REF!+#REF!+#REF! -> #REF! | J31: =+RC[-6]+#REF!+#REF!+#REF!+#REF!+#REF!+#REF!+#REF!+#REF!+#REF!+#REF!+#REF!+#REF!+#REF!+#REF!+#REF!+#REF!+#REF!+#REF!+#REF!+#REF!+#REF!+#REF!+#REF!+#REF!+#REF!+#REF!+#REF!+#REF!+#REF!+#REF! -> #REF! | K31: =+RC[-1]/RC[-2]-1 -> #REF! | L31: =+RC[-2]/RC[-4]-1 -> #REF! | M31: =+RC[-6]+#REF!+#REF!+#REF!+#REF!+#REF!+#REF!+#REF!+#REF!+#REF!+#REF!+#REF!+#REF!+#REF!+#REF!+#REF!+#REF!+#REF!+#REF!+#REF!+#REF!+#REF!+#REF!+#REF!+#REF!+#REF!+#REF!+#REF!+#REF!+#REF!+#REF! -> #REF!
A32: 28.01.2016 | B32: 44622.223100000003 | C32: 31895.384126984129 | D32: 24235.963500000002 | E32: =+RC[-1]/RC[-2]-1 -> -0.24014197780123625 | F32: =+RC[-2]/RC[-4]-1 -> -0.45686337846309588 | G32: 2799 | H32: =+RC[-6]+#REF!+#REF!+#REF!+#REF!+#REF!+#REF!+#REF!+#REF!+#REF!+#REF!+#REF!+#REF!+#REF!+#REF!+#REF!+#REF!+#REF!+#REF!+#REF!+#REF!+#REF!+#REF!+#REF!+#REF!+#REF!+#REF!+#REF!+#REF!+#REF!+#REF! -> #REF! | I32: =+RC[-6]+#REF!+#REF!+#REF!+#REF!+#REF!+#REF!+#REF!+#REF!+#REF!+#REF!+#REF!+#REF!+#REF!+#REF!+#REF!+#REF!+#REF!+#REF!+#REF!+#REF!+#REF!+#REF!+#REF!+#REF!+#REF!+#REF!+#REF!+#REF!+#REF!+#REF! -> #REF! | J32: =+RC[-6]+#REF!+#REF!+#REF!+#REF!+#REF!+#REF!+#REF!+#REF!+#REF!+#REF!+#REF!+#REF!+#REF!+#REF!+#REF!+#REF!+#REF!+#REF!+#REF!+#REF!+#REF!+#REF!+#REF!+#REF!+#REF!+#REF!+#REF!+#REF!+#REF!+#REF! -> #REF! | K32: =+RC[-1]/RC[-2]-1 -> #REF! | L32: =+RC[-2]/RC[-4]-1 -> #REF! | M32: =+RC[-6]+#REF!+#REF!+#REF!+#REF!+#REF!+#REF!+#REF!+#REF!+#REF!+#REF!+#REF!+#REF!+#REF!+#REF!+#REF!+#REF!+#REF!+#REF!+#REF!+#REF!+#REF!+#REF!+#REF!+#REF!+#REF!+#REF!+#REF!+#REF!+#REF!+#REF! -> #REF!
A33: 29.01.2016 | B33: 46095.666599999997 | C33: 32546.31111111111 | D33: 27538.646199999999 | E33: =+RC[-1]/RC[-2]-1 -> -0.15386274942236156 | F33: =+RC[-2]/RC[-4]-1 -> -0.40257624563780581 | G33: 2899 | H33: =+RC[-6]+#REF!+#REF!+#REF!+#REF!+#REF!+#REF!+#REF!+#REF!+#REF!+#REF!+#REF!+#REF!+#REF!+#REF!+#REF!+#REF!+#REF!+#REF!+#REF!+#REF!+#REF!+#REF!+#REF!+#REF!+#REF!+#REF!+#REF!+#REF!+#REF!+#REF! -> #REF! | I33: =+RC[-6]+#REF!+#REF!+#REF!+#REF!+#REF!+#REF!+#REF!+#REF!+#REF!+#REF!+#REF!+#REF!+#REF!+#REF!+#REF!+#REF!+#REF!+#REF!+#REF!+#REF!+#REF!+#REF!+#REF!+#REF!+#REF!+#REF!+#REF!+#REF!+#REF!+#REF! -> #REF! | J33: =+RC[-6]+#REF!+#REF!+#REF!+#REF!+#REF!+#REF!+#REF!+#REF!+#REF!+#REF!+#REF!+#REF!+#REF!+#REF!+#REF!+#REF!+#REF!+#REF!+#REF!+#REF!+#REF!+#REF!+#REF!+#REF!+#REF!+#REF!+#REF!+#REF!+#REF!+#REF! -> #REF! | K33: =+RC[-1]/RC[-2]-1 -> #REF! | L33: =+RC[-2]/RC[-4]-1 -> #REF! | M33: =+RC[-6]+#REF!+#REF!+#REF!+#REF!+#REF!+#REF!+#REF!+#REF!+#REF!+#REF!+#REF!+#REF!+#REF!+#REF!+#REF!+#REF!+#REF!+#REF!+#REF!+#REF!+#REF!+#REF!+#REF!+#REF!+#REF!+#REF!+#REF!+#REF!+#REF!+#REF! -> #REF!
A34: 30.01.2016 | B34: 53494.447800000002 | C34: 37428.257142857146 | D34: 34656.790800000002 | E34: =+RC[-1]/RC[-2]-1 -> -7.4047432459356521E-2 | F34: =+RC[-2]/RC[-4]-1 -> -0.35214228344647014 | G34: 2804 | H34: =+RC[-6]+#REF!+#REF!+#REF!+#REF!+#REF!+#REF!+#REF!+#REF!+#REF!+#REF!+#REF!+#REF!+#REF!+#REF!+#REF!+#REF!+#REF!+#REF!+#REF!+#REF!+#REF!+#REF!+#REF!+#REF!+#REF!+#REF!+#REF!+#REF!+#REF!+#REF! -> #REF! | I34: =+RC[-6]+#REF!+#REF!+#REF!+#REF!+#REF!+#REF!+#REF!+#REF!+#REF!+#REF!+#REF!+#REF!+#REF!+#REF!+#REF!+#REF!+#REF!+#REF!+#REF!+#REF!+#REF!+#REF!+#REF!+#REF!+#REF!+#REF!+#REF!+#REF!+#REF!+#REF! -> #REF! | J34: =+RC[-6]+#REF!+#REF!+#REF!+#REF!+#REF!+#REF!+#REF!+#REF!+#REF!+#REF!+#REF!+#REF!+#REF!+#REF!+#REF!+#REF!+#REF!+#REF!+#REF!+#REF!+#REF!+#REF!+#REF!+#REF!+#REF!+#REF!+#REF!+#REF!+#REF!+#REF! -> #REF! | K34: =+RC[-1]/RC[-2]-1 -> #REF! | L34: =+RC[-2]/RC[-4]-1 -> #REF! | M34: =+RC[-6]+#REF!+#REF!+#REF!+#REF!+#REF!+#REF!+#REF!+#REF!+#REF!+#REF!+#REF!+#REF!+#REF!+#REF!+#REF!+#REF!+#REF!+#REF!+#REF!+#REF!+#REF!+#REF!+#REF!+#REF!+#REF!+#REF!+#REF!+#REF!+#REF!+#REF! -> #REF!
A35: 31.01.2016 | B35: 68747.007500000007 | C35: 33197.228571428568 | D35: 28863.512299999999 | E35: =+RC[-1]/RC[-2]-1 -> -0.13054452006750994 | F35: =+RC[-2]/RC[-4]-1 -> -0.58014881884131464 | G35: 2470 | H35: =+RC[-6]+#REF!+#REF!+#REF!+#REF!+#REF!+#REF!+#REF!+#REF!+#REF!+#REF!+#REF!+#REF!+#REF!+#REF!+#REF!+#REF!+#REF!+#REF!+#REF!+#REF!+#REF!+#REF!+#REF!+#REF!+#REF!+#REF!+#REF!+#REF!+#REF!+#REF! -> #REF! | I35: =+RC[-6]+#REF!+#REF!+#REF!+#REF!+#REF!+#REF!+#REF!+#REF!+#REF!+#REF!+#REF!+#REF!+#REF!+#REF!+#REF!+#REF!+#REF!+#REF!+#REF!+#REF!+#REF!+#REF!+#REF!+#REF!+#REF!+#REF!+#REF!+#REF!+#REF!+#REF! -> #REF! | J35: =+RC[-6]+#REF!+#REF!+#REF!+#REF!+#REF!+#REF!+#REF!+#REF!+#REF!+#REF!+#REF!+#REF!+#REF!+#REF!+#REF!+#REF!+#REF!+#REF!+#REF!+#REF!+#REF!+#REF!+#REF!+#REF!+#REF!+#REF!+#REF!+#REF!+#REF!+#REF! -> #REF! | K35: =+RC[-1]/RC[-2]-1 -> #REF! | L35: =+RC[-2]/RC[-4]-1 -> #REF! | M35: =+RC[-6]+#REF!+#REF!+#REF!+#REF!+#REF!+#REF!+#REF!+#REF!+#REF!+#REF!+#REF!+#REF!+#REF!+#REF!+#REF!+#REF!+#REF!+#REF!+#REF!+#REF!+#REF!+#REF!+#REF!+#REF!+#REF!+#REF!+#REF!+#REF!+#REF!+#REF! -> #REF!
A36: OCAK | B36: =SUM(R[-31]C:R[-1]C) -> 1568951.6640000003 | C36: =SUM(R[-31]C:R[-1]C) -> 999171.7460317458 | D36: =SUM(R[-31]C:R[-1]C) -> 858982.4944999998 | E36: =+RC[-1]/RC[-2]-1 -> -0.14030546008582978 | F36: =+RC[-2]/RC[-4]-1 -> -0.45251181778918104 | G36: =SUM(R[-31]C:R[-1]C) -> 83414 | H36: =SUM(R[-31]C:R[-1]C) -> #REF! | I36: =SUM(R[-31]C:R[-1]C) -> #REF! | J36: =SUM(R[-31]C:R[-1]C) -> #REF! | K36: =+RC[-1]/RC[-2]-1 -> #REF! | L36: =+RC[-2]/RC[-4]-1 -> #REF! | M36: =SUM(R[-31]C:R[-1]C) -> #REF!
A37: 01.02.2016 | B37: 52428.8341 | C37: 32503.288888888888 | D37: 27072.736700000001 | E37: =+RC[-1]/RC[-2]-1 -> -0.16707700588248153 | F37: =+RC[-2]/RC[-4]-1 -> -0.48362886253844806 | G37: 3027 | H37: =+RC[-6]+#REF!+#REF!+#REF!+#REF!+#REF!+#REF!+#REF!+#REF!+#REF!+#REF!+#REF!+#REF!+#REF!+#REF!+#REF!+#REF!+#REF!+#REF!+#REF!+#REF!+#REF!+#REF!+#REF!+#REF!+#REF!+#REF!+#REF!+#REF!+#REF!+#REF! -> #REF! | I37: =+RC[-6]+#REF!+#REF!+#REF!+#REF!+#REF!+#REF!+#REF!+#REF!+#REF!+#REF!+#REF!+#REF!+#REF!+#REF!+#REF!+#REF!+#REF!+#REF!+#REF!+#REF!+#REF!+#REF!+#REF!+#REF!+#REF!+#REF!+#REF!+#REF!+#REF!+#REF! -> #REF! | J37: =+RC[-6]+#REF!+#REF!+#REF!+#REF!+#REF!+#REF!+#REF!+#REF!+#REF!+#REF!+#REF!+#REF!+#REF!+#REF!+#REF!+#REF!+#REF!+#REF!+#REF!+#REF!+#REF!+#REF!+#REF!+#REF!+#REF!+#REF!+#REF!+#REF!+#REF!+#REF! -> #REF! | K37: =+RC[-1]/RC[-2]-1 -> #REF! | L37: =+RC[-2]/RC[-4]-1 -> #REF! | M37: =+RC[-6]+#REF!+#REF!+#REF!+#REF!+#REF!+#REF!+#REF!+#REF!+#REF!+#REF!+#REF!+#REF!+#REF!+#REF!+#REF!+#REF!+#REF!+#REF!+#REF!+#REF!+#REF!+#REF!+#REF!+#REF!+#REF!+#REF!+#REF!+#REF!+#REF!+#REF! -> #REF!
A38: 02.02.2016 | B38: 49768.103999999999 | C38: 29577.993650793651 | D38: 25748.448199999999 | E38: =+RC[-1]/RC[-2]-1 -> -0.12947279305034587 | F38: =+RC[-2]/RC[-4]-1 -> -0.48263152239032459 | G38: 2829 | H38: =+RC[-6]+#REF!+#REF!+#REF!+#REF!+#REF!+#REF!+#REF!+#REF!+#REF!+#REF!+#REF!+#REF!+#REF!+#REF!+#REF!+#REF!+#REF!+#REF!+#REF!+#REF!+#REF!+#REF!+#REF!+#REF!+#REF!+#REF!+#REF!+#REF!+#REF!+#REF! -> #REF! | I38: =+RC[-6]+#REF!+#REF!+#REF!+#REF!+#REF!+#REF!+#REF!+#REF!+#REF!+#REF!+#REF!+#REF!+#REF!+#REF!+#REF!+#REF!+#REF!+#REF!+#REF!+#REF!+#REF!+#REF!+#REF!+#REF!+#REF!+#REF!+#REF!+#REF!+#REF!+#REF! -> #REF! | J38: =+RC[-6]+#REF!+#REF!+#REF!+#REF!+#REF!+#REF!+#REF!+#REF!+#REF!+#REF!+#REF!+#REF!+#REF!+#REF!+#REF!+#REF!+#REF!+#REF!+#REF!+#REF!+#REF!+#REF!+#REF!+#REF!+#REF!+#REF!+#REF!+#REF!+#REF!+#REF! -> #REF! | K38: =+RC[-1]/RC[-2]-1 -> #REF! | L38: =+RC[-2]/RC[-4]-1 -> #REF! | M38: =+RC[-6]+#REF!+#REF!+#REF!+#REF!+#REF!+#REF!+#REF!+#REF!+#REF!+#REF!+#REF!+#REF!+#REF!+#REF!+#REF!+#REF!+#REF!+#REF!+#REF!+#REF!+#REF!+#REF!+#REF!+#REF!+#REF!+#REF!+#REF!+#REF!+#REF!+#REF! -> #REF!
A39: 03.02.2016 | B39: 47108.491600000001 | C39: 29577.993650793651 | D39: 27694.6826 | E39: =+RC[-1]/RC[-2]-1 -> -6.3672711307892094E-2 | F39: =+RC[-2]/RC[-4]-1 -> -0.41210848279421453 | G39: 2867 | H39: =+RC[-6]+#REF!+#REF!+#REF!+#REF!+#REF!+#REF!+#REF!+#REF!+#REF!+#REF!+#REF!+#REF!+#REF!+#REF!+#REF!+#REF!+#REF!+#REF!+#REF!+#REF!+#REF!+#REF!+#REF!+#REF!+#REF!+#REF!+#REF!+#REF!+#REF!+#REF! -> #REF! | I39: =+RC[-6]+#REF!+#REF!+#REF!+#REF!+#REF!+#REF!+#REF!+#REF!+#REF!+#REF!+#REF!+#REF!+#REF!+#REF!+#REF!+#REF!+#REF!+#REF!+#REF!+#REF!+#REF!+#REF!+#REF!+#REF!+#REF!+#REF!+#REF!+#REF!+#REF!+#REF! -> #REF! | J39: =+RC[-6]+#REF!+#REF!+#REF!+#REF!+#REF!+#REF!+#REF!+#REF!+#REF!+#REF!+#REF!+#REF!+#REF!+#REF!+#REF!+#REF!+#REF!+#REF!+#REF!+#REF!+#REF!+#REF!+#REF!+#REF!+#REF!+#REF!+#REF!+#REF!+#REF!+#REF! -> #REF! | K39: =+RC[-1]/RC[-2]-1 -> #REF! | L39: =+RC[-2]/RC[-4]-1 -> #REF! | M39: =+RC[-6]+#REF!+#REF!+#REF!+#REF!+#REF!+#REF!+#REF!+#REF!+#REF!+#REF!+#REF!+#REF!+#REF!+#REF!+#REF!+#REF!+#REF!+#REF!+#REF!+#REF!+#REF!+#REF!+#REF!+#REF!+#REF!+#REF!+#REF!+#REF!+#REF!+#REF! -> #REF!
A40: 04.02.2016 | B40: 46865.495600000002 | C40: 29577.993650793651 | D40: 23807.6715 | E40: =+RC[-1]/RC[-2]-1 -> -0.19508835585400897 | F40: =+RC[-2]/RC[-4]-1 -> -0.49200000565021229 | G40: 2763 | H40: =+RC[-6]+#REF!+#REF!+#REF!+#REF!+#REF!+#REF!+#REF!+#REF!+#REF!+#REF!+#REF!+#REF!+#REF!+#REF!+#REF!+#REF!+#REF!+#REF!+#REF!+#REF!+#REF!+#REF!+#REF!+#REF!+#REF!+#REF!+#REF!+#REF!+#REF!+#REF! -> #REF! | I40: =+RC[-6]+#REF!+#REF!+#REF!+#REF!+#REF!+#REF!+#REF!+#REF!+#REF!+#REF!+#REF!+#REF!+#REF!+#REF!+#REF!+#REF!+#REF!+#REF!+#REF!+#REF!+#REF!+#REF!+#REF!+#REF!+#REF!+#REF!+#REF!+#REF!+#REF!+#REF! -> #REF! | J40: =+RC[-6]+#REF!+#REF!+#REF!+#REF!+#REF!+#REF!+#REF!+#REF!+#REF!+#REF!+#REF!+#REF!+#REF!+#REF!+#REF!+#REF!+#REF!+#REF!+#REF!+#REF!+#REF!+#REF!+#REF!+#REF!+#REF!+#REF!+#REF!+#REF!+#REF!+#REF! -> #REF! | K40: =+RC[-1]/RC[-2]-1 -> #REF! | L40: =+RC[-2]/RC[-4]-1 -> #REF! | M40: =+RC[-6]+#REF!+#REF!+#REF!+#REF!+#REF!+#REF!+#REF!+#REF!+#REF!+#REF!+#REF!+#REF!+#REF!+#REF!+#REF!+#REF!+#REF!+#REF!+#REF!+#REF!+#REF!+#REF!+#REF!+#REF!+#REF!+#REF!+#REF!+#REF!+#REF!+#REF! -> #REF!
A41: 05.02.2016 | B41: 45615.414100000002 | C41: 30228.057142857142 | D41: 28245.680400000001 | E41: =+RC[-1]/RC[-2]-1 -> -6.5580686627938811E-2 | F41: =+RC[-2]/RC[-4]-1 -> -0.3807864960278855 | G41: 3107 | H41: =+RC[-6]+#REF!+#REF!+#REF!+#REF!+#REF!+#REF!+#REF!+#REF!+#REF!+#REF!+#REF!+#REF!+#REF!+#REF!+#REF!+#REF!+#REF!+#REF!+#REF!+#REF!+#REF!+#REF!+#REF!+#REF!+#REF!+#REF!+#REF!+#REF!+#REF!+#REF! -> #REF! | I41: =+RC[-6]+#REF!+#REF!+#REF!+#REF!+#REF!+#REF!+#REF!+#REF!+#REF!+#REF!+#REF!+#REF!+#REF!+#REF!+#REF!+#REF!+#REF!+#REF!+#REF!+#REF!+#REF!+#REF!+#REF!+#REF!+#REF!+#REF!+#REF!+#REF!+#REF!+#REF! -> #REF! | J41: =+RC[-6]+#REF!+#REF!+#REF!+#REF!+#REF!+#REF!+#REF!+#REF!+#REF!+#REF!+#REF!+#REF!+#REF!+#REF!+#REF!+#REF!+#REF!+#REF!+#REF!+#REF!+#REF!+#REF!+#REF!+#REF!+#REF!+#REF!+#REF!+#REF!+#REF!+#REF! -> #REF! | K41: =+RC[-1]/RC[-2]-1 -> #REF! | L41: =+RC[-2]/RC[-4]-1 -> #REF! | M41: =+RC[-6]+#REF!+#REF!+#REF!+#REF!+#REF!+#REF!+#REF!+#REF!+#REF!+#REF!+#REF!+#REF!+#REF!+#REF!+#REF!+#REF!+#REF!+#REF!+#REF!+#REF!+#REF!+#REF!+#REF!+#REF!+#REF!+#REF!+#REF!+#REF!+#REF!+#REF! -> #REF!
A42: 06.02.2016 | B42: 51552.441500000001 | C42: 35753.615873015871 | D42: 34346.041599999997 | E42: =+RC[-1]/RC[-2]-1 -> -3.9368725054693132E-2 | F42: =+RC[-2]/RC[-4]-1 -> -0.33376498569907698 | G42: 2767 | H42: =+RC[-6]+#REF!+#REF!+#REF!+#REF!+#REF!+#REF!+#REF!+#REF!+#REF!+#REF!+#REF!+#REF!+#REF!+#REF!+#REF!+#REF!+#REF!+#REF!+#REF!+#REF!+#REF!+#REF!+#REF!+#REF!+#REF!+#REF!+#REF!+#REF!+#REF!+#REF! -> #REF! | I42: =+RC[-6]+#REF!+#REF!+#REF!+#REF!+#REF!+#REF!+#REF!+#REF!+#REF!+#REF!+#REF!+#REF!+#REF!+#REF!+#REF!+#REF!+#REF!+#REF!+#REF!+#REF!+#REF!+#REF!+#REF!+#REF!+#REF!+#REF!+#REF!+#REF!+#REF!+#REF! -> #REF! | J42: =+RC[-6]+#REF!+#REF!+#REF!+#REF!+#REF!+#REF!+#REF!+#REF!+#REF!+#REF!+#REF!+#REF!+#REF!+#REF!+#REF!+#REF!+#REF!+#REF!+#REF!+#REF!+#REF!+#REF!+#REF!+#REF!+#REF!+#REF!+#REF!+#REF!+#REF!+#REF! -> #REF! | K42: =+RC[-1]/RC[-2]-1 -> #REF! | L42: =+RC[-2]/RC[-4]-1 -> #REF! | M42: =+RC[-6]+#REF!+#REF!+#REF!+#REF!+#REF!+#REF!+#REF!+#REF!+#REF!+#REF!+#REF!+#REF!+#REF!+#REF!+#REF!+#REF!+#REF!+#REF!+#REF!+#REF!+#REF!+#REF!+#REF!+#REF!+#REF!+#REF!+#REF!+#REF!+#REF!+#REF! -> #REF!
A43: 07.02.2016 | B43: 60978.425499999998 | C43: 32503.288888888888 | D43: 30491.114699999998 | E43: =+RC[-1]/RC[-2]-1 -> -6.1906787210593395E-2 | F43: =+RC[-2]/RC[-4]-1 -> -0.49996880946032296 | G43: 2656 | H43: =+RC[-6]+#REF!+#REF!+#REF!+#REF!+#REF!+#REF!+#REF!+#REF!+#REF!+#REF!+#REF!+#REF!+#REF!+#REF!+#REF!+#REF!+#REF!+#REF!+#REF!+#REF!+#REF!+#REF!+#REF!+#REF!+#REF!+#REF!+#REF!+#REF!+#REF!+#REF! -> #REF! | I43: =+RC[-6]+#REF!+#REF!+#REF!+#REF!+#REF!+#REF!+#REF!+#REF!+#REF!+#REF!+#REF!+#REF!+#REF!+#REF!+#REF!+#REF!+#REF!+#REF!+#REF!+#REF!+#REF!+#REF!+#REF!+#REF!+#REF!+#REF!+#REF!+#REF!+#REF!+#REF! -> #REF! | J43: =+RC[-6]+#REF!+#REF!+#REF!+#REF!+#REF!+#REF!+#REF!+#REF!+#REF!+#REF!+#REF!+#REF!+#REF!+#REF!+#REF!+#REF!+#REF!+#REF!+#REF!+#REF!+#REF!+#REF!+#REF!+#REF!+#REF!+#REF!+#REF!+#REF!+#REF!+#REF! -> #REF! | K43: =+RC[-1]/RC[-2]-1 -> #REF! | L43: =+RC[-2]/RC[-4]-1 -> #REF! | M43: =+RC[-6]+#REF!+#REF!+#REF!+#REF!+#REF!+#REF!+#REF!+#REF!+#REF!+#REF!+#REF!+#REF!+#REF!+#REF!+#REF!+#REF!+#REF!+#REF!+#REF!+#REF!+#REF!+#REF!+#REF!+#REF!+#REF!+#REF!+#REF!+#REF!+#REF!+#REF! -> #REF!
A44: SUBAT | B44: =SUM(R[-7]C:R[-1]C) -> 354317.20640000002 | C44: =SUM(R[-7]C:R[-1]C) -> 219722.23174603176 | D44: =SUM(R[-7]C:R[-1]C) -> 197406.3757 | E44: =+RC[-1]/RC[-2]-1 -> -0.10156394220419973 | F44: =+RC[-2]/RC[-4]-1 -> -0.44285410887683041 | G44: =SUM(R[-7]C:R[-1]C) -> 20016 | H44: =SUM(R[-7]C:R[-1]C) -> #REF! | I44: =SUM(R[-7]C:R[-1]C) -> #REF! | J44: =SUM(R[-7]C:R[-1]C) -> #REF! | K44: =+RC[-1]/RC[-2]-1 -> #REF! | L44: =+RC[-2]/RC[-4]-1 -> #REF! | M44: =SUM(R[-7]C:R[-1]C) -> #REF!
A46: TOPLAM | B46: =R[-10]C+R[-2]C -> 1923268.8704000004 | C46: =R[-10]C+R[-2]C -> 1218893.9777777775 | D46: =R[-10]C+R[-2]C -> 1056388.8701999998 | E46: =RC[-1]/RC[-2]-1 -> -0.13332177411693213 | F46: =RC[-2]/RC[-4]-1 -> -0.45073261130655506 | G46: =R[-10]C+R[-2]C -> 103430 | H46: =R[-10]C+R[-2]C -> #REF! | I46: =R[-10]C+R[-2]C -> #REF! | J46: =R[-10]C+R[-2]C -> #REF! | K46: =RC[-1]/RC[-2]-1 -> #REF! | L46: =RC[-2]/RC[-4]-1 -> #REF! | M46: =R[-10]C+R[-2]C -> #REF!
A49: MAGAZA TOPLAM | B49: OCAK | C49: SUBAT
A50: NET SATIŞ - GEÇEN YIL | B50: 11114543.75895958 | C50: 2509078.3848060025
A51: NET SATIŞ - BÜTÇE | B51: 6475315.7492063493 | C51: 1269854.3523809523
A52: NET SATIS -FİİLİ | B52: 5658487.8748558434 | C52: 1262157.9651493866
A53: Prog.Göre Artış | B53: =+R[-1]C/R[-2]C-1 -> -0.12614487169226007 | C53: =+R[-1]C/R[-2]C-1 -> -6.0608425030281854E-3
A54: G.Yıla Göre Artış | B54: =+R[-2]C/R[-4]C-1 -> -0.49089337380182951 | C54: =+R[-2]C/R[-4]C-1 -> -0.49696351744428491
A55: MUSTERI SAYISI | B55: 1219915 | C55: 285890
A58: TOPTAN SATIS | B58: OCAK | C58: SUBAT
A59: NET SATIŞ - GEÇEN YIL | B59: 49820.835710448591 | C59: 2639.1104443532172
A60: NET SATIŞ - BÜTÇE | B60: 0 | C60: 0
A61: NET SATIS -FİİLİ | B61: 29747.782878598809 | C61: 6836.5208406785086
A62: Prog.Göre Artış | B62: =+R[-1]C/R[-2]C-1 -> #DIV/0! | C62: =+R[-1]C/R[-2]C-1 -> #DIV/0!
A63: G.Yıla Göre Artış | B63: =+R[-2]C/R[-4]C-1 -> -0.40290477960890558 | C63: =+R[-2]C/R[-4]C-1 -> 1.5904640919088084
A66: SIRKET TOPLAM | B66: OCAK | C66: SUBAT
A67: NET SATIŞ - GEÇEN YIL | B67: =R[-17]C+R[-8]C -> 11164364.594670029 | C67: =R[-17]C+R[-8]C -> 2511717.4952503559
A68: NET SATIŞ - BÜTÇE | B68: =R[-17]C+R[-8]C -> 6475315.7492063493 | C68: =R[-17]C+R[-8]C -> 1269854.3523809523
A69: NET SATIS -FİİLİ | B69: =R[-17]C+R[-8]C -> 5688235.6577344425 | C69: =R[-17]C+R[-8]C -> 1268994.4859900651
A70: Prog.Göre Artış | B70: =+R[-1]C/R[-2]C-1 -> -0.12155084353506251 | C70: =+R[-1]C/R[-2]C-1 -> -6.7713780661138312E-4
A71: G.Yıla Göre Artış | B71: =+R[-2]C/R[-4]C-1 -> -0.49050072581380411 | C71: =+R[-2]C/R[-4]C-1 -> -0.49477021663872356
A72: MUSTERI SAYISI | B72: =R[-17]C -> 1219915 | C72: =R[-17]C -> 285890
A75: SIRKET TOPLAM | B75: KUMULE
A76: NET SATIŞ - GEÇEN YIL | B76: =SUM(R[-9]C:R[-9]C[1]) -> 13676082.089920385
A77: NET SATIŞ - BÜTÇE | B77: =SUM(R[-9]C:R[-9]C[1]) -> 7745170.1015873011
A78: NET SATIS -FİİLİ | B78: =SUM(R[-9]C:R[-9]C[1]) -> 6957230.1437245077
A79: Prog.Göre Artış | B79: =+R[-1]C/R[-2]C-1 -> -0.1017330733254409
A80: G.Yıla Göre Artış | B80: =+R[-2]C/R[-4]C-1 -> -0.49128485058947102
A81: MUSTERI SAYISI | B81: =SUM(R[-9]C:R[-9]C[1]) -> 1505805